A1: HB 5003 - J. Morrissey Population Totals
A2: DISTRICT | B2: Total Population | C2: Target | D2: Difference | E2: Deviation
A3: 1 | B3: 79319 | C3: 80010.240000000005 | D3: =B3-C3 -> -691.24000000000524 | E3: -8.6393941575478982E-3
A4: 2 | B4: 83753 | C4: 80010.240000000005 | D4: =B4-C4 -> 3742.7599999999948 | E4: 4.6778512350419077E-2
A5: 3 | B5: 82795 | C5: 80010.240000000005 | D5: =B5-C5 -> 2784.7599999999948 | E5: 3.4805044954245787E-2
A6: 4 | B6: 80912 | C6: 80010.240000000005 | D6: =B6-C6 -> 901.75999999999476 | E6: 1.1270557368656746E-2
A7: 5 | B7: 78872 | C7: 80010.240000000005 | D7: =B7-C7 -> -1138.2400000000052 | E7: -1.4226179049081782E-2
A8: 6 | B8: 78270 | C8: 80010.240000000005 | D8: =B8-C8 -> -1740.2400000000052 | E8: -2.1750215972355602E-2
A9: 7 | B9: 80782 | C9: 80010.240000000005 | D9: =B9-C9 -> 771.75999999999476 | E9: 9.6457653420361535E-3
A10: 8 | B10: 81055 | C10: 80010.240000000005 | D10: =B10-C10 -> 1044.7599999999948 | E10: 1.3057828597939398E-2
A11: 9 | B11: 78880 | C11: 80010.240000000005 | D11: =B11-C11 -> -1130.2400000000052 | E11: -1.4126191847443592E-2
A12: 10 | B12: 81465 | C12: 80010.240000000005 | D12: =B12-C12 -> 1454.7599999999948 | E12: 1.818217268189665E-2
A13: 11 | B13: 76957 | C13: 80010.240000000005 | D13: =B13-C13 -> -3053.2400000000052 | E13: -3.8160615441223587E-2
A14: 12 | B14: 76234 | C14: 80010.240000000005 | D14: =B14-C14 -> -3776.2400000000052 | E14: -4.7196958789275038E-2
A15: 13 | B15: 81966 | C15: 80010.240000000005 | D15: =B15-C15 -> 1955.7599999999948 | E15: 2.4443871184488319E-2
A16: 14 | B16: 80302 | C16: 80010.240000000005 | D16: =B16-C16 -> 291.75999999999476 | E16: 3.6465332437447349E-3
A17: 15 | B17: 79568 | C17: 80010.240000000005 | D17: =B17-C17 -> -442.24000000000524 | E17: -5.5272925065592256E-3
A18: 16 | B18: 78656 | C18: 80010.240000000005 | D18: =B18-C18 -> -1354.2400000000052 | E18: -1.692583349331292E-2
A19: 17 | B19: 76278 | C19: 80010.240000000005 | D19: =B19-C19 -> -3732.2400000000052 | E19: -4.664702918026499E-2
A20: 18 | B20: 81946 | C20: 80010.240000000005 | D20: =B20-C20 -> 1935.7599999999948 | E20: 2.4193903180392842E-2
A21: 19 | B21: 79238 | C21: 80010.240000000005 | D21: =B21-C21 -> -772.24000000000524 | E21: -9.6517645741345751E-3
A22: 20 | B22: 80224 | C22: 80010.240000000005 | D22: =B22-C22 -> 213.75999999999476 | E22: 2.6716580277723794E-3
A23: 21 | B23: 83021 | C23: 80010.240000000005 | D23: =B23-C23 -> 3010.7599999999948 | E23: 3.7629683400524666E-2
A24: 22 | B24: 78286 | C24: 80010.240000000005 | D24: =B24-C24 -> -1724.2400000000052 | E24: -2.1550241569079222E-2
A25: 23 | B25: 81802 | C25: 80010.240000000005 | D25: =B25-C25 -> 1791.7599999999948 | E25: 2.2394133550905419E-2
A26: 24 | B26: 79004 | C26: 80010.240000000005 | D26: =B26-C26 -> -1006.2400000000052 | E26: -1.2576390222051642E-2
A27: 25 | B27: 76552 | C27: 80010.240000000005 | D27: =B27-C27 -> -3458.2400000000052 | E27: -4.3222467524156968E-2
A28: 26 | B28: 81561 | C28: 80010.240000000005 | D28: =B28-C28 -> 1550.7599999999948 | E28: 1.9382019101554935E-2
A29: 27 | B29: 81027 | C29: 80010.240000000005 | D29: =B29-C29 -> 1016.7599999999948 | E29: 1.2707873392205731E-2
A30: 28 | B30: 82383 | C30: 80010.240000000005 | D30: =B30-C30 -> 2372.7599999999948 | E30: 2.9655704069878989E-2
A31: 29 | B31: 79606 | C31: 80010.240000000005 | D31: =B31-C31 -> -404.24000000000524 | E31: -5.0523532987778218E-3
A32: 30 | B32: 82994 | C32: 80010.240000000005 | D32: =B32-C32 -> 2983.7599999999948 | E32: 3.7292226594995773E-2
A33: 31 | B33: 82002 | C33: 80010.240000000005 | D33: =B33-C33 -> 1991.7599999999948 | E33: 2.4893813591860176E-2
A34: 32 | B34: 81668 | C34: 80010.240000000005 | D34: =B34-C34 -> 1657.7599999999948 | E34: 2.071934792346573E-2
A35: 33 | B35: 76518 | C35: 80010.240000000005 | D35: =B35-C35 -> -3492.2400000000052 | E35: -4.3647413131119278E-2
A36: 34 | B36: 81806 | C36: 80010.240000000005 | D36: =B36-C36 -> 1795.7599999999948 | E36: 2.2444127151724513E-2
A37: 35 | B37: 78790 | C37: 80010.240000000005 | D37: =B37-C37 -> -1220.2400000000052 | E37: -1.5251047865873233E-2
A38: 36 | B38: 76153 | C38: 80010.240000000005 | D38: =B38-C38 -> -3857.2400000000052 | E38: -4.8209329205861712E-2
A39: 37 | B39: 76571 | C39: 80010.240000000005 | D39: =B39-C39 -> -3439.2400000000052 | E39: -4.298499792026627E-2
A40: 38 | B40: 78917 | C40: 80010.240000000005 | D40: =B40-C40 -> -1093.2400000000052 | E40: -1.3663751039866962E-2
A41: 39 | B41: 77823 | C41: 80010.240000000005 | D41: =B41-C41 -> -2187.2400000000052 | E41: -2.7337000863889484E-2
A42: 40 | B42: 76622 | C42: 80010.240000000005 | D42: =B42-C42 -> -3388.2400000000052 | E42: -4.2347579509822805E-2
A43: 41 | B43: 78225 | C43: 80010.240000000005 | D43: =B43-C43 -> -1785.2400000000052 | E43: -2.2312643981570422E-2
A44: 42 | B44: 81840 | C44: 80010.240000000005 | D44: =B44-C44 -> 1829.7599999999948 | E44: 2.2869072758686822E-2
A45: 43 | B45: 78088 | C45: 80010.240000000005 | D45: =B45-C45 -> -1922.2400000000052 | E45: -2.4024924809624433E-2
A46: 44 | B46: 79883 | C46: 80010.240000000005 | D46: =B46-C46 -> -127.24000000000524 | E46: -1.5902964420554822E-3
A47: 45 | B47: 78709 | C47: 80010.240000000005 | D47: =B47-C47 -> -1301.2400000000052 | E47: -1.6263418282459908E-2
A48: 46 | B48: 77235 | C48: 80010.240000000005 | D48: =B48-C48 -> -2775.2400000000052 | E48: -3.4686060184296472E-2
A49: 47 | B49: 78184 | C49: 80010.240000000005 | D49: =B49-C49 -> -1826.2400000000052 | E49: -2.2825078389966148E-2
A50: 48 | B50: 83331 | C50: 80010.240000000005 | D50: =B50-C50 -> 3320.7599999999948 | E50: 4.1504187464004541E-2
A51: 49 | B51: 78871 | C51: 80010.240000000005 | D51: =B51-C51 -> -1139.2400000000052 | E51: -1.4238677449286556E-2
A52: 50 | B52: 82586 | C52: 80010.240000000005 | D52: =B52-C52 -> 2575.7599999999948 | E52: 3.2192879311448069E-2
A53: 51 | B53: 83623 | C53: 80010.240000000005 | D53: =B53-C53 -> 3612.7599999999948 | E53: 4.5153720323798482E-2
A54: 52 | B54: 81592 | C54: 80010.240000000005 | D54: =B54-C54 -> 1581.7599999999948 | E54: 1.9769469507902922E-2
A55: 53 | B55: 77965 | C55: 80010.240000000005 | D55: =B55-C55 -> -2045.2400000000052 | E55: -2.5562228034811608E-2
A56: 54 | B56: 82824 | C56: 80010.240000000005 | D56: =B56-C56 -> 2813.7599999999948 | E56: 3.5167498560184231E-2
A57: 55 | B57: 79012 | C57: 80010.240000000005 | D57: =B57-C57 -> -998.24000000000524 | E57: -1.2476403020413451E-2
A58: 56 | B58: 81210 | C58: 80010.240000000005 | D58: =B58-C58 -> 1199.7599999999948 | E58: 1.4995080629679334E-2
A59: 57 | B59: 76557 | C59: 80010.240000000005 | D59: =B59-C59 -> -3453.2400000000052 | E59: -4.3159975523133103E-2
A60: 58 | B60: 77164 | C60: 80010.240000000005 | D60: =B60-C60 -> -2846.2400000000052 | E60: -3.5573446598835413E-2
A61: 59 | B61: 82463 | C61: 80010.240000000005 | D61: =B61-C61 -> 2452.7599999999948 | E61: 3.0655576086260891E-2
A62: 60 | B62: 79918 | C62: 80010.240000000005 | D62: =B62-C62 -> -92.240000000005239 | E62: -1.1528524348883996E-3
A63: 61 | B63: 82728 | C63: 80010.240000000005 | D63: =B63-C63 -> 2717.7599999999948 | E63: 3.3967652140525946E-2
A64: 62 | B64: 80391 | C64: 80010.240000000005 | D64: =B64-C64 -> 380.75999999999476 | E64: 4.7588908619696025E-3
A65: 63 | B65: 79996 | C65: 80010.240000000005 | D65: =B65-C65 -> -14.240000000005239 | E65: -1.7797721891604421E-4
A66: 64 | B66: 80520 | C66: 80010.240000000005 | D66: =B66-C66 -> 509.75999999999476 | E66: 6.3711844883854209E-3
A67: 65 | B67: 83186 | C67: 80010.240000000005 | D67: =B67-C67 -> 3175.7599999999948 | E67: 3.9691919434312342E-2
A68: 66 | B68: 82585 | C68: 80010.240000000005 | D68: =B68-C68 -> 2574.7599999999948 | E68: 3.2180380911243291E-2
A69: 67 | B69: 77656 | C69: 80010.240000000005 | D69: =B69-C69 -> -2354.2400000000052 | E69: -2.9424233698086708E-2
A70: 68 | B70: 81345 | C70: 80010.240000000005 | D70: =B70-C70 -> 1334.7599999999948 | E70: 1.6682364657323798E-2
A71: 69 | B71: 77534 | C71: 80010.240000000005 | D71: =B71-C71 -> -2476.2400000000052 | E71: -3.094903852306911E-2
A72: 70 | B72: 79380 | C72: 80010.240000000005 | D72: =B72-C72 -> -630.24000000000524 | E72: -7.8769917450566985E-3
A73: 71 | B73: 76707 | C73: 80010.240000000005 | D73: =B73-C73 -> -3303.2400000000052 | E73: -4.1285215492417031E-2
A74: 72 | B74: 83135 | C74: 80010.240000000005 | D74: =B74-C74 -> 3124.7599999999948 | E74: 3.9054501023868878E-2
A75: 73 | B75: 81362 | C75: 80010.240000000005 | D75: =B75-C75 -> 1351.7599999999948 | E75: 1.6894837460804949E-2
A76: 74 | B76: 81120 | C76: 80010.240000000005 | D76: =B76-C76 -> 1109.7599999999948 | E76: 1.3870224611249694E-2
A77: 75 | B77: 77121 | C77: 80010.240000000005 | D77: =B77-C77 -> -2889.2400000000052 | E77: -3.6110877807640683E-2
A78: 76 | B78: 79435 | C78: 80010.240000000005 | D78: =B78-C78 -> -575.24000000000524 | E78: -7.1895797337941398E-3
A79: 77 | B79: 79765 | C79: 80010.240000000005 | D79: =B79-C79 -> -245.24000000000524 | E79: -3.0651076662187894E-3
A80: 78 | B80: 78523 | C80: 80010.240000000005 | D80: =B80-C80 -> -1487.2400000000052 | E80: -1.8588120720547833E-2
A81: 79 | B81: 78149 | C81: 80010.240000000005 | D81: =B81-C81 -> -1861.2400000000052 | E81: -2.326252239713323E-2
A82: 80 | B82: 80239 | C82: 80010.240000000005 | D82: =B82-C82 -> 228.75999999999476 | E82: 2.8591340308439864E-3
A83: 81 | B83: 83069 | C83: 80010.240000000005 | D83: =B83-C83 -> 3058.7599999999948 | E83: 3.8229606610353808E-2
A84: 82 | B84: 80363 | C84: 80010.240000000005 | D84: =B84-C84 -> 352.75999999999476 | E84: 4.4089356562359364E-3
A85: 83 | B85: 83149 | C85: 80010.240000000005 | D85: =B85-C85 -> 3138.7599999999948 | E85: 3.922947862673571E-2
A86: 84 | B86: 82041 | C86: 80010.240000000005 | D86: =B86-C86 -> 2030.7599999999948 | E86: 2.5381251199846352E-2
A87: 85 | B87: 83127 | C87: 80010.240000000005 | D87: =B87-C87 -> 3116.7599999999948 | E87: 3.8954513822230689E-2
A88: 86 | B88: 80356 | C88: 80010.240000000005 | D88: =B88-C88 -> 345.75999999999476 | E88: 4.3214468548025192E-3
A89: 87 | B89: 82923 | C89: 80010.240000000005 | D89: =B89-C89 -> 2912.7599999999948 | E89: 3.6404840180456831E-2
A90: 88 | B90: 81877 | C90: 80010.240000000005 | D90: =B90-C90 -> 1866.7599999999948 | E90: 2.3331513566263451E-2
A91: 89 | B91: 81392 | C91: 80010.240000000005 | D91: =B91-C91 -> 1381.7599999999948 | E91: 1.7269789466948165E-2
A92: 90 | B92: 79518 | C92: 80010.240000000005 | D92: =B92-C92 -> -492.24000000000524 | E92: -6.152212516797915E-3
A93: 91 | B93: 76459 | C93: 80010.240000000005 | D93: =B93-C93 -> -3551.2400000000052 | E93: -4.4384818743200931E-2
A94: 92 | B94: 78747 | C94: 80010.240000000005 | D94: =B94-C94 -> -1263.2400000000052 | E94: -1.5788479074678504E-2
A95: 93 | B95: 78365 | C95: 80010.240000000005 | D95: =B95-C95 -> -1645.2400000000052 | E95: -2.0562867952902093E-2
A96: 94 | B96: 82137 | C96: 80010.240000000005 | D96: =B96-C96 -> 2126.7599999999948 | E96: 2.6581097619504637E-2
A97: 95 | B97: 79044 | C97: 80010.240000000005 | D97: =B97-C97 -> -966.24000000000524 | E97: -1.207645421386069E-2
A98: 96 | B98: 79796 | C98: 80010.240000000005 | D98: =B98-C98 -> -214.24000000000524 | E98: -2.6776572598708019E-3
A99: 97 | B99: 83233 | C99: 80010.240000000005 | D99: =B99-C99 -> 3222.7599999999948 | E99: 4.0279344243936706E-2
A100: 98 | B100: 79629 | C100: 80010.240000000005 | D100: =B100-C100 -> -381.24000000000524 | E100: -4.7648900940680241E-3
A101: 99 | B101: 78078 | C101: 80010.240000000005 | D101: =B101-C101 -> -1932.2400000000052 | E101: -2.4149908811672168E-2
A102: 100 | B102: 76986 | C102: 80010.240000000005 | D102: =B102-C102 -> -3024.2400000000052 | E102: -3.7798161835285143E-2

A1: HB 5003 - J. Morrissey Racial Demographics
A2: DISTRICT | B2: Total Population | C2: White | D2: % White | E2: Black | F2: % Black | G2: AIAN | H2: % AIAN | I2: Asian | J2: % Asian | K2: HawPI | L2: % HawPI | M2: Other | N2: % Other | O2: Multi | P2: % Multi | Q2: Total Hispanic | R2: % Hispanic
A3: 1 | B3: 79319 | C3: 74911 | D3: =C3/B3 -> 0.94442693427804181 | E3: 3058 | F3: =E3/B3 -> 3.8553183978617983E-2 | G3: 460 | H3: =G3/B3 -> 5.7993671125455438E-3 | I3: 325 | J3: =I3/B3 -> 4.0973789382115254E-3 | K3: 36 | L3: =K3/B3 -> 4.5386351315573821E-4 | M3: 437 | N3: =M3/B3 -> 5.5093987569182663E-3 | O3: 92 | P3: =O3/B3 -> 1.1598734225091087E-3 | Q3: 1013 | R3: =Q3/B3 -> 1.2771214967410079E-2
A4: 2 | B4: 83753 | C4: 81205 | D4: =C4/B4 -> 0.96957720917459678 | E4: 1655 | F4: =E4/B4 -> 1.9760486191539407E-2 | G4: 320 | H4: =G4/B4 -> 3.8207586593913055E-3 | I4: 231 | J4: =I4/B4 -> 2.7581101572480985E-3 | K4: 13 | L4: =K4/B4 -> 1.5521832053777177E-4 | M4: 277 | N4: =M4/B4 -> 3.3073442145355987E-3 | O4: 52 | P4: =O4/B4 -> 6.2087328215108708E-4 | Q4: 622 | R4: =Q4/B4 -> 7.4265996441918499E-3
A5: 3 | B5: 82795 | C5: 77833 | D5: =C5/B5 -> 0.94006884473700103 | E5: 2555 | F5: =E5/B5 -> 3.0859351410109308E-2 | G5: 378 | H5: =G5/B5 -> 4.5654930853312398E-3 | I5: 1558 | J5: =I5/B5 -> 1.8817561446947278E-2 | K5: 29 | L5: =K5/B5 -> 3.5026269702276709E-4 | M5: 332 | N5: =M5/B5 -> 4.0099039797089195E-3 | O5: 110 | P5: =O5/B5 -> 1.3285826438794613E-3 | Q5: 922 | R5: =Q5/B5 -> 1.113593816051694E-2
A6: 4 | B6: 80912 | C6: 77394 | D6: =C6/B6 -> 0.95652066442554873 | E6: 2079 | F6: =E6/B6 -> 2.5694581767846548E-2 | G6: 377 | H6: =G6/B6 -> 4.6593830334190232E-3 | I6: 416 | J6: =I6/B6 -> 5.1413881748071976E-3 | K6: 30 | L6: =K6/B6 -> 3.707731856832114E-4 | M6: 525 | N6: =M6/B6 -> 6.4885307494561995E-3 | O6: 91 | P6: =O6/B6 -> 1.1246786632390746E-3 | Q6: 1136 | R6: =Q6/B6 -> 1.4039944631204272E-2
A7: 5 | B7: 78872 | C7: 74410 | D7: =C7/B7 -> 0.94342732528654016 | E7: 2525 | F7: =E7/B7 -> 3.2013895932650367E-2 | G7: 388 | H7: =G7/B7 -> 4.9193630185617203E-3 | I7: 316 | J7: =I7/B7 -> 4.0064915305811945E-3 | K7: 20 | L7: =K7/B7 -> 2.5357541332792372E-4 | M7: 1082 | N7: =M7/B7 -> 1.3718429861040674E-2 | O7: 131 | P7: =O7/B7 -> 1.6609189572979004E-3 | Q7: 2217 | R7: =Q7/B7 -> 2.8108834567400345E-2
A8: 6 | B8: 78270 | C8: 72836 | D8: =C8/B8 -> 0.93057365529577107 | E8: 3695 | F8: =E8/B8 -> 4.7208381244410375E-2 | G8: 392 | H8: =G8/B8 -> 5.0083045866871085E-3 | I8: 607 | J8: =I8/B8 -> 7.7552063370384568E-3 | K8: 29 | L8: =K8/B8 -> 3.7051232911715853E-4 | M8: 578 | N8: =M8/B8 -> 7.384694007921298E-3 | O8: 133 | P8: =O8/B8 -> 1.6992461990545547E-3 | Q8: 1397 | R8: =Q8/B8 -> 1.7848473233678292E-2
A9: 7 | B9: 80782 | C9: 70915 | D9: =C9/B9 -> 0.87785645317026073 | E9: 3710 | F9: =E9/B9 -> 4.592607263994454E-2 | G9: 436 | H9: =G9/B9 -> 5.3972419598425393E-3 | I9: 4695 | J9: =I9/B9 -> 5.8119383030873217E-2 | K9: 54 | L9: =K9/B9 -> 6.6846574731994749E-4 | M9: 720 | N9: =M9/B9 -> 8.9128766309326327E-3 | O9: 252 | P9: =O9/B9 -> 3.1195068208264218E-3 | Q9: 2158 | R9: =Q9/B9 -> 2.6713871902156423E-2
A10: 8 | B10: 81055 | C10: 72508 | D10: =C10/B10 -> 0.89455308124113253 | E10: 4824 | F10: =E10/B10 -> 5.9515144037998888E-2 | G10: 393 | H10: =G10/B10 -> 4.8485596200111038E-3 | I10: 2414 | J10: =I10/B10 -> 2.9782246622663624E-2 | K10: 38 | L10: =K10/B10 -> 4.6881746961939422E-4 | M10: 687 | N10: =M10/B10 -> 8.4757263586453645E-3 | O10: 191 | P10: =O10/B10 -> 2.3564246499290604E-3 | Q10: 1725 | R10: =Q10/B10 -> 2.1281845660354081E-2
A11: 9 | B11: 78880 | C11: 70162 | D11: =C11/B11 -> 0.88947768762677482 | E11: 6715 | F11: =E11/B11 -> 8.5129310344827583E-2 | G11: 437 | H11: =G11/B11 -> 5.540060851926978E-3 | I11: 408 | J11: =I11/B11 -> 5.1724137931034482E-3 | K11: 31 | L11: =K11/B11 -> 3.9300202839756592E-4 | M11: 1041 | N11: =M11/B11 -> 1.3197261663286004E-2 | O11: 86 | P11: =O11/B11 -> 1.09026369168357E-3 | Q11: 1985 | R11: =Q11/B11 -> 2.5164807302231237E-2
A12: 10 | B12: 81465 | C12: 60308 | D12: =C12/B12 -> 0.74029337752409008 | E12: 18059 | F12: =E12/B12 -> 0.22167802123611366 | G12: 374 | H12: =G12/B12 -> 4.5909286196526115E-3 | I12: 460 | J12: =I12/B12 -> 5.6465966979684524E-3 | K12: 15 | L12: =K12/B12 -> 1.8412815319462345E-4 | M12: 2063 | N12: =M12/B12 -> 2.5323758669367213E-2 | O12: 186 | P12: =O12/B12 -> 2.2831890996133307E-3 | Q12: 3129 | R12: =Q12/B12 -> 3.8409132756398456E-2
A13: 11 | B13: 76957 | C13: 44486 | D13: =C13/B13 -> 0.57806307418428471 | E13: 27572 | F13: =E13/B13 -> 0.35827799940226362 | G13: 434 | H13: =G13/B13 -> 5.639512974778123E-3 | I13: 1592 | J13: =I13/B13 -> 2.0686877087204542E-2 | K13: 57 | L13: =K13/B13 -> 7.4067336304689633E-4 | M13: 2289 | N13: =M13/B13 -> 2.97438829476201E-2 | O13: 527 | P13: =O13/B13 -> 6.8479800408020059E-3 | Q13: 4799 | R13: =Q13/B13 -> 6.2359499460737815E-2
A14: 12 | B14: 76234 | C14: 71019 | D14: =C14/B14 -> 0.93159220295406253 | E14: 3953 | F14: =E14/B14 -> 5.1853503686019362E-2 | G14: 411 | H14: =G14/B14 -> 5.391295222604087E-3 | I14: 407 | J14: =I14/B14 -> 5.3388251961067239E-3 | K14: 33 | L14: =K14/B14 -> 4.3287771860324789E-4 | M14: 310 | N14: =M14/B14 -> 4.0664270535456619E-3 | O14: 101 | P14: =O14/B14 -> 1.3248681690584253E-3 | Q14: 951 | R14: =Q14/B14 -> 1.2474748799748143E-2
A15: 13 | B15: 81966 | C15: 49400 | D15: =C15/B15 -> 0.60268891979601302 | E15: 6462 | F15: =E15/B15 -> 7.8837566795988578E-2 | G15: 400 | H15: =G15/B15 -> 4.8800722250689314E-3 | I15: 22804 | J15: =I15/B15 -> 0.27821291755117977 | K15: 79 | L15: =K15/B15 -> 9.6381426445111391E-4 | M15: 2090 | N15: =M15/B15 -> 2.5498377375985166E-2 | O15: 731 | P15: =O15/B15 -> 8.9183319913134721E-3 | Q15: 6354 | R15: =Q15/B15 -> 7.7519947295219965E-2
A16: 14 | B16: 80302 | C16: 48637 | D16: =C16/B16 -> 0.60567607282508529 | E16: 29077 | F16: =E16/B16 -> 0.36209558915095513 | G16: 342 | H16: =G16/B16 -> 4.2589225673084104E-3 | I16: 625 | J16: =I16/B16 -> 7.7831187268063064E-3 | K16: 32 | L16: =K16/B16 -> 3.9849567881248285E-4 | M16: 1340 | N16: =M16/B16 -> 1.6687006550272721E-2 | O16: 249 | P16: =O16/B16 -> 3.1007945007596326E-3 | Q16: 2418 | R16: =Q16/B16 -> 3.0111329730268237E-2
A17: 15 | B17: 79568 | C17: 73214 | D17: =C17/B17 -> 0.92014377639251965 | E17: 2992 | F17: =E17/B17 -> 3.7603056505127692E-2 | G17: 647 | H17: =G17/B17 -> 8.1314096119042834E-3 | I17: 771 | J17: =I17/B17 -> 9.689825055298612E-3 | K17: 32 | L17: =K17/B17 -> 4.0217172732756888E-4 | M17: 1713 | N17: =M17/B17 -> 2.1528755278503921E-2 | O17: 199 | P17: =O17/B17 -> 2.5010054293183189E-3 | Q17: 3895 | R17: =Q17/B17 -> 4.8951839935652525E-2
A18: 16 | B18: 78656 | C18: 61962 | D18: =C18/B18 -> 0.78775935720097645 | E18: 14688 | F18: =E18/B18 -> 0.18673718470301057 | G18: 461 | H18: =G18/B18 -> 5.8609641985353945E-3 | I18: 688 | J18: =I18/B18 -> 8.746948738812042E-3 | K18: 28 | L18: =K18/B18 -> 3.5598047192839707E-4 | M18: 627 | N18: =M18/B18 -> 7.9714198535394635E-3 | O18: 202 | P18: =O18/B18 -> 2.5681448331977218E-3 | Q18: 1340 | R18: =Q18/B18 -> 1.7036208299430432E-2
A19: 17 | B19: 76278 | C19: 69554 | D19: =C19/B19 -> 0.9118487637326621 | E19: 4273 | F19: =E19/B19 -> 5.601877343401767E-2 | G19: 403 | H19: =G19/B19 -> 5.2833058024594247E-3 | I19: 1303 | J19: =I19/B19 -> 1.7082251763286923E-2 | K19: 42 | L19: =K19/B19 -> 5.5061747817194994E-4 | M19: 578 | N19: =M19/B19 -> 7.5775452948425494E-3 | O19: 125 | P19: =O19/B19 -> 1.6387424945593749E-3 | Q19: 1613 | R19: =Q19/B19 -> 2.1146333149794173E-2
A20: 18 | B20: 81946 | C20: 66078 | D20: =C20/B20 -> 0.8063602860420277 | E20: 7995 | F20: =E20/B20 -> 9.7564249627803676E-2 | G20: 559 | H20: =G20/B20 -> 6.8215654211309885E-3 | I20: 4477 | J20: =I20/B20 -> 5.4633539159934588E-2 | K20: 92 | L20: =K20/B20 -> 1.1226905523149392E-3 | M20: 2369 | N20: =M20/B20 -> 2.8909281722109683E-2 | O20: 376 | P20: =O20/B20 -> 4.5883874746784469E-3 | Q20: 6051 | R20: =Q20/B20 -> 7.3841310131061919E-2
A21: 19 | B21: 79238 | C21: 71437 | D21: =C21/B21 -> 0.90154976147807875 | E21: 5837 | F21: =E21/B21 -> 7.3664151038643072E-2 | G21: 520 | H21: =G21/B21 -> 6.5625078876296724E-3 | I21: 903 | J21: =I21/B21 -> 1.1396047351018452E-2 | K21: 24 | L21: =K21/B21 -> 3.0288497942906179E-4 | M21: 404 | N21: =M21/B21 -> 5.0985638203892075E-3 | O21: 113 | P21: =O21/B21 -> 1.4260834448118326E-3 | Q21: 1260 | R21: =Q21/B21 -> 1.5901461420025746E-2
A22: 20 | B22: 80224 | C22: 71321 | D22: =C22/B22 -> 0.88902323494216196 | E22: 5309 | F22: =E22/B22 -> 6.6177203829278025E-2 | G22: 360 | H22: =G22/B22 -> 4.487435181491823E-3 | I22: 1325 | J22: =I22/B22 -> 1.651625448743518E-2 | K22: 41 | L22: =K22/B22 -> 5.1106900678101321E-4 | M22: 1660 | N22: =M22/B22 -> 2.069206222576785E-2 | O22: 208 | P22: =O22/B22 -> 2.5927403270841645E-3 | Q22: 3422 | R22: =Q22/B22 -> 4.265556441962505E-2
A23: 21 | B23: 83021 | C23: 58292 | D23: =C23/B23 -> 0.70213560424470922 | E23: 16651 | F23: =E23/B23 -> 0.20056371279555776 | G23: 779 | H23: =G23/B23 -> 9.3831681140916154E-3 | I23: 3023 | J23: =I23/B23 -> 3.6412473952373493E-2 | K23: 144 | L23: =K23/B23 -> 1.734500909408463E-3 | M23: 3291 | N23: =M23/B23 -> 3.9640572867105914E-2 | O23: 841 | P23: =O23/B23 -> 1.0129967116753593E-2 | Q23: 8325 | R23: =Q23/B23 -> 0.10027583382517677
A24: 22 | B24: 78286 | C24: 51831 | D24: =C24/B24 -> 0.66207240119561606 | E24: 7031 | F24: =E24/B24 -> 8.9811716015634979E-2 | G24: 354 | H24: =G24/B24 -> 4.5218813070025295E-3 | I24: 13218 | J24: =I24/B24 -> 0.16884244948011137 | K24: 98 | L24: =K24/B24 -> 1.2518202488312087E-3 | M24: 5025 | N24: =M24/B24 -> 6.4187721942620651E-2 | O24: 729 | P24: =O24/B24 -> 9.3120098101831753E-3 | Q24: 11171 | R24: =Q24/B24 -> 0.14269473469074931
A25: 23 | B25: 81802 | C25: 53389 | D25: =C25/B25 -> 0.65266130412459356 | E25: 24171 | F25: =E25/B25 -> 0.2954817730617833 | G25: 505 | H25: =G25/B25 -> 6.1734431920979927E-3 | I25: 2073 | J25: =I25/B25 -> 2.5341678687562652E-2 | K25: 56 | L25: =K25/B25 -> 6.8457983912373777E-4 | M25: 1133 | N25: =M25/B25 -> 1.3850517102271339E-2 | O25: 475 | P25: =O25/B25 -> 5.8067039925674187E-3 | Q25: 2400 | R25: =Q25/B25 -> 2.9339135962445907E-2
A26: 24 | B26: 79004 | C26: 67647 | D26: =C26/B26 -> 0.85624778492228237 | E26: 9023 | F26: =E26/B26 -> 0.1142094071186269 | G26: 795 | H26: =G26/B26 -> 1.0062781631309806E-2 | I26: 641 | J26: =I26/B26 -> 8.1135132398359577E-3 | K26: 58 | L26: =K26/B26 -> 7.3414004354209917E-4 | M26: 611 | N26: =M26/B26 -> 7.7337856311072853E-3 | O26: 229 | P26: =O26/B26 -> 2.8985874132955295E-3 | Q26: 1661 | R26: =Q26/B26 -> 2.1024251936610804E-2
A27: 25 | B27: 76552 | C27: 70170 | D27: =C27/B27 -> 0.91663183195736231 | E27: 4169 | F27: =E27/B27 -> 5.4459713658689519E-2 | G27: 429 | H27: =G27/B27 -> 5.6040338593374437E-3 | I27: 648 | J27: =I27/B27 -> 8.4648343609572581E-3 | K27: 38 | L27: =K27/B27 -> 4.9639460758699964E-4 | M27: 930 | N27: =M27/B27 -> 1.214860486989236E-2 | O27: 168 | P27: =O27/B27 -> 2.1945866861741038E-3 | Q27: 2052 | R27: =Q27/B27 -> 2.6805308809697982E-2
A28: 26 | B28: 81561 | C28: 69950 | D28: =C28/B28 -> 0.85764029376785478 | E28: 3667 | F28: =E28/B28 -> 4.4960213827687251E-2 | G28: 527 | H28: =G28/B28 -> 6.4614215127328008E-3 | I28: 1763 | J28: =I28/B28 -> 2.1615723201039713E-2 | K28: 66 | L28: =K28/B28 -> 8.0921028432706806E-4 | M28: 5299 | N28: =M28/B28 -> 6.4969777221956571E-2 | O28: 289 | P28: =O28/B28 -> 3.5433601844018585E-3 | Q28: 9241 | R28: =Q28/B28 -> 0.11330170056767327
A29: 27 | B29: 81027 | C29: 47956 | D29: =C29/B29 -> 0.59185209868315503 | E29: 24318 | F29: =E29/B29 -> 0.30012218149505721 | G29: 689 | H29: =G29/B29 -> 8.503338393375047E-3 | I29: 2783 | J29: =I29/B29 -> 3.4346575832747112E-2 | K29: 96 | L29: =K29/B29 -> 1.1847902551001517E-3 | M29: 4461 | N29: =M29/B29 -> 5.5055722166685181E-2 | O29: 724 | P29: =O29/B29 -> 8.9352931738803116E-3 | Q29: 7658 | R29: =Q29/B29 -> 9.4511705974551691E-2
A30: 28 | B30: 82383 | C30: 57860 | D30: =C30/B30 -> 0.70232936406782953 | E30: 16313 | F30: =E30/B30 -> 0.1980141534054356 | G30: 639 | H30: =G30/B30 -> 7.7564546083536655E-3 | I30: 2663 | J30: =I30/B30 -> 3.2324630081448841E-2 | K30: 140 | L30: =K30/B30 -> 1.6993797263998641E-3 | M30: 4027 | N30: =M30/B30 -> 4.8881443987230377E-2 | O30: 741 | P30: =O30/B30 -> 8.9945741233021376E-3 | Q30: 7962 | R30: =Q30/B30 -> 9.6646152725683693E-2
A31: 29 | B31: 79606 | C31: 67922 | D31: =C31/B31 -> 0.85322714368263697 | E31: 5593 | F31: =E31/B31 -> 7.0258523226892439E-2 | G31: 508 | H31: =G31/B31 -> 6.3814285355375221E-3 | I31: 1331 | J31: =I31/B31 -> 1.6719845237796144E-2 | K31: 43 | L31: =K31/B31 -> 5.4016028942542019E-4 | M31: 3935 | N31: =M31/B31 -> 4.943094741602392E-2 | O31: 274 | P31: =O31/B31 -> 3.4419516116875612E-3 | Q31: 7070 | R31: =Q31/B31 -> 8.8812401075295838E-2
A32: 30 | B32: 82994 | C32: 65151 | D32: =C32/B32 -> 0.78500855483528931 | E32: 12698 | F32: =E32/B32 -> 0.15299901197676941 | G32: 624 | H32: =G32/B32 -> 7.5186158035520636E-3 | I32: 1211 | J32: =I32/B32 -> 1.4591416246957612E-2 | K32: 77 | L32: =K32/B32 -> 9.2777791165626433E-4 | M32: 2868 | N32: =M32/B32 -> 3.4556714943248912E-2 | O32: 365 | P32: =O32/B32 -> 4.3979082825264474E-3 | Q32: 5407 | R32: =Q32/B32 -> 6.5149287900330144E-2
A33: 31 | B33: 82002 | C33: 45846 | D33: =C33/B33 -> 0.55908392478232238 | E33: 20132 | F33: =E33/B33 -> 0.24550620716567889 | G33: 879 | H33: =G33/B33 -> 1.0719250749981708E-2 | I33: 6495 | J33: =I33/B33 -> 7.9205385234506473E-2 | K33: 213 | L33: =K33/B33 -> 2.5974976220092191E-3 | M33: 7322 | N33: =M33/B33 -> 8.9290505109631477E-2 | O33: 1115 | P33: =O33/B33 -> 1.3597229335869857E-2 | Q33: 16363 | R33: =Q33/B33 -> 0.19954391356308382
A34: 32 | B34: 81668 | C34: 60840 | D34: =C34/B34 -> 0.74496742910319835 | E34: 7014 | F34: =E34/B34 -> 8.588431209286379E-2 | G34: 508 | H34: =G34/B34 -> 6.2203066072390656E-3 | I34: 8407 | J34: =I34/B34 -> 0.10294117647058823 | K34: 66 | L34: =K34/B34 -> 8.0815007101924863E-4 | M34: 4185 | N34: =M34/B34 -> 5.1244061321447813E-2 | O34: 648 | P34: =O34/B34 -> 7.9345643336435328E-3 | Q34: 9891 | R34: =Q34/B34 -> 0.12111230837047558
A35: 33 | B35: 76518 | C35: 67735 | D35: =C35/B35 -> 0.88521655035416502 | E35: 4193 | F35: =E35/B35 -> 5.47975639718759E-2 | G35: 438 | H35: =G35/B35 -> 5.7241433388222377E-3 | I35: 1953 | J35: =I35/B35 -> 2.5523406257351212E-2 | K35: 67 | L35: =K35/B35 -> 8.7561096735408667E-4 | M35: 1824 | N35: =M35/B35 -> 2.3837528424684389E-2 | O35: 308 | P35: =O35/B35 -> 4.0251966857471448E-3 | Q35: 4563 | R35: =Q35/B35 -> 5.9633027522935783E-2
A36: 34 | B36: 81806 | C36: 61858 | D36: =C36/B36 -> 0.75615480527100698 | E36: 2774 | F36: =E36/B36 -> 3.3909493191208472E-2 | G36: 300 | H36: =G36/B36 -> 3.6672126738870009E-3 | I36: 15236 | J36: =I36/B36 -> 0.18624550766447448 | K36: 72 | L36: =K36/B36 -> 8.8013104173288021E-4 | M36: 1137 | N36: =M36/B36 -> 1.3898736034031734E-2 | O36: 429 | P36: =O36/B36 -> 5.244114123658411E-3 | Q36: 4573 | R36: =Q36/B36 -> 5.5900545192284185E-2
A37: 35 | B37: 78790 | C37: 57527 | D37: =C37/B37 -> 0.730130727249651 | E37: 3475 | F37: =E37/B37 -> 4.410458179972078E-2 | G37: 347 | H37: =G37/B37 -> 4.4041121969793122E-3 | I37: 14814 | J37: =I37/B37 -> 0.18801878410965858 | K37: 55 | L37: =K37/B37 -> 6.9805812920421372E-4 | M37: 2103 | N37: =M37/B37 -> 2.6691204467572026E-2 | O37: 469 | P37: =O37/B37 -> 5.9525320472141137E-3 | Q37: 6161 | R37: =Q37/B37 -> 7.8195202436857472E-2
A38: 36 | B38: 76153 | C38: 54596 | D38: =C38/B38 -> 0.71692513755203335 | E38: 6693 | F38: =E38/B38 -> 8.788885533071579E-2 | G38: 428 | H38: =G38/B38 -> 5.6202644675849931E-3 | I38: 10447 | J38: =I38/B38 -> 0.13718435255341221 | K38: 55 | L38: =K38/B38 -> 7.2223024700274446E-4 | M38: 3404 | N38: =M38/B38 -> 4.4699486559951679E-2 | O38: 530 | P38: =O38/B38 -> 6.9596732892991744E-3 | Q38: 8309 | R38: =Q38/B38 -> 0.10910929313356008
A39: 37 | B39: 76571 | C39: 50490 | D39: =C39/B39 -> 0.65938801896279275 | E39: 5223 | F39: =E39/B39 -> 6.8211202674641841E-2 | G39: 520 | H39: =G39/B39 -> 6.7910827859111152E-3 | I39: 15657 | J39: =I39/B39 -> 0.20447689072886602 | K39: 93 | L39: =K39/B39 -> 1.2145590367110264E-3 | M39: 4041 | N39: =M39/B39 -> 5.2774549111282341E-2 | O39: 547 | P39: =O39/B39 -> 7.1436966997949613E-3 | Q39: 10306 | R39: =Q39/B39 -> 0.13459403690692298
A40: 38 | B40: 78917 | C40: 45001 | D40: =C40/B40 -> 0.57023201591545547 | E40: 8259 | F40: =E40/B40 -> 0.10465425700419428 | G40: 652 | H40: =G40/B40 -> 8.2618447229367564E-3 | I40: 14012 | J40: =I40/B40 -> 0.17755363229722368 | K40: 85 | L40: =K40/B40 -> 1.0770809838184421E-3 | M40: 10209 | N40: =M40/B40 -> 0.12936376192708796 | O40: 699 | P40: =O40/B40 -> 8.8574071492834236E-3 | Q40: 21184 | R40: =Q40/B40 -> 0.268433924249528
A41: 39 | B41: 77823 | C41: 43492 | D41: =C41/B41 -> 0.5588579211801139 | E41: 5424 | F41: =E41/B41 -> 6.9696619251378128E-2 | G41: 591 | H41: =G41/B41 -> 7.5941559693149842E-3 | I41: 18770 | J41: =I41/B41 -> 0.24118833763797334 | K41: 88 | L41: =K41/B41 -> 1.1307711087981702E-3 | M41: 8787 | N41: =M41/B41 -> 0.11291006514783547 | O41: 671 | P41: =O41/B41 -> 8.6221297045860484E-3 | Q41: 18112 | R41: =Q41/B41 -> 0.23273325366536884
A42: 40 | B42: 76622 | C42: 46805 | D42: =C42/B42 -> 0.61085588995327711 | E42: 5459 | F42: =E42/B42 -> 7.1245856281485734E-2 | G42: 365 | H42: =G42/B42 -> 4.7636449061627213E-3 | I42: 19788 | J42: =I42/B42 -> 0.25825480932369294 | K42: 111 | L42: =K42/B42 -> 1.4486700947508549E-3 | M42: 3447 | N42: =M42/B42 -> 4.4987079428884656E-2 | O42: 647 | P42: =O42/B42 -> 8.4440500117459738E-3 | Q42: 8564 | R42: =Q42/B42 -> 0.11176946568870559
A43: 41 | B43: 78225 | C43: 54576 | D43: =C43/B43 -> 0.69767976989453495 | E43: 5230 | F43: =E43/B43 -> 6.6858421220837322E-2 | G43: 412 | H43: =G43/B43 -> 5.266858421220837E-3 | I43: 14246 | J43: =I43/B43 -> 0.18211569191434962 | K43: 96 | L43: =K43/B43 -> 1.2272291466922339E-3 | M43: 3168 | N43: =M43/B43 -> 4.0498561840843723E-2 | O43: 497 | P43: =O43/B43 -> 6.3534675615212529E-3 | Q43: 9372 | R43: =Q43/B43 -> 0.11980824544582934
A44: 42 | B44: 81840 | C44: 50066 | D44: =C44/B44 -> 0.61175464320625605 | E44: 12530 | F44: =E44/B44 -> 0.15310361681329424 | G44: 506 | H44: =G44/B44 -> 6.1827956989247311E-3 | I44: 14166 | J44: =I44/B44 -> 0.17309384164222874 | K44: 179 | L44: =K44/B44 -> 2.1871945259042034E-3 | M44: 3534 | N44: =M44/B44 -> 4.3181818181818182E-2 | O44: 859 | P44: =O44/B44 -> 1.0496089931573803E-2 | Q44: 9713 | R44: =Q44/B44 -> 0.11868279569892473
A45: 43 | B45: 78088 | C45: 47719 | D45: =C45/B45 -> 0.61109261346173549 | E45: 12903 | F45: =E45/B45 -> 0.16523665608031965 | G45: 516 | H45: =G45/B45 -> 6.6079295154185024E-3 | I45: 11514 | J45: =I45/B45 -> 0.14744903186148961 | K45: 106 | L45: =K45/B45 -> 1.3574428849503124E-3 | M45: 4606 | N45: =M45/B45 -> 5.8984735170576785E-2 | O45: 724 | P45: =O45/B45 -> 9.2715910255096821E-3 | Q45: 11333 | R45: =Q45/B45 -> 0.14513113410511219
A46: 44 | B46: 79883 | C46: 43977 | D46: =C46/B46 -> 0.55051763203685389 | E46: 17844 | F46: =E46/B46 -> 0.22337668840679495 | G46: 618 | H46: =G46/B46 -> 7.7363143597511362E-3 | I46: 6180 | J46: =I46/B46 -> 7.7363143597511355E-2 | K46: 107 | L46: =K46/B46 -> 1.3394589587271384E-3 | M46: 10269 | N46: =M46/B46 -> 0.12855050511372884 | O46: 888 | P46: =O46/B46 -> 1.11162575266327E-2 | Q46: 19646 | R46: =Q46/B46 -> 0.24593467946872299
A47: 45 | B47: 78709 | C47: 60868 | D47: =C47/B47 -> 0.77332960652530203 | E47: 9386 | F47: =E47/B47 -> 0.11924938698242894 | G47: 507 | H47: =G47/B47 -> 6.4414488813223396E-3 | I47: 4149 | J47: =I47/B47 -> 5.2713158596856775E-2 | K47: 94 | L47: =K47/B47 -> 1.1942725736573962E-3 | M47: 3224 | N47: =M47/B47 -> 4.0961008270972821E-2 | O47: 481 | P47: =O47/B47 -> 6.1111181694596551E-3 | Q47: 7724 | R47: =Q47/B47 -> 9.8133631477975838E-2
A48: 46 | B48: 77235 | C48: 38614 | D48: =C48/B48 -> 0.4999546837573639 | E48: 23170 | F48: =E48/B48 -> 0.29999352625105197 | G48: 456 | H48: =G48/B48 -> 5.9040590405904057E-3 | I48: 7692 | J48: =I48/B48 -> 9.9592153816275009E-2 | K48: 113 | L48: =K48/B48 -> 1.4630672622515698E-3 | M48: 6247 | N48: =M48/B48 -> 8.088301935650935E-2 | O48: 943 | P48: =O48/B48 -> 1.220949051595779E-2 | Q48: 13313 | R48: =Q48/B48 -> 0.17237003948986859
A49: 47 | B49: 78184 | C49: 56589 | D49: =C49/B49 -> 0.7237925918346465 | E49: 5813 | F49: =E49/B49 -> 7.4350250690678396E-2 | G49: 739 | H49: =G49/B49 -> 9.4520618029264297E-3 | I49: 8838 | J49: =I49/B49 -> 0.11304103141307685 | K49: 90 | L49: =K49/B49 -> 1.1511306661209455E-3 | M49: 5475 | N49: =M49/B49 -> 7.0027115522357519E-2 | O49: 640 | P49: =O49/B49 -> 8.1858180701933903E-3 | Q49: 11875 | R49: =Q49/B49 -> 0.15188529622429142
A50: 48 | B50: 83331 | C50: 66164 | D50: =C50/B50 -> 0.7939902317264883 | E50: 4937 | F50: =E50/B50 -> 5.9245658878448598E-2 | G50: 449 | H50: =G50/B50 -> 5.3881508682243106E-3 | I50: 9303 | J50: =I50/B50 -> 0.11163912589552508 | K50: 107 | L50: =K50/B50 -> 1.2840359530066842E-3 | M50: 1905 | N50: =M50/B50 -> 2.2860640097922741E-2 | O50: 466 | P50: =O50/B50 -> 5.5921565803842511E-3 | Q50: 6829 | R50: =Q50/B50 -> 8.1950294608249027E-2
A51: 49 | B51: 78871 | C51: 40557 | D51: =C51/B51 -> 0.51421942158714862 | E51: 13097 | F51: =E51/B51 -> 0.16605596480328638 | G51: 917 | H51: =G51/B51 -> 1.1626580111828174E-2 | I51: 8613 | J51: =I51/B51 -> 0.10920363631753116 | K51: 124 | L51: =K51/B51 -> 1.5721874960378339E-3 | M51: 14548 | N51: =M51/B51 -> 0.18445309429321297 | O51: 1015 | P51: =O51/B51 -> 1.2869115390954851E-2 | Q51: 28622 | R51: =Q51/B51 -> 0.36289637509350714
A52: 50 | B52: 82586 | C52: 48105 | D52: =C52/B52 -> 0.58248371394667375 | E52: 12298 | F52: =E52/B52 -> 0.14891143777395685 | G52: 759 | H52: =G52/B52 -> 9.1904196837236333E-3 | I52: 5727 | J52: =I52/B52 -> 6.934589397718742E-2 | K52: 145 | L52: =K52/B52 -> 1.7557455258760564E-3 | M52: 14685 | N52: =M52/B52 -> 0.17781464170682681 | O52: 867 | P52: =O52/B52 -> 1.0498147385755455E-2 | Q52: 27713 | R52: =Q52/B52 -> 0.33556535005933208
A53: 51 | B53: 83623 | C53: 49829 | D53: =C53/B53 -> 0.59587673247790685 | E53: 17735 | F53: =E53/B53 -> 0.21208280018655154 | G53: 979 | H53: =G53/B53 -> 1.1707305406407327E-2 | I53: 6933 | J53: =I53/B53 -> 8.2907812443944851E-2 | K53: 151 | L53: =K53/B53 -> 1.8057233057890772E-3 | M53: 6922 | N53: =M53/B53 -> 8.2776269686569481E-2 | O53: 1074 | P53: =O53/B53 -> 1.284335649283092E-2 | Q53: 15732 | R53: =Q53/B53 -> 0.18813005991174678
A54: 52 | B54: 81592 | C54: 33949 | D54: =C54/B54 -> 0.41608245906461416 | E54: 27615 | F54: =E54/B54 -> 0.33845229924502401 | G54: 797 | H54: =G54/B54 -> 9.7681145210314745E-3 | I54: 6660 | J54: =I54/B54 -> 8.1625649573487599E-2 | K54: 151 | L54: =K54/B54 -> 1.8506716344739681E-3 | M54: 10897 | N54: =M54/B54 -> 0.13355476027061478 | O54: 1523 | P54: =O54/B54 -> 1.8666045690753995E-2 | Q54: 21232 | R54: =Q54/B54 -> 0.26022159035199527
A55: 53 | B55: 77965 | C55: 50593 | D55: =C55/B55 -> 0.64891938690438022 | E55: 3595 | F55: =E55/B55 -> 4.6110434169178476E-2 | G55: 484 | H55: =G55/B55 -> 6.2079138074777147E-3 | I55: 18271 | J55: =I55/B55 -> 0.23434874623228372 | K55: 58 | L55: =K55/B55 -> 7.4392355544154428E-4 | M55: 4410 | N55: =M55/B55 -> 5.6563842749951902E-2 | O55: 554 | P55: =O55/B55 -> 7.1057525812864746E-3 | Q55: 10828 | R55: =Q55/B55 -> 0.13888283204001795
A56: 54 | B56: 82824 | C56: 61635 | D56: =C56/B56 -> 0.74416835699797157 | E56: 16475 | F56: =E56/B56 -> 0.19891577320583406 | G56: 750 | H56: =G56/B56 -> 9.0553462764416115E-3 | I56: 1673 | J56: =I56/B56 -> 2.0199459093982422E-2 | K56: 106 | L56: =K56/B56 -> 1.2798222737370811E-3 | M56: 1611 | N56: =M56/B56 -> 1.9450883801796579E-2 | O56: 574 | P56: =O56/B56 -> 6.9303583502366463E-3 | Q56: 4013 | R56: =Q56/B56 -> 4.8452139476480249E-2
A57: 55 | B57: 79012 | C57: 67917 | D57: =C57/B57 -> 0.8595782919050271 | E57: 8190 | F57: =E57/B57 -> 0.10365514099124183 | G57: 573 | H57: =G57/B57 -> 7.2520629777755282E-3 | I57: 1368 | J57: =I57/B57 -> 1.7313825747987649E-2 | K57: 33 | L57: =K57/B57 -> 4.1765807725408801E-4 | M57: 705 | N57: =M57/B57 -> 8.9226952867918798E-3 | O57: 226 | P57: =O57/B57 -> 2.860325013921936E-3 | Q57: 1768 | R57: =Q57/B57 -> 2.2376347896522049E-2
A58: 56 | B58: 81210 | C58: 63276 | D58: =C58/B58 -> 0.77916512744735866 | E58: 11652 | F58: =E58/B58 -> 0.14347986701145179 | G58: 441 | H58: =G58/B58 -> 5.4303657185075732E-3 | I58: 4857 | J58: =I58/B58 -> 5.9807905430365717E-2 | K58: 45 | L58: =K58/B58 -> 5.5411895086811974E-4 | M58: 614 | N58: =M58/B58 -> 7.5606452407338993E-3 | O58: 325 | P58: =O58/B58 -> 4.0019702007141975E-3 | Q58: 1864 | R58: =Q58/B58 -> 2.2952838320403891E-2
A59: 57 | B59: 76557 | C59: 64340 | D59: =C59/B59 -> 0.84041955667019341 | E59: 6588 | F59: =E59/B59 -> 8.6053528743289309E-2 | G59: 447 | H59: =G59/B59 -> 5.8387867863160785E-3 | I59: 3321 | J59: =I59/B59 -> 4.3379442768133547E-2 | K59: 38 | L59: =K59/B59 -> 4.963621876510313E-4 | M59: 1512 | N59: =M59/B59 -> 1.9749990203377876E-2 | O59: 311 | P59: =O59/B59 -> 4.0623326410387031E-3 | Q59: 3473 | R59: =Q59/B59 -> 4.5364891518737675E-2
A60: 58 | B60: 77164 | C60: 56796 | D60: =C60/B60 -> 0.73604271421906586 | E60: 12837 | F60: =E60/B60 -> 0.16635996060339017 | G60: 477 | H60: =G60/B60 -> 6.1816391063190092E-3 | I60: 4803 | J60: =I60/B60 -> 6.2244051630293923E-2 | K60: 50 | L60: =K60/B60 -> 6.4797055621792544E-4 | M60: 1793 | N60: =M60/B60 -> 2.3236224145974808E-2 | O60: 408 | P60: =O60/B60 -> 5.2874397387382716E-3 | Q60: 4135 | R60: =Q60/B60 -> 5.3587164999222434E-2
A61: 59 | B61: 82463 | C61: 60586 | D61: =C61/B61 -> 0.73470526175375628 | E61: 18467 | F61: =E61/B61 -> 0.22394285922171156 | G61: 479 | H61: =G61/B61 -> 5.8086657046190412E-3 | I61: 1164 | J61: =I61/B61 -> 1.4115421461746481E-2 | K61: 58 | L61: =K61/B61 -> 7.0334574293925761E-4 | M61: 1428 | N61: =M61/B61 -> 1.7316857257194136E-2 | O61: 281 | P61: =O61/B61 -> 3.4075888580332998E-3 | Q61: 3003 | R61: =Q61/B61 -> 3.6416332173217082E-2
A62: 60 | B62: 79918 | C62: 51881 | D62: =C62/B62 -> 0.64917790735503889 | E62: 26390 | F62: =E62/B62 -> 0.33021346880552566 | G62: 410 | H62: =G62/B62 -> 5.1302585149778524E-3 | I62: 345 | J62: =I62/B62 -> 4.3169248479691686E-3 | K62: 21 | L62: =K62/B62 -> 2.6276933857203634E-4 | M62: 645 | N62: =M62/B62 -> 8.0707725418554012E-3 | O62: 226 | P62: =O62/B62 -> 2.8278985960609624E-3 | Q62: 1341 | R62: =Q62/B62 -> 1.6779699191671462E-2
A63: 61 | B63: 82728 | C63: 52242 | D63: =C63/B63 -> 0.63149115172613868 | E63: 27995 | F63: =E63/B63 -> 0.33839812397253649 | G63: 526 | H63: =G63/B63 -> 6.3581858621023111E-3 | I63: 442 | J63: =I63/B63 -> 5.3428101730973792E-3 | K63: 35 | L63: =K63/B63 -> 4.2307320375205493E-4 | M63: 1199 | N63: =M63/B63 -> 1.4493279179963254E-2 | O63: 289 | P63: =O63/B63 -> 3.4933758824098248E-3 | Q63: 2336 | R63: =Q63/B63 -> 2.8237114398994293E-2
A64: 62 | B64: 80391 | C64: 47523 | D64: =C64/B64 -> 0.59114826286524613 | E64: 27043 | F64: =E64/B64 -> 0.33639337736811337 | G64: 1128 | H64: =G64/B64 -> 1.4031421427771765E-2 | I64: 2055 | J64: =I64/B64 -> 2.5562562973467179E-2 | K64: 172 | L64: =K64/B64 -> 2.1395429836673259E-3 | M64: 1734 | N64: =M64/B64 -> 2.1569578684181065E-2 | O64: 736 | P64: =O64/B64 -> 9.1552536975532083E-3 | Q64: 4386 | R64: =Q64/B64 -> 5.4558346083516812E-2
A65: 63 | B65: 79996 | C65: 32943 | D65: =C65/B65 -> 0.41180809040452021 | E65: 44199 | F65: =E65/B65 -> 0.55251512575628781 | G65: 407 | H65: =G65/B65 -> 5.087754387719386E-3 | I65: 808 | J65: =I65/B65 -> 1.0100505025251262E-2 | K65: 54 | L65: =K65/B65 -> 6.7503375168758437E-4 | M65: 1135 | N65: =M65/B65 -> 1.4188209410470524E-2 | O65: 450 | P65: =O65/B65 -> 5.6252812640632029E-3 | Q65: 2466 | R65: =Q65/B65 -> 3.0826541327066352E-2
A66: 64 | B66: 80520 | C66: 60513 | D66: =C66/B66 -> 0.75152757078986587 | E66: 15577 | F66: =E66/B66 -> 0.19345504222553403 | G66: 492 | H66: =G66/B66 -> 6.1102831594634878E-3 | I66: 2407 | J66: =I66/B66 -> 2.9893194237456532E-2 | K66: 67 | L66: =K66/B66 -> 8.3209140586189766E-4 | M66: 1060 | N66: =M66/B66 -> 1.3164431197218083E-2 | O66: 404 | P66: =O66/B66 -> 5.0173869846000998E-3 | Q66: 2897 | R66: =Q66/B66 -> 3.5978638847491307E-2
A67: 65 | B67: 83186 | C67: 70547 | D67: =C67/B67 -> 0.8480633760488544 | E67: 8150 | F67: =E67/B67 -> 9.7973216647031958E-2 | G67: 373 | H67: =G67/B67 -> 4.4839275839684565E-3 | I67: 3189 | J67: =I67/B67 -> 3.8335777654893849E-2 | K67: 50 | L67: =K67/B67 -> 6.0106267881614693E-4 | M67: 598 | N67: =M67/B67 -> 7.1887096386411171E-3 | O67: 279 | P67: =O67/B67 -> 3.3539297477940999E-3 | Q67: 2067 | R67: =Q67/B67 -> 2.4847931142259513E-2
A68: 66 | B68: 82585 | C68: 62651 | D68: =C68/B68 -> 0.75862444753889935 | E68: 14425 | F68: =E68/B68 -> 0.17466852333958952 | G68: 576 | H68: =G68/B68 -> 6.9746321971302294E-3 | I68: 2558 | J68: =I68/B68 -> 3.0974147847672096E-2 | K68: 73 | L68: =K68/B68 -> 8.8393776109462982E-4 | M68: 1738 | N68: =M68/B68 -> 2.1044983955924201E-2 | O68: 564 | P68: =O68/B68 -> 6.8293273596900161E-3 | Q68: 4091 | R68: =Q68/B68 -> 4.9536840830659318E-2
A69: 67 | B69: 77656 | C69: 47976 | D69: =C69/B69 -> 0.61780158648398065 | E69: 5693 | F69: =E69/B69 -> 7.3310497579066658E-2 | G69: 380 | H69: =G69/B69 -> 4.893375914288658E-3 | I69: 19186 | J69: =I69/B69 -> 0.2470639744514268 | K69: 133 | L69: =K69/B69 -> 1.7126815700010303E-3 | M69: 3767 | N69: =M69/B69 -> 4.8508808076645718E-2 | O69: 521 | P69: =O69/B69 -> 6.7090759245905015E-3 | Q69: 9042 | R69: =Q69/B69 -> 0.11643659214999486
A70: 68 | B70: 81345 | C70: 65771 | D70: =C70/B70 -> 0.80854385641403892 | E70: 10315 | F70: =E70/B70 -> 0.12680558116663593 | G70: 458 | H70: =G70/B70 -> 5.6303399102587744E-3 | I70: 2953 | J70: =I70/B70 -> 3.6302169770729607E-2 | K70: 47 | L70: =K70/B70 -> 5.7778597332349866E-4 | M70: 1410 | N70: =M70/B70 -> 1.7333579199704959E-2 | O70: 391 | P70: =O70/B70 -> 4.8066875653082547E-3 | Q70: 3483 | R70: =Q70/B70 -> 4.2817628618845659E-2
A71: 69 | B71: 77534 | C71: 25382 | D71: =C71/B71 -> 0.32736605876131764 | E71: 43367 | F71: =E71/B71 -> 0.55932881058632344 | G71: 501 | H71: =G71/B71 -> 6.4616813269017465E-3 | I71: 1475 | J71: =I71/B71 -> 1.9023912090179791E-2 | K71: 87 | L71: =K71/B71 -> 1.1220883741326385E-3 | M71: 5968 | N71: =M71/B71 -> 7.6972682951995247E-2 | O71: 754 | P71: =O71/B71 -> 9.724765909149535E-3 | Q71: 9337 | R71: =Q71/B71 -> 0.12042458792271778
A72: 70 | B72: 79380 | C72: 20552 | D72: =C72/B72 -> 0.25890652557319221 | E72: 51434 | F72: =E72/B72 -> 0.64794658604182409 | G72: 619 | H72: =G72/B72 -> 7.7979339884101792E-3 | I72: 931 | J72: =I72/B72 -> 1.1728395061728396E-2 | K72: 90 | L72: =K72/B72 -> 1.1337868480725624E-3 | M72: 4925 | N72: =M72/B72 -> 6.2043335852859663E-2 | O72: 829 | P72: =O72/B72 -> 1.0443436633912824E-2 | Q72: 7748 | R72: =Q72/B72 -> 9.7606449987402366E-2
A73: 71 | B73: 76707 | C73: 31585 | D73: =C73/B73 -> 0.41176163844238467 | E73: 39931 | F73: =E73/B73 -> 0.52056526783735513 | G73: 357 | H73: =G73/B73 -> 4.6540732918768819E-3 | I73: 3347 | J73: =I73/B73 -> 4.3633566688828923E-2 | K73: 48 | L73: =K73/B73 -> 6.2575775352966478E-4 | M73: 751 | N73: =M73/B73 -> 9.7905015187662141E-3 | O73: 688 | P73: =O73/B73 -> 8.9691944672585285E-3 | Q73: 2141 | R73: =Q73/B73 -> 2.7911403131396093E-2
A74: 72 | B74: 83135 | C74: 60898 | D74: =C74/B74 -> 0.73251939616286765 | E74: 9834 | F74: =E74/B74 -> 0.11828952907920852 | G74: 345 | H74: =G74/B74 -> 4.1498767065616168E-3 | I74: 10060 | J74: =I74/B74 -> 0.12100799903770974 | K74: 46 | L74: =K74/B74 -> 5.533168942082156E-4 | M74: 1426 | N74: =M74/B74 -> 1.7152823720454683E-2 | O74: 526 | P74: =O74/B74 -> 6.3270583989895948E-3 | Q74: 3557 | R74: =Q74/B74 -> 4.2785830276057014E-2
A75: 73 | B75: 81362 | C75: 57729 | D75: =C75/B75 -> 0.70953270568570093 | E75: 14162 | F75: =E75/B75 -> 0.1740616012389076 | G75: 472 | H75: =G75/B75 -> 5.8012339912981489E-3 | I75: 4897 | J75: =I75/B75 -> 6.0187802659718299E-2 | K75: 54 | L75: =K75/B75 -> 6.6370049900444923E-4 | M75: 3530 | N75: =M75/B75 -> 4.338634743492048E-2 | O75: 518 | P75: =O75/B75 -> 6.366608490450087E-3 | Q75: 7063 | R75: =Q75/B75 -> 8.6809567119785644E-2
A76: 74 | B76: 81120 | C76: 31035 | D76: =C76/B76 -> 0.38258136094674555 | E76: 45800 | F76: =E76/B76 -> 0.56459566074950696 | G76: 544 | H76: =G76/B76 -> 6.7061143984220905E-3 | I76: 1723 | J76: =I76/B76 -> 2.1240138067061144E-2 | K76: 50 | L76: =K76/B76 -> 6.1637080867850099E-4 | M76: 1287 | N76: =M76/B76 -> 1.5865384615384615E-2 | O76: 681 | P76: =O76/B76 -> 8.3949704142011836E-3 | Q76: 2625 | R76: =Q76/B76 -> 3.2359467455621301E-2
A77: 75 | B77: 77121 | C77: 35431 | D77: =C77/B77 -> 0.45942090999857366 | E77: 40009 | F77: =E77/B77 -> 0.51878217346766764 | G77: 352 | H77: =G77/B77 -> 4.564256168877478E-3 | I77: 367 | J77: =I77/B77 -> 4.758755721528507E-3 | K77: 28 | L77: =K77/B77 -> 3.6306583161525396E-4 | M77: 631 | N77: =M77/B77 -> 8.1819478481866166E-3 | O77: 303 | P77: =O77/B77 -> 3.9288909635507834E-3 | Q77: 1352 | R77: =Q77/B77 -> 1.7530893012279405E-2
A78: 76 | B78: 79435 | C78: 48706 | D78: =C78/B78 -> 0.61315541008371621 | E78: 26648 | F78: =E78/B78 -> 0.33546925158934976 | G78: 505 | H78: =G78/B78 -> 6.3573991313652673E-3 | I78: 2206 | J78: =I78/B78 -> 2.7771133631270851E-2 | K78: 85 | L78: =K78/B78 -> 1.0700572795367281E-3 | M78: 758 | N78: =M78/B78 -> 9.5423931516334104E-3 | O78: 527 | P78: =O78/B78 -> 6.6343551331277143E-3 | Q78: 2248 | R78: =Q78/B78 -> 2.8299867816453703E-2
A79: 77 | B79: 79765 | C79: 38398 | D79: =C79/B79 -> 0.48138908042374473 | E79: 37021 | F79: =E79/B79 -> 0.46412586974236819 | G79: 647 | H79: =G79/B79 -> 8.1113270231304452E-3 | I79: 1589 | J79: =I79/B79 -> 1.9921017990346644E-2 | K79: 85 | L79: =K79/B79 -> 1.0656302889738608E-3 | M79: 1367 | N79: =M79/B79 -> 1.7137842412085501E-2 | O79: 658 | P79: =O79/B79 -> 8.2492321193505923E-3 | Q79: 3655 | R79: =Q79/B79 -> 4.5822102425876012E-2
A80: 78 | B80: 78523 | C80: 60766 | D80: =C80/B80 -> 0.77386243521006581 | E80: 13071 | F80: =E80/B80 -> 0.16646078219120514 | G80: 545 | H80: =G80/B80 -> 6.940641595456108E-3 | I80: 2874 | J80: =I80/B80 -> 3.6600741184111663E-2 | K80: 132 | L80: =K80/B80 -> 1.6810361295416629E-3 | M80: 688 | N80: =M80/B80 -> 8.7617640691262429E-3 | O80: 447 | P80: =O80/B80 -> 5.6925996204933585E-3 | Q80: 2899 | R80: =Q80/B80 -> 3.6919119238949097E-2
A81: 79 | B81: 78149 | C81: 42498 | D81: =C81/B81 -> 0.54380734238441952 | E81: 30864 | F81: =E81/B81 -> 0.39493787508477396 | G81: 626 | H81: =G81/B81 -> 8.0103392237904514E-3 | I81: 2411 | J81: =I81/B81 -> 3.0851322473736068E-2 | K81: 126 | L81: =K81/B81 -> 1.6123046999961612E-3 | M81: 861 | N81: =M81/B81 -> 1.1017415449973767E-2 | O81: 763 | P81: =O81/B81 -> 9.7634006833100875E-3 | Q81: 2809 | R81: =Q81/B81 -> 3.5944157954676322E-2
A82: 80 | B82: 80239 | C82: 26137 | D82: =C82/B82 -> 0.32573935368087836 | E82: 50661 | F82: =E82/B82 -> 0.63137626341305353 | G82: 450 | H82: =G82/B82 -> 5.6082453669661888E-3 | I82: 1298 | J82: =I82/B82 -> 1.6176672191826919E-2 | K82: 91 | L82: =K82/B82 -> 1.1341118408753849E-3 | M82: 890 | N82: =M82/B82 -> 1.1091863059110906E-2 | O82: 712 | P82: =O82/B82 -> 8.8734904472887247E-3 | Q82: 2469 | R82: =Q82/B82 -> 3.0770572913421154E-2
A83: 81 | B83: 83069 | C83: 64811 | D83: =C83/B83 -> 0.78020681602041675 | E83: 11386 | F83: =E83/B83 -> 0.13706677581287846 | G83: 659 | H83: =G83/B83 -> 7.9331639961959331E-3 | I83: 3448 | J83: =I83/B83 -> 4.1507662304830925E-2 | K83: 192 | L83: =K83/B83 -> 2.3113315436564781E-3 | M83: 1832 | N83: =M83/B83 -> 2.205395514572223E-2 | O83: 741 | P83: =O83/B83 -> 8.9202951762992217E-3 | Q83: 5246 | R83: =Q83/B83 -> 6.315231915636399E-2
A84: 82 | B84: 80363 | C84: 51126 | D84: =C84/B84 -> 0.63618829560867562 | E84: 19532 | F84: =E84/B84 -> 0.2430471734504685 | G84: 681 | H84: =G84/B84 -> 8.4740490026504727E-3 | I84: 5386 | J84: =I84/B84 -> 6.7020892699376583E-2 | K84: 212 | L84: =K84/B84 -> 2.638029939151102E-3 | M84: 2311 | N84: =M84/B84 -> 2.8757015044236774E-2 | O84: 1115 | P84: =O84/B84 -> 1.3874544255440937E-2 | Q84: 6608 | R84: =Q84/B84 -> 8.2226895461841892E-2
A85: 83 | B85: 83149 | C85: 62953 | D85: =C85/B85 -> 0.7571107289323985 | E85: 12654 | F85: =E85/B85 -> 0.15218463240688404 | G85: 617 | H85: =G85/B85 -> 7.4204139556699423E-3 | I85: 4592 | J85: =I85/B85 -> 5.5226160266509519E-2 | K85: 96 | L85: =K85/B85 -> 1.1545538731674463E-3 | M85: 1510 | N85: =M85/B85 -> 1.8160170296696292E-2 | O85: 727 | P85: =O85/B85 -> 8.7433402686743072E-3 | Q85: 4596 | R85: =Q85/B85 -> 5.5274266677891495E-2
A86: 84 | B86: 82041 | C86: 48866 | D86: =C86/B86 -> 0.59562901476091223 | E86: 21068 | F86: =E86/B86 -> 0.25679843005326602 | G86: 628 | H86: =G86/B86 -> 7.6547092307504786E-3 | I86: 8704 | J86: =I86/B86 -> 0.10609329481600663 | K86: 131 | L86: =K86/B86 -> 1.5967625943125998E-3 | M86: 1660 | N86: =M86/B86 -> 2.0233785546251264E-2 | O86: 984 | P86: =O86/B86 -> 1.1994002998500749E-2 | Q86: 5494 | R86: =Q86/B86 -> 6.6966516741629192E-2
A87: 85 | B87: 83127 | C87: 50132 | D87: =C87/B87 -> 0.60307721919472612 | E87: 19985 | F87: =E87/B87 -> 0.24041526820407327 | G87: 587 | H87: =G87/B87 -> 7.061484234965775E-3 | I87: 9628 | J87: =I87/B87 -> 0.11582277719633813 | K87: 147 | L87: =K87/B87 -> 1.7683785051788227E-3 | M87: 1627 | N87: =M87/B87 -> 1.9572461414462207E-2 | O87: 1021 | P87: =O87/B87 -> 1.2282411250255632E-2 | Q87: 4911 | R87: =Q87/B87 -> 5.9078277815872098E-2
A88: 86 | B88: 80356 | C88: 39108 | D88: =C88/B88 -> 0.48668425506496094 | E88: 8313 | F88: =E88/B88 -> 0.10345213798596246 | G88: 564 | H88: =G88/B88 -> 7.0187664891234007E-3 | I88: 20102 | J88: =I88/B88 -> 0.25016178007865003 | K88: 73 | L88: =K88/B88 -> 9.0845736472696499E-4 | M88: 11276 | N88: =M88/B88 -> 0.14032555129672955 | O88: 920 | P88: =O88/B88 -> 1.1449051719846682E-2 | Q88: 20773 | R88: =Q88/B88 -> 0.2585121210612773
A89: 87 | B89: 82923 | C89: 52908 | D89: =C89/B89 -> 0.63803769762309614 | E89: 20995 | F89: =E89/B89 -> 0.25318669126780263 | G89: 991 | H89: =G89/B89 -> 1.1950845965534291E-2 | I89: 3326 | J89: =I89/B89 -> 4.0109499173932445E-2 | K89: 247 | L89: =K89/B89 -> 2.9786669560917961E-3 | M89: 2877 | N89: =M89/B89 -> 3.4694837379255453E-2 | O89: 1579 | P89: =O89/B89 -> 1.9041761634287231E-2 | Q89: 8033 | R89: =Q89/B89 -> 9.6873002665123067E-2
A90: 88 | B90: 81877 | C90: 63499 | D90: =C90/B90 -> 0.77554136082172043 | E90: 11121 | F90: =E90/B90 -> 0.13582568975414341 | G90: 712 | H90: =G90/B90 -> 8.6959707854464621E-3 | I90: 3250 | J90: =I90/B90 -> 3.9693686871771071E-2 | K90: 132 | L90: =K90/B90 -> 1.6121743590996251E-3 | M90: 2495 | N90: =M90/B90 -> 3.0472538075405793E-2 | O90: 668 | P90: =O90/B90 -> 8.158579332413254E-3 | Q90: 6451 | R90: =Q90/B90 -> 7.8788915079936975E-2
A91: 89 | B91: 81392 | C91: 30752 | D91: =C91/B91 -> 0.37782583054845686 | E91: 43350 | F91: =E91/B91 -> 0.53260762728523692 | G91: 700 | H91: =G91/B91 -> 8.6003538431295452E-3 | I91: 3287 | J91: =I91/B91 -> 4.0384804403381165E-2 | K91: 167 | L91: =K91/B91 -> 2.0517987025751917E-3 | M91: 1973 | N91: =M91/B91 -> 2.4240711617849419E-2 | O91: 1163 | P91: =O91/B91 -> 1.4288873599370946E-2 | Q91: 5171 | R91: =Q91/B91 -> 6.3532042461175539E-2
A92: 90 | B92: 79518 | C92: 28670 | D92: =C92/B92 -> 0.36054729746724012 | E92: 44736 | F92: =E92/B92 -> 0.56258960235418398 | G92: 522 | H92: =G92/B92 -> 6.5645514223194746E-3 | I92: 2678 | J92: =I92/B92 -> 3.3677909404160065E-2 | K92: 152 | L92: =K92/B92 -> 1.9115168892577781E-3 | M92: 1829 | N92: =M92/B92 -> 2.3001081516134711E-2 | O92: 931 | P92: =O92/B92 -> 1.1708040946703892E-2 | Q92: 4439 | R92: =Q92/B92 -> 5.5823838627732089E-2
A93: 91 | B93: 76459 | C93: 50876 | D93: =C93/B93 -> 0.6654023725133732 | E93: 10202 | F93: =E93/B93 -> 0.13343098915758772 | G93: 601 | H93: =G93/B93 -> 7.8604219254763998E-3 | I93: 8240 | J93: =I93/B93 -> 0.10777017748074132 | K93: 99 | L93: =K93/B93 -> 1.2948115983729843E-3 | M93: 5607 | N93: =M93/B93 -> 7.333342052603356E-2 | O93: 834 | P93: =O93/B93 -> 1.0907806798414837E-2 | Q93: 12787 | R93: =Q93/B93 -> 0.1672399586706601
A94: 92 | B94: 78747 | C94: 29417 | D94: =C94/B94 -> 0.37356343733729541 | E94: 44602 | F94: =E94/B94 -> 0.56639618017194304 | G94: 656 | H94: =G94/B94 -> 8.3304760816285059E-3 | I94: 1589 | J94: =I94/B94 -> 2.0178546484310514E-2 | K94: 88 | L94: =K94/B94 -> 1.1175028889989459E-3 | M94: 1114 | N94: =M94/B94 -> 1.4146570663009384E-2 | O94: 1281 | P94: =O94/B94 -> 1.6267286372814202E-2 | Q94: 3503 | R94: =Q94/B94 -> 4.4484234320037591E-2
A95: 93 | B95: 78365 | C95: 61129 | D95: =C95/B95 -> 0.78005487143495178 | E95: 10593 | F95: =E95/B95 -> 0.13517514196388694 | G95: 559 | H95: =G95/B95 -> 7.1332865437376382E-3 | I95: 4178 | J95: =I95/B95 -> 5.3314617495055193E-2 | K95: 127 | L95: =K95/B95 -> 1.6206214509028266E-3 | M95: 1117 | N95: =M95/B95 -> 1.4253812288649269E-2 | O95: 662 | P95: =O95/B95 -> 8.4476488228163085E-3 | Q95: 3234 | R95: =Q95/B95 -> 4.1268423403305048E-2
A96: 94 | B96: 82137 | C96: 48431 | D96: =C96/B96 -> 0.5896368262780477 | E96: 26137 | F96: =E96/B96 -> 0.31821225513471396 | G96: 717 | H96: =G96/B96 -> 8.7293180905073237E-3 | I96: 3192 | J96: =I96/B96 -> 3.8861901457321303E-2 | K96: 187 | L96: =K96/B96 -> 2.2766840766037231E-3 | M96: 2230 | N96: =M96/B96 -> 2.7149761983028355E-2 | O96: 1243 | P96: =O96/B96 -> 1.5133252979777689E-2 | Q96: 6357 | R96: =Q96/B96 -> 7.739508382336828E-2
A97: 95 | B97: 79044 | C97: 24933 | D97: =C97/B97 -> 0.31543191134051918 | E97: 49291 | F97: =E97/B97 -> 0.62358939324932949 | G97: 517 | H97: =G97/B97 -> 6.540660897727848E-3 | I97: 1797 | J97: =I97/B97 -> 2.2734173371792926E-2 | K97: 112 | L97: =K97/B97 -> 1.4169323414806943E-3 | M97: 1141 | N97: =M97/B97 -> 1.4434998228834574E-2 | O97: 1253 | P97: =O97/B97 -> 1.5851930570315267E-2 | Q97: 3217 | R97: =Q97/B97 -> 4.0698851272708871E-2
A98: 96 | B98: 79796 | C98: 46034 | D98: =C98/B98 -> 0.57689608501679279 | E98: 25437 | F98: =E98/B98 -> 0.31877537721189031 | G98: 662 | H98: =G98/B98 -> 8.2961551957491612E-3 | I98: 3325 | J98: =I98/B98 -> 4.1668755326081511E-2 | K98: 217 | L98: =K98/B98 -> 2.7194345581232141E-3 | M98: 3034 | N98: =M98/B98 -> 3.8021955987768807E-2 | O98: 1087 | P98: =O98/B98 -> 1.3622236703594165E-2 | Q98: 6854 | R98: =Q98/B98 -> 8.5894029775928624E-2
A99: 97 | B99: 83233 | C99: 67563 | D99: =C99/B99 -> 0.81173332692561839 | E99: 11659 | F99: =E99/B99 -> 0.1400766522893564 | G99: 991 | H99: =G99/B99 -> 1.1906335227614048E-2 | I99: 1630 | J99: =I99/B99 -> 1.9583578628668916E-2 | K99: 64 | L99: =K99/B99 -> 7.6892578664712315E-4 | M99: 891 | N99: =M99/B99 -> 1.0704888685977918E-2 | O99: 435 | P99: =O99/B99 -> 5.2262924561171653E-3 | Q99: 2489 | R99: =Q99/B99 -> 2.9904004421323273E-2
A100: 98 | B100: 79629 | C100: 63127 | D100: =C100/B100 -> 0.79276394278466389 | E100: 13933 | F100: =E100/B100 -> 0.17497394165442237 | G100: 862 | H100: =G100/B100 -> 1.0825201873689233E-2 | I100: 686 | J100: =I100/B100 -> 8.614951839154077E-3 | K100: 46 | L100: =K100/B100 -> 5.7767898629896143E-4 | M100: 653 | N100: =M100/B100 -> 8.2005299576787347E-3 | O100: 322 | P100: =O100/B100 -> 4.0437529040927298E-3 | Q100: 1832 | R100: =Q100/B100 -> 2.3006693541297769E-2
A101: 99 | B101: 78078 | C101: 55258 | D101: =C101/B101 -> 0.70772816926663085 | E101: 19804 | F101: =E101/B101 -> 0.25364379210533056 | G101: 610 | H101: =G101/B101 -> 7.8127001203924275E-3 | I101: 739 | J101: =I101/B101 -> 9.4648940802786949E-3 | K101: 44 | L101: =K101/B101 -> 5.6353902507748658E-4 | M101: 1298 | N101: =M101/B101 -> 1.6624401239785855E-2 | O101: 325 | P101: =O101/B101 -> 4.1625041625041629E-3 | Q101: 2933 | R101: =Q101/B101 -> 3.7564999103460645E-2
A102: 100 | B102: 76986 | C102: 55991 | D102: =C102/B102 -> 0.72728807835190812 | E102: 16392 | F102: =E102/B102 -> 0.21292182994310654 | G102: 639 | H102: =G102/B102 -> 8.3002104278700022E-3 | I102: 1179 | J102: =I102/B102 -> 1.5314472761281272E-2 | K102: 145 | L102: =K102/B102 -> 1.8834593302678409E-3 | M102: 2326 | N102: =M102/B102 -> 3.0213285532434467E-2 | O102: 314 | P102: =O102/B102 -> 4.0786636531317385E-3 | Q102: 5317 | R102: =Q102/B102 -> 6.9064505234718007E-2

A1: HB 5003 - J. Morrissey Voting Age Population
A2: DISTRICT | B2: Voting Age Population | C2: VAP White | D2: % VAP White | E2: VAP Black | F2: % VAP Black | G2: VAP AIAN | H2: % VAP AIAN | I2: VAP Asian | J2: % VAP Asian | K2: VAP HawPI | L2: % VAP HawPI | M2: VAP Other | N2: % VAP Other | O2: VAP Multi | P2: % VAP Multi | Q2: Voting Age Hispanic | R2: % VAP Hispanic
A3: 1 | B3: 63175 | C3: 59464 | D3: =C3/B3 -> 0.9412584091808468 | E3: 2650 | F3: =E3/B3 -> 4.1946972694895134E-2 | G3: 392 | H3: =G3/B3 -> 6.2049861495844872E-3 | I3: 241 | J3: =I3/B3 -> 3.8148001582904629E-3 | K3: 22 | L3: =K3/B3 -> 3.4823901859912942E-4 | M3: 332 | N3: =M3/B3 -> 5.2552433715868617E-3 | O3: 74 | P3: =O3/B3 -> 1.1713494261970717E-3 | Q3: 747 | R3: =Q3/B3 -> 1.182429758607044E-2
A4: 2 | B4: 67033 | C4: 64940 | D4: =C4/B4 -> 0.96877657273283313 | E4: 1420 | F4: =E4/B4 -> 2.1183596139215013E-2 | G4: 265 | H4: =G4/B4 -> 3.9532767442901256E-3 | I4: 181 | J4: =I4/B4 -> 2.7001626064774068E-3 | K4: 12 | L4: =K4/B4 -> 1.79016305401817E-4 | M4: 177 | N4: =M4/B4 -> 2.6404905046768009E-3 | O4: 38 | P4: =O4/B4 -> 5.6688496710575391E-4 | Q4: 392 | R4: =Q4/B4 -> 5.8478659764593559E-3
A5: 3 | B5: 67034 | C5: 63120 | D5: =C5/B5 -> 0.94161171942596289 | E5: 2021 | F5: =E5/B5 -> 3.0148879673001762E-2 | G5: 288 | H5: =G5/B5 -> 4.2963272369245459E-3 | I5: 1273 | J5: =I5/B5 -> 1.899036309932273E-2 | K5: 25 | L5: =K5/B5 -> 3.7294507264970013E-4 | M5: 228 | N5: =M5/B5 -> 3.4012590625652653E-3 | O5: 79 | P5: =O5/B5 -> 1.1785064295730524E-3 | Q5: 694 | R5: =Q5/B5 -> 1.0352955216755676E-2
A6: 4 | B6: 64751 | C6: 62300 | D6: =C6/B6 -> 0.96214730274435911 | E6: 1417 | F6: =E6/B6 -> 2.1883831909931893E-2 | G6: 301 | H6: =G6/B6 -> 4.6485768559558927E-3 | I6: 300 | J6: =I6/B6 -> 4.6331330790258069E-3 | K6: 19 | L6: =K6/B6 -> 2.9343176167163443E-4 | M6: 354 | N6: =M6/B6 -> 5.4670970332504516E-3 | O6: 60 | P6: =O6/B6 -> 9.2662661580516126E-4 | Q6: 753 | R6: =Q6/B6 -> 1.1629164028354774E-2
A7: 5 | B7: 62590 | C7: 59592 | D7: =C7/B7 -> 0.95210097459658094 | E7: 1723 | F7: =E7/B7 -> 2.7528359162805559E-2 | G7: 313 | H7: =G7/B7 -> 5.0007988496564943E-3 | I7: 230 | J7: =I7/B7 -> 3.6747084198753793E-3 | K7: 15 | L7: =K7/B7 -> 2.3965489694839431E-4 | M7: 646 | N7: =M7/B7 -> 1.0321137561910849E-2 | O7: 71 | P7: =O7/B7 -> 1.1343665122223998E-3 | Q7: 1313 | R7: =Q7/B7 -> 2.0977791979549448E-2
A8: 6 | B8: 63767 | C8: 59725 | D8: =C8/B8 -> 0.93661298163626949 | E8: 2730 | F8: =E8/B8 -> 4.2812112848338482E-2 | G8: 319 | H8: =G8/B8 -> 5.0025875452820428E-3 | I8: 490 | J8: =I8/B8 -> 7.6842253830351126E-3 | K8: 28 | L8: =K8/B8 -> 4.3909859331629211E-4 | M8: 396 | N8: =M8/B8 -> 6.210108676901846E-3 | O8: 79 | P8: =O8/B8 -> 1.2388853168566814E-3 | Q8: 947 | R8: =Q8/B8 -> 1.4850941709661737E-2
A9: 7 | B9: 67288 | C9: 59198 | D9: =C9/B9 -> 0.87977053858043042 | E9: 2799 | F9: =E9/B9 -> 4.159731304244442E-2 | G9: 356 | H9: =G9/B9 -> 5.290690762097254E-3 | I9: 4168 | J9: =I9/B9 -> 6.194269409107122E-2 | K9: 48 | L9: =K9/B9 -> 7.1335156342884317E-4 | M9: 524 | N9: =M9/B9 -> 7.7874212340982045E-3 | O9: 195 | P9: =O9/B9 -> 2.8979907264296756E-3 | Q9: 1676 | R9: =Q9/B9 -> 2.4907858756390441E-2
A10: 8 | B10: 63985 | C10: 58100 | D10: =C10/B10 -> 0.90802531843400802 | E10: 3349 | F10: =E10/B10 -> 5.2340392279440491E-2 | G10: 301 | H10: =G10/B10 -> 4.7042275533328128E-3 | I10: 1664 | J10: =I10/B10 -> 2.6006095178557474E-2 | K10: 30 | L10: =K10/B10 -> 4.6885988903649293E-4 | M10: 442 | N10: =M10/B10 -> 6.9078690318043288E-3 | O10: 99 | P10: =O10/B10 -> 1.5472376338204266E-3 | Q10: 1126 | R10: =Q10/B10 -> 1.7597874501836367E-2
A11: 9 | B11: 62327 | C11: 55820 | D11: =C11/B11 -> 0.89559901808205111 | E11: 5150 | F11: =E11/B11 -> 8.2628716286681531E-2 | G11: 335 | H11: =G11/B11 -> 5.374877661366663E-3 | I11: 270 | J11: =I11/B11 -> 4.3319909509522362E-3 | K11: 25 | L11: =K11/B11 -> 4.0111027323631811E-4 | M11: 664 | N11: =M11/B11 -> 1.0653488857156609E-2 | O11: 63 | P11: =O11/B11 -> 1.0107978885555216E-3 | Q11: 1222 | R11: =Q11/B11 -> 1.9606270155791229E-2
A12: 10 | B12: 64958 | C12: 49388 | D12: =C12/B12 -> 0.76030665968779831 | E12: 13627 | F12: =E12/B12 -> 0.20978170510175806 | G12: 296 | H12: =G12/B12 -> 4.5567905415807141E-3 | I12: 316 | J12: =I12/B12 -> 4.8646817943902212E-3 | K12: 14 | L12: =K12/B12 -> 2.1552387696665537E-4 | M12: 1205 | N12: =M12/B12 -> 1.8550447981772838E-2 | O12: 112 | P12: =O12/B12 -> 1.724191015733243E-3 | Q12: 1822 | R12: =Q12/B12 -> 2.8048893130946148E-2
A13: 11 | B13: 59599 | C13: 36894 | D13: =C13/B13 -> 0.61903723216832496 | E13: 19313 | F13: =E13/B13 -> 0.32404906122585947 | G13: 360 | H13: =G13/B13 -> 6.0403698048624981E-3 | I13: 1144 | J13: =I13/B13 -> 1.9194952935451936E-2 | K13: 34 | L13: =K13/B13 -> 5.7047937045923592E-4 | M13: 1533 | N13: =M13/B13 -> 2.5721908085706135E-2 | O13: 321 | P13: =O13/B13 -> 5.3859964093357273E-3 | Q13: 3200 | R13: =Q13/B13 -> 5.3692176043222205E-2
A14: 12 | B14: 60531 | C14: 56543 | D14: =C14/B14 -> 0.9341164031653203 | E14: 3100 | F14: =E14/B14 -> 5.1213427830367912E-2 | G14: 323 | H14: =G14/B14 -> 5.3361087707125276E-3 | I14: 280 | J14: =I14/B14 -> 4.6257289653235528E-3 | K14: 25 | L14: =K14/B14 -> 4.1301151476103156E-4 | M14: 195 | N14: =M14/B14 -> 3.221489815136046E-3 | O14: 65 | P14: =O14/B14 -> 1.0738299383786819E-3 | Q14: 606 | R14: =Q14/B14 -> 1.0011399117807405E-2
A15: 13 | B15: 53653 | C15: 32757 | D15: =C15/B15 -> 0.61053435968165803 | E15: 4225 | F15: =E15/B15 -> 7.8746761597673937E-2 | G15: 231 | H15: =G15/B15 -> 4.3054442435651319E-3 | I15: 14622 | J15: =I15/B15 -> 0.27252902913164223 | K15: 56 | L15: =K15/B15 -> 1.0437440590460925E-3 | M15: 1362 | N15: =M15/B15 -> 2.5385346578942463E-2 | O15: 400 | P15: =O15/B15 -> 7.4553147074720889E-3 | Q15: 3966 | R15: =Q15/B15 -> 7.3919445324585761E-2
A16: 14 | B16: 62624 | C16: 39614 | D16: =C16/B16 -> 0.63256898313745524 | E16: 21352 | F16: =E16/B16 -> 0.3409555442003066 | G16: 263 | H16: =G16/B16 -> 4.1996678589678081E-3 | I16: 445 | J16: =I16/B16 -> 7.1059018906489526E-3 | K16: 21 | L16: =K16/B16 -> 3.35334695963209E-4 | M16: 784 | N16: =M16/B16 -> 1.2519161982626469E-2 | O16: 145 | P16: =O16/B16 -> 2.3154062340316811E-3 | Q16: 1468 | R16: =Q16/B16 -> 2.3441492079713848E-2
A17: 15 | B17: 61259 | C17: 57100 | D17: =C17/B17 -> 0.9321079351605478 | E17: 1964 | F17: =E17/B17 -> 3.2060595177851418E-2 | G17: 469 | H17: =G17/B17 -> 7.6560178912486333E-3 | I17: 540 | J17: =I17/B17 -> 8.8150312607127111E-3 | K17: 22 | L17: =K17/B17 -> 3.5913090321422161E-4 | M17: 1067 | N17: =M17/B17 -> 1.7417848805889747E-2 | O17: 97 | P17: =O17/B17 -> 1.5834408005354315E-3 | Q17: 2365 | R17: =Q17/B17 -> 3.860657209552882E-2
A18: 16 | B18: 61950 | C18: 49282 | D18: =C18/B18 -> 0.79551251008878132 | E18: 11250 | F18: =E18/B18 -> 0.18159806295399517 | G18: 354 | H18: =G18/B18 -> 5.7142857142857143E-3 | I18: 482 | J18: =I18/B18 -> 7.7804681194511699E-3 | K18: 24 | L18: =K18/B18 -> 3.8740920096852298E-4 | M18: 421 | N18: =M18/B18 -> 6.7958030669895073E-3 | O18: 137 | P18: =O18/B18 -> 2.211460855528652E-3 | Q18: 932 | R18: =Q18/B18 -> 1.5044390637610977E-2
A19: 17 | B19: 59988 | C19: 55489 | D19: =C19/B19 -> 0.9250016670000667 | E19: 2819 | F19: =E19/B19 -> 4.6992731879709274E-2 | G19: 309 | H19: =G19/B19 -> 5.1510302060412084E-3 | I19: 896 | J19: =I19/B19 -> 1.4936320597452825E-2 | K19: 26 | L19: =K19/B19 -> 4.3342001733680068E-4 | M19: 369 | N19: =M19/B19 -> 6.1512302460492102E-3 | O19: 80 | P19: =O19/B19 -> 1.3336000533440021E-3 | Q19: 999 | R19: =Q19/B19 -> 1.6653330666133226E-2
A20: 18 | B20: 60075 | C20: 49418 | D20: =C20/B20 -> 0.8226050769870995 | E20: 5498 | F20: =E20/B20 -> 9.1518934665002077E-2 | G20: 400 | H20: =G20/B20 -> 6.6583437369954227E-3 | I20: 2987 | J20: =I20/B20 -> 4.9721181856013319E-2 | K20: 67 | L20: =K20/B20 -> 1.1152725759467333E-3 | M20: 1504 | N20: =M20/B20 -> 2.5035372451102787E-2 | O20: 201 | P20: =O20/B20 -> 3.3458177278401996E-3 | Q20: 3747 | R20: =Q20/B20 -> 6.2372034956304619E-2
A21: 19 | B21: 61833 | C21: 56160 | D21: =C21/B21 -> 0.90825287467856974 | E21: 4403 | F21: =E21/B21 -> 7.1207931040059513E-2 | G21: 396 | H21: =G21/B21 -> 6.4043471932463247E-3 | I21: 543 | J21: =I21/B21 -> 8.7817184998301885E-3 | K21: 18 | L21: =K21/B21 -> 2.9110669060210568E-4 | M21: 242 | N21: =M21/B21 -> 3.9137677292060873E-3 | O21: 71 | P21: =O21/B21 -> 1.1482541684860834E-3 | Q21: 780 | R21: =Q21/B21 -> 1.2614623259424579E-2
A22: 20 | B22: 64218 | C22: 57992 | D22: =C22/B22 -> 0.90304898937992462 | E22: 3786 | F22: =E22/B22 -> 5.895543305615248E-2 | G22: 269 | H22: =G22/B22 -> 4.1888567068423185E-3 | I22: 1025 | J22: =I22/B22 -> 1.5961256968451212E-2 | K22: 33 | L22: =K22/B22 -> 5.1387461459403907E-4 | M22: 985 | N22: =M22/B22 -> 1.5338378647731165E-2 | O22: 128 | P22: =O22/B22 -> 1.9932106263041514E-3 | Q22: 2106 | R22: =Q22/B22 -> 3.2794543585910489E-2
A23: 21 | B23: 59425 | C23: 43202 | D23: =C23/B23 -> 0.72700042069835924 | E23: 11052 | F23: =E23/B23 -> 0.1859823306689104 | G23: 556 | H23: =G23/B23 -> 9.3563315103071098E-3 | I23: 2088 | J23: =I23/B23 -> 3.5136726966764828E-2 | K23: 98 | L23: =K23/B23 -> 1.6491375683634834E-3 | M23: 2019 | N23: =M23/B23 -> 3.3975599495161969E-2 | O23: 410 | P23: =O23/B23 -> 6.8994530921329409E-3 | Q23: 5158 | R23: =Q23/B23 -> 8.6798485485906601E-2
A24: 22 | B24: 56721 | C24: 38655 | D24: =C24/B24 -> 0.68149362669910618 | E24: 4833 | F24: =E24/B24 -> 8.5206537261331788E-2 | G24: 239 | H24: =G24/B24 -> 4.2136069533329811E-3 | I24: 9146 | J24: =I24/B24 -> 0.16124539412210645 | K24: 70 | L24: =K24/B24 -> 1.2341108231519191E-3 | M24: 3376 | N24: =M24/B24 -> 5.9519401985155408E-2 | O24: 402 | P24: =O24/B24 -> 7.0873221558153069E-3 | Q24: 7567 | R24: =Q24/B24 -> 0.13340737998272245
A25: 23 | B25: 65703 | C25: 45289 | D25: =C25/B25 -> 0.6892988143615969 | E25: 17257 | F25: =E25/B25 -> 0.26265162930155395 | G25: 418 | H25: =G25/B25 -> 6.3619621630671358E-3 | I25: 1576 | J25: =I25/B25 -> 2.3986728155487573E-2 | K25: 41 | L25: =K25/B25 -> 6.2402021216687216E-4 | M25: 832 | N25: =M25/B25 -> 1.2663044305435064E-2 | O25: 290 | P25: =O25/B25 -> 4.4138015006925102E-3 | Q25: 1775 | R25: =Q25/B25 -> 2.7015509185273123E-2
A26: 24 | B26: 63424 | C26: 54774 | D26: =C26/B26 -> 0.86361629667003026 | E26: 6949 | F26: =E26/B26 -> 0.10956420282542886 | G26: 587 | H26: =G26/B26 -> 9.2551715438950553E-3 | I26: 494 | J26: =I26/B26 -> 7.7888496468213929E-3 | K26: 43 | L26: =K26/B26 -> 6.7797679112008074E-4 | M26: 418 | N26: =M26/B26 -> 6.5905650857719473E-3 | O26: 159 | P26: =O26/B26 -> 2.5069374369323916E-3 | Q26: 1121 | R26: =Q26/B26 -> 1.7674697275479313E-2
A27: 25 | B27: 59225 | C27: 54872 | D27: =C27/B27 -> 0.92650063317855635 | E27: 2937 | F27: =E27/B27 -> 4.9590544533558462E-2 | G27: 324 | H27: =G27/B27 -> 5.4706627268889824E-3 | I27: 456 | J27: =I27/B27 -> 7.6994512452511609E-3 | K27: 30 | L27: =K27/B27 -> 5.0654284508231317E-4 | M27: 523 | N27: =M27/B27 -> 8.830730265934993E-3 | O27: 83 | P27: =O27/B27 -> 1.4014352047277332E-3 | Q27: 1211 | R27: =Q27/B27 -> 2.044744617982271E-2
A28: 26 | B28: 64843 | C28: 56802 | D28: =C28/B28 -> 0.87599278256712365 | E28: 2567 | F28: =E28/B28 -> 3.9587927763983774E-2 | G28: 396 | H28: =G28/B28 -> 6.1070585876655927E-3 | I28: 1418 | J28: =I28/B28 -> 2.1868204740681338E-2 | K28: 64 | L28: =K28/B28 -> 9.8699936770353007E-4 | M28: 3419 | N28: =M28/B28 -> 5.2727356846537017E-2 | O28: 177 | P28: =O28/B28 -> 2.7296701263050754E-3 | Q28: 5910 | R28: =Q28/B28 -> 9.1143222861372858E-2
A29: 27 | B29: 60862 | C29: 38159 | D29: =C29/B29 -> 0.62697578127567288 | E29: 16849 | F29: =E29/B29 -> 0.27683940718346423 | G29: 502 | H29: =G29/B29 -> 8.2481679865926191E-3 | I29: 2050 | J29: =I29/B29 -> 3.3682757714173048E-2 | K29: 64 | L29: =K29/B29 -> 1.0515592652229635E-3 | M29: 2850 | N29: =M29/B29 -> 4.6827248529460089E-2 | O29: 388 | P29: =O29/B29 -> 6.375078045414216E-3 | Q29: 4880 | R29: =Q29/B29 -> 8.0181393973250956E-2
A30: 28 | B30: 60894 | C30: 44615 | D30: =C30/B30 -> 0.73266660097874992 | E30: 10866 | F30: =E30/B30 -> 0.17844122573652577 | G30: 449 | H30: =G30/B30 -> 7.373468650441751E-3 | I30: 1861 | J30: =I30/B30 -> 3.0561303248267481E-2 | K30: 90 | L30: =K30/B30 -> 1.4779781259237363E-3 | M30: 2638 | N30: =M30/B30 -> 4.3321181068742408E-2 | O30: 375 | P30: =O30/B30 -> 6.1582421913489015E-3 | Q30: 5037 | R30: =Q30/B30 -> 8.2717509114198437E-2
A31: 29 | B31: 60975 | C31: 53315 | D31: =C31/B31 -> 0.87437474374743751 | E31: 3708 | F31: =E31/B31 -> 6.0811808118081179E-2 | G31: 368 | H31: =G31/B31 -> 6.035260352603526E-3 | I31: 969 | J31: =I31/B31 -> 1.5891758917589177E-2 | K31: 34 | L31: =K31/B31 -> 5.5760557605576057E-4 | M31: 2428 | N31: =M31/B31 -> 3.9819598195981958E-2 | O31: 153 | P31: =O31/B31 -> 2.5092250922509225E-3 | Q31: 4379 | R31: =Q31/B31 -> 7.1816318163181625E-2
A32: 30 | B32: 62478 | C32: 50122 | D32: =C32/B32 -> 0.80223438650404943 | E32: 9098 | F32: =E32/B32 -> 0.14561925797880854 | G32: 449 | H32: =G32/B32 -> 7.1865296584397711E-3 | I32: 790 | J32: =I32/B32 -> 1.2644450846698038E-2 | K32: 51 | L32: =K32/B32 -> 8.1628733314126573E-4 | M32: 1774 | N32: =M32/B32 -> 2.8393994686129517E-2 | O32: 194 | P32: =O32/B32 -> 3.1050929927334422E-3 | Q32: 3393 | R32: =Q32/B32 -> 5.4307116104868915E-2
A33: 31 | B33: 58378 | C33: 33958 | D33: =C33/B33 -> 0.5816917331871595 | E33: 13836 | F33: =E33/B33 -> 0.23700709171263146 | G33: 577 | H33: =G33/B33 -> 9.883860358354174E-3 | I33: 4538 | J33: =I33/B33 -> 7.7734763095686735E-2 | K33: 151 | L33: =K33/B33 -> 2.5865908390146973E-3 | M33: 4722 | N33: =M33/B33 -> 8.0886635376340402E-2 | O33: 596 | P33: =O33/B33 -> 1.0209325430812977E-2 | Q33: 10430 | R33: =Q33/B33 -> 0.17866319503922712
A34: 32 | B34: 55962 | C34: 42528 | D34: =C34/B34 -> 0.75994424788249171 | E34: 4585 | F34: =E34/B34 -> 8.1930595761409528E-2 | G34: 314 | H34: =G34/B34 -> 5.6109502876952218E-3 | I34: 5379 | J34: =I34/B34 -> 9.6118794896536935E-2 | K34: 48 | L34: =K34/B34 -> 8.577248847432186E-4 | M34: 2780 | N34: =M34/B34 -> 4.9676566241378076E-2 | O34: 328 | P34: =O34/B34 -> 5.8611200457453268E-3 | Q34: 6309 | R34: =Q34/B34 -> 0.1127372145384368
A35: 33 | B35: 55145 | C35: 49548 | D35: =C35/B35 -> 0.89850394414724821 | E35: 2813 | F35: =E35/B35 -> 5.1010971076253513E-2 | G35: 295 | H35: =G35/B35 -> 5.3495330492338384E-3 | I35: 1182 | J35: =I35/B35 -> 2.1434400217608125E-2 | K35: 45 | L35: =K35/B35 -> 8.1603046513736518E-4 | M35: 1105 | N35: =M35/B35 -> 2.0038081421706412E-2 | O35: 157 | P35: =O35/B35 -> 2.8470396228125849E-3 | Q35: 2759 | R35: =Q35/B35 -> 5.0031734518088677E-2
A36: 34 | B36: 60313 | C36: 46135 | D36: =C36/B36 -> 0.76492630112910986 | E36: 2036 | F36: =E36/B36 -> 3.3757233100658236E-2 | G36: 207 | H36: =G36/B36 -> 3.4320958997231111E-3 | I36: 10834 | J36: =I36/B36 -> 0.17962959892560476 | K36: 55 | L36: =K36/B36 -> 9.119095385737735E-4 | M36: 770 | N36: =M36/B36 -> 1.2766733540032828E-2 | O36: 276 | P36: =O36/B36 -> 4.5761278662974818E-3 | Q36: 3142 | R36: =Q36/B36 -> 5.2094904912705388E-2
A37: 35 | B37: 59624 | C37: 44251 | D37: =C37/B37 -> 0.74216758352341339 | E37: 2600 | F37: =E37/B37 -> 4.3606601368576414E-2 | G37: 239 | H37: =G37/B37 -> 4.0084529719576012E-3 | I37: 10677 | J37: =I37/B37 -> 0.17907218569703476 | K37: 41 | L37: =K37/B37 -> 6.8764256004293577E-4 | M37: 1543 | N37: =M37/B37 -> 2.5878840735274387E-2 | O37: 273 | P37: =O37/B37 -> 4.5786931437005237E-3 | Q37: 4411 | R37: =Q37/B37 -> 7.3980276398765601E-2
A38: 36 | B38: 58512 | C38: 43334 | D38: =C38/B38 -> 0.7406002187585452 | E38: 4643 | F38: =E38/B38 -> 7.9351244189226136E-2 | G38: 299 | H38: =G38/B38 -> 5.1100628930817607E-3 | I38: 7548 | J38: =I38/B38 -> 0.12899917965545529 | K38: 43 | L38: =K38/B38 -> 7.3489198796827999E-4 | M38: 2338 | N38: =M38/B38 -> 3.9957615531856713E-2 | O38: 307 | P38: =O38/B38 -> 5.2467869838665575E-3 | Q38: 5709 | R38: =Q38/B38 -> 9.7569729286300241E-2
A39: 37 | B39: 60911 | C39: 41072 | D39: =C39/B39 -> 0.67429528328216581 | E39: 4071 | F39: =E39/B39 -> 6.6835218597626048E-2 | G39: 377 | H39: =G39/B39 -> 6.1893582439953377E-3 | I39: 11999 | J39: =I39/B39 -> 0.19699233307612746 | K39: 72 | L39: =K39/B39 -> 1.1820525028320007E-3 | M39: 2942 | N39: =M39/B39 -> 4.8299978657385369E-2 | O39: 378 | P39: =O39/B39 -> 6.2057756398680042E-3 | Q39: 7539 | R39: =Q39/B39 -> 0.12377074748403408
A40: 38 | B40: 61306 | C40: 36169 | D40: =C40/B40 -> 0.58997488010961407 | E40: 5992 | F40: =E40/B40 -> 9.7739209865266047E-2 | G40: 478 | H40: =G40/B40 -> 7.796952989919421E-3 | I40: 10809 | J40: =I40/B40 -> 0.17631226959840798 | K40: 57 | L40: =K40/B40 -> 9.2976217662219028E-4 | M40: 7338 | N40: =M40/B40 -> 0.11969464652725671 | O40: 463 | P40: =O40/B40 -> 7.5522787329135813E-3 | Q40: 15381 | R40: =Q40/B40 -> 0.25088898313378788
A41: 39 | B41: 59678 | C41: 34373 | D41: =C41/B41 -> 0.57597439592479638 | E41: 3752 | F41: =E41/B41 -> 6.287073963604678E-2 | G41: 433 | H41: =G41/B41 -> 7.2556050805992157E-3 | I41: 14352 | J41: =I41/B41 -> 0.24049063306411073 | K41: 63 | L41: =K41/B41 -> 1.0556654043366064E-3 | M41: 6286 | N41: =M41/B41 -> 0.10533194812158585 | O41: 419 | P41: =O41/B41 -> 7.0210127685244143E-3 | Q41: 12847 | R41: =Q41/B41 -> 0.21527195951606956
A42: 40 | B42: 56014 | C42: 35059 | D42: =C42/B42 -> 0.62589709715428288 | E42: 3803 | F42: =E42/B42 -> 6.7893740850501663E-2 | G42: 258 | H42: =G42/B42 -> 4.6059913593030312E-3 | I42: 14069 | J42: =I42/B42 -> 0.251169350519513 | K42: 64 | L42: =K42/B42 -> 1.1425714999821473E-3 | M42: 2388 | N42: =M42/B42 -> 4.263219909308387E-2 | O42: 373 | P42: =O42/B42 -> 6.6590495233334523E-3 | Q42: 5880 | R42: =Q42/B42 -> 0.10497375656085979
A43: 41 | B43: 58806 | C43: 41798 | D43: =C43/B43 -> 0.71077781178791277 | E43: 3615 | F43: =E43/B43 -> 6.1473319049076623E-2 | G43: 280 | H43: =G43/B43 -> 4.7614189028330443E-3 | I43: 10548 | J43: =I43/B43 -> 0.17936945209672484 | K43: 66 | L43: =K43/B43 -> 1.1223344556677891E-3 | M43: 2213 | N43: =M43/B43 -> 3.7632214399891166E-2 | O43: 286 | P43: =O43/B43 -> 4.8634493078937528E-3 | Q43: 6617 | R43: =Q43/B43 -> 0.11252253171445091
A44: 42 | B44: 59031 | C44: 37264 | D44: =C44/B44 -> 0.63126154054649253 | E44: 8305 | F44: =E44/B44 -> 0.14068879063542883 | G44: 352 | H44: =G44/B44 -> 5.96296860971354E-3 | I44: 10175 | J44: =I44/B44 -> 0.17236706137453203 | K44: 122 | L44: =K44/B44 -> 2.0667107113211702E-3 | M44: 2377 | N44: =M44/B44 -> 4.0266978367298541E-2 | O44: 436 | P44: =O44/B44 -> 7.3859497552133625E-3 | Q44: 6470 | R44: =Q44/B44 -> 0.10960342870695058
A45: 43 | B45: 59703 | C45: 37859 | D45: =C45/B45 -> 0.63412223841348003 | E45: 9260 | F45: =E45/B45 -> 0.15510108369763664 | G45: 368 | H45: =G45/B45 -> 6.1638443629298363E-3 | I45: 8491 | J45: =I45/B45 -> 0.14222065892836205 | K45: 78 | L45: =K45/B45 -> 1.3064670117079544E-3 | M45: 3224 | N45: =M45/B45 -> 5.4000636483928784E-2 | O45: 423 | P45: =O45/B45 -> 7.0850711019546757E-3 | Q45: 7920 | R45: =Q45/B45 -> 0.13265665041957692
A46: 44 | B46: 59332 | C46: 34015 | D46: =C46/B46 -> 0.57329939998651658 | E46: 12708 | F46: =E46/B46 -> 0.21418458841771726 | G46: 423 | H46: =G46/B46 -> 7.1293736937908716E-3 | I46: 4622 | J46: =I46/B46 -> 7.7900626980381582E-2 | K46: 76 | L46: =K46/B46 -> 1.2809276612957595E-3 | M46: 6929 | N46: =M46/B46 -> 0.11678352322524102 | O46: 559 | P46: =O46/B46 -> 9.4215600350569667E-3 | Q46: 13116 | R46: =Q46/B46 -> 0.22106114744151553
A47: 45 | B47: 65973 | C47: 52192 | D47: =C47/B47 -> 0.79111151531687207 | E47: 7314 | F47: =E47/B47 -> 0.11086353508253377 | G47: 402 | H47: =G47/B47 -> 6.0934018462098132E-3 | I47: 3324 | J47: =I47/B47 -> 5.0384248101496068E-2 | K47: 76 | L47: =K47/B47 -> 1.1519864186864323E-3 | M47: 2313 | N47: =M47/B47 -> 3.5059797189759448E-2 | O47: 352 | P47: =O47/B47 -> 5.335516044442423E-3 | Q47: 5727 | R47: =Q47/B47 -> 8.6808239734436812E-2
A48: 46 | B48: 64174 | C48: 33773 | D48: =C48/B48 -> 0.52627232212422481 | E48: 18289 | F48: =E48/B48 -> 0.28499080624551998 | G48: 385 | H48: =G48/B48 -> 5.9993143640726778E-3 | I48: 6410 | J48: =I48/B48 -> 9.9884688503132105E-2 | K48: 97 | L48: =K48/B48 -> 1.5115155670520771E-3 | M48: 4563 | N48: =M48/B48 -> 7.1103562190295136E-2 | O48: 657 | P48: =O48/B48 -> 1.0237791005703245E-2 | Q48: 10034 | R48: =Q48/B48 -> 0.15635615669897465
A49: 47 | B49: 65989 | C49: 48804 | D49: =C49/B49 -> 0.73957780842261589 | E49: 4629 | F49: =E49/B49 -> 7.0148054978860119E-2 | G49: 583 | H49: =G49/B49 -> 8.834805800966827E-3 | I49: 7184 | J49: =I49/B49 -> 0.1088666292866993 | K49: 68 | L49: =K49/B49 -> 1.0304747760990468E-3 | M49: 4250 | N49: =M49/B49 -> 6.4404673506190432E-2 | O49: 471 | P49: =O49/B49 -> 7.1375532285683982E-3 | Q49: 9264 | R49: =Q49/B49 -> 0.14038703420267015
A50: 48 | B50: 71185 | C50: 56759 | D50: =C50/B50 -> 0.79734494626676966 | E50: 4276 | F50: =E50/B50 -> 6.0068834726417081E-2 | G50: 369 | H50: =G50/B50 -> 5.1836763363068061E-3 | I50: 7804 | J50: =I50/B50 -> 0.10962983774671631 | K50: 94 | L50: =K50/B50 -> 1.3205029149399453E-3 | M50: 1514 | N50: =M50/B50 -> 2.1268525672543372E-2 | O50: 369 | P50: =O50/B50 -> 5.1836763363068061E-3 | Q50: 5510 | R50: =Q50/B50 -> 7.7403947460841463E-2
A51: 49 | B51: 62594 | C51: 33428 | D51: =C51/B51 -> 0.53404479662587467 | E51: 10057 | F51: =E51/B51 -> 0.16067035179090647 | G51: 721 | H51: =G51/B51 -> 1.1518675911429211E-2 | I51: 6762 | J51: =I51/B51 -> 0.10802952359651084 | K51: 93 | L51: =K51/B51 -> 1.485765408825127E-3 | M51: 10792 | N51: =M51/B51 -> 0.17241269131226636 | O51: 741 | P51: =O51/B51 -> 1.1838195354187302E-2 | Q51: 21214 | R51: =Q51/B51 -> 0.33891427293350801
A52: 50 | B52: 59678 | C52: 36435 | D52: =C52/B52 -> 0.6105264921746707 | E52: 8428 | F52: =E52/B52 -> 0.14122457186903045 | G52: 523 | H52: =G52/B52 -> 8.7636985153657972E-3 | I52: 4223 | J52: =I52/B52 -> 7.0763095277991891E-2 | K52: 96 | L52: =K52/B52 -> 1.6086329970843526E-3 | M52: 9474 | N52: =M52/B52 -> 0.15875196889976206 | O52: 499 | P52: =O52/B52 -> 8.3615402660947077E-3 | Q52: 17766 | R52: =Q52/B52 -> 0.29769764402292304
A53: 51 | B53: 61167 | C53: 38210 | D53: =C53/B53 -> 0.62468324423300148 | E53: 12160 | F53: =E53/B53 -> 0.19880000653947391 | G53: 670 | H53: =G53/B53 -> 1.0953618781369039E-2 | I53: 4882 | J53: =I53/B53 -> 7.981427894125917E-2 | K53: 109 | L53: =K53/B53 -> 1.7820066375660078E-3 | M53: 4560 | N53: =M53/B53 -> 7.4550002452302713E-2 | O53: 576 | P53: =O53/B53 -> 9.4168424150277118E-3 | Q53: 10252 | R53: =Q53/B53 -> 0.1676067160396946
A54: 52 | B54: 57330 | C54: 25542 | D54: =C54/B54 -> 0.4455259026687598 | E54: 18502 | F54: =E54/B54 -> 0.32272806558520845 | G54: 508 | H54: =G54/B54 -> 8.8609802895517186E-3 | I54: 4739 | J54: =I54/B54 -> 8.266178266178266E-2 | K54: 113 | L54: =K54/B54 -> 1.9710448281876855E-3 | M54: 7132 | N54: =M54/B54 -> 0.12440258154543869 | O54: 794 | P54: =O54/B54 -> 1.3849642421070993E-2 | Q54: 13610 | R54: =Q54/B54 -> 0.23739752311180884
A55: 53 | B55: 60437 | C55: 40048 | D55: =C55/B55 -> 0.66264043549481277 | E55: 2647 | F55: =E55/B55 -> 4.3797673610536589E-2 | G55: 350 | H55: =G55/B55 -> 5.7911544252692883E-3 | I55: 13739 | J55: =I55/B55 -> 0.22732763042507073 | K55: 50 | L55: =K55/B55 -> 8.2730777503846982E-4 | M55: 3227 | N55: =M55/B55 -> 5.3394443800982842E-2 | O55: 376 | P55: =O55/B55 -> 6.2213544682892929E-3 | Q55: 8002 | R55: =Q55/B55 -> 0.1324023363171567
A56: 54 | B56: 60957 | C56: 46093 | D56: =C56/B56 -> 0.75615597880473118 | E56: 11784 | F56: =E56/B56 -> 0.19331660022638911 | G56: 549 | H56: =G56/B56 -> 9.0063487376347267E-3 | I56: 1136 | J56: =I56/B56 -> 1.863608773397641E-2 | K56: 67 | L56: =K56/B56 -> 1.0991354561412142E-3 | M56: 1032 | N56: =M56/B56 -> 1.6929967025936316E-2 | O56: 296 | P56: =O56/B56 -> 4.8558820151910365E-3 | Q56: 2507 | R56: =Q56/B56 -> 4.1127352067851106E-2
A57: 55 | B57: 59302 | C57: 51395 | D57: =C57/B57 -> 0.86666554247748806 | E57: 6037 | F57: =E57/B57 -> 0.10180095106404506 | G57: 389 | H57: =G57/B57 -> 6.5596438568682339E-3 | I57: 892 | J57: =I57/B57 -> 1.5041651209065461E-2 | K57: 22 | L57: =K57/B57 -> 3.709824289231392E-4 | M57: 439 | N57: =M57/B57 -> 7.4027857407844592E-3 | O57: 128 | P57: =O57/B57 -> 2.158443222825537E-3 | Q57: 1135 | R57: =Q57/B57 -> 1.9139320764898316E-2
A58: 56 | B58: 60337 | C58: 47298 | D58: =C58/B58 -> 0.7838971112252846 | E58: 9025 | F58: =E58/B58 -> 0.14957654507184645 | G58: 331 | H58: =G58/B58 -> 5.4858544508344801E-3 | I58: 3106 | J58: =I58/B58 -> 5.1477534514477022E-2 | K58: 32 | L58: =K58/B58 -> 5.3035450884200404E-4 | M58: 353 | N58: =M58/B58 -> 5.8504731756633573E-3 | O58: 192 | P58: =O58/B58 -> 3.1821270530520245E-3 | Q58: 1112 | R58: =Q58/B58 -> 1.8429819182259641E-2
A59: 57 | B59: 60390 | C59: 51528 | D59: =C59/B59 -> 0.8532538499751614 | E59: 4666 | F59: =E59/B59 -> 7.7264447756251034E-2 | G59: 323 | H59: =G59/B59 -> 5.3485676436496113E-3 | I59: 2683 | J59: =I59/B59 -> 4.4427885411491966E-2 | K59: 27 | L59: =K59/B59 -> 4.4709388971684054E-4 | M59: 945 | N59: =M59/B59 -> 1.564828614008942E-2 | O59: 218 | P59: =O59/B59 -> 3.6098691836396754E-3 | Q59: 2297 | R59: =Q59/B59 -> 3.8036098691836398E-2
A60: 58 | B60: 62815 | C60: 47604 | D60: =C60/B60 -> 0.75784446390193427 | E60: 9280 | F60: =E60/B60 -> 0.14773541351587996 | G60: 364 | H60: =G60/B60 -> 5.7947942370452921E-3 | I60: 4009 | J60: =I60/B60 -> 6.3822335429435648E-2 | K60: 37 | L60: =K60/B60 -> 5.8903128233702144E-4 | M60: 1258 | N60: =M60/B60 -> 2.0027063599458727E-2 | O60: 263 | P60: =O60/B60 -> 4.1868980339090983E-3 | Q60: 2986 | R60: =Q60/B60 -> 4.7536416461036374E-2
A61: 59 | B61: 65192 | C61: 48417 | D61: =C61/B61 -> 0.74268315130690887 | E61: 14382 | F61: =E61/B61 -> 0.22060989078414531 | G61: 375 | H61: =G61/B61 -> 5.7522395385936924E-3 | I61: 881 | J61: =I61/B61 -> 1.3513928089336115E-2 | K61: 47 | L61: =K61/B61 -> 7.2094735550374276E-4 | M61: 925 | N61: =M61/B61 -> 1.4188857528531109E-2 | O61: 165 | P61: =O61/B61 -> 2.5309853969812247E-3 | Q61: 1959 | R61: =Q61/B61 -> 3.0049699349613448E-2
A62: 60 | B62: 62653 | C62: 41855 | D62: =C62/B62 -> 0.6680446267537069 | E62: 19674 | F62: =E62/B62 -> 0.31401529056868788 | G62: 328 | H62: =G62/B62 -> 5.2351842689097091E-3 | I62: 250 | J62: =I62/B62 -> 3.9902319122787416E-3 | K62: 18 | L62: =K62/B62 -> 2.8729669768406941E-4 | M62: 390 | N62: =M62/B62 -> 6.2247617831548367E-3 | O62: 138 | P62: =O62/B62 -> 2.2026080155778654E-3 | Q62: 857 | R62: =Q62/B62 -> 1.3678514995291526E-2
A63: 61 | B63: 65779 | C63: 42141 | D63: =C63/B63 -> 0.64064519071436177 | E63: 21912 | F63: =E63/B63 -> 0.33311543197677068 | G63: 397 | H63: =G63/B63 -> 6.0353608294440473E-3 | I63: 307 | J63: =I63/B63 -> 4.6671430091670598E-3 | K63: 23 | L63: =K63/B63 -> 3.4965566518189696E-4 | M63: 812 | N63: =M63/B63 -> 1.2344365222943493E-2 | O63: 187 | P63: =O63/B63 -> 2.8428525821310754E-3 | Q63: 1599 | R63: =Q63/B63 -> 2.4308669940254487E-2
A64: 62 | B64: 61467 | C64: 37550 | D64: =C64/B64 -> 0.61089690402980457 | E64: 19761 | F64: =E64/B64 -> 0.32148957977451315 | G64: 886 | H64: =G64/B64 -> 1.4414238534498186E-2 | I64: 1558 | J64: =I64/B64 -> 2.5346934127255274E-2 | K64: 102 | L64: =K64/B64 -> 1.6594270096149154E-3 | M64: 1216 | N64: =M64/B64 -> 1.9782972977369973E-2 | O64: 394 | P64: =O64/B64 -> 6.4099435469438882E-3 | Q64: 2923 | R64: =Q64/B64 -> 4.7553972050043115E-2
A65: 63 | B65: 62856 | C65: 26483 | D65: =C65/B65 -> 0.42132811505663742 | E65: 34323 | F65: =E65/B65 -> 0.54605765559373809 | G65: 320 | H65: =G65/B65 -> 5.0910016545755374E-3 | I65: 617 | J65: =I65/B65 -> 9.8160875652284589E-3 | K65: 38 | L65: =K65/B65 -> 6.0455644648084515E-4 | M65: 752 | N65: =M65/B65 -> 1.1963853888252513E-2 | O65: 323 | P65: =O65/B65 -> 5.1387297950871835E-3 | Q65: 1626 | R65: =Q65/B65 -> 2.5868652157311951E-2
A66: 64 | B66: 64687 | C66: 49593 | D66: =C66/B66 -> 0.76666099834588097 | E66: 11791 | F66: =E66/B66 -> 0.18227773741246309 | G66: 365 | H66: =G66/B66 -> 5.6425556912517195E-3 | I66: 1907 | J66: =I66/B66 -> 2.9480421104704189E-2 | K66: 50 | L66: =K66/B66 -> 7.7295283441804381E-4 | M66: 733 | N66: =M66/B66 -> 1.1331488552568523E-2 | O66: 248 | P66: =O66/B66 -> 3.8338460587134973E-3 | Q66: 2044 | R66: =Q66/B66 -> 3.1598311871009629E-2
A67: 65 | B67: 61215 | C67: 52236 | D67: =C67/B67 -> 0.8533202646410194 | E67: 6087 | F67: =E67/B67 -> 9.9436412643959818E-2 | G67: 266 | H67: =G67/B67 -> 4.3453401943967978E-3 | I67: 2084 | J67: =I67/B67 -> 3.4043943477905743E-2 | K67: 28 | L67: =K67/B67 -> 4.5740423098913663E-4 | M67: 369 | N67: =M67/B67 -> 6.0279343298211222E-3 | O67: 145 | P67: =O67/B67 -> 2.3687004819080292E-3 | Q67: 1277 | R67: =Q67/B67 -> 2.0860900106183126E-2
A68: 66 | B68: 60413 | C68: 47243 | D68: =C68/B68 -> 0.78200056279277641 | E68: 9618 | F68: =E68/B68 -> 0.15920414480327083 | G68: 394 | H68: =G68/B68 -> 6.5217751146276464E-3 | I68: 1796 | J68: =I68/B68 -> 2.9728700776322978E-2 | K68: 55 | L68: =K68/B68 -> 9.1040007945309787E-4 | M68: 1037 | N68: =M68/B68 -> 1.7165179679870225E-2 | O68: 270 | P68: =O68/B68 -> 4.4692367536788439E-3 | Q68: 2463 | R68: =Q68/B68 -> 4.0769370830781457E-2
A69: 67 | B69: 57930 | C69: 36956 | D69: =C69/B69 -> 0.63794234420852758 | E69: 4004 | F69: =E69/B69 -> 6.9117900914897293E-2 | G69: 271 | H69: =G69/B69 -> 4.6780597272570341E-3 | I69: 13663 | J69: =I69/B69 -> 0.23585361643362679 | K69: 98 | L69: =K69/B69 -> 1.6916968755394442E-3 | M69: 2619 | N69: =M69/B69 -> 4.520973588814086E-2 | O69: 319 | P69: =O69/B69 -> 5.5066459520110482E-3 | Q69: 6308 | R69: =Q69/B69 -> 0.10889003970308994
A70: 68 | B70: 65251 | C70: 53789 | D70: =C70/B70 -> 0.82433985686043121 | E70: 7613 | F70: =E70/B70 -> 0.11667254141698978 | G70: 351 | H70: =G70/B70 -> 5.379227904553187E-3 | I70: 2225 | J70: =I70/B70 -> 3.4099094266754532E-2 | K70: 33 | L70: =K70/B70 -> 5.0573937564175257E-4 | M70: 983 | N70: =M70/B70 -> 1.5064903219874025E-2 | O70: 257 | P70: =O70/B70 -> 3.9386369557554675E-3 | Q70: 2398 | R70: =Q70/B70 -> 3.6750394629967355E-2
A71: 69 | B71: 59970 | C71: 21664 | D71: =C71/B71 -> 0.36124729031182257 | E71: 31855 | F71: =E71/B71 -> 0.53118225779556449 | G71: 396 | H71: =G71/B71 -> 6.6033016508254124E-3 | I71: 1255 | J71: =I71/B71 -> 2.0927130231782557E-2 | K71: 63 | L71: =K71/B71 -> 1.0505252626313156E-3 | M71: 4253 | N71: =M71/B71 -> 7.0918792729698185E-2 | O71: 484 | P71: =O71/B71 -> 8.0707020176755042E-3 | Q71: 6573 | R71: =Q71/B71 -> 0.1096048024012006
A72: 70 | B72: 59060 | C72: 17415 | D72: =C72/B72 -> 0.29486962411107348 | E72: 36480 | F72: =E72/B72 -> 0.61767693870640028 | G72: 479 | H72: =G72/B72 -> 8.1103962072468679E-3 | I72: 736 | J72: =I72/B72 -> 1.2461903149339655E-2 | K72: 67 | L72: =K72/B72 -> 1.1344395529969522E-3 | M72: 3354 | N72: =M72/B72 -> 5.6789705384354891E-2 | O72: 529 | P72: =O72/B72 -> 8.9569928885878773E-3 | Q72: 5218 | R72: =Q72/B72 -> 8.8350829664747721E-2
A73: 71 | B73: 64596 | C73: 29092 | D73: =C73/B73 -> 0.45036844386649327 | E73: 30755 | F73: =E73/B73 -> 0.47611307201684316 | G73: 327 | H73: =G73/B73 -> 5.0622329556009663E-3 | I73: 3205 | J73: =I73/B73 -> 4.9616075298780107E-2 | K73: 42 | L73: =K73/B73 -> 6.5019505851755528E-4 | M73: 620 | N73: =M73/B73 -> 9.5981175304972449E-3 | O73: 555 | P73: =O73/B73 -> 8.5918632732676949E-3 | Q73: 1794 | R73: =Q73/B73 -> 2.7772617499535576E-2
A74: 72 | B74: 64102 | C74: 48062 | D74: =C74/B74 -> 0.74977379800942245 | E74: 7182 | F74: =E74/B74 -> 0.11204018595363639 | G74: 245 | H74: =G74/B74 -> 3.8220336338959781E-3 | I74: 7255 | J74: =I74/B74 -> 0.11317899597516458 | K74: 28 | L74: =K74/B74 -> 4.3680384387382611E-4 | M74: 989 | N74: =M74/B74 -> 1.5428535771114785E-2 | O74: 341 | P74: =O74/B74 -> 5.3196468128919533E-3 | Q74: 2431 | R74: =Q74/B74 -> 3.7923933730616831E-2
A75: 73 | B75: 63372 | C75: 46289 | D75: =C75/B75 -> 0.7304329988007322 | E75: 10311 | F75: =E75/B75 -> 0.16270592690778263 | G75: 344 | H75: =G75/B75 -> 5.4282648488291358E-3 | I75: 3656 | J75: =I75/B75 -> 5.7691093858486399E-2 | K75: 40 | L75: =K75/B75 -> 6.3119358707315533E-4 | M75: 2426 | N75: =M75/B75 -> 3.8281891055986873E-2 | O75: 306 | P75: =O75/B75 -> 4.8286309411096386E-3 | Q75: 4801 | R75: =Q75/B75 -> 7.5759010288455469E-2
A76: 74 | B76: 61607 | C76: 26115 | D76: =C76/B76 -> 0.42389663512263215 | E76: 32552 | F76: =E76/B76 -> 0.52838151508757125 | G76: 409 | H76: =G76/B76 -> 6.6388559741587805E-3 | I76: 1262 | J76: =I76/B76 -> 2.0484685181878681E-2 | K76: 33 | L76: =K76/B76 -> 5.3565341600792123E-4 | M76: 844 | N76: =M76/B76 -> 1.3699741912445015E-2 | O76: 392 | P76: =O76/B76 -> 6.3629133053062156E-3 | Q76: 1677 | R76: =Q76/B76 -> 2.7220932686220722E-2
A77: 75 | B77: 61652 | C77: 29017 | D77: =C77/B77 -> 0.47065788619996107 | E77: 31488 | F77: =E77/B77 -> 0.51073768896386162 | G77: 266 | H77: =G77/B77 -> 4.3145396743009146E-3 | I77: 269 | J77: =I77/B77 -> 4.3631998961915263E-3 | K77: 20 | L77: =K77/B77 -> 3.2440147927074547E-4 | M77: 413 | N77: =M77/B77 -> 6.6988905469408944E-3 | O77: 179 | P77: =O77/B77 -> 2.903393239473172E-3 | Q77: 879 | R77: =Q77/B77 -> 1.4257445013949264E-2
A78: 76 | B78: 59368 | C78: 37849 | D78: =C78/B78 -> 0.63753200377307639 | E78: 18805 | F78: =E78/B78 -> 0.31675313300094327 | G78: 370 | H78: =G78/B78 -> 6.2323137043525136E-3 | I78: 1513 | J78: =I78/B78 -> 2.5485109823473927E-2 | K78: 47 | L78: =K78/B78 -> 7.9167228136369763E-4 | M78: 498 | N78: =M78/B78 -> 8.388357364236626E-3 | O78: 286 | P78: =O78/B78 -> 4.8174100525535642E-3 | Q78: 1404 | R78: =Q78/B78 -> 2.364910389435386E-2
A79: 77 | B79: 58996 | C79: 30008 | D79: =C79/B79 -> 0.50864465387483893 | E79: 26053 | F79: =E79/B79 -> 0.4416062105905485 | G79: 478 | H79: =G79/B79 -> 8.1022442199471158E-3 | I79: 1063 | J79: =I79/B79 -> 1.8018170723438878E-2 | K79: 57 | L79: =K79/B79 -> 9.6616719777612044E-4 | M79: 991 | N79: =M79/B79 -> 1.6797748999932197E-2 | O79: 346 | P79: =O79/B79 -> 5.8648043935182045E-3 | Q79: 2344 | R79: =Q79/B79 -> 3.9731507220828528E-2
A80: 78 | B80: 58182 | C80: 45220 | D80: =C80/B80 -> 0.77721632119899631 | E80: 9964 | F80: =E80/B80 -> 0.17125571482589116 | G80: 411 | H80: =G80/B80 -> 7.0640404248736724E-3 | I80: 1857 | J80: =I80/B80 -> 3.1917087759100751E-2 | K80: 81 | L80: =K80/B80 -> 1.3921831494276581E-3 | M80: 413 | N80: =M80/B80 -> 7.0984153174521326E-3 | O80: 236 | P80: =O80/B80 -> 4.0562373242583613E-3 | Q80: 1717 | R80: =Q80/B80 -> 2.9510845278608505E-2
A81: 79 | B81: 59452 | C81: 34102 | D81: =C81/B81 -> 0.57360559779317766 | E81: 21891 | F81: =E81/B81 -> 0.36821301217789143 | G81: 461 | H81: =G81/B81 -> 7.7541546121240668E-3 | I81: 1880 | J81: =I81/B81 -> 3.1622148960505955E-2 | K81: 78 | L81: =K81/B81 -> 1.3119827760209918E-3 | M81: 593 | N81: =M81/B81 -> 9.9744331561595918E-3 | O81: 447 | P81: =O81/B81 -> 7.5186705241202991E-3 | Q81: 1858 | R81: =Q81/B81 -> 3.1252102536500036E-2
A82: 80 | B82: 61433 | C82: 22326 | D82: =C82/B82 -> 0.36342031155893412 | E82: 36438 | F82: =E82/B82 -> 0.59313398336399004 | G82: 355 | H82: =G82/B82 -> 5.7786531668647147E-3 | I82: 1104 | J82: =I82/B82 -> 1.7970797454137027E-2 | K82: 64 | L82: =K82/B82 -> 1.0417853596601176E-3 | M82: 717 | N82: =M82/B82 -> 1.1671251607442255E-2 | O82: 429 | P82: =O82/B82 -> 6.983217488971725E-3 | Q82: 1756 | R82: =Q82/B82 -> 2.8583985805674474E-2
A83: 81 | B83: 62896 | C83: 50186 | D83: =C83/B83 -> 0.79792037649453063 | E83: 8049 | F83: =E83/B83 -> 0.12797316204528109 | G83: 498 | H83: =G83/B83 -> 7.9178326125667765E-3 | I83: 2448 | J83: =I83/B83 -> 3.8921394047316205E-2 | K83: 130 | L83: =K83/B83 -> 2.066904095649962E-3 | M83: 1199 | N83: =M83/B83 -> 1.9063215466802341E-2 | O83: 386 | P83: =O83/B83 -> 6.1371152378529633E-3 | Q83: 3388 | R83: =Q83/B83 -> 5.3866700585092853E-2
A84: 82 | B84: 61378 | C84: 40834 | D84: =C84/B84 -> 0.66528723646909316 | E84: 13503 | F84: =E84/B84 -> 0.21999739320277623 | G84: 544 | H84: =G84/B84 -> 8.8631105607872521E-3 | I84: 4118 | J84: =I84/B84 -> 6.7092443546547628E-2 | K84: 167 | L84: =K84/B84 -> 2.7208446023004986E-3 | M84: 1631 | N84: =M84/B84 -> 2.6573039199713253E-2 | O84: 581 | P84: =O84/B84 -> 9.4659324187819742E-3 | Q84: 4340 | R84: =Q84/B84 -> 7.070937469451595E-2
A85: 83 | B85: 64823 | C85: 50529 | D85: =C85/B85 -> 0.77949184702960372 | E85: 8988 | F85: =E85/B85 -> 0.13865448991870169 | G85: 464 | H85: =G85/B85 -> 7.15795319562501E-3 | I85: 3367 | J85: =I85/B85 -> 5.194144053808062E-2 | K85: 71 | L85: =K85/B85 -> 1.0952902519167579E-3 | M85: 1000 | N85: =M85/B85 -> 1.5426623266433211E-2 | O85: 404 | P85: =O85/B85 -> 6.2323557996390166E-3 | Q85: 3035 | R85: =Q85/B85 -> 4.6819801613624791E-2
A86: 84 | B86: 60058 | C86: 36923 | D86: =C86/B86 -> 0.61478903726397816 | E86: 14802 | F86: =E86/B86 -> 0.24646175363814979 | G86: 443 | H86: =G86/B86 -> 7.3762030037630294E-3 | I86: 6229 | J86: =I86/B86 -> 0.10371640747277631 | K86: 95 | L86: =K86/B86 -> 1.5818042558859769E-3 | M86: 1094 | N86: =M86/B86 -> 1.8215724799360618E-2 | O86: 472 | P86: =O86/B86 -> 7.859069566086117E-3 | Q86: 3429 | R86: =Q86/B86 -> 5.7094808351926471E-2
A87: 85 | B87: 62446 | C87: 38933 | D87: =C87/B87 -> 0.6234666752073792 | E87: 14089 | F87: =E87/B87 -> 0.22561893475963232 | G87: 453 | H87: =G87/B87 -> 7.2542676872818113E-3 | I87: 7306 | J87: =I87/B87 -> 0.11699708548185632 | K87: 100 | L87: =K87/B87 -> 1.6013835954264484E-3 | M87: 1082 | N87: =M87/B87 -> 1.7326970502514173E-2 | O87: 483 | P87: =O87/B87 -> 7.7346827659097459E-3 | Q87: 3083 | R87: =Q87/B87 -> 4.9370656246997408E-2
A88: 86 | B88: 60067 | C88: 30581 | D88: =C88/B88 -> 0.50911482178234302 | E88: 6055 | F88: =E88/B88 -> 0.10080410208600396 | G88: 387 | H88: =G88/B88 -> 6.442805533820567E-3 | I88: 14465 | J88: =I88/B88 -> 0.24081442389331914 | K88: 55 | L88: =K88/B88 -> 9.1564419731300054E-4 | M88: 7922 | N88: =M88/B88 -> 0.13188606056570162 | O88: 602 | P88: =O88/B88 -> 1.002214194149866E-2 | Q88: 14600 | R88: =Q88/B88 -> 0.24306191419581466
A89: 87 | B89: 68596 | C89: 45410 | D89: =C89/B89 -> 0.66199195288355006 | E89: 16014 | F89: =E89/B89 -> 0.23345384570528893 | G89: 812 | H89: =G89/B89 -> 1.183742492273602E-2 | I89: 2720 | J89: =I89/B89 -> 3.965245786926351E-2 | K89: 204 | L89: =K89/B89 -> 2.9739343401947635E-3 | M89: 2260 | N89: =M89/B89 -> 3.2946527494314537E-2 | O89: 1176 | P89: =O89/B89 -> 1.7143856784652165E-2 | Q89: 6222 | R89: =Q89/B89 -> 9.0704997375940288E-2
A90: 88 | B90: 58674 | C90: 46561 | D90: =C90/B90 -> 0.7935542148140573 | E90: 7509 | F90: =E90/B90 -> 0.12797832089170671 | G90: 481 | H90: =G90/B90 -> 8.1978389065003234E-3 | I90: 2187 | J90: =I90/B90 -> 3.727374987217507E-2 | K90: 84 | L90: =K90/B90 -> 1.4316392269148174E-3 | M90: 1521 | N90: =M90/B90 -> 2.5922896001636161E-2 | O90: 331 | P90: =O90/B90 -> 5.6413402870095783E-3 | Q90: 3905 | R90: =Q90/B90 -> 6.6554180727409068E-2
A91: 89 | B91: 62592 | C91: 25586 | D91: =C91/B91 -> 0.40877428425357876 | E91: 31695 | F91: =E91/B91 -> 0.50637461656441718 | G91: 549 | H91: =G91/B91 -> 8.7710889570552144E-3 | I91: 2518 | J91: =I91/B91 -> 4.0228783231083844E-2 | K91: 119 | L91: =K91/B91 -> 1.9012014314928425E-3 | M91: 1462 | N91: =M91/B91 -> 2.3357617586912065E-2 | O91: 663 | P91: =O91/B91 -> 1.0592407975460122E-2 | Q91: 3577 | R91: =Q91/B91 -> 5.7147878323108386E-2
A92: 90 | B92: 59183 | C92: 23320 | D92: =C92/B92 -> 0.39403207002010715 | E92: 31505 | F92: =E92/B92 -> 0.53233191963908555 | G92: 381 | H92: =G92/B92 -> 6.4376594630214754E-3 | I92: 2059 | J92: =I92/B92 -> 3.479039589071186E-2 | K92: 94 | L92: =K92/B92 -> 1.5882939357585793E-3 | M92: 1268 | N92: =M92/B92 -> 2.1425071388743389E-2 | O92: 556 | P92: =O92/B92 -> 9.3945896625720216E-3 | Q92: 2931 | R92: =Q92/B92 -> 4.9524356656472299E-2
A93: 91 | B93: 52465 | C93: 35802 | D93: =C93/B93 -> 0.68239778900219195 | E93: 6633 | F93: =E93/B93 -> 0.12642714190412657 | G93: 405 | H93: =G93/B93 -> 7.719432002287239E-3 | I93: 5510 | J93: =I93/B93 -> 0.1050223958829696 | K93: 59 | L93: =K93/B93 -> 1.1245592299628324E-3 | M93: 3645 | N93: =M93/B93 -> 6.9474888020585157E-2 | O93: 411 | P93: =O93/B93 -> 7.8337939578766794E-3 | Q93: 8063 | R93: =Q93/B93 -> 0.15368340798627655
A94: 92 | B94: 60992 | C94: 24319 | D94: =C94/B94 -> 0.39872442287513116 | E94: 33304 | F94: =E94/B94 -> 0.54603882476390342 | G94: 514 | H94: =G94/B94 -> 8.4273347324239252E-3 | I94: 1203 | J94: =I94/B94 -> 1.9723898216159497E-2 | K94: 70 | L94: =K94/B94 -> 1.147691500524659E-3 | M94: 817 | N94: =M94/B94 -> 1.3395199370409235E-2 | O94: 765 | P94: =O94/B94 -> 1.2542628541448058E-2 | Q94: 2318 | R94: =Q94/B94 -> 3.8004984260230849E-2
A95: 93 | B95: 58264 | C95: 46360 | D95: =C95/B95 -> 0.79568858986681312 | E95: 7525 | F95: =E95/B95 -> 0.12915350816971027 | G95: 389 | H95: =G95/B95 -> 6.6765069339557873E-3 | I95: 2865 | J95: =I95/B95 -> 4.9172731017437868E-2 | K95: 83 | L95: =K95/B95 -> 1.4245503226692298E-3 | M95: 674 | N95: =M95/B95 -> 1.1568035150350131E-2 | O95: 368 | P95: =O95/B95 -> 6.3160785390635726E-3 | Q95: 1936 | R95: =Q95/B95 -> 3.3228065357682274E-2
A96: 94 | B96: 62719 | C96: 39363 | D96: =C96/B96 -> 0.62760885855960713 | E96: 17958 | F96: =E96/B96 -> 0.28632471818747113 | G96: 539 | H96: =G96/B96 -> 8.5938870198823316E-3 | I96: 2481 | J96: =I96/B96 -> 3.9557390902278416E-2 | K96: 135 | L96: =K96/B96 -> 2.1524577879111595E-3 | M96: 1560 | N96: =M96/B96 -> 2.4872845549195617E-2 | O96: 683 | P96: =O96/B96 -> 1.0889841993654236E-2 | Q96: 4225 | R96: =Q96/B96 -> 6.7363956695738136E-2
A97: 95 | B97: 59312 | C97: 20520 | D97: =C97/B97 -> 0.34596708929053144 | E97: 35458 | F97: =E97/B97 -> 0.59782168869705965 | G97: 407 | H97: =G97/B97 -> 6.8620178041543028E-3 | I97: 1372 | J97: =I97/B97 -> 2.3131912597787969E-2 | K97: 76 | L97: =K97/B97 -> 1.2813595899649312E-3 | M97: 786 | N97: =M97/B97 -> 1.3251955759374157E-2 | O97: 693 | P97: =O97/B97 -> 1.1683976261127596E-2 | Q97: 2086 | R97: =Q97/B97 -> 3.5169948745616401E-2
A98: 96 | B98: 61095 | C98: 37368 | D98: =C98/B98 -> 0.61163761355266388 | E98: 17873 | F98: =E98/B98 -> 0.29254439806858173 | G98: 503 | H98: =G98/B98 -> 8.2330796300842946E-3 | I98: 2497 | J98: =I98/B98 -> 4.0870775022505933E-2 | K98: 148 | L98: =K98/B98 -> 2.4224568295277845E-3 | M98: 2142 | N98: =M98/B98 -> 3.5060152221949421E-2 | O98: 564 | P98: =O98/B98 -> 9.2315246746869622E-3 | Q98: 4550 | R98: =Q98/B98 -> 7.4474179556428516E-2
A99: 97 | B99: 63677 | C99: 52252 | D99: =C99/B99 -> 0.82057885892865556 | E99: 8731 | F99: =E99/B99 -> 0.13711387157058277 | G99: 721 | H99: =G99/B99 -> 1.132276960283933E-2 | I99: 1095 | J99: =I99/B99 -> 1.7196161879485528E-2 | K99: 49 | L99: =K99/B99 -> 7.6950861378519717E-4 | M99: 572 | N99: =M99/B99 -> 8.982835246635363E-3 | O99: 257 | P99: =O99/B99 -> 4.0359941580162383E-3 | Q99: 1570 | R99: =Q99/B99 -> 2.4655684155974685E-2
A100: 98 | B100: 63186 | C100: 50726 | D100: =C100/B100 -> 0.80280441870034502 | E100: 10634 | F100: =E100/B100 -> 0.16829677460196879 | G100: 655 | H100: =G100/B100 -> 1.0366220365270788E-2 | I100: 477 | J100: =I100/B100 -> 7.5491406324185734E-3 | K100: 36 | L100: =K100/B100 -> 5.6974646282404329E-4 | M100: 440 | N100: =M100/B100 -> 6.9635678789605289E-3 | O100: 218 | P100: =O100/B100 -> 3.4501313582122623E-3 | Q100: 1182 | R100: =Q100/B100 -> 1.870667552938942E-2
A101: 99 | B101: 61730 | C101: 44892 | D101: =C101/B101 -> 0.72723149198120851 | E101: 14837 | F101: =E101/B101 -> 0.24035315081807873 | G101: 468 | H101: =G101/B101 -> 7.5814028835250284E-3 | I101: 504 | J101: =I101/B101 -> 8.1645877207192612E-3 | K101: 32 | L101: =K101/B101 -> 5.183865219504293E-4 | M101: 803 | N101: =M101/B101 -> 1.3008261785193586E-2 | O101: 194 | P101: =O101/B101 -> 3.1427182893244776E-3 | Q101: 1885 | R101: =Q101/B101 -> 3.0536206058642476E-2
A102: 100 | B102: 61730 | C102: 46284 | D102: =C102/B102 -> 0.74978130568605217 | E102: 12322 | F102: =E102/B102 -> 0.19961121010853719 | G102: 484 | H102: =G102/B102 -> 7.8405961445002434E-3 | I102: 849 | J102: =I102/B102 -> 1.3753442410497327E-2 | K102: 102 | L102: =K102/B102 -> 1.6523570387169933E-3 | M102: 1495 | N102: =M102/B102 -> 2.4218370322371618E-2 | O102: 194 | P102: =O102/B102 -> 3.1427182893244776E-3 | Q102: 3388 | R102: =Q102/B102 -> 5.4884173011501704E-2

A1: HB 5003 - J. Morrissey Election Data
A2: DISTRICT | B2: Rep. Gov '09 | C2: Dem. Gov '09 | D2: Rep. Lt. Gov '09 | E2: Dem. Lt. Gov '09 | F2: Rep. Att. Gen. '09 | G2: Dem. Att. Gen. '09
A3: 1 | B3: 0.74843410456346671 | C3: 0.25156589543653329 | D3: 0.75549898831668949 | E3: 0.24450101168331048 | F3: 0.74588605520225526 | G3: 0.25411394479774468
A4: 2 | B4: 0.63888585472419446 | C4: 0.3611141452758056 | D4: 0.64626427037413814 | E4: 0.35373572962586186 | F4: 0.62426759201319759 | G4: 0.37573240798680241
A5: 3 | B5: 0.66125468838308588 | C5: 0.33874531161691412 | D5: 0.65140137493389738 | E5: 0.34859862506610262 | F5: 0.64312108391795642 | G5: 0.35687891608204358
A6: 4 | B6: 0.74231182795698925 | C6: 0.25768817204301075 | D6: 0.75741298986023564 | E6: 0.24258701013976433 | F6: 0.74682709741223008 | G6: 0.25317290258776992
A7: 5 | B7: 0.72344166222695794 | C7: 0.27655833777304206 | D7: 0.70957825477294789 | E7: 0.29042174522705211 | F7: 0.70772737139136099 | G7: 0.29227262860863901
A8: 6 | B8: 0.66280735943142088 | C8: 0.33719264056857912 | D8: 0.64417391304347826 | E8: 0.35582608695652174 | F8: 0.6566086095415623 | G8: 0.3433913904584377
A9: 7 | B9: 0.57152309913378252 | C9: 0.42847690086621754 | D9: 0.55645944633317146 | E9: 0.44354055366682854 | F9: 0.57010541709828777 | G9: 0.42989458290171229
A10: 8 | B10: 0.66492493663482155 | C10: 0.33507506336517839 | D10: 0.65083284342543601 | E10: 0.34916715657456399 | F10: 0.6693253703194374 | G10: 0.33067462968056266
A11: 9 | B11: 0.68493217766025172 | C11: 0.31506782233974828 | D11: 0.66450527149433247 | E11: 0.33549472850566747 | F11: 0.68239745121465556 | G11: 0.3176025487853445
A12: 10 | B12: 0.62716140221790084 | C12: 0.3728385977820991 | D12: 0.61743380417852733 | E12: 0.38256619582147267 | F12: 0.62059988067473015 | G12: 0.37940011932526985
A13: 11 | B13: 0.4230299547446304 | C13: 0.57697004525536955 | D13: 0.41516804245283018 | E13: 0.58483195754716977 | F13: 0.43503156658346792 | G13: 0.56496843341653213
A14: 12 | B14: 0.59215582350602891 | C14: 0.40784417649397109 | D14: 0.62154994156252807 | E14: 0.37845005843747193 | F14: 0.64175408581333571 | G14: 0.35824591418666424
A15: 13 | B15: 0.6252916823485134 | C15: 0.37470831765148666 | D15: 0.59780136467020473 | E15: 0.40219863532979527 | F15: 0.59725591267434808 | G15: 0.40274408732565192
A16: 14 | B16: 0.62559718380688967 | C16: 0.37440281619311039 | D16: 0.62778124350176756 | E16: 0.37221875649823249 | F16: 0.63318936358432643 | G16: 0.36681063641567363
A17: 15 | B17: 0.72714681440443218 | C17: 0.27285318559556787 | D17: 0.70772106547588143 | E17: 0.29227893452411857 | F17: 0.70634673314635921 | G17: 0.29365326685364079
A18: 16 | B18: 0.74373452204061419 | C18: 0.25626547795938581 | D18: 0.73541227277292354 | E18: 0.26458772722707641 | F18: 0.74688567410086393 | G18: 0.25311432589913602
A19: 17 | B19: 0.69099478356364963 | C19: 0.30900521643635032 | D19: 0.67315498154981546 | E19: 0.32684501845018449 | F19: 0.69184973232416469 | G19: 0.30815026767583531
A20: 18 | B20: 0.67471612039470419 | C20: 0.32528387960529576 | D20: 0.6551019390857884 | E20: 0.34489806091421166 | F20: 0.65645121038183174 | G20: 0.3435487896181682
A21: 19 | B21: 0.74367454936332067 | C21: 0.25632545063667933 | D21: 0.73001420098571546 | E21: 0.26998579901428454 | F21: 0.74327433998577463 | G21: 0.25672566001422537
A22: 20 | B22: 0.70317435658433014 | C22: 0.2968256434156698 | D22: 0.71511933550625595 | E22: 0.28488066449374411 | F22: 0.71484333790484234 | G22: 0.28515666209515772
A23: 21 | B23: 0.65474281485136299 | C23: 0.34525718514863696 | D23: 0.6287462537462537 | E23: 0.37125374625374624 | F23: 0.62344372509960155 | G23: 0.37655627490039839
A24: 22 | B24: 0.58157759506680373 | C24: 0.41842240493319632 | D24: 0.554357008252648 | E24: 0.445642991747352 | F24: 0.55767613379051562 | G24: 0.44232386620948438
A25: 23 | B25: 0.62444163915323359 | C25: 0.37555836084676636 | D25: 0.61369253583786454 | E25: 0.38630746416213546 | F25: 0.62329615861214371 | G25: 0.37670384138785623
A26: 24 | B26: 0.62456514680643815 | C26: 0.37543485319356185 | D26: 0.62116579073100808 | E26: 0.37883420926899186 | F26: 0.6299666507860886 | G26: 0.3700333492139114
A27: 25 | B27: 0.70442518248175179 | C27: 0.29557481751824816 | D27: 0.67777777777777781 | E27: 0.32222222222222224 | F27: 0.68627178346310713 | G27: 0.31372821653689287
A28: 26 | B28: 0.72437044993435973 | C28: 0.27562955006564027 | D28: 0.73063952788148867 | E28: 0.26936047211851138 | F28: 0.73371531966224368 | G28: 0.26628468033775632
A29: 27 | B29: 0.58620689655172409 | C29: 0.41379310344827586 | D29: 0.56413939877627028 | E29: 0.43586060122372972 | F29: 0.58817571169634286 | G29: 0.41182428830365708
A30: 28 | B30: 0.614091222786875 | C30: 0.38590877721312505 | D30: 0.60501587301587301 | E30: 0.39498412698412699 | F30: 0.58844512389324166 | G30: 0.41155487610675839
A31: 29 | B31: 0.7117756784403394 | C31: 0.28822432155966066 | D31: 0.68922870720116969 | E31: 0.31077129279883026 | F31: 0.68821593955642213 | G31: 0.31178406044357787
A32: 30 | B32: 0.69248959029455615 | C32: 0.30751040970544391 | D32: 0.67021832236498491 | E32: 0.32978167763501515 | F32: 0.67903360467543306 | G32: 0.32096639532456689
A33: 31 | B33: 0.55902644691452663 | C33: 0.44097355308547337 | D33: 0.52815409309791328 | E33: 0.47184590690208666 | F33: 0.53864951768488745 | G33: 0.46135048231511255
A34: 32 | B34: 0.6230688202247191 | C34: 0.3769311797752809 | D34: 0.60036550138536815 | E34: 0.39963449861463185 | F34: 0.60168344222732362 | G34: 0.39831655777267644
A35: 33 | B35: 0.66590736522399396 | C35: 0.33409263477600609 | D35: 0.65001787447014958 | E35: 0.34998212552985036 | F35: 0.6489795918367347 | G35: 0.3510204081632653
A36: 34 | B36: 0.53970940312061422 | C36: 0.46029059687938578 | D36: 0.51909570710219011 | E36: 0.48090429289780989 | F36: 0.50696784392029615 | G36: 0.4930321560797038
A37: 35 | B37: 0.52767792954708848 | C37: 0.47232207045291158 | D37: 0.5016066983480425 | E37: 0.49839330165195744 | F37: 0.46876270497357364 | G37: 0.53123729502642636
A38: 36 | B38: 0.43959601816951771 | C38: 0.56040398183048223 | D38: 0.41497424934408705 | E38: 0.58502575065591289 | F38: 0.41191369149091617 | G38: 0.58808630850908383
A39: 37 | B39: 0.52325448520169127 | C39: 0.47674551479830879 | D39: 0.49913664095775295 | E39: 0.50086335904224699 | F39: 0.48745602399215643 | G39: 0.51254397600784363
A40: 38 | B40: 0.42258044966971697 | C40: 0.57741955033028303 | D40: 0.39628312070657506 | E40: 0.60371687929342488 | F40: 0.39258759280849237 | G40: 0.60741240719150769
A41: 39 | B41: 0.50939122748867527 | C41: 0.49060877251132473 | D41: 0.48339277753009363 | E41: 0.51660722246990642 | F41: 0.47979037743212355 | G41: 0.52020962256787651
A42: 40 | B42: 0.61667385544395836 | C42: 0.38332614455604164 | D42: 0.59607284440039643 | E42: 0.40392715559960357 | F42: 0.5934283942963422 | G42: 0.4065716057036578
A43: 41 | B43: 0.55473459951951409 | C43: 0.44526540048048591 | D43: 0.52578541790160049 | E43: 0.47421458209839951 | F43: 0.52176690700009132 | G43: 0.47823309299990874
A44: 42 | B44: 0.5441614460306049 | C44: 0.4558385539693951 | D44: 0.51596734187680859 | E44: 0.48403265812319141 | F44: 0.51913219075234296 | G44: 0.48086780924765704
A45: 43 | B45: 0.47397812320092114 | C45: 0.52602187679907886 | D45: 0.44993053947673073 | E45: 0.55006946052326933 | F45: 0.44735314604132809 | G45: 0.55264685395867197
A46: 44 | B46: 0.46845897030398875 | C46: 0.53154102969601125 | D46: 0.44530282479212124 | E46: 0.55469717520787876 | F46: 0.44083102166086291 | G46: 0.55916897833913715
A47: 45 | B47: 0.39021164021164023 | C47: 0.60978835978835977 | D47: 0.36710138490733635 | E47: 0.63289861509266365 | F47: 0.36406705539358603 | G47: 0.63593294460641403
A48: 46 | B48: 0.35600889638775979 | C48: 0.64399110361224021 | D48: 0.33297213622291022 | E48: 0.66702786377708978 | F48: 0.3352211016291699 | G48: 0.66477889837083015
A49: 47 | B49: 0.32349101134879982 | C49: 0.67650898865120013 | D49: 0.30571153943441087 | E49: 0.69428846056558913 | F49: 0.30433460076045626 | G49: 0.69566539923954374
A50: 48 | B50: 0.36657420860300266 | C50: 0.63342579139699728 | D50: 0.34663884202113487 | E50: 0.65336115797886507 | F50: 0.34254487293406788 | G50: 0.65745512706593212
A51: 49 | B51: 0.31854773788439866 | C51: 0.68145226211560139 | D51: 0.30629428928720298 | E51: 0.69370571071279696 | F51: 0.30311938592193372 | G51: 0.69688061407806634
A52: 50 | B52: 0.60366798691234713 | C52: 0.39633201308765281 | D52: 0.58482686619105617 | E52: 0.41517313380894377 | F52: 0.58870125348189417 | G52: 0.41129874651810583
A53: 51 | B53: 0.56734355573974304 | C53: 0.43265644426025696 | D53: 0.53616108661980222 | E53: 0.46383891338019778 | F53: 0.5456603324000715 | G53: 0.4543396675999285
A54: 52 | B54: 0.44860531517680652 | C54: 0.55139468482319354 | D54: 0.41194062915374391 | E54: 0.58805937084625615 | F54: 0.42880923315947178 | G54: 0.57119076684052827
A55: 53 | B55: 0.44455698901801899 | C55: 0.55544301098198101 | D55: 0.42104415082178537 | E55: 0.57895584917821463 | F55: 0.41081139288214075 | G55: 0.58918860711785925
A56: 54 | B56: 0.64740955137481915 | C56: 0.35259044862518091 | D56: 0.62648417851084981 | E56: 0.37351582148915013 | F56: 0.62737286149519567 | G56: 0.37262713850480433
A57: 55 | B57: 0.75176348147862626 | C57: 0.24823651852137379 | D57: 0.724979658258747 | E57: 0.27502034174125306 | F57: 0.74626344190380056 | G57: 0.25373655809619938
A58: 56 | B58: 0.69886798876500122 | C58: 0.30113201123499872 | D58: 0.67003944434916829 | E58: 0.32996055565083177 | F58: 0.69431901260052464 | G58: 0.30568098739947536
A59: 57 | B59: 0.59078460577523662 | C59: 0.40921539422476338 | D59: 0.57718838045273491 | E59: 0.42281161954726515 | F59: 0.5882238253070774 | G59: 0.4117761746929226
A60: 58 | B60: 0.40664448576181622 | C60: 0.59335551423818378 | D60: 0.38246580734035224 | E60: 0.61753419265964771 | F60: 0.39851815263027907 | G60: 0.60148184736972088
A61: 59 | B61: 0.58408284311342307 | C61: 0.41591715688657688 | D61: 0.55893705463182897 | E61: 0.44106294536817103 | F61: 0.58565459610027859 | G61: 0.41434540389972147
A62: 60 | B62: 0.63992959517224035 | C62: 0.36007040482775959 | D62: 0.6477367109634552 | E62: 0.35226328903654486 | F62: 0.65894747822458666 | G62: 0.34105252177541334
A63: 61 | B63: 0.66422933514115534 | C63: 0.3357706648588446 | D63: 0.66097765500912542 | E63: 0.33902234499087458 | F63: 0.67648812481367382 | G63: 0.32351187518632613
A64: 62 | B64: 0.64031277150304089 | C64: 0.35968722849695917 | D64: 0.61314270002749516 | E64: 0.38685729997250479 | F64: 0.64081046761994143 | G64: 0.35918953238005852
A65: 63 | B65: 0.46205899363794101 | C65: 0.53794100636205899 | D65: 0.44723737253972018 | E65: 0.55276262746027982 | F65: 0.46874814154029143 | G65: 0.53125185845970857
A66: 64 | B66: 0.61029353588100321 | C66: 0.38970646411899673 | D66: 0.58310039134254454 | E66: 0.41689960865745546 | F66: 0.59097490347490345 | G66: 0.4090250965250965
A67: 65 | B67: 0.75754564193168439 | C67: 0.24245435806831567 | D67: 0.72818977940361374 | E67: 0.27181022059638621 | F67: 0.75229391741897289 | G67: 0.24770608258102708
A68: 66 | B68: 0.73887016672578931 | C68: 0.26112983327421069 | D68: 0.70768612747723625 | E68: 0.29231387252276381 | F68: 0.73336905080810788 | G68: 0.26663094919189212
A69: 67 | B69: 0.56610690633869443 | C69: 0.43389309366130557 | D69: 0.54103723087902933 | E69: 0.45896276912097062 | F69: 0.54265501456512688 | G69: 0.45734498543487306
A70: 68 | B70: 0.60833031510322344 | C70: 0.3916696848967765 | D70: 0.58378397996588394 | E70: 0.41621602003411606 | F70: 0.60640623861234599 | G70: 0.39359376138765395
A71: 69 | B71: 0.28730527013589657 | C71: 0.71269472986410343 | D71: 0.27725419423835307 | E71: 0.72274580576164693 | F71: 0.29815835461755613 | G71: 0.70184164538244387
A72: 70 | B72: 0.23800162689804771 | C72: 0.76199837310195229 | D72: 0.23307291666666666 | E72: 0.76692708333333337 | F72: 0.25152868430092751 | G72: 0.74847131569907244
A73: 71 | B73: 0.2431285367825384 | C73: 0.75687146321746157 | D73: 0.23909774436090225 | E73: 0.76090225563909775 | F73: 0.25741824440619621 | G73: 0.74258175559380379
A74: 72 | B74: 0.66990813539683858 | C74: 0.33009186460316148 | D74: 0.63938852656503131 | E74: 0.36061147343496863 | F74: 0.65950179121886199 | G74: 0.34049820878113807
A75: 73 | B75: 0.64462845560012072 | C75: 0.35537154439987922 | D75: 0.61560105623133199 | E75: 0.38439894376866801 | F75: 0.63514510042076955 | G75: 0.36485489957923045
A76: 74 | B76: 0.38512241054613938 | C76: 0.61487758945386062 | D76: 0.37195729537366545 | E76: 0.62804270462633449 | F76: 0.39048525214081825 | G76: 0.60951474785918169
A77: 75 | B77: 0.52779110045297095 | C77: 0.47220889954702905 | D77: 0.51254773595199132 | E77: 0.48745226404800873 | F77: 0.52728174603174605 | G77: 0.47271825396825395
A78: 76 | B78: 0.61870949294700728 | C78: 0.38129050705299278 | D78: 0.57827648998474335 | E78: 0.42172351001525665 | F78: 0.60321246045266486 | G78: 0.39678753954733514
A79: 77 | B79: 0.474845060153117 | C79: 0.525154939846883 | D79: 0.45166981726528038 | E79: 0.54833018273471956 | F79: 0.47056966022483265 | G79: 0.5294303397751674
A80: 78 | B80: 0.71230198516141974 | C80: 0.28769801483858032 | D80: 0.67017418399141848 | E80: 0.32982581600858152 | F80: 0.69971337905619813 | G80: 0.30028662094380182
A81: 79 | B81: 0.48407932011331445 | C81: 0.51592067988668555 | D81: 0.44721104082806212 | E81: 0.55278895917193793 | F81: 0.46490518038852913 | G81: 0.53509481961147087
A82: 80 | B82: 0.25194121799396779 | C82: 0.74805878200603226 | D82: 0.23004602235371466 | E82: 0.76995397764628537 | F82: 0.25140849738185195 | G82: 0.74859150261814811
A83: 81 | B83: 0.68382981147120803 | C83: 0.31617018852879192 | D83: 0.62090175825451166 | E83: 0.37909824174548828 | F83: 0.66484823863966103 | G83: 0.33515176136033892
A84: 82 | B84: 0.60348175426849682 | C84: 0.39651824573150318 | D84: 0.54810795961815806 | E84: 0.45189204038184189 | F84: 0.58557942262963469 | G84: 0.41442057737036531
A85: 83 | B85: 0.66205657835653342 | C85: 0.33794342164346652 | D85: 0.59798673072523445 | E85: 0.40201326927476549 | F85: 0.64187491434053634 | G85: 0.35812508565946366
A86: 84 | B86: 0.61423657669212384 | C86: 0.38576342330787616 | D86: 0.56791004818847046 | E86: 0.43208995181152954 | F86: 0.60068969617694279 | G86: 0.39931030382305727
A87: 85 | B87: 0.62676267626762672 | C87: 0.37323732373237323 | D87: 0.57061625941293992 | E87: 0.42938374058706008 | F87: 0.60959044020018383 | G87: 0.39040955979981617
A88: 86 | B88: 0.49995975855130786 | C88: 0.50004024144869219 | D88: 0.46877284171201167 | E88: 0.53122715828798828 | F88: 0.47107169012938399 | G88: 0.52892830987061601
A89: 87 | B89: 0.57728675226435755 | C89: 0.42271324773564251 | D89: 0.52026130448096353 | E89: 0.47973869551903642 | F89: 0.54876066639577403 | G89: 0.45123933360422591
A90: 88 | B90: 0.70509135701088077 | C90: 0.29490864298911929 | D90: 0.68261274306992137 | E90: 0.31738725693007863 | F90: 0.68326775729964795 | G90: 0.31673224270035205
A91: 89 | B91: 0.33362255965292842 | C91: 0.66637744034707158 | D91: 0.30219449872238086 | E91: 0.69780550127761909 | F91: 0.32696933253156946 | G91: 0.67303066746843054
A92: 90 | B92: 0.39195348106239197 | C92: 0.60804651893760808 | D92: 0.35648412633640741 | E92: 0.64351587366359264 | F92: 0.37907109623704188 | G92: 0.62092890376295817
A93: 91 | B93: 0.6563348889043672 | C93: 0.3436651110956328 | D93: 0.62887752958476295 | E93: 0.37112247041523705 | F93: 0.63203978705519759 | G93: 0.36796021294480247
A94: 92 | B94: 0.36707590603234563 | C94: 0.63292409396765437 | D94: 0.33915935893559118 | E94: 0.66084064106440887 | F94: 0.35757871613375641 | G94: 0.64242128386624364
A95: 93 | B95: 0.72106904231625835 | C95: 0.27893095768374165 | D95: 0.67743380672908915 | E95: 0.32256619327091079 | F95: 0.69172661870503593 | G95: 0.30827338129496401
A96: 94 | B96: 0.58098172775435186 | C96: 0.41901827224564819 | D96: 0.54761644434725565 | E96: 0.45238355565274435 | F96: 0.56072918954535467 | G96: 0.43927081045464528
A97: 95 | B97: 0.32942332494012161 | C97: 0.67057667505987839 | D97: 0.31206831596132112 | E97: 0.68793168403867888 | F97: 0.32614861032331255 | G97: 0.67385138967668745
A98: 96 | B98: 0.56113184079601985 | C98: 0.43886815920398009 | D98: 0.52900959668820169 | E98: 0.47099040331179826 | F98: 0.54151987921489686 | G98: 0.4584801207851032
A99: 97 | B99: 0.72002852638690784 | C99: 0.2799714736130921 | D99: 0.6930404869012966 | E99: 0.30695951309870334 | F99: 0.7092824925141189 | G99: 0.29071750748588104
A100: 98 | B100: 0.69027003857693958 | C100: 0.30972996142306042 | D100: 0.66113014441216011 | E100: 0.33886985558783989 | F100: 0.67240174672489084 | G100: 0.32759825327510916
A101: 99 | B101: 0.65193528373025345 | C101: 0.34806471626974655 | D101: 0.63058560962592791 | E101: 0.36941439037407209 | F101: 0.64117476010468155 | G101: 0.35882523989531839
A102: 100 | B102: 0.61681876165243843 | C102: 0.38318123834756157 | D102: 0.57379185883296568 | E102: 0.42620814116703432 | F102: 0.60006058158319875 | G102: 0.39993941841680131