A1: HB 5005 Population Totals
A2: DISTRICT | B2: Total Population | C2: Target | D2: Difference | E2: Deviation
A3: 1 | B3: 80508 | C3: 80010.240000000005 | D3: =B3-C3 -> 497.75999999999476 | E3: =(B3-C3)/C3 -> 6.2212036859281353E-3
A4: 2 | B4: 79491 | C4: 80010.240000000005 | D4: =B4-C4 -> -519.24000000000524 | E4: =(B4-C4)/C4 -> -6.4896693223268076E-3
A5: 3 | B5: 80583 | C5: 80010.240000000005 | D5: =B5-C5 -> 572.75999999999476 | E5: =(B5-C5)/C5 -> 7.1585837012861694E-3
A6: 4 | B6: 80446 | C6: 80010.240000000005 | D6: =B6-C6 -> 435.75999999999476 | E6: =(B6-C6)/C6 -> 5.4463028732321603E-3
A7: 5 | B7: 80600 | C7: 80010.240000000005 | D7: =B7-C7 -> 589.75999999999476 | E7: =(B7-C7)/C7 -> 7.3710565047673234E-3
A8: 6 | B8: 79608 | C8: 80010.240000000005 | D8: =B8-C8 -> -402.24000000000524 | E8: =(B8-C8)/C8 -> -5.0273564983682739E-3
A9: 7 | B9: 80146 | C9: 80010.240000000005 | D9: =B9-C9 -> 135.75999999999476 | E9: =(B9-C9)/C9 -> 1.6967828118000241E-3
A10: 8 | B10: 80685 | C10: 80010.240000000005 | D10: =B10-C10 -> 674.75999999999476 | E10: =(B10-C10)/C10 -> 8.4334205221730952E-3
A11: 9 | B11: 80574 | C11: 80010.240000000005 | D11: =B11-C11 -> 563.75999999999476 | E11: =(B11-C11)/C11 -> 7.0460980994432052E-3
A12: 10 | B12: 80073 | C12: 80010.240000000005 | D12: =B12-C12 -> 62.759999999994761 | E12: =(B12-C12)/C12 -> 7.8439959685153745E-4
A13: 11 | B13: 80132 | C13: 80010.240000000005 | D13: =B13-C13 -> 121.75999999999476 | E13: =(B13-C13)/C13 -> 1.5218052089331911E-3
A14: 12 | B14: 80492 | C14: 80010.240000000005 | D14: =B14-C14 -> 481.75999999999476 | E14: =(B14-C14)/C14 -> 6.0212292826517548E-3
A15: 13 | B15: 80579 | C15: 80010.240000000005 | D15: =B15-C15 -> 568.75999999999476 | E15: =(B15-C15)/C15 -> 7.1085901004670745E-3
A16: 14 | B16: 79407 | C16: 80010.240000000005 | D16: =B16-C16 -> -603.24000000000524 | E16: =(B16-C16)/C16 -> -7.539534939527805E-3
A17: 15 | B17: 80630 | C17: 80010.240000000005 | D17: =B17-C17 -> 619.75999999999476 | E17: =(B17-C17)/C17 -> 7.7460085109105374E-3
A18: 16 | B18: 79692 | C18: 80010.240000000005 | D18: =B18-C18 -> -318.24000000000524 | E18: =(B18-C18)/C18 -> -3.9774908811672756E-3
A19: 17 | B19: 80631 | C19: 80010.240000000005 | D19: =B19-C19 -> 620.75999999999476 | E19: =(B19-C19)/C19 -> 7.7585069111153109E-3
A20: 18 | B20: 79450 | C20: 80010.240000000005 | D20: =B20-C20 -> -560.24000000000524 | E20: =(B20-C20)/C20 -> -7.0021037307225328E-3
A21: 19 | B21: 80080 | C21: 80010.240000000005 | D21: =B21-C21 -> 69.759999999994761 | E21: =(B21-C21)/C21 -> 8.7188839828495398E-4
A22: 20 | B22: 79334 | C22: 80010.240000000005 | D22: =B22-C22 -> -676.24000000000524 | E22: =(B22-C22)/C22 -> -8.4519181544762921E-3
A23: 21 | B23: 79608 | C23: 80010.240000000005 | D23: =B23-C23 -> -402.24000000000524 | E23: =(B23-C23)/C23 -> -5.0273564983682739E-3
A24: 22 | B24: 79307 | C24: 80010.240000000005 | D24: =B24-C24 -> -703.24000000000524 | E24: =(B24-C24)/C24 -> -8.7893749600051838E-3
A25: 23 | B25: 79330 | C25: 80010.240000000005 | D25: =B25-C25 -> -680.24000000000524 | E25: =(B25-C25)/C25 -> -8.5019117552953879E-3
A26: 24 | B26: 79678 | C26: 80010.240000000005 | D26: =B26-C26 -> -332.24000000000524 | E26: =(B26-C26)/C26 -> -4.1524684840341091E-3
A27: 25 | B27: 80011 | C27: 80010.240000000005 | D27: =B27-C27 -> 0.75999999999476131 | E27: =(B27-C27)/C27 -> 9.4987841555626042E-6
A28: 26 | B28: 80688 | C28: 80010.240000000005 | D28: =B28-C28 -> 677.75999999999476 | E28: =(B28-C28)/C28 -> 8.4709157227874175E-3
A29: 27 | B29: 79381 | C29: 80010.240000000005 | D29: =B29-C29 -> -629.24000000000524 | E29: =(B29-C29)/C29 -> -7.8644933448519232E-3
A30: 28 | B30: 79304 | C30: 80010.240000000005 | D30: =B30-C30 -> -706.24000000000524 | E30: =(B30-C30)/C30 -> -8.8268701606195061E-3
A31: 29 | B31: 80185 | C31: 80010.240000000005 | D31: =B31-C31 -> 174.75999999999476 | E31: =(B31-C31)/C31 -> 2.1842204197862016E-3
A32: 30 | B32: 80583 | C32: 80010.240000000005 | D32: =B32-C32 -> 572.75999999999476 | E32: =(B32-C32)/C32 -> 7.1585837012861694E-3
A33: 31 | B33: 79210 | C33: 80010.240000000005 | D33: =B33-C33 -> -800.24000000000524 | E33: =(B33-C33)/C33 -> -1.0001719779868242E-2
A34: 32 | B34: 80268 | C34: 80010.240000000005 | D34: =B34-C34 -> 257.75999999999476 | E34: =(B34-C34)/C34 -> 3.221587636782426E-3
A35: 33 | B35: 80760 | C35: 80010.240000000005 | D35: =B35-C35 -> 749.75999999999476 | E35: =(B35-C35)/C35 -> 9.3708005375311293E-3
A36: 34 | B36: 80722 | C36: 80010.240000000005 | D36: =B36-C36 -> 711.75999999999476 | E36: =(B36-C36)/C36 -> 8.8958613297497255E-3
A37: 35 | B37: 80213 | C37: 80010.240000000005 | D37: =B37-C37 -> 202.75999999999476 | E37: =(B37-C37)/C37 -> 2.5341756255198677E-3
A38: 36 | B38: 79746 | C38: 80010.240000000005 | D38: =B38-C38 -> -264.24000000000524 | E38: =(B38-C38)/C38 -> -3.3025772701094913E-3
A39: 37 | B39: 80255 | C39: 80010.240000000005 | D39: =B39-C39 -> 244.75999999999476 | E39: =(B39-C39)/C39 -> 3.0591084341203669E-3
A40: 38 | B40: 80758 | C40: 80010.240000000005 | D40: =B40-C40 -> 747.75999999999476 | E40: =(B40-C40)/C40 -> 9.3458037371215823E-3
A41: 39 | B41: 80710 | C41: 80010.240000000005 | D41: =B41-C41 -> 699.75999999999476 | E41: =(B41-C41)/C41 -> 8.7458805272924399E-3
A42: 40 | B42: 80729 | C42: 80010.240000000005 | D42: =B42-C42 -> 718.75999999999476 | E42: =(B42-C42)/C42 -> 8.9833501311831418E-3
A43: 41 | B43: 80792 | C43: 80010.240000000005 | D43: =B43-C43 -> 781.75999999999476 | E43: =(B43-C43)/C43 -> 9.7707493440838903E-3
A44: 42 | B44: 79964 | C44: 80010.240000000005 | D44: =B44-C44 -> -46.240000000005239 | E44: =(B44-C44)/C44 -> -5.7792602546880543E-4
A45: 43 | B45: 80750 | C45: 80010.240000000005 | D45: =B45-C45 -> 739.75999999999476 | E45: =(B45-C45)/C45 -> 9.2458165354833925E-3
A46: 44 | B46: 80796 | C46: 80010.240000000005 | D46: =B46-C46 -> 785.75999999999476 | E46: =(B46-C46)/C46 -> 9.8207429449029861E-3
A47: 45 | B47: 80240 | C47: 80010.240000000005 | D47: =B47-C47 -> 229.75999999999476 | E47: =(B47-C47)/C47 -> 2.8716324310487599E-3
A48: 46 | B48: 80333 | C48: 80010.240000000005 | D48: =B48-C48 -> 322.75999999999476 | E48: =(B48-C48)/C48 -> 4.0339836500927224E-3
A49: 47 | B49: 80757 | C49: 80010.240000000005 | D49: =B49-C49 -> 746.75999999999476 | E49: =(B49-C49)/C49 -> 9.3333053369168088E-3
A50: 48 | B50: 79492 | C50: 80010.240000000005 | D50: =B50-C50 -> -518.24000000000524 | E50: =(B50-C50)/C50 -> -6.4771709221220332E-3
A51: 49 | B51: 80609 | C51: 80010.240000000005 | D51: =B51-C51 -> 598.75999999999476 | E51: =(B51-C51)/C51 -> 7.4835421066102876E-3
A52: 50 | B52: 80677 | C52: 80010.240000000005 | D52: =B52-C52 -> 666.75999999999476 | E52: =(B52-C52)/C52 -> 8.3334333205349054E-3
A53: 51 | B53: 80372 | C53: 80010.240000000005 | D53: =B53-C53 -> 361.75999999999476 | E53: =(B53-C53)/C53 -> 4.5214212580788997E-3
A54: 52 | B54: 79290 | C54: 80010.240000000005 | D54: =B54-C54 -> -720.24000000000524 | E54: =(B54-C54)/C54 -> -9.0018477634863387E-3
A55: 53 | B55: 80049 | C55: 80010.240000000005 | D55: =B55-C55 -> 38.759999999994761 | E55: =(B55-C55)/C55 -> 4.8443799193696654E-4
A56: 54 | B56: 80155 | C56: 80010.240000000005 | D56: =B56-C56 -> 144.75999999999476 | E56: =(B56-C56)/C56 -> 1.8092684136429881E-3
A57: 55 | B57: 79578 | C57: 80010.240000000005 | D57: =B57-C57 -> -432.24000000000524 | E57: =(B57-C57)/C57 -> -5.4023085045114879E-3
A58: 56 | B58: 79271 | C58: 80010.240000000005 | D58: =B58-C58 -> -739.24000000000524 | E58: =(B58-C58)/C58 -> -9.2393173673770406E-3
A59: 57 | B59: 80778 | C59: 80010.240000000005 | D59: =B59-C59 -> 767.75999999999476 | E59: =(B59-C59)/C59 -> 9.5957717412170577E-3
A60: 58 | B60: 80767 | C60: 80010.240000000005 | D60: =B60-C60 -> 756.75999999999476 | E60: =(B60-C60)/C60 -> 9.4582893389645456E-3
A61: 59 | B61: 79345 | C61: 80010.240000000005 | D61: =B61-C61 -> -665.24000000000524 | E61: =(B61-C61)/C61 -> -8.31443575222378E-3
A62: 60 | B62: 79219 | C62: 80010.240000000005 | D62: =B62-C62 -> -791.24000000000524 | E62: =(B62-C62)/C62 -> -9.889234178025277E-3
A63: 61 | B63: 79792 | C63: 80010.240000000005 | D63: =B63-C63 -> -218.24000000000524 | E63: =(B63-C63)/C63 -> -2.7276508606898968E-3
A64: 62 | B64: 79677 | C64: 80010.240000000005 | D64: =B64-C64 -> -333.24000000000524 | E64: =(B64-C64)/C64 -> -4.1649668842388826E-3
A65: 63 | B65: 79602 | C65: 80010.240000000005 | D65: =B65-C65 -> -408.24000000000524 | E65: =(B65-C65)/C65 -> -5.1023468995969167E-3
A66: 64 | B66: 79262 | C66: 80010.240000000005 | D66: =B66-C66 -> -748.24000000000524 | E66: =(B66-C66)/C66 -> -9.3518029692200039E-3
A67: 65 | B67: 79364 | C67: 80010.240000000005 | D67: =B67-C67 -> -646.24000000000524 | E67: =(B67-C67)/C67 -> -8.0769661483330781E-3
A68: 66 | B68: 79397 | C68: 80010.240000000005 | D68: =B68-C68 -> -613.24000000000524 | E68: =(B68-C68)/C68 -> -7.6645189415755436E-3
A69: 67 | B69: 79633 | C69: 80010.240000000005 | D69: =B69-C69 -> -377.24000000000524 | E69: =(B69-C69)/C69 -> -4.7148964932489292E-3
A70: 68 | B70: 79611 | C70: 80010.240000000005 | D70: =B70-C70 -> -399.24000000000524 | E70: =(B70-C70)/C70 -> -4.9898612977539525E-3
A71: 69 | B71: 79386 | C71: 80010.240000000005 | D71: =B71-C71 -> -624.24000000000524 | E71: =(B71-C71)/C71 -> -7.8020013438280548E-3
A72: 70 | B72: 79382 | C72: 80010.240000000005 | D72: =B72-C72 -> -628.24000000000524 | E72: =(B72-C72)/C72 -> -7.8519949446471497E-3
A73: 71 | B73: 80322 | C73: 80010.240000000005 | D73: =B73-C73 -> 311.75999999999476 | E73: =(B73-C73)/C73 -> 3.8965012478402107E-3
A74: 72 | B74: 80764 | C74: 80010.240000000005 | D74: =B74-C74 -> 753.75999999999476 | E74: =(B74-C74)/C74 -> 9.4207941383502251E-3
A75: 73 | B75: 80135 | C75: 80010.240000000005 | D75: =B75-C75 -> 124.75999999999476 | E75: =(B75-C75)/C75 -> 1.5593004095475122E-3
A76: 74 | B76: 79594 | C76: 80010.240000000005 | D76: =B76-C76 -> -416.24000000000524 | E76: =(B76-C76)/C76 -> -5.2023341012351074E-3
A77: 75 | B77: 79295 | C77: 80010.240000000005 | D77: =B77-C77 -> -715.24000000000524 | E77: =(B77-C77)/C77 -> -8.9393557624624694E-3
A78: 76 | B78: 80313 | C78: 80010.240000000005 | D78: =B78-C78 -> 302.75999999999476 | E78: =(B78-C78)/C78 -> 3.7840156459972465E-3
A79: 77 | B79: 79627 | C79: 80010.240000000005 | D79: =B79-C79 -> -383.24000000000524 | E79: =(B79-C79)/C79 -> -4.789886894477572E-3
A80: 78 | B80: 80475 | C80: 80010.240000000005 | D80: =B80-C80 -> 464.75999999999476 | E80: =(B80-C80)/C80 -> 5.8087564791705999E-3
A81: 79 | B81: 80243 | C81: 80010.240000000005 | D81: =B81-C81 -> 232.75999999999476 | E81: =(B81-C81)/C81 -> 2.9091276316630813E-3
A82: 80 | B82: 80705 | C82: 80010.240000000005 | D82: =B82-C82 -> 694.75999999999476 | E82: =(B82-C82)/C82 -> 8.6833885262685723E-3
A83: 81 | B83: 79438 | C83: 80010.240000000005 | D83: =B83-C83 -> -572.24000000000524 | E83: =(B83-C83)/C83 -> -7.1520845331798184E-3
A84: 82 | B84: 80463 | C84: 80010.240000000005 | D84: =B84-C84 -> 452.75999999999476 | E84: =(B84-C84)/C84 -> 5.6587756767133152E-3
A85: 83 | B85: 79538 | C85: 80010.240000000005 | D85: =B85-C85 -> -472.24000000000524 | E85: =(B85-C85)/C85 -> -5.9022445127024396E-3
A86: 84 | B86: 80281 | C86: 80010.240000000005 | D86: =B86-C86 -> 270.75999999999476 | E86: =(B86-C86)/C86 -> 3.3840668394444855E-3
A87: 85 | B87: 80800 | C87: 80010.240000000005 | D87: =B87-C87 -> 789.75999999999476 | E87: =(B87-C87)/C87 -> 9.8707365457220819E-3
A88: 86 | B88: 80747 | C88: 80010.240000000005 | D88: =B88-C88 -> 736.75999999999476 | E88: =(B88-C88)/C88 -> 9.2083213348690702E-3
A89: 87 | B89: 79275 | C89: 80010.240000000005 | D89: =B89-C89 -> -735.24000000000524 | E89: =(B89-C89)/C89 -> -9.1893237665579448E-3
A90: 88 | B90: 80191 | C90: 80010.240000000005 | D90: =B90-C90 -> 180.75999999999476 | E90: =(B90-C90)/C90 -> 2.2592108210148444E-3
A91: 89 | B91: 79614 | C91: 80010.240000000005 | D91: =B91-C91 -> -396.24000000000524 | E91: =(B91-C91)/C91 -> -4.9523660971396311E-3
A92: 90 | B92: 80425 | C92: 80010.240000000005 | D92: =B92-C92 -> 414.75999999999476 | E92: =(B92-C92)/C92 -> 5.1838364689319105E-3
A93: 91 | B93: 79229 | C93: 80010.240000000005 | D93: =B93-C93 -> -781.24000000000524 | E93: =(B93-C93)/C93 -> -9.7642501759775402E-3
A94: 92 | B94: 79689 | C94: 80010.240000000005 | D94: =B94-C94 -> -321.24000000000524 | E94: =(B94-C94)/C94 -> -4.014986081781597E-3
A95: 93 | B95: 79211 | C95: 80010.240000000005 | D95: =B95-C95 -> -799.24000000000524 | E95: =(B95-C95)/C95 -> -9.9892213796634686E-3
A96: 94 | B96: 79429 | C96: 80010.240000000005 | D96: =B96-C96 -> -581.24000000000524 | E96: =(B96-C96)/C96 -> -7.2645701350227817E-3
A97: 95 | B97: 80071 | C97: 80010.240000000005 | D97: =B97-C97 -> 60.759999999994761 | E97: =(B97-C97)/C97 -> 7.5940279644198989E-4
A98: 96 | B98: 79217 | C98: 80010.240000000005 | D98: =B98-C98 -> -793.24000000000524 | E98: =(B98-C98)/C98 -> -9.9142309784348258E-3
A99: 97 | B99: 79386 | C99: 80010.240000000005 | D99: =B99-C99 -> -624.24000000000524 | E99: =(B99-C99)/C99 -> -7.8020013438280548E-3
A100: 98 | B100: 79251 | C100: 80010.240000000005 | D100: =B100-C100 -> -759.24000000000524 | E100: =(B100-C100)/C100 -> -9.489285371472516E-3
A101: 99 | B101: 80332 | C101: 80010.240000000005 | D101: =B101-C101 -> 321.75999999999476 | E101: =(B101-C101)/C101 -> 4.0214852498879489E-3
A102: 100 | B102: 80037 | C102: 80010.240000000005 | D102: =B102-C102 -> 26.759999999994761 | E102: =(B102-C102)/C102 -> 3.344571894796811E-4

A1: HB 5005 Racial Demographics
A2: DISTRICT | B2: Total Population | C2: White | D2: % White | E2: Black | F2: % Black | G2: AIAN | H2: % AIAN | I2: Asian | J2: % Asian | K2: HawPI | L2: % HawPI | M2: Other | N2: % Other | O2: Multi | P2: % Multi | Q2: Total Hispanic | R2: % Hispanic
A3: 1 | B3: 80508 | C3: 76238 | D3: =C3/B3 -> 0.94696179261688285 | E3: 2866 | F3: =E3/B3 -> 3.5598946688527845E-2 | G3: 463 | H3: =G3/B3 -> 5.7509812689422171E-3 | I3: 358 | J3: =I3/B3 -> 4.4467630546032692E-3 | K3: 36 | L3: =K3/B3 -> 4.4716053063049635E-4 | M3: 449 | N3: =M3/B3 -> 5.5770855070303577E-3 | O3: 98 | P3: =O3/B3 -> 1.2172703333830179E-3 | Q3: 1032 | R3: =Q3/B3 -> 1.2818601878074229E-2
A4: 2 | B4: 79491 | C4: 45289 | D4: =C4/B4 -> 0.56973745455460367 | E4: 20362 | F4: =E4/B4 -> 0.25615478481840709 | G4: 694 | H4: =G4/B4 -> 8.7305481123649224E-3 | I4: 5598 | J4: =I4/B4 -> 7.0423066762274972E-2 | K4: 183 | L4: =K4/B4 -> 2.3021474129146695E-3 | M4: 6208 | N4: =M4/B4 -> 7.8096891471990545E-2 | O4: 1157 | P4: =O4/B4 -> 1.4555106867444113E-2 | Q4: 14019 | R4: =Q4/B4 -> 0.17635958787787295
A5: 3 | B5: 80583 | C5: 77178 | D5: =C5/B5 -> 0.95774543017758085 | E5: 2400 | F5: =E5/B5 -> 2.9782956703026692E-2 | G5: 324 | H5: =G5/B5 -> 4.0206991549086033E-3 | I5: 417 | J5: =I5/B5 -> 5.1747887271508877E-3 | K5: 23 | L5: =K5/B5 -> 2.8542000173733916E-4 | M5: 170 | N5: =M5/B5 -> 2.1096260997977242E-3 | O5: 71 | P5: =O5/B5 -> 8.8107913579787305E-4 | Q5: 471 | R5: =Q5/B5 -> 5.8449052529689887E-3
A6: 4 | B6: 80446 | C6: 77768 | D6: =C6/B6 -> 0.9667105884692837 | E6: 1655 | F6: =E6/B6 -> 2.0572806603187232E-2 | G6: 327 | H6: =G6/B6 -> 4.064838525221888E-3 | I6: 284 | J6: =I6/B6 -> 3.5303184745046367E-3 | K6: 15 | L6: =K6/B6 -> 1.8646048280834349E-4 | M6: 351 | N6: =M6/B6 -> 4.3631752977152374E-3 | O6: 46 | P6: =O6/B6 -> 5.7181214727892006E-4 | Q6: 833 | R6: =Q6/B6 -> 1.0354772145290007E-2
A7: 5 | B7: 80600 | C7: 76060 | D7: =C7/B7 -> 0.94367245657568233 | E7: 2580 | F7: =E7/B7 -> 3.2009925558312655E-2 | G7: 393 | H7: =G7/B7 -> 4.8759305210918117E-3 | I7: 343 | J7: =I7/B7 -> 4.2555831265508682E-3 | K7: 33 | L7: =K7/B7 -> 4.0942928039702233E-4 | M7: 1058 | N7: =M7/B7 -> 1.3126550868486353E-2 | O7: 133 | P7: =O7/B7 -> 1.6501240694789083E-3 | Q7: 2219 | R7: =Q7/B7 -> 2.7531017369727045E-2
A8: 6 | B8: 79608 | C8: 76371 | D8: =C8/B8 -> 0.95933825746156165 | E8: 1790 | F8: =E8/B8 -> 2.2485177369108631E-2 | G8: 378 | H8: =G8/B8 -> 4.748266505878806E-3 | I8: 297 | J8: =I8/B8 -> 3.7307808260476335E-3 | K8: 14 | L8: =K8/B8 -> 1.7586172243995579E-4 | M8: 679 | N8: =M8/B8 -> 8.5292935383378555E-3 | O8: 79 | P8: =O8/B8 -> 9.9236257662546471E-4 | Q8: 1348 | R8: =Q8/B8 -> 1.6932971560647173E-2
A9: 7 | B9: 80146 | C9: 74108 | D9: =C9/B9 -> 0.92466249095400899 | E9: 3612 | F9: =E9/B9 -> 4.5067751353779356E-2 | G9: 408 | H9: =G9/B9 -> 5.0907094552441797E-3 | I9: 1303 | J9: =I9/B9 -> 1.6257829461233251E-2 | K9: 32 | L9: =K9/B9 -> 3.9927132982307291E-4 | M9: 518 | N9: =M9/B9 -> 6.463204651510992E-3 | O9: 165 | P9: =O9/B9 -> 2.0587427944002198E-3 | Q9: 1636 | R9: =Q9/B9 -> 2.0412746737204602E-2
A10: 8 | B10: 80685 | C10: 74011 | D10: =C10/B10 -> 0.91728326206853816 | E10: 3652 | F10: =E10/B10 -> 4.5262440354464896E-2 | G10: 438 | H10: =G10/B10 -> 5.4285183119538944E-3 | I10: 1722 | J10: =I10/B10 -> 2.134225692507901E-2 | K10: 32 | L10: =K10/B10 -> 3.9660407758567269E-4 | M10: 675 | N10: =M10/B10 -> 8.3658672615727833E-3 | O10: 155 | P10: =O10/B10 -> 1.9210510008056021E-3 | Q10: 1558 | R10: =Q10/B10 -> 1.9309661027452438E-2
A11: 9 | B11: 80574 | C11: 69709 | D11: =C11/B11 -> 0.86515501278328 | E11: 8389 | F11: =E11/B11 -> 0.10411547149204459 | G11: 428 | H11: =G11/B11 -> 5.3118872092734627E-3 | I11: 362 | J11: =I11/B11 -> 4.4927644153200785E-3 | K11: 28 | L11: =K11/B11 -> 3.4750663985901162E-4 | M11: 1557 | N11: =M11/B11 -> 1.9323851366445752E-2 | O11: 101 | P11: =O11/B11 -> 1.253506093777149E-3 | Q11: 2349 | R11: =Q11/B11 -> 2.9153324893886366E-2
A12: 10 | B12: 80073 | C12: 60409 | D12: =C12/B12 -> 0.75442408801968208 | E12: 7294 | F12: =E12/B12 -> 9.1091878660722089E-2 | G12: 470 | H12: =G12/B12 -> 5.8696439498957202E-3 | I12: 6838 | J12: =I12/B12 -> 8.5397075168908376E-2 | K12: 66 | L12: =K12/B12 -> 8.2424787381514368E-4 | M12: 4417 | N12: =M12/B12 -> 5.5162164524871056E-2 | O12: 579 | P12: =O12/B12 -> 7.2309018021055787E-3 | Q12: 9772 | R12: =Q12/B12 -> 0.12203863974123612
A13: 11 | B13: 80132 | C13: 47632 | D13: =C13/B13 -> 0.59441920830629458 | E13: 27648 | F13: =E13/B13 -> 0.345030699346079 | G13: 420 | H13: =G13/B13 -> 5.241351769580193E-3 | I13: 1596 | J13: =I13/B13 -> 1.9917136724404733E-2 | K13: 56 | L13: =K13/B13 -> 6.9884690261069239E-4 | M13: 2261 | N13: =M13/B13 -> 2.8215943692906705E-2 | O13: 519 | P13: =O13/B13 -> 6.4768132581240956E-3 | Q13: 4734 | R13: =Q13/B13 -> 5.9077522088553887E-2
A14: 12 | B14: 80492 | C14: 70200 | D14: =C14/B14 -> 0.87213636137752815 | E14: 3863 | F14: =E14/B14 -> 4.7992347065546885E-2 | G14: 424 | H14: =G14/B14 -> 5.267604233961139E-3 | I14: 5015 | J14: =I14/B14 -> 6.2304328380460169E-2 | K14: 52 | L14: =K14/B14 -> 6.4602693435372456E-4 | M14: 689 | N14: =M14/B14 -> 8.5598568801868516E-3 | O14: 249 | P14: =O14/B14 -> 3.0934751279630274E-3 | Q14: 1959 | R14: =Q14/B14 -> 2.4337822392287434E-2
A15: 13 | B15: 80579 | C15: 48642 | D15: =C15/B15 -> 0.60365603941473589 | E15: 11369 | F15: =E15/B15 -> 0.14109135134464315 | G15: 634 | H15: =G15/B15 -> 7.8680549522828526E-3 | I15: 8593 | J15: =I15/B15 -> 0.10664068802045198 | K15: 94 | L15: =K15/B15 -> 1.1665570433984042E-3 | M15: 10388 | N15: =M15/B15 -> 0.1289169634768364 | O15: 859 | P15: =O15/B15 -> 1.0660345747651373E-2 | Q15: 20063 | R15: =Q15/B15 -> 0.24898546767768276
A16: 14 | B16: 79407 | C16: 47862 | D16: =C16/B16 -> 0.60274283123654082 | E16: 28920 | F16: =E16/B16 -> 0.36419962975556314 | G16: 342 | H16: =G16/B16 -> 4.3069250821715973E-3 | I16: 634 | J16: =I16/B16 -> 7.9841827546689847E-3 | K16: 27 | L16: =K16/B16 -> 3.4002040122407346E-4 | M16: 1379 | N16: =M16/B16 -> 1.7366227158814713E-2 | O16: 243 | P16: =O16/B16 -> 3.0601836110166611E-3 | Q16: 2407 | R16: =Q16/B16 -> 3.0312189101716472E-2
A17: 15 | B17: 80630 | C17: 75913 | D17: =C17/B17 -> 0.94149820166191245 | E17: 1904 | F17: =E17/B17 -> 2.3614039439414609E-2 | G17: 517 | H17: =G17/B17 -> 6.4120054570259207E-3 | I17: 485 | J17: =I17/B17 -> 6.0151308445987846E-3 | K17: 31 | L17: =K17/B17 -> 3.8447228078878829E-4 | M17: 1627 | N17: =M17/B17 -> 2.0178593575592211E-2 | O17: 153 | P17: =O17/B17 -> 1.8975567406672455E-3 | Q17: 3386 | R17: =Q17/B17 -> 4.1994294927446357E-2
A18: 16 | B18: 79692 | C18: 54827 | D18: =C18/B18 -> 0.68798624705114697 | E18: 22358 | F18: =E18/B18 -> 0.28055513727852233 | G18: 372 | H18: =G18/B18 -> 4.6679716910103903E-3 | I18: 437 | J18: =I18/B18 -> 5.4836119058374747E-3 | K18: 18 | L18: =K18/B18 -> 2.2586959795211565E-4 | M18: 1491 | N18: =M18/B18 -> 1.8709531697033578E-2 | O18: 189 | P18: =O18/B18 -> 2.3716307784972142E-3 | Q18: 2628 | R18: =Q18/B18 -> 3.2976961301008884E-2
A19: 17 | B19: 80631 | C19: 71273 | D19: =C19/B19 -> 0.88394041993774108 | E19: 5839 | F19: =E19/B19 -> 7.2416316305143183E-2 | G19: 410 | H19: =G19/B19 -> 5.0848929071945033E-3 | I19: 2111 | J19: =I19/B19 -> 2.6180997383140479E-2 | K19: 56 | L19: =K19/B19 -> 6.9452195805583456E-4 | M19: 737 | N19: =M19/B19 -> 9.1404050551276809E-3 | O19: 205 | P19: =O19/B19 -> 2.5424464535972516E-3 | Q19: 2059 | R19: =Q19/B19 -> 2.5536084136374346E-2
A20: 18 | B20: 79450 | C20: 69073 | D20: =C20/B20 -> 0.86938955317809941 | E20: 6396 | F20: =E20/B20 -> 8.0503461296412837E-2 | G20: 644 | H20: =G20/B20 -> 8.1057268722466956E-3 | I20: 1288 | J20: =I20/B20 -> 1.6211453744493391E-2 | K20: 63 | L20: =K20/B20 -> 7.9295154185022026E-4 | M20: 1750 | N20: =M20/B20 -> 2.2026431718061675E-2 | O20: 236 | P20: =O20/B20 -> 2.9704216488357455E-3 | Q20: 4292 | R20: =Q20/B20 -> 5.4021397105097547E-2
A21: 19 | B21: 80080 | C21: 73554 | D21: =C21/B21 -> 0.91850649350649349 | E21: 5114 | F21: =E21/B21 -> 6.3861138861138866E-2 | G21: 507 | H21: =G21/B21 -> 6.3311688311688315E-3 | I21: 466 | J21: =I21/B21 -> 5.8191808191808189E-3 | K21: 31 | L21: =K21/B21 -> 3.8711288711288711E-4 | M21: 299 | N21: =M21/B21 -> 3.7337662337662337E-3 | O21: 109 | P21: =O21/B21 -> 1.3611388611388612E-3 | Q21: 1019 | R21: =Q21/B21 -> 1.2724775224775225E-2
A22: 20 | B22: 79334 | C22: 69268 | D22: =C22/B22 -> 0.87311871328812363 | E22: 7495 | F22: =E22/B22 -> 9.44739960168402E-2 | G22: 432 | H22: =G22/B22 -> 5.4453323921647718E-3 | I22: 667 | J22: =I22/B22 -> 8.4074923740136646E-3 | K22: 42 | L22: =K22/B22 -> 5.2940731590490832E-4 | M22: 1200 | N22: =M22/B22 -> 1.512592331156881E-2 | O22: 230 | P22: =O22/B22 -> 2.8991353013840221E-3 | Q22: 2580 | R22: =Q22/B22 -> 3.252073511987294E-2
A23: 21 | B23: 79608 | C23: 45487 | D23: =C23/B23 -> 0.5713872977590192 | E23: 20209 | F23: =E23/B23 -> 0.25385639634207618 | G23: 516 | H23: =G23/B23 -> 6.4817606270726564E-3 | I23: 10340 | J23: =I23/B23 -> 0.1298864435735102 | K23: 136 | L23: =K23/B23 -> 1.708371017988142E-3 | M23: 1798 | N23: =M23/B23 -> 2.2585669781931463E-2 | O23: 1122 | P23: =O23/B23 -> 1.4094060898402171E-2 | Q23: 5567 | R23: =Q23/B23 -> 6.9930157773088128E-2
A24: 22 | B24: 79307 | C24: 59135 | D24: =C24/B24 -> 0.74564666422888271 | E24: 17584 | F24: =E24/B24 -> 0.22172065517545739 | G24: 425 | H24: =G24/B24 -> 5.3589216588699612E-3 | I24: 1165 | J24: =I24/B24 -> 1.4689749959020011E-2 | K24: 40 | L24: =K24/B24 -> 5.0436909730540815E-4 | M24: 659 | N24: =M24/B24 -> 8.3094808781065989E-3 | O24: 299 | P24: =O24/B24 -> 3.7701590023579254E-3 | Q24: 1773 | R24: =Q24/B24 -> 2.2356160238062212E-2
A25: 23 | B25: 79330 | C25: 62083 | D25: =C25/B25 -> 0.78259170553384594 | E25: 13129 | F25: =E25/B25 -> 0.16549855035925878 | G25: 520 | H25: =G25/B25 -> 6.5548972645909495E-3 | I25: 2185 | J25: =I25/B25 -> 2.7543174082944662E-2 | K25: 43 | L25: =K25/B25 -> 5.4203958149502077E-4 | M25: 1034 | N25: =M25/B25 -> 1.3034161099205849E-2 | O25: 336 | P25: =O25/B25 -> 4.2354720786587675E-3 | Q25: 2087 | R25: =Q25/B25 -> 2.6307828060002522E-2
A26: 24 | B26: 79678 | C26: 70684 | D26: =C26/B26 -> 0.88712066065915307 | E26: 6873 | F26: =E26/B26 -> 8.6259695273475739E-2 | G26: 796 | H26: =G26/B26 -> 9.9902105976555633E-3 | I26: 590 | J26: =I26/B26 -> 7.4048043374582697E-3 | K26: 50 | L26: =K26/B26 -> 6.275257913100228E-4 | M26: 500 | N26: =M26/B26 -> 6.2752579131002285E-3 | O26: 185 | P26: =O26/B26 -> 2.3218454278470845E-3 | Q26: 1424 | R26: =Q26/B26 -> 1.787193453650945E-2
A27: 25 | B27: 80011 | C27: 73736 | D27: =C27/B27 -> 0.92157328367349489 | E27: 3153 | F27: =E27/B27 -> 3.9407081526290133E-2 | G27: 361 | H27: =G27/B27 -> 4.5118796165527237E-3 | I27: 1202 | J27: =I27/B27 -> 1.5022934346527352E-2 | K27: 17 | L27: =K27/B27 -> 2.1247078526702578E-4 | M27: 1414 | N27: =M27/B27 -> 1.7672570021622026E-2 | O27: 128 | P27: =O27/B27 -> 1.5997800302458413E-3 | Q27: 2893 | R27: =Q27/B27 -> 3.6157528339853272E-2
A28: 26 | B28: 80688 | C28: 67806 | D28: =C28/B28 -> 0.84034800713860802 | E28: 4085 | F28: =E28/B28 -> 5.0627106880824904E-2 | G28: 508 | H28: =G28/B28 -> 6.2958556414832445E-3 | I28: 2338 | J28: =I28/B28 -> 2.8975808050763434E-2 | K28: 78 | L28: =K28/B28 -> 9.6668649613325397E-4 | M28: 5542 | N28: =M28/B28 -> 6.8684314891929402E-2 | O28: 331 | P28: =O28/B28 -> 4.1022209002577834E-3 | Q28: 9906 | R28: =Q28/B28 -> 0.12276918500892325
A29: 27 | B29: 79381 | C29: 56899 | D29: =C29/B29 -> 0.71678361320719064 | E29: 15961 | F29: =E29/B29 -> 0.20106826570589939 | G29: 612 | H29: =G29/B29 -> 7.7096534435192304E-3 | I29: 3006 | J29: =I29/B29 -> 3.7868003678462103E-2 | K29: 76 | L29: =K29/B29 -> 9.5740794396644035E-4 | M29: 2223 | N29: =M29/B29 -> 2.8004182361018381E-2 | O29: 604 | P29: =O29/B29 -> 7.6088736599438152E-3 | Q29: 5022 | R29: =Q29/B29 -> 6.3264509139466629E-2
A30: 28 | B30: 79304 | C30: 56206 | D30: =C30/B30 -> 0.70874104710985575 | E30: 15873 | F30: =E30/B30 -> 0.20015383839402803 | G30: 772 | H30: =G30/B30 -> 9.7346918188237659E-3 | I30: 2555 | J30: =I30/B30 -> 3.2217794814889539E-2 | K30: 119 | L30: =K30/B30 -> 1.5005548269948553E-3 | M30: 3012 | N30: =M30/B30 -> 3.7980429738726923E-2 | O30: 767 | P30: =O30/B30 -> 9.6716432966811264E-3 | Q30: 7076 | R30: =Q30/B30 -> 8.9226268536265516E-2
A31: 29 | B31: 80185 | C31: 68835 | D31: =C31/B31 -> 0.85845232898921242 | E31: 5568 | F31: =E31/B31 -> 6.9439421338155519E-2 | G31: 547 | H31: =G31/B31 -> 6.8217247614890562E-3 | I31: 1293 | J31: =I31/B31 -> 1.6125210450832449E-2 | K31: 39 | L31: =K31/B31 -> 4.863752572176841E-4 | M31: 3611 | N31: =M31/B31 -> 4.5033360354180957E-2 | O31: 292 | P31: =O31/B31 -> 3.6415788489118912E-3 | Q31: 6624 | R31: =Q31/B31 -> 8.2608966764357417E-2
A32: 30 | B32: 80583 | C32: 62914 | D32: =C32/B32 -> 0.78073539083925891 | E32: 12893 | F32: =E32/B32 -> 0.15999652532171799 | G32: 607 | H32: =G32/B32 -> 7.5326061328071679E-3 | I32: 1060 | J32: =I32/B32 -> 1.3154139210503455E-2 | K32: 83 | L32: =K32/B32 -> 1.0299939193130065E-3 | M32: 2667 | N32: =M32/B32 -> 3.3096310636238413E-2 | O32: 359 | P32: =O32/B32 -> 4.4550339401610763E-3 | Q32: 5030 | R32: =Q32/B32 -> 6.2420113423426779E-2
A33: 31 | B33: 79210 | C33: 50345 | D33: =C33/B33 -> 0.63558894079030426 | E33: 16867 | F33: =E33/B33 -> 0.21294028531751041 | G33: 788 | H33: =G33/B33 -> 9.9482388587299585E-3 | I33: 5459 | J33: =I33/B33 -> 6.8918065900770098E-2 | K33: 180 | L33: =K33/B33 -> 2.2724403484408536E-3 | M33: 4661 | N33: =M33/B33 -> 5.8843580356015654E-2 | O33: 910 | P33: =O33/B33 -> 1.148844842822876E-2 | Q33: 11324 | R33: =Q33/B33 -> 0.14296174725413457
A34: 32 | B34: 80268 | C34: 55738 | D34: =C34/B34 -> 0.69439876414013058 | E34: 6514 | F34: =E34/B34 -> 8.1153136991079886E-2 | G34: 379 | H34: =G34/B34 -> 4.7216823640803306E-3 | I34: 14332 | J34: =I34/B34 -> 0.17855185129815118 | K34: 76 | L34: =K34/B34 -> 9.4682812577864155E-4 | M34: 2533 | N34: =M34/B34 -> 3.1556784771017095E-2 | O34: 696 | P34: =O34/B34 -> 8.6709523097622965E-3 | Q34: 7420 | R34: =Q34/B34 -> 9.2440324911546315E-2
A35: 33 | B35: 80760 | C35: 70605 | D35: =C35/B35 -> 0.87425705794947994 | E35: 4462 | F35: =E35/B35 -> 5.5250123823675085E-2 | G35: 478 | H35: =G35/B35 -> 5.91877166914314E-3 | I35: 2804 | J35: =I35/B35 -> 3.4720158494304112E-2 | K35: 75 | L35: =K35/B35 -> 9.2867756315007425E-4 | M35: 1984 | N35: =M35/B35 -> 2.4566617137196631E-2 | O35: 352 | P35: =O35/B35 -> 4.3585933630510155E-3 | Q35: 5091 | R35: =Q35/B35 -> 6.3038632986627041E-2
A36: 34 | B36: 80722 | C36: 61693 | D36: =C36/B36 -> 0.7642650083000917 | E36: 2920 | F36: =E36/B36 -> 3.6173533856941109E-2 | G36: 286 | H36: =G36/B36 -> 3.5430242065360123E-3 | I36: 13316 | J36: =I36/B36 -> 0.16496122494487253 | K36: 79 | L36: =K36/B36 -> 9.7866752558162587E-4 | M36: 1987 | N36: =M36/B36 -> 2.4615346497856842E-2 | O36: 441 | P36: =O36/B36 -> 5.4631946681202147E-3 | Q36: 5819 | R36: =Q36/B36 -> 7.2086915586828865E-2
A37: 35 | B37: 80213 | C37: 53780 | D37: =C37/B37 -> 0.67046488723772957 | E37: 4175 | F37: =E37/B37 -> 5.2048919751162527E-2 | G37: 376 | H37: =G37/B37 -> 4.6875194793861343E-3 | I37: 18124 | J37: =I37/B37 -> 0.22594841235211249 | K37: 84 | L37: =K37/B37 -> 1.0472117985862641E-3 | M37: 3122 | N37: =M37/B37 -> 3.892137184745615E-2 | O37: 552 | P37: =O37/B37 -> 6.8816775335668783E-3 | Q37: 8037 | R37: =Q37/B37 -> 0.10019572887187862
A38: 36 | B38: 79746 | C38: 53210 | D38: =C38/B38 -> 0.66724349810648809 | E38: 7677 | F38: =E38/B38 -> 9.6268151380633507E-2 | G38: 453 | H38: =G38/B38 -> 5.6805357008501995E-3 | I38: 14093 | J38: =I38/B38 -> 0.17672359742181426 | K38: 55 | L38: =K38/B38 -> 6.8968976500388733E-4 | M38: 3598 | N38: =M38/B38 -> 4.5118250445163391E-2 | O38: 660 | P38: =O38/B38 -> 8.276277180046648E-3 | Q38: 8819 | R38: =Q38/B38 -> 0.11058861886489604
A39: 37 | B39: 80255 | C39: 47377 | D39: =C39/B39 -> 0.5903308205096256 | E39: 6773 | F39: =E39/B39 -> 8.4393495732353122E-2 | G39: 487 | H39: =G39/B39 -> 6.0681577471808608E-3 | I39: 20703 | J39: =I39/B39 -> 0.2579652358108529 | K39: 75 | L39: =K39/B39 -> 9.3452121363154941E-4 | M39: 4142 | N39: =M39/B39 -> 5.1610491558158368E-2 | O39: 698 | P39: =O39/B39 -> 8.6972774281976195E-3 | Q39: 10555 | R39: =Q39/B39 -> 0.13151828546508007
A40: 38 | B40: 80758 | C40: 42448 | D40: =C40/B40 -> 0.52561975284182372 | E40: 8220 | F40: =E40/B40 -> 0.10178558161420541 | G40: 764 | H40: =G40/B40 -> 9.4603630600064385E-3 | I40: 16430 | J40: =I40/B40 -> 0.2034473364867877 | K40: 90 | L40: =K40/B40 -> 1.1144406746080883E-3 | M40: 12070 | N40: =M40/B40 -> 0.14945887713910697 | O40: 736 | P40: =O40/B40 -> 9.1136481834617009E-3 | Q40: 25694 | R40: =Q40/B40 -> 0.31816042992644694
A41: 39 | B41: 80710 | C41: 46876 | D41: =C41/B41 -> 0.5807954404658654 | E41: 7970 | F41: =E41/B41 -> 9.8748606120678969E-2 | G41: 608 | H41: =G41/B41 -> 7.5331433527443935E-3 | I41: 17106 | J41: =I41/B41 -> 0.21194399702639077 | K41: 104 | L41: =K41/B41 -> 1.288563994548383E-3 | M41: 7296 | N41: =M41/B41 -> 9.0397720232932716E-2 | O41: 750 | P41: =O41/B41 -> 9.2925288068393015E-3 | Q41: 15374 | R41: =Q41/B41 -> 0.19048445050179655
A42: 40 | B42: 80729 | C42: 55837 | D42: =C42/B42 -> 0.69165975052335593 | E42: 5581 | F42: =E42/B42 -> 6.9132529821997052E-2 | G42: 453 | H42: =G42/B42 -> 5.6113664234661645E-3 | I42: 15153 | J42: =I42/B42 -> 0.18770206493329536 | K42: 125 | L42: =K42/B42 -> 1.5483902934509285E-3 | M42: 2995 | N42: =M42/B42 -> 3.7099431431084247E-2 | O42: 585 | P42: =O42/B42 -> 7.2464665733503447E-3 | Q42: 7868 | R42: =Q42/B42 -> 9.7461878630975232E-2
A43: 41 | B43: 80792 | C43: 54579 | D43: =C43/B43 -> 0.67554955936231309 | E43: 5080 | F43: =E43/B43 -> 6.2877512625012372E-2 | G43: 420 | H43: =G43/B43 -> 5.1985345083671647E-3 | I43: 16675 | J43: =I43/B43 -> 0.20639419744529161 | K43: 105 | L43: =K43/B43 -> 1.2996336270917912E-3 | M43: 3398 | N43: =M43/B43 -> 4.20586196653134E-2 | O43: 535 | P43: =O43/B43 -> 6.6219427666105559E-3 | Q43: 9941 | R43: =Q43/B43 -> 0.12304436082780473
A44: 42 | B44: 79964 | C44: 55174 | D44: =C44/B44 -> 0.68998549347206239 | E44: 8666 | F44: =E44/B44 -> 0.10837376819568806 | G44: 492 | H44: =G44/B44 -> 6.1527687459356712E-3 | I44: 12522 | J44: =I44/B44 -> 0.15659546796058227 | K44: 145 | L44: =K44/B44 -> 1.8133159921964884E-3 | M44: 2280 | N44: =M44/B44 -> 2.8512830773848231E-2 | O44: 685 | P44: =O44/B44 -> 8.5663548596868599E-3 | Q44: 7461 | R44: =Q44/B44 -> 9.3304487019158625E-2
A45: 43 | B45: 80750 | C45: 47821 | D45: =C45/B45 -> 0.59221052631578952 | E45: 14789 | F45: =E45/B45 -> 0.18314551083591332 | G45: 547 | H45: =G45/B45 -> 6.773993808049536E-3 | I45: 11263 | J45: =I45/B45 -> 0.13947987616099072 | K45: 117 | L45: =K45/B45 -> 1.4489164086687305E-3 | M45: 5415 | N45: =M45/B45 -> 6.7058823529411768E-2 | O45: 798 | P45: =O45/B45 -> 9.8823529411764706E-3 | Q45: 12611 | R45: =Q45/B45 -> 0.1561733746130031
A46: 44 | B46: 80796 | C46: 44799 | D46: =C46/B46 -> 0.55447051834249217 | E46: 18328 | F46: =E46/B46 -> 0.22684291301549581 | G46: 631 | H46: =G46/B46 -> 7.8097925639883164E-3 | I46: 6018 | J46: =I46/B46 -> 7.4483885340858452E-2 | K46: 123 | L46: =K46/B46 -> 1.522352591712461E-3 | M46: 9984 | N46: =M46/B46 -> 0.12357047378583098 | O46: 913 | P46: =O46/B46 -> 1.1300064359621763E-2 | Q46: 19469 | R46: =Q46/B46 -> 0.24096489925243825
A47: 45 | B47: 80240 | C47: 59905 | D47: =C47/B47 -> 0.74657278165503493 | E47: 9859 | F47: =E47/B47 -> 0.12286889332003988 | G47: 610 | H47: =G47/B47 -> 7.6021934197407779E-3 | I47: 3933 | J47: =I47/B47 -> 4.9015453639082752E-2 | K47: 94 | L47: =K47/B47 -> 1.1714855433698904E-3 | M47: 5289 | N47: =M47/B47 -> 6.5914755732801589E-2 | O47: 550 | P47: =O47/B47 -> 6.8544366899302095E-3 | Q47: 11072 | R47: =Q47/B47 -> 0.13798604187437688
A48: 46 | B48: 80333 | C48: 41531 | D48: =C48/B48 -> 0.51698554765787408 | E48: 23285 | F48: =E48/B48 -> 0.28985597450611827 | G48: 484 | H48: =G48/B48 -> 6.0249212652334653E-3 | I48: 7435 | J48: =I48/B48 -> 9.2552251254154588E-2 | K48: 112 | L48: =K48/B48 -> 1.3941966564176614E-3 | M48: 6541 | N48: =M48/B48 -> 8.1423574371677895E-2 | O48: 945 | P48: =O48/B48 -> 1.1763534288524018E-2 | Q48: 13746 | R48: =Q48/B48 -> 0.17111274320640335
A49: 47 | B49: 80757 | C49: 61673 | D49: =C49/B49 -> 0.76368612008866099 | E49: 4226 | F49: =E49/B49 -> 5.2329828993152298E-2 | G49: 702 | H49: =G49/B49 -> 8.6927449013707789E-3 | I49: 8755 | J49: =I49/B49 -> 0.10841165471723814 | K49: 101 | L49: =K49/B49 -> 1.2506655769778472E-3 | M49: 4753 | N49: =M49/B49 -> 5.8855579082927795E-2 | O49: 547 | P49: =O49/B49 -> 6.7734066396721027E-3 | Q49: 10754 | R49: =Q49/B49 -> 0.13316492687940365
A50: 48 | B50: 79492 | C50: 63919 | D50: =C50/B50 -> 0.80409349368489913 | E50: 3596 | F50: =E50/B50 -> 4.523725657927842E-2 | G50: 372 | H50: =G50/B50 -> 4.679716197856388E-3 | I50: 9544 | J50: =I50/B50 -> 0.12006239621597142 | K50: 73 | L50: =K50/B50 -> 9.183314044180547E-4 | M50: 1586 | N50: =M50/B50 -> 1.9951693252151161E-2 | O50: 402 | P50: =O50/B50 -> 5.0571126654254516E-3 | Q50: 5831 | R50: =Q50/B50 -> 7.3353293413173648E-2
A51: 49 | B51: 80609 | C51: 42754 | D51: =C51/B51 -> 0.53038742572169362 | E51: 14262 | F51: =E51/B51 -> 0.17692813457554368 | G51: 734 | H51: =G51/B51 -> 9.105682988251932E-3 | I51: 11082 | J51: =I51/B51 -> 0.13747844533488818 | K51: 145 | L51: =K51/B51 -> 1.7988065848726568E-3 | M51: 10609 | N51: =M51/B51 -> 0.13161061419940701 | O51: 1023 | P51: =O51/B51 -> 1.2690890595342952E-2 | Q51: 21749 | R51: =Q51/B51 -> 0.26980858216824422
A52: 50 | B52: 80677 | C52: 50040 | D52: =C52/B52 -> 0.62025112485590683 | E52: 12052 | F52: =E52/B52 -> 0.14938582247728596 | G52: 687 | H52: =G52/B52 -> 8.515438105036131E-3 | I52: 6540 | J52: =I52/B52 -> 8.1063995934405095E-2 | K52: 143 | L52: =K52/B52 -> 1.7725002169143621E-3 | M52: 10321 | N52: =M52/B52 -> 0.12792989327813378 | O52: 894 | P52: =O52/B52 -> 1.1081225132317761E-2 | Q52: 21171 | R52: =Q52/B52 -> 0.26241679784820954
A53: 51 | B53: 80372 | C53: 55264 | D53: =C53/B53 -> 0.68760264768824964 | E53: 13338 | F53: =E53/B53 -> 0.16595331707559846 | G53: 791 | H53: =G53/B53 -> 9.841735927935101E-3 | I53: 5744 | J53: =I53/B53 -> 7.1467675309809381E-2 | K53: 148 | L53: =K53/B53 -> 1.8414373164783756E-3 | M53: 4258 | N53: =M53/B53 -> 5.2978649280844073E-2 | O53: 829 | P53: =O53/B53 -> 1.0314537401084956E-2 | Q53: 10775 | R53: =Q53/B53 -> 0.1340641019260439
A54: 52 | B54: 79290 | C54: 33564 | D54: =C54/B54 -> 0.42330684827847143 | E54: 25067 | F54: =E54/B54 -> 0.31614327153487198 | G54: 1042 | H54: =G54/B54 -> 1.3141631983856728E-2 | I54: 6144 | J54: =I54/B54 -> 7.7487703367385544E-2 | K54: 128 | L54: =K54/B54 -> 1.6143271534871989E-3 | M54: 11922 | N54: =M54/B54 -> 0.15035944003026863 | O54: 1423 | P54: =O54/B54 -> 1.7946777651658467E-2 | Q54: 23127 | R54: =Q54/B54 -> 0.29167612561483164
A55: 53 | B55: 80049 | C55: 48549 | D55: =C55/B55 -> 0.60649102424764834 | E55: 4632 | F55: =E55/B55 -> 5.7864557958250573E-2 | G55: 604 | H55: =G55/B55 -> 7.5453784556958866E-3 | I55: 17736 | J55: =I55/B55 -> 0.22156429187122886 | K55: 59 | L55: =K55/B55 -> 7.3704855775837304E-4 | M55: 7815 | N55: =M55/B55 -> 9.7627703031892971E-2 | O55: 654 | P55: =O55/B55 -> 8.1699958775250155E-3 | Q55: 16791 | R55: =Q55/B55 -> 0.20975902259865833
A56: 54 | B56: 80155 | C56: 58394 | D56: =C56/B56 -> 0.72851350508389989 | E56: 15091 | F56: =E56/B56 -> 0.18827272160189631 | G56: 609 | H56: =G56/B56 -> 7.5977793026012104E-3 | I56: 2438 | J56: =I56/B56 -> 3.0416068866571017E-2 | K56: 137 | L56: =K56/B56 -> 1.7091884473831951E-3 | M56: 2865 | N56: =M56/B56 -> 3.5743247458050027E-2 | O56: 621 | P56: =O56/B56 -> 7.7474892395982785E-3 | Q56: 6404 | R56: =Q56/B56 -> 7.9895203044102053E-2
A57: 55 | B57: 79578 | C57: 63245 | D57: =C57/B57 -> 0.7947548317374149 | E57: 13351 | F57: =E57/B57 -> 0.16777249993716856 | G57: 658 | H57: =G57/B57 -> 8.2686169544346419E-3 | I57: 1120 | J57: =I57/B57 -> 1.4074241624569604E-2 | K57: 54 | L57: =K57/B57 -> 6.7857950689889169E-4 | M57: 787 | N57: =M57/B57 -> 9.8896679986931069E-3 | O57: 363 | P57: =O57/B57 -> 4.5615622408203271E-3 | Q57: 2068 | R57: =Q57/B57 -> 2.5987081856794592E-2
A58: 56 | B58: 79271 | C58: 62856 | D58: =C58/B58 -> 0.7929255339279182 | E58: 10005 | F58: =E58/B58 -> 0.12621261243077544 | G58: 421 | H58: =G58/B58 -> 5.3108955355678621E-3 | I58: 5022 | J58: =I58/B58 -> 6.3352297813828506E-2 | K58: 51 | L58: =K58/B58 -> 6.4336264207591682E-4 | M58: 608 | N58: =M58/B58 -> 7.6698918898462235E-3 | O58: 308 | P58: =O58/B58 -> 3.8854057599878897E-3 | Q58: 1904 | R58: =Q58/B58 -> 2.4018871970834226E-2
A59: 57 | B59: 80778 | C59: 55937 | D59: =C59/B59 -> 0.69247814999133428 | E59: 14615 | F59: =E59/B59 -> 0.18092797543885711 | G59: 513 | H59: =G59/B59 -> 6.3507390626160592E-3 | I59: 6584 | J59: =I59/B59 -> 8.1507341107727352E-2 | K59: 70 | L59: =K59/B59 -> 8.6657258164351679E-4 | M59: 2590 | N59: =M59/B59 -> 3.2063185520810118E-2 | O59: 469 | P59: =O59/B59 -> 5.8060362970115626E-3 | Q59: 5761 | R59: =Q59/B59 -> 7.1318923469261428E-2
A60: 58 | B60: 80767 | C60: 71271 | D60: =C60/B60 -> 0.88242722894251369 | E60: 5948 | F60: =E60/B60 -> 7.3643938737355599E-2 | G60: 453 | H60: =G60/B60 -> 5.6087263362511915E-3 | I60: 1601 | J60: =I60/B60 -> 1.982245223915708E-2 | K60: 38 | L60: =K60/B60 -> 4.7048918493939354E-4 | M60: 1214 | N60: =M60/B60 -> 1.5030891329379573E-2 | O60: 242 | P60: =O60/B60 -> 2.9962732304035064E-3 | Q60: 2569 | R60: =Q60/B60 -> 3.1807545160771104E-2
A61: 59 | B61: 79345 | C61: 61136 | D61: =C61/B61 -> 0.77050853866028102 | E61: 16314 | F61: =E61/B61 -> 0.2056084189299893 | G61: 458 | H61: =G61/B61 -> 5.7722603818766149E-3 | I61: 561 | J61: =I61/B61 -> 7.0703888083685175E-3 | K61: 50 | L61: =K61/B61 -> 6.3015943033587494E-4 | M61: 596 | N61: =M61/B61 -> 7.5115004096036296E-3 | O61: 230 | P61: =O61/B61 -> 2.8987333795450249E-3 | Q61: 1436 | R61: =Q61/B61 -> 1.8098178839246328E-2
A62: 60 | B62: 79219 | C62: 50287 | D62: =C62/B62 -> 0.6347845845062422 | E62: 27103 | F62: =E62/B62 -> 0.34212751991315216 | G62: 439 | H62: =G62/B62 -> 5.5415998687183632E-3 | I62: 440 | J62: =I62/B62 -> 5.5542231030434614E-3 | K62: 25 | L62: =K62/B62 -> 3.155808581274694E-4 | M62: 689 | N62: =M62/B62 -> 8.6974084499930569E-3 | O62: 236 | P62: =O62/B62 -> 2.9790833007233113E-3 | Q62: 1407 | R62: =Q62/B62 -> 1.7760890695413978E-2
A63: 61 | B63: 79792 | C63: 50089 | D63: =C63/B63 -> 0.62774463605373976 | E63: 27384 | F63: =E63/B63 -> 0.34319229997994788 | G63: 537 | H63: =G63/B63 -> 6.7299979947864448E-3 | I63: 422 | J63: =I63/B63 -> 5.2887507519550833E-3 | K63: 30 | L63: =K63/B63 -> 3.7597754160818126E-4 | M63: 1030 | N63: =M63/B63 -> 1.290856226188089E-2 | O63: 300 | P63: =O63/B63 -> 3.7597754160818126E-3 | Q63: 2085 | R63: =Q63/B63 -> 2.6130439141768599E-2
A64: 62 | B64: 79677 | C64: 52025 | D64: =C64/B64 -> 0.65294878070208462 | E64: 20686 | F64: =E64/B64 -> 0.2596232287862244 | G64: 720 | H64: =G64/B64 -> 9.0364848074099176E-3 | I64: 2339 | J64: =I64/B64 -> 2.9356024950738607E-2 | K64: 139 | L64: =K64/B64 -> 1.7445435947638591E-3 | M64: 3164 | N64: =M64/B64 -> 3.9710330459229136E-2 | O64: 604 | P64: =O64/B64 -> 7.5806066995494307E-3 | Q64: 6078 | R64: =Q64/B64 -> 7.6282992582552056E-2
A65: 63 | B65: 79602 | C65: 28243 | D65: =C65/B65 -> 0.35480264314966958 | E65: 48039 | F65: =E65/B65 -> 0.6034898620637672 | G65: 440 | H65: =G65/B65 -> 5.5274993090625862E-3 | I65: 823 | J65: =I65/B65 -> 1.0338936207632973E-2 | K65: 85 | L65: =K65/B65 -> 1.0678123665234542E-3 | M65: 1361 | N65: =M65/B65 -> 1.7097560362804954E-2 | O65: 611 | P65: =O65/B65 -> 7.6756865405391821E-3 | Q65: 3111 | R65: =Q65/B65 -> 3.9081932614758425E-2
A66: 64 | B66: 79262 | C66: 57100 | D66: =C66/B66 -> 0.72039564987005122 | E66: 19728 | F66: =E66/B66 -> 0.24889606621079458 | G66: 563 | H66: =G66/B66 -> 7.1030254094017311E-3 | I66: 886 | J66: =I66/B66 -> 1.1178118139840024E-2 | K66: 55 | L66: =K66/B66 -> 6.9390123892912119E-4 | M66: 563 | N66: =M66/B66 -> 7.1030254094017311E-3 | O66: 367 | P66: =O66/B66 -> 4.6302137215815898E-3 | Q66: 1582 | R66: =Q66/B66 -> 1.9959122908833993E-2
A67: 65 | B67: 79364 | C67: 64601 | D67: =C67/B67 -> 0.8139836701779144 | E67: 11248 | F67: =E67/B67 -> 0.14172672748349377 | G67: 383 | H67: =G67/B67 -> 4.8258656317725921E-3 | I67: 2222 | J67: =I67/B67 -> 2.7997580767098431E-2 | K67: 38 | L67: =K67/B67 -> 4.7880651176856006E-4 | M67: 576 | N67: =M67/B67 -> 7.257698704702384E-3 | O67: 296 | P67: =O67/B67 -> 3.729650723249836E-3 | Q67: 1834 | R67: =Q67/B67 -> 2.3108714278514186E-2
A68: 66 | B68: 79397 | C68: 60025 | D68: =C68/B68 -> 0.75601093240298756 | E68: 14125 | F68: =E68/B68 -> 0.17790344723352267 | G68: 539 | H68: =G68/B68 -> 6.7886695970880515E-3 | I68: 2507 | J68: =I68/B68 -> 3.1575500333765757E-2 | K68: 75 | L68: =K68/B68 -> 9.4462007380631508E-4 | M68: 1621 | N68: =M68/B68 -> 2.0416388528533825E-2 | O68: 505 | P68: =O68/B68 -> 6.3604418302958552E-3 | Q68: 3767 | R68: =Q68/B68 -> 4.7445117573711851E-2
A69: 67 | B69: 79633 | C69: 53298 | D69: =C69/B69 -> 0.66929539261361493 | E69: 4756 | F69: =E69/B69 -> 5.9723983775570429E-2 | G69: 328 | H69: =G69/B69 -> 4.1188954327979607E-3 | I69: 17683 | J69: =I69/B69 -> 0.22205618273831201 | K69: 128 | L69: =K69/B69 -> 1.6073738274333504E-3 | M69: 3015 | N69: =M69/B69 -> 3.7861188200871497E-2 | O69: 425 | P69: =O69/B69 -> 5.3369834113997962E-3 | Q69: 7838 | R69: =Q69/B69 -> 9.8426531714239068E-2
A70: 68 | B70: 79611 | C70: 69144 | D70: =C70/B70 -> 0.86852319403097566 | E70: 6073 | F70: =E70/B70 -> 7.6283428169474074E-2 | G70: 353 | H70: =G70/B70 -> 4.4340606197636008E-3 | I70: 2825 | J70: =I70/B70 -> 3.5485046036351761E-2 | K70: 46 | L70: =K70/B70 -> 5.7780959917599331E-4 | M70: 878 | N70: =M70/B70 -> 1.1028626697315698E-2 | O70: 292 | P70: =O70/B70 -> 3.6678348469432616E-3 | Q70: 2383 | R70: =Q70/B70 -> 2.9933049452965044E-2
A71: 69 | B71: 79386 | C71: 24416 | D71: =C71/B71 -> 0.30756052704507092 | E71: 46579 | F71: =E71/B71 -> 0.58674073514221647 | G71: 467 | H71: =G71/B71 -> 5.882649333635654E-3 | I71: 1481 | J71: =I71/B71 -> 1.8655682362129344E-2 | K71: 89 | L71: =K71/B71 -> 1.1211044768598998E-3 | M71: 5600 | N71: =M71/B71 -> 7.0541405285566725E-2 | O71: 754 | P71: =O71/B71 -> 9.4978963545209478E-3 | Q71: 8424 | R71: =Q71/B71 -> 0.1061144282367168
A72: 70 | B72: 79382 | C72: 23130 | D72: =C72/B72 -> 0.29137587866266912 | E72: 46844 | F72: =E72/B72 -> 0.59010858884885742 | G72: 662 | H72: =G72/B72 -> 8.33942203522209E-3 | I72: 1502 | J72: =I72/B72 -> 1.892116600740722E-2 | K72: 84 | L72: =K72/B72 -> 1.0581743972185129E-3 | M72: 6262 | N72: =M72/B72 -> 7.8884381849789631E-2 | O72: 898 | P72: =O72/B72 -> 1.1312388198836008E-2 | Q72: 10086 | R72: =Q72/B72 -> 0.12705651155173717
A73: 71 | B73: 80322 | C73: 26832 | D73: =C73/B73 -> 0.33405542690670054 | E73: 48476 | F73: =E73/B73 -> 0.60352082866462486 | G73: 360 | H73: =G73/B73 -> 4.4819601105550158E-3 | I73: 3167 | J73: =I73/B73 -> 3.9428799083688154E-2 | K73: 49 | L73: =K73/B73 -> 6.1004457060332166E-4 | M73: 670 | N73: =M73/B73 -> 8.3414257613107241E-3 | O73: 768 | P73: =O73/B73 -> 9.5615149025173683E-3 | Q73: 1937 | R73: =Q73/B73 -> 2.4115435372625185E-2
A74: 72 | B74: 80764 | C74: 59396 | D74: =C74/B74 -> 0.73542667525134964 | E74: 11381 | F74: =E74/B74 -> 0.14091674508444357 | G74: 417 | H74: =G74/B74 -> 5.1631915209746915E-3 | I74: 6962 | J74: =I74/B74 -> 8.6201773067208165E-2 | K74: 45 | L74: =K74/B74 -> 5.571789411123768E-4 | M74: 2110 | N74: =M74/B74 -> 2.6125501461047002E-2 | O74: 453 | P74: =O74/B74 -> 5.6089346738645929E-3 | Q74: 4603 | R74: =Q74/B74 -> 5.6993214798672677E-2
A75: 73 | B75: 80135 | C75: 56598 | D75: =C75/B75 -> 0.70628314718911833 | E75: 11764 | F75: =E75/B75 -> 0.14680227116740499 | G75: 416 | H75: =G75/B75 -> 5.1912397828664126E-3 | I75: 7807 | J75: =I75/B75 -> 9.7423098521245394E-2 | K75: 55 | L75: =K75/B75 -> 6.863417982155113E-4 | M75: 2934 | N75: =M75/B75 -> 3.6613215199351096E-2 | O75: 561 | P75: =O75/B75 -> 7.0006863417982155E-3 | Q75: 6074 | R75: =Q75/B75 -> 7.5797092406563918E-2
A76: 74 | B76: 79594 | C76: 26427 | D76: =C76/B76 -> 0.33202251425986884 | E76: 48211 | F76: =E76/B76 -> 0.60571148579038625 | G76: 1012 | H76: =G76/B76 -> 1.2714526220569389E-2 | I76: 1746 | J76: =I76/B76 -> 2.1936326858808454E-2 | K76: 58 | L76: =K76/B76 -> 7.2869814307611124E-4 | M76: 1403 | N76: =M76/B76 -> 1.7626956805789382E-2 | O76: 737 | P76: =O76/B76 -> 9.2594919215016214E-3 | Q76: 2784 | R76: =Q76/B76 -> 3.4977510867653341E-2
A77: 75 | B77: 79295 | C77: 32792 | D77: =C77/B77 -> 0.41354435966958825 | E77: 44635 | F77: =E77/B77 -> 0.56289803896840906 | G77: 348 | H77: =G77/B77 -> 4.3886752002017778E-3 | I77: 326 | J77: =I77/B77 -> 4.1112302162809762E-3 | K77: 30 | L77: =K77/B77 -> 3.7833406898291191E-4 | M77: 871 | N77: =M77/B77 -> 1.0984299136137209E-2 | O77: 293 | P77: =O77/B77 -> 3.695062740399773E-3 | Q77: 1733 | R77: =Q77/B77 -> 2.1855098051579546E-2
A78: 76 | B78: 80313 | C78: 54860 | D78: =C78/B78 -> 0.68307745943994125 | E78: 21093 | F78: =E78/B78 -> 0.2626349407941429 | G78: 519 | H78: =G78/B78 -> 6.4622165776399834E-3 | I78: 2568 | J78: =I78/B78 -> 3.197489821075044E-2 | K78: 81 | L78: =K78/B78 -> 1.0085540323484367E-3 | M78: 685 | N78: =M78/B78 -> 8.5291297797367802E-3 | O78: 507 | P78: =O78/B78 -> 6.3128011654402152E-3 | Q78: 2419 | R78: =Q78/B78 -> 3.0119656842603315E-2
A79: 77 | B79: 79627 | C79: 26586 | D79: =C79/B79 -> 0.33388172353598655 | E79: 48940 | F79: =E79/B79 -> 0.61461564544689617 | G79: 538 | H79: =G79/B79 -> 6.7565021914677186E-3 | I79: 1268 | J79: =I79/B79 -> 1.5924246800708301E-2 | K79: 99 | L79: =K79/B79 -> 1.243296871664134E-3 | M79: 1445 | N79: =M79/B79 -> 1.8147110904592662E-2 | O79: 751 | P79: =O79/B79 -> 9.4314742486844919E-3 | Q79: 3518 | R79: =Q79/B79 -> 4.4180993883984075E-2
A80: 78 | B80: 80475 | C80: 60719 | D80: =C80/B80 -> 0.75450761105933517 | E80: 13832 | F80: =E80/B80 -> 0.17187946567256912 | G80: 587 | H80: =G80/B80 -> 7.2941907424666046E-3 | I80: 3772 | J80: =I80/B80 -> 4.6871699285492389E-2 | K80: 112 | L80: =K80/B80 -> 1.3917365641503573E-3 | M80: 889 | N80: =M80/B80 -> 1.104690897794346E-2 | O80: 564 | P80: =O80/B80 -> 7.0083876980428705E-3 | Q80: 3408 | R80: =Q80/B80 -> 4.2348555452003729E-2
A81: 79 | B81: 80243 | C81: 48264 | D81: =C81/B81 -> 0.60147302568448335 | E81: 25207 | F81: =E81/B81 -> 0.31413332004037736 | G81: 819 | H81: =G81/B81 -> 1.0206497763044751E-2 | I81: 2655 | J81: =I81/B81 -> 3.3086998242837382E-2 | K81: 193 | L81: =K81/B81 -> 2.4051942225490073E-3 | M81: 1701 | N81: =M81/B81 -> 2.1198110738631409E-2 | O81: 1404 | P81: =O81/B81 -> 1.7496853308076717E-2 | Q81: 5690 | R81: =Q81/B81 -> 7.0909612053387833E-2
A82: 80 | B82: 80705 | C82: 28912 | D82: =C82/B82 -> 0.35824298370609009 | E82: 47835 | F82: =E82/B82 -> 0.59271420605910419 | G82: 524 | H82: =G82/B82 -> 6.492782355492225E-3 | I82: 1488 | J82: =I82/B82 -> 1.8437519360634411E-2 | K82: 150 | L82: =K82/B82 -> 1.858620903289759E-3 | M82: 1003 | N82: =M82/B82 -> 1.2427978439997522E-2 | O82: 793 | P82: =O82/B82 -> 9.8259091753918597E-3 | Q82: 2720 | R82: =Q82/B82 -> 3.3702992379654295E-2
A83: 81 | B83: 79438 | C83: 58121 | D83: =C83/B83 -> 0.7316523578136408 | E83: 15414 | F83: =E83/B83 -> 0.19403811777738614 | G83: 755 | H83: =G83/B83 -> 9.5042674790402574E-3 | I83: 2708 | J83: =I83/B83 -> 3.4089478587074194E-2 | K83: 139 | L83: =K83/B83 -> 1.7497922908431733E-3 | M83: 1625 | N83: =M83/B83 -> 2.0456204838993932E-2 | O83: 676 | P83: =O83/B83 -> 8.5097812130214764E-3 | Q83: 4525 | R83: =Q83/B83 -> 5.6962662705506178E-2
A84: 82 | B84: 80463 | C84: 66725 | D84: =C84/B84 -> 0.82926313957968256 | E84: 8314 | F84: =E84/B84 -> 0.10332699501634292 | G84: 587 | H84: =G84/B84 -> 7.2952785752457647E-3 | I84: 2693 | J84: =I84/B84 -> 3.3468799323912855E-2 | K84: 138 | L84: =K84/B84 -> 1.7150740091719176E-3 | M84: 1446 | N84: =M84/B84 -> 1.797099287871444E-2 | O84: 560 | P84: =O84/B84 -> 6.9597206169295205E-3 | Q84: 4252 | R84: =Q84/B84 -> 5.2844164398543426E-2
A85: 83 | B85: 79538 | C85: 58152 | D85: =C85/B85 -> 0.73112223088335138 | E85: 13407 | F85: =E85/B85 -> 0.16856093942518041 | G85: 717 | H85: =G85/B85 -> 9.0145590786793739E-3 | I85: 4392 | J85: =I85/B85 -> 5.521888908446277E-2 | K85: 150 | L85: =K85/B85 -> 1.8858910206442203E-3 | M85: 1966 | N85: =M85/B85 -> 2.4717744977243581E-2 | O85: 754 | P85: =O85/B85 -> 9.4797455304382813E-3 | Q85: 5196 | R85: =Q85/B85 -> 6.5327264955115788E-2
A86: 84 | B86: 80281 | C86: 52357 | D86: =C86/B86 -> 0.65217174673957723 | E86: 17161 | F86: =E86/B86 -> 0.21376166216165718 | G86: 598 | H86: =G86/B86 -> 7.4488359636775822E-3 | I86: 7049 | J86: =I86/B86 -> 8.7804088140406827E-2 | K86: 228 | L86: =K86/B86 -> 2.8400244142449647E-3 | M86: 1997 | N86: =M86/B86 -> 2.4875126119505236E-2 | O86: 891 | P86: =O86/B86 -> 1.109851646093098E-2 | Q86: 6168 | R86: =Q86/B86 -> 7.6830134153784826E-2
A87: 85 | B87: 80800 | C87: 53934 | D87: =C87/B87 -> 0.66749999999999998 | E87: 16822 | F87: =E87/B87 -> 0.20819306930693068 | G87: 711 | H87: =G87/B87 -> 8.7995049504950486E-3 | I87: 6348 | J87: =I87/B87 -> 7.8564356435643565E-2 | K87: 172 | L87: =K87/B87 -> 2.1287128712871289E-3 | M87: 1914 | N87: =M87/B87 -> 2.3688118811881188E-2 | O87: 899 | P87: =O87/B87 -> 1.1126237623762376E-2 | Q87: 5317 | R87: =Q87/B87 -> 6.5804455445544557E-2
A88: 86 | B88: 80747 | C88: 46400 | D88: =C88/B88 -> 0.57463435174062194 | E88: 6804 | F88: =E88/B88 -> 8.4263192440586027E-2 | G88: 545 | H88: =G88/B88 -> 6.7494767607465291E-3 | I88: 17169 | J88: =I88/B88 -> 0.21262709450505901 | K88: 72 | L88: =K88/B88 -> 8.916739940802754E-4 | M88: 8989 | N88: =M88/B88 -> 0.11132302128871661 | O88: 768 | P88: =O88/B88 -> 9.5111892701896048E-3 | Q88: 17163 | R88: =Q88/B88 -> 0.21255278833888566
A89: 87 | B89: 79275 | C89: 44093 | D89: =C89/B89 -> 0.55620309050772632 | E89: 7083 | F89: =E89/B89 -> 8.9347209082308421E-2 | G89: 437 | H89: =G89/B89 -> 5.5124566382844528E-3 | I89: 21108 | J89: =I89/B89 -> 0.26626300851466417 | K89: 83 | L89: =K89/B89 -> 1.0469883317565437E-3 | M89: 5698 | N89: =M89/B89 -> 7.1876379690949233E-2 | O89: 773 | P89: =O89/B89 -> 9.7508672343109438E-3 | Q89: 11761 | R89: =Q89/B89 -> 0.14835698517817722
A90: 88 | B90: 80191 | C90: 60158 | D90: =C90/B90 -> 0.75018393585315057 | E90: 12389 | F90: =E90/B90 -> 0.15449364641917424 | G90: 590 | H90: =G90/B90 -> 7.3574341260241177E-3 | I90: 2631 | J90: =I90/B90 -> 3.2809168111134664E-2 | K90: 122 | L90: =K90/B90 -> 1.5213677345338006E-3 | M90: 3649 | N90: =M90/B90 -> 4.5503859535359327E-2 | O90: 652 | P90: =O90/B90 -> 8.1305882206232621E-3 | Q90: 7188 | R90: =Q90/B90 -> 8.9635994064171789E-2
A91: 89 | B91: 79614 | C91: 27929 | D91: =C91/B91 -> 0.35080513477529079 | E91: 46676 | F91: =E91/B91 -> 0.58627879518677617 | G91: 490 | H91: =G91/B91 -> 6.1546964101791141E-3 | I91: 2208 | J91: =I91/B91 -> 2.7733815660562211E-2 | K91: 106 | L91: =K91/B91 -> 1.3314241213856859E-3 | M91: 1259 | N91: =M91/B91 -> 1.5813801592684702E-2 | O91: 946 | P91: =O91/B91 -> 1.1882332253121311E-2 | Q91: 3565 | R91: =Q91/B91 -> 4.4778556535282739E-2
A92: 90 | B92: 80425 | C92: 25163 | D92: =C92/B92 -> 0.31287534970469383 | E92: 48097 | F92: =E92/B92 -> 0.59803543674230653 | G92: 551 | H92: =G92/B92 -> 6.8511035125893693E-3 | I92: 3422 | J92: =I92/B92 -> 4.2548958657133977E-2 | K92: 128 | L92: =K92/B92 -> 1.5915449176251166E-3 | M92: 1886 | N92: =M92/B92 -> 2.3450419645632575E-2 | O92: 1178 | P92: =O92/B92 -> 1.4647186820018651E-2 | Q92: 4873 | R92: =Q92/B92 -> 6.0590612371774946E-2
A93: 91 | B93: 79229 | C93: 56058 | D93: =C93/B93 -> 0.70754395486501154 | E93: 16428 | F93: =E93/B93 -> 0.20734831942849211 | G93: 657 | H93: =G93/B93 -> 8.292418180211791E-3 | I93: 3840 | J93: =I93/B93 -> 4.8467101692562069E-2 | K93: 148 | L93: =K93/B93 -> 1.868002877734163E-3 | M93: 1273 | N93: =M93/B93 -> 1.6067349076726956E-2 | O93: 825 | P93: =O93/B93 -> 1.0412853879261382E-2 | Q93: 3591 | R93: =Q93/B93 -> 4.5324313067184999E-2
A94: 92 | B94: 79689 | C94: 25037 | D94: =C94/B94 -> 0.3141838898718769 | E94: 49849 | F94: =E94/B94 -> 0.62554430347977763 | G94: 610 | H94: =G94/B94 -> 7.6547578712243851E-3 | I94: 1675 | J94: =I94/B94 -> 2.1019212187378435E-2 | K94: 99 | L94: =K94/B94 -> 1.2423295561495313E-3 | M94: 1042 | N94: =M94/B94 -> 1.3075832298058703E-2 | O94: 1377 | P94: =O94/B94 -> 1.7279674735534389E-2 | Q94: 3430 | R94: =Q94/B94 -> 4.3042327046392853E-2
A95: 93 | B95: 79211 | C95: 51530 | D95: =C95/B95 -> 0.65054096022017149 | E95: 19753 | F95: =E95/B95 -> 0.24937193066619534 | G95: 551 | H95: =G95/B95 -> 6.9561045814343966E-3 | I95: 4006 | J95: =I95/B95 -> 5.0573783944149173E-2 | K95: 195 | L95: =K95/B95 -> 2.4617792983297774E-3 | M95: 2225 | N95: =M95/B95 -> 2.8089533019403871E-2 | O95: 951 | P95: =O95/B95 -> 1.2005908270315991E-2 | Q95: 5723 | R95: =Q95/B95 -> 7.2250066278673419E-2
A96: 94 | B96: 79429 | C96: 53846 | D96: =C96/B96 -> 0.67791360837981085 | E96: 18342 | F96: =E96/B96 -> 0.23092321444308753 | G96: 671 | H96: =G96/B96 -> 8.4477961449848284E-3 | I96: 3036 | J96: =I96/B96 -> 3.8222815344521523E-2 | K96: 151 | L96: =K96/B96 -> 1.9010688791247529E-3 | M96: 2417 | N96: =M96/B96 -> 3.0429691926122701E-2 | O96: 966 | P96: =O96/B96 -> 1.2161804882347757E-2 | Q96: 5773 | R96: =Q96/B96 -> 7.2681262511173503E-2
A97: 95 | B97: 80071 | C97: 23721 | D97: =C97/B97 -> 0.29624957849908207 | E97: 50522 | F97: =E97/B97 -> 0.63096501854604037 | G97: 567 | H97: =G97/B97 -> 7.0812154213135839E-3 | I97: 1834 | J97: =I97/B97 -> 2.2904672103508137E-2 | K97: 127 | L97: =K97/B97 -> 1.5860923430455471E-3 | M97: 1913 | N97: =M97/B97 -> 2.389129647437899E-2 | O97: 1387 | P97: =O97/B97 -> 1.732212661263129E-2 | Q97: 5035 | R97: =Q97/B97 -> 6.2881692497908107E-2
A98: 96 | B98: 79217 | C98: 62755 | D98: =C98/B98 -> 0.79219107009858991 | E98: 11559 | F98: =E98/B98 -> 0.14591564941868537 | G98: 515 | H98: =G98/B98 -> 6.5011298079957584E-3 | I98: 2648 | J98: =I98/B98 -> 3.3427168410820912E-2 | K98: 97 | L98: =K98/B98 -> 1.2244846434477448E-3 | M98: 1149 | N98: =M98/B98 -> 1.4504462425994421E-2 | O98: 494 | P98: =O98/B98 -> 6.2360351944658341E-3 | Q98: 3357 | R98: =Q98/B98 -> 4.2377267505712156E-2
A99: 97 | B99: 79386 | C99: 67533 | D99: =C99/B99 -> 0.85069155770538885 | E99: 8709 | F99: =E99/B99 -> 0.10970448189857154 | G99: 991 | H99: =G99/B99 -> 1.2483309399642255E-2 | I99: 1232 | J99: =I99/B99 -> 1.5519109162824679E-2 | K99: 45 | L99: =K99/B99 -> 5.6685057818758975E-4 | M99: 575 | N99: =M99/B99 -> 7.2430907212858693E-3 | O99: 301 | P99: =O99/B99 -> 3.7916005340992115E-3 | Q99: 1606 | R99: =Q99/B99 -> 2.0230267301539314E-2
A100: 98 | B100: 79251 | C100: 63155 | D100: =C100/B100 -> 0.79689846184906188 | E100: 13524 | F100: =E100/B100 -> 0.17064768898815158 | G100: 837 | H100: =G100/B100 -> 1.0561380928947268E-2 | I100: 731 | J100: =I100/B100 -> 9.2238583740268266E-3 | K100: 46 | L100: =K100/B100 -> 5.8043431628622985E-4 | M100: 654 | N100: =M100/B100 -> 8.2522618011129194E-3 | O100: 304 | P100: =O100/B100 -> 3.835913742413345E-3 | Q100: 1870 | R100: =Q100/B100 -> 2.35959167707663E-2
A101: 99 | B101: 80332 | C101: 56801 | D101: =C101/B101 -> 0.7070781257780212 | E101: 20397 | F101: =E101/B101 -> 0.2539087785689389 | G101: 687 | H101: =G101/B101 -> 8.5520091619777916E-3 | I101: 763 | J101: =I101/B101 -> 9.4980829557337054E-3 | K101: 45 | L101: =K101/B101 -> 5.6017527261863263E-4 | M101: 1286 | N101: =M101/B101 -> 1.600856445750137E-2 | O101: 353 | P101: =O101/B101 -> 4.394263805208385E-3 | Q101: 2971 | R101: =Q101/B101 -> 3.698401633222128E-2
A102: 100 | B102: 80037 | C102: 50150 | D102: =C102/B102 -> 0.62658520434299136 | E102: 23768 | F102: =E102/B102 -> 0.29696265477216788 | G102: 836 | H102: =G102/B102 -> 1.0445169109286955E-2 | I102: 1646 | J102: =I102/B102 -> 2.0565488461586515E-2 | K102: 173 | L102: =K102/B102 -> 2.1615003061084249E-3 | M102: 2868 | N102: =M102/B102 -> 3.5833427039994002E-2 | O102: 596 | P102: =O102/B102 -> 7.4465559678648626E-3 | Q102: 6573 | R102: =Q102/B102 -> 8.2124517410697553E-2

A1: HB 5005 Voting Age Population
A2: DISTRICT | B2: Voting Age Population | C2: VAP White | D2: % VAP White | E2: VAP Black | F2: % VAP Black | G2: VAP AIAN | H2: % VAP AIAN | I2: VAP Asian | J2: % VAP Asian | K2: VAP HawPI | L2: % VAP HawPI | M2: VAP Other | N2: % VAP Other | O2: VAP Multi | P2: % VAP Multi | Q2: Voting Age Hispanic | R2: % VAP Hispanic
A3: 1 | B3: 64221 | C3: 60648 | D3: =C3/B3 -> 0.94436399308637364 | E3: 2482 | F3: =E3/B3 -> 3.8647794335186308E-2 | G3: 392 | H3: =G3/B3 -> 6.1039223929867182E-3 | I3: 266 | J3: =I3/B3 -> 4.1419473380981302E-3 | K3: 22 | L3: =K3/B3 -> 3.4256707307578517E-4 | M3: 334 | N3: =M3/B3 -> 5.2007910185141934E-3 | O3: 77 | P3: =O3/B3 -> 1.1989847557652481E-3 | Q3: 754 | R3: =Q3/B3 -> 1.1740707868142819E-2
A4: 2 | B4: 56163 | C4: 33408 | D4: =C4/B4 -> 0.59484001922974206 | E4: 13686 | F4: =E4/B4 -> 0.24368356391218418 | G4: 467 | H4: =G4/B4 -> 8.3150828837490875E-3 | I4: 3894 | J4: =I4/B4 -> 6.9333903103466696E-2 | K4: 127 | L4: =K4/B4 -> 2.2612752167797305E-3 | M4: 3999 | N4: =M4/B4 -> 7.1203461353560177E-2 | O4: 582 | P4: =O4/B4 -> 1.0362694300518135E-2 | Q4: 8879 | R4: =Q4/B4 -> 0.158093406691238
A5: 3 | B5: 64745 | C5: 62065 | D5: =C5/B5 -> 0.95860684222719905 | E5: 1932 | F5: =E5/B5 -> 2.9840142095914741E-2 | G5: 267 | H5: =G5/B5 -> 4.1238705691559194E-3 | I5: 321 | J5: =I5/B5 -> 4.9579118078616107E-3 | K5: 20 | L5: =K5/B5 -> 3.0890416248358944E-4 | M5: 97 | N5: =M5/B5 -> 1.4981851880454089E-3 | O5: 43 | P5: =O5/B5 -> 6.6414394933971737E-4 | Q5: 327 | R5: =Q5/B5 -> 5.0505830566066881E-3
A6: 4 | B6: 64195 | C6: 62070 | D6: =C6/B6 -> 0.96689773346833863 | E6: 1370 | F6: =E6/B6 -> 2.1341225952176961E-2 | G6: 263 | H6: =G6/B6 -> 4.0968922813303214E-3 | I6: 197 | J6: =I6/B6 -> 3.0687748266998989E-3 | K6: 7 | L6: =K6/B6 -> 1.0904276033959031E-4 | M6: 247 | N6: =M6/B6 -> 3.8476516862684012E-3 | O6: 41 | P6: =O6/B6 -> 6.3867902484617185E-4 | Q6: 541 | R6: =Q6/B6 -> 8.4274476205311935E-3
A7: 5 | B7: 64337 | C7: 61274 | D7: =C7/B7 -> 0.95239131448466663 | E7: 1725 | F7: =E7/B7 -> 2.6811943360741098E-2 | G7: 313 | H7: =G7/B7 -> 4.865007693862008E-3 | I7: 257 | J7: =I7/B7 -> 3.9945909818611377E-3 | K7: 25 | L7: =K7/B7 -> 3.8857888928610286E-4 | M7: 669 | N7: =M7/B7 -> 1.0398371077296112E-2 | O7: 74 | P7: =O7/B7 -> 1.1501935122868645E-3 | Q7: 1353 | R7: =Q7/B7 -> 2.1029889488163887E-2
A8: 6 | B8: 62988 | C8: 60788 | D8: =C8/B8 -> 0.96507271226265323 | E8: 1231 | F8: =E8/B8 -> 1.9543405093033595E-2 | G8: 302 | H8: =G8/B8 -> 4.7945640439448784E-3 | I8: 212 | J8: =I8/B8 -> 3.3657204546897823E-3 | K8: 12 | L8: =K8/B8 -> 1.9051247856734617E-4 | M8: 402 | N8: =M8/B8 -> 6.3821680320060963E-3 | O8: 41 | P8: =O8/B8 -> 6.5091763510509936E-4 | Q8: 813 | R8: =Q8/B8 -> 1.2907220422937703E-2
A9: 7 | B9: 64401 | C9: 59855 | D9: =C9/B9 -> 0.92941103399015546 | E9: 2606 | F9: =E9/B9 -> 4.046521016754398E-2 | G9: 331 | H9: =G9/B9 -> 5.1396717442275738E-3 | I9: 1123 | J9: =I9/B9 -> 1.7437617428300804E-2 | K9: 30 | L9: =K9/B9 -> 4.6583127591186475E-4 | M9: 339 | N9: =M9/B9 -> 5.2638934178040712E-3 | O9: 117 | P9: =O9/B9 -> 1.8167419760562725E-3 | Q9: 1137 | R9: =Q9/B9 -> 1.7655005357059671E-2
A10: 8 | B10: 63208 | C10: 58658 | D10: =C10/B10 -> 0.92801544108340717 | E10: 2522 | F10: =E10/B10 -> 3.9900012656625745E-2 | G10: 341 | H10: =G10/B10 -> 5.3948867231995946E-3 | I10: 1154 | J10: =I10/B10 -> 1.8257182635109479E-2 | K10: 22 | L10: =K10/B10 -> 3.4805720794836098E-4 | M10: 432 | N10: =M10/B10 -> 6.8345779015314516E-3 | O10: 79 | P10: =O10/B10 -> 1.2498417921782052E-3 | Q10: 1012 | R10: =Q10/B10 -> 1.6010631565624604E-2
A11: 9 | B11: 64142 | C11: 56131 | D11: =C11/B11 -> 0.87510523525926853 | E11: 6385 | F11: =E11/B11 -> 9.9544760063608864E-2 | G11: 341 | H11: =G11/B11 -> 5.3163293941567149E-3 | I11: 252 | J11: =I11/B11 -> 3.9287830126905924E-3 | K11: 25 | L11: =K11/B11 -> 3.8976021951295562E-4 | M11: 940 | N11: =M11/B11 -> 1.4654984253687131E-2 | O11: 68 | P11: =O11/B11 -> 1.0601477970752394E-3 | Q11: 1388 | R11: =Q11/B11 -> 2.1639487387359296E-2
A12: 10 | B12: 56543 | C12: 43657 | D12: =C12/B12 -> 0.77210264754257818 | E12: 4894 | F12: =E12/B12 -> 8.6553596377977826E-2 | G12: 294 | H12: =G12/B12 -> 5.1995826185381039E-3 | I12: 4433 | J12: =I12/B12 -> 7.8400509346868749E-2 | K12: 49 | L12: =K12/B12 -> 8.6659710308968391E-4 | M12: 2919 | N12: =M12/B12 -> 5.1624427426914032E-2 | O12: 297 | P12: =O12/B12 -> 5.2526395840333901E-3 | Q12: 6216 | R12: =Q12/B12 -> 0.10993403250623419
A13: 11 | B13: 62356 | C13: 39559 | D13: =C13/B13 -> 0.6344056706652127 | E13: 19412 | F13: =E13/B13 -> 0.31130925652703828 | G13: 353 | H13: =G13/B13 -> 5.6610430431714674E-3 | I13: 1169 | J13: =I13/B13 -> 1.8747193533902109E-2 | K13: 36 | L13: =K13/B13 -> 5.7733016870870481E-4 | M13: 1509 | N13: =M13/B13 -> 2.4199756238373213E-2 | O13: 318 | P13: =O13/B13 -> 5.0997498235935594E-3 | Q13: 3146 | R13: =Q13/B13 -> 5.0452241965488483E-2
A14: 12 | B14: 69034 | C14: 60408 | D14: =C14/B14 -> 0.87504707825129646 | E14: 3084 | F14: =E14/B14 -> 4.467363907639714E-2 | G14: 337 | H14: =G14/B14 -> 4.8816525190485847E-3 | I14: 4401 | J14: =I14/B14 -> 6.3751195063302138E-2 | K14: 51 | L14: =K14/B14 -> 7.3876640495987485E-4 | M14: 555 | N14: =M14/B14 -> 8.0395167598574617E-3 | O14: 198 | P14: =O14/B14 -> 2.8681519251383377E-3 | Q14: 1618 | R14: =Q14/B14 -> 2.3437726337746618E-2
A15: 13 | B15: 58290 | C15: 36735 | D15: =C15/B15 -> 0.63021101389603706 | E15: 7701 | F15: =E15/B15 -> 0.13211528564076172 | G15: 461 | H15: =G15/B15 -> 7.9087322010636465E-3 | I15: 6080 | J15: =I15/B15 -> 0.10430605592726025 | K15: 64 | L15: =K15/B15 -> 1.0979584834448447E-3 | M15: 6752 | N15: =M15/B15 -> 0.11583462000343112 | O15: 497 | P15: =O15/B15 -> 8.5263338480013728E-3 | Q15: 12955 | R15: =Q15/B15 -> 0.22225081489106194
A16: 14 | B16: 62379 | C16: 39414 | D16: =C16/B16 -> 0.63184725628817395 | E16: 21270 | F16: =E16/B16 -> 0.34098013754628964 | G16: 260 | H16: =G16/B16 -> 4.1680693823241792E-3 | I16: 457 | J16: =I16/B16 -> 7.326183491239039E-3 | K16: 18 | L16: =K16/B16 -> 2.8855864954552014E-4 | M16: 812 | N16: =M16/B16 -> 1.3017201301720131E-2 | O16: 148 | P16: =O16/B16 -> 2.3725933407076098E-3 | Q16: 1461 | R16: =Q16/B16 -> 2.3421343721444717E-2
A17: 15 | B17: 62907 | C17: 59863 | D17: =C17/B17 -> 0.95161110846169739 | E17: 1209 | F17: =E17/B17 -> 1.9218846869187848E-2 | G17: 392 | H17: =G17/B17 -> 6.2314209865356801E-3 | I17: 346 | J17: =I17/B17 -> 5.5001828095442478E-3 | K17: 24 | L17: =K17/B17 -> 3.815155706042253E-4 | M17: 997 | N17: =M17/B17 -> 1.584879266218386E-2 | O17: 76 | P17: =O17/B17 -> 1.2081326402467135E-3 | Q17: 2048 | R17: =Q17/B17 -> 3.2555995358227223E-2
A18: 16 | B18: 63086 | C18: 44381 | D18: =C18/B18 -> 0.70349998414862247 | E18: 17101 | F18: =E18/B18 -> 0.27107440636591318 | G18: 283 | H18: =G18/B18 -> 4.4859398281710677E-3 | I18: 300 | J18: =I18/B18 -> 4.7554132454110266E-3 | K18: 14 | L18: =K18/B18 -> 2.219192847858479E-4 | M18: 898 | N18: =M18/B18 -> 1.4234536981263672E-2 | O18: 109 | P18: =O18/B18 -> 1.7278001458326728E-3 | Q18: 1595 | R18: =Q18/B18 -> 2.5282947088101956E-2
A19: 17 | B19: 63576 | C19: 57265 | D19: =C19/B19 -> 0.90073298099911914 | E19: 3890 | F19: =E19/B19 -> 6.1186611299861582E-2 | G19: 317 | H19: =G19/B19 -> 4.9861582987290798E-3 | I19: 1473 | J19: =I19/B19 -> 2.3169120422801056E-2 | K19: 35 | L19: =K19/B19 -> 5.5052220963885739E-4 | M19: 472 | N19: =M19/B19 -> 7.4241852271297341E-3 | O19: 124 | P19: =O19/B19 -> 1.9504215427205234E-3 | Q19: 1309 | R19: =Q19/B19 -> 2.0589530640493268E-2
A20: 18 | B20: 59686 | C20: 52508 | D20: =C20/B20 -> 0.87973729182722915 | E20: 4602 | F20: =E20/B20 -> 7.7103508360419529E-2 | G20: 460 | H20: =G20/B20 -> 7.7069999664913045E-3 | I20: 847 | J20: =I20/B20 -> 1.4190932546995945E-2 | K20: 47 | L20: =K20/B20 -> 7.8745434440237244E-4 | M20: 1096 | N20: =M20/B20 -> 1.8362765137553194E-2 | O20: 126 | P20: =O20/B20 -> 2.1110478169084879E-3 | Q20: 2635 | R20: =Q20/B20 -> 4.4147706329792584E-2
A21: 19 | B21: 62844 | C21: 58171 | D21: =C21/B21 -> 0.92564127044745714 | E21: 3726 | F21: =E21/B21 -> 5.9289669658201261E-2 | G21: 388 | H21: =G21/B21 -> 6.1740182038062504E-3 | I21: 299 | J21: =I21/B21 -> 4.7578129972630639E-3 | K21: 20 | L21: =K21/B21 -> 3.1824836102094077E-4 | M21: 174 | N21: =M21/B21 -> 2.7687607408821845E-3 | O21: 66 | P21: =O21/B21 -> 1.0502195913691045E-3 | Q21: 639 | R21: =Q21/B21 -> 1.0168035134619056E-2
A22: 20 | B22: 62717 | C22: 55842 | D22: =C22/B22 -> 0.89038059856179341 | E22: 5214 | F22: =E22/B22 -> 8.3135354050735841E-2 | G22: 330 | H22: =G22/B22 -> 5.2617312690339145E-3 | I22: 476 | J22: =I22/B22 -> 7.5896487395761911E-3 | K22: 30 | L22: =K22/B22 -> 4.7833920627581039E-4 | M22: 690 | N22: =M22/B22 -> 1.1001801744343639E-2 | O22: 135 | P22: =O22/B22 -> 2.1525264282411466E-3 | Q22: 1608 | R22: =Q22/B22 -> 2.5638981456383436E-2
A23: 21 | B23: 58656 | C23: 34776 | D23: =C23/B23 -> 0.59288052373158762 | E23: 13997 | F23: =E23/B23 -> 0.2386286142935079 | G23: 388 | H23: =G23/B23 -> 6.6148390616475724E-3 | I23: 7696 | J23: =I23/B23 -> 0.13120567375886524 | K23: 93 | L23: =K23/B23 -> 1.5855155482815057E-3 | M23: 1185 | N23: =M23/B23 -> 2.020253682487725E-2 | O23: 521 | P23: =O23/B23 -> 8.8822967812329512E-3 | Q23: 3432 | R23: =Q23/B23 -> 5.8510638297872342E-2
A24: 22 | B24: 61467 | C24: 47057 | D24: =C24/B24 -> 0.76556526266126534 | E24: 12606 | F24: =E24/B24 -> 0.20508565571770218 | G24: 341 | H24: =G24/B24 -> 5.5476922576341778E-3 | I24: 810 | J24: =I24/B24 -> 1.3177802723412563E-2 | K24: 29 | L24: =K24/B24 -> 4.7179787528267201E-4 | M24: 437 | N24: =M24/B24 -> 7.109505913742333E-3 | O24: 187 | P24: =O24/B24 -> 3.0422828509606781E-3 | Q24: 1179 | R24: =Q24/B24 -> 1.9181023964078284E-2
A25: 23 | B25: 63982 | C25: 51425 | D25: =C25/B25 -> 0.80374167734675372 | E25: 9563 | F25: =E25/B25 -> 0.1494639117251727 | G25: 423 | H25: =G25/B25 -> 6.611234409677722E-3 | I25: 1574 | J25: =I25/B25 -> 2.460066893813885E-2 | K25: 34 | L25: =K25/B25 -> 5.3139945609702733E-4 | M25: 754 | N25: =M25/B25 -> 1.1784564408739958E-2 | O25: 209 | P25: =O25/B25 -> 3.2665437154199618E-3 | Q25: 1543 | R25: =Q25/B25 -> 2.4116157669344503E-2
A26: 24 | B26: 64424 | C26: 57333 | D26: =C26/B26 -> 0.88993232335775485 | E26: 5506 | F26: =E26/B26 -> 8.5465044082950456E-2 | G26: 587 | H26: =G26/B26 -> 9.111511238047933E-3 | I26: 472 | J26: =I26/B26 -> 7.3264621880044702E-3 | K26: 38 | L26: =K26/B26 -> 5.8984229479697007E-4 | M26: 355 | N26: =M26/B26 -> 5.5103688066559043E-3 | O26: 133 | P26: =O26/B26 -> 2.0644480317893953E-3 | Q26: 990 | R26: =Q26/B26 -> 1.5366943996026325E-2
A27: 25 | B27: 61585 | C27: 57373 | D27: =C27/B27 -> 0.93160672241617282 | E27: 2232 | F27: =E27/B27 -> 3.6242591540147764E-2 | G27: 262 | H27: =G27/B27 -> 4.2542826987091008E-3 | I27: 769 | J27: =I27/B27 -> 1.2486806852317935E-2 | K27: 13 | L27: =K27/B27 -> 2.1109036291304701E-4 | M27: 853 | N27: =M27/B27 -> 1.3850775351140699E-2 | O27: 83 | P27: =O27/B27 -> 1.3477307785986848E-3 | Q27: 1717 | R27: =Q27/B27 -> 2.7880165624746284E-2
A28: 26 | B28: 65566 | C28: 56466 | D28: =C28/B28 -> 0.86120855321355583 | E28: 2921 | F28: =E28/B28 -> 4.4550529237714666E-2 | G28: 376 | H28: =G28/B28 -> 5.7346795595278038E-3 | I28: 1932 | J28: =I28/B28 -> 2.9466491779275843E-2 | K28: 76 | L28: =K28/B28 -> 1.1591373577768966E-3 | M28: 3588 | N28: =M28/B28 -> 5.4723484732940857E-2 | O28: 207 | P28: =O28/B28 -> 3.1571241192081263E-3 | Q28: 6380 | R28: =Q28/B28 -> 9.7306530823902629E-2
A29: 27 | B29: 58981 | C29: 43713 | D29: =C29/B29 -> 0.74113697631440634 | E29: 10874 | F29: =E29/B29 -> 0.18436445635035012 | G29: 445 | H29: =G29/B29 -> 7.5448025635374101E-3 | I29: 2143 | J29: =I29/B29 -> 3.6333734592495885E-2 | K29: 54 | L29: =K29/B29 -> 9.1554907512588803E-4 | M29: 1438 | N29: =M29/B29 -> 2.438073277835235E-2 | O29: 314 | P29: =O29/B29 -> 5.3237483257320157E-3 | Q29: 3189 | R29: =Q29/B29 -> 5.4068259269934388E-2
A30: 28 | B30: 58388 | C30: 43126 | D30: =C30/B30 -> 0.73861067342604647 | E30: 10643 | F30: =E30/B30 -> 0.1822806056038912 | G30: 547 | H30: =G30/B30 -> 9.3683633623347258E-3 | I30: 1771 | J30: =I30/B30 -> 3.0331574981160514E-2 | K30: 80 | L30: =K30/B30 -> 1.3701445502500515E-3 | M30: 1855 | N30: =M30/B30 -> 3.1770226758923069E-2 | O30: 366 | P30: =O30/B30 -> 6.268411317393985E-3 | Q30: 4374 | R30: =Q30/B30 -> 7.4912653284921554E-2
A31: 29 | B31: 61678 | C31: 54222 | D31: =C31/B31 -> 0.87911410875839036 | E31: 3712 | F31: =E31/B31 -> 6.0183533837024544E-2 | G31: 394 | H31: =G31/B31 -> 6.3880151755893516E-3 | I31: 938 | J31: =I31/B31 -> 1.5208015824118811E-2 | K31: 30 | L31: =K31/B31 -> 4.8639709458802167E-4 | M31: 2217 | N31: =M31/B31 -> 3.59447452900548E-2 | O31: 165 | P31: =O31/B31 -> 2.6751840202341192E-3 | Q31: 4074 | R31: =Q31/B31 -> 6.6052725445053348E-2
A32: 30 | B32: 61276 | C32: 48944 | D32: =C32/B32 -> 0.79874665448136306 | E32: 9268 | F32: =E32/B32 -> 0.15125008159801553 | G32: 452 | H32: =G32/B32 -> 7.3764606044780991E-3 | I32: 710 | J32: =I32/B32 -> 1.1586918206149226E-2 | K32: 56 | L32: =K32/B32 -> 9.138977740061362E-4 | M32: 1651 | N32: =M32/B32 -> 2.6943664730073764E-2 | O32: 195 | P32: =O32/B32 -> 3.1823226059142242E-3 | Q32: 3171 | R32: =Q32/B32 -> 5.1749461453097459E-2
A33: 31 | B33: 56743 | C33: 37294 | D33: =C33/B33 -> 0.65724406534726754 | E33: 11510 | F33: =E33/B33 -> 0.20284440371499568 | G33: 506 | H33: =G33/B33 -> 8.9173995030223992E-3 | I33: 3792 | J33: =I33/B33 -> 6.6827626315140193E-2 | K33: 124 | L33: =K33/B33 -> 2.185291577815766E-3 | M33: 3025 | N33: =M33/B33 -> 5.3310540507199126E-2 | O33: 492 | P33: =O33/B33 -> 8.6706730345593296E-3 | Q33: 7182 | R33: =Q33/B33 -> 0.12657067832155508
A34: 32 | B34: 55263 | C34: 39133 | D34: =C34/B34 -> 0.70812297558945403 | E34: 4398 | F34: =E34/B34 -> 7.9583084523098632E-2 | G34: 228 | H34: =G34/B34 -> 4.125726073503067E-3 | I34: 9364 | J34: =I34/B34 -> 0.16944429365036281 | K34: 51 | L34: =K34/B34 -> 9.2285977959937024E-4 | M34: 1704 | N34: =M34/B34 -> 3.0834373812496606E-2 | O34: 385 | P34: =O34/B34 -> 6.966686571485442E-3 | Q34: 4881 | R34: =Q34/B34 -> 8.8323109494598553E-2
A35: 33 | B35: 57289 | C35: 50926 | D35: =C35/B35 -> 0.88893155754158737 | E35: 2850 | F35: =E35/B35 -> 4.9747770078025451E-2 | G35: 325 | H35: =G35/B35 -> 5.6729913246871128E-3 | I35: 1738 | J35: =I35/B35 -> 3.0337412068634467E-2 | K35: 51 | L35: =K35/B35 -> 8.9022325402782383E-4 | M35: 1225 | N35: =M35/B35 -> 2.1382813454589887E-2 | O35: 174 | P35: =O35/B35 -> 3.0372322784478697E-3 | Q35: 3127 | R35: =Q35/B35 -> 5.458290422245108E-2
A36: 34 | B36: 57978 | C36: 44921 | D36: =C36/B36 -> 0.77479388733657595 | E36: 2037 | F36: =E36/B36 -> 3.5134016351029702E-2 | G36: 193 | H36: =G36/B36 -> 3.3288488737107181E-3 | I36: 9219 | J36: =I36/B36 -> 0.15900858946496946 | K36: 53 | L36: =K36/B36 -> 9.1413984614853905E-4 | M36: 1291 | N36: =M36/B36 -> 2.2267066818448377E-2 | O36: 264 | P36: =O36/B36 -> 4.5534513091172518E-3 | Q36: 3835 | R36: =Q36/B36 -> 6.6145779433578258E-2
A37: 35 | B37: 62743 | C37: 42985 | D37: =C37/B37 -> 0.68509634540904962 | E37: 3213 | F37: =E37/B37 -> 5.1208899797586985E-2 | G37: 259 | H37: =G37/B37 -> 4.1279505283457916E-3 | I37: 13543 | J37: =I37/B37 -> 0.21584877994357937 | K37: 73 | L37: =K37/B37 -> 1.1634764037422502E-3 | M37: 2306 | N37: =M37/B37 -> 3.6753103931912723E-2 | O37: 364 | P37: =O37/B37 -> 5.8014439857832743E-3 | Q37: 5932 | R37: =Q37/B37 -> 9.4544411328753811E-2
A38: 36 | B38: 61859 | C38: 43038 | D38: =C38/B38 -> 0.69574354580578412 | E38: 5383 | F38: =E38/B38 -> 8.7020482064048887E-2 | G38: 309 | H38: =G38/B38 -> 4.9952310900596517E-3 | I38: 10240 | J38: =I38/B38 -> 0.1655377552175108 | K38: 49 | L38: =K38/B38 -> 7.9212402399004189E-4 | M38: 2450 | N38: =M38/B38 -> 3.9606201199502096E-2 | O38: 390 | P38: =O38/B38 -> 6.3046605991044146E-3 | Q38: 6069 | R38: =Q38/B38 -> 9.8110218399909466E-2
A39: 37 | B39: 63480 | C39: 38998 | D39: =C39/B39 -> 0.6143352236925016 | E39: 5117 | F39: =E39/B39 -> 8.0608065532451159E-2 | G39: 368 | H39: =G39/B39 -> 5.7971014492753624E-3 | I39: 15501 | J39: =I39/B39 -> 0.24418714555765594 | K39: 57 | L39: =K39/B39 -> 8.9792060491493387E-4 | M39: 3013 | N39: =M39/B39 -> 4.746376811594203E-2 | O39: 426 | P39: =O39/B39 -> 6.7107750472589793E-3 | Q39: 7714 | R39: =Q39/B39 -> 0.12151858853182104
A40: 38 | B40: 62463 | C40: 33887 | D40: =C40/B40 -> 0.54251316779533487 | E40: 5892 | F40: =E40/B40 -> 9.4327842082512853E-2 | G40: 563 | H40: =G40/B40 -> 9.0133358948497506E-3 | I40: 12849 | J40: =I40/B40 -> 0.20570577782046973 | K40: 58 | L40: =K40/B40 -> 9.285497014232426E-4 | M40: 8707 | N40: =M40/B40 -> 0.1393945215567616 | O40: 507 | P40: =O40/B40 -> 8.1168051486479997E-3 | Q40: 18684 | R40: =Q40/B40 -> 0.29912107967917007
A41: 39 | B41: 61870 | C41: 37283 | D41: =C41/B41 -> 0.60260223048327133 | E41: 5616 | F41: =E41/B41 -> 9.0770971391627611E-2 | G41: 437 | H41: =G41/B41 -> 7.0631970260223052E-3 | I41: 12757 | J41: =I41/B41 -> 0.20619039922417973 | K41: 76 | L41: =K41/B41 -> 1.2283820914821399E-3 | M41: 5240 | N41: =M41/B41 -> 8.4693712623242282E-2 | O41: 461 | P41: =O41/B41 -> 7.4511071601745596E-3 | Q41: 10921 | R41: =Q41/B41 -> 0.17651527396153224
A42: 40 | B42: 58415 | C42: 41056 | D42: =C42/B42 -> 0.70283317641016863 | E42: 3843 | F42: =E42/B42 -> 6.5787896944278015E-2 | G42: 314 | H42: =G42/B42 -> 5.3753316785072327E-3 | I42: 10719 | J42: =I42/B42 -> 0.18349738936916887 | K42: 73 | L42: =K42/B42 -> 1.2496790207994523E-3 | M42: 2085 | N42: =M42/B42 -> 3.5692887100915859E-2 | O42: 325 | P42: =O42/B42 -> 5.5636394761619445E-3 | Q42: 5322 | R42: =Q42/B42 -> 9.1106736283488823E-2
A43: 41 | B43: 60765 | C43: 41973 | D43: =C43/B43 -> 0.69074302641323126 | E43: 3467 | F43: =E43/B43 -> 5.7055870978359256E-2 | G43: 283 | H43: =G43/B43 -> 4.6572862667654076E-3 | I43: 12276 | J43: =I43/B43 -> 0.20202419155764009 | K43: 71 | L43: =K43/B43 -> 1.1684357771743602E-3 | M43: 2388 | N43: =M43/B43 -> 3.9298938533695385E-2 | O43: 307 | P43: =O43/B43 -> 5.0522504731342057E-3 | Q43: 6992 | R43: =Q43/B43 -> 0.11506623878877643
A44: 42 | B44: 58066 | C44: 41053 | D44: =C44/B44 -> 0.7070058209623532 | E44: 5682 | F44: =E44/B44 -> 9.7854165949092409E-2 | G44: 344 | H44: =G44/B44 -> 5.9242930458443836E-3 | I44: 9044 | J44: =I44/B44 -> 0.15575379740295525 | K44: 101 | L44: =K44/B44 -> 1.7393999931112872E-3 | M44: 1498 | N44: =M44/B44 -> 2.579822960079909E-2 | O44: 344 | P44: =O44/B44 -> 5.9242930458443836E-3 | Q44: 4910 | R44: =Q44/B44 -> 8.4558950160162571E-2
A45: 43 | B45: 62318 | C45: 38605 | D45: =C45/B45 -> 0.61948393722519979 | E45: 10680 | F45: =E45/B45 -> 0.17137905581052024 | G45: 398 | H45: =G45/B45 -> 6.3865977727141435E-3 | I45: 8316 | J45: =I45/B45 -> 0.13344459064796688 | K45: 89 | L45: =K45/B45 -> 1.428158798421002E-3 | M45: 3754 | N45: =M45/B45 -> 6.0239417182836423E-2 | O45: 476 | P45: =O45/B45 -> 7.6382425623415387E-3 | Q45: 8829 | R45: =Q45/B45 -> 0.14167656214897784
A46: 44 | B46: 59112 | C46: 33967 | D46: =C46/B46 -> 0.57462105832994992 | E46: 12991 | F46: =E46/B46 -> 0.21976925159020166 | G46: 415 | H46: =G46/B46 -> 7.0205711192312895E-3 | I46: 4387 | J46: =I46/B46 -> 7.4215049397753419E-2 | K46: 85 | L46: =K46/B46 -> 1.4379483015293003E-3 | M46: 6707 | N46: =M46/B46 -> 0.11346257951008255 | O46: 560 | P46: =O46/B46 -> 9.4735417512518613E-3 | Q46: 12893 | R46: =Q46/B46 -> 0.21811138178373257
A47: 45 | B47: 67692 | C47: 51797 | D47: =C47/B47 -> 0.76518643266560304 | E47: 7774 | F47: =E47/B47 -> 0.11484370383501744 | G47: 501 | H47: =G47/B47 -> 7.4011700053182063E-3 | I47: 3217 | J47: =I47/B47 -> 4.7524079654907521E-2 | K47: 79 | L47: =K47/B47 -> 1.1670507593216333E-3 | M47: 3918 | N47: =M47/B47 -> 5.7879808544584292E-2 | O47: 406 | P47: =O47/B47 -> 5.9977545352478878E-3 | Q47: 8358 | R47: =Q47/B47 -> 0.12347101577734444
A48: 46 | B48: 66262 | C48: 35868 | D48: =C48/B48 -> 0.54130572575533487 | E48: 18343 | F48: =E48/B48 -> 0.27682532975159219 | G48: 402 | H48: =G48/B48 -> 6.0668256315837129E-3 | I48: 6127 | J48: =I48/B48 -> 9.2466270260481126E-2 | K48: 96 | L48: =K48/B48 -> 1.4487941806767075E-3 | M48: 4771 | N48: =M48/B48 -> 7.200205245842263E-2 | O48: 655 | P48: =O48/B48 -> 9.8850019619087862E-3 | Q48: 10253 | R48: =Q48/B48 -> 0.15473423681748211
A49: 47 | B49: 68384 | C49: 53109 | D49: =C49/B49 -> 0.77662903603182032 | E49: 3395 | F49: =E49/B49 -> 4.964611605053814E-2 | G49: 550 | H49: =G49/B49 -> 8.0428170332241464E-3 | I49: 7141 | J49: =I49/B49 -> 0.10442501169864296 | K49: 76 | L49: =K49/B49 -> 1.1113710809546092E-3 | M49: 3709 | N49: =M49/B49 -> 5.4237833411324286E-2 | O49: 404 | P49: =O49/B49 -> 5.9078146934955543E-3 | Q49: 8449 | R49: =Q49/B49 -> 0.12355229293401965
A50: 48 | B50: 64068 | C50: 51895 | D50: =C50/B50 -> 0.80999875132671539 | E50: 2962 | F50: =E50/B50 -> 4.6232128363613657E-2 | G50: 290 | H50: =G50/B50 -> 4.5264406568021479E-3 | I50: 7347 | J50: =I50/B50 -> 0.11467503277767373 | K50: 62 | L50: =K50/B50 -> 9.6772179559218333E-4 | M50: 1204 | N50: =M50/B50 -> 1.8792532933757881E-2 | O50: 308 | P50: =O50/B50 -> 4.8073921458450398E-3 | Q50: 4435 | R50: =Q50/B50 -> 6.9223325216956982E-2
A51: 49 | B51: 66373 | C51: 36838 | D51: =C51/B51 -> 0.5550148403718379 | E51: 11102 | F51: =E51/B51 -> 0.16726681029936871 | G51: 585 | H51: =G51/B51 -> 8.8138248986786797E-3 | I51: 9093 | J51: =I51/B51 -> 0.13699847829689785 | K51: 109 | L51: =K51/B51 -> 1.6422340409503865E-3 | M51: 7909 | N51: =M51/B51 -> 0.11915989935666611 | O51: 737 | P51: =O51/B51 -> 1.1103912735600319E-2 | Q51: 16346 | R51: =Q51/B51 -> 0.2462748406731653
A52: 50 | B52: 55689 | C52: 35574 | D52: =C52/B52 -> 0.63879760814523512 | E52: 7997 | F52: =E52/B52 -> 0.14360107022930921 | G52: 438 | H52: =G52/B52 -> 7.8651080105586382E-3 | I52: 4492 | J52: =I52/B52 -> 8.0662249277236073E-2 | K52: 90 | L52: =K52/B52 -> 1.616118084361364E-3 | M52: 6642 | N52: =M52/B52 -> 0.11926951462586867 | O52: 456 | P52: =O52/B52 -> 8.1883316274309111E-3 | Q52: 13405 | R52: =Q52/B52 -> 0.24071181023182317
A53: 51 | B53: 58448 | C53: 41641 | D53: =C53/B53 -> 0.71244525047905827 | E53: 8991 | F53: =E53/B53 -> 0.15382904462085956 | G53: 559 | H53: =G53/B53 -> 9.5640569395017798E-3 | I53: 3986 | J53: =I53/B53 -> 6.8197372022994793E-2 | K53: 98 | L53: =K53/B53 -> 1.6767040788393101E-3 | M53: 2745 | N53: =M53/B53 -> 4.6964823432794962E-2 | O53: 428 | P53: =O53/B53 -> 7.322748425951273E-3 | Q53: 6847 | R53: =Q53/B53 -> 0.11714686558992608
A54: 52 | B54: 56592 | C54: 25644 | D54: =C54/B54 -> 0.45313825275657338 | E54: 17160 | F54: =E54/B54 -> 0.30322307039864294 | G54: 677 | H54: =G54/B54 -> 1.196282160022618E-2 | I54: 4428 | J54: =I54/B54 -> 7.8244274809160311E-2 | K54: 100 | L54: =K54/B54 -> 1.7670342097823013E-3 | M54: 7818 | N54: =M54/B54 -> 0.13814673452078033 | O54: 765 | P54: =O54/B54 -> 1.3517811704834605E-2 | Q54: 14987 | R54: =Q54/B54 -> 0.26482541702007351
A55: 53 | B55: 62827 | C55: 39121 | D55: =C55/B55 -> 0.62267814793003007 | E55: 3426 | F55: =E55/B55 -> 5.4530695401658523E-2 | G55: 451 | H55: =G55/B55 -> 7.1784423894185618E-3 | I55: 13659 | J55: =I55/B55 -> 0.21740652904006239 | K55: 51 | L55: =K55/B55 -> 8.1175290878125641E-4 | M55: 5667 | N55: =M55/B55 -> 9.0200073216929022E-2 | O55: 452 | P55: =O55/B55 -> 7.1943591131201556E-3 | Q55: 12306 | R55: =Q55/B55 -> 0.1958712018718067
A56: 54 | B56: 57249 | C56: 42858 | D56: =C56/B56 -> 0.74862443012105018 | E56: 10139 | F56: =E56/B56 -> 0.17710353019266711 | G56: 434 | H56: =G56/B56 -> 7.580918443990288E-3 | I56: 1632 | J56: =I56/B56 -> 2.850704815804643E-2 | K56: 83 | L56: =K56/B56 -> 1.4498069835280965E-3 | M56: 1797 | N56: =M56/B56 -> 3.138919457108421E-2 | O56: 306 | P56: =O56/B56 -> 5.3450715296337057E-3 | Q56: 3932 | R56: =Q56/B56 -> 6.8682422400391269E-2
A57: 55 | B57: 59680 | C57: 47737 | D57: =C57/B57 -> 0.79988270777479897 | E57: 9978 | F57: =E57/B57 -> 0.1671916890080429 | G57: 459 | H57: =G57/B57 -> 7.6910187667560319E-3 | I57: 765 | J57: =I57/B57 -> 1.2818364611260053E-2 | K57: 31 | L57: =K57/B57 -> 5.1943699731903483E-4 | M57: 502 | N57: =M57/B57 -> 8.411528150134049E-3 | O57: 208 | P57: =O57/B57 -> 3.4852546916890078E-3 | Q57: 1335 | R57: =Q57/B57 -> 2.2369302949061663E-2
A58: 56 | B58: 58745 | C58: 46976 | D58: =C58/B58 -> 0.79965954549323348 | E58: 7644 | F58: =E58/B58 -> 0.13012171248616902 | G58: 315 | H58: =G58/B58 -> 5.3621584815729002E-3 | I58: 3233 | J58: =I58/B58 -> 5.5034471018810115E-2 | K58: 37 | L58: =K58/B58 -> 6.2984083751808668E-4 | M58: 350 | N58: =M58/B58 -> 5.9579538684143328E-3 | O58: 190 | P58: =O58/B58 -> 3.2343178142820667E-3 | Q58: 1142 | R58: =Q58/B58 -> 1.9439952336369054E-2
A59: 57 | B59: 68024 | C59: 48829 | D59: =C59/B59 -> 0.71782018111254853 | E59: 10826 | F59: =E59/B59 -> 0.15914971186640009 | G59: 397 | H59: =G59/B59 -> 5.8361754674820651E-3 | I59: 5775 | J59: =I59/B59 -> 8.4896507115135827E-2 | K59: 52 | L59: =K59/B59 -> 7.6443608138304132E-4 | M59: 1817 | N59: =M59/B59 -> 2.6711160766788193E-2 | O59: 328 | P59: =O59/B59 -> 4.82182759026226E-3 | Q59: 4207 | R59: =Q59/B59 -> 6.1845819122662592E-2
A60: 58 | B60: 61395 | C60: 54936 | D60: =C60/B60 -> 0.89479599315905201 | E60: 4240 | F60: =E60/B60 -> 6.9060998452642727E-2 | G60: 314 | H60: =G60/B60 -> 5.1144229986155223E-3 | I60: 1055 | J60: =I60/B60 -> 1.718380975649483E-2 | K60: 31 | L60: =K60/B60 -> 5.0492711132828411E-4 | M60: 693 | N60: =M60/B60 -> 1.1287564133887124E-2 | O60: 126 | P60: =O60/B60 -> 2.0522843879794772E-3 | Q60: 1524 | R60: =Q60/B60 -> 2.4822868311751772E-2
A61: 59 | B61: 62208 | C61: 48415 | D61: =C61/B61 -> 0.77827610596707819 | E61: 12466 | F61: =E61/B61 -> 0.20039223251028807 | G61: 360 | H61: =G61/B61 -> 5.7870370370370367E-3 | I61: 387 | J61: =I61/B61 -> 6.2210648148148147E-3 | K61: 38 | L61: =K61/B61 -> 6.1085390946502061E-4 | M61: 396 | N61: =M61/B61 -> 6.3657407407407404E-3 | O61: 146 | P61: =O61/B61 -> 2.3469650205761318E-3 | Q61: 941 | R61: =Q61/B61 -> 1.5126671810699589E-2
A62: 60 | B62: 62712 | C62: 41036 | D62: =C62/B62 -> 0.65435642301313945 | E62: 20399 | F62: =E62/B62 -> 0.32528064804184209 | G62: 349 | H62: =G62/B62 -> 5.5651231024365349E-3 | I62: 333 | J62: =I62/B62 -> 5.3099885189437429E-3 | K62: 22 | L62: =K62/B62 -> 3.5081005230258962E-4 | M62: 425 | N62: =M62/B62 -> 6.7770123740272994E-3 | O62: 148 | P62: =O62/B62 -> 2.3599948973083303E-3 | Q62: 927 | R62: =Q62/B62 -> 1.4781859931113663E-2
A63: 61 | B63: 63280 | C63: 40447 | D63: =C63/B63 -> 0.63917509481668777 | E63: 21215 | F63: =E63/B63 -> 0.33525600505689002 | G63: 411 | H63: =G63/B63 -> 6.4949431099873582E-3 | I63: 293 | J63: =I63/B63 -> 4.6302149178255375E-3 | K63: 18 | L63: =K63/B63 -> 2.8445006321112514E-4 | M63: 699 | N63: =M63/B63 -> 1.104614412136536E-2 | O63: 197 | P63: =O63/B63 -> 3.1131479140328699E-3 | Q63: 1421 | R63: =Q63/B63 -> 2.2455752212389379E-2
A64: 62 | B64: 61022 | C64: 41265 | D64: =C64/B64 -> 0.67623152305725809 | E64: 14988 | F64: =E64/B64 -> 0.2456163350922618 | G64: 548 | H64: =G64/B64 -> 8.9803677362262791E-3 | I64: 1729 | J64: =I64/B64 -> 2.8334043459735832E-2 | K64: 85 | L64: =K64/B64 -> 1.3929402510569958E-3 | M64: 2062 | N64: =M64/B64 -> 3.379109173740618E-2 | O64: 345 | P64: =O64/B64 -> 5.6536986660548653E-3 | Q64: 3959 | R64: =Q64/B64 -> 6.4878240634525255E-2
A65: 63 | B65: 61404 | C65: 22534 | D65: =C65/B65 -> 0.36697934987948666 | E65: 36553 | F65: =E65/B65 -> 0.5952869519900984 | G65: 327 | H65: =G65/B65 -> 5.3253859683408244E-3 | I65: 636 | J65: =I65/B65 -> 1.0357631424662889E-2 | K65: 56 | L65: =K65/B65 -> 9.1199270405836752E-4 | M65: 918 | N65: =M65/B65 -> 1.4950166112956811E-2 | O65: 380 | P65: =O65/B65 -> 6.1885219203960656E-3 | Q65: 2045 | R65: =Q65/B65 -> 3.3304019282131454E-2
A66: 64 | B66: 61722 | C66: 45123 | D66: =C66/B66 -> 0.73106833867988719 | E66: 14961 | F66: =E66/B66 -> 0.24239331194711772 | G66: 422 | H66: =G66/B66 -> 6.8371083244224105E-3 | I66: 628 | J66: =I66/B66 -> 1.0174654094164156E-2 | K66: 36 | L66: =K66/B66 -> 5.8326042578011087E-4 | M66: 347 | N66: =M66/B66 -> 5.6219824373805122E-3 | O66: 205 | P66: =O66/B66 -> 3.3213440912478534E-3 | Q66: 975 | R66: =Q66/B66 -> 1.5796636531544669E-2
A67: 65 | B67: 59232 | C67: 48341 | D67: =C67/B67 -> 0.81612979470556457 | E67: 8666 | F67: =E67/B67 -> 0.14630605078336034 | G67: 274 | H67: =G67/B67 -> 4.6258779038357645E-3 | I67: 1425 | J67: =I67/B67 -> 2.4057941653160452E-2 | K67: 22 | L67: =K67/B67 -> 3.7142085359265263E-4 | M67: 353 | N67: =M67/B67 -> 5.9596164235548353E-3 | O67: 151 | P67: =O67/B67 -> 2.5492976769313884E-3 | Q67: 1142 | R67: =Q67/B67 -> 1.9280118854673151E-2
A68: 66 | B68: 58534 | C68: 45692 | D68: =C68/B68 -> 0.78060614343800183 | E68: 9403 | F68: =E68/B68 -> 0.16064167834079338 | G68: 373 | H68: =G68/B68 -> 6.3723647794444258E-3 | I68: 1781 | J68: =I68/B68 -> 3.0426760515256092E-2 | K68: 58 | L68: =K68/B68 -> 9.9087709707178727E-4 | M68: 980 | N68: =M68/B68 -> 1.6742406122937096E-2 | O68: 247 | P68: =O68/B68 -> 4.21976970649537E-3 | Q68: 2278 | R68: =Q68/B68 -> 3.8917552191888478E-2
A69: 67 | B69: 57154 | C69: 39122 | D69: =C69/B69 -> 0.6845015222031704 | E69: 3270 | F69: =E69/B69 -> 5.7213843300556393E-2 | G69: 236 | H69: =G69/B69 -> 4.1291948070126322E-3 | I69: 12121 | J69: =I69/B69 -> 0.21207614515169543 | K69: 89 | L69: =K69/B69 -> 1.5571963467123911E-3 | M69: 2056 | N69: =M69/B69 -> 3.5972985267872765E-2 | O69: 260 | P69: =O69/B69 -> 4.5491129229800189E-3 | Q69: 5329 | R69: =Q69/B69 -> 9.3239318332925078E-2
A70: 68 | B70: 63752 | C70: 55904 | D70: =C70/B70 -> 0.87689797967122596 | E70: 4624 | F70: =E70/B70 -> 7.2531057849165512E-2 | G70: 271 | H70: =G70/B70 -> 4.2508470322499686E-3 | I70: 2110 | J70: =I70/B70 -> 3.3097000878403816E-2 | K70: 33 | L70: =K70/B70 -> 5.176308194252729E-4 | M70: 620 | N70: =M70/B70 -> 9.7251850922324013E-3 | O70: 190 | P70: =O70/B70 -> 2.980298657297026E-3 | Q70: 1691 | R70: =Q70/B70 -> 2.6524658049943532E-2
A71: 69 | B71: 62538 | C71: 21682 | D71: =C71/B71 -> 0.3467012056669545 | E71: 34514 | F71: =E71/B71 -> 0.55188845182129265 | G71: 390 | H71: =G71/B71 -> 6.2362083853017367E-3 | I71: 1284 | J71: =I71/B71 -> 2.053151683776264E-2 | K71: 65 | L71: =K71/B71 -> 1.0393680642169561E-3 | M71: 4074 | N71: =M71/B71 -> 6.5144392209536606E-2 | O71: 529 | P71: =O71/B71 -> 8.4588570149349198E-3 | Q71: 6060 | R71: =Q71/B71 -> 9.6901084140842364E-2
A72: 70 | B72: 58654 | C72: 19204 | D72: =C72/B72 -> 0.32741160023186827 | E72: 33063 | F72: =E72/B72 -> 0.56369557063456888 | G72: 493 | H72: =G72/B72 -> 8.405223855150544E-3 | I72: 1137 | J72: =I72/B72 -> 1.9384867187233607E-2 | K72: 59 | L72: =K72/B72 -> 1.0058990009206533E-3 | M72: 4176 | N72: =M72/B72 -> 7.1197190302451668E-2 | O72: 522 | P72: =O72/B72 -> 8.8996487878064585E-3 | Q72: 6670 | R72: =Q72/B72 -> 0.1137177345108603
A73: 71 | B73: 66230 | C73: 24970 | D73: =C73/B73 -> 0.37701947757813681 | E73: 36658 | F73: =E73/B73 -> 0.55349539483617693 | G73: 325 | H73: =G73/B73 -> 4.9071417786501585E-3 | I73: 3069 | J73: =I73/B73 -> 4.6338517288237957E-2 | K73: 41 | L73: =K73/B73 -> 6.190548089989431E-4 | M73: 566 | N73: =M73/B73 -> 8.5459761437415068E-3 | O73: 601 | P73: =O73/B73 -> 9.0744375660576776E-3 | Q73: 1616 | R73: =Q73/B73 -> 2.4399818813226636E-2
A74: 72 | B74: 62008 | C74: 46792 | D74: =C74/B74 -> 0.75461230808927882 | E74: 8308 | F74: =E74/B74 -> 0.13398271190814087 | G74: 292 | H74: =G74/B74 -> 4.7090697974454905E-3 | I74: 4891 | J74: =I74/B74 -> 7.8876919107211979E-2 | K74: 35 | L74: =K74/B74 -> 5.6444329763901432E-4 | M74: 1424 | N74: =M74/B74 -> 2.2964778738227325E-2 | O74: 266 | P74: =O74/B74 -> 4.2897690620565089E-3 | Q74: 3084 | R74: =Q74/B74 -> 4.9735517997677718E-2
A75: 73 | B75: 63116 | C75: 45955 | D75: =C75/B75 -> 0.72810380885987702 | E75: 8550 | F75: =E75/B75 -> 0.13546485835604286 | G75: 310 | H75: =G75/B75 -> 4.911591355599214E-3 | I75: 5860 | J75: =I75/B75 -> 9.2844920463907729E-2 | K75: 34 | L75: =K75/B75 -> 5.3869066480765574E-4 | M75: 2044 | N75: =M75/B75 -> 3.2384815260789658E-2 | O75: 363 | P75: =O75/B75 -> 5.7513150389758537E-3 | Q75: 4196 | R75: =Q75/B75 -> 6.6480765574497752E-2
A76: 74 | B76: 60478 | C76: 22359 | D76: =C76/B76 -> 0.36970468600152123 | E76: 34617 | F76: =E76/B76 -> 0.57238995998544928 | G76: 800 | H76: =G76/B76 -> 1.3227950659744039E-2 | I76: 1306 | J76: =I76/B76 -> 2.1594629452032145E-2 | K76: 37 | L76: =K76/B76 -> 6.1179271801316184E-4 | M76: 926 | N76: =M76/B76 -> 1.5311352888653726E-2 | O76: 433 | P76: =O76/B76 -> 7.1596282945864615E-3 | Q76: 1806 | R76: =Q76/B76 -> 2.9862098614372168E-2
A77: 75 | B77: 63445 | C77: 26977 | D77: =C77/B77 -> 0.42520293167310269 | E77: 35167 | F77: =E77/B77 -> 0.55429111829143352 | G77: 270 | H77: =G77/B77 -> 4.2556545039010166E-3 | I77: 250 | J77: =I77/B77 -> 3.9404208369453854E-3 | K77: 23 | L77: =K77/B77 -> 3.6251871699897548E-4 | M77: 570 | N77: =M77/B77 -> 8.98415950823548E-3 | O77: 188 | P77: =O77/B77 -> 2.9631964693829301E-3 | Q77: 1128 | R77: =Q77/B77 -> 1.7779178816297581E-2
A78: 76 | B78: 59747 | C78: 41918 | D78: =C78/B78 -> 0.70159171171774315 | E78: 15023 | F78: =E78/B78 -> 0.25144358712571341 | G78: 386 | H78: =G78/B78 -> 6.4605754263812407E-3 | I78: 1701 | J78: =I78/B78 -> 2.847004870537433E-2 | K78: 46 | L78: =K78/B78 -> 7.6991313371382669E-4 | M78: 424 | N78: =M78/B78 -> 7.0965906237970104E-3 | O78: 249 | P78: =O78/B78 -> 4.1675732672770182E-3 | Q78: 1460 | R78: =Q78/B78 -> 2.4436373374395366E-2
A79: 77 | B79: 57841 | C79: 21046 | D79: =C79/B79 -> 0.36385954599678427 | E79: 33997 | F79: =E79/B79 -> 0.58776646323542125 | G79: 386 | H79: =G79/B79 -> 6.6734669179301879E-3 | I79: 914 | J79: =I79/B79 -> 1.5801939800487542E-2 | K79: 59 | L79: =K79/B79 -> 1.0200376895281894E-3 | M79: 1038 | N79: =M79/B79 -> 1.7945747825936619E-2 | O79: 401 | P79: =O79/B79 -> 6.9327985339119307E-3 | Q79: 2231 | R79: =Q79/B79 -> 3.8571255683684587E-2
A80: 78 | B80: 60410 | C80: 46088 | D80: =C80/B80 -> 0.76292004634994204 | E80: 10355 | F80: =E80/B80 -> 0.1714120178778348 | G80: 438 | H80: =G80/B80 -> 7.2504552226452575E-3 | I80: 2599 | J80: =I80/B80 -> 4.3022678364509188E-2 | K80: 68 | L80: =K80/B80 -> 1.1256414500910444E-3 | M80: 578 | N80: =M80/B80 -> 9.5679523257738777E-3 | O80: 284 | P80: =O80/B80 -> 4.7012084092037743E-3 | Q80: 2127 | R80: =Q80/B80 -> 3.5209402416818407E-2
A81: 79 | B81: 66796 | C81: 41472 | D81: =C81/B81 -> 0.62087550152703752 | E81: 19677 | F81: =E81/B81 -> 0.29458350799449068 | G81: 682 | H81: =G81/B81 -> 1.0210192227079466E-2 | I81: 2244 | J81: =I81/B81 -> 3.3594826037487271E-2 | K81: 162 | L81: =K81/B81 -> 2.4252949278399903E-3 | M81: 1450 | N81: =M81/B81 -> 2.1707886699802382E-2 | O81: 1109 | P81: =O81/B81 -> 1.6602790586262649E-2 | Q81: 4676 | R81: =Q81/B81 -> 7.0004191867776511E-2
A82: 80 | B82: 60871 | C82: 23739 | D82: =C82/B82 -> 0.38998866455290698 | E82: 34268 | F82: =E82/B82 -> 0.56296101591891046 | G82: 383 | H82: =G82/B82 -> 6.2919945458428479E-3 | I82: 1165 | J82: =I82/B82 -> 1.9138834584613362E-2 | K82: 91 | L82: =K82/B82 -> 1.4949647615449064E-3 | M82: 755 | N82: =M82/B82 -> 1.2403279065564883E-2 | O82: 470 | P82: =O82/B82 -> 7.7212465706165499E-3 | Q82: 1833 | R82: =Q82/B82 -> 3.0112861625404545E-2
A83: 81 | B83: 59833 | C83: 44792 | D83: =C83/B83 -> 0.74861698393862919 | E83: 11130 | F83: =E83/B83 -> 0.18601774940250362 | G83: 560 | H83: =G83/B83 -> 9.3593836177360314E-3 | I83: 1830 | J83: =I83/B83 -> 3.0585128607958818E-2 | K83: 97 | L83: =K83/B83 -> 1.6211789480721341E-3 | M83: 1077 | N83: =M83/B83 -> 1.8000100279110191E-2 | O83: 347 | P83: =O83/B83 -> 5.7994752059900056E-3 | Q83: 2880 | R83: =Q83/B83 -> 4.8133972891213878E-2
A84: 82 | B84: 63348 | C84: 53757 | D84: =C84/B84 -> 0.84859821935972723 | E84: 5786 | F84: =E84/B84 -> 9.1336743070025886E-2 | G84: 464 | H84: =G84/B84 -> 7.3246195617856918E-3 | I84: 1932 | J84: =I84/B84 -> 3.0498200416745596E-2 | K84: 98 | L84: =K84/B84 -> 1.5470101660668056E-3 | M84: 993 | N84: =M84/B84 -> 1.5675317294942225E-2 | O84: 318 | P84: =O84/B84 -> 5.0198901307065731E-3 | Q84: 2843 | R84: =Q84/B84 -> 4.487908063395845E-2
A85: 83 | B85: 62818 | C85: 47638 | D85: =C85/B85 -> 0.75834951765417558 | E85: 9500 | F85: =E85/B85 -> 0.15123053901747907 | G85: 539 | H85: =G85/B85 -> 8.5803432137285494E-3 | I85: 3260 | J85: =I85/B85 -> 5.1895953389155973E-2 | K85: 106 | L85: =K85/B85 -> 1.6874144353529244E-3 | M85: 1359 | N85: =M85/B85 -> 2.1633926581553057E-2 | O85: 416 | P85: =O85/B85 -> 6.622305708554873E-3 | Q85: 3476 | R85: =Q85/B85 -> 5.5334458276290237E-2
A86: 84 | B86: 58742 | C86: 39207 | D86: =C86/B86 -> 0.66744407749140311 | E86: 12012 | F86: =E86/B86 -> 0.20448741956351504 | G86: 443 | H86: =G86/B86 -> 7.5414524530999965E-3 | I86: 5126 | J86: =I86/B86 -> 8.7262946443771069E-2 | K86: 162 | L86: =K86/B86 -> 2.7578223417656874E-3 | M86: 1333 | N86: =M86/B86 -> 2.2692451738109021E-2 | O86: 459 | P86: =O86/B86 -> 7.813829968336114E-3 | Q86: 3917 | R86: =Q86/B86 -> 6.6681420448741952E-2
A87: 85 | B87: 62188 | C87: 43120 | D87: =C87/B87 -> 0.6933813597478613 | E87: 11770 | F87: =E87/B87 -> 0.18926480993117642 | G87: 534 | H87: =G87/B87 -> 8.5868656332411392E-3 | I87: 4817 | J87: =I87/B87 -> 7.7458673699105932E-2 | K87: 136 | L87: =K87/B87 -> 2.1869170901138483E-3 | M87: 1329 | N87: =M87/B87 -> 2.1370682446774297E-2 | O87: 482 | P87: =O87/B87 -> 7.7506914517270209E-3 | Q87: 3512 | R87: =Q87/B87 -> 5.6473917797645851E-2
A88: 86 | B88: 59286 | C88: 34944 | D88: =C88/B88 -> 0.58941402692035216 | E88: 4930 | F88: =E88/B88 -> 8.3156225753128907E-2 | G88: 371 | H88: =G88/B88 -> 6.2578011672232902E-3 | I88: 12153 | J88: =I88/B88 -> 0.20498937354518773 | K88: 49 | L88: =K88/B88 -> 8.2650204095401948E-4 | M88: 6349 | N88: =M88/B88 -> 0.10709105016361367 | O88: 490 | P88: =O88/B88 -> 8.2650204095401948E-3 | Q88: 12059 | R88: =Q88/B88 -> 0.20340383901764328
A89: 87 | B89: 55787 | C89: 32124 | D89: =C89/B89 -> 0.57583307939125605 | E89: 4831 | F89: =E89/B89 -> 8.6597235915177373E-2 | G89: 295 | H89: =G89/B89 -> 5.2879703156649398E-3 | I89: 14180 | J89: =I89/B89 -> 0.25418108161399611 | K89: 66 | L89: =K89/B89 -> 1.1830713248606305E-3 | M89: 3853 | N89: =M89/B89 -> 6.9066269919515297E-2 | O89: 438 | P89: =O89/B89 -> 7.8512915195296396E-3 | Q89: 7895 | R89: =Q89/B89 -> 0.14152042590567696
A90: 88 | B90: 58354 | C90: 45104 | D90: =C90/B90 -> 0.77293758782602739 | E90: 8248 | F90: =E90/B90 -> 0.14134420948006993 | G90: 418 | H90: =G90/B90 -> 7.1631764746204205E-3 | I90: 1794 | J90: =I90/B90 -> 3.0743393769064674E-2 | K90: 89 | L90: =K90/B90 -> 1.5251739383761182E-3 | M90: 2361 | N90: =M90/B90 -> 4.0459951331528257E-2 | O90: 340 | P90: =O90/B90 -> 5.8265071803132607E-3 | Q90: 4545 | R90: =Q90/B90 -> 7.7886691572128727E-2
A91: 89 | B91: 61070 | C91: 23417 | D91: =C91/B91 -> 0.38344522678893073 | E91: 33869 | F91: =E91/B91 -> 0.55459308989683964 | G91: 394 | H91: =G91/B91 -> 6.4516129032258064E-3 | I91: 1800 | J91: =I91/B91 -> 2.9474373669559521E-2 | K91: 83 | L91: =K91/B91 -> 1.3590961192074668E-3 | M91: 942 | N91: =M91/B91 -> 1.5424922220402816E-2 | O91: 565 | P91: =O91/B91 -> 9.2516784018339612E-3 | Q91: 2515 | R91: =Q91/B91 -> 4.1182249877190109E-2
A92: 90 | B92: 60204 | C92: 20960 | D92: =C92/B92 -> 0.34814962460966048 | E92: 34069 | F92: =E92/B92 -> 0.56589263171882265 | G92: 422 | H92: =G92/B92 -> 7.0095010298319048E-3 | I92: 2668 | J92: =I92/B92 -> 4.4315992292870907E-2 | K92: 83 | L92: =K92/B92 -> 1.3786459371470333E-3 | M92: 1333 | N92: =M92/B92 -> 2.2141385954421632E-2 | O92: 669 | P92: =O92/B92 -> 1.1112218457245365E-2 | Q92: 3258 | R92: =Q92/B92 -> 5.4116005581024515E-2
A93: 91 | B93: 59281 | C93: 43142 | D93: =C93/B93 -> 0.72775425515763903 | E93: 11626 | F93: =E93/B93 -> 0.19611679964912873 | G93: 481 | H93: =G93/B93 -> 8.1138982135928878E-3 | I93: 2676 | J93: =I93/B93 -> 4.5140938918034446E-2 | K93: 101 | L93: =K93/B93 -> 1.7037499367419577E-3 | M93: 801 | N93: =M93/B93 -> 1.3511917815151566E-2 | O93: 454 | P93: =O93/B93 -> 7.6584403097113745E-3 | Q93: 2231 | R93: =Q93/B93 -> 3.763431790961691E-2
A94: 92 | B94: 61309 | C94: 20662 | D94: =C94/B94 -> 0.33701414148004372 | E94: 37224 | F94: =E94/B94 -> 0.60715392519858424 | G94: 472 | H94: =G94/B94 -> 7.6987065520559787E-3 | I94: 1285 | J94: =I94/B94 -> 2.0959402371593078E-2 | K94: 71 | L94: =K94/B94 -> 1.1580681466016409E-3 | M94: 767 | N94: =M94/B94 -> 1.2510398147090965E-2 | O94: 828 | P94: =O94/B94 -> 1.3505358104030403E-2 | Q94: 2264 | R94: =Q94/B94 -> 3.6927694139522745E-2
A95: 93 | B95: 62539 | C95: 42610 | D95: =C95/B95 -> 0.68133484705543745 | E95: 14122 | F95: =E95/B95 -> 0.22581109387742049 | G95: 422 | H95: =G95/B95 -> 6.7477893794272376E-3 | I95: 3164 | J95: =I95/B95 -> 5.0592430323478148E-2 | K95: 137 | L95: =K95/B95 -> 2.1906330449799325E-3 | M95: 1565 | N95: =M95/B95 -> 2.5024384783894849E-2 | O95: 519 | P95: =O95/B95 -> 8.298821535361935E-3 | Q95: 3916 | R95: =Q95/B95 -> 6.261692703752858E-2
A96: 94 | B96: 62412 | C96: 44092 | D96: =C96/B96 -> 0.70646670512081011 | E96: 13120 | F96: =E96/B96 -> 0.2102159841056207 | G96: 528 | H96: =G96/B96 -> 8.4599115554701027E-3 | I96: 2350 | J96: =I96/B96 -> 3.765301544574761E-2 | K96: 105 | L96: =K96/B96 -> 1.6823687752355316E-3 | M96: 1699 | N96: =M96/B96 -> 2.7222329039287316E-2 | O96: 518 | P96: =O96/B96 -> 8.2996859578286231E-3 | Q96: 3895 | R96: =Q96/B96 -> 6.2407870281356151E-2
A97: 95 | B97: 59017 | C97: 19542 | D97: =C97/B97 -> 0.33112493010488503 | E97: 35394 | F97: =E97/B97 -> 0.59972550282122106 | G97: 431 | H97: =G97/B97 -> 7.3029804971448901E-3 | I97: 1411 | J97: =I97/B97 -> 2.3908365386244641E-2 | K97: 92 | L97: =K97/B97 -> 1.5588728671399766E-3 | M97: 1374 | N97: =M97/B97 -> 2.3281427385329651E-2 | O97: 773 | P97: =O97/B97 -> 1.3097920938034803E-2 | Q97: 3300 | R97: =Q97/B97 -> 5.5916091973499164E-2
A98: 96 | B98: 61067 | C98: 49447 | D98: =C98/B98 -> 0.80971719586683477 | E98: 8373 | F98: =E98/B98 -> 0.13711169698855355 | G98: 354 | H98: =G98/B98 -> 5.7969115889105411E-3 | I98: 1826 | J98: =I98/B98 -> 2.9901583506640246E-2 | K98: 72 | L98: =K98/B98 -> 1.179032865541127E-3 | M98: 725 | N98: =M98/B98 -> 1.1872205937740514E-2 | O98: 270 | P98: =O98/B98 -> 4.4213732457792261E-3 | Q98: 2119 | R98: =Q98/B98 -> 3.4699592251134004E-2
A99: 97 | B99: 60024 | C99: 51473 | D99: =C99/B99 -> 0.85754031720645074 | E99: 6497 | F99: =E99/B99 -> 0.10824003731840597 | G99: 714 | H99: =G99/B99 -> 1.1895241903238705E-2 | I99: 802 | J99: =I99/B99 -> 1.3361322137811542E-2 | K99: 30 | L99: =K99/B99 -> 4.9980007996801279E-4 | M99: 349 | N99: =M99/B99 -> 5.8143409302945492E-3 | O99: 159 | P99: =O99/B99 -> 2.6489404238304679E-3 | Q99: 969 | R99: =Q99/B99 -> 1.6143542582966814E-2
A100: 98 | B100: 62740 | C100: 50614 | D100: =C100/B100 -> 0.80672617150143444 | E100: 10318 | F100: =E100/B100 -> 0.16445648708957603 | G100: 624 | H100: =G100/B100 -> 9.9458080969078745E-3 | I100: 502 | J100: =I100/B100 -> 8.0012751036021672E-3 | K100: 36 | L100: =K100/B100 -> 5.7379662097545422E-4 | M100: 446 | N100: =M100/B100 -> 7.1087025820847942E-3 | O100: 200 | P100: =O100/B100 -> 3.1877590054191903E-3 | Q100: 1205 | R100: =Q100/B100 -> 1.9206248007650622E-2
A101: 99 | B101: 63534 | C101: 46161 | D101: =C101/B101 -> 0.72655585985456606 | E101: 15274 | F101: =E101/B101 -> 0.24040671136714201 | G101: 525 | H101: =G101/B101 -> 8.2632920955708761E-3 | I101: 520 | J101: =I101/B101 -> 8.1845940756130574E-3 | K101: 33 | L101: =K101/B101 -> 5.1940693172159791E-4 | M101: 804 | N101: =M101/B101 -> 1.2654641609217112E-2 | O101: 217 | P101: =O101/B101 -> 3.4154940661692951E-3 | Q101: 1916 | R101: =Q101/B101 -> 3.0157081247835803E-2
A102: 100 | B102: 63027 | C102: 41380 | D102: =C102/B102 -> 0.65654402081647545 | E102: 17393 | F102: =E102/B102 -> 0.27596109603820584 | G102: 648 | H102: =G102/B102 -> 1.0281308010852492E-2 | I102: 1248 | J102: =I102/B102 -> 1.9801037650530724E-2 | K102: 122 | L102: =K102/B102 -> 1.9356783600679075E-3 | M102: 1893 | N102: =M102/B102 -> 3.0034747013184825E-2 | O102: 343 | P102: =O102/B102 -> 5.4421121106827232E-3 | Q102: 4247 | R102: =Q102/B102 -> 6.7383819632855765E-2

A1: HB 5005 Election Data
A2: DISTRICT | B2: Rep. Gov '09 | C2: Dem. Gov '09 | D2: Rep. Lt. Gov '09 | E2: Dem. Lt. Gov '09 | F2: Rep. Att. Gen. '09 | G2: Dem. Att. Gen. '09
A3: 1 | B3: 0.744265983376039 | C3: 0.255734016623961 | D3: 0.75272588152776887 | E3: 0.24727411847223107 | F3: 0.74158238381769304 | G3: 0.25841761618230702
A4: 2 | B4: 0.58123041398647535 | C4: 0.41876958601352465 | D4: 0.55140575611379139 | E4: 0.44859424388620861 | F4: 0.5594376507778055 | G4: 0.4405623492221945
A5: 3 | B5: 0.70310108282782469 | C5: 0.29689891717217531 | D5: 0.69768670737435412 | E5: 0.30231329262564582 | F5: 0.67573035044921759 | G5: 0.32426964955078241
A6: 4 | B6: 0.67700441489071783 | C6: 0.32299558510928217 | D6: 0.69026598436709219 | E6: 0.30973401563290781 | F6: 0.6743290680557128 | G6: 0.32567093194428715
A7: 5 | B7: 0.74115868473624535 | C7: 0.25884131526375465 | D7: 0.7465678198791873 | E7: 0.25343218012081276 | F7: 0.73940631207239016 | G7: 0.26059368792760979
A8: 6 | B8: 0.72175208898823784 | C8: 0.27824791101176222 | D8: 0.70748152543287124 | E8: 0.29251847456712876 | F8: 0.70640511542213069 | G8: 0.29359488457786931
A9: 7 | B9: 0.65366005931012949 | C9: 0.34633994068987045 | D9: 0.63418992064743285 | E9: 0.36581007935256715 | F9: 0.64808950812750687 | G9: 0.35191049187249313
A10: 8 | B10: 0.66775571751696405 | C10: 0.33224428248303595 | D10: 0.65323904533400678 | E10: 0.34676095466599316 | F10: 0.67201486235433205 | G10: 0.32798513764566795
A11: 9 | B11: 0.67559143630882423 | C11: 0.32440856369117571 | D11: 0.65506001655629142 | E11: 0.34493998344370863 | F11: 0.66588321320380239 | G11: 0.33411678679619766
A12: 10 | B12: 0.62379932701131846 | C12: 0.37620067298868154 | D12: 0.60545184818889852 | E12: 0.39454815181110148 | F12: 0.60460380153048632 | G12: 0.39539619846951368
A13: 11 | B13: 0.44189494038027716 | C13: 0.5581050596197229 | D13: 0.43567232160538649 | E13: 0.56432767839461351 | F13: 0.45516152378445951 | G13: 0.54483847621554049
A14: 12 | B14: 0.51036428308598059 | C14: 0.48963571691401936 | D14: 0.49950304385637967 | E14: 0.50049695614362033 | F14: 0.51086277937320512 | G14: 0.48913722062679488
A15: 13 | B15: 0.6133122028526149 | C15: 0.3866877971473851 | D15: 0.58889154514303932 | E15: 0.41110845485696074 | F15: 0.58958200382897252 | G15: 0.41041799617102742
A16: 14 | B16: 0.61605206073752716 | C16: 0.38394793926247289 | D16: 0.61850484293894148 | E16: 0.38149515706105847 | F16: 0.62322338428533119 | G16: 0.37677661571466881
A17: 15 | B17: 0.73758356139799897 | C17: 0.26241643860200098 | D17: 0.71258495643844366 | E17: 0.28741504356155634 | F17: 0.70837326032397896 | G17: 0.29162673967602099
A18: 16 | B18: 0.64082741328875892 | C18: 0.35917258671124114 | D18: 0.63227216978616751 | E18: 0.36772783021383243 | F18: 0.64470021413276235 | G18: 0.35529978586723771
A19: 17 | B19: 0.66757620976337673 | C19: 0.33242379023662333 | D19: 0.64912280701754388 | E19: 0.35087719298245612 | F19: 0.66688191484781956 | G19: 0.33311808515218044
A20: 18 | B20: 0.67151556156968872 | C20: 0.32848443843031122 | D20: 0.65439134882361538 | E20: 0.34560865117638462 | F20: 0.65745748672221405 | G20: 0.3425425132777859
A21: 19 | B21: 0.62355237475601821 | C21: 0.37644762524398179 | D21: 0.62754944716091798 | E21: 0.37245055283908196 | F21: 0.65449821656611917 | G21: 0.34550178343388083
A22: 20 | B22: 0.66184118060435704 | C22: 0.33815881939564302 | D22: 0.67100806259243362 | E22: 0.32899193740756644 | F22: 0.67238076996743923 | G22: 0.32761923003256083
A23: 21 | B23: 0.60669700151674255 | C23: 0.3933029984832575 | D23: 0.55223435355885686 | E23: 0.44776564644114314 | F23: 0.59046710016106907 | G23: 0.40953289983893099
A24: 22 | B24: 0.70213386477421869 | C24: 0.29786613522578137 | D24: 0.69056733411857085 | E24: 0.30943266588142915 | F24: 0.70095893779198426 | G24: 0.29904106220801574
A25: 23 | B25: 0.70085397459319365 | C25: 0.29914602540680629 | D25: 0.68939426693761074 | E25: 0.3106057330623892 | F25: 0.6975033533815066 | G25: 0.30249664661849335
A26: 24 | B26: 0.62845905323781426 | C26: 0.37154094676218569 | D26: 0.64016575118049535 | E26: 0.35983424881950465 | F26: 0.65163835827358896 | G26: 0.34836164172641099
A27: 25 | B27: 0.68284526004373369 | C27: 0.31715473995626636 | D27: 0.68192041522491353 | E27: 0.31807958477508652 | F27: 0.68961033331888522 | G27: 0.31038966668111484
A28: 26 | B28: 0.6962983161769718 | C28: 0.30370168382302815 | D28: 0.70251290877796901 | E28: 0.29748709122203099 | F28: 0.70464891709201272 | G28: 0.29535108290798728
A29: 27 | B29: 0.64999538617698627 | C29: 0.35000461382301373 | D29: 0.62493049119555144 | E29: 0.37506950880444856 | F29: 0.64915128466747052 | G29: 0.35084871533252943
A30: 28 | B30: 0.63874345549738221 | C30: 0.36125654450261779 | D30: 0.61588371077422177 | E30: 0.38411628922577828 | F30: 0.60747198007471981 | G30: 0.39252801992528019
A31: 29 | B31: 0.70577259475218657 | C31: 0.29422740524781343 | D31: 0.6862907031618688 | E31: 0.3137092968381312 | F31: 0.68422915806242257 | G31: 0.31577084193757743
A32: 30 | B32: 0.68083667204329046 | C32: 0.31916332795670949 | D32: 0.65460613444932991 | E32: 0.34539386555067014 | F32: 0.66800783524802798 | G32: 0.33199216475197207
A33: 31 | B33: 0.60404810794954533 | C33: 0.39595189205045467 | D33: 0.57671240944696389 | E33: 0.42328759055303611 | F33: 0.58517862415116617 | G33: 0.41482137584883377
A34: 32 | B34: 0.62407280433834067 | C34: 0.37592719566165927 | D34: 0.59471864193649793 | E34: 0.40528135806350202 | F34: 0.59552323029657028 | G34: 0.40447676970342966
A35: 33 | B35: 0.66484434320425212 | C35: 0.33515565679574794 | D35: 0.64514154552410097 | E35: 0.35485845447589903 | F35: 0.64594057387492987 | G35: 0.35405942612507008
A36: 34 | B36: 0.56856047984005331 | C36: 0.43143952015994669 | D36: 0.54755611495699597 | E36: 0.45244388504300398 | F36: 0.53259228187919461 | G36: 0.46740771812080539
A37: 35 | B37: 0.49360548393697568 | C37: 0.50639451606302432 | D37: 0.46418441545046674 | E37: 0.53581558454953326 | F37: 0.4349775784753363 | G37: 0.56502242152466364
A38: 36 | B38: 0.41951194504255102 | C38: 0.58048805495744904 | D38: 0.39477892999019759 | E38: 0.60522107000980241 | F38: 0.39103922277918451 | G38: 0.60896077722081543
A39: 37 | B39: 0.53017353017353019 | C39: 0.46982646982646981 | D39: 0.50509404388714729 | E39: 0.49490595611285265 | F39: 0.49934776937124969 | G39: 0.50065223062875031
A40: 38 | B40: 0.4404500366154051 | C40: 0.55954996338459495 | D40: 0.41726814653411415 | E40: 0.58273185346588585 | F40: 0.41003704951162007 | G40: 0.58996295048837988
A41: 39 | B41: 0.50071312143439284 | C41: 0.49928687856560716 | D41: 0.47481386392811298 | E41: 0.52518613607188702 | F41: 0.47317899491812537 | G41: 0.52682100508187468
A42: 40 | B42: 0.64961439588688941 | C42: 0.35038560411311054 | D42: 0.62992044632709987 | E42: 0.37007955367290007 | F42: 0.62467666839110192 | G42: 0.37532333160889808
A43: 41 | B43: 0.52946341914313444 | C43: 0.47053658085686556 | D43: 0.50258007531030635 | E43: 0.49741992468969365 | F43: 0.49760163926791784 | G43: 0.50239836073208211
A44: 42 | B44: 0.58186351463662389 | C44: 0.41813648536337611 | D44: 0.55233718609293037 | E44: 0.44766281390706958 | F44: 0.55325086038508042 | G44: 0.44674913961491952
A45: 43 | B45: 0.45024348324262387 | C45: 0.54975651675737613 | D45: 0.42940228031786248 | E45: 0.57059771968213746 | F45: 0.42522959625714779 | G45: 0.57477040374285215
A46: 44 | B46: 0.45968979035282087 | C46: 0.54031020964717913 | D46: 0.4354441965562611 | E46: 0.5645558034437389 | F46: 0.43109965635738834 | G46: 0.56890034364261166
A47: 45 | B47: 0.37285151337301919 | C47: 0.62714848662698075 | D47: 0.34952236030095529 | E47: 0.65047763969904471 | F47: 0.34965242455069517 | G47: 0.65034757544930488
A48: 46 | B48: 0.36720997123681687 | C48: 0.63279002876318313 | D48: 0.34307224754800386 | E48: 0.65692775245199608 | F48: 0.34342734391241081 | G48: 0.65657265608758919
A49: 47 | B49: 0.33199608154126042 | C49: 0.66800391845873952 | D49: 0.31488442022176283 | E49: 0.68511557977823723 | F49: 0.3125999811800132 | G49: 0.6874000188199868
A50: 48 | B50: 0.39527798933739527 | C50: 0.60472201066260467 | D50: 0.37530359197238911 | E50: 0.62469640802761084 | F50: 0.36742618194231097 | G50: 0.63257381805768897
A51: 49 | B51: 0.32411813581086185 | C51: 0.6758818641891382 | D51: 0.30559629486684675 | E51: 0.69440370513315319 | F51: 0.30660738923808062 | G51: 0.69339261076191938
A52: 50 | B52: 0.62611820475571522 | C52: 0.37388179524428472 | D52: 0.60253145018136911 | E52: 0.39746854981863083 | F52: 0.60817585807944463 | G52: 0.39182414192055537
A53: 51 | B53: 0.62075181591644135 | C53: 0.37924818408355865 | D53: 0.59006873035324203 | E53: 0.40993126964675797 | F53: 0.59926392148495844 | G53: 0.40073607851504162
A54: 52 | B54: 0.46174664307275942 | C54: 0.53825335692724052 | D54: 0.43170834208867409 | E54: 0.56829165791132585 | F54: 0.44474789915966384 | G54: 0.55525210084033616
A55: 53 | B55: 0.42032786885245904 | C55: 0.57967213114754101 | D55: 0.39892784001927478 | E55: 0.60107215998072516 | F55: 0.39379489346290819 | G55: 0.60620510653709181
A56: 54 | B56: 0.65848411995444767 | C56: 0.34151588004555233 | D56: 0.64432660362892924 | E56: 0.35567339637107082 | F56: 0.63122200895713376 | G56: 0.36877799104286629
A57: 55 | B57: 0.68430909171980203 | C57: 0.31569090828019797 | D57: 0.65870307167235498 | E57: 0.34129692832764508 | F57: 0.67907186303221445 | G57: 0.32092813696778555
A58: 56 | B58: 0.70843373493975903 | C58: 0.29156626506024097 | D58: 0.67959595959595964 | E58: 0.32040404040404041 | F58: 0.70114373198847257 | G58: 0.29885626801152737
A59: 57 | B59: 0.34664812239221138 | C59: 0.65335187760778857 | D59: 0.32347349586222324 | E59: 0.67652650413777682 | F59: 0.33672208492473599 | G59: 0.66327791507526401
A60: 58 | B60: 0.65590630509612968 | C60: 0.34409369490387037 | D60: 0.63101491019993228 | E60: 0.36898508980006778 | F60: 0.65171739500085024 | G60: 0.34828260499914981
A61: 59 | B61: 0.67389443651925818 | C61: 0.32610556348074182 | D61: 0.65888706721959689 | E61: 0.34111293278040311 | F61: 0.67372287467981251 | G61: 0.32627712532018754
A62: 60 | B62: 0.61512979254914735 | C62: 0.3848702074508526 | D62: 0.62627228251701061 | E62: 0.37372771748298939 | F62: 0.63881508281983157 | G62: 0.36118491718016849
A63: 61 | B63: 0.6551392405063291 | C63: 0.3448607594936709 | D63: 0.65131306865177829 | E63: 0.34868693134822165 | F63: 0.66933763463239504 | G63: 0.33066236536760496
A64: 62 | B64: 0.66557540783486846 | C64: 0.33442459216513148 | D64: 0.63559132573217081 | E64: 0.36440867426782919 | F64: 0.66129032258064513 | G64: 0.33870967741935482
A65: 63 | B65: 0.4088472715531159 | C65: 0.59115272844688405 | D65: 0.39692287374537771 | E65: 0.60307712625462229 | F65: 0.41557235707653534 | G65: 0.58442764292346461
A66: 64 | B66: 0.664068121851763 | C66: 0.335931878148237 | D66: 0.63771109221236788 | E66: 0.36228890778763212 | F66: 0.64988996658244358 | G66: 0.35011003341755642
A67: 65 | B67: 0.7308657207485092 | C67: 0.26913427925149086 | D67: 0.703548801192596 | E67: 0.29645119880740406 | F67: 0.72951669778054351 | G67: 0.27048330221945655
A68: 66 | B68: 0.74771104193371174 | C68: 0.2522889580662882 | D68: 0.71579044627182853 | E68: 0.28420955372817147 | F68: 0.74185359549524599 | G68: 0.25814640450475401
A69: 67 | B69: 0.58375661098601872 | C69: 0.41624338901398128 | D69: 0.55906050871557222 | E69: 0.44093949128442783 | F69: 0.55585400537209673 | G69: 0.44414599462790333
A70: 68 | B70: 0.63691025246831334 | C70: 0.36308974753168666 | D70: 0.61051009928106814 | E70: 0.38948990071893186 | F70: 0.63184319119669874 | G70: 0.36815680880330126
A71: 69 | B71: 0.23261423020233149 | C71: 0.76738576979766848 | D71: 0.22460290638729299 | E71: 0.77539709361270703 | F71: 0.24455930359085962 | G71: 0.75544069640914036
A72: 70 | B72: 0.30743456821342774 | C72: 0.69256543178657226 | D72: 0.29789808917197452 | E72: 0.70210191082802553 | F72: 0.31794380587484034 | G72: 0.68205619412515961
A73: 71 | B73: 0.19375165826479171 | C73: 0.80624834173520832 | D73: 0.19647915823553216 | E73: 0.80352084176446781 | F73: 0.21444097269392745 | G73: 0.78555902730607252
A74: 72 | B74: 0.66409480370007246 | C74: 0.33590519629992754 | D74: 0.63253166723724752 | E74: 0.36746833276275248 | F74: 0.65171718904086096 | G74: 0.34828281095913904
A75: 73 | B75: 0.65638786350949851 | C75: 0.34361213649050149 | D75: 0.62741373852484961 | E75: 0.37258626147515034 | F75: 0.6473014002809625 | G75: 0.3526985997190375
A76: 74 | B76: 0.33982058689372052 | C76: 0.66017941310627948 | D76: 0.32718917538932857 | E76: 0.67281082461067143 | F76: 0.34822116125057756 | G76: 0.65177883874942244
A77: 75 | B77: 0.49374183717892905 | C77: 0.50625816282107095 | D77: 0.48450089525514772 | E77: 0.51549910474485228 | F77: 0.50376322788749928 | G77: 0.49623677211250072
A78: 76 | B78: 0.6426092990978487 | C78: 0.3573907009021513 | D78: 0.60113484646194926 | E78: 0.39886515353805074 | F78: 0.62525352577708604 | G78: 0.37474647422291402
A79: 77 | B79: 0.34480866822109452 | C79: 0.65519133177890554 | D79: 0.32766903276690329 | E79: 0.67233096723309671 | F79: 0.34647927721210381 | G79: 0.65352072278789619
A80: 78 | B80: 0.70039064431587794 | C80: 0.29960935568412206 | D80: 0.65683700262573219 | E80: 0.34316299737426781 | F80: 0.68552697932425621 | G80: 0.31447302067574384
A81: 79 | B81: 0.49445209362598203 | C81: 0.50554790637401803 | D81: 0.45429953274858598 | E81: 0.54570046725141408 | F81: 0.46911340206185564 | G81: 0.5308865979381443
A82: 80 | B82: 0.3430088709190755 | C82: 0.6569911290809245 | D82: 0.31843403205918619 | E82: 0.68156596794081381 | F82: 0.33875877492700501 | G82: 0.66124122507299499
A83: 81 | B83: 0.67316096139839765 | C83: 0.32683903860160235 | D83: 0.62163503287433319 | E83: 0.37836496712566681 | F83: 0.65810215354061941 | G83: 0.34189784645938065
A84: 82 | B84: 0.66854667689392233 | C84: 0.33145332310607772 | D84: 0.59950408669299293 | E84: 0.40049591330700707 | F84: 0.64515240543518182 | G84: 0.35484759456481824
A85: 83 | B85: 0.63400105429625719 | C85: 0.36599894570374275 | D85: 0.57434323858742464 | E85: 0.42565676141257536 | F85: 0.61083955524520595 | G85: 0.389160444754794
A86: 84 | B86: 0.64428252592884339 | C86: 0.35571747407115661 | D86: 0.58795955266858635 | E86: 0.41204044733141365 | F86: 0.62648829431438124 | G86: 0.37351170568561876
A87: 85 | B87: 0.63963056255247686 | C87: 0.36036943744752309 | D87: 0.5830463728191001 | E87: 0.4169536271808999 | F87: 0.61973196464214431 | G87: 0.38026803535785569
A88: 86 | B88: 0.52652963671128106 | C88: 0.47347036328871894 | D88: 0.49834626255337061 | E88: 0.50165373744662933 | F88: 0.49768058316766073 | G88: 0.50231941683233927
A89: 87 | B89: 0.59440505548705302 | C89: 0.40559494451294698 | D89: 0.56772939346811824 | E89: 0.43227060653188182 | F89: 0.57012906235422178 | G89: 0.42987093764577827
A90: 88 | B90: 0.68208955223880596 | C90: 0.31791044776119404 | D90: 0.66386164471011544 | E90: 0.33613835528988451 | F90: 0.65661320316132032 | G90: 0.34338679683867968
A91: 89 | B91: 0.27882935352358768 | C91: 0.72117064647641238 | D91: 0.25188878815352073 | E91: 0.74811121184647933 | F91: 0.27724723359102621 | G91: 0.72275276640897379
A92: 90 | B92: 0.35051868029014899 | C92: 0.64948131970985101 | D92: 0.31571290009699321 | E92: 0.68428709990300673 | F92: 0.33990747504261015 | G92: 0.66009252495738979
A93: 91 | B93: 0.66597839135654258 | C93: 0.33402160864345737 | D93: 0.619845922767576 | E93: 0.38015407723242406 | F93: 0.63765083690151814 | G93: 0.36234916309848192
A94: 92 | B94: 0.30855129583184043 | C94: 0.69144870416815951 | D94: 0.28775834658187599 | E94: 0.71224165341812395 | F94: 0.30080799358539445 | G94: 0.69919200641460555
A95: 93 | B95: 0.55200725062643274 | C95: 0.4479927493735672 | D95: 0.52116913819041477 | E95: 0.47883086180958523 | F95: 0.53106428957320362 | G95: 0.46893571042679633
A96: 94 | B96: 0.61535212754724955 | C96: 0.38464787245275051 | D96: 0.58089294287085935 | E96: 0.41910705712914065 | F96: 0.59267979452054798 | G96: 0.40732020547945208
A97: 95 | B97: 0.3401102687801516 | C97: 0.6598897312198484 | D97: 0.3234796105545365 | E97: 0.67652038944546355 | F97: 0.34100403596969481 | G97: 0.65899596403030514
A98: 96 | B98: 0.67630057803468213 | C98: 0.32369942196531792 | D98: 0.64127010106796511 | E98: 0.35872989893203489 | F98: 0.65552540700542672 | G98: 0.34447459299457328
A99: 97 | B99: 0.77698201840514425 | C99: 0.22301798159485581 | D99: 0.75301134823192217 | E99: 0.24698865176807777 | F99: 0.77067989766648581 | G99: 0.22932010233351421
A100: 98 | B100: 0.69174028647396857 | C100: 0.30825971352603138 | D100: 0.66280180649643916 | E100: 0.33719819350356089 | F100: 0.6725899406217255 | G100: 0.32741005937827455
A101: 99 | B101: 0.65608879882092852 | C101: 0.34391120117907148 | D101: 0.6348314606741573 | E101: 0.3651685393258427 | F101: 0.6464442986976483 | G101: 0.35355570130235175
A102: 100 | B102: 0.57214547504933744 | C102: 0.42785452495066251 | D102: 0.53858158487948671 | E102: 0.46141841512051329 | F102: 0.55798534372455511 | G102: 0.44201465627544501