A1: HB 5005 - Senate Committee Substitute, Senate Population Totals
A2: DISTRICT | B2: Total Population | C2: Target | D2: Difference | E2: Deviation
A3: 1 | B3: 201072 | C3: 200025.60000000001 | D3: =B3-C3 -> 1046.3999999999942 | E3: =(B3-C3)/C3 -> 5.2313303897100882E-3
A4: 2 | B4: 200193 | C4: 200025.60000000001 | D4: =B4-C4 -> 167.39999999999418 | E4: =(B4-C4)/C4 -> 8.3689287771162376E-4
A5: 3 | B5: 203449 | C5: 200025.60000000001 | D5: =B5-C5 -> 3423.3999999999942 | E5: =(B5-C5)/C5 -> 1.7114809304409007E-2
A6: 4 | B6: 201941 | C6: 200025.60000000001 | D6: =B6-C6 -> 1915.3999999999942 | E6: =(B6-C6)/C6 -> 9.5757743008894562E-3
A7: 5 | B7: 200751 | C7: 200025.60000000001 | D7: =B7-C7 -> 725.39999999999418 | E7: =(B7-C7)/C7 -> 3.6265358034171333E-3
A8: 6 | B8: 196367 | C8: 200025.60000000001 | D8: =B8-C8 -> -3658.6000000000058 | E8: =(B8-C8)/C8 -> -1.8290658795674181E-2
A9: 7 | B9: 199020 | C9: 200025.60000000001 | D9: =B9-C9 -> -1005.6000000000058 | E9: =(B9-C9)/C9 -> -5.0273564983682375E-3
A10: 8 | B10: 198279 | C10: 200025.60000000001 | D10: =B10-C10 -> -1746.6000000000058 | E10: =(B10-C10)/C10 -> -8.7318823190631889E-3
A11: 9 | B11: 198943 | C11: 200025.60000000001 | D11: =B11-C11 -> -1082.6000000000058 | E11: =(B11-C11)/C11 -> -5.4123072246752705E-3
A12: 10 | B12: 199977 | C12: 200025.60000000001 | D12: =B12-C12 -> -48.600000000005821 | E12: =(B12-C12)/C12 -> -2.4296889998083154E-4
A13: 11 | B13: 201788 | C13: 200025.60000000001 | D13: =B13-C13 -> 1762.3999999999942 | E13: =(B13-C13)/C13 -> 8.810872208357301E-3
A14: 12 | B14: 203630 | C14: 200025.60000000001 | D14: =B14-C14 -> 3604.3999999999942 | E14: =(B14-C14)/C14 -> 1.8019693479234627E-2
A15: 13 | B15: 202920 | C15: 200025.60000000001 | D15: =B15-C15 -> 2894.3999999999942 | E15: =(B15-C15)/C15 -> 1.4470147821078872E-2
A16: 14 | B16: 199604 | C16: 200025.60000000001 | D16: =B16-C16 -> -421.60000000000582 | E16: =(B16-C16)/C16 -> -2.1077302105330809E-3
A17: 15 | B17: 198140 | C17: 200025.60000000001 | D17: =B17-C17 -> -1885.6000000000058 | E17: =(B17-C17)/C17 -> -9.426793370448612E-3
A18: 16 | B18: 200841 | C18: 200025.60000000001 | D18: =B18-C18 -> 815.39999999999418 | E18: =(B18-C18)/C18 -> 4.0764782107889901E-3
A19: 17 | B19: 204024 | C19: 200025.60000000001 | D19: =B19-C19 -> 3998.3999999999942 | E19: =(B19-C19)/C19 -> 1.9989441351506976E-2
A20: 18 | B20: 198553 | C20: 200025.60000000001 | D20: =B20-C20 -> -1472.6000000000058 | E20: =(B20-C20)/C20 -> -7.3620576566199815E-3
A21: 19 | B21: 200782 | C21: 200025.60000000001 | D21: =B21-C21 -> 756.39999999999418 | E21: =(B21-C21)/C21 -> 3.7815159659563284E-3
A22: 20 | B22: 201089 | C22: 200025.60000000001 | D22: =B22-C22 -> 1063.3999999999942 | E22: =(B22-C22)/C22 -> 5.3163195111025499E-3
A23: 21 | B23: 200511 | C23: 200025.60000000001 | D23: =B23-C23 -> 485.39999999999418 | E23: =(B23-C23)/C23 -> 2.4266893837588499E-3
A24: 22 | B24: 196185 | C24: 200025.60000000001 | D24: =B24-C24 -> -3840.6000000000058 | E24: =(B24-C24)/C24 -> -1.9200542330581716E-2
A25: 23 | B25: 199307 | C25: 200025.60000000001 | D25: =B25-C25 -> -718.60000000000582 | E25: =(B25-C25)/C25 -> -3.5925401548602071E-3
A26: 24 | B26: 204024 | C26: 200025.60000000001 | D26: =B26-C26 -> 3998.3999999999942 | E26: =(B26-C26)/C26 -> 1.9989441351506976E-2
A27: 25 | B27: 198245 | C27: 200025.60000000001 | D27: =B27-C27 -> -1780.6000000000058 | E27: =(B27-C27)/C27 -> -8.9018605618481125E-3
A28: 26 | B28: 201484 | C28: 200025.60000000001 | D28: =B28-C28 -> 1458.3999999999942 | E28: =(B28-C28)/C28 -> 7.291066743456808E-3
A29: 27 | B29: 203166 | C29: 200025.60000000001 | D29: =B29-C29 -> 3140.3999999999942 | E29: =(B29-C29)/C29 -> 1.5699990401228613E-2
A30: 28 | B30: 200017 | C30: 200025.60000000001 | D30: =B30-C30 -> -8.6000000000058208 | E30: =(B30-C30)/C30 -> -4.2994496704450935E-5
A31: 29 | B31: 203988 | C31: 200025.60000000001 | D31: =B31-C31 -> 3962.3999999999942 | E31: =(B31-C31)/C31 -> 1.9809464388558237E-2
A32: 30 | B32: 196030 | C32: 200025.60000000001 | D32: =B32-C32 -> -3995.6000000000058 | E32: =(B32-C32)/C32 -> -1.9975443143277687E-2
A33: 31 | B33: 200905 | C33: 200025.60000000001 | D33: =B33-C33 -> 879.39999999999418 | E33: =(B33-C33)/C33 -> 4.3964372560311984E-3
A34: 32 | B34: 198617 | C34: 200025.60000000001 | D34: =B34-C34 -> -1408.6000000000058 | E34: =(B34-C34)/C34 -> -7.0420986113777723E-3
A35: 33 | B35: 196178 | C35: 200025.60000000001 | D35: =B35-C35 -> -3847.6000000000058 | E35: =(B35-C35)/C35 -> -1.9235537851155081E-2
A36: 34 | B36: 196312 | C36: 200025.60000000001 | D36: =B36-C36 -> -3713.6000000000058 | E36: =(B36-C36)/C36 -> -1.8565623600179205E-2
A37: 35 | B37: 196251 | C37: 200025.60000000001 | D37: =B37-C37 -> -3774.6000000000058 | E37: =(B37-C37)/C37 -> -1.8870584565175687E-2
A38: 36 | B38: 199138 | C38: 200025.60000000001 | D38: =B38-C38 -> -887.60000000000582 | E38: =(B38-C38)/C38 -> -4.437432008702915E-3
A39: 37 | B39: 198267 | C39: 200025.60000000001 | D39: =B39-C39 -> -1758.6000000000058 | E39: =(B39-C39)/C39 -> -8.7918746400461028E-3
A40: 38 | B40: 201414 | C40: 200025.60000000001 | D40: =B40-C40 -> 1388.3999999999942 | E40: =(B40-C40)/C40 -> 6.9411115377231419E-3
A41: 39 | B41: 201164 | C41: 200025.60000000001 | D41: =B41-C41 -> 1138.3999999999942 | E41: =(B41-C41)/C41 -> 5.6912715172457631E-3
A42: 40 | B42: 198458 | C42: 200025.60000000001 | D42: =B42-C42 -> -1567.6000000000058 | E42: =(B42-C42)/C42 -> -7.8369968644013861E-3

A1: HB 5005 - Senate Committee Substitute, Senate Racial Demographics
A2: DISTRICT | B2: Total Population | C2: White | D2: % White | E2: Black | F2: % Black | G2: AIAN | H2: % AIAN | I2: Asian | J2: % Asian | K2: HawPI | L2: % HawPI | M2: Other | N2: % Other | O2: Multi | P2: % Multi | Q2: Total Hispanic | R2: % Hispanic
A3: 1 | B3: 201072 | C3: 116539 | D3: =C3/B3 -> 0.57958840614307316 | E3: 65255 | F3: =E3/B3 -> 0.32453548977480701 | G3: 1637 | H3: =G3/B3 -> 8.1413622980822786E-3 | I3: 8271 | J3: =I3/B3 -> 4.1134518978276441E-2 | K3: 457 | L3: =K3/B3 -> 2.2728176971433117E-3 | M3: 6121 | N3: =M3/B3 -> 3.0441831781650355E-2 | O3: 2792 | P3: =O3/B3 -> 1.3885573326967455E-2 | Q3: 15459 | R3: =Q3/B3 -> 7.6882907615182627E-2
A4: 2 | B4: 200193 | C4: 79753 | D4: =C4/B4 -> 0.39838056275693956 | E4: 106265 | F4: =E4/B4 -> 0.53081276568111768 | G4: 1480 | H4: =G4/B4 -> 7.3928658844215336E-3 | I4: 6174 | J4: =I4/B4 -> 3.0840239169201721E-2 | K4: 289 | L4: =K4/B4 -> 1.4436069193228534E-3 | M4: 3199 | N4: =M4/B4 -> 1.5979579705584113E-2 | O4: 3033 | P4: =O4/B4 -> 1.5150379883412507E-2 | Q4: 9267 | R4: =Q4/B4 -> 4.6290329831712398E-2
A5: 3 | B5: 203449 | C5: 169921 | D5: =C5/B5 -> 0.83520194250156055 | E5: 24104 | F5: =E5/B5 -> 0.118476866438272 | G5: 1985 | H5: =G5/B5 -> 9.7567449336197279E-3 | I5: 4624 | J5: =I5/B5 -> 2.2728054696754468E-2 | K5: 159 | L5: =K5/B5 -> 7.8152264203805379E-4 | M5: 1683 | N5: =M5/B5 -> 8.2723434374216628E-3 | O5: 973 | P5: =O5/B5 -> 4.7825253503334985E-3 | Q5: 5551 | R5: =Q5/B5 -> 2.7284479156938594E-2
A6: 4 | B6: 201941 | C6: 153625 | D6: =C6/B6 -> 0.76074199890066896 | E6: 40116 | F6: =E6/B6 -> 0.19865208154857111 | G6: 1624 | H6: =G6/B6 -> 8.0419528476139077E-3 | I6: 2933 | J6: =I6/B6 -> 1.45240441515096E-2 | K6: 168 | L6: =K6/B6 -> 8.3192615664971455E-4 | M6: 2567 | N6: =M6/B6 -> 1.2711633595951293E-2 | O6: 908 | P6: =O6/B6 -> 4.4963627990353616E-3 | Q6: 6349 | R6: =Q6/B6 -> 3.1439876003387129E-2
A7: 5 | B7: 200751 | C7: 73698 | D7: =C7/B7 -> 0.36711149633127604 | E7: 112929 | F7: =E7/B7 -> 0.56253268974998882 | G7: 1445 | H7: =G7/B7 -> 7.197971616579743E-3 | I7: 5973 | J7: =I7/B7 -> 2.9753276446941732E-2 | K7: 251 | L7: =K7/B7 -> 1.2503051043332286E-3 | M7: 4083 | N7: =M7/B7 -> 2.0338628450169614E-2 | O7: 2372 | P7: =O7/B7 -> 1.1815632300710831E-2 | Q7: 10373 | R7: =Q7/B7 -> 5.167097548704614E-2
A8: 6 | B8: 196367 | C8: 123902 | D8: =C8/B8 -> 0.63097159909760803 | E8: 55125 | F8: =E8/B8 -> 0.28072435796238676 | G8: 1902 | H8: =G8/B8 -> 9.6859451944573179E-3 | I8: 6754 | J8: =I8/B8 -> 3.4394781200507214E-2 | K8: 442 | L8: =K8/B8 -> 2.2508873690589557E-3 | M8: 5844 | N8: =M8/B8 -> 2.9760601323032893E-2 | O8: 2398 | P8: =O8/B8 -> 1.2211827852948815E-2 | Q8: 15191 | R8: =Q8/B8 -> 7.7360248921661989E-2
A9: 7 | B9: 199020 | C9: 131555 | D9: =C9/B9 -> 0.6610139684453824 | E9: 44850 | F9: =E9/B9 -> 0.22535423575520047 | G9: 1582 | H9: =G9/B9 -> 7.9489498542860016E-3 | I9: 14327 | J9: =I9/B9 -> 7.1987739925635619E-2 | K9: 387 | L9: =K9/B9 -> 1.9445281881217968E-3 | M9: 4209 | N9: =M9/B9 -> 2.1148628278564969E-2 | O9: 2110 | P9: =O9/B9 -> 1.0601949552808763E-2 | Q9: 12161 | R9: =Q9/B9 -> 6.110441161692292E-2
A10: 8 | B10: 198279 | C10: 141564 | D10: =C10/B10 -> 0.71396365727081534 | E10: 35589 | F10: =E10/B10 -> 0.17948950720953807 | G10: 1577 | H10: =G10/B10 -> 7.9534393455686185E-3 | I10: 12192 | J10: =I10/B10 -> 6.1489113824459471E-2 | K10: 446 | L10: =K10/B10 -> 2.2493557058488292E-3 | M10: 4824 | N10: =M10/B10 -> 2.4329354091961328E-2 | O10: 2087 | P10: =O10/B10 -> 1.0525572551808311E-2 | Q10: 13895 | R10: =Q10/B10 -> 7.0078021373922605E-2
A11: 9 | B11: 198943 | C11: 80706 | D11: =C11/B11 -> 0.40567398702140817 | E11: 107925 | F11: =E11/B11 -> 0.54249207059308446 | G11: 1721 | H11: =G11/B11 -> 8.6507190501802032E-3 | I11: 4377 | J11: =I11/B11 -> 2.2001276747611126E-2 | K11: 115 | L11: =K11/B11 -> 5.7805502078484797E-4 | M11: 2384 | N11: =M11/B11 -> 1.1983331909139803E-2 | O11: 1715 | P11: =O11/B11 -> 8.6205596577914271E-3 | Q11: 5518 | R11: =Q11/B11 -> 2.7736587866876442E-2
A12: 10 | B12: 199977 | C12: 138475 | D12: =C12/B12 -> 0.69245463228271253 | E12: 45465 | F12: =E12/B12 -> 0.22735114538171891 | G12: 1068 | H12: =G12/B12 -> 5.340614170629622E-3 | I12: 7652 | J12: =I12/B12 -> 3.8264400406046693E-2 | K12: 139 | L12: =K12/B12 -> 6.950799341924321E-4 | M12: 5966 | N12: =M12/B12 -> 2.9833430844547124E-2 | O12: 1212 | P12: =O12/B12 -> 6.0606969801527176E-3 | Q12: 11794 | R12: =Q12/B12 -> 5.8976782329967947E-2
A13: 11 | B13: 201788 | C13: 142424 | D13: =C13/B13 -> 0.70581005808075803 | E13: 43308 | F13: =E13/B13 -> 0.21462128570579023 | G13: 1508 | H13: =G13/B13 -> 7.4731896842230462E-3 | I13: 6420 | J13: =I13/B13 -> 3.1815568814795726E-2 | K13: 185 | L13: =K13/B13 -> 9.1680377425813232E-4 | M13: 6529 | N13: =M13/B13 -> 3.2355739687196461E-2 | O13: 1414 | P13: =O13/B13 -> 7.007354252978373E-3 | Q13: 12496 | R13: =Q13/B13 -> 6.1926378179079034E-2
A14: 12 | B14: 203630 | C14: 150352 | D14: =C14/B14 -> 0.73835878799783927 | E14: 26467 | F14: =E14/B14 -> 0.12997593674802338 | G14: 1009 | H14: =G14/B14 -> 4.9550655600844673E-3 | I14: 19196 | J14: =I14/B14 -> 9.4269017335363164E-2 | K14: 113 | L14: =K14/B14 -> 5.5492805578745766E-4 | M14: 5293 | N14: =M14/B14 -> 2.5993223002504541E-2 | O14: 1200 | P14: =O14/B14 -> 5.8930413003977803E-3 | Q14: 11625 | R14: =Q14/B14 -> 5.7088837597603498E-2
A15: 13 | B15: 202920 | C15: 146476 | D15: =C15/B15 -> 0.7218411196530653 | E15: 16651 | F15: =E15/B15 -> 8.2056968263355012E-2 | G15: 1110 | H15: =G15/B15 -> 5.4701360141927854E-3 | I15: 29817 | J15: =I15/B15 -> 0.14693968066232999 | K15: 186 | L15: =K15/B15 -> 9.1661738616203431E-4 | M15: 7112 | N15: =M15/B15 -> 3.5048294894539721E-2 | O15: 1568 | P15: =O15/B15 -> 7.7271831263552139E-3 | Q15: 19207 | R15: =Q15/B15 -> 9.4653065247388132E-2
A16: 14 | B16: 199604 | C16: 146080 | D16: =C16/B16 -> 0.7318490611410593 | E16: 38142 | F16: =E16/B16 -> 0.19108835494278673 | G16: 1460 | H16: =G16/B16 -> 7.3144826756978819E-3 | I16: 10302 | J16: =I16/B16 -> 5.1612192140438065E-2 | K16: 277 | L16: =K16/B16 -> 1.387747740526242E-3 | M16: 1968 | N16: =M16/B16 -> 9.8595218532694737E-3 | O16: 1375 | P16: =O16/B16 -> 6.8886395062223204E-3 | Q16: 7490 | R16: =Q16/B16 -> 3.7524298110258314E-2
A17: 15 | B17: 198140 | C17: 134346 | D17: =C17/B17 -> 0.67803573231048753 | E17: 58526 | F17: =E17/B17 -> 0.29537700615726253 | G17: 1144 | H17: =G17/B17 -> 5.7736953669122841E-3 | I17: 1131 | J17: =I17/B17 -> 5.7080851922882807E-3 | K17: 88 | L17: =K17/B17 -> 4.4413041283940648E-4 | M17: 2302 | N17: =M17/B17 -> 1.161804784495811E-2 | O17: 603 | P17: =O17/B17 -> 3.043302715251842E-3 | Q17: 4667 | R17: =Q17/B17 -> 2.355405269001716E-2
A18: 16 | B18: 200841 | C18: 74207 | D18: =C18/B18 -> 0.36948133100313185 | E18: 110339 | F18: =E18/B18 -> 0.54938483676141825 | G18: 1355 | H18: =G18/B18 -> 6.7466304190877359E-3 | I18: 3645 | J18: =I18/B18 -> 1.8148684780498005E-2 | K18: 311 | L18: =K18/B18 -> 1.5484886054142331E-3 | M18: 9215 | N18: =M18/B18 -> 4.5882065912836521E-2 | O18: 1769 | P18: =O18/B18 -> 8.8079625176134355E-3 | Q18: 16215 | R18: =Q18/B18 -> 8.0735507192256556E-2
A19: 17 | B19: 204024 | C19: 148539 | D19: =C19/B19 -> 0.72804670038818964 | E19: 38721 | F19: =E19/B19 -> 0.18978649570638748 | G19: 1535 | H19: =G19/B19 -> 7.5236246716072616E-3 | I19: 5232 | J19: =I19/B19 -> 2.5644041877426187E-2 | K19: 264 | L19: =K19/B19 -> 1.2939654158334313E-3 | M19: 8370 | N19: =M19/B19 -> 4.1024585342900835E-2 | O19: 1363 | P19: =O19/B19 -> 6.6805865976551776E-3 | Q19: 16277 | R19: =Q19/B19 -> 7.9779829823942286E-2
A20: 18 | B20: 198553 | C20: 82293 | D20: =C20/B20 -> 0.41446364446772399 | E20: 108845 | F20: =E20/B20 -> 0.54819116306477367 | G20: 1167 | H20: =G20/B20 -> 5.8775238853102192E-3 | I20: 2674 | J20: =I20/B20 -> 1.3467436906015019E-2 | K20: 204 | L20: =K20/B20 -> 1.0274334812367478E-3 | M20: 2000 | N20: =M20/B20 -> 1.007287726702694E-2 | O20: 1370 | P20: =O20/B20 -> 6.8999209279134539E-3 | Q20: 5217 | R20: =Q20/B20 -> 2.6275100351039773E-2
A21: 19 | B21: 200782 | C21: 185949 | D21: =C21/B21 -> 0.92612385572411871 | E21: 8796 | F21: =E21/B21 -> 4.3808707951908041E-2 | G21: 967 | H21: =G21/B21 -> 4.8161687800699262E-3 | I21: 3022 | J21: =I21/B21 -> 1.5051150003486368E-2 | K21: 71 | L21: =K21/B21 -> 3.5361735613750238E-4 | M21: 1684 | N21: =M21/B21 -> 8.3872060244444217E-3 | O21: 293 | P21: =O21/B21 -> 1.459294159835045E-3 | Q21: 3927 | R21: =Q21/B21 -> 1.9558526162703829E-2
A22: 20 | B22: 201089 | C22: 135888 | D22: =C22/B22 -> 0.67576048416372847 | E22: 58396 | F22: =E22/B22 -> 0.29039877865024938 | G22: 868 | H22: =G22/B22 -> 4.3164966756013504E-3 | I22: 1105 | J22: =I22/B22 -> 5.4950792932482633E-3 | K22: 62 | L22: =K22/B22 -> 3.083211911143822E-4 | M22: 4262 | N22: =M22/B22 -> 2.1194595427895112E-2 | O22: 508 | P22: =O22/B22 -> 2.5262445981630026E-3 | Q22: 7306 | R22: =Q22/B22 -> 3.6332171327123811E-2
A23: 21 | B23: 200511 | C23: 152120 | D23: =C23/B23 -> 0.75866161956201905 | E23: 34350 | F23: =E23/B23 -> 0.17131229708095816 | G23: 1122 | H23: =G23/B23 -> 5.5957029788889388E-3 | I23: 8449 | J23: =I23/B23 -> 4.2137339098603066E-2 | K23: 150 | L23: =K23/B23 -> 7.4808863354130194E-4 | M23: 3408 | N23: =M23/B23 -> 1.6996573754058379E-2 | O23: 912 | P23: =O23/B23 -> 4.5483788919311163E-3 | Q23: 8157 | R23: =Q23/B23 -> 4.0681059891975999E-2
A24: 22 | B24: 196185 | C24: 138035 | D24: =C24/B24 -> 0.7035960955220838 | E24: 52344 | F24: =E24/B24 -> 0.26680938909702578 | G24: 1400 | H24: =G24/B24 -> 7.1361215179549919E-3 | I24: 1857 | J24: =I24/B24 -> 9.4655554706017282E-3 | K24: 99 | L24: =K24/B24 -> 5.0462573591253152E-4 | M24: 1660 | N24: =M24/B24 -> 8.4614012284323463E-3 | O24: 790 | P24: =O24/B24 -> 4.0268114279888882E-3 | Q24: 4184 | R24: =Q24/B24 -> 2.1326808879374059E-2
A25: 23 | B25: 199307 | C25: 172867 | D25: =C25/B25 -> 0.86734033425820467 | E25: 20031 | F25: =E25/B25 -> 0.10050324373955756 | G25: 1152 | H25: =G25/B25 -> 5.780027796314229E-3 | I25: 3119 | J25: =I25/B25 -> 1.5649224563111179E-2 | K25: 86 | L25: =K25/B25 -> 4.3149513062762471E-4 | M25: 1583 | N25: =M25/B25 -> 7.9425208346922092E-3 | O25: 469 | P25: =O25/B25 -> 2.3531536774925115E-3 | Q25: 3831 | R25: =Q25/B25 -> 1.9221602853888724E-2
A26: 24 | B26: 204024 | C26: 181909 | D26: =C26/B26 -> 0.89160588950319575 | E26: 15056 | F26: =E26/B26 -> 7.3795239775712659E-2 | G26: 1179 | H26: =G26/B26 -> 5.778731913892483E-3 | I26: 1966 | J26: =I26/B26 -> 9.6361212406383557E-3 | K26: 97 | L26: =K26/B26 -> 4.7543426263576833E-4 | M26: 3318 | N26: =M26/B26 -> 1.6262792612633806E-2 | O26: 499 | P26: =O26/B26 -> 2.4457906912912207E-3 | Q26: 6760 | R26: =Q26/B26 -> 3.3133356859977259E-2
A27: 25 | B27: 198245 | C27: 165121 | D27: =C27/B27 -> 0.83291381875961568 | E27: 20363 | F27: =E27/B27 -> 0.10271633584705793 | G27: 1222 | H27: =G27/B27 -> 6.1640898887739921E-3 | I27: 7934 | J27: =I27/B27 -> 4.0021185906328027E-2 | K27: 127 | L27: =K27/B27 -> 6.4062145325228886E-4 | M27: 2814 | N27: =M27/B27 -> 1.4194557239779061E-2 | O27: 664 | P27: =O27/B27 -> 3.3493909051930692E-3 | Q27: 6931 | R27: =Q27/B27 -> 3.496178970465838E-2
A28: 26 | B28: 201484 | C28: 180374 | D28: =C28/B28 -> 0.89522741259851901 | E28: 8075 | F28: =E28/B28 -> 4.0077624029699631E-2 | G28: 1371 | H28: =G28/B28 -> 6.8045105318536459E-3 | I28: 3298 | J28: =I28/B28 -> 1.6368545393182585E-2 | K28: 127 | L28: =K28/B28 -> 6.3032300331539973E-4 | M28: 7636 | N28: =M28/B28 -> 3.7898790970995216E-2 | O28: 603 | P28: =O28/B28 -> 2.9927934724345356E-3 | Q28: 14661 | R28: =Q28/B28 -> 7.2765083083520282E-2
A29: 27 | B29: 203166 | C29: 174454 | D29: =C29/B29 -> 0.85867714086018332 | E29: 15584 | F29: =E29/B29 -> 7.6705748009017263E-2 | G29: 1374 | H29: =G29/B29 -> 6.762942618351496E-3 | I29: 3478 | J29: =I29/B29 -> 1.7119006132915941E-2 | K29: 176 | L29: =K29/B29 -> 8.6628668182668362E-4 | M29: 7365 | N29: =M29/B29 -> 3.6251144384395029E-2 | O29: 735 | P29: =O29/B29 -> 3.6177313133102982E-3 | Q29: 14948 | R29: =Q29/B29 -> 7.3575302954234464E-2
A30: 28 | B30: 200017 | C30: 150618 | D30: =C30/B30 -> 0.75302599279061277 | E30: 30569 | F30: =E30/B30 -> 0.15283200927921126 | G30: 1838 | H30: =G30/B30 -> 9.189218916392107E-3 | I30: 9086 | J30: =I30/B30 -> 4.5426138778203853E-2 | K30: 276 | L30: =K30/B30 -> 1.3798827099696525E-3 | M30: 6052 | N30: =M30/B30 -> 3.0257428118609916E-2 | O30: 1578 | P30: =O30/B30 -> 7.8893294070004043E-3 | Q30: 15968 | R30: =Q30/B30 -> 7.9833214176794967E-2
A31: 29 | B31: 203988 | C31: 104501 | D31: =C31/B31 -> 0.51228993862384065 | E31: 48210 | F31: =E31/B31 -> 0.23633743161362433 | G31: 2051 | H31: =G31/B31 -> 1.005451301056925E-2 | I31: 17169 | J31: =I31/B31 -> 8.4166715689158192E-2 | K31: 378 | L31: =K31/B31 -> 1.853050179422319E-3 | M31: 28883 | N31: =M31/B31 -> 0.14159166225464243 | O31: 2796 | P31: =O31/B31 -> 1.3706688628742867E-2 | Q31: 57008 | R31: =Q31/B31 -> 0.2794674196521364
A32: 30 | B32: 196030 | C32: 135368 | D32: =C32/B32 -> 0.69054736519920423 | E32: 27710 | F32: =E32/B32 -> 0.14135591491098301 | G32: 1497 | H32: =G32/B32 -> 7.6365862368004897E-3 | I32: 14703 | J32: =I32/B32 -> 7.5003825945008415E-2 | K32: 264 | L32: =K32/B32 -> 1.3467326429628119E-3 | M32: 14757 | N32: =M32/B32 -> 7.5279293985614448E-2 | O32: 1731 | P32: =O32/B32 -> 8.8302810794266186E-3 | Q32: 31600 | R32: =Q32/B32 -> 0.16119981635463959
A33: 31 | B33: 200905 | C33: 148296 | D33: =C33/B33 -> 0.73813991687613545 | E33: 11990 | F33: =E33/B33 -> 5.9679948234240061E-2 | G33: 1269 | H33: =G33/B33 -> 6.3164182076105623E-3 | I33: 27819 | J33: =I33/B33 -> 0.13846843035265424 | K33: 244 | L33: =K33/B33 -> 1.2145043677359946E-3 | M33: 9884 | N33: =M33/B33 -> 4.9197381847141682E-2 | O33: 1403 | P33: =O33/B33 -> 6.9834001144819689E-3 | Q33: 24026 | R33: =Q33/B33 -> 0.11958886040665986
A34: 32 | B34: 198617 | C34: 147196 | D34: =C34/B34 -> 0.74110473927206633 | E34: 11165 | F34: =E34/B34 -> 5.6213717858994948E-2 | G34: 1005 | H34: =G34/B34 -> 5.0599898296721834E-3 | I34: 31804 | J34: =I34/B34 -> 0.16012728014218319 | K34: 170 | L34: =K34/B34 -> 8.5591867765599122E-4 | M34: 6144 | N34: =M34/B34 -> 3.0933907973637705E-2 | O34: 1133 | P34: =O34/B34 -> 5.7044462457896353E-3 | Q34: 17410 | R34: =Q34/B34 -> 8.7656142223475328E-2
A35: 33 | B35: 196178 | C35: 112298 | D35: =C35/B35 -> 0.57242912049261385 | E35: 20203 | F35: =E35/B35 -> 0.10298300522994423 | G35: 1242 | H35: =G35/B35 -> 6.3309851257531422E-3 | I35: 40821 | J35: =I35/B35 -> 0.20808143624667394 | K35: 195 | L35: =K35/B35 -> 9.9399524921244984E-4 | M35: 19391 | N35: =M35/B35 -> 9.8843907063992903E-2 | O35: 2028 | P35: =O35/B35 -> 1.0337550591809479E-2 | Q35: 38810 | R35: =Q35/B35 -> 0.19783054165094965
A36: 34 | B36: 196312 | C36: 132960 | D36: =C36/B36 -> 0.67728921308936796 | E36: 11602 | F36: =E36/B36 -> 5.9099800317861363E-2 | G36: 1078 | H36: =G36/B36 -> 5.4912588125025467E-3 | I36: 40711 | J36: =I36/B36 -> 0.20737907005175435 | K36: 256 | L36: =K36/B36 -> 1.3040466196666532E-3 | M36: 8481 | N36: =M36/B36 -> 4.3201638208565957E-2 | O36: 1224 | P36: =O36/B36 -> 6.2349729002811848E-3 | Q36: 22037 | R36: =Q36/B36 -> 0.11225498186560169
A37: 35 | B37: 196251 | C37: 106787 | D37: =C37/B37 -> 0.54413480695639771 | E37: 25065 | F37: =E37/B37 -> 0.12771909442499657 | G37: 1602 | H37: =G37/B37 -> 8.1630157298561538E-3 | I37: 34850 | J37: =I37/B37 -> 0.17757871297471095 | K37: 221 | L37: =K37/B37 -> 1.1261089115469475E-3 | M37: 25631 | N37: =M37/B37 -> 0.13060315616226159 | O37: 2095 | P37: =O37/B37 -> 1.0675104840230114E-2 | Q37: 51879 | R37: =Q37/B37 -> 0.26435024534906826
A38: 36 | B38: 199138 | C38: 105909 | D38: =C38/B38 -> 0.5318372184113529 | E38: 50571 | F38: =E38/B38 -> 0.25394952244172381 | G38: 1902 | H38: =G38/B38 -> 9.5511655234058798E-3 | I38: 16936 | J38: =I38/B38 -> 8.5046550633229218E-2 | K38: 382 | L38: =K38/B38 -> 1.9182677339332523E-3 | M38: 20662 | N38: =M38/B38 -> 0.10375719350400225 | O38: 2776 | P38: =O38/B38 -> 1.394008175235264E-2 | Q38: 42965 | R38: =Q38/B38 -> 0.2157549036346654
A39: 37 | B39: 198267 | C39: 119378 | D39: =C39/B39 -> 0.60210725940272458 | E39: 15433 | F39: =E39/B39 -> 7.7839479086282637E-2 | G39: 1146 | H39: =G39/B39 -> 5.7800844315998127E-3 | I39: 48160 | J39: =I39/B39 -> 0.24290476983058198 | K39: 233 | L39: =K39/B39 -> 1.1751829603514454E-3 | M39: 12319 | N39: =M39/B39 -> 6.2133385787851735E-2 | O39: 1598 | P39: =O39/B39 -> 8.0598385006077668E-3 | Q39: 30619 | R39: =Q39/B39 -> 0.1544331633605189
A40: 38 | B40: 201414 | C40: 189958 | D40: =C40/B40 -> 0.94312212656518413 | E40: 8283 | F40: =E40/B40 -> 4.1124251541600883E-2 | G40: 888 | H40: =G40/B40 -> 4.4088295749054188E-3 | I40: 1191 | J40: =I40/B40 -> 5.9131937203967949E-3 | K40: 51 | L40: =K40/B40 -> 2.5320980666686526E-4 | M40: 804 | N40: =M40/B40 -> 3.9917781286305815E-3 | O40: 239 | P40: =O40/B40 -> 1.1866106626153097E-3 | Q40: 1947 | R40: =Q40/B40 -> 9.6666567368703261E-3
A41: 39 | B41: 201164 | C41: 122722 | D41: =C41/B41 -> 0.61005945397784889 | E41: 35833 | F41: =E41/B41 -> 0.17812829333280308 | G41: 1332 | H41: =G41/B41 -> 6.6214630848461953E-3 | I41: 28812 | J41: =I41/B41 -> 0.1432264222226641 | K41: 359 | L41: =K41/B41 -> 1.784613549143982E-3 | M41: 10105 | N41: =M41/B41 -> 5.023264600027838E-2 | O41: 2001 | P41: =O41/B41 -> 9.9471078324153434E-3 | Q41: 25242 | R41: =Q41/B41 -> 0.12547970809886461
A42: 40 | B42: 198458 | C42: 189689 | D42: =C42/B42 -> 0.95581432847252312 | E42: 5203 | F42: =E42/B42 -> 2.621713410394139E-2 | G42: 1049 | H42: =G42/B42 -> 5.2857531568392306E-3 | I42: 829 | J42: =I42/B42 -> 4.1772062602666556E-3 | K42: 74 | L42: =K42/B42 -> 3.7287486521077508E-4 | M42: 1371 | N42: =M42/B42 -> 6.9082627054590897E-3 | O42: 243 | P42: =O42/B42 -> 1.2244404357597074E-3 | Q42: 2857 | R42: =Q42/B42 -> 1.4395993106853843E-2

A1: HB 5005 - Senate Committee Substitute, Senate Voting Age Population
A2: DISTRICT | B2: Voting Age Population | C2: VAP White | D2: % VAP White | E2: VAP Black | F2: % VAP Black | G2: VAP AIAN | H2: % VAP AIAN | I2: VAP Asian | J2: % VAP Asian | K2: VAP HawPI | L2: % VAP HawPI | M2: VAP Other | N2: % VAP Other | O2: VAP Multi | P2: % VAP Multi | Q2: Voting Age Hispanic | R2: % VAP Hispanic
A3: 1 | B3: 154956 | C3: 95081 | D3: =C3/B3 -> 0.61359998967448826 | E3: 46018 | F3: =E3/B3 -> 0.29697462505485428 | G3: 1240 | H3: =G3/B3 -> 8.002271612586799E-3 | I3: 6445 | J3: =I3/B3 -> 4.1592452050904775E-2 | K3: 306 | L3: =K3/B3 -> 1.9747541237512584E-3 | M3: 4327 | N3: =M3/B3 -> 2.792405586101861E-2 | O3: 1539 | P3: =O3/B3 -> 9.9318516223960342E-3 | Q3: 10404 | R3: =Q3/B3 -> 6.7141640207542791E-2
A4: 2 | B4: 150369 | C4: 63636 | D4: =C4/B4 -> 0.42319893063064862 | E4: 77022 | F4: =E4/B4 -> 0.51221993895018259 | G4: 1105 | H4: =G4/B4 -> 7.3485891373886907E-3 | I4: 4466 | J4: =I4/B4 -> 2.9700270667491306E-2 | K4: 220 | L4: =K4/B4 -> 1.4630675205660742E-3 | M4: 2208 | N4: =M4/B4 -> 1.4683877660954053E-2 | O4: 1712 | P4: =O4/B4 -> 1.1385325432768722E-2 | Q4: 5918 | R4: =Q4/B4 -> 3.9356516303227396E-2
A5: 3 | B5: 157697 | C5: 133375 | D5: =C5/B5 -> 0.84576751618610368 | E5: 17955 | F5: =E5/B5 -> 0.11385758765226986 | G5: 1465 | H5: =G5/B5 -> 9.2899674692606699E-3 | I5: 3178 | J5: =I5/B5 -> 2.0152571069836457E-2 | K5: 108 | L5: =K5/B5 -> 6.8485767008884127E-4 | M5: 1064 | N5: =M5/B5 -> 6.7471163053196958E-3 | O5: 552 | P5: =O5/B5 -> 3.5003836471207443E-3 | Q5: 3468 | R5: =Q5/B5 -> 2.1991540739519456E-2
A6: 4 | B6: 154170 | C6: 119019 | D6: =C6/B6 -> 0.77199844327690215 | E6: 29832 | F6: =E6/B6 -> 0.19350068106635532 | G6: 1156 | H6: =G6/B6 -> 7.4982162547836805E-3 | I6: 1933 | J6: =I6/B6 -> 1.2538107284166829E-2 | K6: 99 | L6: =K6/B6 -> 6.4214827787507293E-4 | M6: 1610 | N6: =M6/B6 -> 1.0443017448271389E-2 | O6: 521 | P6: =O6/B6 -> 3.379386391645586E-3 | Q6: 4025 | R6: =Q6/B6 -> 2.6107543620678471E-2
A7: 5 | B7: 149582 | C7: 59413 | D7: =C7/B7 -> 0.39719351258841307 | E7: 80221 | F7: =E7/B7 -> 0.53630115923038868 | G7: 1101 | H7: =G7/B7 -> 7.3605112914655506E-3 | I7: 4434 | J7: =I7/B7 -> 2.9642604056637829E-2 | K7: 181 | L7: =K7/B7 -> 1.2100386410129561E-3 | M7: 2940 | N7: =M7/B7 -> 1.9654771296011554E-2 | O7: 1292 | P7: =O7/B7 -> 8.6374028960703834E-3 | Q7: 6854 | R7: =Q7/B7 -> 4.5821021245871826E-2
A8: 6 | B8: 160365 | C8: 104839 | D8: =C8/B8 -> 0.65375237738908121 | E8: 42154 | F8: =E8/B8 -> 0.26286284413681288 | G8: 1523 | H8: =G8/B8 -> 9.4970847753562179E-3 | I8: 5515 | J8: =I8/B8 -> 3.4390297134661553E-2 | K8: 348 | L8: =K8/B8 -> 2.170049574408381E-3 | M8: 4270 | N8: =M8/B8 -> 2.6626757708976399E-2 | O8: 1716 | P8: =O8/B8 -> 1.0700589280703396E-2 | Q8: 11051 | R8: =Q8/B8 -> 6.8911545536744306E-2
A9: 7 | B9: 153597 | C9: 105761 | D9: =C9/B9 -> 0.68856162555258238 | E9: 31513 | F9: =E9/B9 -> 0.20516676758009597 | G9: 1204 | H9: =G9/B9 -> 7.8386947661738191E-3 | I9: 10827 | J9: =I9/B9 -> 7.0489658001132841E-2 | K9: 267 | L9: =K9/B9 -> 1.7383152014687788E-3 | M9: 2883 | N9: =M9/B9 -> 1.8769897849567375E-2 | O9: 1142 | P9: =O9/B9 -> 7.4350410489788209E-3 | Q9: 8017 | R9: =Q9/B9 -> 5.2195029850843441E-2
A10: 8 | B10: 149629 | C10: 110669 | D10: =C10/B10 -> 0.7396226667290432 | E10: 24261 | F10: =E10/B10 -> 0.16214102881125986 | G10: 1197 | H10: =G10/B10 -> 7.9997861377139462E-3 | I10: 8876 | J10: =I10/B10 -> 5.9320051594276509E-2 | K10: 320 | L10: =K10/B10 -> 2.13862286054174E-3 | M10: 3227 | N10: =M10/B10 -> 2.1566674909275607E-2 | O10: 1079 | P10: =O10/B10 -> 7.211168957889179E-3 | Q10: 8921 | R10: =Q10/B10 -> 5.962079543404019E-2
A11: 9 | B11: 155821 | C11: 68909 | D11: =C11/B11 -> 0.4422317916070363 | E11: 79106 | F11: =E11/B11 -> 0.50767226497070361 | G11: 1362 | H11: =G11/B11 -> 8.7407987370123411E-3 | I11: 3584 | J11: =I11/B11 -> 2.3000750861565514E-2 | K11: 84 | L11: =K11/B11 -> 5.3908009831794173E-4 | M11: 1663 | N11: =M11/B11 -> 1.0672502422651633E-2 | O11: 1113 | P11: =O11/B11 -> 7.1428113027127279E-3 | Q11: 3833 | R11: =Q11/B11 -> 2.4598738295865126E-2
A12: 10 | B12: 157128 | C12: 111093 | D12: =C12/B12 -> 0.70702230029020929 | E12: 34106 | F12: =E12/B12 -> 0.21705870373198921 | G12: 835 | H12: =G12/B12 -> 5.3141387913039047E-3 | I12: 5953 | J12: =I12/B12 -> 3.788630925105646E-2 | K12: 100 | L12: =K12/B12 -> 6.3642380734178501E-4 | M12: 4254 | N12: =M12/B12 -> 2.7073468764319535E-2 | O12: 787 | P12: =O12/B12 -> 5.0086553637798481E-3 | Q12: 8291 | R12: =Q12/B12 -> 5.2765897866707399E-2
A13: 11 | B13: 150313 | C13: 109659 | D13: =C13/B13 -> 0.72953769800349932 | E13: 30020 | F13: =E13/B13 -> 0.19971659137932182 | G13: 1072 | H13: =G13/B13 -> 7.1317850086153557E-3 | I13: 4581 | J13: =I13/B13 -> 3.0476405899689314E-2 | K13: 128 | L13: =K13/B13 -> 8.5155641893914699E-4 | M13: 4101 | N13: =M13/B13 -> 2.7283069328667513E-2 | O13: 752 | P13: =O13/B13 -> 5.0028939612674888E-3 | Q13: 7791 | R13: =Q13/B13 -> 5.1831844218397607E-2
A14: 12 | B14: 154608 | C14: 116600 | D14: =C14/B14 -> 0.75416537307254472 | E14: 19279 | F14: =E14/B14 -> 0.12469600538135155 | G14: 724 | H14: =G14/B14 -> 4.6828107213080826E-3 | I14: 13574 | J14: =I14/B14 -> 8.7796233053916997E-2 | K14: 78 | L14: =K14/B14 -> 5.0450170754424094E-4 | M14: 3608 | N14: =M14/B14 -> 2.3336437959225912E-2 | O14: 745 | P14: =O14/B14 -> 4.8186381041084546E-3 | Q14: 7829 | R14: =Q14/B14 -> 5.0637741902100797E-2
A15: 13 | B15: 137128 | C15: 100922 | D15: =C15/B15 -> 0.73596931334227877 | E15: 10793 | F15: =E15/B15 -> 7.8707484977539238E-2 | G15: 715 | H15: =G15/B15 -> 5.2141065282072224E-3 | I15: 19118 | J15: =I15/B15 -> 0.13941718686191004 | K15: 126 | L15: =K15/B15 -> 9.1884954203372033E-4 | M15: 4615 | N15: =M15/B15 -> 3.365468759115571E-2 | O15: 839 | P15: =O15/B15 -> 6.1183711568753279E-3 | Q15: 12137 | R15: =Q15/B15 -> 8.8508546759232254E-2
A16: 14 | B16: 148997 | C16: 110637 | D16: =C16/B16 -> 0.74254515191581039 | E16: 28069 | F16: =E16/B16 -> 0.18838634334919496 | G16: 1075 | H16: =G16/B16 -> 7.2149103673228316E-3 | I16: 7156 | J16: =I16/B16 -> 4.8027812640522964E-2 | K16: 178 | L16: =K16/B16 -> 1.1946549259381062E-3 | M16: 1229 | N16: =M16/B16 -> 8.2484882245951255E-3 | O16: 653 | P16: =O16/B16 -> 4.3826385766156366E-3 | Q16: 4519 | R16: =Q16/B16 -> 3.0329469720866864E-2
A17: 15 | B17: 156564 | C17: 107458 | D17: =C17/B17 -> 0.68635190720727624 | E17: 45518 | F17: =E17/B17 -> 0.29073094708873048 | G17: 862 | H17: =G17/B17 -> 5.5057356735903531E-3 | I17: 818 | J17: =I17/B17 -> 5.2247004419917736E-3 | K17: 56 | L17: =K17/B17 -> 3.5768120385273753E-4 | M17: 1477 | N17: =M17/B17 -> 9.4338417516159519E-3 | O17: 375 | P17: =O17/B17 -> 2.395186632942439E-3 | Q17: 3033 | R17: =Q17/B17 -> 1.9372269487238445E-2
A18: 16 | B18: 152593 | C18: 59982 | D18: =C18/B18 -> 0.39308487283165022 | E18: 81087 | F18: =E18/B18 -> 0.53139396957920748 | G18: 1062 | H18: =G18/B18 -> 6.9596901561670586E-3 | I18: 2839 | J18: =I18/B18 -> 1.8605047413708362E-2 | K18: 204 | L18: =K18/B18 -> 1.3368896345179661E-3 | M18: 6321 | N18: =M18/B18 -> 4.1423918528372863E-2 | O18: 1098 | P18: =O18/B18 -> 7.1956118563761117E-3 | Q18: 10944 | R18: =Q18/B18 -> 7.1720196863552063E-2
A19: 17 | B19: 154318 | C19: 116071 | D19: =C19/B19 -> 0.75215464171386359 | E19: 27031 | F19: =E19/B19 -> 0.17516427118029004 | G19: 1145 | H19: =G19/B19 -> 7.4197436462369913E-3 | I19: 3700 | J19: =I19/B19 -> 2.397646418434661E-2 | K19: 183 | L19: =K19/B19 -> 1.1858629583068729E-3 | M19: 5444 | N19: =M19/B19 -> 3.527780297826566E-2 | O19: 744 | P19: =O19/B19 -> 4.8212133386902369E-3 | Q19: 10485 | R19: =Q19/B19 -> 6.7944115398074101E-2
A20: 18 | B20: 152088 | C20: 66502 | D20: =C20/B20 -> 0.4372600073641576 | E20: 80412 | F20: =E20/B20 -> 0.52872021461259266 | G20: 876 | H20: =G20/B20 -> 5.7598232602177691E-3 | I20: 1963 | J20: =I20/B20 -> 1.2907001209825891E-2 | K20: 125 | L20: =K20/B20 -> 8.2189258850139395E-4 | M20: 1397 | N20: =M20/B20 -> 9.1854715690915783E-3 | O20: 813 | P20: =O20/B20 -> 5.3455893956130662E-3 | Q20: 3443 | R20: =Q20/B20 -> 2.2638209457682395E-2
A21: 19 | B21: 157993 | C21: 147637 | D21: =C21/B21 -> 0.93445279221231325 | E21: 6230 | F21: =E21/B21 -> 3.9432126739792267E-2 | G21: 760 | H21: =G21/B21 -> 4.8103396985942418E-3 | I21: 2042 | J21: =I21/B21 -> 1.2924623242801896E-2 | K21: 52 | L21: =K21/B21 -> 3.2912850569329023E-4 | M21: 1097 | N21: =M21/B21 -> 6.9433455912603723E-3 | O21: 175 | P21: =O21/B21 -> 1.1076440095447266E-3 | Q21: 2474 | R21: =Q21/B21 -> 1.5658921597792308E-2
A22: 20 | B22: 158633 | C22: 110813 | D22: =C22/B22 -> 0.69854948213801671 | E22: 43490 | F22: =E22/B22 -> 0.27415481015929849 | G22: 681 | H22: =G22/B22 -> 4.2929277010458101E-3 | I22: 781 | J22: =I22/B22 -> 4.9233135602302167E-3 | K22: 49 | L22: =K22/B22 -> 3.0888907100035931E-4 | M22: 2508 | N22: =M22/B22 -> 1.5810077348344921E-2 | O22: 311 | P22: =O22/B22 -> 1.9605000220635051E-3 | Q22: 4330 | R22: =Q22/B22 -> 2.7295707702684812E-2
A23: 21 | B23: 162817 | C23: 127589 | D23: =C23/B23 -> 0.78363438707260302 | E23: 24254 | F23: =E23/B23 -> 0.14896478868914179 | G23: 902 | H23: =G23/B23 -> 5.5399620432755791E-3 | I23: 7022 | J23: =I23/B23 -> 4.3128174576364878E-2 | K23: 115 | L23: =K23/B23 -> 7.0631445119367139E-4 | M23: 2327 | N23: =M23/B23 -> 1.4292119373284116E-2 | O23: 608 | P23: =O23/B23 -> 3.7342537941369757E-3 | Q23: 5718 | R23: =Q23/B23 -> 3.5119182886307942E-2
A24: 22 | B24: 154751 | C24: 111269 | D24: =C24/B24 -> 0.71901958630315799 | E24: 39363 | F24: =E24/B24 -> 0.25436346130235021 | G24: 1114 | H24: =G24/B24 -> 7.1986610748880457E-3 | I24: 1387 | J24: =I24/B24 -> 8.9627853778004671E-3 | K24: 78 | L24: =K24/B24 -> 5.0403551511783446E-4 | M24: 1050 | N24: =M24/B24 -> 6.7850934727400796E-3 | O24: 490 | P24: =O24/B24 -> 3.1663769539453704E-3 | Q24: 2799 | R24: =Q24/B24 -> 1.8087120600189983E-2
A25: 23 | B25: 157277 | C25: 138030 | D25: =C25/B25 -> 0.87762355589183416 | E25: 14746 | F25: =E25/B25 -> 9.3758146454980706E-2 | G25: 890 | H25: =G25/B25 -> 5.6588058012296775E-3 | I25: 2151 | J25: =I25/B25 -> 1.3676507054432626E-2 | K25: 65 | L25: =K25/B25 -> 4.1328356975272928E-4 | M25: 1107 | N25: =M25/B25 -> 7.0385371033272505E-3 | O25: 288 | P25: =O25/B25 -> 1.831164124442862E-3 | Q25: 2648 | R25: =Q25/B25 -> 1.6836536810849647E-2
A26: 24 | B26: 158069 | C26: 142925 | D26: =C26/B26 -> 0.90419373817763127 | E26: 10712 | F26: =E26/B26 -> 6.7767873523587804E-2 | G26: 860 | H26: =G26/B26 -> 5.4406619893843829E-3 | I26: 1348 | J26: =I26/B26 -> 8.5279213508024972E-3 | K26: 67 | L26: =K26/B26 -> 4.2386552707994609E-4 | M26: 1878 | N26: =M26/B26 -> 1.1880887460539384E-2 | O26: 279 | P26: =O26/B26 -> 1.7650519709747009E-3 | Q26: 3970 | R26: =Q26/B26 -> 2.5115614067274417E-2
A27: 25 | B27: 160398 | C27: 135056 | D27: =C27/B27 -> 0.84200551129066448 | E27: 15328 | F27: =E27/B27 -> 9.5562288806593593E-2 | G27: 913 | H27: =G27/B27 -> 5.6920909238269805E-3 | I27: 6590 | J27: =I27/B27 -> 4.1085300315465277E-2 | K27: 103 | L27: =K27/B27 -> 6.4215264529482907E-4 | M27: 1959 | N27: =M27/B27 -> 1.2213369244005536E-2 | O27: 449 | P27: =O27/B27 -> 2.7992867741493035E-3 | Q27: 4908 | R27: =Q27/B27 -> 3.0598885272883701E-2
A28: 26 | B28: 159446 | C28: 144854 | D28: =C28/B28 -> 0.90848312281273913 | E28: 5612 | F28: =E28/B28 -> 3.5196869159464649E-2 | G28: 1017 | H28: =G28/B28 -> 6.378334984885165E-3 | I28: 2616 | J28: =I28/B28 -> 1.6406808574689864E-2 | K28: 112 | L28: =K28/B28 -> 7.0243217139344979E-4 | M28: 4889 | N28: =M28/B28 -> 3.0662418624487289E-2 | O28: 346 | P28: =O28/B28 -> 2.170013672340479E-3 | Q28: 9274 | R28: =Q28/B28 -> 5.8163892477704052E-2
A29: 27 | B29: 153073 | C29: 133915 | D29: =C29/B29 -> 0.87484402866606126 | E29: 10732 | F29: =E29/B29 -> 7.0110339511213607E-2 | G29: 983 | H29: =G29/B29 -> 6.4217726182932327E-3 | I29: 2374 | J29: =I29/B29 -> 1.5508940178868906E-2 | K29: 129 | L29: =K29/B29 -> 8.4273516557459511E-4 | M29: 4531 | N29: =M29/B29 -> 2.9600256086965041E-2 | O29: 409 | P29: =O29/B29 -> 2.6719277730233287E-3 | Q29: 9128 | R29: =Q29/B29 -> 5.9631679002828716E-2
A30: 28 | B30: 143045 | C30: 110717 | D30: =C30/B30 -> 0.77400118843720511 | E30: 20396 | F30: =E30/B30 -> 0.1425845013806844 | G30: 1275 | H30: =G30/B30 -> 8.9132790380649449E-3 | I30: 6056 | J30: =I30/B30 -> 4.2336327729036317E-2 | K30: 174 | L30: =K30/B30 -> 1.2164004334300395E-3 | M30: 3680 | N30: =M30/B30 -> 2.5726170086336469E-2 | O30: 747 | P30: =O30/B30 -> 5.2221328952427558E-3 | Q30: 9662 | R30: =Q30/B30 -> 6.7545178090810579E-2
A31: 29 | B31: 145014 | C31: 78009 | D31: =C31/B31 -> 0.53794116430137784 | E31: 32726 | F31: =E31/B31 -> 0.22567476243673024 | G31: 1371 | H31: =G31/B31 -> 9.4542595887293635E-3 | I31: 12294 | J31: =I31/B31 -> 8.477802143241342E-2 | K31: 273 | L31: =K31/B31 -> 1.8825768546485166E-3 | M31: 18796 | N31: =M31/B31 -> 0.12961507164825464 | O31: 1545 | P31: =O31/B31 -> 1.0654143737846001E-2 | Q31: 36610 | R31: =Q31/B31 -> 0.25245838332850623
A32: 30 | B32: 159954 | C32: 113468 | D32: =C32/B32 -> 0.70937894644710353 | E32: 21421 | F32: =E32/B32 -> 0.1339197519286795 | G32: 1187 | H32: =G32/B32 -> 7.4208835040074023E-3 | I32: 11733 | J32: =I32/B32 -> 7.3352338797404257E-2 | K32: 211 | L32: =K32/B32 -> 1.319129249659277E-3 | M32: 10736 | N32: =M32/B32 -> 6.7119296797829381E-2 | O32: 1198 | P32: =O32/B32 -> 7.4896532753166538E-3 | Q32: 23136 | R32: =Q32/B32 -> 0.14464158445553096
A33: 31 | B33: 161054 | C33: 120879 | D33: =C33/B33 -> 0.75054950513492369 | E33: 9359 | F33: =E33/B33 -> 5.8110944155376459E-2 | G33: 1000 | H33: =G33/B33 -> 6.2090975697592114E-3 | I33: 21304 | J33: =I33/B33 -> 0.13227861462615023 | K33: 186 | L33: =K33/B33 -> 1.1548921479752133E-3 | M33: 7348 | N33: =M33/B33 -> 4.5624448942590684E-2 | O33: 978 | P33: =O33/B33 -> 6.0724974232245089E-3 | Q33: 17980 | R33: =Q33/B33 -> 0.11163957430427061
A34: 32 | B34: 149896 | C34: 113697 | D34: =C34/B34 -> 0.75850589742221275 | E34: 7902 | F34: =E34/B34 -> 5.2716550141431395E-2 | G34: 703 | H34: =G34/B34 -> 4.6899183433847464E-3 | I34: 22521 | J34: =I34/B34 -> 0.15024416929070822 | K34: 124 | L34: =K34/B34 -> 8.2724021988578745E-4 | M34: 4265 | N34: =M34/B34 -> 2.8453060788813576E-2 | O34: 684 | P34: =O34/B34 -> 4.5631637935635372E-3 | Q34: 12178 | R34: =Q34/B34 -> 8.1242995143299357E-2
A35: 33 | B35: 142710 | C35: 84442 | D35: =C35/B35 -> 0.59170345455819495 | E35: 14108 | F35: =E35/B35 -> 9.8857823558265015E-2 | G35: 817 | H35: =G35/B35 -> 5.7248966435428494E-3 | I35: 28590 | J35: =I35/B35 -> 0.20033634643682993 | K35: 147 | L35: =K35/B35 -> 1.0300609627916753E-3 | M35: 13421 | N35: =M35/B35 -> 9.4043865181136568E-2 | O35: 1185 | P35: =O35/B35 -> 8.3035526592390163E-3 | Q35: 26634 | R35: =Q35/B35 -> 0.1866302291360101
A36: 34 | B36: 151463 | C36: 104813 | D36: =C36/B36 -> 0.69200398777259131 | E36: 8678 | F36: =E36/B36 -> 5.7294520774050429E-2 | G36: 765 | H36: =G36/B36 -> 5.0507384641793702E-3 | I36: 30103 | J36: =I36/B36 -> 0.19874820913358379 | K36: 199 | L36: =K36/B36 -> 1.3138522279368559E-3 | M36: 6125 | N36: =M36/B36 -> 4.0438919075945941E-2 | O36: 780 | P36: =O36/B36 -> 5.1497725517122995E-3 | Q36: 15918 | R36: =Q36/B36 -> 0.10509497368994408
A37: 35 | B37: 153812 | C37: 86599 | D37: =C37/B37 -> 0.56301849010480332 | E37: 18896 | F37: =E37/B37 -> 0.12285127298260214 | G37: 1178 | H37: =G37/B37 -> 7.6587002314513824E-3 | I37: 26990 | J37: =I37/B37 -> 0.17547395521805842 | K37: 166 | L37: =K37/B37 -> 1.0792395911892441E-3 | M37: 18555 | N37: =M37/B37 -> 0.12063428081033989 | O37: 1428 | P37: =O37/B37 -> 9.2840610615556648E-3 | Q37: 37848 | R37: =Q37/B37 -> 0.24606662679114763
A38: 36 | B38: 144164 | C38: 80457 | D38: =C38/B38 -> 0.55809356011209454 | E38: 34856 | F38: =E38/B38 -> 0.24178019477816931 | G38: 1256 | H38: =G38/B38 -> 8.7122998806914344E-3 | I38: 12179 | J38: =I38/B38 -> 8.4480175355844733E-2 | K38: 271 | L38: =K38/B38 -> 1.8798035570600151E-3 | M38: 13607 | N38: =M38/B38 -> 9.4385560888987544E-2 | O38: 1538 | P38: =O38/B38 -> 1.066840542715241E-2 | Q38: 28040 | R38: =Q38/B38 -> 0.19450070752753809
A39: 37 | B39: 149996 | C39: 92692 | D39: =C39/B39 -> 0.61796314568388488 | E39: 10840 | F39: =E39/B39 -> 7.2268593829168781E-2 | G39: 822 | H39: =G39/B39 -> 5.480146137230326E-3 | I39: 35832 | J39: =I39/B39 -> 0.23888637030320808 | K39: 154 | L39: =K39/B39 -> 1.026694045174538E-3 | M39: 8701 | N39: =M39/B39 -> 5.8008213552361396E-2 | O39: 955 | P39: =O39/B39 -> 6.3668364489719723E-3 | Q39: 21603 | R39: =Q39/B39 -> 0.1440238406357503
A40: 38 | B40: 162238 | C40: 153258 | D40: =C40/B40 -> 0.94464921904855825 | E40: 6584 | F40: =E40/B40 -> 4.0582354318963496E-2 | G40: 717 | H40: =G40/B40 -> 4.4194331784168936E-3 | I40: 937 | J40: =I40/B40 -> 5.7754656738865122E-3 | K40: 47 | L40: =K40/B40 -> 2.8969785130487311E-4 | M40: 544 | N40: =M40/B40 -> 3.3530985342521483E-3 | O40: 151 | P40: =O40/B40 -> 9.3073139461778373E-4 | Q40: 1361 | R40: =Q40/B40 -> 8.3889101197006863E-3
A41: 39 | B41: 153134 | C41: 96636 | D41: =C41/B41 -> 0.63105515430929771 | E41: 25726 | F41: =E41/B41 -> 0.16799665652304518 | G41: 986 | H41: =G41/B41 -> 6.4388052294069246E-3 | I41: 21253 | J41: =I41/B41 -> 0.13878694476732797 | K41: 251 | L41: =K41/B41 -> 1.6390873352749879E-3 | M41: 7136 | N41: =M41/B41 -> 4.6599710057857825E-2 | O41: 1146 | P41: =O41/B41 -> 7.4836417777893868E-3 | Q41: 17747 | R41: =Q41/B41 -> 0.11589196390089726
A42: 40 | B42: 158487 | C42: 151963 | D42: =C42/B42 -> 0.95883574047082731 | E42: 3892 | F42: =E42/B42 -> 2.455721920409876E-2 | G42: 870 | H42: =G42/B42 -> 5.4894092259932994E-3 | I42: 611 | J42: =I42/B42 -> 3.8552057897493172E-3 | K42: 48 | L42: =K42/B42 -> 3.02863957296182E-4 | M42: 936 | N42: =M42/B42 -> 5.9058471672755498E-3 | O42: 167 | P42: =O42/B42 -> 1.0537141847596332E-3 | Q42: 1928 | R42: =Q42/B42 -> 1.2165035618063312E-2

A1: HB 5005 - Senate Committee Substitute, Senate Election Data
A2: DISTRICT | B2: Rep. Gov '09 | C2: Dem. Gov '09 | D2: Rep. Lt. Gov '09 | E2: Dem. Lt. Gov '09 | F2: Rep. Att. Gen. '09 | G2: Dem. Att. Gen. '09 | H2: Rep. Pres. '08 | I2: Dem. Pres. '08 | J2: Other Pres. '08 | K2: Rep. U.S. Sen. '08 | L2: Dem. U.S. Sen. '08 | M2: Other U.S. Sen. '08
A3: 1 | B3: 0.54271953251614968 | C3: 0.45728046748385037 | D3: 0.51114903036871351 | E3: 0.48885096963128644 | F3: 0.52402465017143918 | G3: 0.47597534982856082 | H3: 0.41746927930919958 | I3: 0.57425243243908142 | J3: 8.278288251719005E-3 | K3: 0.30176788242516883 | L3: 0.684487489506722 | M3: 1.3744628068109206E-2
A4: 2 | B4: 0.40310502718687397 | C4: 0.59689497281312598 | D4: 0.37869879986395216 | E4: 0.62130120013604784 | F4: 0.39367654604539792 | G4: 0.60632345395460208 | H4: 0.29882686133525399 | I4: 0.6945933078603953 | J4: 6.5798308043507449E-3 | K4: 0.21776225520768366 | L4: 0.77008856180616192 | M4: 1.2149182986154422E-2
A5: 3 | B5: 0.71102470265324791 | C5: 0.28897529734675204 | D5: 0.67571222225636929 | E5: 0.32428777774363071 | F5: 0.68821533240783583 | G5: 0.31178466759216411 | H5: 0.62438528917807257 | I5: 0.36688556573508857 | J5: 8.729145086838903E-3 | K5: 0.4491830887563027 | L5: 0.53869930888589945 | M5: 1.2117602357797883E-2
A6: 4 | B6: 0.69872559699814973 | C6: 0.30127440300185021 | D6: 0.67607529230823005 | E6: 0.32392470769176995 | F6: 0.6922335541303053 | G6: 0.30776644586969476 | H6: 0.58371774886266026 | I6: 0.40839245379060224 | J6: 7.8897973467375055E-3 | K6: 0.42556442760906527 | L6: 0.5636527990013559 | M6: 1.0782773389578804E-2
A7: 5 | B7: 0.35982364287682556 | C7: 0.64017635712317444 | D7: 0.33346693386773546 | E7: 0.66653306613226448 | F7: 0.35572296058661779 | G7: 0.64427703941338221 | H7: 0.26040718687433373 | I7: 0.73301437894901067 | J7: 6.578434176655659E-3 | K7: 0.19159815653513607 | L7: 0.79794934456058331 | M7: 1.045249890428061E-2
A8: 6 | B8: 0.54156828976972859 | C8: 0.45843171023027141 | D8: 0.50351021800301277 | E8: 0.49648978199698718 | F8: 0.52489940355583464 | G8: 0.47510059644416541 | H8: 0.42690166405216695 | I8: 0.56316323705822646 | J8: 9.9350988896065948E-3 | K8: 0.28721554869931559 | L8: 0.69953485458332676 | M8: 1.3249596717357598E-2
A9: 7 | B9: 0.62908201255185614 | C9: 0.3709179874481438 | D9: 0.57168045276447543 | E9: 0.42831954723552462 | F9: 0.61031039722161928 | G9: 0.38968960277838072 | H9: 0.5039657379382948 | I9: 0.48690648514792262 | J9: 9.127776913782585E-3 | K9: 0.35145238387057237 | L9: 0.63532295624463786 | M9: 1.3224659884789802E-2
A10: 8 | B10: 0.65035132736996093 | C10: 0.34964867263003907 | D10: 0.5880295470110557 | E10: 0.41197045298894436 | F10: 0.63060047881956316 | G10: 0.36939952118043679 | H10: 0.5226122769170426 | I10: 0.46862783552330523 | J10: 8.7598875596522196E-3 | K10: 0.36047184928832093 | L10: 0.62635838461642046 | M10: 1.3169766095258615E-2
A11: 9 | B11: 0.36467819502711551 | C11: 0.63532180497288449 | D11: 0.35324112303881089 | E11: 0.64675887696118906 | F11: 0.37310892979434285 | G11: 0.62689107020565715 | H11: 0.27143924979614026 | I11: 0.72219579595904682 | J11: 6.3649542448129016E-3 | K11: 0.19865288691888389 | L11: 0.78938049000659671 | M11: 1.1966623074519426E-2
A12: 10 | B12: 0.59295708874552466 | C12: 0.40704291125447534 | D12: 0.57134173873780003 | E12: 0.42865826126219997 | F12: 0.59248424058788707 | G12: 0.40751575941211299 | H12: 0.47464859170665785 | I12: 0.51734962065993462 | J12: 8.0017876334074634E-3 | K12: 0.34419953846485646 | L12: 0.64240731554769559 | M12: 1.3393145987447969E-2
A13: 11 | B13: 0.68561116984433668 | C13: 0.31438883015566332 | D13: 0.65814286238397479 | E13: 0.34185713761602526 | F13: 0.68334557473374957 | G13: 0.31665442526625048 | H13: 0.56912739732122997 | I13: 0.42330796956347616 | J13: 7.5646331152939084E-3 | K13: 0.43445785572066548 | L13: 0.55404569333048359 | M13: 1.1496450948850918E-2
A14: 12 | B14: 0.67382307731288327 | C14: 0.32617692268711679 | D14: 0.64395056705487463 | E14: 0.35604943294512537 | F14: 0.66291848555364941 | G14: 0.33708151444635059 | H14: 0.55047779106471462 | I14: 0.44144231494349462 | J14: 8.0798939917908277E-3 | K14: 0.39761935877330545 | L14: 0.59146846140442588 | M14: 1.0912179822268688E-2
A15: 13 | B15: 0.64842115274871603 | C15: 0.35157884725128402 | D15: 0.62354376480156926 | E15: 0.37645623519843074 | F15: 0.62384048962417515 | G15: 0.37615951037582479 | H15: 0.49757365462670133 | I15: 0.49589633935544997 | J15: 6.5300060178486831E-3 | K15: 0.40818414984844165 | L15: 0.58220420218140367 | M15: 9.6116479701546676E-3
A16: 14 | B16: 0.68937538273116961 | C16: 0.31062461726883039 | D16: 0.64292853083540735 | E16: 0.3570714691645927 | F16: 0.67169339558142716 | G16: 0.32830660441857284 | H16: 0.60593716240547357 | I16: 0.38650072020165649 | J16: 7.562117392870004E-3 | K16: 0.43862666850144488 | L16: 0.5520503646621715 | M16: 9.3229668363836518E-3
A17: 15 | B17: 0.68246757128340008 | C17: 0.31753242871659992 | D17: 0.6772402854877082 | E17: 0.32275971451229185 | F17: 0.69138050996602951 | G17: 0.30861949003397043 | H17: 0.57938940092165903 | I17: 0.41193548387096773 | J17: 8.6751152073732719E-3 | K17: 0.40258849024801346 | L17: 0.58449313749097043 | M17: 1.2918372261016133E-2
A18: 16 | B18: 0.40828418904944241 | C18: 0.59171581095055759 | D18: 0.39360764352944522 | E18: 0.60639235647055478 | F18: 0.41774644671499517 | G18: 0.58225355328500483 | H18: 0.27817735890652556 | I18: 0.71424437830687826 | J18: 7.5782627865961195E-3 | K18: 0.21698783537971805 | L18: 0.76813324238290137 | M18: 1.4878922237380628E-2
A19: 17 | B19: 0.61195181160242307 | C19: 0.38804818839757699 | D19: 0.59097070649052263 | E19: 0.40902929350947731 | F19: 0.5937766116596469 | G19: 0.40622338834035304 | H19: 0.48542583683079127 | I19: 0.50486231958235239 | J19: 9.7118435868563825E-3 | K19: 0.35504873294346978 | L19: 0.63380116959064325 | M19: 1.115009746588694E-2
A20: 18 | B20: 0.44285874313879242 | C20: 0.55714125686120752 | D20: 0.42431756089721512 | E20: 0.57568243910278483 | F20: 0.43904697955497929 | G20: 0.56095302044502071 | H20: 0.34385238003468876 | I20: 0.64927009057621887 | J20: 6.8775293890923107E-3 | K20: 0.24765357553402473 | L20: 0.74043429379887071 | M20: 1.1912130667104582E-2
A21: 19 | B21: 0.69132533059219126 | C21: 0.30867466940780874 | D21: 0.67252149499912262 | E21: 0.32747850500087733 | F21: 0.68879375649630925 | G21: 0.3112062435036908 | H21: 0.62004399260223908 | I21: 0.36827936396765121 | J21: 1.1676643430109762E-2 | K21: 0.3981568553695693 | L21: 0.59165385168549267 | M21: 1.018929294493799E-2
A22: 20 | B22: 0.59578013417009301 | C22: 0.40421986582990693 | D22: 0.59242350006681221 | E22: 0.40757649993318784 | F22: 0.59832045683574064 | G22: 0.4016795431642593 | H22: 0.50199790463660066 | I22: 0.48607557927052114 | J22: 1.1926516092878202E-2 | K22: 0.29238778490254586 | L22: 0.69584153387086534 | M22: 1.1770681226588788E-2
A23: 21 | B23: 0.51701564494020891 | C23: 0.48298435505979109 | D23: 0.50512814353998026 | E23: 0.49487185646001969 | F23: 0.52035861936352279 | G23: 0.47964138063647727 | H23: 0.43150762852195018 | I23: 0.5570274677352075 | J23: 1.1464903742842335E-2 | K23: 0.2716741453128817 | L23: 0.71550715507155072 | M23: 1.2818699615567584E-2
A24: 22 | B24: 0.63830568766191087 | C24: 0.36169431233808919 | D24: 0.62148717745451665 | E24: 0.37851282254548335 | F24: 0.63982227159122462 | G24: 0.36017772840877532 | H24: 0.52911928381321072 | I24: 0.46088797483668037 | J24: 9.9927413501088806E-3 | K24: 0.37647902474005018 | L24: 0.61170114118272523 | M24: 1.1819834077224565E-2
A25: 23 | B25: 0.74834575468412623 | C25: 0.25165424531587377 | D25: 0.7355225244219552 | E25: 0.26447747557804485 | F25: 0.74919529312437338 | G25: 0.25080470687562662 | H25: 0.67140954495005545 | I25: 0.31746947835738071 | J25: 1.1120976692563818E-2 | K25: 0.47703507760482022 | L25: 0.51311877550559004 | M25: 9.846146889589763E-3
A26: 24 | B26: 0.73270493182965835 | C26: 0.26729506817034171 | D26: 0.73256783386387747 | E26: 0.26743216613612247 | F26: 0.73760562043102629 | G26: 0.26239437956897371 | H26: 0.63239068497021356 | I26: 0.35680143163248484 | J26: 1.080788339730156E-2 | K26: 0.47391813713057235 | L26: 0.51393166419073155 | M26: 1.2150198678696088E-2
A27: 25 | B27: 0.46391976145296826 | C27: 0.53608023854703168 | D27: 0.46138215102974828 | E27: 0.53861784897025167 | F27: 0.48075509153738694 | G27: 0.51924490846261306 | H27: 0.42444712313072119 | I27: 0.56525319552685915 | J27: 1.029968134241965E-2 | K27: 0.28707734726454798 | L27: 0.70230493880907463 | M27: 1.0617713926377401E-2
A28: 26 | B28: 0.70978763894295227 | C28: 0.29021236105704773 | D28: 0.69715687562973672 | E28: 0.30284312437026328 | F28: 0.69730843415746102 | G28: 0.30269156584253903 | H28: 0.57952966398898931 | I28: 0.40873178672101423 | J28: 1.1738549289996427E-2 | K28: 0.43891402714932126 | L28: 0.54996844663453148 | M28: 1.1117526216147268E-2
A29: 27 | B29: 0.69688595586718916 | C29: 0.3031140441328109 | D29: 0.67786157756573195 | E29: 0.3221384224342681 | F29: 0.67805650470872569 | G29: 0.32194349529127425 | H29: 0.57290186174898694 | I29: 0.41611558113584307 | J29: 1.0982557115170023E-2 | K29: 0.42546981776765375 | L29: 0.56435079726651483 | M29: 1.0179384965831435E-2
A30: 28 | B30: 0.68223341205828614 | C30: 0.31776658794171381 | D30: 0.65952086379484876 | E30: 0.3404791362051513 | F30: 0.65846969969429958 | G30: 0.34153030030570042 | H30: 0.55713427033110385 | I30: 0.43477037586484724 | J30: 8.0953538040489555E-3 | K30: 0.42256058053647788 | L30: 0.56647661008163797 | M30: 1.0962809381884151E-2
A31: 29 | B31: 0.55010477859081386 | C31: 0.44989522140918614 | D31: 0.524080105328806 | E31: 0.47591989467119394 | F31: 0.53217529990985368 | G31: 0.46782470009014632 | H31: 0.37648517755098621 | I31: 0.61503527558527304 | J31: 8.4795468637407206E-3 | K31: 0.30107433569953312 | L31: 0.68700210007463081 | M31: 1.1923564225836125E-2
A32: 30 | B32: 0.41488258980185783 | C32: 0.58511741019814212 | D32: 0.39285355614919559 | E32: 0.60714644385080441 | F32: 0.39035343872721778 | G32: 0.60964656127278216 | H32: 0.33733842839556832 | I32: 0.65404441936807556 | J32: 8.6171522363561754E-3 | K32: 0.26719885773624091 | L32: 0.71897715472481827 | M32: 1.382398753894081E-2
A33: 31 | B33: 0.44406388373765282 | C33: 0.55593611626234718 | D33: 0.42381806387606363 | E33: 0.57618193612393631 | F33: 0.41816271963330787 | G33: 0.58183728036669213 | H33: 0.38262970498474058 | I33: 0.6084308240081383 | J33: 8.9394710071210581E-3 | K33: 0.30864977000090194 | L33: 0.67861974770967282 | M33: 1.2730482289425195E-2
A34: 32 | B34: 0.44927815882260075 | C34: 0.55072184117739931 | D34: 0.42726887940460656 | E34: 0.57273112059539344 | F34: 0.41823738274832623 | G34: 0.58176261725167377 | H34: 0.38591184096802073 | I34: 0.605937289926054 | J34: 8.1508691059252857E-3 | K34: 0.30754694124772863 | L34: 0.68102967898243494 | M34: 1.1423379769836463E-2
A35: 33 | B35: 0.54726907009128889 | C35: 0.45273092990871111 | D35: 0.51965379327584049 | E35: 0.48034620672415945 | F35: 0.52178526841448192 | G35: 0.47821473158551808 | H35: 0.4046086285867187 | I35: 0.58780476287913364 | J35: 7.586608534147608E-3 | K35: 0.32645076810066748 | L35: 0.66058254287630547 | M35: 1.2966689023027051E-2
A36: 34 | B36: 0.52947803229440482 | C36: 0.47052196770559518 | D36: 0.50316493490982916 | E36: 0.49683506509017078 | F36: 0.48878977340607704 | G36: 0.51121022659392301 | H36: 0.43084377569069032 | I36: 0.5599013477491841 | J36: 9.2548765601255575E-3 | K36: 0.33718721300338422 | L36: 0.65104985720935504 | M36: 1.176292978726081E-2
A37: 35 | B37: 0.42412750755702117 | C37: 0.57587249244297889 | D37: 0.40310381533979495 | E37: 0.596896184660205 | F37: 0.39863737486095663 | G37: 0.60136262513904337 | H37: 0.33933506941670794 | I37: 0.65139871870656463 | J37: 9.2662118767274301E-3 | K37: 0.26845550376013122 | L37: 0.71838809751977517 | M37: 1.3156398720093557E-2
A38: 36 | B38: 0.48697159307893423 | C38: 0.51302840692106577 | D38: 0.45806088937542533 | E38: 0.54193911062457467 | F38: 0.46337848652814417 | G38: 0.53662151347185583 | H38: 0.36234615983798102 | I38: 0.63040972114036453 | J38: 7.2441190216544632E-3 | K38: 0.2847907666109552 | L38: 0.70365172968370593 | M38: 1.1557503705338841E-2
A39: 37 | B39: 0.53933857539315444 | C39: 0.4606614246068455 | D39: 0.51263495904690992 | E39: 0.48736504095309008 | F39: 0.5112482533768048 | G39: 0.48875174662319515 | H39: 0.42480291085506366 | I39: 0.56774856962058695 | J39: 7.4485195243494083E-3 | K39: 0.33597887126679027 | L39: 0.65156264589363599 | M39: 1.245848283957369E-2
A40: 38 | B40: 0.65985494685946267 | C40: 0.34014505314053733 | D40: 0.6569430428762526 | E40: 0.3430569571237474 | F40: 0.64564095278685418 | G40: 0.35435904721314582 | H40: 0.58074581963198768 | I40: 0.40456167354649131 | J40: 1.4692506821521024E-2 | K40: 0.34581456591501059 | L40: 0.64467341094530228 | M40: 9.5120231396871539E-3
A41: 39 | B41: 0.5279037211926203 | C41: 0.4720962788073797 | D41: 0.50180862250262881 | E41: 0.49819137749737119 | F41: 0.5021582127892531 | G41: 0.49784178721074684 | H41: 0.40713947013264923 | I41: 0.58603961238707791 | J41: 6.8209174802728364E-3 | K41: 0.32388768579584604 | L41: 0.66562899891721627 | M41: 1.0483315286937691E-2
A42: 40 | B42: 0.75034429819610327 | C42: 0.24965570180389679 | D42: 0.75580379717740087 | E42: 0.24419620282259918 | F42: 0.7472197868118684 | G42: 0.2527802131881316 | H42: 0.66023660816662399 | I42: 0.32423682400075543 | J42: 1.552656783262063E-2 | K42: 0.42041305575839405 | L42: 0.56984610297460769 | M42: 9.74084126699825E-3