A1: HB 5001 - C. Jones Population Totals
A2: DISTRICT | B2: Total Population | C2: Target | D2: Difference | E2: Deviation
A3: 1 | B3: 80227 | C3: 80010.240000000005 | D3: =B3-C3 -> 216.75999999999476 | E3: =(B3-C3)/C3 -> 2.7091532283867008E-3
A4: 2 | B4: 79235 | C4: 80010.240000000005 | D4: =B4-C4 -> -775.24000000000524 | E4: =(B4-C4)/C4 -> -9.6892597747488974E-3
A5: 3 | B5: 79803 | C5: 80010.240000000005 | D5: =B5-C5 -> -207.24000000000524 | E5: =(B5-C5)/C5 -> -2.5901684584373852E-3
A6: 4 | B6: 80495 | C6: 80010.240000000005 | D6: =B6-C6 -> 484.75999999999476 | E6: =(B6-C6)/C6 -> 6.0587244832660762E-3
A7: 5 | B7: 80559 | C7: 80010.240000000005 | D7: =B7-C7 -> 548.75999999999476 | E7: =(B7-C7)/C7 -> 6.8586220963715982E-3
A8: 6 | B8: 80661 | C8: 80010.240000000005 | D8: =B8-C8 -> 650.75999999999476 | E8: =(B8-C8)/C8 -> 8.1334589172585257E-3
A9: 7 | B9: 80146 | C9: 80010.240000000005 | D9: =B9-C9 -> 135.75999999999476 | E9: =(B9-C9)/C9 -> 1.6967828118000241E-3
A10: 8 | B10: 80685 | C10: 80010.240000000005 | D10: =B10-C10 -> 674.75999999999476 | E10: =(B10-C10)/C10 -> 8.4334205221730952E-3
A11: 9 | B11: 80574 | C11: 80010.240000000005 | D11: =B11-C11 -> 563.75999999999476 | E11: =(B11-C11)/C11 -> 7.0460980994432052E-3
A12: 10 | B12: 80784 | C12: 80010.240000000005 | D12: =B12-C12 -> 773.75999999999476 | E12: =(B12-C12)/C12 -> 9.6707621424457005E-3
A13: 11 | B13: 80132 | C13: 80010.240000000005 | D13: =B13-C13 -> 121.75999999999476 | E13: =(B13-C13)/C13 -> 1.5218052089331911E-3
A14: 12 | B14: 80492 | C14: 80010.240000000005 | D14: =B14-C14 -> 481.75999999999476 | E14: =(B14-C14)/C14 -> 6.0212292826517548E-3
A15: 13 | B15: 80579 | C15: 80010.240000000005 | D15: =B15-C15 -> 568.75999999999476 | E15: =(B15-C15)/C15 -> 7.1085901004670745E-3
A16: 14 | B16: 79416 | C16: 80010.240000000005 | D16: =B16-C16 -> -594.24000000000524 | E16: =(B16-C16)/C16 -> -7.4270493376848417E-3
A17: 15 | B17: 80528 | C17: 80010.240000000005 | D17: =B17-C17 -> 517.75999999999476 | E17: =(B17-C17)/C17 -> 6.4711716900236107E-3
A18: 16 | B18: 79683 | C18: 80010.240000000005 | D18: =B18-C18 -> -327.24000000000524 | E18: =(B18-C18)/C18 -> -4.0899764830102398E-3
A19: 17 | B19: 80631 | C19: 80010.240000000005 | D19: =B19-C19 -> 620.75999999999476 | E19: =(B19-C19)/C19 -> 7.7585069111153109E-3
A20: 18 | B20: 79450 | C20: 80010.240000000005 | D20: =B20-C20 -> -560.24000000000524 | E20: =(B20-C20)/C20 -> -7.0021037307225328E-3
A21: 19 | B21: 80080 | C21: 80010.240000000005 | D21: =B21-C21 -> 69.759999999994761 | E21: =(B21-C21)/C21 -> 8.7188839828495398E-4
A22: 20 | B22: 79334 | C22: 80010.240000000005 | D22: =B22-C22 -> -676.24000000000524 | E22: =(B22-C22)/C22 -> -8.4519181544762921E-3
A23: 21 | B23: 79608 | C23: 80010.240000000005 | D23: =B23-C23 -> -402.24000000000524 | E23: =(B23-C23)/C23 -> -5.0273564983682739E-3
A24: 22 | B24: 79307 | C24: 80010.240000000005 | D24: =B24-C24 -> -703.24000000000524 | E24: =(B24-C24)/C24 -> -8.7893749600051838E-3
A25: 23 | B25: 79731 | C25: 80010.240000000005 | D25: =B25-C25 -> -279.24000000000524 | E25: =(B25-C25)/C25 -> -3.4900532731810979E-3
A26: 24 | B26: 79277 | C26: 80010.240000000005 | D26: =B26-C26 -> -733.24000000000524 | E26: =(B26-C26)/C26 -> -9.1643269661483978E-3
A27: 25 | B27: 80551 | C27: 80010.240000000005 | D27: =B27-C27 -> 540.75999999999476 | E27: =(B27-C27)/C27 -> 6.7586348947334084E-3
A28: 26 | B28: 80790 | C28: 80010.240000000005 | D28: =B28-C28 -> 779.75999999999476 | E28: =(B28-C28)/C28 -> 9.7457525436743433E-3
A29: 27 | B29: 79368 | C29: 80010.240000000005 | D29: =B29-C29 -> -642.24000000000524 | E29: =(B29-C29)/C29 -> -8.0269725475139823E-3
A30: 28 | B30: 79304 | C30: 80010.240000000005 | D30: =B30-C30 -> -706.24000000000524 | E30: =(B30-C30)/C30 -> -8.8268701606195061E-3
A31: 29 | B31: 79474 | C31: 80010.240000000005 | D31: =B31-C31 -> -536.24000000000524 | E31: =(B31-C31)/C31 -> -6.7021421258079616E-3
A32: 30 | B32: 80583 | C32: 80010.240000000005 | D32: =B32-C32 -> 572.75999999999476 | E32: =(B32-C32)/C32 -> 7.1585837012861694E-3
A33: 31 | B33: 80414 | C33: 80010.240000000005 | D33: =B33-C33 -> 403.75999999999476 | E33: =(B33-C33)/C33 -> 5.0463540666793993E-3
A34: 32 | B34: 80268 | C34: 80010.240000000005 | D34: =B34-C34 -> 257.75999999999476 | E34: =(B34-C34)/C34 -> 3.221587636782426E-3
A35: 33 | B35: 80760 | C35: 80010.240000000005 | D35: =B35-C35 -> 749.75999999999476 | E35: =(B35-C35)/C35 -> 9.3708005375311293E-3
A36: 34 | B36: 80722 | C36: 80010.240000000005 | D36: =B36-C36 -> 711.75999999999476 | E36: =(B36-C36)/C36 -> 8.8958613297497255E-3
A37: 35 | B37: 80079 | C37: 80010.240000000005 | D37: =B37-C37 -> 68.759999999994761 | E37: =(B37-C37)/C37 -> 8.5938999808018014E-4
A38: 36 | B38: 79746 | C38: 80010.240000000005 | D38: =B38-C38 -> -264.24000000000524 | E38: =(B38-C38)/C38 -> -3.3025772701094913E-3
A39: 37 | B39: 80389 | C39: 80010.240000000005 | D39: =B39-C39 -> 378.75999999999476 | E39: =(B39-C39)/C39 -> 4.7338940615600546E-3
A40: 38 | B40: 80655 | C40: 80010.240000000005 | D40: =B40-C40 -> 644.75999999999476 | E40: =(B40-C40)/C40 -> 8.0584685160298829E-3
A41: 39 | B41: 80770 | C41: 80010.240000000005 | D41: =B41-C41 -> 759.75999999999476 | E41: =(B41-C41)/C41 -> 9.4957845395788679E-3
A42: 40 | B42: 80729 | C42: 80010.240000000005 | D42: =B42-C42 -> 718.75999999999476 | E42: =(B42-C42)/C42 -> 8.9833501311831418E-3
A43: 41 | B43: 80805 | C43: 80010.240000000005 | D43: =B43-C43 -> 794.75999999999476 | E43: =(B43-C43)/C43 -> 9.9332285467459511E-3
A44: 42 | B44: 79964 | C44: 80010.240000000005 | D44: =B44-C44 -> -46.240000000005239 | E44: =(B44-C44)/C44 -> -5.7792602546880543E-4
A45: 43 | B45: 80436 | C45: 80010.240000000005 | D45: =B45-C45 -> 425.75999999999476 | E45: =(B45-C45)/C45 -> 5.3213188711844226E-3
A46: 44 | B46: 80365 | C46: 80010.240000000005 | D46: =B46-C46 -> 354.75999999999476 | E46: =(B46-C46)/C46 -> 4.4339324566454834E-3
A47: 45 | B47: 80697 | C47: 80010.240000000005 | D47: =B47-C47 -> 686.75999999999476 | E47: =(B47-C47)/C47 -> 8.5834013246303808E-3
A48: 46 | B48: 80333 | C48: 80010.240000000005 | D48: =B48-C48 -> 322.75999999999476 | E48: =(B48-C48)/C48 -> 4.0339836500927224E-3
A49: 47 | B49: 79451 | C49: 80010.240000000005 | D49: =B49-C49 -> -559.24000000000524 | E49: =(B49-C49)/C49 -> -6.9896053305177584E-3
A50: 48 | B50: 80667 | C50: 80010.240000000005 | D50: =B50-C50 -> 656.75999999999476 | E50: =(B50-C50)/C50 -> 8.2084493184871668E-3
A51: 49 | B51: 80798 | C51: 80010.240000000005 | D51: =B51-C51 -> 787.75999999999476 | E51: =(B51-C51)/C51 -> 9.8457397453125331E-3
A52: 50 | B52: 80677 | C52: 80010.240000000005 | D52: =B52-C52 -> 666.75999999999476 | E52: =(B52-C52)/C52 -> 8.3334333205349054E-3
A53: 51 | B53: 79361 | C53: 80010.240000000005 | D53: =B53-C53 -> -649.24000000000524 | E53: =(B53-C53)/C53 -> -8.1144613489474004E-3
A54: 52 | B54: 79353 | C54: 80010.240000000005 | D54: =B54-C54 -> -657.24000000000524 | E54: =(B54-C54)/C54 -> -8.2144485505855902E-3
A55: 53 | B55: 80309 | C55: 80010.240000000005 | D55: =B55-C55 -> 298.75999999999476 | E55: =(B55-C55)/C55 -> 3.7340220451781516E-3
A56: 54 | B56: 80209 | C56: 80010.240000000005 | D56: =B56-C56 -> 198.75999999999476 | E56: =(B56-C56)/C56 -> 2.4841820247007728E-3
A57: 55 | B57: 79578 | C57: 80010.240000000005 | D57: =B57-C57 -> -432.24000000000524 | E57: =(B57-C57)/C57 -> -5.4023085045114879E-3
A58: 56 | B58: 79271 | C58: 80010.240000000005 | D58: =B58-C58 -> -739.24000000000524 | E58: =(B58-C58)/C58 -> -9.2393173673770406E-3
A59: 57 | B59: 80698 | C59: 80010.240000000005 | D59: =B59-C59 -> 687.75999999999476 | E59: =(B59-C59)/C59 -> 8.5958997248351543E-3
A60: 58 | B60: 80307 | C60: 80010.240000000005 | D60: =B60-C60 -> 296.75999999999476 | E60: =(B60-C60)/C60 -> 3.7090252447686037E-3
A61: 59 | B61: 79345 | C61: 80010.240000000005 | D61: =B61-C61 -> -665.24000000000524 | E61: =(B61-C61)/C61 -> -8.31443575222378E-3
A62: 60 | B62: 79219 | C62: 80010.240000000005 | D62: =B62-C62 -> -791.24000000000524 | E62: =(B62-C62)/C62 -> -9.889234178025277E-3
A63: 61 | B63: 79223 | C63: 80010.240000000005 | D63: =B63-C63 -> -787.24000000000524 | E63: =(B63-C63)/C63 -> -9.839240577206183E-3
A64: 62 | B64: 79249 | C64: 80010.240000000005 | D64: =B64-C64 -> -761.24000000000524 | E64: =(B64-C64)/C64 -> -9.5142821718820648E-3
A65: 63 | B65: 79628 | C65: 80010.240000000005 | D65: =B65-C65 -> -382.24000000000524 | E65: =(B65-C65)/C65 -> -4.7773884942727985E-3
A66: 64 | B66: 79358 | C66: 80010.240000000005 | D66: =B66-C66 -> -652.24000000000524 | E66: =(B66-C66)/C66 -> -8.1519565495617209E-3
A67: 65 | B67: 79263 | C67: 80010.240000000005 | D67: =B67-C67 -> -747.24000000000524 | E67: =(B67-C67)/C67 -> -9.3393045690152304E-3
A68: 66 | B68: 79334 | C68: 80010.240000000005 | D68: =B68-C68 -> -676.24000000000524 | E68: =(B68-C68)/C68 -> -8.4519181544762921E-3
A69: 67 | B69: 79633 | C69: 80010.240000000005 | D69: =B69-C69 -> -377.24000000000524 | E69: =(B69-C69)/C69 -> -4.7148964932489292E-3
A70: 68 | B70: 79666 | C70: 80010.240000000005 | D70: =B70-C70 -> -344.24000000000524 | E70: =(B70-C70)/C70 -> -4.3024492864913947E-3
A71: 69 | B71: 79306 | C71: 80010.240000000005 | D71: =B71-C71 -> -704.24000000000524 | E71: =(B71-C71)/C71 -> -8.8018733602099573E-3
A72: 70 | B72: 79769 | C72: 80010.240000000005 | D72: =B72-C72 -> -241.24000000000524 | E72: =(B72-C72)/C72 -> -3.0151140653996941E-3
A73: 71 | B73: 80310 | C73: 80010.240000000005 | D73: =B73-C73 -> 299.75999999999476 | E73: =(B73-C73)/C73 -> 3.7465204453829251E-3
A74: 72 | B74: 80509 | C74: 80010.240000000005 | D74: =B74-C74 -> 498.75999999999476 | E74: =(B74-C74)/C74 -> 6.2337020861329088E-3
A75: 73 | B75: 80644 | C75: 80010.240000000005 | D75: =B75-C75 -> 633.75999999999476 | E75: =(B75-C75)/C75 -> 7.9209861137773709E-3
A76: 74 | B76: 79595 | C76: 80010.240000000005 | D76: =B76-C76 -> -415.24000000000524 | E76: =(B76-C76)/C76 -> -5.189835701030333E-3
A77: 75 | B77: 79742 | C77: 80010.240000000005 | D77: =B77-C77 -> -268.24000000000524 | E77: =(B77-C77)/C77 -> -3.3525708709285862E-3
A78: 76 | B78: 80313 | C78: 80010.240000000005 | D78: =B78-C78 -> 302.75999999999476 | E78: =(B78-C78)/C78 -> 3.7840156459972465E-3
A79: 77 | B79: 79627 | C79: 80010.240000000005 | D79: =B79-C79 -> -383.24000000000524 | E79: =(B79-C79)/C79 -> -4.789886894477572E-3
A80: 78 | B80: 80543 | C80: 80010.240000000005 | D80: =B80-C80 -> 532.75999999999476 | E80: =(B80-C80)/C80 -> 6.6586476930952177E-3
A81: 79 | B81: 80278 | C81: 80010.240000000005 | D81: =B81-C81 -> 267.75999999999476 | E81: =(B81-C81)/C81 -> 3.3465716388301641E-3
A82: 80 | B82: 80705 | C82: 80010.240000000005 | D82: =B82-C82 -> 694.75999999999476 | E82: =(B82-C82)/C82 -> 8.6833885262685723E-3
A83: 81 | B83: 79370 | C83: 80010.240000000005 | D83: =B83-C83 -> -640.24000000000524 | E83: =(B83-C83)/C83 -> -8.0019757471044353E-3
A84: 82 | B84: 80463 | C84: 80010.240000000005 | D84: =B84-C84 -> 452.75999999999476 | E84: =(B84-C84)/C84 -> 5.6587756767133152E-3
A85: 83 | B85: 79538 | C85: 80010.240000000005 | D85: =B85-C85 -> -472.24000000000524 | E85: =(B85-C85)/C85 -> -5.9022445127024396E-3
A86: 84 | B86: 80281 | C86: 80010.240000000005 | D86: =B86-C86 -> 270.75999999999476 | E86: =(B86-C86)/C86 -> 3.3840668394444855E-3
A87: 85 | B87: 79836 | C87: 80010.240000000005 | D87: =B87-C87 -> -174.24000000000524 | E87: =(B87-C87)/C87 -> -2.1777212516798502E-3
A88: 86 | B88: 80747 | C88: 80010.240000000005 | D88: =B88-C88 -> 736.75999999999476 | E88: =(B88-C88)/C88 -> 9.2083213348690702E-3
A89: 87 | B89: 79275 | C89: 80010.240000000005 | D89: =B89-C89 -> -735.24000000000524 | E89: =(B89-C89)/C89 -> -9.1893237665579448E-3
A90: 88 | B90: 80137 | C90: 80010.240000000005 | D90: =B90-C90 -> 126.75999999999476 | E90: =(B90-C90)/C90 -> 1.5842972099570599E-3
A91: 89 | B91: 80784 | C91: 80010.240000000005 | D91: =B91-C91 -> 773.75999999999476 | E91: =(B91-C91)/C91 -> 9.6707621424457005E-3
A92: 90 | B92: 80758 | C92: 80010.240000000005 | D92: =B92-C92 -> 747.75999999999476 | E92: =(B92-C92)/C92 -> 9.3458037371215823E-3
A93: 91 | B93: 79347 | C93: 80010.240000000005 | D93: =B93-C93 -> -663.24000000000524 | E93: =(B93-C93)/C93 -> -8.289438951814233E-3
A94: 92 | B94: 79376 | C94: 80010.240000000005 | D94: =B94-C94 -> -634.24000000000524 | E94: =(B94-C94)/C94 -> -7.9269853458757925E-3
A95: 93 | B95: 79453 | C95: 80010.240000000005 | D95: =B95-C95 -> -557.24000000000524 | E95: =(B95-C95)/C95 -> -6.9646085301082114E-3
A96: 94 | B96: 79429 | C96: 80010.240000000005 | D96: =B96-C96 -> -581.24000000000524 | E96: =(B96-C96)/C96 -> -7.2645701350227817E-3
A97: 95 | B97: 79969 | C97: 80010.240000000005 | D97: =B97-C97 -> -41.240000000005239 | E97: =(B97-C97)/C97 -> -5.1543402444493647E-4
A98: 96 | B98: 79272 | C98: 80010.240000000005 | D98: =B98-C98 -> -738.24000000000524 | E98: =(B98-C98)/C98 -> -9.2268189671722671E-3
A99: 97 | B99: 79386 | C99: 80010.240000000005 | D99: =B99-C99 -> -624.24000000000524 | E99: =(B99-C99)/C99 -> -7.8020013438280548E-3
A100: 98 | B100: 79251 | C100: 80010.240000000005 | D100: =B100-C100 -> -759.24000000000524 | E100: =(B100-C100)/C100 -> -9.489285371472516E-3
A101: 99 | B101: 80332 | C101: 80010.240000000005 | D101: =B101-C101 -> 321.75999999999476 | E101: =(B101-C101)/C101 -> 4.0214852498879489E-3
A102: 100 | B102: 79463 | C102: 80010.240000000005 | D102: =B102-C102 -> -547.24000000000524 | E102: =(B102-C102)/C102 -> -6.8396245280604737E-3

A1: HB 5001 - C. Jones Racial Demographics
A2: DISTRICT | B2: Total Persons | C2: White | D2: % White | E2: Black | F2: % Black | G2: AIAN | H2: % AIAN | I2: Asian | J2: % Asian | K2: HawPI | L2: % HawPI | M2: Other | N2: % Other | O2: Multi | P2: % Multi | Q2: Total Hispanic | R2: % Hispanic
A3: 1 | B3: 80227 | C3: 75960 | D3: =C3/B3 -> 0.94681341692946264 | E3: 2866 | F3: =E3/B3 -> 3.5723634187991571E-2 | G3: 463 | H3: =G3/B3 -> 5.7711244344173405E-3 | I3: 358 | J3: =I3/B3 -> 4.4623381155969935E-3 | K3: 36 | L3: =K3/B3 -> 4.4872673788126194E-4 | M3: 446 | N3: =M3/B3 -> 5.559225697084523E-3 | O3: 98 | P3: =O3/B3 -> 1.2215338975656573E-3 | Q3: 1029 | R3: =Q3/B3 -> 1.2826105924439403E-2
A4: 2 | B4: 79235 | C4: 45202 | D4: =C4/B4 -> 0.57048021707578722 | E4: 20219 | F4: =E4/B4 -> 0.25517763614564271 | G4: 694 | H4: =G4/B4 -> 8.758755600429104E-3 | I4: 5578 | J4: =I4/B4 -> 7.0398182621316335E-2 | K4: 183 | L4: =K4/B4 -> 2.3095854104877894E-3 | M4: 6204 | N4: =M4/B4 -> 7.8298731621127021E-2 | O4: 1155 | P4: =O4/B4 -> 1.4576891525209818E-2 | Q4: 14000 | R4: =Q4/B4 -> 0.1766895942449675
A5: 3 | B5: 79803 | C5: 76412 | D5: =C5/B5 -> 0.95750786311291558 | E5: 2398 | F5: =E5/B5 -> 3.0048995651792539E-2 | G5: 315 | H5: =G5/B5 -> 3.9472200293222057E-3 | I5: 416 | J5: =I5/B5 -> 5.2128366101525008E-3 | K5: 23 | L5: =K5/B5 -> 2.8820971642670072E-4 | M5: 169 | N5: =M5/B5 -> 2.1177148728744534E-3 | O5: 70 | P5: =O5/B5 -> 8.7716000651604572E-4 | Q5: 452 | R5: =Q5/B5 -> 5.663947470646467E-3
A6: 4 | B6: 80495 | C6: 76718 | D6: =C6/B6 -> 0.95307783092117526 | E6: 2566 | F6: =E6/B6 -> 3.1877756382384E-2 | G6: 377 | H6: =G6/B6 -> 4.6835207155723957E-3 | I6: 334 | J6: =I6/B6 -> 4.1493260450959687E-3 | K6: 13 | L6: =K6/B6 -> 1.615007143300826E-4 | M6: 399 | N6: =M6/B6 -> 4.9568296167463817E-3 | O6: 88 | P6: =O6/B6 -> 1.0932356046959438E-3 | Q6: 873 | R6: =Q6/B6 -> 1.0845394123858624E-2
A7: 5 | B7: 80559 | C7: 77135 | D7: =C7/B7 -> 0.95749698978388509 | E7: 1646 | F7: =E7/B7 -> 2.0432229794312244E-2 | G7: 362 | H7: =G7/B7 -> 4.4936009632691567E-3 | I7: 286 | J7: =I7/B7 -> 3.5501930262292233E-3 | K7: 34 | L7: =K7/B7 -> 4.220509192020755E-4 | M7: 1004 | N7: =M7/B7 -> 1.24629153787907E-2 | O7: 92 | P7: =O7/B7 -> 1.1420201343114984E-3 | Q7: 2202 | R7: =Q7/B7 -> 2.7334003649499124E-2
A8: 6 | B8: 80661 | C8: 77390 | D8: =C8/B8 -> 0.95944756449833257 | E8: 1815 | F8: =E8/B8 -> 2.2501580689552571E-2 | G8: 368 | H8: =G8/B8 -> 4.5623039635015687E-3 | I8: 305 | J8: =I8/B8 -> 3.781257361054289E-3 | K8: 15 | L8: =K8/B8 -> 1.8596347677316176E-4 | M8: 689 | N8: =M8/B8 -> 8.5419223664472306E-3 | O8: 79 | P8: =O8/B8 -> 9.7940764433865194E-4 | Q8: 1347 | R8: =Q8/B8 -> 1.6699520214229924E-2
A9: 7 | B9: 80146 | C9: 74108 | D9: =C9/B9 -> 0.92466249095400899 | E9: 3612 | F9: =E9/B9 -> 4.5067751353779356E-2 | G9: 408 | H9: =G9/B9 -> 5.0907094552441797E-3 | I9: 1303 | J9: =I9/B9 -> 1.6257829461233251E-2 | K9: 32 | L9: =K9/B9 -> 3.9927132982307291E-4 | M9: 518 | N9: =M9/B9 -> 6.463204651510992E-3 | O9: 165 | P9: =O9/B9 -> 2.0587427944002198E-3 | Q9: 1636 | R9: =Q9/B9 -> 2.0412746737204602E-2
A10: 8 | B10: 80685 | C10: 74011 | D10: =C10/B10 -> 0.91728326206853816 | E10: 3652 | F10: =E10/B10 -> 4.5262440354464896E-2 | G10: 438 | H10: =G10/B10 -> 5.4285183119538944E-3 | I10: 1722 | J10: =I10/B10 -> 2.134225692507901E-2 | K10: 32 | L10: =K10/B10 -> 3.9660407758567269E-4 | M10: 675 | N10: =M10/B10 -> 8.3658672615727833E-3 | O10: 155 | P10: =O10/B10 -> 1.9210510008056021E-3 | Q10: 1558 | R10: =Q10/B10 -> 1.9309661027452438E-2
A11: 9 | B11: 80574 | C11: 69709 | D11: =C11/B11 -> 0.86515501278328 | E11: 8389 | F11: =E11/B11 -> 0.10411547149204459 | G11: 428 | H11: =G11/B11 -> 5.3118872092734627E-3 | I11: 362 | J11: =I11/B11 -> 4.4927644153200785E-3 | K11: 28 | L11: =K11/B11 -> 3.4750663985901162E-4 | M11: 1557 | N11: =M11/B11 -> 1.9323851366445752E-2 | O11: 101 | P11: =O11/B11 -> 1.253506093777149E-3 | Q11: 2349 | R11: =Q11/B11 -> 2.9153324893886366E-2
A12: 10 | B12: 80784 | C12: 61035 | D12: =C12/B12 -> 0.75553327391562686 | E12: 7340 | F12: =E12/B12 -> 9.0859576153693805E-2 | G12: 480 | H12: =G12/B12 -> 5.9417706476530005E-3 | I12: 6847 | J12: =I12/B12 -> 8.4756882551000196E-2 | K12: 66 | L12: =K12/B12 -> 8.1699346405228761E-4 | M12: 4435 | N12: =M12/B12 -> 5.4899485046543871E-2 | O12: 581 | P12: =O12/B12 -> 7.192018221429986E-3 | Q12: 9821 | R12: =Q12/B12 -> 0.12157110318875025
A13: 11 | B13: 80132 | C13: 47632 | D13: =C13/B13 -> 0.59441920830629458 | E13: 27648 | F13: =E13/B13 -> 0.345030699346079 | G13: 420 | H13: =G13/B13 -> 5.241351769580193E-3 | I13: 1596 | J13: =I13/B13 -> 1.9917136724404733E-2 | K13: 56 | L13: =K13/B13 -> 6.9884690261069239E-4 | M13: 2261 | N13: =M13/B13 -> 2.8215943692906705E-2 | O13: 519 | P13: =O13/B13 -> 6.4768132581240956E-3 | Q13: 4734 | R13: =Q13/B13 -> 5.9077522088553887E-2
A14: 12 | B14: 80492 | C14: 70200 | D14: =C14/B14 -> 0.87213636137752815 | E14: 3863 | F14: =E14/B14 -> 4.7992347065546885E-2 | G14: 424 | H14: =G14/B14 -> 5.267604233961139E-3 | I14: 5015 | J14: =I14/B14 -> 6.2304328380460169E-2 | K14: 52 | L14: =K14/B14 -> 6.4602693435372456E-4 | M14: 689 | N14: =M14/B14 -> 8.5598568801868516E-3 | O14: 249 | P14: =O14/B14 -> 3.0934751279630274E-3 | Q14: 1959 | R14: =Q14/B14 -> 2.4337822392287434E-2
A15: 13 | B15: 80579 | C15: 48642 | D15: =C15/B15 -> 0.60365603941473589 | E15: 11369 | F15: =E15/B15 -> 0.14109135134464315 | G15: 634 | H15: =G15/B15 -> 7.8680549522828526E-3 | I15: 8593 | J15: =I15/B15 -> 0.10664068802045198 | K15: 94 | L15: =K15/B15 -> 1.1665570433984042E-3 | M15: 10388 | N15: =M15/B15 -> 0.1289169634768364 | O15: 859 | P15: =O15/B15 -> 1.0660345747651373E-2 | Q15: 20063 | R15: =Q15/B15 -> 0.24898546767768276
A16: 14 | B16: 79416 | C16: 47704 | D16: =C16/B16 -> 0.60068500050367679 | E16: 29126 | F16: =E16/B16 -> 0.36675229172962626 | G16: 346 | H16: =G16/B16 -> 4.3568046741210842E-3 | I16: 615 | J16: =I16/B16 -> 7.744031429434875E-3 | K16: 27 | L16: =K16/B16 -> 3.399818676337262E-4 | M16: 1360 | N16: =M16/B16 -> 1.7125012591921025E-2 | O16: 238 | P16: =O16/B16 -> 2.996877203586179E-3 | Q16: 2369 | R16: =Q16/B16 -> 2.9830260904603605E-2
A17: 15 | B17: 80528 | C17: 75826 | D17: =C17/B17 -> 0.9416103715477846 | E17: 1906 | F17: =E17/B17 -> 2.3668786012318695E-2 | G17: 516 | H17: =G17/B17 -> 6.407709119809259E-3 | I17: 484 | J17: =I17/B17 -> 6.0103318100536455E-3 | K17: 31 | L17: =K17/B17 -> 3.8495926882575006E-4 | M17: 1613 | N17: =M17/B17 -> 2.0030300019868864E-2 | O17: 152 | P17: =O17/B17 -> 1.8875422213391615E-3 | Q17: 3371 | R17: =Q17/B17 -> 4.186121597456785E-2
A18: 16 | B18: 79683 | C18: 54985 | D18: =C18/B18 -> 0.69004681048655292 | E18: 22152 | F18: =E18/B18 -> 0.27800158126576557 | G18: 368 | H18: =G18/B18 -> 4.618300013804701E-3 | I18: 456 | J18: =I18/B18 -> 5.7226761040623467E-3 | K18: 18 | L18: =K18/B18 -> 2.2589510937088213E-4 | M18: 1510 | N18: =M18/B18 -> 1.8950089730557333E-2 | O18: 194 | P18: =O18/B18 -> 2.4346472898861739E-3 | Q18: 2666 | R18: =Q18/B18 -> 3.3457575643487315E-2
A19: 17 | B19: 80631 | C19: 71273 | D19: =C19/B19 -> 0.88394041993774108 | E19: 5839 | F19: =E19/B19 -> 7.2416316305143183E-2 | G19: 410 | H19: =G19/B19 -> 5.0848929071945033E-3 | I19: 2111 | J19: =I19/B19 -> 2.6180997383140479E-2 | K19: 56 | L19: =K19/B19 -> 6.9452195805583456E-4 | M19: 737 | N19: =M19/B19 -> 9.1404050551276809E-3 | O19: 205 | P19: =O19/B19 -> 2.5424464535972516E-3 | Q19: 2059 | R19: =Q19/B19 -> 2.5536084136374346E-2
A20: 18 | B20: 79450 | C20: 69073 | D20: =C20/B20 -> 0.86938955317809941 | E20: 6396 | F20: =E20/B20 -> 8.0503461296412837E-2 | G20: 644 | H20: =G20/B20 -> 8.1057268722466956E-3 | I20: 1288 | J20: =I20/B20 -> 1.6211453744493391E-2 | K20: 63 | L20: =K20/B20 -> 7.9295154185022026E-4 | M20: 1750 | N20: =M20/B20 -> 2.2026431718061675E-2 | O20: 236 | P20: =O20/B20 -> 2.9704216488357455E-3 | Q20: 4292 | R20: =Q20/B20 -> 5.4021397105097547E-2
A21: 19 | B21: 80080 | C21: 73554 | D21: =C21/B21 -> 0.91850649350649349 | E21: 5114 | F21: =E21/B21 -> 6.3861138861138866E-2 | G21: 507 | H21: =G21/B21 -> 6.3311688311688315E-3 | I21: 466 | J21: =I21/B21 -> 5.8191808191808189E-3 | K21: 31 | L21: =K21/B21 -> 3.8711288711288711E-4 | M21: 299 | N21: =M21/B21 -> 3.7337662337662337E-3 | O21: 109 | P21: =O21/B21 -> 1.3611388611388612E-3 | Q21: 1019 | R21: =Q21/B21 -> 1.2724775224775225E-2
A22: 20 | B22: 79334 | C22: 69268 | D22: =C22/B22 -> 0.87311871328812363 | E22: 7495 | F22: =E22/B22 -> 9.44739960168402E-2 | G22: 432 | H22: =G22/B22 -> 5.4453323921647718E-3 | I22: 667 | J22: =I22/B22 -> 8.4074923740136646E-3 | K22: 42 | L22: =K22/B22 -> 5.2940731590490832E-4 | M22: 1200 | N22: =M22/B22 -> 1.512592331156881E-2 | O22: 230 | P22: =O22/B22 -> 2.8991353013840221E-3 | Q22: 2580 | R22: =Q22/B22 -> 3.252073511987294E-2
A23: 21 | B23: 79608 | C23: 45487 | D23: =C23/B23 -> 0.5713872977590192 | E23: 20209 | F23: =E23/B23 -> 0.25385639634207618 | G23: 516 | H23: =G23/B23 -> 6.4817606270726564E-3 | I23: 10340 | J23: =I23/B23 -> 0.1298864435735102 | K23: 136 | L23: =K23/B23 -> 1.708371017988142E-3 | M23: 1798 | N23: =M23/B23 -> 2.2585669781931463E-2 | O23: 1122 | P23: =O23/B23 -> 1.4094060898402171E-2 | Q23: 5567 | R23: =Q23/B23 -> 6.9930157773088128E-2
A24: 22 | B24: 79307 | C24: 59135 | D24: =C24/B24 -> 0.74564666422888271 | E24: 17584 | F24: =E24/B24 -> 0.22172065517545739 | G24: 425 | H24: =G24/B24 -> 5.3589216588699612E-3 | I24: 1165 | J24: =I24/B24 -> 1.4689749959020011E-2 | K24: 40 | L24: =K24/B24 -> 5.0436909730540815E-4 | M24: 659 | N24: =M24/B24 -> 8.3094808781065989E-3 | O24: 299 | P24: =O24/B24 -> 3.7701590023579254E-3 | Q24: 1773 | R24: =Q24/B24 -> 2.2356160238062212E-2
A25: 23 | B25: 79731 | C25: 62608 | D25: =C25/B25 -> 0.78524037074663555 | E25: 13008 | F25: =E25/B25 -> 0.16314858712420513 | G25: 524 | H25: =G25/B25 -> 6.5720986818176121E-3 | I25: 2183 | J25: =I25/B25 -> 2.7379563783221081E-2 | K25: 46 | L25: =K25/B25 -> 5.7693996061757664E-4 | M25: 1024 | N25: =M25/B25 -> 1.2843185210269531E-2 | O25: 338 | P25: =O25/B25 -> 4.2392544932334979E-3 | Q25: 2088 | R25: =Q25/B25 -> 2.6188057342815218E-2
A26: 24 | B26: 79277 | C26: 70159 | D26: =C26/B26 -> 0.88498555697112657 | E26: 6994 | F26: =E26/B26 -> 8.8222309118659886E-2 | G26: 792 | H26: =G26/B26 -> 9.9902872207575967E-3 | I26: 592 | J26: =I26/B26 -> 7.4674874175359816E-3 | K26: 47 | L26: =K26/B26 -> 5.9285795375707963E-4 | M26: 510 | N26: =M26/B26 -> 6.4331394982151194E-3 | O26: 183 | P26: =O26/B26 -> 2.3083618199477782E-3 | Q26: 1423 | R26: =Q26/B26 -> 1.7949720599921792E-2
A27: 25 | B27: 80551 | C27: 73998 | D27: =C27/B27 -> 0.91864781318667676 | E27: 3213 | F27: =E27/B27 -> 3.9887772963712431E-2 | G27: 363 | H27: =G27/B27 -> 4.5064617447331508E-3 | I27: 1402 | J27: =I27/B27 -> 1.7405122220704894E-2 | K27: 17 | L27: =K27/B27 -> 2.1104641779742028E-4 | M27: 1421 | N27: =M27/B27 -> 1.7640997628831423E-2 | O27: 137 | P27: =O27/B27 -> 1.7007858375439162E-3 | Q27: 2924 | R27: =Q27/B27 -> 3.6299983861156286E-2
A28: 26 | B28: 80790 | C28: 67893 | D28: =C28/B28 -> 0.84036390642406233 | E28: 4083 | F28: =E28/B28 -> 5.0538432974378017E-2 | G28: 509 | H28: =G28/B28 -> 6.3002846886990966E-3 | I28: 2339 | J28: =I28/B28 -> 2.8951602921153608E-2 | K28: 78 | L28: =K28/B28 -> 9.6546602302265128E-4 | M28: 5556 | N28: =M28/B28 -> 6.8770887486075002E-2 | O28: 332 | P28: =O28/B28 -> 4.1094194826092334E-3 | Q28: 9921 | R28: =Q28/B28 -> 0.12279985146676568
A29: 27 | B29: 79368 | C29: 57420 | D29: =C29/B29 -> 0.72346537647414577 | E29: 15462 | F29: =E29/B29 -> 0.19481403084366494 | G29: 615 | H29: =G29/B29 -> 7.7487148472936192E-3 | I29: 3042 | J29: =I29/B29 -> 3.8327789537345024E-2 | K29: 70 | L29: =K29/B29 -> 8.8196754359439573E-4 | M29: 2147 | N29: =M29/B29 -> 2.7051204515673822E-2 | O29: 612 | P29: =O29/B29 -> 7.7109162382824311E-3 | Q29: 4894 | R29: =Q29/B29 -> 6.1662130833585321E-2
A30: 28 | B30: 79304 | C30: 56206 | D30: =C30/B30 -> 0.70874104710985575 | E30: 15873 | F30: =E30/B30 -> 0.20015383839402803 | G30: 772 | H30: =G30/B30 -> 9.7346918188237659E-3 | I30: 2555 | J30: =I30/B30 -> 3.2217794814889539E-2 | K30: 119 | L30: =K30/B30 -> 1.5005548269948553E-3 | M30: 3012 | N30: =M30/B30 -> 3.7980429738726923E-2 | O30: 767 | P30: =O30/B30 -> 9.6716432966811264E-3 | Q30: 7076 | R30: =Q30/B30 -> 8.9226268536265516E-2
A31: 29 | B31: 79474 | C31: 68209 | D31: =C31/B31 -> 0.85825553011047639 | E31: 5522 | F31: =E31/B31 -> 6.9481843118504166E-2 | G31: 537 | H31: =G31/B31 -> 6.7569267936683696E-3 | I31: 1284 | J31: =I31/B31 -> 1.6156227193799229E-2 | K31: 39 | L31: =K31/B31 -> 4.9072652691446261E-4 | M31: 3593 | N31: =M31/B31 -> 4.5209754133427281E-2 | O31: 290 | P31: =O31/B31 -> 3.6489921232101064E-3 | Q31: 6575 | R31: =Q31/B31 -> 8.2731459345194658E-2
A32: 30 | B32: 80583 | C32: 62914 | D32: =C32/B32 -> 0.78073539083925891 | E32: 12893 | F32: =E32/B32 -> 0.15999652532171799 | G32: 607 | H32: =G32/B32 -> 7.5326061328071679E-3 | I32: 1060 | J32: =I32/B32 -> 1.3154139210503455E-2 | K32: 83 | L32: =K32/B32 -> 1.0299939193130065E-3 | M32: 2667 | N32: =M32/B32 -> 3.3096310636238413E-2 | O32: 359 | P32: =O32/B32 -> 4.4550339401610763E-3 | Q32: 5030 | R32: =Q32/B32 -> 6.2420113423426779E-2
A33: 31 | B33: 80414 | C33: 49716 | D33: =C33/B33 -> 0.61825055338622625 | E33: 18000 | F33: =E33/B33 -> 0.2238416196184744 | G33: 796 | H33: =G33/B33 -> 9.8987738453503119E-3 | I33: 5587 | J33: =I33/B33 -> 6.9477951600467575E-2 | K33: 196 | L33: =K33/B33 -> 2.4373865247344991E-3 | M33: 5160 | N33: =M33/B33 -> 6.4167930957295991E-2 | O33: 959 | P33: =O33/B33 -> 1.1925784067450941E-2 | Q33: 12054 | R33: =Q33/B33 -> 0.1498992712711717
A34: 32 | B34: 80268 | C34: 55738 | D34: =C34/B34 -> 0.69439876414013058 | E34: 6514 | F34: =E34/B34 -> 8.1153136991079886E-2 | G34: 379 | H34: =G34/B34 -> 4.7216823640803306E-3 | I34: 14332 | J34: =I34/B34 -> 0.17855185129815118 | K34: 76 | L34: =K34/B34 -> 9.4682812577864155E-4 | M34: 2533 | N34: =M34/B34 -> 3.1556784771017095E-2 | O34: 696 | P34: =O34/B34 -> 8.6709523097622965E-3 | Q34: 7420 | R34: =Q34/B34 -> 9.2440324911546315E-2
A35: 33 | B35: 80760 | C35: 70605 | D35: =C35/B35 -> 0.87425705794947994 | E35: 4462 | F35: =E35/B35 -> 5.5250123823675085E-2 | G35: 478 | H35: =G35/B35 -> 5.91877166914314E-3 | I35: 2804 | J35: =I35/B35 -> 3.4720158494304112E-2 | K35: 75 | L35: =K35/B35 -> 9.2867756315007425E-4 | M35: 1984 | N35: =M35/B35 -> 2.4566617137196631E-2 | O35: 352 | P35: =O35/B35 -> 4.3585933630510155E-3 | Q35: 5091 | R35: =Q35/B35 -> 6.3038632986627041E-2
A36: 34 | B36: 80722 | C36: 61693 | D36: =C36/B36 -> 0.7642650083000917 | E36: 2920 | F36: =E36/B36 -> 3.6173533856941109E-2 | G36: 286 | H36: =G36/B36 -> 3.5430242065360123E-3 | I36: 13316 | J36: =I36/B36 -> 0.16496122494487253 | K36: 79 | L36: =K36/B36 -> 9.7866752558162587E-4 | M36: 1987 | N36: =M36/B36 -> 2.4615346497856842E-2 | O36: 441 | P36: =O36/B36 -> 5.4631946681202147E-3 | Q36: 5819 | R36: =Q36/B36 -> 7.2086915586828865E-2
A37: 35 | B37: 80079 | C37: 52985 | D37: =C37/B37 -> 0.66165911162726809 | E37: 4126 | F37: =E37/B37 -> 5.152411993156758E-2 | G37: 370 | H37: =G37/B37 -> 4.6204373181483287E-3 | I37: 18645 | J37: =I37/B37 -> 0.23283257782939348 | K37: 84 | L37: =K37/B37 -> 1.0489641479039448E-3 | M37: 3338 | N37: =M37/B37 -> 4.1683837210754381E-2 | O37: 531 | P37: =O37/B37 -> 6.6309519349642227E-3 | Q37: 8559 | R37: =Q37/B37 -> 0.10688195407035553
A38: 36 | B38: 79746 | C38: 53210 | D38: =C38/B38 -> 0.66724349810648809 | E38: 7677 | F38: =E38/B38 -> 9.6268151380633507E-2 | G38: 453 | H38: =G38/B38 -> 5.6805357008501995E-3 | I38: 14093 | J38: =I38/B38 -> 0.17672359742181426 | K38: 55 | L38: =K38/B38 -> 6.8968976500388733E-4 | M38: 3598 | N38: =M38/B38 -> 4.5118250445163391E-2 | O38: 660 | P38: =O38/B38 -> 8.276277180046648E-3 | Q38: 8819 | R38: =Q38/B38 -> 0.11058861886489604
A39: 37 | B39: 80389 | C39: 48172 | D39: =C39/B39 -> 0.59923621390986326 | E39: 6822 | F39: =E39/B39 -> 8.4862356790108104E-2 | G39: 493 | H39: =G39/B39 -> 6.1326798442572989E-3 | I39: 20182 | J39: =I39/B39 -> 0.25105424871562032 | K39: 75 | L39: =K39/B39 -> 9.3296346515070472E-4 | M39: 3926 | N39: =M39/B39 -> 4.8837527522422222E-2 | O39: 719 | P39: =O39/B39 -> 8.9440097525780894E-3 | Q39: 10033 | R39: =Q39/B39 -> 0.12480563261142694
A40: 38 | B40: 80655 | C40: 42460 | D40: =C40/B40 -> 0.52643977434752964 | E40: 8198 | F40: =E40/B40 -> 0.10164279957845143 | G40: 779 | H40: =G40/B40 -> 9.6584216725559488E-3 | I40: 16460 | J40: =I40/B40 -> 0.20407910234951335 | K40: 90 | L40: =K40/B40 -> 1.1158638646085177E-3 | M40: 11924 | N40: =M40/B40 -> 0.14783956357324407 | O40: 744 | P40: =O40/B40 -> 9.2244746140970803E-3 | Q40: 25515 | R40: =Q40/B40 -> 0.31634740561651481
A41: 39 | B41: 80770 | C41: 45121 | D41: =C41/B41 -> 0.55863563204159961 | E41: 9851 | F41: =E41/B41 -> 0.12196360034666337 | G41: 610 | H41: =G41/B41 -> 7.5523090256283277E-3 | I41: 16584 | J41: =I41/B41 -> 0.20532375882134457 | K41: 126 | L41: =K41/B41 -> 1.5599851429986382E-3 | M41: 7668 | N41: =M41/B41 -> 9.4936238702488546E-2 | O41: 810 | P41: =O41/B41 -> 1.0028475919276959E-2 | Q41: 15881 | R41: =Q41/B41 -> 0.19662003219016963
A42: 40 | B42: 80729 | C42: 55837 | D42: =C42/B42 -> 0.69165975052335593 | E42: 5581 | F42: =E42/B42 -> 6.9132529821997052E-2 | G42: 453 | H42: =G42/B42 -> 5.6113664234661645E-3 | I42: 15153 | J42: =I42/B42 -> 0.18770206493329536 | K42: 125 | L42: =K42/B42 -> 1.5483902934509285E-3 | M42: 2995 | N42: =M42/B42 -> 3.7099431431084247E-2 | O42: 585 | P42: =O42/B42 -> 7.2464665733503447E-3 | Q42: 7868 | R42: =Q42/B42 -> 9.7461878630975232E-2
A43: 41 | B43: 80805 | C43: 54334 | D43: =C43/B43 -> 0.67240888558876311 | E43: 5120 | F43: =E43/B43 -> 6.3362415692098259E-2 | G43: 414 | H43: =G43/B43 -> 5.1234453313532581E-3 | I43: 16887 | J43: =I43/B43 -> 0.2089845925375905 | K43: 105 | L43: =K43/B43 -> 1.2994245405606088E-3 | M43: 3405 | N43: =M43/B43 -> 4.2138481529608314E-2 | O43: 540 | P43: =O43/B43 -> 6.6827547800259882E-3 | Q43: 9942 | R43: =Q43/B43 -> 0.12303694078336737
A44: 42 | B44: 79964 | C44: 55174 | D44: =C44/B44 -> 0.68998549347206239 | E44: 8666 | F44: =E44/B44 -> 0.10837376819568806 | G44: 492 | H44: =G44/B44 -> 6.1527687459356712E-3 | I44: 12522 | J44: =I44/B44 -> 0.15659546796058227 | K44: 145 | L44: =K44/B44 -> 1.8133159921964884E-3 | M44: 2280 | N44: =M44/B44 -> 2.8512830773848231E-2 | O44: 685 | P44: =O44/B44 -> 8.5663548596868599E-3 | Q44: 7461 | R44: =Q44/B44 -> 9.3304487019158625E-2
A45: 43 | B45: 80436 | C45: 49100 | D45: =C45/B45 -> 0.61042319359490771 | E45: 13136 | F45: =E45/B45 -> 0.16330996071410811 | G45: 550 | H45: =G45/B45 -> 6.8377343478044656E-3 | I45: 11578 | J45: =I45/B45 -> 0.14394052414341837 | K45: 102 | L45: =K45/B45 -> 1.2680889154110099E-3 | M45: 5221 | N45: =M45/B45 -> 6.4908747327067487E-2 | O45: 749 | P45: =O45/B45 -> 9.3117509572828092E-3 | Q45: 12409 | R45: =Q45/B45 -> 0.15427171913073748
A46: 44 | B46: 80365 | C46: 44722 | D46: =C46/B46 -> 0.55648603247682449 | E46: 18120 | F46: =E46/B46 -> 0.22547128725191315 | G46: 645 | H46: =G46/B46 -> 8.025881913768431E-3 | I46: 6067 | J46: =I46/B46 -> 7.5493062900516397E-2 | K46: 110 | L46: =K46/B46 -> 1.3687550550612829E-3 | M46: 9821 | N46: =M46/B46 -> 0.12220493996142599 | O46: 880 | P46: =O46/B46 -> 1.0950040440490263E-2 | Q46: 19110 | R46: =Q46/B46 -> 0.23779008274746469
A47: 45 | B47: 80697 | C47: 59102 | D47: =C47/B47 -> 0.73239401712579155 | E47: 10624 | F47: =E47/B47 -> 0.13165297346865434 | G47: 598 | H47: =G47/B47 -> 7.4104365713719223E-3 | I47: 4034 | J47: =I47/B47 -> 4.9989466770759758E-2 | K47: 105 | L47: =K47/B47 -> 1.3011636120301871E-3 | M47: 5654 | N47: =M47/B47 -> 7.0064562499225491E-2 | O47: 580 | P47: =O47/B47 -> 7.1873799521667472E-3 | Q47: 11676 | R47: =Q47/B47 -> 0.14468939365775679
A48: 46 | B48: 80333 | C48: 41531 | D48: =C48/B48 -> 0.51698554765787408 | E48: 23285 | F48: =E48/B48 -> 0.28985597450611827 | G48: 484 | H48: =G48/B48 -> 6.0249212652334653E-3 | I48: 7435 | J48: =I48/B48 -> 9.2552251254154588E-2 | K48: 112 | L48: =K48/B48 -> 1.3941966564176614E-3 | M48: 6541 | N48: =M48/B48 -> 8.1423574371677895E-2 | O48: 945 | P48: =O48/B48 -> 1.1763534288524018E-2 | Q48: 13746 | R48: =Q48/B48 -> 0.17111274320640335
A49: 47 | B49: 79451 | C49: 62105 | D49: =C49/B49 -> 0.78167675674314985 | E49: 4295 | F49: =E49/B49 -> 5.405847629356459E-2 | G49: 599 | H49: =G49/B49 -> 7.5392380209185535E-3 | I49: 8338 | J49: =I49/B49 -> 0.10494518634126694 | K49: 90 | L49: =K49/B49 -> 1.1327736592365105E-3 | M49: 3535 | N49: =M49/B49 -> 4.4492832060011832E-2 | O49: 489 | P49: =O49/B49 -> 6.1547368818517072E-3 | Q49: 8861 | R49: =Q49/B49 -> 0.11152785993883023
A50: 48 | B50: 80667 | C50: 64340 | D50: =C50/B50 -> 0.79760000991731439 | E50: 3677 | F50: =E50/B50 -> 4.5582456270841856E-2 | G50: 422 | H50: =G50/B50 -> 5.2313833413911515E-3 | I50: 10337 | J50: =I50/B50 -> 0.12814409857810505 | K50: 82 | L50: =K50/B50 -> 1.0165247251044418E-3 | M50: 1400 | N50: =M50/B50 -> 1.7355300184709981E-2 | O50: 409 | P50: =O50/B50 -> 5.0702269825331301E-3 | Q50: 5647 | R50: =Q50/B50 -> 7.0003842959326615E-2
A51: 49 | B51: 80798 | C51: 42870 | D51: =C51/B51 -> 0.53058244015940992 | E51: 13460 | F51: =E51/B51 -> 0.16658828188816555 | G51: 797 | H51: =G51/B51 -> 9.8641055471670094E-3 | I51: 10646 | J51: =I51/B51 -> 0.13176068714572142 | K51: 142 | L51: =K51/B51 -> 1.7574692442882249E-3 | M51: 11823 | N51: =M51/B51 -> 0.14632787940295552 | O51: 1060 | P51: =O51/B51 -> 1.3119136612292383E-2 | Q51: 23583 | R51: =Q51/B51 -> 0.29187603653555783
A52: 50 | B52: 80677 | C52: 50040 | D52: =C52/B52 -> 0.62025112485590683 | E52: 12052 | F52: =E52/B52 -> 0.14938582247728596 | G52: 687 | H52: =G52/B52 -> 8.515438105036131E-3 | I52: 6540 | J52: =I52/B52 -> 8.1063995934405095E-2 | K52: 143 | L52: =K52/B52 -> 1.7725002169143621E-3 | M52: 10321 | N52: =M52/B52 -> 0.12792989327813378 | O52: 894 | P52: =O52/B52 -> 1.1081225132317761E-2 | Q52: 21171 | R52: =Q52/B52 -> 0.26241679784820954
A53: 51 | B53: 79361 | C53: 54479 | D53: =C53/B53 -> 0.68647068459318805 | E53: 13218 | F53: =E53/B53 -> 0.16655536094555259 | G53: 788 | H53: =G53/B53 -> 9.9293103665528404E-3 | I53: 5676 | J53: =I53/B53 -> 7.1521276193596356E-2 | K53: 146 | L53: =K53/B53 -> 1.8396945603003994E-3 | M53: 4235 | N53: =M53/B53 -> 5.3363742896384875E-2 | O53: 819 | P53: =O53/B53 -> 1.0319930444424844E-2 | Q53: 10726 | R53: =Q53/B53 -> 0.1351545469437129
A54: 52 | B54: 79353 | C54: 35065 | D54: =C54/B54 -> 0.44188625508802437 | E54: 24197 | F54: =E54/B54 -> 0.30492861013446249 | G54: 1037 | H54: =G54/B54 -> 1.3068188978362507E-2 | I54: 6104 | J54: =I54/B54 -> 7.6922107544768317E-2 | K54: 114 | L54: =K54/B54 -> 1.4366186533590413E-3 | M54: 11450 | N54: =M54/B54 -> 0.1442919612365002 | O54: 1386 | P54: =O54/B54 -> 1.746625836452308E-2 | Q54: 22465 | R54: =Q54/B54 -> 0.28310208813781457
A55: 53 | B55: 80309 | C55: 49169 | D55: =C55/B55 -> 0.61224769328468787 | E55: 4481 | F55: =E55/B55 -> 5.5796984148725547E-2 | G55: 578 | H55: =G55/B55 -> 7.1972008118641748E-3 | I55: 17611 | J55: =I55/B55 -> 0.21929049048051899 | K55: 59 | L55: =K55/B55 -> 7.3466236660897286E-4 | M55: 7764 | N55: =M55/B55 -> 9.6676586683933308E-2 | O55: 647 | P55: =O55/B55 -> 8.0563822236611096E-3 | Q55: 16662 | R55: =Q55/B55 -> 0.20747363309218145
A56: 54 | B56: 80209 | C56: 58437 | D56: =C56/B56 -> 0.72855913924871274 | E56: 15091 | F56: =E56/B56 -> 0.18814596865688388 | G56: 612 | H56: =G56/B56 -> 7.6300664513957285E-3 | I56: 2442 | J56: =I56/B56 -> 3.0445461232530016E-2 | K56: 137 | L56: =K56/B56 -> 1.7080377513745341E-3 | M56: 2869 | N56: =M56/B56 -> 3.5769053348128015E-2 | O56: 621 | P56: =O56/B56 -> 7.7422733109750773E-3 | Q56: 6408 | R56: =Q56/B56 -> 7.9891284020496459E-2
A57: 55 | B57: 79578 | C57: 63245 | D57: =C57/B57 -> 0.7947548317374149 | E57: 13351 | F57: =E57/B57 -> 0.16777249993716856 | G57: 658 | H57: =G57/B57 -> 8.2686169544346419E-3 | I57: 1120 | J57: =I57/B57 -> 1.4074241624569604E-2 | K57: 54 | L57: =K57/B57 -> 6.7857950689889169E-4 | M57: 787 | N57: =M57/B57 -> 9.8896679986931069E-3 | O57: 363 | P57: =O57/B57 -> 4.5615622408203271E-3 | Q57: 2068 | R57: =Q57/B57 -> 2.5987081856794592E-2
A58: 56 | B58: 79271 | C58: 62856 | D58: =C58/B58 -> 0.7929255339279182 | E58: 10005 | F58: =E58/B58 -> 0.12621261243077544 | G58: 421 | H58: =G58/B58 -> 5.3108955355678621E-3 | I58: 5022 | J58: =I58/B58 -> 6.3352297813828506E-2 | K58: 51 | L58: =K58/B58 -> 6.4336264207591682E-4 | M58: 608 | N58: =M58/B58 -> 7.6698918898462235E-3 | O58: 308 | P58: =O58/B58 -> 3.8854057599878897E-3 | Q58: 1904 | R58: =Q58/B58 -> 2.4018871970834226E-2
A59: 57 | B59: 80698 | C59: 56085 | D59: =C59/B59 -> 0.69499863689310759 | E59: 14603 | F59: =E59/B59 -> 0.18095863590175718 | G59: 513 | H59: =G59/B59 -> 6.3570348707526828E-3 | I59: 6384 | J59: =I59/B59 -> 7.9109767280477833E-2 | K59: 70 | L59: =K59/B59 -> 8.6743165877716921E-4 | M59: 2583 | N59: =M59/B59 -> 3.2008228208877547E-2 | O59: 460 | P59: =O59/B59 -> 5.7002651862499689E-3 | Q59: 5730 | R59: =Q59/B59 -> 7.1005477211331131E-2
A60: 58 | B60: 80307 | C60: 70861 | D60: =C60/B60 -> 0.88237638063929669 | E60: 5900 | F60: =E60/B60 -> 7.3468066295590675E-2 | G60: 451 | H60: =G60/B60 -> 5.6159487964934562E-3 | I60: 1601 | J60: =I60/B60 -> 1.993599561682045E-2 | K60: 38 | L60: =K60/B60 -> 4.7318415580210942E-4 | M60: 1214 | N60: =M60/B60 -> 1.5116988556414758E-2 | O60: 242 | P60: =O60/B60 -> 3.0134359395818547E-3 | Q60: 2569 | R60: =Q60/B60 -> 3.1989739375147867E-2
A61: 59 | B61: 79345 | C61: 61136 | D61: =C61/B61 -> 0.77050853866028102 | E61: 16314 | F61: =E61/B61 -> 0.2056084189299893 | G61: 458 | H61: =G61/B61 -> 5.7722603818766149E-3 | I61: 561 | J61: =I61/B61 -> 7.0703888083685175E-3 | K61: 50 | L61: =K61/B61 -> 6.3015943033587494E-4 | M61: 596 | N61: =M61/B61 -> 7.5115004096036296E-3 | O61: 230 | P61: =O61/B61 -> 2.8987333795450249E-3 | Q61: 1436 | R61: =Q61/B61 -> 1.8098178839246328E-2
A62: 60 | B62: 79219 | C62: 50287 | D62: =C62/B62 -> 0.6347845845062422 | E62: 27103 | F62: =E62/B62 -> 0.34212751991315216 | G62: 439 | H62: =G62/B62 -> 5.5415998687183632E-3 | I62: 440 | J62: =I62/B62 -> 5.5542231030434614E-3 | K62: 25 | L62: =K62/B62 -> 3.155808581274694E-4 | M62: 689 | N62: =M62/B62 -> 8.6974084499930569E-3 | O62: 236 | P62: =O62/B62 -> 2.9790833007233113E-3 | Q62: 1407 | R62: =Q62/B62 -> 1.7760890695413978E-2
A63: 61 | B63: 79223 | C63: 49709 | D63: =C63/B63 -> 0.6274566729358898 | E63: 27200 | F63: =E63/B63 -> 0.34333463766835387 | G63: 530 | H63: =G63/B63 -> 6.6899763957436603E-3 | I63: 404 | J63: =I63/B63 -> 5.0995291771329032E-3 | K63: 34 | L63: =K63/B63 -> 4.2916829708544236E-4 | M63: 1048 | N63: =M63/B63 -> 1.3228481627810106E-2 | O63: 298 | P63: =O63/B63 -> 3.7615338979841715E-3 | Q63: 2095 | R63: =Q63/B63 -> 2.6444340658647109E-2
A64: 62 | B64: 79249 | C64: 53209 | D64: =C64/B64 -> 0.67141541218185719 | E64: 18854 | F64: =E64/B64 -> 0.23790836477431893 | G64: 771 | H64: =G64/B64 -> 9.7288293858597587E-3 | I64: 2203 | J64: =I64/B64 -> 2.7798458024706936E-2 | K64: 142 | L64: =K64/B64 -> 1.791820716980656E-3 | M64: 3487 | N64: =M64/B64 -> 4.400055521205315E-2 | O64: 583 | P64: =O64/B64 -> 7.356559704223397E-3 | Q64: 6757 | R64: =Q64/B64 -> 8.5262905525621768E-2
A65: 63 | B65: 79628 | C65: 28269 | D65: =C65/B65 -> 0.35501331190033658 | E65: 48039 | F65: =E65/B65 -> 0.6032928115738182 | G65: 440 | H65: =G65/B65 -> 5.5256944793288789E-3 | I65: 823 | J65: =I65/B65 -> 1.033556035565379E-2 | K65: 85 | L65: =K65/B65 -> 1.067463706233988E-3 | M65: 1361 | N65: =M65/B65 -> 1.7091977696287737E-2 | O65: 611 | P65: =O65/B65 -> 7.6731802883407843E-3 | Q65: 3111 | R65: =Q65/B65 -> 3.906917164816396E-2
A66: 64 | B66: 79358 | C66: 57327 | D66: =C66/B66 -> 0.72238463670959452 | E66: 19643 | F66: =E66/B66 -> 0.24752387913001839 | G66: 569 | H66: =G66/B66 -> 7.1700395675294232E-3 | I66: 858 | J66: =I66/B66 -> 1.0811764409385317E-2 | K66: 55 | L66: =K66/B66 -> 6.9306182111444339E-4 | M66: 539 | N66: =M66/B66 -> 6.7920058469215453E-3 | O66: 367 | P66: =O66/B66 -> 4.6246125154363769E-3 | Q66: 1530 | R66: =Q66/B66 -> 1.9279719751001789E-2
A67: 65 | B67: 79263 | C67: 64751 | D67: =C67/B67 -> 0.81691331390434374 | E67: 11019 | F67: =E67/B67 -> 0.13901820521554825 | G67: 388 | H67: =G67/B67 -> 4.8950960725685378E-3 | I67: 2192 | J67: =I67/B67 -> 2.7654769564614008E-2 | K67: 39 | L67: =K67/B67 -> 4.9203285265508499E-4 | M67: 582 | N67: =M67/B67 -> 7.3426441088528067E-3 | O67: 292 | P67: =O67/B67 -> 3.6839382814175593E-3 | Q67: 1842 | R67: =Q67/B67 -> 2.3239090117709398E-2
A68: 66 | B68: 79334 | C68: 59966 | D68: =C68/B68 -> 0.75586759775127943 | E68: 14122 | F68: =E68/B68 -> 0.17800690750497894 | G68: 538 | H68: =G68/B68 -> 6.7814556180200167E-3 | I68: 2507 | J68: =I68/B68 -> 3.1600574785085843E-2 | K68: 75 | L68: =K68/B68 -> 9.4537020697305063E-4 | M68: 1621 | N68: =M68/B68 -> 2.0432601406710868E-2 | O68: 505 | P68: =O68/B68 -> 6.3654927269518741E-3 | Q68: 3767 | R68: =Q68/B68 -> 4.7482794262233091E-2
A69: 67 | B69: 79633 | C69: 53298 | D69: =C69/B69 -> 0.66929539261361493 | E69: 4756 | F69: =E69/B69 -> 5.9723983775570429E-2 | G69: 328 | H69: =G69/B69 -> 4.1188954327979607E-3 | I69: 17683 | J69: =I69/B69 -> 0.22205618273831201 | K69: 128 | L69: =K69/B69 -> 1.6073738274333504E-3 | M69: 3015 | N69: =M69/B69 -> 3.7861188200871497E-2 | O69: 425 | P69: =O69/B69 -> 5.3369834113997962E-3 | Q69: 7838 | R69: =Q69/B69 -> 9.8426531714239068E-2
A70: 68 | B70: 79666 | C70: 67542 | D70: =C70/B70 -> 0.84781462606381641 | E70: 7505 | F70: =E70/B70 -> 9.4205809253633921E-2 | G70: 356 | H70: =G70/B70 -> 4.4686566414781715E-3 | I70: 2923 | J70: =I70/B70 -> 3.6690683604046898E-2 | K70: 47 | L70: =K70/B70 -> 5.899630959254889E-4 | M70: 976 | N70: =M70/B70 -> 1.2251148545176111E-2 | O70: 317 | P70: =O70/B70 -> 3.9791127959229785E-3 | Q70: 2589 | R70: =Q70/B70 -> 3.249817990108704E-2
A71: 69 | B71: 79306 | C71: 22688 | D71: =C71/B71 -> 0.28608175926159435 | E71: 47677 | F71: =E71/B71 -> 0.6011777166923058 | G71: 494 | H71: =G71/B71 -> 6.2290368950646859E-3 | I71: 1356 | J71: =I71/B71 -> 1.7098327995359746E-2 | K71: 92 | L71: =K71/B71 -> 1.1600635513075934E-3 | M71: 6230 | N71: =M71/B71 -> 7.8556477441807687E-2 | O71: 769 | P71: =O71/B71 -> 9.6966181625602107E-3 | Q71: 9483 | R71: =Q71/B71 -> 0.11957481148967292
A72: 70 | B72: 79769 | C72: 21948 | D72: =C72/B72 -> 0.2751444796850907 | E72: 49325 | F72: =E72/B72 -> 0.61834797979164835 | G72: 586 | H72: =G72/B72 -> 7.3462121876919605E-3 | I72: 1707 | J72: =I72/B72 -> 2.1399290451177777E-2 | K72: 81 | L72: =K72/B72 -> 1.0154320600734622E-3 | M72: 5233 | N72: =M72/B72 -> 6.5601925560054661E-2 | O72: 889 | P72: =O72/B72 -> 1.114468026426306E-2 | Q72: 8229 | R72: =Q72/B72 -> 0.10316037558450024
A73: 71 | B73: 80310 | C73: 26608 | D73: =C73/B73 -> 0.33131614991906361 | E73: 47604 | F73: =E73/B73 -> 0.59275308180799402 | G73: 351 | H73: =G73/B73 -> 4.3705640642510276E-3 | I73: 3447 | J73: =I73/B73 -> 4.2921180425849831E-2 | K73: 51 | L73: =K73/B73 -> 6.35039223010833E-4 | M73: 1432 | N73: =M73/B73 -> 1.7830905242186529E-2 | O73: 817 | P73: =O73/B73 -> 1.017307931764413E-2 | Q73: 3166 | R73: =Q73/B73 -> 3.9422238824554853E-2
A74: 72 | B74: 80509 | C74: 59371 | D74: =C74/B74 -> 0.73744550298724365 | E74: 11438 | F74: =E74/B74 -> 0.14207107279931436 | G74: 406 | H74: =G74/B74 -> 5.0429144567688084E-3 | I74: 6863 | J74: =I74/B74 -> 8.5245127873902302E-2 | K74: 46 | L74: =K74/B74 -> 5.7136469214621967E-4 | M74: 1953 | N74: =M74/B74 -> 2.4258157473077545E-2 | O74: 432 | P74: =O74/B74 -> 5.3658597175471065E-3 | Q74: 4293 | R74: =Q74/B74 -> 5.332323094312437E-2
A75: 73 | B75: 80644 | C75: 59944 | D75: =C75/B75 -> 0.74331630375477409 | E75: 9686 | F75: =E75/B75 -> 0.12010812955706562 | G75: 424 | H75: =G75/B75 -> 5.2576757105302317E-3 | I75: 7606 | J75: =I75/B75 -> 9.4315758146917311E-2 | K75: 54 | L75: =K75/B75 -> 6.6960964237885025E-4 | M75: 2412 | N75: =M75/B75 -> 2.9909230692921979E-2 | O75: 518 | P75: =O75/B75 -> 6.4232924954119343E-3 | Q75: 5235 | R75: =Q75/B75 -> 6.4914934775060759E-2
A76: 74 | B76: 79595 | C76: 26046 | D76: =C76/B76 -> 0.3272316100257554 | E76: 48656 | F76: =E76/B76 -> 0.61129467931402726 | G76: 1012 | H76: =G76/B76 -> 1.2714366480306553E-2 | I76: 1718 | J76: =I76/B76 -> 2.1584270368741755E-2 | K76: 57 | L76: =K76/B76 -> 7.1612538476034931E-4 | M76: 1368 | N76: =M76/B76 -> 1.7187009234248381E-2 | O76: 738 | P76: =O76/B76 -> 9.2719391921603118E-3 | Q76: 2737 | R76: =Q76/B76 -> 3.4386582071738177E-2
A77: 75 | B77: 79742 | C77: 32919 | D77: =C77/B77 -> 0.4128188407614557 | E77: 44904 | F77: =E77/B77 -> 0.56311604925885983 | G77: 349 | H77: =G77/B77 -> 4.3766145820270368E-3 | I77: 372 | J77: =I77/B77 -> 4.6650447693812542E-3 | K77: 26 | L77: =K77/B77 -> 3.2605151613955004E-4 | M77: 877 | N77: =M77/B77 -> 1.0997968448245592E-2 | O77: 295 | P77: =O77/B77 -> 3.6994306638910486E-3 | Q77: 1775 | R77: =Q77/B77 -> 2.2259286197988514E-2
A78: 76 | B78: 80313 | C78: 54860 | D78: =C78/B78 -> 0.68307745943994125 | E78: 21093 | F78: =E78/B78 -> 0.2626349407941429 | G78: 519 | H78: =G78/B78 -> 6.4622165776399834E-3 | I78: 2568 | J78: =I78/B78 -> 3.197489821075044E-2 | K78: 81 | L78: =K78/B78 -> 1.0085540323484367E-3 | M78: 685 | N78: =M78/B78 -> 8.5291297797367802E-3 | O78: 507 | P78: =O78/B78 -> 6.3128011654402152E-3 | Q78: 2419 | R78: =Q78/B78 -> 3.0119656842603315E-2
A79: 77 | B79: 79627 | C79: 26586 | D79: =C79/B79 -> 0.33388172353598655 | E79: 48940 | F79: =E79/B79 -> 0.61461564544689617 | G79: 538 | H79: =G79/B79 -> 6.7565021914677186E-3 | I79: 1268 | J79: =I79/B79 -> 1.5924246800708301E-2 | K79: 99 | L79: =K79/B79 -> 1.243296871664134E-3 | M79: 1445 | N79: =M79/B79 -> 1.8147110904592662E-2 | O79: 751 | P79: =O79/B79 -> 9.4314742486844919E-3 | Q79: 3518 | R79: =Q79/B79 -> 4.4180993883984075E-2
A80: 78 | B80: 80543 | C80: 60784 | D80: =C80/B80 -> 0.7546776256161305 | E80: 13835 | F80: =E80/B80 -> 0.17177160026321345 | G80: 587 | H80: =G80/B80 -> 7.2880324795450875E-3 | I80: 3772 | J80: =I80/B80 -> 4.683212693840557E-2 | K80: 112 | L80: =K80/B80 -> 1.3905615633885006E-3 | M80: 889 | N80: =M80/B80 -> 1.1037582409396222E-2 | O80: 564 | P80: =O80/B80 -> 7.0024707299206632E-3 | Q80: 3408 | R80: =Q80/B80 -> 4.2312801857392945E-2
A81: 79 | B81: 80278 | C81: 49065 | D81: =C81/B81 -> 0.61118861954707393 | E81: 24516 | F81: =E81/B81 -> 0.30538877401031417 | G81: 805 | H81: =G81/B81 -> 1.0027653902688158E-2 | I81: 2713 | J81: =I81/B81 -> 3.3795062158997483E-2 | K81: 193 | L81: =K81/B81 -> 2.4041455940606391E-3 | M81: 1641 | N81: =M81/B81 -> 2.044146590597673E-2 | O81: 1345 | P81: =O81/B81 -> 1.6754278880888911E-2 | Q81: 5524 | R81: =Q81/B81 -> 6.8810882184409172E-2
A82: 80 | B82: 80705 | C82: 28912 | D82: =C82/B82 -> 0.35824298370609009 | E82: 47835 | F82: =E82/B82 -> 0.59271420605910419 | G82: 524 | H82: =G82/B82 -> 6.492782355492225E-3 | I82: 1488 | J82: =I82/B82 -> 1.8437519360634411E-2 | K82: 150 | L82: =K82/B82 -> 1.858620903289759E-3 | M82: 1003 | N82: =M82/B82 -> 1.2427978439997522E-2 | O82: 793 | P82: =O82/B82 -> 9.8259091753918597E-3 | Q82: 2720 | R82: =Q82/B82 -> 3.3702992379654295E-2
A83: 81 | B83: 79370 | C83: 58056 | D83: =C83/B83 -> 0.73146024946453325 | E83: 15411 | F83: =E83/B83 -> 0.19416656167317625 | G83: 755 | H83: =G83/B83 -> 9.5124102305657043E-3 | I83: 2708 | J83: =I83/B83 -> 3.4118684641552224E-2 | K83: 139 | L83: =K83/B83 -> 1.7512914199319643E-3 | M83: 1625 | N83: =M83/B83 -> 2.0473730628701021E-2 | O83: 676 | P83: =O83/B83 -> 8.5170719415396251E-3 | Q83: 4525 | R83: =Q83/B83 -> 5.7011465289152075E-2
A84: 82 | B84: 80463 | C84: 66725 | D84: =C84/B84 -> 0.82926313957968256 | E84: 8314 | F84: =E84/B84 -> 0.10332699501634292 | G84: 587 | H84: =G84/B84 -> 7.2952785752457647E-3 | I84: 2693 | J84: =I84/B84 -> 3.3468799323912855E-2 | K84: 138 | L84: =K84/B84 -> 1.7150740091719176E-3 | M84: 1446 | N84: =M84/B84 -> 1.797099287871444E-2 | O84: 560 | P84: =O84/B84 -> 6.9597206169295205E-3 | Q84: 4252 | R84: =Q84/B84 -> 5.2844164398543426E-2
A85: 83 | B85: 79538 | C85: 58152 | D85: =C85/B85 -> 0.73112223088335138 | E85: 13407 | F85: =E85/B85 -> 0.16856093942518041 | G85: 717 | H85: =G85/B85 -> 9.0145590786793739E-3 | I85: 4392 | J85: =I85/B85 -> 5.521888908446277E-2 | K85: 150 | L85: =K85/B85 -> 1.8858910206442203E-3 | M85: 1966 | N85: =M85/B85 -> 2.4717744977243581E-2 | O85: 754 | P85: =O85/B85 -> 9.4797455304382813E-3 | Q85: 5196 | R85: =Q85/B85 -> 6.5327264955115788E-2
A86: 84 | B86: 80281 | C86: 52357 | D86: =C86/B86 -> 0.65217174673957723 | E86: 17161 | F86: =E86/B86 -> 0.21376166216165718 | G86: 598 | H86: =G86/B86 -> 7.4488359636775822E-3 | I86: 7049 | J86: =I86/B86 -> 8.7804088140406827E-2 | K86: 228 | L86: =K86/B86 -> 2.8400244142449647E-3 | M86: 1997 | N86: =M86/B86 -> 2.4875126119505236E-2 | O86: 891 | P86: =O86/B86 -> 1.109851646093098E-2 | Q86: 6168 | R86: =Q86/B86 -> 7.6830134153784826E-2
A87: 85 | B87: 79836 | C87: 53522 | D87: =C87/B87 -> 0.6703993186031364 | E87: 16402 | F87: =E87/B87 -> 0.2054461646375069 | G87: 693 | H87: =G87/B87 -> 8.680294603938073E-3 | I87: 6306 | J87: =I87/B87 -> 7.8986923192544717E-2 | K87: 170 | L87: =K87/B87 -> 2.1293651986572472E-3 | M87: 1866 | N87: =M87/B87 -> 2.337291447467308E-2 | O87: 877 | P87: =O87/B87 -> 1.0985019289543565E-2 | Q87: 5209 | R87: =Q87/B87 -> 6.5246254822385885E-2
A88: 86 | B88: 80747 | C88: 46400 | D88: =C88/B88 -> 0.57463435174062194 | E88: 6804 | F88: =E88/B88 -> 8.4263192440586027E-2 | G88: 545 | H88: =G88/B88 -> 6.7494767607465291E-3 | I88: 17169 | J88: =I88/B88 -> 0.21262709450505901 | K88: 72 | L88: =K88/B88 -> 8.916739940802754E-4 | M88: 8989 | N88: =M88/B88 -> 0.11132302128871661 | O88: 768 | P88: =O88/B88 -> 9.5111892701896048E-3 | Q88: 17163 | R88: =Q88/B88 -> 0.21255278833888566
A89: 87 | B89: 79275 | C89: 44093 | D89: =C89/B89 -> 0.55620309050772632 | E89: 7083 | F89: =E89/B89 -> 8.9347209082308421E-2 | G89: 437 | H89: =G89/B89 -> 5.5124566382844528E-3 | I89: 21108 | J89: =I89/B89 -> 0.26626300851466417 | K89: 83 | L89: =K89/B89 -> 1.0469883317565437E-3 | M89: 5698 | N89: =M89/B89 -> 7.1876379690949233E-2 | O89: 773 | P89: =O89/B89 -> 9.7508672343109438E-3 | Q89: 11761 | R89: =Q89/B89 -> 0.14835698517817722
A90: 88 | B90: 80137 | C90: 60115 | D90: =C90/B90 -> 0.7501528632217328 | E90: 12389 | F90: =E90/B90 -> 0.15459775135081175 | G90: 587 | H90: =G90/B90 -> 7.3249560128280317E-3 | I90: 2627 | J90: =I90/B90 -> 3.2781361917715912E-2 | K90: 122 | L90: =K90/B90 -> 1.5223929021550594E-3 | M90: 3645 | N90: =M90/B90 -> 4.5484607609468784E-2 | O90: 652 | P90: =O90/B90 -> 8.1360669852876943E-3 | Q90: 7184 | R90: =Q90/B90 -> 8.9646480402311046E-2
A91: 89 | B91: 80784 | C91: 29105 | D91: =C91/B91 -> 0.36028173895820953 | E91: 46334 | F91: =E91/B91 -> 0.57355416914240442 | G91: 515 | H91: =G91/B91 -> 6.3750247573776987E-3 | I91: 2387 | J91: =I91/B91 -> 2.9547930283224402E-2 | K91: 113 | L91: =K91/B91 -> 1.3987918399683105E-3 | M91: 1362 | N91: =M91/B91 -> 1.6859774212715388E-2 | O91: 968 | P91: =O91/B91 -> 1.1982570806100218E-2 | Q91: 3770 | R91: =Q91/B91 -> 4.6667656961774606E-2
A92: 90 | B92: 80758 | C92: 24589 | D92: =C92/B92 -> 0.30447757497709205 | E92: 49185 | F92: =E92/B92 -> 0.60904182867332024 | G92: 549 | H92: =G92/B92 -> 6.7980881151093386E-3 | I92: 3270 | J92: =I92/B92 -> 4.0491344510760544E-2 | K92: 120 | L92: =K92/B92 -> 1.4859208994774512E-3 | M92: 1843 | N92: =M92/B92 -> 2.2821268481141188E-2 | O92: 1202 | P92: =O92/B92 -> 1.4883974343099135E-2 | Q92: 4780 | R92: =Q92/B92 -> 5.9189182495851804E-2
A93: 91 | B93: 79347 | C93: 54580 | D93: =C93/B93 -> 0.68786469557765262 | E93: 18212 | F93: =E93/B93 -> 0.22952348544998552 | G93: 670 | H93: =G93/B93 -> 8.4439235257791727E-3 | I93: 3620 | J93: =I93/B93 -> 4.5622392781075528E-2 | K93: 146 | L93: =K93/B93 -> 1.8400191563638197E-3 | M93: 1266 | N93: =M93/B93 -> 1.5955234602442435E-2 | O93: 853 | P93: =O93/B93 -> 1.0750248906700946E-2 | Q93: 3613 | R93: =Q93/B93 -> 4.5534172684537536E-2
A94: 92 | B94: 79376 | C94: 23685 | D94: =C94/B94 -> 0.29838994154404352 | E94: 50964 | F94: =E94/B94 -> 0.64205805281193307 | G94: 580 | H94: =G94/B94 -> 7.306994557548881E-3 | I94: 1610 | J94: =I94/B94 -> 2.0283209030437413E-2 | K94: 93 | L94: =K94/B94 -> 1.1716387825035275E-3 | M94: 1047 | N94: =M94/B94 -> 1.3190385003023584E-2 | O94: 1397 | P94: =O94/B94 -> 1.7599778270509979E-2 | Q94: 3377 | R94: =Q94/B94 -> 4.2544345898004432E-2
A95: 93 | B95: 79453 | C95: 53087 | D95: =C95/B95 -> 0.6681560167646281 | E95: 18528 | F95: =E95/B95 -> 0.23319446716926989 | G95: 543 | H95: =G95/B95 -> 6.8342290410683048E-3 | I95: 4133 | J95: =I95/B95 -> 5.2018174266547521E-2 | K95: 200 | L95: =K95/B95 -> 2.5172114331743294E-3 | M95: 2037 | N95: =M95/B95 -> 2.5637798446880546E-2 | O95: 925 | P95: =O95/B95 -> 1.1642102878431274E-2 | Q95: 5292 | R95: =Q95/B95 -> 6.6605414521792763E-2
A96: 94 | B96: 79429 | C96: 53846 | D96: =C96/B96 -> 0.67791360837981085 | E96: 18342 | F96: =E96/B96 -> 0.23092321444308753 | G96: 671 | H96: =G96/B96 -> 8.4477961449848284E-3 | I96: 3036 | J96: =I96/B96 -> 3.8222815344521523E-2 | K96: 151 | L96: =K96/B96 -> 1.9010688791247529E-3 | M96: 2417 | N96: =M96/B96 -> 3.0429691926122701E-2 | O96: 966 | P96: =O96/B96 -> 1.2161804882347757E-2 | Q96: 5773 | R96: =Q96/B96 -> 7.2681262511173503E-2
A97: 95 | B97: 79969 | C97: 24943 | D97: =C97/B97 -> 0.31190836449124038 | E97: 48848 | F97: =E97/B97 -> 0.61083669922094808 | G97: 591 | H97: =G97/B97 -> 7.3903637659593095E-3 | I97: 1990 | J97: =I97/B97 -> 2.4884642799084644E-2 | K97: 129 | L97: =K97/B97 -> 1.6131250859708138E-3 | M97: 2103 | N97: =M97/B97 -> 2.6297690355012567E-2 | O97: 1365 | P97: =O97/B97 -> 1.7069114281784193E-2 | Q97: 5494 | R97: =Q97/B97 -> 6.8701621878477906E-2
A98: 96 | B98: 79272 | C98: 62806 | D98: =C98/B98 -> 0.79228479160359266 | E98: 11559 | F98: =E98/B98 -> 0.14581441114138663 | G98: 516 | H98: =G98/B98 -> 6.5092340296699974E-3 | I98: 2650 | J98: =I98/B98 -> 3.3429205772530023E-2 | K98: 98 | L98: =K98/B98 -> 1.2362498738520537E-3 | M98: 1149 | N98: =M98/B98 -> 1.4494399031183772E-2 | O98: 494 | P98: =O98/B98 -> 6.2317085477848417E-3 | Q98: 3360 | R98: =Q98/B98 -> 4.2385709960641837E-2
A99: 97 | B99: 79386 | C99: 67533 | D99: =C99/B99 -> 0.85069155770538885 | E99: 8709 | F99: =E99/B99 -> 0.10970448189857154 | G99: 991 | H99: =G99/B99 -> 1.2483309399642255E-2 | I99: 1232 | J99: =I99/B99 -> 1.5519109162824679E-2 | K99: 45 | L99: =K99/B99 -> 5.6685057818758975E-4 | M99: 575 | N99: =M99/B99 -> 7.2430907212858693E-3 | O99: 301 | P99: =O99/B99 -> 3.7916005340992115E-3 | Q99: 1606 | R99: =Q99/B99 -> 2.0230267301539314E-2
A100: 98 | B100: 79251 | C100: 63155 | D100: =C100/B100 -> 0.79689846184906188 | E100: 13524 | F100: =E100/B100 -> 0.17064768898815158 | G100: 837 | H100: =G100/B100 -> 1.0561380928947268E-2 | I100: 731 | J100: =I100/B100 -> 9.2238583740268266E-3 | K100: 46 | L100: =K100/B100 -> 5.8043431628622985E-4 | M100: 654 | N100: =M100/B100 -> 8.2522618011129194E-3 | O100: 304 | P100: =O100/B100 -> 3.835913742413345E-3 | Q100: 1870 | R100: =Q100/B100 -> 2.35959167707663E-2
A101: 99 | B101: 80332 | C101: 56801 | D101: =C101/B101 -> 0.7070781257780212 | E101: 20397 | F101: =E101/B101 -> 0.2539087785689389 | G101: 687 | H101: =G101/B101 -> 8.5520091619777916E-3 | I101: 763 | J101: =I101/B101 -> 9.4980829557337054E-3 | K101: 45 | L101: =K101/B101 -> 5.6017527261863263E-4 | M101: 1286 | N101: =M101/B101 -> 1.600856445750137E-2 | O101: 353 | P101: =O101/B101 -> 4.394263805208385E-3 | Q101: 2971 | R101: =Q101/B101 -> 3.698401633222128E-2
A102: 100 | B102: 79463 | C102: 49159 | D102: =C102/B102 -> 0.61864012181770134 | E102: 24133 | F102: =E102/B102 -> 0.30370109359072778 | G102: 845 | H102: =G102/B102 -> 1.0633879918955992E-2 | I102: 1603 | J102: =I102/B102 -> 2.0172910662824207E-2 | K102: 176 | L102: =K102/B102 -> 2.2148672967292954E-3 | M102: 2916 | N102: =M102/B102 -> 3.6696324075355828E-2 | O102: 631 | P102: =O102/B102 -> 7.9408026377055987E-3 | Q102: 6735 | R102: =Q102/B102 -> 8.475642751972616E-2

A1: HB 5001 - C. Jones Voting Age Population
A2: DISTRICT | B2: Voting Age Population | C2: VAP White | D2: % VAP White | E2: VAP Black | F2: % VAP Black | G2: VAP AIAN | H2: % VAP AIAN | I2: VAP Asian | J2: % VAP Asian | K2: VAP HawPI | L2: % VAP HawPI | M2: VAP Other | N2: % VAP Other | O2: VAP Multi | P2: % VAP Multi | Q2: Voting Age Hispanic | R2: % VAP Hispanic
A3: 1 | B3: 64003 | C3: 60431 | D3: =C3/B3 -> 0.94419011608830838 | E3: 2482 | F3: =E3/B3 -> 3.8779432214114964E-2 | G3: 392 | H3: =G3/B3 -> 6.1247129040826213E-3 | I3: 266 | J3: =I3/B3 -> 4.1560551849132068E-3 | K3: 22 | L3: =K3/B3 -> 3.4373388747402465E-4 | M3: 333 | N3: =M3/B3 -> 5.2028811149477366E-3 | O3: 77 | P3: =O3/B3 -> 1.2030686061590863E-3 | Q3: 753 | R3: =Q3/B3 -> 1.1765073512179116E-2
A4: 2 | B4: 55988 | C4: 33347 | D4: =C4/B4 -> 0.59560977352289779 | E4: 13588 | F4: =E4/B4 -> 0.24269486318496822 | G4: 467 | H4: =G4/B4 -> 8.3410730870900913E-3 | I4: 3882 | J4: =I4/B4 -> 6.9336286347074366E-2 | K4: 127 | L4: =K4/B4 -> 2.2683432164035153E-3 | M4: 3996 | N4: =M4/B4 -> 7.1372436950775164E-2 | O4: 581 | P4: =O4/B4 -> 1.0377223690790884E-2 | Q4: 8870 | R4: =Q4/B4 -> 0.15842680574408802
A5: 3 | B5: 64131 | C5: 61462 | D5: =C5/B5 -> 0.95838206171742213 | E5: 1930 | F5: =E5/B5 -> 3.0094650013254121E-2 | G5: 260 | H5: =G5/B5 -> 4.0542015561896745E-3 | I5: 320 | J5: =I5/B5 -> 4.989786530694984E-3 | K5: 20 | L5: =K5/B5 -> 3.118616581684365E-4 | M5: 96 | N5: =M5/B5 -> 1.4969359592084952E-3 | O5: 43 | P5: =O5/B5 -> 6.7050256506213848E-4 | Q5: 316 | R5: =Q5/B5 -> 4.9274141990612967E-3
A6: 4 | B6: 63854 | C6: 61058 | D6: =C6/B6 -> 0.95621261001660041 | E6: 1918 | F6: =E6/B6 -> 3.0037272527954396E-2 | G6: 303 | H6: =G6/B6 -> 4.7451999874714192E-3 | I6: 231 | J6: =I6/B6 -> 3.6176277132207849E-3 | K6: 11 | L6: =K6/B6 -> 1.7226798634384691E-4 | M6: 273 | N6: =M6/B6 -> 4.2753782065336546E-3 | O6: 60 | P6: =O6/B6 -> 9.3964356187552851E-4 | Q6: 563 | R6: =Q6/B6 -> 8.8169887555987099E-3
A7: 5 | B7: 64644 | C7: 62254 | D7: =C7/B7 -> 0.96302827795309698 | E7: 1168 | F7: =E7/B7 -> 1.8068188849699896E-2 | G7: 287 | H7: =G7/B7 -> 4.4397005135820801E-3 | I7: 220 | J7: =I7/B7 -> 3.4032547490873088E-3 | K7: 20 | L7: =K7/B7 -> 3.0938679537157354E-4 | M7: 641 | N7: =M7/B7 -> 9.9158467916589318E-3 | O7: 54 | P7: =O7/B7 -> 8.3534434750324852E-4 | Q7: 1345 | R7: =Q7/B7 -> 2.080626198873832E-2
A8: 6 | B8: 63854 | C8: 61640 | D8: =C8/B8 -> 0.96532715256679302 | E8: 1242 | F8: =E8/B8 -> 1.9450621730823441E-2 | G8: 295 | H8: =G8/B8 -> 4.6199141792213488E-3 | I8: 216 | J8: =I8/B8 -> 3.3827168227519027E-3 | K8: 13 | L8: =K8/B8 -> 2.0358943840636452E-4 | M8: 406 | N8: =M8/B8 -> 6.3582547686910768E-3 | O8: 42 | P8: =O8/B8 -> 6.5775049331286996E-4 | Q8: 811 | R8: =Q8/B8 -> 1.2700848811350893E-2
A9: 7 | B9: 64401 | C9: 59855 | D9: =C9/B9 -> 0.92941103399015546 | E9: 2606 | F9: =E9/B9 -> 4.046521016754398E-2 | G9: 331 | H9: =G9/B9 -> 5.1396717442275738E-3 | I9: 1123 | J9: =I9/B9 -> 1.7437617428300804E-2 | K9: 30 | L9: =K9/B9 -> 4.6583127591186475E-4 | M9: 339 | N9: =M9/B9 -> 5.2638934178040712E-3 | O9: 117 | P9: =O9/B9 -> 1.8167419760562725E-3 | Q9: 1137 | R9: =Q9/B9 -> 1.7655005357059671E-2
A10: 8 | B10: 63208 | C10: 58658 | D10: =C10/B10 -> 0.92801544108340717 | E10: 2522 | F10: =E10/B10 -> 3.9900012656625745E-2 | G10: 341 | H10: =G10/B10 -> 5.3948867231995946E-3 | I10: 1154 | J10: =I10/B10 -> 1.8257182635109479E-2 | K10: 22 | L10: =K10/B10 -> 3.4805720794836098E-4 | M10: 432 | N10: =M10/B10 -> 6.8345779015314516E-3 | O10: 79 | P10: =O10/B10 -> 1.2498417921782052E-3 | Q10: 1012 | R10: =Q10/B10 -> 1.6010631565624604E-2
A11: 9 | B11: 64142 | C11: 56131 | D11: =C11/B11 -> 0.87510523525926853 | E11: 6385 | F11: =E11/B11 -> 9.9544760063608864E-2 | G11: 341 | H11: =G11/B11 -> 5.3163293941567149E-3 | I11: 252 | J11: =I11/B11 -> 3.9287830126905924E-3 | K11: 25 | L11: =K11/B11 -> 3.8976021951295562E-4 | M11: 940 | N11: =M11/B11 -> 1.4654984253687131E-2 | O11: 68 | P11: =O11/B11 -> 1.0601477970752394E-3 | Q11: 1388 | R11: =Q11/B11 -> 2.1639487387359296E-2
A12: 10 | B12: 57012 | C12: 44081 | D12: =C12/B12 -> 0.7731881007507192 | E12: 4917 | F12: =E12/B12 -> 8.6245001052410022E-2 | G12: 299 | H12: =G12/B12 -> 5.2445099277345121E-3 | I12: 4440 | J12: =I12/B12 -> 7.7878341401810144E-2 | K12: 49 | L12: =K12/B12 -> 8.5946818213709399E-4 | M12: 2927 | N12: =M12/B12 -> 5.1340068757454574E-2 | O12: 299 | P12: =O12/B12 -> 5.2445099277345121E-3 | Q12: 6239 | R12: =Q12/B12 -> 0.10943310180312917
A13: 11 | B13: 62356 | C13: 39559 | D13: =C13/B13 -> 0.6344056706652127 | E13: 19412 | F13: =E13/B13 -> 0.31130925652703828 | G13: 353 | H13: =G13/B13 -> 5.6610430431714674E-3 | I13: 1169 | J13: =I13/B13 -> 1.8747193533902109E-2 | K13: 36 | L13: =K13/B13 -> 5.7733016870870481E-4 | M13: 1509 | N13: =M13/B13 -> 2.4199756238373213E-2 | O13: 318 | P13: =O13/B13 -> 5.0997498235935594E-3 | Q13: 3146 | R13: =Q13/B13 -> 5.0452241965488483E-2
A14: 12 | B14: 69034 | C14: 60408 | D14: =C14/B14 -> 0.87504707825129646 | E14: 3084 | F14: =E14/B14 -> 4.467363907639714E-2 | G14: 337 | H14: =G14/B14 -> 4.8816525190485847E-3 | I14: 4401 | J14: =I14/B14 -> 6.3751195063302138E-2 | K14: 51 | L14: =K14/B14 -> 7.3876640495987485E-4 | M14: 555 | N14: =M14/B14 -> 8.0395167598574617E-3 | O14: 198 | P14: =O14/B14 -> 2.8681519251383377E-3 | Q14: 1618 | R14: =Q14/B14 -> 2.3437726337746618E-2
A15: 13 | B15: 58290 | C15: 36735 | D15: =C15/B15 -> 0.63021101389603706 | E15: 7701 | F15: =E15/B15 -> 0.13211528564076172 | G15: 461 | H15: =G15/B15 -> 7.9087322010636465E-3 | I15: 6080 | J15: =I15/B15 -> 0.10430605592726025 | K15: 64 | L15: =K15/B15 -> 1.0979584834448447E-3 | M15: 6752 | N15: =M15/B15 -> 0.11583462000343112 | O15: 497 | P15: =O15/B15 -> 8.5263338480013728E-3 | Q15: 12955 | R15: =Q15/B15 -> 0.22225081489106194
A16: 14 | B16: 62243 | C16: 39231 | D16: =C16/B16 -> 0.63028774320003855 | E16: 21334 | F16: =E16/B16 -> 0.34275340198897869 | G16: 265 | H16: =G16/B16 -> 4.2575068682422119E-3 | I16: 444 | J16: =I16/B16 -> 7.1333322622624228E-3 | K16: 18 | L16: =K16/B16 -> 2.8918914576739552E-4 | M16: 805 | N16: =M16/B16 -> 1.2933181241264078E-2 | O16: 146 | P16: =O16/B16 -> 2.3456452934466528E-3 | Q16: 1444 | R16: =Q16/B16 -> 2.3199395916006619E-2
A17: 15 | B17: 62834 | C17: 59798 | D17: =C17/B17 -> 0.95168221026832611 | E17: 1210 | F17: =E17/B17 -> 1.9257090110449758E-2 | G17: 391 | H17: =G17/B17 -> 6.2227456472610373E-3 | I17: 346 | J17: =I17/B17 -> 5.5065728745583601E-3 | K17: 24 | L17: =K17/B17 -> 3.8195881210809432E-4 | M17: 990 | N17: =M17/B17 -> 1.5755800999458891E-2 | O17: 75 | P17: =O17/B17 -> 1.1936212878377948E-3 | Q17: 2038 | R17: =Q17/B17 -> 3.2434669128179008E-2
A18: 16 | B18: 63222 | C18: 44564 | D18: =C18/B18 -> 0.70488121223624689 | E18: 17037 | F18: =E18/B18 -> 0.26947897883648098 | G18: 278 | H18: =G18/B18 -> 4.3972035051089813E-3 | I18: 313 | J18: =I18/B18 -> 4.9508082629464425E-3 | K18: 14 | L18: =K18/B18 -> 2.2144190313498467E-4 | M18: 905 | N18: =M18/B18 -> 1.4314637309797222E-2 | O18: 111 | P18: =O18/B18 -> 1.7557179462845212E-3 | Q18: 1612 | R18: =Q18/B18 -> 2.5497453418113946E-2
A19: 17 | B19: 63576 | C19: 57265 | D19: =C19/B19 -> 0.90073298099911914 | E19: 3890 | F19: =E19/B19 -> 6.1186611299861582E-2 | G19: 317 | H19: =G19/B19 -> 4.9861582987290798E-3 | I19: 1473 | J19: =I19/B19 -> 2.3169120422801056E-2 | K19: 35 | L19: =K19/B19 -> 5.5052220963885739E-4 | M19: 472 | N19: =M19/B19 -> 7.4241852271297341E-3 | O19: 124 | P19: =O19/B19 -> 1.9504215427205234E-3 | Q19: 1309 | R19: =Q19/B19 -> 2.0589530640493268E-2
A20: 18 | B20: 59686 | C20: 52508 | D20: =C20/B20 -> 0.87973729182722915 | E20: 4602 | F20: =E20/B20 -> 7.7103508360419529E-2 | G20: 460 | H20: =G20/B20 -> 7.7069999664913045E-3 | I20: 847 | J20: =I20/B20 -> 1.4190932546995945E-2 | K20: 47 | L20: =K20/B20 -> 7.8745434440237244E-4 | M20: 1096 | N20: =M20/B20 -> 1.8362765137553194E-2 | O20: 126 | P20: =O20/B20 -> 2.1110478169084879E-3 | Q20: 2635 | R20: =Q20/B20 -> 4.4147706329792584E-2
A21: 19 | B21: 62844 | C21: 58171 | D21: =C21/B21 -> 0.92564127044745714 | E21: 3726 | F21: =E21/B21 -> 5.9289669658201261E-2 | G21: 388 | H21: =G21/B21 -> 6.1740182038062504E-3 | I21: 299 | J21: =I21/B21 -> 4.7578129972630639E-3 | K21: 20 | L21: =K21/B21 -> 3.1824836102094077E-4 | M21: 174 | N21: =M21/B21 -> 2.7687607408821845E-3 | O21: 66 | P21: =O21/B21 -> 1.0502195913691045E-3 | Q21: 639 | R21: =Q21/B21 -> 1.0168035134619056E-2
A22: 20 | B22: 62717 | C22: 55842 | D22: =C22/B22 -> 0.89038059856179341 | E22: 5214 | F22: =E22/B22 -> 8.3135354050735841E-2 | G22: 330 | H22: =G22/B22 -> 5.2617312690339145E-3 | I22: 476 | J22: =I22/B22 -> 7.5896487395761911E-3 | K22: 30 | L22: =K22/B22 -> 4.7833920627581039E-4 | M22: 690 | N22: =M22/B22 -> 1.1001801744343639E-2 | O22: 135 | P22: =O22/B22 -> 2.1525264282411466E-3 | Q22: 1608 | R22: =Q22/B22 -> 2.5638981456383436E-2
A23: 21 | B23: 58656 | C23: 34776 | D23: =C23/B23 -> 0.59288052373158762 | E23: 13997 | F23: =E23/B23 -> 0.2386286142935079 | G23: 388 | H23: =G23/B23 -> 6.6148390616475724E-3 | I23: 7696 | J23: =I23/B23 -> 0.13120567375886524 | K23: 93 | L23: =K23/B23 -> 1.5855155482815057E-3 | M23: 1185 | N23: =M23/B23 -> 2.020253682487725E-2 | O23: 521 | P23: =O23/B23 -> 8.8822967812329512E-3 | Q23: 3432 | R23: =Q23/B23 -> 5.8510638297872342E-2
A24: 22 | B24: 61467 | C24: 47057 | D24: =C24/B24 -> 0.76556526266126534 | E24: 12606 | F24: =E24/B24 -> 0.20508565571770218 | G24: 341 | H24: =G24/B24 -> 5.5476922576341778E-3 | I24: 810 | J24: =I24/B24 -> 1.3177802723412563E-2 | K24: 29 | L24: =K24/B24 -> 4.7179787528267201E-4 | M24: 437 | N24: =M24/B24 -> 7.109505913742333E-3 | O24: 187 | P24: =O24/B24 -> 3.0422828509606781E-3 | Q24: 1179 | R24: =Q24/B24 -> 1.9181023964078284E-2
A25: 23 | B25: 64320 | C25: 51834 | D25: =C25/B25 -> 0.80587686567164174 | E25: 9490 | F25: =E25/B25 -> 0.14754353233830847 | G25: 427 | H25: =G25/B25 -> 6.6386815920398013E-3 | I25: 1572 | J25: =I25/B25 -> 2.4440298507462686E-2 | K25: 36 | L25: =K25/B25 -> 5.5970149253731347E-4 | M25: 750 | N25: =M25/B25 -> 1.1660447761194031E-2 | O25: 211 | P25: =O25/B25 -> 3.2804726368159203E-3 | Q25: 1544 | R25: =Q25/B25 -> 2.400497512437811E-2
A26: 24 | B26: 64086 | C26: 56924 | D26: =C26/B26 -> 0.8882439222295041 | E26: 5579 | F26: =E26/B26 -> 8.7054894984864087E-2 | G26: 583 | H26: =G26/B26 -> 9.0971507037418461E-3 | I26: 474 | J26: =I26/B26 -> 7.3963112068158414E-3 | K26: 36 | L26: =K26/B26 -> 5.6174515494803855E-4 | M26: 359 | N26: =M26/B26 -> 5.6018475173984957E-3 | O26: 131 | P26: =O26/B26 -> 2.0441282027275848E-3 | Q26: 989 | R26: =Q26/B26 -> 1.5432387728989172E-2
A27: 25 | B27: 62073 | C27: 57623 | D27: =C27/B27 -> 0.92831021539155512 | E27: 2289 | F27: =E27/B27 -> 3.6875936397467501E-2 | G27: 264 | H27: =G27/B27 -> 4.2530568846358323E-3 | I27: 935 | J27: =I27/B27 -> 1.5062909799751905E-2 | K27: 13 | L27: =K27/B27 -> 2.0943083144040083E-4 | M27: 860 | N27: =M27/B27 -> 1.3854655002980361E-2 | O27: 89 | P27: =O27/B27 -> 1.433795692168898E-3 | Q27: 1748 | R27: =Q27/B27 -> 2.8160391796755432E-2
A28: 26 | B28: 65639 | C28: 56531 | D28: =C28/B28 -> 0.86124103048492517 | E28: 2920 | F28: =E28/B28 -> 4.448574780237359E-2 | G28: 377 | H28: =G28/B28 -> 5.7435366169502891E-3 | I28: 1932 | J28: =I28/B28 -> 2.9433720806228005E-2 | K28: 76 | L28: =K28/B28 -> 1.1578482304727372E-3 | M28: 3595 | N28: =M28/B28 -> 5.4769268270388034E-2 | O28: 208 | P28: =O28/B28 -> 3.1688477886622282E-3 | Q28: 6390 | R28: =Q28/B28 -> 9.7350660430536723E-2
A29: 27 | B29: 59138 | C29: 44311 | D29: =C29/B29 -> 0.74928134194595697 | E29: 10480 | F29: =E29/B29 -> 0.17721262132638912 | G29: 438 | H29: =G29/B29 -> 7.4064053569616829E-3 | I29: 2158 | J29: =I29/B29 -> 3.6490919544117151E-2 | K29: 49 | L29: =K29/B29 -> 8.2857046230849882E-4 | M29: 1382 | N29: =M29/B29 -> 2.3369068957353984E-2 | O29: 320 | P29: =O29/B29 -> 5.4110724069126453E-3 | Q29: 3094 | R29: =Q29/B29 -> 5.2318306334336637E-2
A30: 28 | B30: 58388 | C30: 43126 | D30: =C30/B30 -> 0.73861067342604647 | E30: 10643 | F30: =E30/B30 -> 0.1822806056038912 | G30: 547 | H30: =G30/B30 -> 9.3683633623347258E-3 | I30: 1771 | J30: =I30/B30 -> 3.0331574981160514E-2 | K30: 80 | L30: =K30/B30 -> 1.3701445502500515E-3 | M30: 1855 | N30: =M30/B30 -> 3.1770226758923069E-2 | O30: 366 | P30: =O30/B30 -> 6.268411317393985E-3 | Q30: 4374 | R30: =Q30/B30 -> 7.4912653284921554E-2
A31: 29 | B31: 61209 | C31: 53798 | D31: =C31/B31 -> 0.87892303419431783 | E31: 3689 | F31: =E31/B31 -> 6.0268914702086292E-2 | G31: 389 | H31: =G31/B31 -> 6.3552745511281017E-3 | I31: 931 | J31: =I31/B31 -> 1.5210181509255174E-2 | K31: 30 | L31: =K31/B31 -> 4.9012400137234721E-4 | M31: 2209 | N31: =M31/B31 -> 3.6089463967717166E-2 | O31: 163 | P31: =O31/B31 -> 2.6630070741230864E-3 | Q31: 4051 | R31: =Q31/B31 -> 6.6183077651979283E-2
A32: 30 | B32: 61276 | C32: 48944 | D32: =C32/B32 -> 0.79874665448136306 | E32: 9268 | F32: =E32/B32 -> 0.15125008159801553 | G32: 452 | H32: =G32/B32 -> 7.3764606044780991E-3 | I32: 710 | J32: =I32/B32 -> 1.1586918206149226E-2 | K32: 56 | L32: =K32/B32 -> 9.138977740061362E-4 | M32: 1651 | N32: =M32/B32 -> 2.6943664730073764E-2 | O32: 195 | P32: =O32/B32 -> 3.1823226059142242E-3 | Q32: 3171 | R32: =Q32/B32 -> 5.1749461453097459E-2
A33: 31 | B33: 57646 | C33: 36874 | D33: =C33/B33 -> 0.63966276931617116 | E33: 12364 | F33: =E33/B33 -> 0.2144814904763557 | G33: 509 | H33: =G33/B33 -> 8.8297540158900883E-3 | I33: 3894 | J33: =I33/B33 -> 6.7550220310168968E-2 | K33: 138 | L33: =K33/B33 -> 2.3939215210075286E-3 | M33: 3341 | N33: =M33/B33 -> 5.7957186968740242E-2 | O33: 526 | P33: =O33/B33 -> 9.1246573916663777E-3 | Q33: 7656 | R33: =Q33/B33 -> 0.13281060264372202
A34: 32 | B34: 55263 | C34: 39133 | D34: =C34/B34 -> 0.70812297558945403 | E34: 4398 | F34: =E34/B34 -> 7.9583084523098632E-2 | G34: 228 | H34: =G34/B34 -> 4.125726073503067E-3 | I34: 9364 | J34: =I34/B34 -> 0.16944429365036281 | K34: 51 | L34: =K34/B34 -> 9.2285977959937024E-4 | M34: 1704 | N34: =M34/B34 -> 3.0834373812496606E-2 | O34: 385 | P34: =O34/B34 -> 6.966686571485442E-3 | Q34: 4881 | R34: =Q34/B34 -> 8.8323109494598553E-2
A35: 33 | B35: 57289 | C35: 50926 | D35: =C35/B35 -> 0.88893155754158737 | E35: 2850 | F35: =E35/B35 -> 4.9747770078025451E-2 | G35: 325 | H35: =G35/B35 -> 5.6729913246871128E-3 | I35: 1738 | J35: =I35/B35 -> 3.0337412068634467E-2 | K35: 51 | L35: =K35/B35 -> 8.9022325402782383E-4 | M35: 1225 | N35: =M35/B35 -> 2.1382813454589887E-2 | O35: 174 | P35: =O35/B35 -> 3.0372322784478697E-3 | Q35: 3127 | R35: =Q35/B35 -> 5.458290422245108E-2
A36: 34 | B36: 57978 | C36: 44921 | D36: =C36/B36 -> 0.77479388733657595 | E36: 2037 | F36: =E36/B36 -> 3.5134016351029702E-2 | G36: 193 | H36: =G36/B36 -> 3.3288488737107181E-3 | I36: 9219 | J36: =I36/B36 -> 0.15900858946496946 | K36: 53 | L36: =K36/B36 -> 9.1413984614853905E-4 | M36: 1291 | N36: =M36/B36 -> 2.2267066818448377E-2 | O36: 264 | P36: =O36/B36 -> 4.5534513091172518E-3 | Q36: 3835 | R36: =Q36/B36 -> 6.6145779433578258E-2
A37: 35 | B37: 62283 | C37: 42049 | D37: =C37/B37 -> 0.6751280445707496 | E37: 3119 | F37: =E37/B37 -> 5.0077870365910444E-2 | G37: 252 | H37: =G37/B37 -> 4.0460478782332254E-3 | I37: 13984 | J37: =I37/B37 -> 0.22452354575084693 | K37: 71 | L37: =K37/B37 -> 1.1399579339466629E-3 | M37: 2454 | N37: =M37/B37 -> 3.9400799576128319E-2 | O37: 354 | P37: =O37/B37 -> 5.6837339241847694E-3 | Q37: 6268 | R37: =Q37/B37 -> 0.10063741309827721
A38: 36 | B38: 61859 | C38: 43038 | D38: =C38/B38 -> 0.69574354580578412 | E38: 5383 | F38: =E38/B38 -> 8.7020482064048887E-2 | G38: 309 | H38: =G38/B38 -> 4.9952310900596517E-3 | I38: 10240 | J38: =I38/B38 -> 0.1655377552175108 | K38: 49 | L38: =K38/B38 -> 7.9212402399004189E-4 | M38: 2450 | N38: =M38/B38 -> 3.9606201199502096E-2 | O38: 390 | P38: =O38/B38 -> 6.3046605991044146E-3 | Q38: 6069 | R38: =Q38/B38 -> 9.8110218399909466E-2
A39: 37 | B39: 63940 | C39: 39934 | D39: =C39/B39 -> 0.62455426962777605 | E39: 5211 | F39: =E39/B39 -> 8.1498279637159832E-2 | G39: 375 | H39: =G39/B39 -> 5.8648733187363156E-3 | I39: 15060 | J39: =I39/B39 -> 0.23553331248045042 | K39: 59 | L39: =K39/B39 -> 9.2274006881451357E-4 | M39: 2865 | N39: =M39/B39 -> 4.4807632155145452E-2 | O39: 436 | P39: =O39/B39 -> 6.8188927119174226E-3 | Q39: 7378 | R39: =Q39/B39 -> 0.1153894275883641
A40: 38 | B40: 62394 | C40: 33891 | D40: =C40/B40 -> 0.5431772285796711 | E40: 5881 | F40: =E40/B40 -> 9.4255857935057863E-2 | G40: 577 | H40: =G40/B40 -> 9.2476840721864278E-3 | I40: 12871 | J40: =I40/B40 -> 0.20628586081995062 | K40: 58 | L40: =K40/B40 -> 9.2957656184889574E-4 | M40: 8604 | N40: =M40/B40 -> 0.13789787479565344 | O40: 512 | P40: =O40/B40 -> 8.2059172356316306E-3 | Q40: 18546 | R40: =Q40/B40 -> 0.29724011924223481
A41: 39 | B41: 61474 | C41: 35812 | D41: =C41/B41 -> 0.58255522659986336 | E41: 6894 | F41: =E41/B41 -> 0.11214497185802128 | G41: 436 | H41: =G41/B41 -> 7.0924293197123988E-3 | I41: 12302 | J41: =I41/B41 -> 0.20011712268601359 | K41: 94 | L41: =K41/B41 -> 1.5291017340664345E-3 | M41: 5448 | N41: =M41/B41 -> 8.8622832416956759E-2 | O41: 488 | P41: =O41/B41 -> 7.9383153853661709E-3 | Q41: 11193 | R41: =Q41/B41 -> 0.1820769756319745
A42: 40 | B42: 58415 | C42: 41056 | D42: =C42/B42 -> 0.70283317641016863 | E42: 3843 | F42: =E42/B42 -> 6.5787896944278015E-2 | G42: 314 | H42: =G42/B42 -> 5.3753316785072327E-3 | I42: 10719 | J42: =I42/B42 -> 0.18349738936916887 | K42: 73 | L42: =K42/B42 -> 1.2496790207994523E-3 | M42: 2085 | N42: =M42/B42 -> 3.5692887100915859E-2 | O42: 325 | P42: =O42/B42 -> 5.5636394761619445E-3 | Q42: 5322 | R42: =Q42/B42 -> 9.1106736283488823E-2
A43: 41 | B43: 60650 | C43: 41685 | D43: =C43/B43 -> 0.68730420445177243 | E43: 3495 | F43: =E43/B43 -> 5.7625721352019786E-2 | G43: 276 | H43: =G43/B43 -> 4.5507007419620773E-3 | I43: 12424 | J43: =I43/B43 -> 0.20484748557295959 | K43: 71 | L43: =K43/B43 -> 1.1706512778235779E-3 | M43: 2394 | N43: =M43/B43 -> 3.9472382522671066E-2 | O43: 305 | P43: =O43/B43 -> 5.0288540807914266E-3 | Q43: 6991 | R43: =Q43/B43 -> 0.1152679307502061
A44: 42 | B44: 58066 | C44: 41053 | D44: =C44/B44 -> 0.7070058209623532 | E44: 5682 | F44: =E44/B44 -> 9.7854165949092409E-2 | G44: 344 | H44: =G44/B44 -> 5.9242930458443836E-3 | I44: 9044 | J44: =I44/B44 -> 0.15575379740295525 | K44: 101 | L44: =K44/B44 -> 1.7393999931112872E-3 | M44: 1498 | N44: =M44/B44 -> 2.579822960079909E-2 | O44: 344 | P44: =O44/B44 -> 5.9242930458443836E-3 | Q44: 4910 | R44: =Q44/B44 -> 8.4558950160162571E-2
A45: 43 | B45: 62495 | C45: 39737 | D45: =C45/B45 -> 0.63584286742939433 | E45: 9526 | F45: =E45/B45 -> 0.15242819425554044 | G45: 399 | H45: =G45/B45 -> 6.3845107608608686E-3 | I45: 8633 | J45: =I45/B45 -> 0.13813905112408992 | K45: 75 | L45: =K45/B45 -> 1.2000960076806145E-3 | M45: 3670 | N45: =M45/B45 -> 5.8724697975838069E-2 | O45: 455 | P45: =O45/B45 -> 7.2805824465957273E-3 | Q45: 8756 | R45: =Q45/B45 -> 0.14010720857668613
A46: 44 | B46: 59264 | C46: 34304 | D46: =C46/B46 -> 0.5788336933045356 | E46: 12894 | F46: =E46/B46 -> 0.2175688444924406 | G46: 422 | H46: =G46/B46 -> 7.1206803455723545E-3 | I46: 4432 | J46: =I46/B46 -> 7.4784017278617707E-2 | K46: 79 | L46: =K46/B46 -> 1.3330183585313175E-3 | M46: 6588 | N46: =M46/B46 -> 0.11116360691144708 | O46: 545 | P46: =O46/B46 -> 9.196139308855291E-3 | Q46: 12673 | R46: =Q46/B46 -> 0.21383976781857453
A47: 45 | B47: 67744 | C47: 50884 | D47: =C47/B47 -> 0.75112187057156354 | E47: 8344 | F47: =E47/B47 -> 0.12316957959376476 | G47: 502 | H47: =G47/B47 -> 7.4102503542749177E-3 | I47: 3327 | J47: =I47/B47 -> 4.9111360415682571E-2 | K47: 84 | L47: =K47/B47 -> 1.2399622106754843E-3 | M47: 4179 | N47: =M47/B47 -> 6.1688119981105335E-2 | O47: 424 | P47: =O47/B47 -> 6.2588568729333967E-3 | Q47: 8779 | R47: =Q47/B47 -> 0.1295908124704771
A48: 46 | B48: 66262 | C48: 35868 | D48: =C48/B48 -> 0.54130572575533487 | E48: 18343 | F48: =E48/B48 -> 0.27682532975159219 | G48: 402 | H48: =G48/B48 -> 6.0668256315837129E-3 | I48: 6127 | J48: =I48/B48 -> 9.2466270260481126E-2 | K48: 96 | L48: =K48/B48 -> 1.4487941806767075E-3 | M48: 4771 | N48: =M48/B48 -> 7.200205245842263E-2 | O48: 655 | P48: =O48/B48 -> 9.8850019619087862E-3 | Q48: 10253 | R48: =Q48/B48 -> 0.15473423681748211
A49: 47 | B49: 67270 | C49: 53379 | D49: =C49/B49 -> 0.79350379069421728 | E49: 3487 | F49: =E49/B49 -> 5.1835885238590756E-2 | G49: 471 | H49: =G49/B49 -> 7.0016352014270851E-3 | I49: 6772 | J49: =I49/B49 -> 0.1006689460383529 | K49: 70 | L49: =K49/B49 -> 1.0405827263267431E-3 | M49: 2736 | N49: =M49/B49 -> 4.06719191318567E-2 | O49: 355 | P49: =O49/B49 -> 5.2772409692284821E-3 | Q49: 6983 | R49: =Q49/B49 -> 0.10380555968485208
A50: 48 | B50: 66518 | C50: 53318 | D50: =C50/B50 -> 0.80155747316515835 | E50: 3148 | F50: =E50/B50 -> 4.7325535945157704E-2 | G50: 336 | H50: =G50/B50 -> 5.0512643194323345E-3 | I50: 8219 | J50: =I50/B50 -> 0.12356054000420939 | K50: 70 | L50: =K50/B50 -> 1.0523467332150696E-3 | M50: 1092 | N50: =M50/B50 -> 1.6416609038155085E-2 | O50: 335 | P50: =O50/B50 -> 5.036230794672119E-3 | Q50: 4421 | R50: =Q50/B50 -> 6.6463212964911755E-2
A51: 49 | B51: 65025 | C51: 35847 | D51: =C51/B51 -> 0.55128027681660896 | E51: 10334 | F51: =E51/B51 -> 0.15892349096501346 | G51: 618 | H51: =G51/B51 -> 9.5040369088811999E-3 | I51: 8510 | J51: =I51/B51 -> 0.13087274125336409 | K51: 104 | L51: =K51/B51 -> 1.5993848519800077E-3 | M51: 8862 | N51: =M51/B51 -> 0.13628604382929643 | O51: 750 | P51: =O51/B51 -> 1.1534025374855825E-2 | Q51: 17646 | R51: =Q51/B51 -> 0.27137254901960783
A52: 50 | B52: 55689 | C52: 35574 | D52: =C52/B52 -> 0.63879760814523512 | E52: 7997 | F52: =E52/B52 -> 0.14360107022930921 | G52: 438 | H52: =G52/B52 -> 7.8651080105586382E-3 | I52: 4492 | J52: =I52/B52 -> 8.0662249277236073E-2 | K52: 90 | L52: =K52/B52 -> 1.616118084361364E-3 | M52: 6642 | N52: =M52/B52 -> 0.11926951462586867 | O52: 456 | P52: =O52/B52 -> 8.1883316274309111E-3 | Q52: 13405 | R52: =Q52/B52 -> 0.24071181023182317
A53: 51 | B53: 57711 | C53: 41050 | D53: =C53/B53 -> 0.71130287120306357 | E53: 8915 | F53: =E53/B53 -> 0.15447661624300393 | G53: 556 | H53: =G53/B53 -> 9.6342118486943563E-3 | I53: 3943 | J53: =I53/B53 -> 6.8323196617629228E-2 | K53: 96 | L53: =K53/B53 -> 1.6634610386234859E-3 | M53: 2731 | N53: =M53/B53 -> 4.7322001005007712E-2 | O53: 420 | P53: =O53/B53 -> 7.2776420439777511E-3 | Q53: 6816 | R53: =Q53/B53 -> 0.1181057337422675
A54: 52 | B54: 56601 | C54: 26716 | D54: =C54/B54 -> 0.47200579495061923 | E54: 16480 | F54: =E54/B54 -> 0.29116093355241074 | G54: 677 | H54: =G54/B54 -> 1.1960919418384834E-2 | I54: 4381 | J54: =I54/B54 -> 7.7401459338174231E-2 | K54: 88 | L54: =K54/B54 -> 1.5547428490662709E-3 | M54: 7519 | N54: =M54/B54 -> 0.1328421759332874 | O54: 740 | P54: =O54/B54 -> 1.3073973958057278E-2 | Q54: 14553 | R54: =Q54/B54 -> 0.25711559866433453
A55: 53 | B55: 63038 | C55: 39618 | D55: =C55/B55 -> 0.62847806085218438 | E55: 3302 | F55: =E55/B55 -> 5.2381103461404233E-2 | G55: 436 | H55: =G55/B55 -> 6.916463085757797E-3 | I55: 13552 | J55: =I55/B55 -> 0.21498143976649006 | K55: 51 | L55: =K55/B55 -> 8.0903581966432941E-4 | M55: 5630 | N55: =M55/B55 -> 8.9311209111964218E-2 | O55: 449 | P55: =O55/B55 -> 7.122687902534979E-3 | Q55: 12225 | R55: =Q55/B55 -> 0.1939306450077731
A56: 54 | B56: 57288 | C56: 42886 | D56: =C56/B56 -> 0.7486035469906438 | E56: 10139 | F56: =E56/B56 -> 0.17698296327328586 | G56: 437 | H56: =G56/B56 -> 7.6281245636084342E-3 | I56: 1636 | J56: =I56/B56 -> 2.8557464041335009E-2 | K56: 83 | L56: =K56/B56 -> 1.4488199972070941E-3 | M56: 1801 | N56: =M56/B56 -> 3.1437648373132246E-2 | O56: 306 | P56: =O56/B56 -> 5.3414327607875997E-3 | Q56: 3936 | R56: =Q56/B56 -> 6.8705488060326766E-2
A57: 55 | B57: 59680 | C57: 47737 | D57: =C57/B57 -> 0.79988270777479897 | E57: 9978 | F57: =E57/B57 -> 0.1671916890080429 | G57: 459 | H57: =G57/B57 -> 7.6910187667560319E-3 | I57: 765 | J57: =I57/B57 -> 1.2818364611260053E-2 | K57: 31 | L57: =K57/B57 -> 5.1943699731903483E-4 | M57: 502 | N57: =M57/B57 -> 8.411528150134049E-3 | O57: 208 | P57: =O57/B57 -> 3.4852546916890078E-3 | Q57: 1335 | R57: =Q57/B57 -> 2.2369302949061663E-2
A58: 56 | B58: 58745 | C58: 46976 | D58: =C58/B58 -> 0.79965954549323348 | E58: 7644 | F58: =E58/B58 -> 0.13012171248616902 | G58: 315 | H58: =G58/B58 -> 5.3621584815729002E-3 | I58: 3233 | J58: =I58/B58 -> 5.5034471018810115E-2 | K58: 37 | L58: =K58/B58 -> 6.2984083751808668E-4 | M58: 350 | N58: =M58/B58 -> 5.9579538684143328E-3 | O58: 190 | P58: =O58/B58 -> 3.2343178142820667E-3 | Q58: 1142 | R58: =Q58/B58 -> 1.9439952336369054E-2
A59: 57 | B59: 67910 | C59: 48916 | D59: =C59/B59 -> 0.72030628773376526 | E59: 10804 | F59: =E59/B59 -> 0.15909291709615667 | G59: 397 | H59: =G59/B59 -> 5.8459726108084226E-3 | I59: 5609 | J59: =I59/B59 -> 8.2594610513915478E-2 | K59: 52 | L59: =K59/B59 -> 7.6571933441319396E-4 | M59: 1810 | N59: =M59/B59 -> 2.6652922986305404E-2 | O59: 322 | P59: =O59/B59 -> 4.741569724635547E-3 | Q59: 4176 | R59: =Q59/B59 -> 6.149315270210573E-2
A60: 58 | B60: 61021 | C60: 54599 | D60: =C60/B60 -> 0.89475754248537387 | E60: 4205 | F60: =E60/B60 -> 6.8910702872781504E-2 | G60: 312 | H60: =G60/B60 -> 5.1129938873502563E-3 | I60: 1055 | J60: =I60/B60 -> 1.7289129971649105E-2 | K60: 31 | L60: =K60/B60 -> 5.0802182855082679E-4 | M60: 693 | N60: =M60/B60 -> 1.1356746038249127E-2 | O60: 126 | P60: =O60/B60 -> 2.0648629160452958E-3 | Q60: 1524 | R60: =Q60/B60 -> 2.4975008603595483E-2
A61: 59 | B61: 62208 | C61: 48415 | D61: =C61/B61 -> 0.77827610596707819 | E61: 12466 | F61: =E61/B61 -> 0.20039223251028807 | G61: 360 | H61: =G61/B61 -> 5.7870370370370367E-3 | I61: 387 | J61: =I61/B61 -> 6.2210648148148147E-3 | K61: 38 | L61: =K61/B61 -> 6.1085390946502061E-4 | M61: 396 | N61: =M61/B61 -> 6.3657407407407404E-3 | O61: 146 | P61: =O61/B61 -> 2.3469650205761318E-3 | Q61: 941 | R61: =Q61/B61 -> 1.5126671810699589E-2
A62: 60 | B62: 62712 | C62: 41036 | D62: =C62/B62 -> 0.65435642301313945 | E62: 20399 | F62: =E62/B62 -> 0.32528064804184209 | G62: 349 | H62: =G62/B62 -> 5.5651231024365349E-3 | I62: 333 | J62: =I62/B62 -> 5.3099885189437429E-3 | K62: 22 | L62: =K62/B62 -> 3.5081005230258962E-4 | M62: 425 | N62: =M62/B62 -> 6.7770123740272994E-3 | O62: 148 | P62: =O62/B62 -> 2.3599948973083303E-3 | Q62: 927 | R62: =Q62/B62 -> 1.4781859931113663E-2
A63: 61 | B63: 63124 | C63: 40213 | D63: =C63/B63 -> 0.63704771560737594 | E63: 21311 | F63: =E63/B63 -> 0.33760534820353588 | G63: 404 | H63: =G63/B63 -> 6.4001013877447565E-3 | I63: 280 | J63: =I63/B63 -> 4.4357138330904256E-3 | K63: 22 | L63: =K63/B63 -> 3.4852037259996196E-4 | M63: 699 | N63: =M63/B63 -> 1.1073442747607883E-2 | O63: 195 | P63: =O63/B63 -> 3.0891578480451176E-3 | Q63: 1429 | R63: =Q63/B63 -> 2.2637982383879349E-2
A64: 62 | B64: 60977 | C64: 42274 | D64: =C64/B64 -> 0.69327779326631356 | E64: 13756 | F64: =E64/B64 -> 0.22559325647375239 | G64: 592 | H64: =G64/B64 -> 9.708578644406907E-3 | I64: 1644 | J64: =I64/B64 -> 2.6960985289535399E-2 | K64: 88 | L64: =K64/B64 -> 1.443167095790216E-3 | M64: 2281 | N64: =M64/B64 -> 3.7407547107925938E-2 | O64: 342 | P64: =O64/B64 -> 5.6086721222756118E-3 | Q64: 4426 | R64: =Q64/B64 -> 7.2584745067812456E-2
A65: 63 | B65: 61428 | C65: 22558 | D65: =C65/B65 -> 0.36722667187601743 | E65: 36553 | F65: =E65/B65 -> 0.59505437259881488 | G65: 327 | H65: =G65/B65 -> 5.3233053330728657E-3 | I65: 636 | J65: =I65/B65 -> 1.0353584684508694E-2 | K65: 56 | L65: =K65/B65 -> 9.1163638731523084E-4 | M65: 918 | N65: =M65/B65 -> 1.4944325063488962E-2 | O65: 380 | P65: =O65/B65 -> 6.1861040567819233E-3 | Q65: 2045 | R65: =Q65/B65 -> 3.3291007358207982E-2
A66: 64 | B66: 61765 | C66: 45211 | D66: =C66/B66 -> 0.73198413340888857 | E66: 14940 | F66: =E66/B66 -> 0.24188456245446449 | G66: 427 | H66: =G66/B66 -> 6.913300412855177E-3 | I66: 609 | J66: =I66/B66 -> 9.8599530478426286E-3 | K66: 37 | L66: =K66/B66 -> 5.9904476645349309E-4 | M66: 330 | N66: =M66/B66 -> 5.3428317008014248E-3 | O66: 211 | P66: =O66/B66 -> 3.4161742086942443E-3 | Q66: 944 | R66: =Q66/B66 -> 1.5283736744110743E-2
A67: 65 | B67: 59022 | C67: 48308 | D67: =C67/B67 -> 0.81847446714784322 | E67: 8508 | F67: =E67/B67 -> 0.14414963911761716 | G67: 281 | H67: =G67/B67 -> 4.7609365999118974E-3 | I67: 1406 | J67: =I67/B67 -> 2.3821625834434618E-2 | K67: 23 | L67: =K67/B67 -> 3.8968520212802007E-4 | M67: 351 | N67: =M67/B67 -> 5.9469350411710887E-3 | O67: 145 | P67: =O67/B67 -> 2.4567110568940397E-3 | Q67: 1144 | R67: =Q67/B67 -> 1.9382603097150217E-2
A68: 66 | B68: 58483 | C68: 45645 | D68: =C68/B68 -> 0.78048321734521142 | E68: 9400 | F68: =E68/B68 -> 0.16073046868320709 | G68: 372 | H68: =G68/B68 -> 6.3608228032077697E-3 | I68: 1781 | J68: =I68/B68 -> 3.0453294119658705E-2 | K68: 58 | L68: =K68/B68 -> 9.9174118974744798E-4 | M68: 980 | N68: =M68/B68 -> 1.6757006309525844E-2 | O68: 247 | P68: =O68/B68 -> 4.2234495494417185E-3 | Q68: 2278 | R68: =Q68/B68 -> 3.8951490176632526E-2
A69: 67 | B69: 57154 | C69: 39122 | D69: =C69/B69 -> 0.6845015222031704 | E69: 3270 | F69: =E69/B69 -> 5.7213843300556393E-2 | G69: 236 | H69: =G69/B69 -> 4.1291948070126322E-3 | I69: 12121 | J69: =I69/B69 -> 0.21207614515169543 | K69: 89 | L69: =K69/B69 -> 1.5571963467123911E-3 | M69: 2056 | N69: =M69/B69 -> 3.5972985267872765E-2 | O69: 260 | P69: =O69/B69 -> 4.5491129229800189E-3 | Q69: 5329 | R69: =Q69/B69 -> 9.3239318332925078E-2
A70: 68 | B70: 63749 | C70: 54635 | D70: =C70/B70 -> 0.85703305149884701 | E70: 5711 | F70: =E70/B70 -> 8.9585718991670463E-2 | G70: 274 | H70: =G70/B70 -> 4.2981066369668546E-3 | I70: 2207 | J70: =I70/B70 -> 3.4620150904327913E-2 | K70: 32 | L70: =K70/B70 -> 5.0196865833189539E-4 | M70: 679 | N70: =M70/B70 -> 1.0651147468979905E-2 | O70: 211 | P70: =O70/B70 -> 3.3098558408759353E-3 | Q70: 1814 | R70: =Q70/B70 -> 2.8455348319189319E-2
A71: 69 | B71: 61663 | C71: 19886 | D71: =C71/B71 -> 0.32249485104519726 | E71: 35092 | F71: =E71/B71 -> 0.56909329743930726 | G71: 402 | H71: =G71/B71 -> 6.5193065533626325E-3 | I71: 1178 | J71: =I71/B71 -> 1.9103838606619853E-2 | K71: 67 | L71: =K71/B71 -> 1.0865510922271053E-3 | M71: 4515 | N71: =M71/B71 -> 7.3220569871722097E-2 | O71: 523 | P71: =O71/B71 -> 8.4815853915638229E-3 | Q71: 6766 | R71: =Q71/B71 -> 0.10972544313445665
A72: 70 | B72: 59137 | C72: 18524 | D72: =C72/B72 -> 0.31323875069753288 | E72: 34811 | F72: =E72/B72 -> 0.58865008370394167 | G72: 446 | H72: =G72/B72 -> 7.5418096961293269E-3 | I72: 1304 | J72: =I72/B72 -> 2.2050492923212203E-2 | K72: 58 | L72: =K72/B72 -> 9.8077345824103355E-4 | M72: 3471 | N72: =M72/B72 -> 5.8694218509562544E-2 | O72: 523 | P72: =O72/B72 -> 8.8438710113803547E-3 | Q72: 5416 | R72: =Q72/B72 -> 9.1583949135059267E-2
A73: 71 | B73: 65964 | C73: 24495 | D73: =C73/B73 -> 0.3713389121338912 | E73: 36110 | F73: =E73/B73 -> 0.54741980474198049 | G73: 320 | H73: =G73/B73 -> 4.8511309198957008E-3 | I73: 3249 | J73: =I73/B73 -> 4.9254138621066035E-2 | K73: 40 | L73: =K73/B73 -> 6.063913649869626E-4 | M73: 1130 | N73: =M73/B73 -> 1.7130556060881694E-2 | O73: 620 | P73: =O73/B73 -> 9.3990661572979205E-3 | Q73: 2473 | R73: =Q73/B73 -> 3.749014614031896E-2
A74: 72 | B74: 62060 | C74: 46973 | D74: =C74/B74 -> 0.75689655172413794 | E74: 8383 | F74: =E74/B74 -> 0.13507895584917823 | G74: 282 | H74: =G74/B74 -> 4.5439896873992911E-3 | I74: 4808 | J74: =I74/B74 -> 7.7473412826297133E-2 | K74: 36 | L74: =K74/B74 -> 5.8008378988076053E-4 | M74: 1316 | N74: =M74/B74 -> 2.1205285207863359E-2 | O74: 262 | P74: =O74/B74 -> 4.2217209152433125E-3 | Q74: 2880 | R74: =Q74/B74 -> 4.6406703190460842E-2
A75: 73 | B75: 63854 | C75: 48810 | D75: =C75/B75 -> 0.76440003758574249 | E75: 6991 | F75: =E75/B75 -> 0.10948413568453033 | G75: 317 | H75: =G75/B75 -> 4.9644501519090422E-3 | I75: 5713 | J75: =I75/B75 -> 8.9469727816581579E-2 | K75: 36 | L75: =K75/B75 -> 5.6378613712531711E-4 | M75: 1652 | N75: =M75/B75 -> 2.5871519403639551E-2 | O75: 335 | P75: =O75/B75 -> 5.2463432204717013E-3 | Q75: 3621 | R75: =Q75/B75 -> 5.6707488959188146E-2
A76: 74 | B76: 60498 | C76: 22016 | D76: =C76/B76 -> 0.36391285662335943 | E76: 35023 | F76: =E76/B76 -> 0.57891169956031607 | G76: 797 | H76: =G76/B76 -> 1.3173989222784224E-2 | I76: 1287 | J76: =I76/B76 -> 2.1273430526628979E-2 | K76: 36 | L76: =K76/B76 -> 5.9506099375185957E-4 | M76: 906 | N76: =M76/B76 -> 1.4975701676088466E-2 | O76: 433 | P76: =O76/B76 -> 7.1572613970709775E-3 | Q76: 1779 | R76: =Q76/B76 -> 2.940593077457106E-2
A77: 75 | B77: 63534 | C77: 27099 | D77: =C77/B77 -> 0.42652752856738124 | E77: 35092 | F77: =E77/B77 -> 0.55233418327194883 | G77: 272 | H77: =G77/B77 -> 4.2811722857052916E-3 | I77: 282 | J77: =I77/B77 -> 4.4385683256209273E-3 | K77: 18 | L77: =K77/B77 -> 2.8331287184814433E-4 | M77: 587 | N77: =M77/B77 -> 9.2391475430478164E-3 | O77: 184 | P77: =O77/B77 -> 2.8960871344476972E-3 | Q77: 1151 | R77: =Q77/B77 -> 1.8116284194289671E-2
A78: 76 | B78: 59747 | C78: 41918 | D78: =C78/B78 -> 0.70159171171774315 | E78: 15023 | F78: =E78/B78 -> 0.25144358712571341 | G78: 386 | H78: =G78/B78 -> 6.4605754263812407E-3 | I78: 1701 | J78: =I78/B78 -> 2.847004870537433E-2 | K78: 46 | L78: =K78/B78 -> 7.6991313371382669E-4 | M78: 424 | N78: =M78/B78 -> 7.0965906237970104E-3 | O78: 249 | P78: =O78/B78 -> 4.1675732672770182E-3 | Q78: 1460 | R78: =Q78/B78 -> 2.4436373374395366E-2
A79: 77 | B79: 57841 | C79: 21046 | D79: =C79/B79 -> 0.36385954599678427 | E79: 33997 | F79: =E79/B79 -> 0.58776646323542125 | G79: 386 | H79: =G79/B79 -> 6.6734669179301879E-3 | I79: 914 | J79: =I79/B79 -> 1.5801939800487542E-2 | K79: 59 | L79: =K79/B79 -> 1.0200376895281894E-3 | M79: 1038 | N79: =M79/B79 -> 1.7945747825936619E-2 | O79: 401 | P79: =O79/B79 -> 6.9327985339119307E-3 | Q79: 2231 | R79: =Q79/B79 -> 3.8571255683684587E-2
A80: 78 | B80: 60478 | C80: 46153 | D80: =C80/B80 -> 0.76313700849895827 | E80: 10358 | F80: =E80/B80 -> 0.17126889116703595 | G80: 438 | H80: =G80/B80 -> 7.2423029862098611E-3 | I80: 2599 | J80: =I80/B80 -> 4.2974304705843444E-2 | K80: 68 | L80: =K80/B80 -> 1.1243758060782434E-3 | M80: 578 | N80: =M80/B80 -> 9.5571943516650684E-3 | O80: 284 | P80: =O80/B80 -> 4.6959224842091337E-3 | Q80: 2127 | R80: =Q80/B80 -> 3.5169813816594467E-2
A81: 79 | B81: 67363 | C81: 42471 | D81: =C81/B81 -> 0.63047964015854396 | E81: 19261 | F81: =E81/B81 -> 0.2859284770571382 | G81: 675 | H81: =G81/B81 -> 1.0020337574039161E-2 | I81: 2305 | J81: =I81/B81 -> 3.421759719727447E-2 | K81: 162 | L81: =K81/B81 -> 2.4048810177693986E-3 | M81: 1404 | N81: =M81/B81 -> 2.0842302154001454E-2 | O81: 1085 | P81: =O81/B81 -> 1.6106764841233318E-2 | Q81: 4593 | R81: =Q81/B81 -> 6.8182830337128686E-2
A82: 80 | B82: 60871 | C82: 23739 | D82: =C82/B82 -> 0.38998866455290698 | E82: 34268 | F82: =E82/B82 -> 0.56296101591891046 | G82: 383 | H82: =G82/B82 -> 6.2919945458428479E-3 | I82: 1165 | J82: =I82/B82 -> 1.9138834584613362E-2 | K82: 91 | L82: =K82/B82 -> 1.4949647615449064E-3 | M82: 755 | N82: =M82/B82 -> 1.2403279065564883E-2 | O82: 470 | P82: =O82/B82 -> 7.7212465706165499E-3 | Q82: 1833 | R82: =Q82/B82 -> 3.0112861625404545E-2
A83: 81 | B83: 59765 | C83: 44727 | D83: =C83/B83 -> 0.74838115954153772 | E83: 11127 | F83: =E83/B83 -> 0.18617920187400652 | G83: 560 | H83: =G83/B83 -> 9.3700326277921867E-3 | I83: 1830 | J83: =I83/B83 -> 3.061992805153518E-2 | K83: 97 | L83: =K83/B83 -> 1.6230235087425751E-3 | M83: 1077 | N83: =M83/B83 -> 1.8020580607378902E-2 | O83: 347 | P83: =O83/B83 -> 5.8060737890069441E-3 | Q83: 2880 | R83: =Q83/B83 -> 4.8188739228645527E-2
A84: 82 | B84: 63348 | C84: 53757 | D84: =C84/B84 -> 0.84859821935972723 | E84: 5786 | F84: =E84/B84 -> 9.1336743070025886E-2 | G84: 464 | H84: =G84/B84 -> 7.3246195617856918E-3 | I84: 1932 | J84: =I84/B84 -> 3.0498200416745596E-2 | K84: 98 | L84: =K84/B84 -> 1.5470101660668056E-3 | M84: 993 | N84: =M84/B84 -> 1.5675317294942225E-2 | O84: 318 | P84: =O84/B84 -> 5.0198901307065731E-3 | Q84: 2843 | R84: =Q84/B84 -> 4.487908063395845E-2
A85: 83 | B85: 62818 | C85: 47638 | D85: =C85/B85 -> 0.75834951765417558 | E85: 9500 | F85: =E85/B85 -> 0.15123053901747907 | G85: 539 | H85: =G85/B85 -> 8.5803432137285494E-3 | I85: 3260 | J85: =I85/B85 -> 5.1895953389155973E-2 | K85: 106 | L85: =K85/B85 -> 1.6874144353529244E-3 | M85: 1359 | N85: =M85/B85 -> 2.1633926581553057E-2 | O85: 416 | P85: =O85/B85 -> 6.622305708554873E-3 | Q85: 3476 | R85: =Q85/B85 -> 5.5334458276290237E-2
A86: 84 | B86: 58742 | C86: 39207 | D86: =C86/B86 -> 0.66744407749140311 | E86: 12012 | F86: =E86/B86 -> 0.20448741956351504 | G86: 443 | H86: =G86/B86 -> 7.5414524530999965E-3 | I86: 5126 | J86: =I86/B86 -> 8.7262946443771069E-2 | K86: 162 | L86: =K86/B86 -> 2.7578223417656874E-3 | M86: 1333 | N86: =M86/B86 -> 2.2692451738109021E-2 | O86: 459 | P86: =O86/B86 -> 7.813829968336114E-3 | Q86: 3917 | R86: =Q86/B86 -> 6.6681420448741952E-2
A87: 85 | B87: 61501 | C87: 42803 | D87: =C87/B87 -> 0.69597242321263064 | E87: 11486 | F87: =E87/B87 -> 0.18676119087494511 | G87: 520 | H87: =G87/B87 -> 8.4551470707793369E-3 | I87: 4783 | J87: =I87/B87 -> 7.7771093152956869E-2 | K87: 134 | L87: =K87/B87 -> 2.1788263605469829E-3 | M87: 1304 | N87: =M87/B87 -> 2.1202907269800491E-2 | O87: 471 | P87: =O87/B87 -> 7.6584120583405146E-3 | Q87: 3451 | R87: =Q87/B87 -> 5.611290873319133E-2
A88: 86 | B88: 59286 | C88: 34944 | D88: =C88/B88 -> 0.58941402692035216 | E88: 4930 | F88: =E88/B88 -> 8.3156225753128907E-2 | G88: 371 | H88: =G88/B88 -> 6.2578011672232902E-3 | I88: 12153 | J88: =I88/B88 -> 0.20498937354518773 | K88: 49 | L88: =K88/B88 -> 8.2650204095401948E-4 | M88: 6349 | N88: =M88/B88 -> 0.10709105016361367 | O88: 490 | P88: =O88/B88 -> 8.2650204095401948E-3 | Q88: 12059 | R88: =Q88/B88 -> 0.20340383901764328
A89: 87 | B89: 55787 | C89: 32124 | D89: =C89/B89 -> 0.57583307939125605 | E89: 4831 | F89: =E89/B89 -> 8.6597235915177373E-2 | G89: 295 | H89: =G89/B89 -> 5.2879703156649398E-3 | I89: 14180 | J89: =I89/B89 -> 0.25418108161399611 | K89: 66 | L89: =K89/B89 -> 1.1830713248606305E-3 | M89: 3853 | N89: =M89/B89 -> 6.9066269919515297E-2 | O89: 438 | P89: =O89/B89 -> 7.8512915195296396E-3 | Q89: 7895 | R89: =Q89/B89 -> 0.14152042590567696
A90: 88 | B90: 58315 | C90: 45076 | D90: =C90/B90 -> 0.77297436337134529 | E90: 8248 | F90: =E90/B90 -> 0.14143873788905084 | G90: 415 | H90: =G90/B90 -> 7.116522335591186E-3 | I90: 1790 | J90: =I90/B90 -> 3.0695361399296923E-2 | K90: 89 | L90: =K90/B90 -> 1.5261939466689532E-3 | M90: 2357 | N90: =M90/B90 -> 4.0418417216839579E-2 | O90: 340 | P90: =O90/B90 -> 5.8304038412072363E-3 | Q90: 4541 | R90: =Q90/B90 -> 7.7870187773300181E-2
A91: 89 | B91: 61863 | C91: 24233 | D91: =C91/B91 -> 0.39172041446421935 | E91: 33607 | F91: =E91/B91 -> 0.54324879168485196 | G91: 413 | H91: =G91/B91 -> 6.676042222329987E-3 | I91: 1931 | J91: =I91/B91 -> 3.1214134458400013E-2 | K91: 88 | L91: =K91/B91 -> 1.4224981006417407E-3 | M91: 1009 | N91: =M91/B91 -> 1.6310233903949048E-2 | O91: 582 | P91: =O91/B91 -> 9.4078851656078759E-3 | Q91: 2629 | R91: =Q91/B91 -> 4.2497130756672004E-2
A92: 90 | B92: 60322 | C92: 20443 | D92: =C92/B92 -> 0.33889791452538048 | E92: 34864 | F92: =E92/B92 -> 0.57796492158748047 | G92: 423 | H92: =G92/B92 -> 7.0123669639600809E-3 | I92: 2554 | J92: =I92/B92 -> 4.2339444978614769E-2 | K92: 78 | L92: =K92/B92 -> 1.2930605749146248E-3 | M92: 1289 | N92: =M92/B92 -> 2.1368654885448094E-2 | O92: 671 | P92: =O92/B92 -> 1.1123636484201452E-2 | Q92: 3177 | R92: =Q92/B92 -> 5.2667351878253374E-2
A93: 91 | B93: 59295 | C93: 42104 | D93: =C93/B93 -> 0.71007673496922163 | E93: 12802 | F93: =E93/B93 -> 0.21590353318154987 | G93: 487 | H93: =G93/B93 -> 8.2131714309806904E-3 | I93: 2534 | J93: =I93/B93 -> 4.2735475166540179E-2 | K93: 104 | L93: =K93/B93 -> 1.7539421536385867E-3 | M93: 802 | N93: =M93/B93 -> 1.3525592377097563E-2 | O93: 462 | P93: =O93/B93 -> 7.791550720971414E-3 | Q93: 2238 | R93: =Q93/B93 -> 3.7743485960030354E-2
A94: 92 | B94: 61162 | C94: 19570 | D94: =C94/B94 -> 0.31996991596089075 | E94: 38241 | F94: =E94/B94 -> 0.62524116281351161 | G94: 453 | H94: =G94/B94 -> 7.4065596285275174E-3 | I94: 1228 | J94: =I94/B94 -> 2.007782610117393E-2 | K94: 65 | L94: =K94/B94 -> 1.062751381576796E-3 | M94: 765 | N94: =M94/B94 -> 1.2507766260096137E-2 | O94: 840 | P94: =O94/B94 -> 1.3734017854223211E-2 | Q94: 2234 | R94: =Q94/B94 -> 3.6525947483731731E-2
A95: 93 | B95: 62782 | C95: 43758 | D95: =C95/B95 -> 0.69698321174859035 | E95: 13299 | F95: =E95/B95 -> 0.2118282310216304 | G95: 420 | H95: =G95/B95 -> 6.6898155522283455E-3 | I95: 3229 | J95: =I95/B95 -> 5.1431939090822207E-2 | K95: 138 | L95: =K95/B95 -> 2.1980822528750278E-3 | M95: 1426 | N95: =M95/B95 -> 2.2713516613041954E-2 | O95: 512 | P95: =O95/B95 -> 8.1552037208116983E-3 | Q95: 3625 | R95: =Q95/B95 -> 5.7739479468637507E-2
A96: 94 | B96: 62412 | C96: 44092 | D96: =C96/B96 -> 0.70646670512081011 | E96: 13120 | F96: =E96/B96 -> 0.2102159841056207 | G96: 528 | H96: =G96/B96 -> 8.4599115554701027E-3 | I96: 2350 | J96: =I96/B96 -> 3.765301544574761E-2 | K96: 105 | L96: =K96/B96 -> 1.6823687752355316E-3 | M96: 1699 | N96: =M96/B96 -> 2.7222329039287316E-2 | O96: 518 | P96: =O96/B96 -> 8.2996859578286231E-3 | Q96: 3895 | R96: =Q96/B96 -> 6.2407870281356151E-2
A97: 95 | B97: 58866 | C97: 20485 | D97: =C97/B97 -> 0.34799374851357318 | E97: 34024 | F97: =E97/B97 -> 0.57799069072129927 | G97: 445 | H97: =G97/B97 -> 7.5595420106682977E-3 | I97: 1544 | J97: =I97/B97 -> 2.6229062616790678E-2 | K97: 94 | L97: =K97/B97 -> 1.5968470764108314E-3 | M97: 1514 | N97: =M97/B97 -> 2.5719430571127647E-2 | O97: 760 | P97: =O97/B97 -> 1.2910678490130126E-2 | Q97: 3613 | R97: =Q97/B97 -> 6.1376686032684404E-2
A98: 96 | B98: 61108 | C98: 49486 | D98: =C98/B98 -> 0.80981213589055445 | E98: 8373 | F98: =E98/B98 -> 0.13701970282123455 | G98: 355 | H98: =G98/B98 -> 5.8093866596844934E-3 | I98: 1827 | J98: =I98/B98 -> 2.9897885710545264E-2 | K98: 72 | L98: =K98/B98 -> 1.1782418014007986E-3 | M98: 725 | N98: =M98/B98 -> 1.1864240361327485E-2 | O98: 270 | P98: =O98/B98 -> 4.4184067552529944E-3 | Q98: 2120 | R98: =Q98/B98 -> 3.4692675263467955E-2
A99: 97 | B99: 60024 | C99: 51473 | D99: =C99/B99 -> 0.85754031720645074 | E99: 6497 | F99: =E99/B99 -> 0.10824003731840597 | G99: 714 | H99: =G99/B99 -> 1.1895241903238705E-2 | I99: 802 | J99: =I99/B99 -> 1.3361322137811542E-2 | K99: 30 | L99: =K99/B99 -> 4.9980007996801279E-4 | M99: 349 | N99: =M99/B99 -> 5.8143409302945492E-3 | O99: 159 | P99: =O99/B99 -> 2.6489404238304679E-3 | Q99: 969 | R99: =Q99/B99 -> 1.6143542582966814E-2
A100: 98 | B100: 62740 | C100: 50614 | D100: =C100/B100 -> 0.80672617150143444 | E100: 10318 | F100: =E100/B100 -> 0.16445648708957603 | G100: 624 | H100: =G100/B100 -> 9.9458080969078745E-3 | I100: 502 | J100: =I100/B100 -> 8.0012751036021672E-3 | K100: 36 | L100: =K100/B100 -> 5.7379662097545422E-4 | M100: 446 | N100: =M100/B100 -> 7.1087025820847942E-3 | O100: 200 | P100: =O100/B100 -> 3.1877590054191903E-3 | Q100: 1205 | R100: =Q100/B100 -> 1.9206248007650622E-2
A101: 99 | B101: 63534 | C101: 46161 | D101: =C101/B101 -> 0.72655585985456606 | E101: 15274 | F101: =E101/B101 -> 0.24040671136714201 | G101: 525 | H101: =G101/B101 -> 8.2632920955708761E-3 | I101: 520 | J101: =I101/B101 -> 8.1845940756130574E-3 | K101: 33 | L101: =K101/B101 -> 5.1940693172159791E-4 | M101: 804 | N101: =M101/B101 -> 1.2654641609217112E-2 | O101: 217 | P101: =O101/B101 -> 3.4154940661692951E-3 | Q101: 1916 | R101: =Q101/B101 -> 3.0157081247835803E-2
A102: 100 | B102: 62236 | C102: 40399 | D102: =C102/B102 -> 0.64912590783469371 | E102: 17560 | F102: =E102/B102 -> 0.2821518092422392 | G102: 649 | H102: =G102/B102 -> 1.0428048075069092E-2 | I102: 1204 | J102: =I102/B102 -> 1.9345716305675172E-2 | K102: 124 | L102: =K102/B102 -> 1.9924159650363134E-3 | M102: 1941 | N102: =M102/B102 -> 3.1187737001092616E-2 | O102: 359 | P102: =O102/B102 -> 5.7683655761938428E-3 | Q102: 4358 | R102: =Q102/B102 -> 7.0023780448614945E-2

A1: HB 5001 - C. Jones Election Data
A2: DISTRICT | B2: Rep. Gov '09 | C2: Dem. Gov '09 | D2: Rep. Lt. Gov '09 | E2: Dem. Lt. Gov '09 | F2: Rep. Att. Gen. '09 | G2: Dem. Att. Gen. '09
A3: 1 | B3: 0.74433312460864121 | C3: 0.25566687539135879 | D3: 0.75269916309972529 | E3: 0.24730083690027471 | F3: 0.74159825551564906 | G3: 0.25840174448435094
A4: 2 | B4: 0.58118035493190257 | C4: 0.41881964506809738 | D4: 0.55140264713227338 | E4: 0.44859735286772662 | F4: 0.55944055944055948 | G4: 0.44055944055944057
A5: 3 | B5: 0.70532700120157921 | C5: 0.29467299879842079 | D5: 0.6997806887558532 | E5: 0.30021931124414675 | F5: 0.67792332652325438 | G5: 0.32207667347674557
A6: 4 | B6: 0.69645829745709198 | C6: 0.30354170254290797 | D6: 0.7086460611074995 | E6: 0.29135393889250044 | F6: 0.69879446522952671 | G6: 0.30120553477047329
A7: 5 | B7: 0.71703718881262168 | C7: 0.28296281118737832 | D7: 0.72408568443051202 | E7: 0.27591431556948798 | F7: 0.71055260528944741 | G7: 0.28944739471055259
A8: 6 | B8: 0.7232770931401068 | C8: 0.27672290685989315 | D8: 0.7092487407566177 | E8: 0.2907512592433823 | F8: 0.70856435377079185 | G8: 0.29143564622920815
A9: 7 | B9: 0.65366005931012949 | C9: 0.34633994068987045 | D9: 0.63418992064743285 | E9: 0.36581007935256715 | F9: 0.64808950812750687 | G9: 0.35191049187249313
A10: 8 | B10: 0.66775571751696405 | C10: 0.33224428248303595 | D10: 0.65323904533400678 | E10: 0.34676095466599316 | F10: 0.67201486235433205 | G10: 0.32798513764566795
A11: 9 | B11: 0.67559143630882423 | C11: 0.32440856369117571 | D11: 0.65506001655629142 | E11: 0.34493998344370863 | F11: 0.66588321320380239 | G11: 0.33411678679619766
A12: 10 | B12: 0.62486355366889024 | C12: 0.37513644633110976 | D12: 0.60651920838183937 | E12: 0.39348079161816063 | F12: 0.60575099418782508 | G12: 0.39424900581217498
A13: 11 | B13: 0.44189494038027716 | C13: 0.5581050596197229 | D13: 0.43567232160538649 | E13: 0.56432767839461351 | F13: 0.45516152378445951 | G13: 0.54483847621554049
A14: 12 | B14: 0.51036428308598059 | C14: 0.48963571691401936 | D14: 0.49950304385637967 | E14: 0.50049695614362033 | F14: 0.51086277937320512 | G14: 0.48913722062679488
A15: 13 | B15: 0.6133122028526149 | C15: 0.3866877971473851 | D15: 0.58889154514303932 | E15: 0.41110845485696074 | F15: 0.58958200382897252 | G15: 0.41041799617102742
A16: 14 | B16: 0.61593750000000003 | C16: 0.38406249999999997 | D16: 0.61735051490807136 | E16: 0.38264948509192859 | F16: 0.62198217661355659 | G16: 0.37801782338644341
A17: 15 | B17: 0.73705447209145936 | C17: 0.2629455279085407 | D17: 0.71209772996626852 | E17: 0.28790227003373142 | F17: 0.70787541611564597 | G17: 0.29212458388435403
A18: 16 | B18: 0.64073345074070243 | C18: 0.35926654925929763 | D18: 0.63330333986132425 | E18: 0.36669666013867569 | F18: 0.64577352472089311 | G18: 0.35422647527910683
A19: 17 | B19: 0.66757620976337673 | C19: 0.33242379023662333 | D19: 0.64912280701754388 | E19: 0.35087719298245612 | F19: 0.66688191484781956 | G19: 0.33311808515218044
A20: 18 | B20: 0.67151556156968872 | C20: 0.32848443843031122 | D20: 0.65439134882361538 | E20: 0.34560865117638462 | F20: 0.65745748672221405 | G20: 0.3425425132777859
A21: 19 | B21: 0.62355237475601821 | C21: 0.37644762524398179 | D21: 0.62754944716091798 | E21: 0.37245055283908196 | F21: 0.65449821656611917 | G21: 0.34550178343388083
A22: 20 | B22: 0.66184118060435704 | C22: 0.33815881939564302 | D22: 0.67100806259243362 | E22: 0.32899193740756644 | F22: 0.67238076996743923 | G22: 0.32761923003256083
A23: 21 | B23: 0.60669700151674255 | C23: 0.3933029984832575 | D23: 0.55223435355885686 | E23: 0.44776564644114314 | F23: 0.59046710016106907 | G23: 0.40953289983893099
A24: 22 | B24: 0.70213386477421869 | C24: 0.29786613522578137 | D24: 0.69056733411857085 | E24: 0.30943266588142915 | F24: 0.70095893779198426 | G24: 0.29904106220801574
A25: 23 | B25: 0.70197531904140165 | C25: 0.2980246809585983 | D25: 0.69047721133644901 | E25: 0.30952278866355099 | F25: 0.69849030708526338 | G25: 0.30150969291473667
A26: 24 | B26: 0.62649520117252144 | C26: 0.37350479882747861 | D26: 0.63847276264591435 | E26: 0.3615272373540856 | F26: 0.6500631742637768 | G26: 0.34993682573622314
A27: 25 | B27: 0.68208215902297376 | C27: 0.31791784097702624 | D27: 0.68109761350908937 | E27: 0.31890238649091068 | F27: 0.68877088460044034 | G27: 0.31122911539955966
A28: 26 | B28: 0.69705862280761621 | C28: 0.30294137719238379 | D28: 0.70323914541695387 | E28: 0.29676085458304619 | F28: 0.70539906103286387 | G28: 0.29460093896713613
A29: 27 | B29: 0.64974975443191918 | C29: 0.35025024556808082 | D29: 0.62474168701859856 | E29: 0.37525831298140144 | F29: 0.64893066980023506 | G29: 0.351069330199765
A30: 28 | B30: 0.63874345549738221 | C30: 0.36125654450261779 | D30: 0.61588371077422177 | E30: 0.38411628922577828 | F30: 0.60747198007471981 | G30: 0.39252801992528019
A31: 29 | B31: 0.70543957659511913 | C31: 0.29456042340488092 | D31: 0.68594205485156756 | E31: 0.31405794514843238 | F31: 0.68378153260352215 | G31: 0.31621846739647785
A32: 30 | B32: 0.68083667204329046 | C32: 0.31916332795670949 | D32: 0.65460613444932991 | E32: 0.34539386555067014 | F32: 0.66800783524802798 | G32: 0.33199216475197207
A33: 31 | B33: 0.60259476264498391 | C33: 0.39740523735501615 | D33: 0.57483197311569856 | E33: 0.4251680268843015 | F33: 0.58382476832350461 | G33: 0.41617523167649539
A34: 32 | B34: 0.62407280433834067 | C34: 0.37592719566165927 | D34: 0.59471864193649793 | E34: 0.40528135806350202 | F34: 0.59552323029657028 | G34: 0.40447676970342966
A35: 33 | B35: 0.66484434320425212 | C35: 0.33515565679574794 | D35: 0.64514154552410097 | E35: 0.35485845447589903 | F35: 0.64594057387492987 | G35: 0.35405942612507008
A36: 34 | B36: 0.56856047984005331 | C36: 0.43143952015994669 | D36: 0.54755611495699597 | E36: 0.45244388504300398 | F36: 0.53259228187919461 | G36: 0.46740771812080539
A37: 35 | B37: 0.49024427715470886 | C37: 0.50975572284529114 | D37: 0.4608394857762404 | E37: 0.53916051422375966 | F37: 0.43157296990346394 | G37: 0.56842703009653606
A38: 36 | B38: 0.41951194504255102 | C38: 0.58048805495744904 | D38: 0.39477892999019759 | E38: 0.60522107000980241 | F38: 0.39103922277918451 | G38: 0.60896077722081543
A39: 37 | B39: 0.53436792757840279 | C39: 0.46563207242159715 | D39: 0.50926046693622018 | E39: 0.49073953306377982 | F39: 0.50351516729592505 | G39: 0.49648483270407501
A40: 38 | B40: 0.44017321785476349 | C40: 0.55982678214523651 | D40: 0.41721764024265556 | E40: 0.58278235975734438 | F40: 0.40990899898887767 | G40: 0.59009100101112233
A41: 39 | B41: 0.49135544528597547 | C41: 0.50864455471402459 | D41: 0.46637172802443777 | E41: 0.53362827197556217 | F41: 0.46472570285353271 | G41: 0.53527429714646735
A42: 40 | B42: 0.64961439588688941 | C42: 0.35038560411311054 | D42: 0.62992044632709987 | E42: 0.37007955367290007 | F42: 0.62467666839110192 | G42: 0.37532333160889808
A43: 41 | B43: 0.53116594007976992 | C43: 0.46883405992023003 | D43: 0.50382534054860983 | E43: 0.49617465945139017 | F43: 0.49906550789645826 | G43: 0.50093449210354168
A44: 42 | B44: 0.58186351463662389 | C44: 0.41813648536337611 | D44: 0.55233718609293037 | E44: 0.44766281390706958 | F44: 0.55325086038508042 | G44: 0.44674913961491952
A45: 43 | B45: 0.45914198161389175 | C45: 0.54085801838610825 | D45: 0.43771389459274468 | E45: 0.56228610540725532 | F45: 0.43337719549173292 | G45: 0.56662280450826708
A46: 44 | B46: 0.45343054142647227 | C46: 0.54656945857352779 | D46: 0.42835201092212299 | E46: 0.57164798907787706 | F46: 0.42517665830863915 | G46: 0.57482334169136085
A47: 45 | B47: 0.37695354085934507 | C47: 0.62304645914065493 | D47: 0.35421676399862589 | E47: 0.64578323600137411 | F47: 0.35409313936472409 | G47: 0.64590686063527591
A48: 46 | B48: 0.36720997123681687 | C48: 0.63279002876318313 | D48: 0.34307224754800386 | E48: 0.65692775245199608 | F48: 0.34342734391241081 | G48: 0.65657265608758919
A49: 47 | B49: 0.32642415289446958 | C49: 0.67357584710553042 | D49: 0.31120196998559679 | E49: 0.68879803001440321 | F49: 0.30738467261904762 | G49: 0.69261532738095233
A50: 48 | B50: 0.41406385563074788 | C50: 0.58593614436925212 | D50: 0.3922683342808414 | E50: 0.6077316657191586 | F50: 0.38550470768557038 | G50: 0.61449529231442956
A51: 49 | B51: 0.30688547984302533 | C51: 0.69311452015697472 | D51: 0.28783577200262067 | E51: 0.71216422799737933 | F51: 0.28826937002172337 | G51: 0.71173062997827663
A52: 50 | B52: 0.62611820475571522 | C52: 0.37388179524428472 | D52: 0.60253145018136911 | E52: 0.39746854981863083 | F52: 0.60817585807944463 | G52: 0.39182414192055537
A53: 51 | B53: 0.61955000538271077 | C53: 0.38044999461728929 | D53: 0.58882397489992422 | E53: 0.41117602510007573 | F53: 0.59785551824975636 | G53: 0.4021444817502437
A54: 52 | B54: 0.47534246575342465 | C54: 0.52465753424657535 | D54: 0.44612345679012344 | E54: 0.55387654320987656 | F54: 0.45833333333333331 | G54: 0.54166666666666663
A55: 53 | B55: 0.42235915492957748 | C55: 0.57764084507042257 | D55: 0.4010790300586945 | E55: 0.5989209699413055 | F55: 0.39587543088077976 | G55: 0.6041245691192203
A56: 54 | B56: 0.6585550850135895 | C56: 0.34144491498641044 | D56: 0.644366421959783 | E56: 0.35563357804021706 | F56: 0.63127277376462321 | G56: 0.36872722623537685
A57: 55 | B57: 0.68430909171980203 | C57: 0.31569090828019797 | D57: 0.65870307167235498 | E57: 0.34129692832764508 | F57: 0.67907186303221445 | G57: 0.32092813696778555
A58: 56 | B58: 0.70843373493975903 | C58: 0.29156626506024097 | D58: 0.67959595959595964 | E58: 0.32040404040404041 | F58: 0.70114373198847257 | G58: 0.29885626801152737
A59: 57 | B59: 0.3468493454626137 | C59: 0.6531506545373863 | D59: 0.32365075825156109 | E59: 0.67634924174843891 | F59: 0.33702894898930513 | G59: 0.66297105101069487
A60: 58 | B60: 0.6570921686238067 | C60: 0.3429078313761933 | D60: 0.63217117040320514 | E60: 0.3678288295967948 | F60: 0.65290670316978228 | G60: 0.34709329683021772
A61: 59 | B61: 0.67389443651925818 | C61: 0.32610556348074182 | D61: 0.65888706721959689 | E61: 0.34111293278040311 | F61: 0.67372287467981251 | G61: 0.32627712532018754
A62: 60 | B62: 0.61512979254914735 | C62: 0.3848702074508526 | D62: 0.62627228251701061 | E62: 0.37372771748298939 | F62: 0.63881508281983157 | G62: 0.36118491718016849
A63: 61 | B63: 0.65693693693693689 | C63: 0.34306306306306306 | D63: 0.65390883760054674 | E63: 0.34609116239945326 | F63: 0.67231339332980411 | G63: 0.32768660667019589
A64: 62 | B64: 0.67061954069532015 | C64: 0.3293804593046798 | D64: 0.64074613815214221 | E64: 0.35925386184785779 | F64: 0.66604368648522372 | G64: 0.33395631351477634
A65: 63 | B65: 0.40906157222150508 | C65: 0.59093842777849492 | D65: 0.39708308585758595 | E65: 0.602916914142414 | F65: 0.41578842712268843 | G65: 0.58421157287731162
A66: 64 | B66: 0.65901377520463167 | C66: 0.34098622479536833 | D66: 0.63317681347150256 | E66: 0.36682318652849744 | F66: 0.64608114714029652 | G66: 0.35391885285970343
A67: 65 | B67: 0.73164763458401305 | C67: 0.26835236541598695 | D67: 0.70414322670718188 | E67: 0.29585677329281812 | F67: 0.73022337405899052 | G67: 0.26977662594100948
A68: 66 | B68: 0.74773164696178174 | C68: 0.25226835303821832 | D68: 0.71581186699347921 | E68: 0.28418813300652085 | F68: 0.74186841618924415 | G68: 0.25813158381075585
A69: 67 | B69: 0.58375661098601872 | C69: 0.41624338901398128 | D69: 0.55906050871557222 | E69: 0.44093949128442783 | F69: 0.55585400537209673 | G69: 0.44414599462790333
A70: 68 | B70: 0.63049994831685219 | C70: 0.36950005168314787 | D70: 0.60426090259314247 | E70: 0.39573909740685748 | F70: 0.62649098474341192 | G70: 0.37350901525658808
A71: 69 | B71: 0.22904068169323805 | C71: 0.77095931830676201 | D71: 0.22039542143600416 | E71: 0.77960457856399579 | F71: 0.23958696713877067 | G71: 0.7604130328612293
A72: 70 | B72: 0.30255979857322701 | C72: 0.69744020142677299 | D72: 0.29369108049311093 | E72: 0.70630891950688901 | F72: 0.31392880965375053 | G72: 0.68607119034624942
A73: 71 | B73: 0.21025244356936923 | C73: 0.78974755643063077 | D73: 0.21353458759567923 | E73: 0.78646541240432077 | F73: 0.23212487411883181 | G73: 0.76787512588116813
A74: 72 | B74: 0.66373432107079722 | C74: 0.33626567892920278 | D74: 0.63066525871172119 | E74: 0.36933474128827876 | F74: 0.65203589266062811 | G74: 0.34796410733937189
A75: 73 | B75: 0.6473367697594502 | C75: 0.35266323024054985 | D75: 0.61969886535225849 | E75: 0.38030113464774151 | F75: 0.63744157867405227 | G75: 0.36255842132594773
A76: 74 | B76: 0.33802390679376609 | C76: 0.66197609320623396 | D76: 0.32584840479577321 | E76: 0.67415159520422674 | F76: 0.34622458363134773 | G76: 0.65377541636865233
A77: 75 | B77: 0.50104496007716626 | C77: 0.49895503992283374 | D77: 0.49072902338376889 | E77: 0.50927097661623111 | F77: 0.508648017351649 | G77: 0.49135198264835106
A78: 76 | B78: 0.6426092990978487 | C78: 0.3573907009021513 | D78: 0.60113484646194926 | E78: 0.39886515353805074 | F78: 0.62525352577708604 | G78: 0.37474647422291402
A79: 77 | B79: 0.34480866822109452 | C79: 0.65519133177890554 | D79: 0.32766903276690329 | E79: 0.67233096723309671 | F79: 0.34647927721210381 | G79: 0.65352072278789619
A80: 78 | B80: 0.70038026569213296 | C80: 0.29961973430786704 | D80: 0.65684890054468426 | E80: 0.34315109945531569 | F80: 0.68550418051777984 | G80: 0.31449581948222022
A81: 79 | B81: 0.48739750986941999 | C81: 0.51260249013058001 | D81: 0.44639016897081413 | E81: 0.55360983102918582 | F81: 0.46425535203647889 | G81: 0.53574464796352117
A82: 80 | B82: 0.3430088709190755 | C82: 0.6569911290809245 | D82: 0.31843403205918619 | E82: 0.68156596794081381 | F82: 0.33875877492700501 | G82: 0.66124122507299499
A83: 81 | B83: 0.67313069908814593 | C83: 0.32686930091185412 | D83: 0.62156789663312217 | E83: 0.37843210336687788 | F83: 0.65808937783578847 | G83: 0.34191062216421159
A84: 82 | B84: 0.66854667689392233 | C84: 0.33145332310607772 | D84: 0.59950408669299293 | E84: 0.40049591330700707 | F84: 0.64515240543518182 | G84: 0.35484759456481824
A85: 83 | B85: 0.63400105429625719 | C85: 0.36599894570374275 | D85: 0.57434323858742464 | E85: 0.42565676141257536 | F85: 0.61083955524520595 | G85: 0.389160444754794
A86: 84 | B86: 0.64428252592884339 | C86: 0.35571747407115661 | D86: 0.58795955266858635 | E86: 0.41204044733141365 | F86: 0.62648829431438124 | G86: 0.37351170568561876
A87: 85 | B87: 0.64172872940645453 | C87: 0.35827127059354547 | D87: 0.5848805598935739 | E87: 0.41511944010642604 | F87: 0.62175212692573001 | G87: 0.37824787307426994
A88: 86 | B88: 0.52652963671128106 | C88: 0.47347036328871894 | D88: 0.49834626255337061 | E88: 0.50165373744662933 | F88: 0.49768058316766073 | G88: 0.50231941683233927
A89: 87 | B89: 0.59440505548705302 | C89: 0.40559494451294698 | D89: 0.56772939346811824 | E89: 0.43227060653188182 | F89: 0.57012906235422178 | G89: 0.42987093764577827
A90: 88 | B90: 0.68204538925596092 | C90: 0.31795461074403908 | D90: 0.66384016726681383 | E90: 0.33615983273318623 | F90: 0.65658621692352426 | G90: 0.34341378307647574
A91: 89 | B91: 0.29255201823395338 | C91: 0.70744798176604662 | D91: 0.26592247113693707 | E91: 0.73407752886306288 | F91: 0.28823033922965002 | G91: 0.71176966077034998
A92: 90 | B92: 0.3441151435425211 | C92: 0.65588485645747896 | D92: 0.30988852353837515 | E92: 0.69011147646162485 | F92: 0.33413926499032881 | G92: 0.66586073500967113
A93: 91 | B93: 0.65207316471922294 | C93: 0.347926835280777 | D93: 0.60626275700701948 | E93: 0.39373724299298052 | F93: 0.62436218109054531 | G93: 0.37563781890945475
A94: 92 | B94: 0.29620044700623455 | C94: 0.7037995529937654 | D94: 0.27689806731290262 | E94: 0.72310193268709733 | F94: 0.28903593977659059 | G94: 0.71096406022340941
A95: 93 | B95: 0.56647518501267924 | C95: 0.43352481498732082 | D95: 0.53497105304334225 | E95: 0.46502894695665781 | F95: 0.54528776601320894 | G95: 0.45471223398679106
A96: 94 | B96: 0.61535212754724955 | C96: 0.38464787245275051 | D96: 0.58089294287085935 | E96: 0.41910705712914065 | F96: 0.59267979452054798 | G96: 0.40732020547945208
A97: 95 | B97: 0.35935851445452627 | C97: 0.64064148554547373 | D97: 0.34127212548568137 | E97: 0.65872787451431858 | F97: 0.35933550018057059 | G97: 0.64066449981942941
A98: 96 | B98: 0.67626835916839578 | C98: 0.32373164083160422 | D98: 0.64124166700748431 | E98: 0.35875833299251564 | F98: 0.65550396515593545 | G98: 0.3444960348440646
A99: 97 | B99: 0.77698201840514425 | C99: 0.22301798159485581 | D99: 0.75301134823192217 | E99: 0.24698865176807777 | F99: 0.77067989766648581 | G99: 0.22932010233351421
A100: 98 | B100: 0.69174028647396857 | C100: 0.30825971352603138 | D100: 0.66280180649643916 | E100: 0.33719819350356089 | F100: 0.6725899406217255 | G100: 0.32741005937827455
A101: 99 | B101: 0.65608879882092852 | C101: 0.34391120117907148 | D101: 0.6348314606741573 | E101: 0.3651685393258427 | F101: 0.6464442986976483 | G101: 0.35355570130235175
A102: 100 | B102: 0.57264106766565204 | C102: 0.42735893233434791 | D102: 0.53931034482758622 | E102: 0.46068965517241378 | F102: 0.55906319792358306 | G102: 0.440936802076417