A1: Current Congressional Districts District Population Summary
A2: DISTRICT | B2: Total Population | C2: Target | D2: Difference | E2: Deviation from Ideal
A3: 1 | B3: 786237 | C3: 727365.818181818 | D3: =B3-C3 -> 58871.181818181998 | E3: =(B3-C3)/C3 -> 8.0937514998080509E-2
A4: 2 | B4: 646184 | C4: 727365.818181818 | D4: =B4-C4 -> -81181.818181818002 | E4: =(B4-C4)/C4 -> -0.11161071382862972
A5: 3 | B5: 663390 | C5: 727365.818181818 | D5: =B5-C5 -> -63975.818181818002 | E5: =(B5-C5)/C5 -> -8.7955491697062557E-2
A6: 4 | B6: 738639 | C6: 727365.818181818 | D6: =B6-C6 -> 11273.181818181998 | E6: =(B6-C6)/C6 -> 1.5498641173929989E-2
A7: 5 | B7: 685859 | C7: 727365.818181818 | D7: =B7-C7 -> -41506.818181818002 | E7: =(B7-C7)/C7 -> -5.7064570734945697E-2
A8: 6 | B8: 704056 | C8: 727365.818181818 | D8: =B8-C8 -> -23309.818181818002 | E8: =(B8-C8)/C8 -> -3.2046897997056137E-2
A9: 7 | B9: 757917 | C9: 727365.818181818 | D9: =B9-C9 -> 30551.181818181998 | E9: =(B9-C9)/C9 -> 4.2002498680169198E-2
A10: 8 | B10: 701010 | C10: 727365.818181818 | D10: =B10-C10 -> -26355.818181818002 | E10: =(B10-C10)/C10 -> -3.6234611969667645E-2
A11: 9 | B11: 656200 | C11: 727365.818181818 | D11: =B11-C11 -> -71165.818181818002 | E11: =(B11-C11)/C11 -> -9.7840476419018149E-2
A12: 10 | B12: 869437 | C12: 727365.818181818 | D12: =B12-C12 -> 142071.181818182 | E12: =(B12-C12)/C12 -> 0.19532287367217024
A13: 11 | B13: 792095 | C13: 727365.818181818 | D13: =B13-C13 -> 64729.181818181998 | E13: =(B13-C13)/C13 -> 8.899123412203265E-2

A1: Current Congressional Districts Demographic Population Totals
A2: DISTRICT | B2: Total Population | C2: White | D2: % White | E2: Black | F2: % Black | G2: AIAN | H2: % AIAN | I2: Asian | J2: % Asian | K2: HawPI | L2: % HawPI | M2: Other | N2: % Other | O2: Multi | P2: % Multi | Q2: Hispanic | R2: % Hispanic
A3: 1 | B3: 786237 | C3: 558404 | D3: =C3/B3 -> 0.71022350767007913 | E3: 164455 | F3: =E3/B3 -> 0.20916721039584757 | G3: 6612 | H3: =G3/B3 -> 8.409677997855608E-3 | I3: 26452 | J3: =I3/B3 -> 3.3643799515922043E-2 | K3: 1105 | L3: =K3/B3 -> 1.4054286430173091E-3 | M3: 22428 | N3: =M3/B3 -> 2.8525749869314214E-2 | O3: 6781 | P3: =O3/B3 -> 8.6246259079641382E-3 | Q3: 53012 | R3: =Q3/B3 -> 6.7424962193333562E-2
A4: 2 | B4: 646184 | C4: 427383 | D4: =C4/B4 -> 0.66139520631894322 | E4: 149285 | F4: =E4/B4 -> 0.23102552833248735 | G4: 5459 | H4: =G4/B4 -> 8.4480581382392634E-3 | I4: 39012 | J4: =I4/B4 -> 6.0372896883859703E-2 | K4: 1357 | L4: =K4/B4 -> 2.1000210466368711E-3 | M4: 16213 | N4: =M4/B4 -> 2.5090376734799996E-2 | O4: 7475 | P4: =O4/B4 -> 1.1567912545033613E-2 | Q4: 45210 | R4: =Q4/B4 -> 6.9964592128557809E-2
A5: 3 | B5: 663390 | C5: 246414 | D5: =C5/B5 -> 0.37144666033554924 | E5: 373134 | F5: =E5/B5 -> 0.56246551802107358 | G5: 5407 | H5: =G5/B5 -> 8.1505600024118548E-3 | I5: 15449 | J5: =I5/B5 -> 2.3287960324997362E-2 | K5: 901 | L5: =K5/B5 -> 1.3581754322495062E-3 | M5: 14355 | N5: =M5/B5 -> 2.1638854972188305E-2 | O5: 7730 | P5: =O5/B5 -> 1.165227091153017E-2 | Q5: 32713 | R5: =Q5/B5 -> 4.9311867830386352E-2
A6: 4 | B6: 738639 | C6: 441259 | D6: =C6/B6 -> 0.59739466776057049 | E6: 254180 | F6: =E6/B6 -> 0.34411938714311052 | G6: 5074 | H6: =G6/B6 -> 6.8693908661741389E-3 | I6: 17637 | J6: =I6/B6 -> 2.3877699390365253E-2 | K6: 787 | L6: =K6/B6 -> 1.0654731201574787E-3 | M6: 14724 | N6: =M6/B6 -> 1.9933959620328741E-2 | O6: 4978 | P6: =O6/B6 -> 6.7394220992934304E-3 | Q6: 33353 | R6: =Q6/B6 -> 4.515466960179465E-2
A7: 5 | B7: 685859 | C7: 501303 | D7: =C7/B7 -> 0.73091262198206919 | E7: 155886 | F7: =E7/B7 -> 0.22728578322949761 | G7: 3753 | H7: =G7/B7 -> 5.4719701862919346E-3 | I7: 12312 | J7: =I7/B7 -> 1.7951211546396562E-2 | K7: 311 | L7: =K7/B7 -> 4.5344597067327252E-4 | M7: 10204 | N7: =M7/B7 -> 1.4877693520096696E-2 | O7: 2090 | P7: =O7/B7 -> 3.0472735649747251E-3 | Q7: 20935 | R7: =Q7/B7 -> 3.0523766546768361E-2
A8: 6 | B8: 704056 | C8: 585107 | D8: =C8/B8 -> 0.83105179133478024 | E8: 84891 | F8: =E8/B8 -> 0.12057421568738851 | G8: 4348 | H8: =G8/B8 -> 6.1756451191382501E-3 | I8: 12311 | J8: =I8/B8 -> 1.7485824991193881E-2 | K8: 390 | L8: =K8/B8 -> 5.5393320985830667E-4 | M8: 14700 | N8: =M8/B8 -> 2.0879020986966947E-2 | O8: 2309 | P8: =O8/B8 -> 3.2795686706739236E-3 | Q8: 30117 | R8: =Q8/B8 -> 4.2776426875134929E-2
A9: 7 | B9: 757917 | C9: 563423 | D9: =C9/B9 -> 0.74338351033160621 | E9: 135386 | F9: =E9/B9 -> 0.17862905832696721 | G9: 4604 | H9: =G9/B9 -> 6.074543782498611E-3 | I9: 32784 | J9: =I9/B9 -> 4.3255396039408006E-2 | K9: 523 | L9: =K9/B9 -> 6.9004917424995082E-4 | M9: 17198 | N9: =M9/B9 -> 2.2691139003347332E-2 | O9: 3999 | P9: =O9/B9 -> 5.2763033419226642E-3 | Q9: 36794 | R9: =Q9/B9 -> 4.8546212843886598E-2
A10: 8 | B10: 701010 | C10: 444616 | D10: =C10/B10 -> 0.63425058130411838 | E10: 99886 | F10: =E10/B10 -> 0.14248869488309723 | G10: 5182 | H10: =G10/B10 -> 7.39219126688635E-3 | I10: 84581 | J10: =I10/B10 -> 0.12065591075733584 | K10: 844 | L10: =K10/B10 -> 1.2039771187286915E-3 | M10: 59460 | N10: =M10/B10 -> 8.4820473317071085E-2 | O10: 6441 | P10: =O10/B10 -> 9.1881713527624427E-3 | Q10: 127533 | R10: =Q10/B10 -> 0.181927504600505
A11: 9 | B11: 656200 | C11: 609813 | D11: =C11/B11 -> 0.92930966168850959 | E11: 28039 | F11: =E11/B11 -> 4.2729350807680588E-2 | G11: 3185 | H11: =G11/B11 -> 4.8537031392868026E-3 | I11: 8764 | J11: =I11/B11 -> 1.335568424260896E-2 | K11: 254 | L11: =K11/B11 -> 3.8707711063700091E-4 | M11: 5114 | N11: =M11/B11 -> 7.7933556842426088E-3 | O11: 1031 | P11: =O11/B11 -> 1.5711673270344408E-3 | Q11: 11632 | R11: =Q11/B11 -> 1.7726302956415727E-2
A12: 10 | B12: 869437 | C12: 611159 | D12: =C12/B12 -> 0.70293649798662816 | E12: 71471 | F12: =E12/B12 -> 8.2203770946025989E-2 | G12: 5327 | H12: =G12/B12 -> 6.1269534192816728E-3 | I12: 119178 | J12: =I12/B12 -> 0.13707491169572952 | K12: 907 | L12: =K12/B12 -> 1.0432038204033186E-3 | M12: 55074 | N12: =M12/B12 -> 6.3344440137698299E-2 | O12: 6321 | P12: =O12/B12 -> 7.2702219942330495E-3 | Q12: 117278 | R12: =Q12/B12 -> 0.13488958946996735
A13: 11 | B13: 792095 | C13: 497971 | D13: =C13/B13 -> 0.62867585327517528 | E13: 96841 | F13: =E13/B13 -> 0.12225932495470872 | G13: 5912 | H13: =G13/B13 -> 7.4637511914606202E-3 | I13: 130333 | J13: =I13/B13 -> 0.16454213194124442 | K13: 1200 | L13: =K13/B13 -> 1.5149697952897064E-3 | M13: 52413 | N13: =M13/B13 -> 6.6170093233766158E-2 | O13: 7425 | P13: =O13/B13 -> 9.3738756083550576E-3 | Q13: 123248 | R13: =Q13/B13 -> 0.1555974977748881

A1: Current Congressional Districts Voting Age Population Totals
A2: DISTRICT | B2: Voting Age Pop. | C2: VAP White | D2: % VAP White | E2: VAP Black | F2: % VAP Black | G2: VAP AIAN | H2: % VAP AIAN | I2: VAP Asian | J2: % VAP Asian | K2: VAP HawPI | L2: % VAP HawPI | M2: VAP Other | N2: % VAP Other | O2: VAP Multi | P2: % VAP Multi | Q2: VAP Hispanic | R2: % VAP Hispanic
A3: 1 | B3: 592940 | C3: 434385 | D3: =C3/B3 -> 0.73259520356191188 | E3: 116161 | F3: =E3/B3 -> 0.19590683711674031 | G3: 4797 | H3: =G3/B3 -> 8.0901946234020299E-3 | I3: 18735 | J3: =I3/B3 -> 3.1596788882517622E-2 | K3: 756 | L3: =K3/B3 -> 1.2750025297669242E-3 | M3: 14488 | N3: =M3/B3 -> 2.4434175464633858E-2 | O3: 3618 | P3: =O3/B3 -> 6.1017978210274231E-3 | Q3: 33602 | R3: =Q3/B3 -> 5.6670152123317705E-2
A4: 2 | B4: 500240 | C4: 343037 | D4: =C4/B4 -> 0.68574484247561174 | E4: 107121 | F4: =E4/B4 -> 0.2141392131776747 | G4: 4217 | H4: =G4/B4 -> 8.4299536222613141E-3 | I4: 29285 | J4: =I4/B4 -> 5.8541899888053736E-2 | K4: 998 | L4: =K4/B4 -> 1.9950423796577643E-3 | M4: 11259 | N4: =M4/B4 -> 2.2507196545658085E-2 | O4: 4323 | P4: =O4/B4 -> 8.6418519110826805E-3 | Q4: 30312 | R4: =Q4/B4 -> 6.0594914441068286E-2
A5: 3 | B5: 511559 | C5: 207441 | D5: =C5/B5 -> 0.40550747812080329 | E5: 271419 | F5: =E5/B5 -> 0.53057223116004215 | G5: 4200 | H5: =G5/B5 -> 8.2101966733065003E-3 | I5: 12758 | J5: =I5/B5 -> 2.4939449799534365E-2 | K5: 652 | L5: =K5/B5 -> 1.2745352930942473E-3 | M5: 10357 | N5: =M5/B5 -> 2.0245954034627481E-2 | O5: 4732 | P5: =O5/B5 -> 9.2501549185919907E-3 | Q5: 22506 | R5: =Q5/B5 -> 4.3994925316532402E-2
A6: 4 | B6: 557742 | C6: 342184 | D6: =C6/B6 -> 0.6135166438962818 | E6: 186644 | F6: =E6/B6 -> 0.33464218222762498 | G6: 3746 | H6: =G6/B6 -> 6.7163670657759324E-3 | I6: 12349 | J6: =I6/B6 -> 2.2141061637818201E-2 | K6: 492 | L6: =K6/B6 -> 8.8212829587873962E-4 | M6: 9614 | N6: =M6/B6 -> 1.7237360643451632E-2 | O6: 2713 | P6: =O6/B6 -> 4.8642562331687412E-3 | Q6: 21184 | R6: =Q6/B6 -> 3.7981719146128495E-2
A7: 5 | B7: 543596 | C7: 405436 | D7: =C7/B7 -> 0.74584066107918379 | E7: 117536 | F7: =E7/B7 -> 0.21621939822956754 | G7: 2866 | H7: =G7/B7 -> 5.2722978094025715E-3 | I7: 9685 | J7: =I7/B7 -> 1.7816540224725716E-2 | K7: 238 | L7: =K7/B7 -> 4.3782514955959938E-4 | M7: 6529 | N7: =M7/B7 -> 1.2010757989389179E-2 | O7: 1306 | P7: =O7/B7 -> 2.4025195181715834E-3 | Q7: 13800 | R7: =Q7/B7 -> 2.5386500268581816E-2
A8: 6 | B8: 556067 | C8: 472240 | D8: =C8/B8 -> 0.84925018028403054 | E8: 60303 | F8: =E8/B8 -> 0.10844556501284917 | G8: 3346 | H8: =G8/B8 -> 6.0172605099745174E-3 | I8: 9008 | J8: =I8/B8 -> 1.6199486752495652E-2 | K8: 295 | L8: =K8/B8 -> 5.3051161101090333E-4 | M8: 9455 | N8: =M8/B8 -> 1.7003346719010479E-2 | O8: 1420 | P8: =O8/B8 -> 2.5536491106287551E-3 | Q8: 19404 | R8: =Q8/B8 -> 3.4895075593408709E-2
A9: 7 | B9: 576326 | C9: 437613 | D9: =C9/B9 -> 0.75931504044585874 | E9: 98210 | F9: =E9/B9 -> 0.17040702657870718 | G9: 3360 | H9: =G9/B9 -> 5.830033696206661E-3 | I9: 23110 | J9: =I9/B9 -> 4.0098832952183312E-2 | K9: 356 | L9: =K9/B9 -> 6.1770595114570568E-4 | M9: 11362 | N9: =M9/B9 -> 1.9714536564375024E-2 | O9: 2315 | P9: =O9/B9 -> 4.0168238115233391E-3 | Q9: 24120 | R9: =Q9/B9 -> 4.1851313319197815E-2
A10: 8 | B10: 565094 | C10: 370959 | D10: =C10/B10 -> 0.6564553861835376 | E10: 75734 | F10: =E10/B10 -> 0.13402018071329724 | G10: 3960 | H10: =G10/B10 -> 7.0076836774058829E-3 | I10: 66225 | J10: =I10/B10 -> 0.11719289180207187 | K10: 675 | L10: =K10/B10 -> 1.1944915359214574E-3 | M10: 43128 | N10: =M10/B10 -> 7.6320045868474976E-2 | O10: 4413 | P10: =O10/B10 -> 7.8093202192909498E-3 | Q10: 93296 | R10: =Q10/B10 -> 0.16509819605233819
A11: 9 | B11: 528131 | C11: 492562 | D11: =C11/B11 -> 0.93265117934754826 | E11: 21444 | F11: =E11/B11 -> 4.0603562373729245E-2 | G11: 2579 | H11: =G11/B11 -> 4.8832581310318838E-3 | I11: 7287 | J11: =I11/B11 -> 1.3797713067401837E-2 | K11: 204 | L11: =K11/B11 -> 3.8626780098119595E-4 | M11: 3343 | N11: =M11/B11 -> 6.3298689150987162E-3 | O11: 712 | P11: =O11/B11 -> 1.3481503642088801E-3 | Q11: 7810 | R11: =Q11/B11 -> 1.4787997674819316E-2
A12: 10 | B12: 629287 | C12: 453796 | D12: =C12/B12 -> 0.72112724400790096 | E12: 49016 | F12: =E12/B12 -> 7.7891327804324575E-2 | G12: 3641 | H12: =G12/B12 -> 5.7859132637413458E-3 | I12: 82026 | J12: =I12/B12 -> 0.13034752028883481 | K12: 644 | L12: =K12/B12 -> 1.0233804289616661E-3 | M12: 36543 | N12: =M12/B12 -> 5.8070482943394668E-2 | O12: 3621 | P12: =O12/B12 -> 5.7541312628419149E-3 | Q12: 77158 | R12: =Q12/B12 -> 0.12261178126991341
A13: 11 | B13: 586365 | C13: 379691 | D13: =C13/B13 -> 0.64753353286775306 | E13: 66660 | F13: =E13/B13 -> 0.11368345655010105 | G13: 4074 | H13: =G13/B13 -> 6.9478908188585608E-3 | I13: 95206 | J13: =I13/B13 -> 0.16236644410904472 | K13: 822 | L13: =K13/B13 -> 1.4018572049832442E-3 | M13: 35756 | N13: =M13/B13 -> 6.097908299438063E-2 | O13: 4156 | P13: =O13/B13 -> 7.0877354548787869E-3 | Q13: 83665 | R13: =Q13/B13 -> 0.1426841643003931

A1: Current Congressional Districts Election Data
A2: DISTRICT | B2: Rep. Gov '09 | C2: Dem. Gov '09 | D2: Rep. Lt. Gov '09 | E2: Dem. Lt. Gov '09 | F2: Rep. Att. Gen. '09 | G2: Dem. Att. Gen. '09 | H2: Rep. Pres. '08 | I2: Dem. Pres. '08 | J2: Other Pres. '08 | K2: Rep. U.S. Sen. '08 | L2: Dem. U.S. Sen. '08 | M2: Other U.S. Sen. '08
A3: 1 | B3: 0.64708585311749012 | C3: 0.35291414688250983 | D3: 0.62020515610747495 | E3: 0.3797948438925251 | F3: 0.62616332556000087 | G3: 0.37383667443999913 | H3: 0.52513568166591884 | I3: 0.46648985537532961 | J3: 8.3744629587515444E-3 | K3: 0.38205609341005292 | L3: 0.60632687284537845 | M3: 1.161703374456864E-2
A4: 2 | B4: 0.6175172041362903 | C4: 0.38248279586370965 | D4: 0.56248742201650237 | E4: 0.43751257798349769 | F4: 0.59722232576169854 | G4: 0.40277767423830146 | H4: 0.49546048808832072 | I4: 0.49534750468074118 | J4: 9.1920072309380849E-3 | K4: 0.34211516281453985 | L4: 0.64495392743312352 | M4: 1.2930909752336699E-2
A5: 3 | B5: 0.34422502563188162 | C5: 0.65577497436811838 | D5: 0.32685606060606059 | E5: 0.67314393939393935 | F5: 0.3456918940738315 | G5: 0.6543081059261685 | H5: 0.24720291417314055 | I5: 0.74638144444857446 | J5: 6.4156413782849499E-3 | K5: 0.18079900685831357 | L5: 0.80629548250006666 | M5: 1.2905510641619796E-2
A6: 4 | B6: 0.61316683808075845 | C6: 0.38683316191924161 | D6: 0.58688638591851161 | E6: 0.41311361408148839 | F6: 0.6089681031383225 | G6: 0.39103189686167755 | H6: 0.49873150308109127 | I6: 0.4933990292408485 | J6: 7.8694676780602692E-3 | K6: 0.37432824432502121 | L6: 0.61418037585428908 | M6: 1.1491379820689747E-2
A7: 5 | B7: 0.61417873247425925 | C7: 0.3858212675257407 | D7: 0.60121543674654876 | E7: 0.39878456325345124 | F7: 0.6166927252604395 | G7: 0.38330727473956044 | H7: 0.51754491326206697 | I7: 0.47256129995367113 | J7: 9.8937867842619123E-3 | K7: 0.34772169553166321 | L7: 0.64115248133043801 | M7: 1.1125823137898769E-2
A8: 6 | B8: 0.66739958229319929 | C8: 0.33260041770680071 | D8: 0.66475979578027922 | E8: 0.33524020421972073 | F8: 0.67404845452561235 | G8: 0.32595154547438759 | H8: 0.57764523284641955 | I8: 0.41179237832306625 | J8: 1.0562388830514179E-2 | K8: 0.41377203913724914 | L8: 0.57551164308727687 | M8: 1.0716317775473943E-2
A9: 7 | B9: 0.65532581770385723 | C9: 0.34467418229614277 | D9: 0.62917372116905823 | E9: 0.37082627883094177 | F9: 0.64828944928611165 | G9: 0.35171055071388835 | H9: 0.53985923875672459 | I9: 0.45209437243945705 | J9: 8.0463888038183502E-3 | K9: 0.39362920061957035 | L9: 0.59493685711525002 | M9: 1.143394226517962E-2
A10: 8 | B10: 0.38636176688327711 | C10: 0.61363823311672283 | D10: 0.36501211040600218 | E10: 0.63498788959399788 | F10: 0.3618207034071082 | G10: 0.63817929659289174 | H10: 0.31852851443323166 | I10: 0.67237346475788151 | J10: 9.0980208088868031E-3 | K10: 0.25490825760819574 | L10: 0.73113611494362241 | M10: 1.3955627448181804E-2
A11: 9 | B11: 0.66626095911939176 | C11: 0.3337390408806083 | D11: 0.66268764571942784 | E11: 0.3373123542805721 | F11: 0.66136775113842106 | G11: 0.338632248861579 | H11: 0.59333514060867976 | I11: 0.39178274424130316 | J11: 1.4882115150017142E-2 | K11: 0.36340447067370285 | L11: 0.62532701545594427 | M11: 1.1268513870352912E-2
A12: 10 | B12: 0.60747541554259854 | C12: 0.39252458445740146 | D12: 0.58487327681695056 | E12: 0.4151267231830495 | F12: 0.58372722985644254 | G12: 0.41627277014355746 | H12: 0.4766796045718697 | I12: 0.51469070033177 | J12: 8.6296950963603326E-3 | K12: 0.37513462364520367 | L12: 0.6140736959404357 | M12: 1.0791680414360686E-2
A13: 11 | B13: 0.55122335614119788 | C13: 0.44877664385880212 | D13: 0.52381271538122132 | E13: 0.47618728461877874 | F13: 0.52028707652579276 | G13: 0.47971292347420724 | H13: 0.43624936887140919 | I13: 0.55602096675613188 | J13: 7.7296643724588769E-3 | K13: 0.34515760851320959 | L13: 0.64369062405585953 | M13: 1.1151767430930881E-2