A1: SB 5002 William & Mary Senate Plan Population Totals
A2: DISTRICT | B2: Total Population | C2: Target | D2: Difference | E2: Deviation
A3: 1 | B3: 197184 | C3: 200025.60000000001 | D3: =B3-C3 -> -2841.6000000000058 | E3: -1.4206181608754108E-2
A4: 2 | B4: 200759 | C4: 200025.60000000001 | D4: =B4-C4 -> 733.39999999999418 | E4: 3.6665306840724097E-3
A5: 3 | B5: 192559 | C5: 200025.60000000001 | D5: =B5-C5 -> -7466.6000000000058 | E5: -3.7328221987585619E-2
A6: 4 | B6: 203076 | C6: 200025.60000000001 | D6: =B6-C6 -> 3050.3999999999942 | E6: 1.5250047993856757E-2
A7: 5 | B7: 200588 | C7: 200025.60000000001 | D7: =B7-C7 -> 562.39999999999418 | E7: 2.8116401100658824E-3
A8: 6 | B8: 203492 | C8: 200025.60000000001 | D8: =B8-C8 -> 3466.3999999999942 | E8: 1.7329781787931115E-2
A9: 7 | B9: 202568 | C9: 200025.60000000001 | D9: =B9-C9 -> 2542.3999999999942 | E9: 1.2710373072246723E-2
A10: 8 | B10: 199504 | C10: 200025.60000000001 | D10: =B10-C10 -> -521.60000000000582 | E10: -2.6076662187240322E-3
A11: 9 | B11: 200938 | C11: 200025.60000000001 | D11: =B11-C11 -> 912.39999999999418 | E11: 4.5614161387342129E-3
A12: 10 | B12: 201790 | C12: 200025.60000000001 | D12: =B12-C12 -> 1764.3999999999942 | E12: 8.8208709285211191E-3
A13: 11 | B13: 200286 | C13: 200025.60000000001 | D13: =B13-C13 -> 260.39999999999418 | E13: 1.3018333653292088E-3
A14: 12 | B14: 201527 | C14: 200025.60000000001 | D14: =B14-C14 -> 1501.3999999999942 | E14: 7.5060392269789174E-3
A15: 13 | B15: 198661 | C15: 200025.60000000001 | D15: =B15-C15 -> -1364.6000000000058 | E15: -6.8221267677737538E-3
A16: 14 | B16: 200862 | C16: 200025.60000000001 | D16: =B16-C16 -> 836.39999999999418 | E16: 4.1814647725090899E-3
A17: 15 | B17: 190453 | C17: 200025.60000000001 | D17: =B17-C17 -> -9572.6000000000058 | E17: -4.7856874320087055E-2
A18: 16 | B18: 201930 | C18: 200025.60000000001 | D18: =B18-C18 -> 1904.3999999999942 | E18: 9.5207813399884513E-3
A19: 17 | B19: 202840 | C19: 200025.60000000001 | D19: =B19-C19 -> 2814.3999999999942 | E19: 1.4070199014526111E-2
A20: 18 | B20: 196762 | C20: 200025.60000000001 | D20: =B20-C20 -> -3263.6000000000058 | E20: -1.6315911563319924E-2
A21: 19 | B21: 191586 | C21: 200025.60000000001 | D21: =B21-C21 -> -8439.6000000000058 | E21: -4.2192599347283574E-2
A22: 20 | B22: 201898 | C22: 200025.60000000001 | D22: =B22-C22 -> 1872.3999999999942 | E22: 9.3608018173673476E-3
A23: 21 | B23: 191784 | C23: 200025.60000000001 | D23: =B23-C23 -> -8241.6000000000058 | E23: -4.1202726051065494E-2
A24: 22 | B24: 192637 | C24: 200025.60000000001 | D24: =B24-C24 -> -7388.6000000000058 | E24: -3.6938271901196675E-2
A25: 23 | B25: 205308 | C25: 200025.60000000001 | D25: =B25-C25 -> 5282.3999999999942 | E25: 2.6408619696678796E-2
A26: 24 | B26: 190315 | C26: 200025.60000000001 | D26: =B26-C26 -> -9710.6000000000058 | E26: -4.8546786011390571E-2
A27: 25 | B27: 193906 | C27: 200025.60000000001 | D27: =B27-C27 -> -6119.6000000000058 | E27: -3.05940839572535E-2
A28: 26 | B28: 198110 | C28: 200025.60000000001 | D28: =B28-C28 -> -1915.6000000000058 | E28: -9.5767741729058976E-3
A29: 27 | B29: 205724 | C29: 200025.60000000001 | D29: =B29-C29 -> 5698.3999999999942 | E29: 2.8488353490753154E-2
A30: 28 | B30: 198035 | C30: 200025.60000000001 | D30: =B30-C30 -> -1990.6000000000058 | E30: -9.9517261790491099E-3
A31: 29 | B31: 201146 | C31: 200025.60000000001 | D31: =B31-C31 -> 1120.3999999999942 | E31: 5.6012830357713922E-3
A32: 30 | B32: 201992 | C32: 200025.60000000001 | D32: =B32-C32 -> 1966.3999999999942 | E32: 9.8307416650668424E-3
A33: 31 | B33: 207627 | C33: 200025.60000000001 | D33: =B33-C33 -> 7601.3999999999942 | E33: 3.8002135726626959E-2
A34: 32 | B34: 201301 | C34: 200025.60000000001 | D34: =B34-C34 -> 1275.3999999999942 | E34: 6.3761838484673672E-3
A35: 33 | B35: 203622 | C35: 200025.60000000001 | D35: =B35-C35 -> 3596.3999999999942 | E35: 1.7979698598579352E-2
A36: 34 | B36: 201757 | C36: 200025.60000000001 | D36: =B36-C36 -> 1731.3999999999942 | E36: 8.6558920458181064E-3
A37: 35 | B37: 200280 | C37: 200025.60000000001 | D37: =B37-C37 -> 254.39999999999418 | E37: 1.2718372048377516E-3
A38: 36 | B38: 200004 | C38: 200025.60000000001 | D38: =B38-C38 -> -21.600000000005821 | E38: -1.0798617776927463E-4
A39: 37 | B39: 201251 | C39: 200025.60000000001 | D39: =B39-C39 -> 1225.3999999999942 | E39: 6.1262158443718909E-3
A40: 38 | B40: 204125 | C40: 200025.60000000001 | D40: =B40-C40 -> 4099.3999999999942 | E40: 2.0494376719779838E-2
A41: 39 | B41: 205919 | C41: 200025.60000000001 | D41: =B41-C41 -> 5893.3999999999942 | E41: 2.9463228706725509E-2
A42: 40 | B42: 206918 | C42: 200025.60000000001 | D42: =B42-C42 -> 6892.3999999999942 | E42: 3.4457589428553113E-2

A1: SB 5002 William & Mary Senate Plan Racial Demographics
A2: DISTRICT | B2: Total Population | C2: White | D2: % White | E2: Black | F2: % Black | G2: AIAN | H2: % AIAN | I2: Asian | J2: % Asian | K2: HawPI | L2: % HawPI | M2: Other | N2: % Other | O2: Multi | P2: % Multi | Q2: Total Hispanic | R2: % Hispanic
A3: 1 | B3: 197184 | C3: 150078 | D3: =C3/B3 -> 0.76110637779941581 | E3: 32250 | F3: =E3/B3 -> 0.16355282375851996 | G3: 1401 | H3: =G3/B3 -> 7.1050389483933787E-3 | I3: 8323 | J3: =I3/B3 -> 4.2209307043167804E-2 | K3: 287 | L3: =K3/B3 -> 1.4554933463161311E-3 | M3: 3228 | N3: =M3/B3 -> 1.6370496592015581E-2 | O3: 1617 | P3: =O3/B3 -> 8.2004625121713734E-3 | Q3: 8995 | R3: =Q3/B3 -> 4.5617291463810453E-2
A4: 2 | B4: 200759 | C4: 73399 | D4: =C4/B4 -> 0.36560751946363551 | E4: 113024 | F4: =E4/B4 -> 0.56298347770212043 | G4: 1579 | H4: =G4/B4 -> 7.8651517491121203E-3 | I4: 5113 | J4: =I4/B4 -> 2.5468347620779142E-2 | K4: 349 | L4: =K4/B4 -> 1.7384027615200315E-3 | M4: 3707 | N4: =M4/B4 -> 1.8464925607320219E-2 | O4: 3588 | P4: =O4/B4 -> 1.7872175095512529E-2 | Q4: 11361 | R4: =Q4/B4 -> 5.6590240039051797E-2
A5: 3 | B5: 192559 | C5: 150915 | D5: =C5/B5 -> 0.78373381664840391 | E5: 31685 | F5: =E5/B5 -> 0.16454697001957841 | G5: 2096 | H5: =G5/B5 -> 1.0884975513998307E-2 | I5: 3571 | J5: =I5/B5 -> 1.8544965439164101E-2 | K5: 193 | L5: =K5/B5 -> 1.0022902071572868E-3 | M5: 3057 | N5: =M5/B5 -> 1.5875653695750395E-2 | O5: 1042 | P5: =O5/B5 -> 5.411328475947632E-3 | Q5: 7541 | R5: =Q5/B5 -> 3.9162023068254406E-2
A6: 4 | B6: 203076 | C6: 145253 | D6: =C6/B6 -> 0.7152642360495578 | E6: 38214 | F6: =E6/B6 -> 0.18817585534479703 | G6: 1736 | H6: =G6/B6 -> 8.5485237054107825E-3 | I6: 7169 | J6: =I6/B6 -> 3.5302054403277591E-2 | K6: 346 | L6: =K6/B6 -> 1.7037956233134394E-3 | M6: 8415 | N6: =M6/B6 -> 4.1437688353128881E-2 | O6: 1943 | P6: =O6/B6 -> 9.5678465205144871E-3 | Q6: 19160 | R6: =Q6/B6 -> 9.4348913707183513E-2
A7: 5 | B7: 200588 | C7: 76695 | D7: =C7/B7 -> 0.38235088838813885 | E7: 109307 | F7: =E7/B7 -> 0.5449328972819909 | G7: 1334 | H7: =G7/B7 -> 6.6504476838095995E-3 | I7: 6869 | J7: =I7/B7 -> 3.4244321694218996E-2 | K7: 268 | L7: =K7/B7 -> 1.3360719484714937E-3 | M7: 3706 | N7: =M7/B7 -> 1.8475681496400581E-2 | O7: 2409 | P7: =O7/B7 -> 1.2009691506969509E-2 | Q7: 9905 | R7: =Q7/B7 -> 4.9379823319440845E-2
A8: 6 | B8: 203492 | C8: 151029 | D8: =C8/B8 -> 0.74218642501916532 | E8: 44123 | F8: =E8/B8 -> 0.21682916281721148 | G8: 1659 | H8: =G8/B8 -> 8.1526546498142428E-3 | I8: 2037 | J8: =I8/B8 -> 1.00102215320504E-2 | K8: 177 | L8: =K8/B8 -> 8.6981306390423215E-4 | M8: 3713 | N8: =M8/B8 -> 1.8246417549584257E-2 | O8: 754 | P8: =O8/B8 -> 3.7053053682700055E-3 | Q8: 8622 | R8: =Q8/B8 -> 4.2370216028148527E-2
A9: 7 | B9: 202568 | C9: 130804 | D9: =C9/B9 -> 0.64572884167291966 | E9: 49859 | F9: =E9/B9 -> 0.24613463133367561 | G9: 1949 | H9: =G9/B9 -> 9.6214604478496116E-3 | I9: 11736 | J9: =I9/B9 -> 5.793610046996564E-2 | K9: 473 | L9: =K9/B9 -> 2.3350183642036255E-3 | M9: 5342 | N9: =M9/B9 -> 2.6371391335255321E-2 | O9: 2405 | P9: =O9/B9 -> 1.1872556376130484E-2 | Q9: 14691 | R9: =Q9/B9 -> 7.252379447889104E-2
A10: 8 | B10: 199504 | C10: 144769 | D10: =C10/B10 -> 0.72564459860453923 | E10: 33994 | F10: =E10/B10 -> 0.17039257358248455 | G10: 1555 | H10: =G10/B10 -> 7.7943299382468526E-3 | I10: 12187 | J10: =I10/B10 -> 6.1086494506375814E-2 | K10: 423 | L10: =K10/B10 -> 2.1202582404362819E-3 | M10: 4605 | N10: =M10/B10 -> 2.3082243965033281E-2 | O10: 1971 | P10: =O10/B10 -> 9.8795011628839517E-3 | Q10: 13410 | R10: =Q10/B10 -> 6.7216697409575754E-2
A11: 9 | B11: 200938 | C11: 72882 | D11: =C11/B11 -> 0.36270889528113148 | E11: 117236 | F11: =E11/B11 -> 0.58344364928485404 | G11: 1715 | H11: =G11/B11 -> 8.5349709860753076E-3 | I11: 4994 | J11: =I11/B11 -> 2.4853437378693926E-2 | K11: 115 | L11: =K11/B11 -> 5.7231583871641999E-4 | M11: 2165 | N11: =M11/B11 -> 1.0774467746269993E-2 | O11: 1831 | P11: =O11/B11 -> 9.1122634842588264E-3 | Q11: 5336 | R11: =Q11/B11 -> 2.6555454916441887E-2
A12: 10 | B12: 201790 | C12: 159940 | D12: =C12/B12 -> 0.79260617473611183 | E12: 27558 | F12: =E12/B12 -> 0.13656771891570443 | G12: 1133 | H12: =G12/B12 -> 5.6147480053520991E-3 | I12: 8214 | J12: =I12/B12 -> 4.070568412706279E-2 | K12: 135 | L12: =K12/B12 -> 6.6901233956092969E-4 | M12: 3685 | N12: =M12/B12 -> 1.8261559046533524E-2 | O12: 1125 | P12: =O12/B12 -> 5.5751028296744144E-3 | Q12: 9078 | R12: =Q12/B12 -> 4.4987363100252739E-2
A13: 11 | B13: 200286 | C13: 126517 | D13: =C13/B13 -> 0.63168169517589845 | E13: 62959 | F13: =E13/B13 -> 0.31434548595508421 | G13: 1338 | H13: =G13/B13 -> 6.6804469608459901E-3 | I13: 3516 | J13: =I13/B13 -> 1.7554896498007847E-2 | K13: 162 | L13: =K13/B13 -> 8.088433540037746E-4 | M13: 4539 | N13: =M13/B13 -> 2.2662592492735389E-2 | O13: 1255 | P13: =O13/B13 -> 6.266039563424303E-3 | Q13: 9278 | R13: =Q13/B13 -> 4.6323757027450743E-2
A14: 12 | B14: 201527 | C14: 140675 | D14: =C14/B14 -> 0.69804542319391449 | E14: 32959 | F14: =E14/B14 -> 0.16354632381765222 | G14: 990 | H14: =G14/B14 -> 4.9124931150664672E-3 | I14: 19927 | J14: =I14/B14 -> 9.8880050812049994E-2 | K14: 127 | L14: =K14/B14 -> 6.3018851072064791E-4 | M14: 5536 | N14: =M14/B14 -> 2.7470264530311074E-2 | O14: 1313 | P14: =O14/B14 -> 6.5152560202851231E-3 | Q14: 11996 | R14: =Q14/B14 -> 5.9525522634684185E-2
A15: 13 | B15: 198661 | C15: 119092 | D15: =C15/B15 -> 0.59947347491455294 | E15: 62539 | F15: =E15/B15 -> 0.31480260342996358 | G15: 1586 | H15: =G15/B15 -> 7.9834491923427339E-3 | I15: 7217 | J15: =I15/B15 -> 3.6328217415597427E-2 | K15: 404 | L15: =K15/B15 -> 2.033615052778351E-3 | M15: 5327 | N15: =M15/B15 -> 2.6814523233045239E-2 | O15: 2496 | P15: =O15/B15 -> 1.2564116761719714E-2 | Q15: 13682 | R15: =Q15/B15 -> 6.8871091960676728E-2
A16: 14 | B16: 200862 | C16: 136172 | D16: =C16/B16 -> 0.67793808684569501 | E16: 43127 | F16: =E16/B16 -> 0.21470960161703059 | G16: 1470 | H16: =G16/B16 -> 7.3184574483974073E-3 | I16: 14871 | J16: =I16/B16 -> 7.4035905248379483E-2 | K16: 309 | L16: =K16/B16 -> 1.5383696269080265E-3 | M16: 3152 | N16: =M16/B16 -> 1.569236590295825E-2 | O16: 1761 | P16: =O16/B16 -> 8.7672133106311799E-3 | Q16: 10178 | R16: =Q16/B16 -> 5.0671605380808712E-2
A17: 15 | B17: 190453 | C17: 133034 | D17: =C17/B17 -> 0.69851354402398491 | E17: 45789 | F17: =E17/B17 -> 0.24042152132022074 | G17: 1148 | H17: =G17/B17 -> 6.0277338765994757E-3 | I17: 6187 | J17: =I17/B17 -> 3.248570513460014E-2 | K17: 114 | L17: =K17/B17 -> 5.9857287624768315E-4 | M17: 3413 | N17: =M17/B17 -> 1.7920431812573179E-2 | O17: 768 | P17: =O17/B17 -> 4.0324909557738651E-3 | Q17: 7515 | R17: =Q17/B17 -> 3.945855407895911E-2
A18: 16 | B18: 201930 | C18: 75529 | D18: =C18/B18 -> 0.3740355568761452 | E18: 105140 | F18: =E18/B18 -> 0.52067548160253552 | G18: 1465 | H18: =G18/B18 -> 7.2549893527460007E-3 | I18: 4334 | J18: =I18/B18 -> 2.1462883177338681E-2 | K18: 336 | L18: =K18/B18 -> 1.6639429505274105E-3 | M18: 13278 | N18: =M18/B18 -> 6.5755459812806422E-2 | O18: 1848 | P18: =O18/B18 -> 9.1516862279007582E-3 | Q18: 21628 | R18: =Q18/B18 -> 0.10710642301787748
A19: 17 | B19: 202840 | C19: 170681 | D19: =C19/B19 -> 0.84145632025241568 | E19: 21860 | F19: =E19/B19 -> 0.10776967067639519 | G19: 1449 | H19: =G19/B19 -> 7.1435614277262863E-3 | I19: 2770 | J19: =I19/B19 -> 1.3656083612699665E-2 | K19: 166 | L19: =K19/B19 -> 8.1837901794517848E-4 | M19: 5204 | N19: =M19/B19 -> 2.5655689213172943E-2 | O19: 710 | P19: =O19/B19 -> 3.5002957996450403E-3 | Q19: 10918 | R19: =Q19/B19 -> 5.3825675409189512E-2
A20: 18 | B20: 196762 | C20: 86474 | D20: =C20/B20 -> 0.439485266464053 | E20: 102262 | F20: =E20/B20 -> 0.51972433701629384 | G20: 1343 | H20: =G20/B20 -> 6.8255049247314013E-3 | I20: 2999 | J20: =I20/B20 -> 1.5241764161779206E-2 | K20: 235 | L20: =K20/B20 -> 1.1943363047742959E-3 | M20: 1972 | N20: =M20/B20 -> 1.0022260395808134E-2 | O20: 1477 | P20: =O20/B20 -> 7.5065307325601488E-3 | Q20: 5361 | R20: =Q20/B20 -> 2.7246114595297872E-2
A21: 19 | B21: 191586 | C21: 116391 | D21: =C21/B21 -> 0.60751307506811558 | E21: 70476 | F21: =E21/B21 -> 0.36785568882903763 | G21: 879 | H21: =G21/B21 -> 4.5880179136262569E-3 | I21: 1143 | J21: =I21/B21 -> 5.9659891641351661E-3 | K21: 63 | L21: =K21/B21 -> 3.2883404841689892E-4 | M21: 2062 | N21: =M21/B21 -> 1.0762790600565803E-2 | O21: 572 | P21: =O21/B21 -> 2.985604376102638E-3 | Q21: 4240 | R21: =Q21/B21 -> 2.2131053417264311E-2
A22: 20 | B22: 201898 | C22: 169894 | D22: =C22/B22 -> 0.84148431386145484 | E22: 25955 | F22: =E22/B22 -> 0.12855501292731975 | G22: 958 | H22: =G22/B22 -> 4.7449702324936357E-3 | I22: 1036 | J22: =I22/B22 -> 5.1313039257446826E-3 | K22: 55 | L22: =K22/B22 -> 2.7241478370266175E-4 | M22: 3702 | N22: =M22/B22 -> 1.8335991441222797E-2 | O22: 298 | P22: =O22/B22 -> 1.4759928280616945E-3 | Q22: 6021 | R22: =Q22/B22 -> 2.9821989321340479E-2
A23: 21 | B23: 191784 | C23: 149840 | D23: =C23/B23 -> 0.78129562424394106 | E23: 34043 | F23: =E23/B23 -> 0.17750698702707213 | G23: 1061 | H23: =G23/B23 -> 5.5322654653151464E-3 | I23: 3045 | J23: =I23/B23 -> 1.587723689150294E-2 | K23: 114 | L23: =K23/B23 -> 5.9441872106119381E-4 | M23: 2968 | N23: =M23/B23 -> 1.5475743544821258E-2 | O23: 713 | P23: =O23/B23 -> 3.7177241062862389E-3 | Q23: 6787 | R23: =Q23/B23 -> 3.5388770700371254E-2
A24: 22 | B24: 192637 | C24: 171559 | D24: =C24/B24 -> 0.89058176778085207 | E24: 9418 | F24: =E24/B24 -> 4.8889880967830687E-2 | G24: 981 | H24: =G24/B24 -> 5.0924796378681147E-3 | I24: 8373 | J24: =I24/B24 -> 4.3465170242476786E-2 | K24: 112 | L24: =K24/B24 -> 5.8140440310013128E-4 | M24: 1677 | N24: =M24/B24 -> 8.7054927142760745E-3 | O24: 517 | P24: =O24/B24 -> 2.6838042535961421E-3 | Q24: 4718 | R24: =Q24/B24 -> 2.4491660480593033E-2
A25: 23 | B25: 205308 | C25: 161228 | D25: =C25/B25 -> 0.78529818613984848 | E25: 36588 | F25: =E25/B25 -> 0.17821029867321292 | G25: 1192 | H25: =G25/B25 -> 5.8059111189042801E-3 | I25: 3553 | J25: =I25/B25 -> 1.7305706548210495E-2 | K25: 100 | L25: =K25/B25 -> 4.8707308044498995E-4 | M25: 1939 | N25: =M25/B25 -> 9.4443470298283556E-3 | O25: 708 | P25: =O25/B25 -> 3.448477409550529E-3 | Q25: 4442 | R25: =Q25/B25 -> 2.1635786233366455E-2
A26: 24 | B26: 190315 | C26: 164451 | D26: =C26/B26 -> 0.86409899377348076 | E26: 10587 | F26: =E26/B26 -> 5.5628825893912721E-2 | G26: 1049 | H26: =G26/B26 -> 5.5119144576097519E-3 | I26: 5673 | J26: =I26/B26 -> 2.9808475422326144E-2 | K26: 128 | L26: =K26/B26 -> 6.7256916165304894E-4 | M26: 7798 | N26: =M26/B26 -> 4.0974174395081837E-2 | O26: 629 | P26: =O26/B26 -> 3.3050468959356857E-3 | Q26: 14398 | R26: =Q26/B26 -> 7.5653521792817174E-2
A27: 25 | B27: 193906 | C27: 170696 | D27: =C27/B27 -> 0.88030282714304864 | E27: 17517 | F27: =E27/B27 -> 9.0337586253132957E-2 | G27: 1519 | H27: =G27/B27 -> 7.8336926139469642E-3 | I27: 1549 | J27: =I27/B27 -> 7.9884067537879175E-3 | K27: 105 | L27: =K27/B27 -> 5.4149948944333848E-4 | M27: 2011 | N27: =M27/B27 -> 1.0371004507338607E-2 | O27: 509 | P27: =O27/B27 -> 2.6249832393015174E-3 | Q27: 4789 | R27: =Q27/B27 -> 2.4697533856610936E-2
A28: 26 | B28: 198110 | C28: 175342 | D28: =C28/B28 -> 0.88507394881631418 | E28: 10857 | F28: =E28/B28 -> 5.4802887284841756E-2 | G28: 1414 | H28: =G28/B28 -> 7.1374488920296804E-3 | I28: 2826 | J28: =I28/B28 -> 1.4264802382514765E-2 | K28: 117 | L28: =K28/B28 -> 5.9058099035889152E-4 | M28: 6925 | N28: =M28/B28 -> 3.4955327848165157E-2 | O28: 629 | P28: =O28/B28 -> 3.1750037857755792E-3 | Q28: 13594 | R28: =Q28/B28 -> 6.8618444298621975E-2
A29: 27 | B29: 205724 | C29: 144340 | D29: =C29/B29 -> 0.70161964573895119 | E29: 18875 | F29: =E29/B29 -> 9.1749139623962209E-2 | G29: 1215 | H29: =G29/B29 -> 5.9059711069199506E-3 | I29: 31915 | J29: =I29/B29 -> 0.15513503529000019 | K29: 222 | L29: =K29/B29 -> 1.07911570842488E-3 | M29: 7485 | N29: =M29/B29 -> 3.6383698547568587E-2 | O29: 1672 | P29: =O29/B29 -> 8.1273939841729689E-3 | Q29: 20079 | R29: =Q29/B29 -> 9.7601641033617861E-2
A30: 28 | B30: 198035 | C30: 157703 | D30: =C30/B30 -> 0.79633903097937231 | E30: 34145 | F30: =E30/B30 -> 0.17241901684045749 | G30: 1288 | H30: =G30/B30 -> 6.5039008256116346E-3 | I30: 2143 | J30: =I30/B30 -> 1.0821319463731159E-2 | K30: 104 | L30: =K30/B30 -> 5.2515969399348603E-4 | M30: 2008 | N30: =M30/B30 -> 1.0139621784028077E-2 | O30: 644 | P30: =O30/B30 -> 3.2519504128058173E-3 | Q30: 4698 | R30: =Q30/B30 -> 2.3723079253667283E-2
A31: 29 | B31: 201146 | C31: 123798 | D31: =C31/B31 -> 0.61546339474809342 | E31: 35991 | F31: =E31/B31 -> 0.17892973263201853 | G31: 1950 | H31: =G31/B31 -> 9.6944507969335715E-3 | I31: 14614 | J31: =I31/B31 -> 7.2653694331480612E-2 | K31: 402 | L31: =K31/B31 -> 1.9985483181370746E-3 | M31: 22094 | N31: =M31/B31 -> 0.10984061328587195 | O31: 2297 | P31: =O31/B31 -> 1.1419565887464827E-2 | Q31: 45154 | R31: =Q31/B31 -> 0.22448370835114792
A32: 30 | B32: 201992 | C32: 123180 | D32: =C32/B32 -> 0.60982613172798927 | E32: 41916 | F32: =E32/B32 -> 0.20751316883836984 | G32: 1416 | H32: =G32/B32 -> 7.0101786209354824E-3 | I32: 15848 | J32: =I32/B32 -> 7.8458552813972834E-2 | K32: 276 | L32: =K32/B32 -> 1.3663907481484415E-3 | M32: 17441 | N32: =M32/B32 -> 8.6345003762525255E-2 | O32: 1915 | P32: =O32/B32 -> 9.4805734880589326E-3 | Q32: 35877 | R32: =Q32/B32 -> 0.17761594518594795
A33: 31 | B33: 207627 | C33: 148970 | D33: =C33/B33 -> 0.71748857325877657 | E33: 18608 | F33: =E33/B33 -> 8.9622255294349959E-2 | G33: 1614 | H33: =G33/B33 -> 7.7735554624398561E-3 | I33: 22843 | J33: =I33/B33 -> 0.11001940980700968 | K33: 269 | L33: =K33/B33 -> 1.2955925770733094E-3 | M33: 13625 | N33: =M33/B33 -> 6.5622486478155537E-2 | O33: 1698 | P33: =O33/B33 -> 8.1781271221950894E-3 | Q33: 31382 | R33: =Q33/B33 -> 0.15114604555284236
A34: 32 | B34: 201301 | C34: 142066 | D34: =C34/B34 -> 0.7057391667204832 | E34: 12541 | F34: =E34/B34 -> 6.2299740190063638E-2 | G34: 1099 | H34: =G34/B34 -> 5.4594860432884088E-3 | I34: 34011 | J34: =I34/B34 -> 0.16895594159989269 | K34: 149 | L34: =K34/B34 -> 7.401850959508398E-4 | M34: 10089 | N34: =M34/B34 -> 5.0118976060724983E-2 | O34: 1346 | P34: =O34/B34 -> 6.6865042895961771E-3 | Q34: 24401 | R34: =Q34/B34 -> 0.12121648675366739
A35: 33 | B35: 203622 | C35: 136764 | D35: =C35/B35 -> 0.6716563043286089 | E35: 18119 | F35: =E35/B35 -> 8.8983508658199997E-2 | G35: 1126 | H35: =G35/B35 -> 5.5298543379399085E-3 | I35: 30351 | J35: =I35/B35 -> 0.14905560302914223 | K35: 218 | L35: =K35/B35 -> 1.0706112306135879E-3 | M35: 15212 | N35: =M35/B35 -> 7.470705522978853E-2 | O35: 1832 | P35: =O35/B35 -> 8.9970631857068488E-3 | Q35: 31880 | R35: =Q35/B35 -> 0.15656461482551001
A36: 34 | B36: 201757 | C36: 131782 | D36: =C36/B36 -> 0.65317188499035972 | E36: 12923 | F36: =E36/B36 -> 6.4052300539758231E-2 | G36: 911 | H36: =G36/B36 -> 4.5153328013402263E-3 | I36: 46606 | J36: =I36/B36 -> 0.23100065920885024 | K36: 255 | L36: =K36/B36 -> 1.2638966677736088E-3 | M36: 7833 | N36: =M36/B36 -> 3.8823931759492857E-2 | O36: 1447 | P36: =O36/B36 -> 7.1719940324251451E-3 | Q36: 20041 | R36: =Q36/B36 -> 9.9332365171964296E-2
A37: 35 | B37: 200280 | C37: 112253 | D37: =C37/B37 -> 0.56048032754144195 | E37: 18783 | F37: =E37/B37 -> 9.3783702816057524E-2 | G37: 1640 | H37: =G37/B37 -> 8.1885360495306571E-3 | I37: 40526 | J37: =I37/B37 -> 0.20234671459956061 | K37: 225 | L37: =K37/B37 -> 1.1234272019173157E-3 | M37: 25042 | N37: =M37/B37 -> 0.1250349510685041 | O37: 1811 | P37: =O37/B37 -> 9.0423407229878166E-3 | Q37: 52610 | R37: =Q37/B37 -> 0.26268224485719993
A38: 36 | B38: 200004 | C38: 97928 | D38: =C38/B38 -> 0.48963020739585206 | E38: 54846 | F38: =E38/B38 -> 0.27422451550968979 | G38: 2025 | H38: =G38/B38 -> 1.0124797504049919E-2 | I38: 20499 | J38: =I38/B38 -> 0.10249295014099719 | K38: 406 | L38: =K38/B38 -> 2.0299594008119839E-3 | M38: 21204 | N38: =M38/B38 -> 0.10601787964240715 | O38: 3096 | P38: =O38/B38 -> 1.5479690406191876E-2 | Q38: 44513 | R38: =Q38/B38 -> 0.22256054878902423
A39: 37 | B39: 201251 | C39: 129546 | D39: =C39/B39 -> 0.64370363377076389 | E39: 13399 | F39: =E39/B39 -> 6.6578551162478697E-2 | G39: 1093 | H39: =G39/B39 -> 5.4310289141420416E-3 | I39: 46904 | J39: =I39/B39 -> 0.23306219596424366 | K39: 237 | L39: =K39/B39 -> 1.1776338999557765E-3 | M39: 8641 | N39: =M39/B39 -> 4.2936432613999431E-2 | O39: 1431 | P39: =O39/B39 -> 7.1105236744165249E-3 | Q39: 23172 | R39: =Q39/B39 -> 0.11513980054757492
A40: 38 | B40: 204125 | C40: 194151 | D40: =C40/B40 -> 0.95113778322106557 | E40: 6813 | F40: =E40/B40 -> 3.337660747091243E-2 | G40: 912 | H40: =G40/B40 -> 4.4678505817513777E-3 | I40: 1166 | J40: =I40/B40 -> 5.7121861604409064E-3 | K40: 49 | L40: =K40/B40 -> 2.4004898958971218E-4 | M40: 804 | N40: =M40/B40 -> 3.9387630128597676E-3 | O40: 230 | P40: =O40/B40 -> 1.1267605633802818E-3 | Q40: 1980 | R40: =Q40/B40 -> 9.6999387630128595E-3
A41: 39 | B41: 205919 | C41: 125271 | D41: =C41/B41 -> 0.60835085640470277 | E41: 30132 | F41: =E41/B41 -> 0.14632938194144299 | G41: 1497 | H41: =G41/B41 -> 7.2698488240521761E-3 | I41: 31237 | J41: =I41/B41 -> 0.15169556961717956 | K41: 272 | L41: =K41/B41 -> 1.3209077355659264E-3 | M41: 15522 | N41: =M41/B41 -> 7.537915393917026E-2 | O41: 1988 | P41: =O41/B41 -> 9.654281537886257E-3 | Q41: 34501 | R41: =Q41/B41 -> 0.1675464624439707
A42: 40 | B42: 206918 | C42: 195761 | D42: =C42/B42 -> 0.94608008969736801 | E42: 7037 | F42: =E42/B42 -> 3.4008641104205532E-2 | G42: 1078 | H42: =G42/B42 -> 5.2097932514329351E-3 | I42: 918 | J42: =I42/B42 -> 4.43654007867851E-3 | K42: 82 | L42: =K42/B42 -> 3.9629225103664256E-4 | M42: 1757 | N42: =M42/B42 -> 8.4912864033095236E-3 | O42: 285 | P42: =O42/B42 -> 1.3773572139688186E-3 | Q42: 3893 | R42: =Q42/B42 -> 1.8814216259581091E-2

A1: SB 5002 William & Mary Senate Plan Voting Age Population
A2: DISTRICT | B2: Voting Age Population | C2: VAP White | D2: % VAP White | E2: VAP Black | F2: % VAP Black | G2: VAP AIAN | H2: % VAP AIAN | I2: VAP Asian | J2: % VAP Asian | K2: VAP HawPI | L2: % VAP HawPI | M2: VAP Other | N2: % VAP Other | O2: VAP Multi | P2: % VAP Multi | Q2: Voting Age Hispanic | R2: % VAP Hispanic
A3: 1 | B3: 152158 | C3: 118830 | D3: =C3/B3 -> 0.78096452371876601 | E3: 23112 | F3: =E3/B3 -> 0.15189474099291525 | G3: 1014 | H3: =G3/B3 -> 6.6641254485469053E-3 | I3: 5997 | J3: =I3/B3 -> 3.9412978614335098E-2 | K3: 201 | L3: =K3/B3 -> 1.3209952812208363E-3 | M3: 2092 | N3: =M3/B3 -> 1.3748866310019849E-2 | O3: 912 | P3: =O3/B3 -> 5.9937696341960328E-3 | Q3: 5795 | R3: =Q3/B3 -> 3.8085411217287292E-2
A4: 2 | B4: 156952 | C4: 62102 | D4: =C4/B4 -> 0.39567511086191959 | E4: 83995 | F4: =E4/B4 -> 0.53516361690198277 | G4: 1252 | H4: =G4/B4 -> 7.976961109128905E-3 | I4: 4075 | J4: =I4/B4 -> 2.596335185279576E-2 | K4: 268 | L4: =K4/B4 -> 1.7075284163311077E-3 | M4: 2888 | N4: =M4/B4 -> 1.8400530098374026E-2 | O4: 2372 | P4: =O4/B4 -> 1.5112900759467862E-2 | Q4: 8393 | R4: =Q4/B4 -> 5.347494775472756E-2
A5: 3 | B5: 143118 | C5: 113832 | D5: =C5/B5 -> 0.79537165136460819 | E5: 22889 | F5: =E5/B5 -> 0.15993096605598178 | G5: 1505 | H5: =G5/B5 -> 1.0515798152573402E-2 | I5: 2361 | J5: =I5/B5 -> 1.6496876703140068E-2 | K5: 121 | L5: =K5/B5 -> 8.4545619698430665E-4 | M5: 1859 | N5: =M5/B5 -> 1.2989281571849802E-2 | O5: 551 | P5: =O5/B5 -> 3.8499699548624213E-3 | Q5: 4619 | R5: =Q5/B5 -> 3.2274067552648861E-2
A6: 4 | B6: 147637 | C6: 109287 | D6: =C6/B6 -> 0.74024126743296059 | E6: 25650 | F6: =E6/B6 -> 0.17373693586296118 | G6: 1226 | H6: =G6/B6 -> 8.3041513983621983E-3 | I6: 4915 | J6: =I6/B6 -> 3.3291112661460204E-2 | K6: 230 | L6: =K6/B6 -> 1.5578750584203146E-3 | M6: 5362 | N6: =M6/B6 -> 3.6318808970650991E-2 | O6: 967 | P6: =O6/B6 -> 6.5498486151845401E-3 | Q6: 11967 | R6: =Q6/B6 -> 8.1056916626590897E-2
A7: 5 | B7: 153152 | C7: 63817 | D7: =C7/B7 -> 0.41669060802340158 | E7: 78589 | F7: =E7/B7 -> 0.5131438048474718 | G7: 1064 | H7: =G7/B7 -> 6.9473464270789808E-3 | I7: 5436 | J7: =I7/B7 -> 3.5494149603008777E-2 | K7: 201 | L7: =K7/B7 -> 1.3124216464688676E-3 | M7: 2668 | N7: =M7/B7 -> 1.7420601755119097E-2 | O7: 1377 | P7: =O7/B7 -> 8.9910676974508993E-3 | Q7: 6708 | R7: =Q7/B7 -> 4.3799623903050561E-2
A8: 6 | B8: 161965 | C8: 123116 | D8: =C8/B8 -> 0.7601395363195752 | E8: 33187 | F8: =E8/B8 -> 0.20490229370543017 | G8: 1264 | H8: =G8/B8 -> 7.8041552187200942E-3 | I8: 1434 | J8: =I8/B8 -> 8.853764702250487E-3 | K8: 132 | L8: =K8/B8 -> 8.1499089309418707E-4 | M8: 2361 | N8: =M8/B8 -> 1.4577223474207391E-2 | O8: 471 | P8: =O8/B8 -> 2.90803568672244E-3 | Q8: 5474 | R8: =Q8/B8 -> 3.3797425369678634E-2
A9: 7 | B9: 156313 | C9: 106335 | D9: =C9/B9 -> 0.68026971525081092 | E9: 34327 | F9: =E9/B9 -> 0.21960425556415653 | G9: 1472 | H9: =G9/B9 -> 9.417003064364448E-3 | I9: 8835 | J9: =I9/B9 -> 5.6521210647866783E-2 | K9: 335 | L9: =K9/B9 -> 2.1431358876101156E-3 | M9: 3704 | N9: =M9/B9 -> 2.3696045754351844E-2 | O9: 1305 | P9: =O9/B9 -> 8.3486338308394054E-3 | Q9: 9727 | R9: =Q9/B9 -> 6.2227709787413717E-2
A10: 8 | B10: 150259 | C10: 112102 | D10: =C10/B10 -> 0.74605847237103939 | E10: 23750 | F10: =E10/B10 -> 0.15806041568225532 | G10: 1183 | H10: =G10/B10 -> 7.8730724948256007E-3 | I10: 8812 | J10: =I10/B10 -> 5.864540559966458E-2 | K10: 302 | L10: =K10/B10 -> 2.0098629699385729E-3 | M10: 3076 | N10: =M10/B10 -> 2.0471319521625994E-2 | O10: 1034 | P10: =O10/B10 -> 6.8814513606506103E-3 | Q10: 8631 | R10: =Q10/B10 -> 5.7440818852780864E-2
A11: 9 | B11: 160419 | C11: 64887 | D11: =C11/B11 -> 0.40448450619939036 | E11: 86591 | F11: =E11/B11 -> 0.53978020059967957 | G11: 1388 | H11: =G11/B11 -> 8.6523416802249103E-3 | I11: 4591 | J11: =I11/B11 -> 2.8618804505700698E-2 | K11: 94 | L11: =K11/B11 -> 5.8596550283943917E-4 | M11: 1599 | N11: =M11/B11 -> 9.9676472238325892E-3 | O11: 1269 | P11: =O11/B11 -> 7.9105342883324294E-3 | Q11: 3935 | R11: =Q11/B11 -> 2.4529513336948864E-2
A12: 10 | B12: 150898 | C12: 122004 | D12: =C12/B12 -> 0.80851966228843319 | E12: 19246 | F12: =E12/B12 -> 0.12754310858990842 | G12: 805 | H12: =G12/B12 -> 5.3347294198730268E-3 | I12: 5734 | J12: =I12/B12 -> 3.7999178252859547E-2 | K12: 91 | L12: =K12/B12 -> 6.0305636920303786E-4 | M12: 2397 | N12: =M12/B12 -> 1.5884902384392104E-2 | O12: 621 | P12: =O12/B12 -> 4.1153626953306204E-3 | Q12: 5833 | R12: =Q12/B12 -> 3.8655250566607909E-2
A13: 11 | B13: 153838 | C13: 99796 | D13: =C13/B13 -> 0.64870838154422183 | E13: 46828 | F13: =E13/B13 -> 0.30439813310105435 | G13: 976 | H13: =G13/B13 -> 6.3443362498212409E-3 | I13: 2575 | J13: =I13/B13 -> 1.673838713451813E-2 | K13: 114 | L13: =K13/B13 -> 7.4103927508157935E-4 | M13: 2865 | N13: =M13/B13 -> 1.8623487044813376E-2 | O13: 684 | P13: =O13/B13 -> 4.4462356504894763E-3 | Q13: 5860 | R13: =Q13/B13 -> 3.8092018877000484E-2
A14: 12 | B14: 154733 | C14: 111230 | D14: =C14/B14 -> 0.71885118235928991 | E14: 23971 | F14: =E14/B14 -> 0.15491847246547277 | G14: 725 | H14: =G14/B14 -> 4.6854904900699912E-3 | I14: 14123 | J14: =I14/B14 -> 9.1273354746563437E-2 | K14: 83 | L14: =K14/B14 -> 5.3640787679421972E-4 | M14: 3783 | N14: =M14/B14 -> 2.4448566239910038E-2 | O14: 818 | P14: =O14/B14 -> 5.2865258218996597E-3 | Q14: 8106 | R14: =Q14/B14 -> 5.2387015051734279E-2
A15: 13 | B15: 151181 | C15: 95597 | D15: =C15/B15 -> 0.63233475105998771 | E15: 43603 | F15: =E15/B15 -> 0.28841587236491356 | G15: 1205 | H15: =G15/B15 -> 7.9705783134123992E-3 | I15: 5421 | J15: =I15/B15 -> 3.5857680528637859E-2 | K15: 281 | L15: =K15/B15 -> 1.8586991751608998E-3 | M15: 3751 | N15: =M15/B15 -> 2.4811318882663826E-2 | O15: 1323 | P15: =O15/B15 -> 8.7510996752237381E-3 | Q15: 9040 | R15: =Q15/B15 -> 5.97958738201229E-2
A16: 14 | B16: 149307 | C16: 103183 | D16: =C16/B16 -> 0.69107945374295909 | E16: 31147 | F16: =E16/B16 -> 0.20861044693149014 | G16: 1086 | H16: =G16/B16 -> 7.2736040507143003E-3 | I16: 10700 | J16: =I16/B16 -> 7.1664422967442923E-2 | K16: 201 | L16: =K16/B16 -> 1.3462195342482269E-3 | M16: 2134 | N16: =M16/B16 -> 1.4292698935749831E-2 | O16: 856 | P16: =O16/B16 -> 5.7331538373954338E-3 | Q16: 6385 | R16: =Q16/B16 -> 4.2764237443656358E-2
A17: 15 | B17: 155160 | C17: 111021 | D17: =C17/B17 -> 0.71552590873936583 | E17: 34924 | F17: =E17/B17 -> 0.22508378448053623 | G17: 899 | H17: =G17/B17 -> 5.7940190770817222E-3 | I17: 5349 | J17: =I17/B17 -> 3.4474091260634186E-2 | K17: 88 | L17: =K17/B17 -> 5.6715648362980155E-4 | M17: 2375 | N17: =M17/B17 -> 1.5306780097963393E-2 | O17: 504 | P17: =O17/B17 -> 3.2482598607888632E-3 | Q17: 5360 | R17: =Q17/B17 -> 3.4544985821087906E-2
A18: 16 | B18: 153398 | C18: 61545 | D18: =C18/B18 -> 0.40121122830806139 | E18: 76808 | F18: =E18/B18 -> 0.50071056989008988 | G18: 1149 | H18: =G18/B18 -> 7.490319300121253E-3 | I18: 3350 | J18: =I18/B18 -> 2.1838615888081982E-2 | K18: 220 | L18: =K18/B18 -> 1.4341777598143391E-3 | M18: 9192 | N18: =M18/B18 -> 5.9922554400970024E-2 | O18: 1134 | P18: =O18/B18 -> 7.3925344528611844E-3 | Q18: 14753 | R18: =Q18/B18 -> 9.6174656775186121E-2
A19: 17 | B19: 153896 | C19: 131631 | D19: =C19/B19 -> 0.85532437490253155 | E19: 15626 | F19: =E19/B19 -> 0.10153610230285387 | G19: 1071 | H19: =G19/B19 -> 6.9592452045537248E-3 | I19: 1861 | J19: =I19/B19 -> 1.2092582003430889E-2 | K19: 122 | L19: =K19/B19 -> 7.9274315121900503E-4 | M19: 3204 | N19: =M19/B19 -> 2.0819254561522067E-2 | O19: 381 | P19: =O19/B19 -> 2.4756978738888599E-3 | Q19: 6747 | R19: =Q19/B19 -> 4.3841295420283831E-2
A20: 18 | B20: 149422 | C20: 69328 | D20: =C20/B20 -> 0.46397451513164056 | E20: 74505 | F20: =E20/B20 -> 0.4986213542851789 | G20: 992 | H20: =G20/B20 -> 6.6389152869055423E-3 | I20: 2214 | J20: =I20/B20 -> 1.4817095206863782E-2 | K20: 142 | L20: =K20/B20 -> 9.5032859953688212E-4 | M20: 1379 | N20: =M20/B20 -> 9.2288953433898625E-3 | O20: 862 | P20: =O20/B20 -> 5.7688961464844538E-3 | Q20: 3490 | R20: =Q20/B20 -> 2.335666769284309E-2
A21: 19 | B21: 151389 | C21: 94890 | D21: =C21/B21 -> 0.62679587024156314 | E21: 53320 | F21: =E21/B21 -> 0.35220524608789278 | G21: 681 | H21: =G21/B21 -> 4.4983453223153601E-3 | I21: 824 | J21: =I21/B21 -> 5.4429317850041943E-3 | K21: 45 | L21: =K21/B21 -> 2.9724748825872419E-4 | M21: 1276 | N21: =M21/B21 -> 8.428617667069602E-3 | O21: 353 | P21: =O21/B21 -> 2.3317414078962142E-3 | Q21: 2722 | R21: =Q21/B21 -> 1.7980170289783274E-2
A22: 20 | B22: 160264 | C22: 136847 | D22: =C22/B22 -> 0.85388484001397691 | E22: 19507 | F22: =E22/B22 -> 0.12171791543952479 | G22: 763 | H22: =G22/B22 -> 4.7608945240353419E-3 | I22: 712 | J22: =I22/B22 -> 4.4426695951679728E-3 | K22: 47 | L22: =K22/B22 -> 2.9326611091698695E-4 | M22: 2205 | N22: =M22/B22 -> 1.3758548395148005E-2 | O22: 183 | P22: =O22/B22 -> 1.1418659212299705E-3 | Q22: 3556 | R22: =Q22/B22 -> 2.2188389157889482E-2
A23: 21 | B23: 149924 | C23: 120716 | D23: =C23/B23 -> 0.80518129185453968 | E23: 23760 | F23: =E23/B23 -> 0.15848029668365304 | G23: 843 | H23: =G23/B23 -> 5.6228489101144584E-3 | I23: 2130 | J23: =I23/B23 -> 1.4207198313812331E-2 | K23: 73 | L23: =K23/B23 -> 4.8691336944051654E-4 | M23: 1961 | N23: =M23/B23 -> 1.3079960513326752E-2 | O23: 441 | P23: =O23/B23 -> 2.9414903551132575E-3 | Q23: 4435 | R23: =Q23/B23 -> 2.9581654705050558E-2
A24: 22 | B24: 156600 | C24: 140468 | D24: =C24/B24 -> 0.89698595146871007 | E24: 6854 | F24: =E24/B24 -> 4.3767560664112387E-2 | G24: 783 | H24: =G24/B24 -> 5.0000000000000001E-3 | I24: 6874 | J24: =I24/B24 -> 4.3895274584929755E-2 | K24: 94 | L24: =K24/B24 -> 6.0025542784163468E-4 | M24: 1171 | N24: =M24/B24 -> 7.4776500638569603E-3 | O24: 356 | P24: =O24/B24 -> 2.27330779054917E-3 | Q24: 3425 | R24: =Q24/B24 -> 2.1871008939974457E-2
A25: 23 | B25: 161907 | C25: 130001 | D25: =C25/B25 -> 0.80293625352826004 | E25: 26601 | F25: =E25/B25 -> 0.16429802293909468 | G25: 937 | H25: =G25/B25 -> 5.7872729406387617E-3 | I25: 2516 | J25: =I25/B25 -> 1.5539785185322438E-2 | K25: 75 | L25: =K25/B25 -> 4.6322889065945265E-4 | M25: 1337 | N25: =M25/B25 -> 8.2578270241558428E-3 | O25: 440 | P25: =O25/B25 -> 2.7176094918687889E-3 | Q25: 3093 | R25: =Q25/B25 -> 1.9103559450795827E-2
A26: 24 | B26: 149433 | C26: 131538 | D26: =C26/B26 -> 0.88024733492602036 | E26: 7379 | F26: =E26/B26 -> 4.9379989694378082E-2 | G26: 756 | H26: =G26/B26 -> 5.0591234867800282E-3 | I26: 4283 | J26: =I26/B26 -> 2.8661674462802728E-2 | K26: 112 | L26: =K26/B26 -> 7.4949977581926347E-4 | M26: 4966 | N26: =M26/B26 -> 3.3232284702843416E-2 | O26: 399 | P26: =O26/B26 -> 2.670092951356126E-3 | Q26: 9158 | R26: =Q26/B26 -> 6.1284990597792993E-2
A27: 25 | B27: 154148 | C27: 137237 | D27: =C27/B27 -> 0.89029374367490988 | E27: 13005 | F27: =E27/B27 -> 8.4366972000934168E-2 | G27: 1147 | H27: =G27/B27 -> 7.4409009523315256E-3 | I27: 1154 | J27: =I27/B27 -> 7.4863118561382565E-3 | K27: 76 | L27: =K27/B27 -> 4.9303266990165294E-4 | M27: 1202 | N27: =M27/B27 -> 7.7977009108129852E-3 | O27: 327 | P27: =O27/B27 -> 2.1213379349715859E-3 | Q27: 3027 | R27: =Q27/B27 -> 1.9636972260425045E-2
A28: 26 | B28: 151084 | C28: 136254 | D28: =C28/B28 -> 0.90184268354028219 | E28: 7178 | F28: =E28/B28 -> 4.7509994440178976E-2 | G28: 1008 | H28: =G28/B28 -> 6.6717852320563398E-3 | I28: 1987 | J28: =I28/B28 -> 1.3151624261999947E-2 | K28: 83 | L28: =K28/B28 -> 5.4936326811575017E-4 | M28: 4242 | N28: =M28/B28 -> 2.8077096184903762E-2 | O28: 332 | P28: =O28/B28 -> 2.1974530724630007E-3 | Q28: 8292 | R28: =Q28/B28 -> 5.4883376135130127E-2
A29: 27 | B29: 140016 | C29: 100493 | D29: =C29/B29 -> 0.71772511712947096 | E29: 12227 | F29: =E29/B29 -> 8.7325734201805505E-2 | G29: 797 | H29: =G29/B29 -> 5.6922066049594332E-3 | I29: 20680 | J29: =I29/B29 -> 0.14769740601074163 | K29: 143 | L29: =K29/B29 -> 1.0213118500742773E-3 | M29: 4827 | N29: =M29/B29 -> 3.4474631470689063E-2 | O29: 849 | P29: =O29/B29 -> 6.0635927322591704E-3 | Q29: 12522 | R29: =Q29/B29 -> 8.9432636270140559E-2
A30: 28 | B30: 152046 | C30: 121308 | D30: =C30/B30 -> 0.79783749654709757 | E30: 26660 | F30: =E30/B30 -> 0.17534167291477579 | G30: 948 | H30: =G30/B30 -> 6.2349552109230103E-3 | I30: 1432 | J30: =I30/B30 -> 9.4182023861199907E-3 | K30: 74 | L30: =K30/B30 -> 4.8669481604251343E-4 | M30: 1254 | N30: =M30/B30 -> 8.2475040448285394E-3 | O30: 370 | P30: =O30/B30 -> 2.4334740802125672E-3 | Q30: 2980 | R30: =Q30/B30 -> 1.9599331781171486E-2
A31: 29 | B31: 144988 | C31: 92835 | D31: =C31/B31 -> 0.64029436918917426 | E31: 24597 | F31: =E31/B31 -> 0.1696485226363561 | G31: 1318 | H31: =G31/B31 -> 9.0904074819985105E-3 | I31: 10445 | J31: =I31/B31 -> 7.2040444726460123E-2 | K31: 271 | L31: =K31/B31 -> 1.8691202030512871E-3 | M31: 14267 | N31: =M31/B31 -> 9.840124699975171E-2 | O31: 1255 | P31: =O31/B31 -> 8.6558887632079903E-3 | Q31: 28866 | R31: =Q31/B31 -> 0.19909233867630424
A32: 30 | B32: 164564 | C32: 104066 | D32: =C32/B32 -> 0.63237403077222232 | E32: 32543 | F32: =E32/B32 -> 0.1977528499550327 | G32: 1137 | H32: =G32/B32 -> 6.9091660387448047E-3 | I32: 12701 | J32: =I32/B32 -> 7.7179699083639197E-2 | K32: 224 | L32: =K32/B32 -> 1.3611725529277363E-3 | M32: 12549 | N32: =M32/B32 -> 7.6256046279866804E-2 | O32: 1344 | P32: =O32/B32 -> 8.1670353175664172E-3 | Q32: 26142 | R32: =Q32/B32 -> 0.15885612892248607
A33: 31 | B33: 175001 | C33: 128150 | D33: =C33/B33 -> 0.73228152981982964 | E33: 15039 | F33: =E33/B33 -> 8.5936651790561203E-2 | G33: 1286 | H33: =G33/B33 -> 7.348529436974646E-3 | I33: 18703 | J33: =I33/B33 -> 0.10687367500757139 | K33: 216 | L33: =K33/B33 -> 1.2342786612647928E-3 | M33: 10354 | N33: =M33/B33 -> 5.9165376197850297E-2 | O33: 1253 | P33: =O33/B33 -> 7.1599590859480807E-3 | Q33: 24100 | R33: =Q33/B33 -> 0.13771349878000697
A34: 32 | B34: 152416 | C34: 110025 | D34: =C34/B34 -> 0.72187303170270833 | E34: 8891 | F34: =E34/B34 -> 5.8333770732731473E-2 | G34: 762 | H34: =G34/B34 -> 4.999475120722234E-3 | I34: 24626 | J34: =I34/B34 -> 0.16157096367835397 | K34: 120 | L34: =K34/B34 -> 7.873189166491707E-4 | M34: 7141 | N34: =M34/B34 -> 4.6852036531597731E-2 | O34: 851 | P34: =O34/B34 -> 5.5834033172370351E-3 | Q34: 17157 | R34: =Q34/B34 -> 0.11256692210791518
A35: 33 | B35: 143649 | C35: 98550 | D35: =C35/B35 -> 0.68604724014786045 | E35: 12384 | F35: =E35/B35 -> 8.6210137209448034E-2 | G35: 739 | H35: =G35/B35 -> 5.144484124497908E-3 | I35: 20529 | J35: =I35/B35 -> 0.14291084518513877 | K35: 159 | L35: =K35/B35 -> 1.1068646492492116E-3 | M35: 10284 | N35: =M35/B35 -> 7.1591170143892408E-2 | O35: 1004 | P35: =O35/B35 -> 6.9892585399132607E-3 | Q35: 21328 | R35: =Q35/B35 -> 0.14847301408293828
A36: 34 | B36: 149243 | C36: 100034 | D36: =C36/B36 -> 0.6702759928438855 | E36: 9248 | F36: =E36/B36 -> 6.1966055359380337E-2 | G36: 618 | H36: =G36/B36 -> 4.1408977305468263E-3 | I36: 32855 | J36: =I36/B36 -> 0.22014432837721032 | K36: 183 | L36: =K36/B36 -> 1.2261881629289145E-3 | M36: 5423 | N36: =M36/B36 -> 3.6336712609636633E-2 | O36: 882 | P36: =O36/B36 -> 5.9098249164114902E-3 | Q36: 13858 | R36: =Q36/B36 -> 9.285527629436556E-2
A37: 35 | B37: 156107 | C37: 90180 | D37: =C37/B37 -> 0.57768069337057271 | E37: 13676 | F37: =E37/B37 -> 8.7606577539764391E-2 | G37: 1210 | H37: =G37/B37 -> 7.7510938010467182E-3 | I37: 31541 | J37: =I37/B37 -> 0.20204731370149961 | K37: 162 | L37: =K37/B37 -> 1.0377497485698911E-3 | M37: 18097 | N37: =M37/B37 -> 0.11592689629548963 | O37: 1241 | P37: =O37/B37 -> 7.9496755430570054E-3 | Q37: 38346 | R37: =Q37/B37 -> 0.24563920900408054
A38: 36 | B38: 142428 | C38: 73813 | D38: =C38/B38 -> 0.51824781644058748 | E38: 36959 | F38: =E38/B38 -> 0.2594925155166119 | G38: 1341 | H38: =G38/B38 -> 9.4152835116690543E-3 | I38: 14523 | J38: =I38/B38 -> 0.10196730979863509 | K38: 299 | L38: =K38/B38 -> 2.0993063161737859E-3 | M38: 13886 | N38: =M38/B38 -> 9.7494874603308343E-2 | O38: 1607 | P38: =O38/B38 -> 1.1282893813014295E-2 | Q38: 28743 | R38: =Q38/B38 -> 0.20180722891566266
A39: 37 | B39: 154571 | C39: 102057 | D39: =C39/B39 -> 0.66025968648711597 | E39: 9782 | F39: =E39/B39 -> 6.3284833506932092E-2 | G39: 799 | H39: =G39/B39 -> 5.1691455706439115E-3 | I39: 34648 | J39: =I39/B39 -> 0.22415588952649593 | K39: 161 | L39: =K39/B39 -> 1.041592536763041E-3 | M39: 6244 | N39: =M39/B39 -> 4.0395675773592717E-2 | O39: 880 | P39: =O39/B39 -> 5.6931765984563724E-3 | Q39: 16652 | R39: =Q39/B39 -> 0.10773042808806309
A40: 38 | B40: 164134 | C40: 156547 | D40: =C40/B40 -> 0.95377557361667908 | E40: 5205 | F40: =E40/B40 -> 3.1711893940317058E-2 | G40: 733 | H40: =G40/B40 -> 4.465863258069626E-3 | I40: 920 | J40: =I40/B40 -> 5.6051762584229956E-3 | K40: 45 | L40: =K40/B40 -> 2.7416623003155956E-4 | M40: 533 | N40: =M40/B40 -> 3.2473466801515834E-3 | O40: 151 | P40: =O40/B40 -> 9.1998001632812216E-4 | Q40: 1360 | R40: =Q40/B40 -> 8.2859127298426892E-3
A41: 39 | B41: 154342 | C41: 96911 | D41: =C41/B41 -> 0.62789778543753483 | E41: 21155 | F41: =E41/B41 -> 0.13706573712923248 | G41: 1020 | H41: =G41/B41 -> 6.6087001593862979E-3 | I41: 23133 | J41: =I41/B41 -> 0.14988143214419924 | K41: 191 | L41: =K41/B41 -> 1.2375115004341008E-3 | M41: 10754 | N41: =M41/B41 -> 6.9676432856902198E-2 | O41: 1178 | P41: =O41/B41 -> 7.6324007723108421E-3 | Q41: 23743 | R41: =Q41/B41 -> 0.15383369400422439
A42: 40 | B42: 165287 | C42: 156781 | D42: =C42/B42 -> 0.94853799754366652 | E42: 5530 | F42: =E42/B42 -> 3.345695668745878E-2 | G42: 884 | H42: =G42/B42 -> 5.3482730039265038E-3 | I42: 675 | J42: =I42/B42 -> 4.0838057439484049E-3 | K42: 53 | L42: =K42/B42 -> 3.2065437693224515E-4 | M42: 1172 | N42: =M42/B42 -> 7.090696788011156E-3 | O42: 192 | P42: =O42/B42 -> 1.1616158560564351E-3 | Q42: 2529 | R42: =Q42/B42 -> 1.5300658853993357E-2

A1: SB 5002 William & Mary Senate Plan Election Data
A2: DISTRICT | B2: Rep. Gov '09 | C2: Dem. Gov '09 | D2: Rep. Lt. Gov '09 | E2: Dem. Lt. Gov '09 | F2: Rep. Att. Gen. '09 | G2: Dem. Att. Gen. '09
A3: 1 | B3: 0.65706280397547046 | C3: 0.34293719602452949 | D3: 0.61920647313506993 | E3: 0.38079352686493007 | F3: 0.63343317643702757 | G3: 0.36656682356297249
A4: 2 | B4: 0.32794457274826788 | C4: 0.67205542725173206 | D4: 0.30684204386374242 | E4: 0.69315795613625764 | F4: 0.32160154988698741 | G4: 0.67839845011301259
A5: 3 | B5: 0.71794617928357851 | C5: 0.28205382071642143 | D5: 0.69670592932721098 | E5: 0.30329407067278896 | F5: 0.70729412706673611 | G5: 0.29270587293326394
A6: 4 | B6: 0.65103762606671833 | C6: 0.34896237393328161 | D6: 0.63189792663476874 | E6: 0.36810207336523126 | F6: 0.62263919548687763 | G6: 0.37736080451312237
A7: 5 | B7: 0.34384400809495158 | C7: 0.65615599190504836 | D7: 0.31359754886663449 | E7: 0.68640245113336551 | F7: 0.33745452478399274 | G7: 0.66254547521600726
A8: 6 | B8: 0.65680504192926714 | C8: 0.34319495807073286 | D8: 0.62695471072046316 | E8: 0.3730452892795369 | F8: 0.64033238248790769 | G8: 0.35966761751209225
A9: 7 | B9: 0.60521447423595864 | C9: 0.39478552576404136 | D9: 0.54830722587165237 | E9: 0.45169277412834763 | F9: 0.58581132075471698 | G9: 0.41418867924528302
A10: 8 | B10: 0.66281956961559685 | C10: 0.33718043038440315 | D10: 0.60024375380865325 | E10: 0.39975624619134675 | F10: 0.64281361335083442 | G10: 0.35718638664916558
A11: 9 | B11: 0.27476840948343539 | C11: 0.72523159051656461 | D11: 0.27023593466424684 | E11: 0.72976406533575322 | F11: 0.28938782029342641 | G11: 0.71061217970657353
A12: 10 | B12: 0.67884397315271694 | C12: 0.32115602684728312 | D12: 0.65155311006255479 | E12: 0.34844688993744527 | F12: 0.67490142927550523 | G12: 0.32509857072449483
A13: 11 | B13: 0.6452301127704968 | C13: 0.3547698872295032 | D13: 0.61756720065164272 | E13: 0.38243279934835733 | F13: 0.6402088772845953 | G13: 0.3597911227154047
A14: 12 | B14: 0.63171529130116311 | C14: 0.36828470869883695 | D14: 0.60179769636513691 | E14: 0.39820230363486309 | F14: 0.62190647482014394 | G14: 0.37809352517985612
A15: 13 | B15: 0.59423769507803126 | C15: 0.4057623049219688 | D15: 0.56148988783891196 | E15: 0.43851011216108804 | F15: 0.57467417324230874 | G15: 0.42532582675769126
A16: 14 | B16: 0.66035681380350109 | C16: 0.33964318619649886 | D16: 0.61461609224910685 | E16: 0.38538390775089321 | F16: 0.64580616193795304 | G16: 0.35419383806204702
A17: 15 | B17: 0.52106141739111578 | C17: 0.47893858260888417 | D17: 0.50522003435971985 | E17: 0.49477996564028015 | F17: 0.52177862460120528 | G17: 0.47822137539879478
A18: 16 | B18: 0.41195690330245999 | C18: 0.58804309669754007 | D18: 0.39575981397893584 | E18: 0.60424018602106411 | F18: 0.4185152646606633 | G18: 0.58148473533933676
A19: 17 | B19: 0.68890826053175158 | C19: 0.31109173946824842 | D19: 0.66423455770818529 | E19: 0.33576544229181465 | F19: 0.67090528418585893 | G19: 0.32909471581414113
A20: 18 | B20: 0.45519912735691548 | C20: 0.54480087264308452 | D20: 0.4319240252031778 | E20: 0.56807597479682226 | F20: 0.44900211533155521 | G20: 0.55099788466844479
A21: 19 | B21: 0.63165078037290601 | C21: 0.36834921962709399 | D21: 0.63463456655785278 | E21: 0.36536543344214728 | F21: 0.64329559405265313 | G21: 0.35670440594734687
A22: 20 | B22: 0.67250778816199375 | C22: 0.32749221183800625 | D22: 0.65499022340558311 | E22: 0.34500977659441695 | F22: 0.66360625497840942 | G22: 0.33639374502159058
A23: 21 | B23: 0.56678317313693671 | C23: 0.43321682686306329 | D23: 0.5640515965320364 | E23: 0.43594840346796365 | F23: 0.5856699135799861 | G23: 0.41433008642001395
A24: 22 | B24: 0.62011061637681453 | C24: 0.37988938362318553 | D24: 0.60633675316837654 | E24: 0.3936632468316234 | F24: 0.62177766114217659 | G24: 0.37822233885782347
A25: 23 | B25: 0.7175795569250385 | C25: 0.2824204430749615 | D25: 0.70550706976577482 | E25: 0.29449293023422518 | F25: 0.71687374317724795 | G25: 0.28312625682275211
A26: 24 | B26: 0.6442809532792555 | C26: 0.3557190467207445 | D26: 0.63626561806304305 | E26: 0.36373438193695695 | F26: 0.64840289111681049 | G26: 0.35159710888318957
A27: 25 | B27: 0.67042938052403633 | C27: 0.32957061947596372 | D27: 0.68181635684747255 | E27: 0.3181836431525274 | F27: 0.68591673692239752 | G27: 0.31408326307760248
A28: 26 | B28: 0.71379393514153533 | C28: 0.28620606485846473 | D28: 0.69415159249805791 | E28: 0.30584840750194209 | F28: 0.69349721562798128 | G28: 0.30650278437201872
A29: 27 | B29: 0.64722276075998453 | C29: 0.35277723924001553 | D29: 0.62351908731899952 | E29: 0.37648091268100042 | F29: 0.62355551221414984 | G29: 0.3764444877858501
A30: 28 | B30: 0.70567928543897573 | C30: 0.29432071456102427 | D30: 0.68179589904829518 | E30: 0.31820410095170476 | F30: 0.70526958705167797 | G30: 0.29473041294832208
A31: 29 | B31: 0.60035599479291202 | C31: 0.39964400520708804 | D31: 0.57382308124147885 | E31: 0.42617691875852115 | F31: 0.5813169164882227 | G31: 0.4186830835117773
A32: 30 | B32: 0.3891961970613656 | C32: 0.61080380293863445 | D32: 0.36707234765191266 | E32: 0.63292765234808734 | F32: 0.36418040843070876 | G32: 0.63581959156929124
A33: 31 | B33: 0.3420665349908989 | C33: 0.6579334650091011 | D33: 0.32280297557451626 | E33: 0.67719702442548368 | F33: 0.32143904585003424 | G33: 0.67856095414996576
A34: 32 | B34: 0.48016934046345811 | C34: 0.51983065953654184 | D34: 0.45716314442139883 | E34: 0.54283685557860117 | F34: 0.44842168291450707 | G34: 0.55157831708549299
A35: 33 | B35: 0.59614611596824441 | C35: 0.40385388403175559 | D35: 0.57056645874537248 | E35: 0.42943354125462752 | F35: 0.5727695966803299 | G35: 0.42723040331967005
A36: 34 | B36: 0.54635096475744116 | C36: 0.4536490352425589 | D36: 0.51963406914296217 | E36: 0.48036593085703783 | F36: 0.50464655542166215 | G36: 0.49535344457833785
A37: 35 | B37: 0.43673624288425045 | C37: 0.5632637571157495 | D37: 0.41571616159015423 | E37: 0.58428383840984577 | F37: 0.40855234536939888 | G37: 0.59144765463060112
A38: 36 | B38: 0.51379952314073885 | C38: 0.48620047685926121 | D38: 0.48287547293962824 | E38: 0.51712452706037182 | F38: 0.49310015479366331 | G38: 0.50689984520633669
A39: 37 | B39: 0.55032446876192898 | C39: 0.44967553123807102 | D39: 0.5260034158838599 | E39: 0.47399658411614004 | F39: 0.52075810345932783 | G39: 0.47924189654067223
A40: 38 | B40: 0.66196810270663753 | C40: 0.33803189729336247 | D40: 0.65584621662057396 | E40: 0.34415378337942604 | F40: 0.64689879060835376 | G40: 0.3531012093916463
A41: 39 | B41: 0.51344075300123637 | C41: 0.48655924699876363 | D41: 0.48608713109817303 | E41: 0.51391286890182697 | F41: 0.48467182631420241 | G41: 0.51532817368579753
A42: 40 | B42: 0.73762255715645264 | C42: 0.26237744284354736 | D42: 0.74602350923899552 | E42: 0.25397649076100443 | F42: 0.73719023241063741 | G42: 0.26280976758936259