A1: SB 5004 - M. Locke Population Totals
A2: DISTRICT | B2: Total Population | C2: Target | D2: Difference | E2: Deviation
A3: 1 | B3: 727367 | C3: 727365.818181818 | D3: =B3-C3 -> 1.1818181819980964 | E3: =(B3-C3)/C3 -> 1.6247920268679438E-6
A4: 2 | B4: 727362 | C4: 727365.818181818 | D4: =B4-C4 -> -3.8181818180019036 | E4: =(B4-C4)/C4 -> -5.2493280857576422E-6
A5: 3 | B5: 727367 | C5: 727365.818181818 | D5: =B5-C5 -> 1.1818181819980964 | E5: =(B5-C5)/C5 -> 1.6247920268679438E-6
A6: 4 | B6: 727367 | C6: 727365.818181818 | D6: =B6-C6 -> 1.1818181819980964 | E6: =(B6-C6)/C6 -> 1.6247920268679438E-6
A7: 5 | B7: 727366 | C7: 727365.818181818 | D7: =B7-C7 -> 0.18181818199809641 | E7: =(B7-C7)/C7 -> 2.4996800434282676E-7
A8: 6 | B8: 727366 | C8: 727365.818181818 | D8: =B8-C8 -> 0.18181818199809641 | E8: =(B8-C8)/C8 -> 2.4996800434282676E-7
A9: 7 | B9: 727366 | C9: 727365.818181818 | D9: =B9-C9 -> 0.18181818199809641 | E9: =(B9-C9)/C9 -> 2.4996800434282676E-7
A10: 8 | B10: 727366 | C10: 727365.818181818 | D10: =B10-C10 -> 0.18181818199809641 | E10: =(B10-C10)/C10 -> 2.4996800434282676E-7
A11: 9 | B11: 727366 | C11: 727365.818181818 | D11: =B11-C11 -> 0.18181818199809641 | E11: =(B11-C11)/C11 -> 2.4996800434282676E-7
A12: 10 | B12: 727365 | C12: 727365.818181818 | D12: =B12-C12 -> -0.81818181800190359 | E12: =(B12-C12)/C12 -> -1.1248560181822903E-6
A13: 11 | B13: 727366 | C13: 727365.818181818 | D13: =B13-C13 -> 0.18181818199809641 | E13: =(B13-C13)/C13 -> 2.4996800434282676E-7

A1: SB 5004 - M. Locke Racial Demographics
A2: DISTRICT | B2: Total Population | C2: White | D2: % White | E2: Black | F2: % Black | G2: AIAN | H2: % AIAN | I2: Asian | J2: % Asian | K2: HawPI | L2: % HawPI | M2: Other | N2: % Other | O2: Multi | P2: % Multi | Q2: Total Hispanic | R2: % Hispanic
A3: 1 | B3: 727367 | C3: 543967 | D3: =C3/B3 -> 0.74785768394771823 | E3: 139147 | F3: =E3/B3 -> 0.19130232743580614 | G3: 6325 | H3: =G3/B3 -> 8.6957478136896506E-3 | I3: 16993 | J3: =I3/B3 -> 2.3362346655814738E-2 | K3: 790 | L3: =K3/B3 -> 1.0861092130932527E-3 | M3: 15480 | N3: =M3/B3 -> 2.1282241289472852E-2 | O3: 4665 | P3: =O3/B3 -> 6.4135436444050942E-3 | Q3: 37841 | R3: =Q3/B3 -> 5.2024631307166808E-2
A4: 2 | B4: 727362 | C4: 518695 | D4: =C4/B4 -> 0.71311808975448265 | E4: 138310 | F4: =E4/B4 -> 0.19015290873045335 | G4: 5776 | H4: =G4/B4 -> 7.9410252391518936E-3 | I4: 42153 | J4: =I4/B4 -> 5.7953261237183133E-2 | K4: 1317 | L4: =K4/B4 -> 1.8106527423758733E-3 | M4: 14619 | N4: =M4/B4 -> 2.0098657889744034E-2 | O4: 6492 | P4: =O4/B4 -> 8.925404406609088E-3 | Q4: 42063 | R4: =Q4/B4 -> 5.7829526425631252E-2
A5: 3 | B5: 727367 | C5: 346939 | D5: =C5/B5 -> 0.4769792965586836 | E5: 324133 | F5: =E5/B5 -> 0.44562511084500672 | G5: 5760 | H5: =G5/B5 -> 7.9189735030596661E-3 | I5: 23671 | J5: =I5/B5 -> 3.254340656092454E-2 | K5: 1362 | L5: =K5/B5 -> 1.8725072762443167E-3 | M5: 15620 | N5: =M5/B5 -> 2.147471633989444E-2 | O5: 9882 | P5: =O5/B5 -> 1.358598891618674E-2 | Q5: 42499 | R5: =Q5/B5 -> 5.842855119905082E-2
A6: 4 | B6: 727367 | C6: 290090 | D6: =C6/B6 -> 0.39882205269141985 | E6: 389360 | F6: =E6/B6 -> 0.53530061165821385 | G6: 4973 | H6: =G6/B6 -> 6.8369887553325903E-3 | I6: 14227 | J6: =I6/B6 -> 1.955958958819963E-2 | K6: 679 | L6: =K6/B6 -> 9.3350399454470714E-4 | M6: 22066 | N6: =M6/B6 -> 3.0336817590019893E-2 | O6: 5972 | P6: =O6/B6 -> 8.2104357222695015E-3 | Q6: 40841 | R6: =Q6/B6 -> 5.6149096673343717E-2
A7: 5 | B7: 727366 | C7: 521885 | D7: =C7/B7 -> 0.71749985564351371 | E7: 170723 | F7: =E7/B7 -> 0.23471402292655966 | G7: 4277 | H7: =G7/B7 -> 5.8801208744978456E-3 | I7: 15480 | J7: =I7/B7 -> 2.1282270548802117E-2 | K7: 387 | L7: =K7/B7 -> 5.3205676372005295E-4 | M7: 11775 | N7: =M7/B7 -> 1.6188548818614014E-2 | O7: 2839 | P7: =O7/B7 -> 3.9031244242925846E-3 | Q7: 24365 | R7: =Q7/B7 -> 3.3497578935501524E-2
A8: 6 | B8: 727366 | C8: 654758 | D8: =C8/B8 -> 0.90017680232510178 | E8: 43343 | F8: =E8/B8 -> 5.9588982712967059E-2 | G8: 4482 | H8: =G8/B8 -> 6.1619597286647985E-3 | I8: 9662 | J8: =I8/B8 -> 1.3283546385176101E-2 | K8: 377 | L8: =K8/B8 -> 5.1830852693142101E-4 | M8: 13119 | N8: =M8/B8 -> 1.8036311843006133E-2 | O8: 1625 | P8: =O8/B8 -> 2.2340884781526771E-3 | Q8: 27378 | R8: =Q8/B8 -> 3.7639922679916303E-2
A9: 7 | B9: 727366 | C9: 551123 | D9: =C9/B9 -> 0.75769695036611551 | E9: 98626 | F9: =E9/B9 -> 0.13559336015156057 | G9: 4790 | H9: =G9/B9 -> 6.5854054217546597E-3 | I9: 41863 | J9: =I9/B9 -> 5.7554243668249544E-2 | K9: 667 | L9: =K9/B9 -> 9.1700739380174497E-4 | M9: 25793 | N9: =M9/B9 -> 3.5460827148918149E-2 | O9: 4504 | P9: =O9/B9 -> 6.1922058495997891E-3 | Q9: 56069 | R9: =Q9/B9 -> 7.7084988850179961E-2
A10: 8 | B10: 727366 | C10: 454669 | D10: =C10/B10 -> 0.62508970724504587 | E10: 105900 | F10: =E10/B10 -> 0.14559382759161138 | G10: 5554 | H10: =G10/B10 -> 7.6357707124061341E-3 | I10: 89760 | J10: =I10/B10 -> 0.12340417341475955 | K10: 962 | L10: =K10/B10 -> 1.3225803790663847E-3 | M10: 63612 | N10: =M10/B10 -> 8.7455283859844982E-2 | O10: 6909 | P10: =O10/B10 -> 9.4986567972657511E-3 | Q10: 135594 | R10: =Q10/B10 -> 0.18641784191177482
A11: 9 | B11: 727366 | C11: 651235 | D11: =C11/B11 -> 0.89533329850446686 | E11: 52481 | F11: =E11/B11 -> 7.2152121490418858E-2 | G11: 3669 | H11: =G11/B11 -> 5.044228077749029E-3 | I11: 10909 | J11: =I11/B11 -> 1.4997951512718493E-2 | K11: 303 | L11: =K11/B11 -> 4.165715746955453E-4 | M11: 7238 | N11: =M11/B11 -> 9.9509737876117381E-3 | O11: 1531 | P11: =O11/B11 -> 2.1048550523395373E-3 | Q11: 16356 | R11: =Q11/B11 -> 2.2486616091486267E-2
A12: 10 | B12: 727365 | C12: 527743 | D12: =C12/B12 -> 0.7255545702638978 | E12: 54611 | F12: =E12/B12 -> 7.5080599148982977E-2 | G12: 4011 | H12: =G12/B12 -> 5.5144253572827944E-3 | I12: 96867 | J12: =I12/B12 -> 0.13317522839289764 | K12: 778 | L12: =K12/B12 -> 1.0696142926866154E-3 | M12: 38400 | N12: =M12/B12 -> 5.2793301849827806E-2 | O12: 4955 | P12: =O12/B12 -> 6.8122606944243953E-3 | Q12: 85367 | R12: =Q12/B12 -> 0.11736473434932942
A13: 11 | B13: 727366 | C13: 425748 | D13: =C13/B13 -> 0.58532843162864368 | E13: 96820 | F13: =E13/B13 -> 0.13311042858753364 | G13: 5246 | H13: =G13/B13 -> 7.2123250193162729E-3 | I13: 137228 | J13: =I13/B13 -> 0.18866430380303725 | K13: 957 | L13: =K13/B13 -> 1.3157062606720688E-3 | M13: 54161 | N13: =M13/B13 -> 7.4461825270909013E-2 | O13: 7206 | P13: =O13/B13 -> 9.9069794298881162E-3 | Q13: 123452 | R13: =Q13/B13 -> 0.169724732803018

A1: SB 5004 - M. Locke Voting Age Population
A2: DISTRICT | B2: Voting Age Population | C2: VAP White | D2: % VAP White | E2: VAP Black | F2: % VAP Black | G2: VAP AIAN | H2: % VAP AIAN | I2: VAP Asian | J2: % VAP Asian | K2: VAP HawPI | L2: % VAP HawPI | M2: VAP Other | N2: % VAP Other | O2: VAP Multi | P2: % VAP Multi | Q2: Voting Age Hispanic | R2: % VAP Hispanic
A3: 1 | B3: 546844 | C3: 418340 | D3: =C3/B3 -> 0.7650079364498833 | E3: 99668 | F3: =E3/B3 -> 0.18226038870317676 | G3: 4567 | H3: =G3/B3 -> 8.3515591283803061E-3 | I3: 11558 | J3: =I3/B3 -> 2.113582667086043E-2 | K3: 526 | L3: =K3/B3 -> 9.6188309645895353E-4 | M3: 9717 | N3: =M3/B3 -> 1.7769235833254092E-2 | O3: 2468 | P3: =O3/B3 -> 4.5131701179861169E-3 | Q3: 23596 | R3: =Q3/B3 -> 4.3149417384116859E-2
A4: 2 | B4: 552119 | C4: 404939 | D4: =C4/B4 -> 0.73342703294036249 | E4: 98363 | F4: =E4/B4 -> 0.17815543388291291 | G4: 4330 | H4: =G4/B4 -> 7.8425122120412451E-3 | I4: 30538 | J4: =I4/B4 -> 5.5310539937948162E-2 | K4: 917 | L4: =K4/B4 -> 1.6608738333583884E-3 | M4: 9652 | N4: =M4/B4 -> 1.7481738538249907E-2 | O4: 3380 | P4: =O4/B4 -> 6.1218686551268841E-3 | Q4: 26708 | R4: =Q4/B4 -> 4.8373629597967108E-2
A5: 3 | B5: 563795 | C5: 287650 | D5: =C5/B5 -> 0.51020317668656157 | E5: 234693 | F5: =E5/B5 -> 0.41627364556266017 | G5: 4491 | H5: =G5/B5 -> 7.9656612775920333E-3 | I5: 18600 | J5: =I5/B5 -> 3.2990714710134005E-2 | K5: 986 | L5: =K5/B5 -> 1.7488626185049531E-3 | M5: 11439 | N5: =M5/B5 -> 2.0289289546732411E-2 | O5: 5936 | P5: =O5/B5 -> 1.0528649597814809E-2 | Q5: 29517 | R5: =Q5/B5 -> 5.235413581177556E-2
A6: 4 | B6: 562948 | C6: 240551 | D6: =C6/B6 -> 0.42730589681462589 | E6: 287625 | F6: =E6/B6 -> 0.51092640883349794 | G6: 3862 | H6: =G6/B6 -> 6.8603139188699487E-3 | I6: 11454 | J6: =I6/B6 -> 2.0346461840169961E-2 | K6: 448 | L6: =K6/B6 -> 7.9581062549294074E-4 | M6: 15279 | N6: =M6/B6 -> 2.714105032791661E-2 | O6: 3729 | P6: =O6/B6 -> 6.6240576394267321E-3 | Q6: 27839 | R6: =Q6/B6 -> 4.9452169649772268E-2
A7: 5 | B7: 573420 | C7: 421926 | D7: =C7/B7 -> 0.73580621533954171 | E7: 126588 | F7: =E7/B7 -> 0.22075965261065189 | G7: 3260 | H7: =G7/B7 -> 5.6851871228767743E-3 | I7: 12085 | J7: =I7/B7 -> 2.1075302570541663E-2 | K7: 295 | L7: =K7/B7 -> 5.1445711694743813E-4 | M7: 7548 | N7: =M7/B7 -> 1.3163126504133095E-2 | O7: 1718 | P7: =O7/B7 -> 2.9960587353074536E-3 | Q7: 16085 | R7: =Q7/B7 -> 2.8050992291862857E-2
A8: 6 | B8: 572210 | C8: 520978 | D8: =C8/B8 -> 0.91046643714720121 | E8: 31425 | F8: =E8/B8 -> 5.4918648747837334E-2 | G8: 3393 | H8: =G8/B8 -> 5.9296412156376157E-3 | I8: 6942 | J8: =I8/B8 -> 1.2131909613603397E-2 | K8: 295 | L8: =K8/B8 -> 5.1554499222313487E-4 | M8: 8202 | N8: =M8/B8 -> 1.4333898393946278E-2 | O8: 975 | P8: =O8/B8 -> 1.7039198895510389E-3 | Q8: 17083 | R8: =Q8/B8 -> 2.9854424075077331E-2
A9: 7 | B9: 542620 | C9: 420286 | D9: =C9/B9 -> 0.77454940842578601 | E9: 70057 | F9: =E9/B9 -> 0.12910876856732151 | G9: 3405 | H9: =G9/B9 -> 6.2751096531642771E-3 | I9: 29110 | J9: =I9/B9 -> 5.3647119531163613E-2 | K9: 445 | L9: =K9/B9 -> 8.2009509417271754E-4 | M9: 16805 | N9: =M9/B9 -> 3.0970107994544985E-2 | O9: 2512 | P9: =O9/B9 -> 4.629390733846891E-3 | Q9: 35996 | R9: =Q9/B9 -> 6.6337400022114926E-2
A10: 8 | B10: 580212 | C10: 375269 | D10: =C10/B10 -> 0.64677910832592223 | E10: 79591 | F10: =E10/B10 -> 0.13717572197748409 | G10: 4213 | H10: =G10/B10 -> 7.2611390319400494E-3 | I10: 69715 | J10: =I10/B10 -> 0.12015435737282235 | K10: 738 | L10: =K10/B10 -> 1.2719488738598995E-3 | M10: 46039 | N10: =M10/B10 -> 7.9348582931755979E-2 | O10: 4647 | P10: =O10/B10 -> 8.0091414862153831E-3 | Q10: 98819 | R10: =Q10/B10 -> 0.17031533301620788
A11: 9 | B11: 583773 | C11: 527960 | D11: =C11/B11 -> 0.90439263206760157 | E11: 37937 | F11: =E11/B11 -> 6.498587635947535E-2 | G11: 2967 | H11: =G11/B11 -> 5.0824549953492199E-3 | I11: 8852 | J11: =I11/B11 -> 1.5163428250364439E-2 | K11: 231 | L11: =K11/B11 -> 3.9570175393517686E-4 | M11: 4826 | N11: =M11/B11 -> 8.266911967494215E-3 | O11: 1000 | P11: =O11/B11 -> 1.7129946057799863E-3 | Q11: 11069 | R11: =Q11/B11 -> 1.8961137291378671E-2
A12: 10 | B12: 520811 | C12: 387308 | D12: =C12/B12 -> 0.74366324828008623 | E12: 36962 | F12: =E12/B12 -> 7.0970083197167494E-2 | G12: 2706 | H12: =G12/B12 -> 5.1957427934509835E-3 | I12: 65528 | J12: =I12/B12 -> 0.12581915512537178 | K12: 541 | L12: =K12/B12 -> 1.0387645422235705E-3 | M12: 25026 | N12: =M12/B12 -> 4.8051980468922506E-2 | O12: 2740 | P12: =O12/B12 -> 5.2610255927774182E-3 | Q12: 55325 | R12: =Q12/B12 -> 0.10622855508044185
A13: 11 | B13: 548595 | C13: 334137 | D13: =C13/B13 -> 0.60907773494107675 | E13: 67339 | F13: =E13/B13 -> 0.12274811108376854 | G13: 3592 | H13: =G13/B13 -> 6.5476353229613829E-3 | I13: 101292 | J13: =I13/B13 -> 0.18463894129549122 | K13: 710 | L13: =K13/B13 -> 1.2942152225229905E-3 | M13: 37301 | N13: =M13/B13 -> 6.7993692979338133E-2 | O13: 4224 | P13: =O13/B13 -> 7.699669154841003E-3 | Q13: 84820 | R13: =Q13/B13 -> 0.15461314813295782

A1: SB 5004 - M. Locke Election Data
A2: DISTRICT | B2: Rep. Gov '09 | C2: Dem. Gov '09 | D2: Rep. Lt. Gov '09 | E2: Dem. Lt. Gov '09 | F2: Rep. Att. Gen. '09 | G2: Dem. Att. Gen. '09
A3: 1 | B3: 0.6804954247744105 | C3: 0.31950457522558956 | D3: 0.65630149592312792 | E3: 0.34369850407687202 | F3: 0.66467165241783954 | G3: 0.33532834758216051
A4: 2 | B4: 0.65865423036087356 | C4: 0.34134576963912644 | D4: 0.6090215507716642 | E4: 0.39097844922833586 | F4: 0.63971495055264693 | G4: 0.36028504944735312
A5: 3 | B5: 0.44994381868508315 | C5: 0.55005618131491685 | D5: 0.41843609779281232 | E5: 0.58156390220718768 | F5: 0.43632929877278215 | G5: 0.56367070122721785
A6: 4 | B6: 0.39839809560133888 | C6: 0.60160190439866112 | D6: 0.38697215396667045 | E6: 0.61302784603332949 | F6: 0.40614709110867181 | G6: 0.59385290889132825
A7: 5 | B7: 0.62230725548367238 | C7: 0.37769274451632762 | D7: 0.60838359599628167 | E7: 0.39161640400371833 | F7: 0.62325006639314495 | G7: 0.37674993360685505
A8: 6 | B8: 0.69214111286879332 | C8: 0.30785888713120668 | D8: 0.68614539043866019 | E8: 0.31385460956133981 | F8: 0.69662553748364175 | G8: 0.30337446251635819
A9: 7 | B9: 0.67581363708435838 | C9: 0.32418636291564157 | D9: 0.64846474309520141 | E9: 0.35153525690479864 | F9: 0.66607759286928747 | G9: 0.33392240713071253
A10: 8 | B10: 0.39936804590240227 | C10: 0.60063195409759773 | D10: 0.37794023961058643 | E10: 0.62205976038941357 | F10: 0.37500618505690253 | G10: 0.62499381494309747
A11: 9 | B11: 0.6547544409613375 | C11: 0.3452455590386625 | D11: 0.64896934328507738 | E11: 0.35103065671492262 | F11: 0.6490041219596614 | G11: 0.35099587804033855
A12: 10 | B12: 0.6254022897941125 | C12: 0.3745977102058875 | D12: 0.60290030359117208 | E12: 0.39709969640882797 | F12: 0.60042748091603049 | G12: 0.39957251908396946
A13: 11 | B13: 0.49776649546411633 | C13: 0.50223350453588367 | D13: 0.46960358824967136 | E13: 0.53039641175032859 | F13: 0.46537370477884532 | G13: 0.53462629522115468