A1: SB 635 - Vogel Population Totals
A2: DISTRICT | B2: Total Pop. | C2: Target | D2: Difference | E2: Deviation
A3: 1 | B3: 201650 | C3: 200025.60000000001 | D3: =B3-C3 -> 1624.3999999999942 | E3: =(B3-C3)/C3 -> 8.1209605170537869E-3
A4: 2 | B4: 199615 | C4: 200025.60000000001 | D4: =B4-C4 -> -410.60000000000582 | E4: =(B4-C4)/C4 -> -2.0527372496320761E-3
A5: 3 | B5: 203449 | C5: 200025.60000000001 | D5: =B5-C5 -> 3423.3999999999942 | E5: =(B5-C5)/C5 -> 1.7114809304409007E-2
A6: 4 | B6: 202574 | C6: 200025.60000000001 | D6: =B6-C6 -> 2548.3999999999942 | E6: =(B6-C6)/C6 -> 1.2740369232738181E-2
A7: 5 | B7: 200751 | C7: 200025.60000000001 | D7: =B7-C7 -> 725.39999999999418 | E7: =(B7-C7)/C7 -> 3.6265358034171333E-3
A8: 6 | B8: 196367 | C8: 200025.60000000001 | D8: =B8-C8 -> -3658.6000000000058 | E8: =(B8-C8)/C8 -> -1.8290658795674181E-2
A9: 7 | B9: 199020 | C9: 200025.60000000001 | D9: =B9-C9 -> -1005.6000000000058 | E9: =(B9-C9)/C9 -> -5.0273564983682375E-3
A10: 8 | B10: 198279 | C10: 200025.60000000001 | D10: =B10-C10 -> -1746.6000000000058 | E10: =(B10-C10)/C10 -> -8.7318823190631889E-3
A11: 9 | B11: 198943 | C11: 200025.60000000001 | D11: =B11-C11 -> -1082.6000000000058 | E11: =(B11-C11)/C11 -> -5.4123072246752705E-3
A12: 10 | B12: 199977 | C12: 200025.60000000001 | D12: =B12-C12 -> -48.600000000005821 | E12: =(B12-C12)/C12 -> -2.4296889998083154E-4
A13: 11 | B13: 201788 | C13: 200025.60000000001 | D13: =B13-C13 -> 1762.3999999999942 | E13: =(B13-C13)/C13 -> 8.810872208357301E-3
A14: 12 | B14: 203630 | C14: 200025.60000000001 | D14: =B14-C14 -> 3604.3999999999942 | E14: =(B14-C14)/C14 -> 1.8019693479234627E-2
A15: 13 | B15: 199114 | C15: 200025.60000000001 | D15: =B15-C15 -> -911.60000000000582 | E15: =(B15-C15)/C15 -> -4.5574166506687436E-3
A16: 14 | B16: 199509 | C16: 200025.60000000001 | D16: =B16-C16 -> -516.60000000000582 | E16: =(B16-C16)/C16 -> -2.5826694183144847E-3
A17: 15 | B17: 196032 | C17: 200025.60000000001 | D17: =B17-C17 -> -3993.6000000000058 | E17: =(B17-C17)/C17 -> -1.9965444423113869E-2
A18: 16 | B18: 201363 | C18: 200025.60000000001 | D18: =B18-C18 -> 1337.3999999999942 | E18: =(B18-C18)/C18 -> 6.6861441735457565E-3
A19: 17 | B19: 203458 | C19: 200025.60000000001 | D19: =B19-C19 -> 3432.3999999999942 | E19: =(B19-C19)/C19 -> 1.7159803545146193E-2
A20: 18 | B20: 199974 | C20: 200025.60000000001 | D20: =B20-C20 -> -51.600000000005821 | E20: =(B20-C20)/C20 -> -2.5796698022656012E-4
A21: 19 | B21: 201071 | C21: 200025.60000000001 | D21: =B21-C21 -> 1045.3999999999942 | E21: =(B21-C21)/C21 -> 5.2263310296281782E-3
A22: 20 | B22: 200060 | C22: 200025.60000000001 | D22: =B22-C22 -> 34.399999999994179 | E22: =(B22-C22)/C22 -> 1.7197798681765824E-4
A23: 21 | B23: 200075 | C23: 200025.60000000001 | D23: =B23-C23 -> 49.399999999994179 | E23: =(B23-C23)/C23 -> 2.4696838804630095E-4
A24: 22 | B24: 196185 | C24: 200025.60000000001 | D24: =B24-C24 -> -3840.6000000000058 | E24: =(B24-C24)/C24 -> -1.9200542330581716E-2
A25: 23 | B25: 200743 | C25: 200025.60000000001 | D25: =B25-C25 -> 717.39999999999418 | E25: =(B25-C25)/C25 -> 3.5865409227618574E-3
A26: 24 | B26: 204024 | C26: 200025.60000000001 | D26: =B26-C26 -> 3998.3999999999942 | E26: =(B26-C26)/C26 -> 1.9989441351506976E-2
A27: 25 | B27: 198811 | C27: 200025.60000000001 | D27: =B27-C27 -> -1214.6000000000058 | E27: =(B27-C27)/C27 -> -6.0722227554873267E-3
A28: 26 | B28: 201484 | C28: 200025.60000000001 | D28: =B28-C28 -> 1458.3999999999942 | E28: =(B28-C28)/C28 -> 7.291066743456808E-3
A29: 27 | B29: 203166 | C29: 200025.60000000001 | D29: =B29-C29 -> 3140.3999999999942 | E29: =(B29-C29)/C29 -> 1.5699990401228613E-2
A30: 28 | B30: 201162 | C30: 200025.60000000001 | D30: =B30-C30 -> 1136.3999999999942 | E30: =(B30-C30)/C30 -> 5.6812727970819441E-3
A31: 29 | B31: 203433 | C31: 200025.60000000001 | D31: =B31-C31 -> 3407.3999999999942 | E31: =(B31-C31)/C31 -> 1.7034819543098455E-2
A32: 30 | B32: 196074 | C32: 200025.60000000001 | D32: =B32-C32 -> -3951.6000000000058 | E32: =(B32-C32)/C32 -> -1.9755471299673671E-2
A33: 31 | B33: 200905 | C33: 200025.60000000001 | D33: =B33-C33 -> 879.39999999999418 | E33: =(B33-C33)/C33 -> 4.3964372560311984E-3
A34: 32 | B34: 198617 | C34: 200025.60000000001 | D34: =B34-C34 -> -1408.6000000000058 | E34: =(B34-C34)/C34 -> -7.0420986113777723E-3
A35: 33 | B35: 196074 | C35: 200025.60000000001 | D35: =B35-C35 -> -3951.6000000000058 | E35: =(B35-C35)/C35 -> -1.9755471299673671E-2
A36: 34 | B36: 196312 | C36: 200025.60000000001 | D36: =B36-C36 -> -3713.6000000000058 | E36: =(B36-C36)/C36 -> -1.8565623600179205E-2
A37: 35 | B37: 196251 | C37: 200025.60000000001 | D37: =B37-C37 -> -3774.6000000000058 | E37: =(B37-C37)/C37 -> -1.8870584565175687E-2
A38: 36 | B38: 201781 | C38: 200025.60000000001 | D38: =B38-C38 -> 1755.3999999999942 | E38: =(B38-C38)/C38 -> 8.7758766877839341E-3
A39: 37 | B39: 198267 | C39: 200025.60000000001 | D39: =B39-C39 -> -1758.6000000000058 | E39: =(B39-C39)/C39 -> -8.7918746400461028E-3
A40: 38 | B40: 201414 | C40: 200025.60000000001 | D40: =B40-C40 -> 1388.3999999999942 | E40: =(B40-C40)/C40 -> 6.9411115377231419E-3
A41: 39 | B41: 201164 | C41: 200025.60000000001 | D41: =B41-C41 -> 1138.3999999999942 | E41: =(B41-C41)/C41 -> 5.6912715172457631E-3
A42: 40 | B42: 198458 | C42: 200025.60000000001 | D42: =B42-C42 -> -1567.6000000000058 | E42: =(B42-C42)/C42 -> -7.8369968644013861E-3

A1: SB 635 - Vogel Racial Demographics
A2: DISTRICT | B2: Total Population | C2: White | D2: % White | E2: Black | F2: % Black | G2: AIAN | H2: % AIAN | I2: Asian | J2: % Asian | K2: HawPI | L2: % HawPI | M2: Other | N2: % Other | O2: Multi | P2: % Multi | Q2: Total Hispanic | R2: % Hispanic
A3: 1 | B3: 201650 | C3: 116785 | D3: =C3/B3 -> 0.57914703694520209 | E3: 65544 | F3: =E3/B3 -> 0.32503843292834117 | G3: 1638 | H3: =G3/B3 -> 8.1229853706917925E-3 | I3: 8289 | J3: =I3/B3 -> 4.1105876518720552E-2 | K3: 457 | L3: =K3/B3 -> 2.2663030002479543E-3 | M3: 6142 | N3: =M3/B3 -> 3.0458715596330274E-2 | O3: 2795 | P3: =O3/B3 -> 1.3860649640466155E-2 | Q3: 15534 | R3: =Q3/B3 -> 7.7034465658318868E-2
A4: 2 | B4: 199615 | C4: 79507 | D4: =C4/B4 -> 0.39830173083185133 | E4: 105976 | F4: =E4/B4 -> 0.53090198632367303 | G4: 1479 | H4: =G4/B4 -> 7.409262830949578E-3 | I4: 6156 | J4: =I4/B4 -> 3.0839365779124814E-2 | K4: 289 | L4: =K4/B4 -> 1.4477869899556647E-3 | M4: 3178 | N4: =M4/B4 -> 1.5920647245948452E-2 | O4: 3030 | P4: =O4/B4 -> 1.5179219998497107E-2 | Q4: 9192 | R4: =Q4/B4 -> 4.6048643639005085E-2
A5: 3 | B5: 203449 | C5: 169921 | D5: =C5/B5 -> 0.83520194250156055 | E5: 24104 | F5: =E5/B5 -> 0.118476866438272 | G5: 1985 | H5: =G5/B5 -> 9.7567449336197279E-3 | I5: 4624 | J5: =I5/B5 -> 2.2728054696754468E-2 | K5: 159 | L5: =K5/B5 -> 7.8152264203805379E-4 | M5: 1683 | N5: =M5/B5 -> 8.2723434374216628E-3 | O5: 973 | P5: =O5/B5 -> 4.7825253503334985E-3 | Q5: 5551 | R5: =Q5/B5 -> 2.7284479156938594E-2
A6: 4 | B6: 202574 | C6: 154241 | D6: =C6/B6 -> 0.76140570853120337 | E6: 40111 | F6: =E6/B6 -> 0.19800665435840731 | G6: 1633 | H6: =G6/B6 -> 8.0612516907401736E-3 | I6: 2942 | J6: =I6/B6 -> 1.4523087859251434E-2 | K6: 169 | L6: =K6/B6 -> 8.3426303474285943E-4 | M6: 2567 | N6: =M6/B6 -> 1.2671912486301302E-2 | O6: 911 | P6: =O6/B6 -> 4.4971220393535205E-3 | Q6: 6353 | R6: =Q6/B6 -> 3.1361379051605832E-2
A7: 5 | B7: 200751 | C7: 73698 | D7: =C7/B7 -> 0.36711149633127604 | E7: 112929 | F7: =E7/B7 -> 0.56253268974998882 | G7: 1445 | H7: =G7/B7 -> 7.197971616579743E-3 | I7: 5973 | J7: =I7/B7 -> 2.9753276446941732E-2 | K7: 251 | L7: =K7/B7 -> 1.2503051043332286E-3 | M7: 4083 | N7: =M7/B7 -> 2.0338628450169614E-2 | O7: 2372 | P7: =O7/B7 -> 1.1815632300710831E-2 | Q7: 10373 | R7: =Q7/B7 -> 5.167097548704614E-2
A8: 6 | B8: 196367 | C8: 123902 | D8: =C8/B8 -> 0.63097159909760803 | E8: 55125 | F8: =E8/B8 -> 0.28072435796238676 | G8: 1902 | H8: =G8/B8 -> 9.6859451944573179E-3 | I8: 6754 | J8: =I8/B8 -> 3.4394781200507214E-2 | K8: 442 | L8: =K8/B8 -> 2.2508873690589557E-3 | M8: 5844 | N8: =M8/B8 -> 2.9760601323032893E-2 | O8: 2398 | P8: =O8/B8 -> 1.2211827852948815E-2 | Q8: 15191 | R8: =Q8/B8 -> 7.7360248921661989E-2
A9: 7 | B9: 199020 | C9: 131555 | D9: =C9/B9 -> 0.6610139684453824 | E9: 44850 | F9: =E9/B9 -> 0.22535423575520047 | G9: 1582 | H9: =G9/B9 -> 7.9489498542860016E-3 | I9: 14327 | J9: =I9/B9 -> 7.1987739925635619E-2 | K9: 387 | L9: =K9/B9 -> 1.9445281881217968E-3 | M9: 4209 | N9: =M9/B9 -> 2.1148628278564969E-2 | O9: 2110 | P9: =O9/B9 -> 1.0601949552808763E-2 | Q9: 12161 | R9: =Q9/B9 -> 6.110441161692292E-2
A10: 8 | B10: 198279 | C10: 141564 | D10: =C10/B10 -> 0.71396365727081534 | E10: 35589 | F10: =E10/B10 -> 0.17948950720953807 | G10: 1577 | H10: =G10/B10 -> 7.9534393455686185E-3 | I10: 12192 | J10: =I10/B10 -> 6.1489113824459471E-2 | K10: 446 | L10: =K10/B10 -> 2.2493557058488292E-3 | M10: 4824 | N10: =M10/B10 -> 2.4329354091961328E-2 | O10: 2087 | P10: =O10/B10 -> 1.0525572551808311E-2 | Q10: 13895 | R10: =Q10/B10 -> 7.0078021373922605E-2
A11: 9 | B11: 198943 | C11: 80706 | D11: =C11/B11 -> 0.40567398702140817 | E11: 107925 | F11: =E11/B11 -> 0.54249207059308446 | G11: 1721 | H11: =G11/B11 -> 8.6507190501802032E-3 | I11: 4377 | J11: =I11/B11 -> 2.2001276747611126E-2 | K11: 115 | L11: =K11/B11 -> 5.7805502078484797E-4 | M11: 2384 | N11: =M11/B11 -> 1.1983331909139803E-2 | O11: 1715 | P11: =O11/B11 -> 8.6205596577914271E-3 | Q11: 5518 | R11: =Q11/B11 -> 2.7736587866876442E-2
A12: 10 | B12: 199977 | C12: 138475 | D12: =C12/B12 -> 0.69245463228271253 | E12: 45465 | F12: =E12/B12 -> 0.22735114538171891 | G12: 1068 | H12: =G12/B12 -> 5.340614170629622E-3 | I12: 7652 | J12: =I12/B12 -> 3.8264400406046693E-2 | K12: 139 | L12: =K12/B12 -> 6.950799341924321E-4 | M12: 5966 | N12: =M12/B12 -> 2.9833430844547124E-2 | O12: 1212 | P12: =O12/B12 -> 6.0606969801527176E-3 | Q12: 11794 | R12: =Q12/B12 -> 5.8976782329967947E-2
A13: 11 | B13: 201788 | C13: 142424 | D13: =C13/B13 -> 0.70581005808075803 | E13: 43308 | F13: =E13/B13 -> 0.21462128570579023 | G13: 1508 | H13: =G13/B13 -> 7.4731896842230462E-3 | I13: 6420 | J13: =I13/B13 -> 3.1815568814795726E-2 | K13: 185 | L13: =K13/B13 -> 9.1680377425813232E-4 | M13: 6529 | N13: =M13/B13 -> 3.2355739687196461E-2 | O13: 1414 | P13: =O13/B13 -> 7.007354252978373E-3 | Q13: 12496 | R13: =Q13/B13 -> 6.1926378179079034E-2
A14: 12 | B14: 203630 | C14: 150352 | D14: =C14/B14 -> 0.73835878799783927 | E14: 26467 | F14: =E14/B14 -> 0.12997593674802338 | G14: 1009 | H14: =G14/B14 -> 4.9550655600844673E-3 | I14: 19196 | J14: =I14/B14 -> 9.4269017335363164E-2 | K14: 113 | L14: =K14/B14 -> 5.5492805578745766E-4 | M14: 5293 | N14: =M14/B14 -> 2.5993223002504541E-2 | O14: 1200 | P14: =O14/B14 -> 5.8930413003977803E-3 | Q14: 11625 | R14: =Q14/B14 -> 5.7088837597603498E-2
A15: 13 | B15: 199114 | C15: 142766 | D15: =C15/B15 -> 0.7170063380776841 | E15: 16812 | F15: =E15/B15 -> 8.4434042809646739E-2 | G15: 1093 | H15: =G15/B15 -> 5.4893176773104851E-3 | I15: 29383 | J15: =I15/B15 -> 0.147568729471559 | K15: 208 | L15: =K15/B15 -> 1.0446277007141638E-3 | M15: 7292 | N15: =M15/B15 -> 3.6622236507729243E-2 | O15: 1560 | P15: =O15/B15 -> 7.8347077553562287E-3 | Q15: 19074 | R15: =Q15/B15 -> 9.5794369054913273E-2
A16: 14 | B16: 199509 | C16: 146006 | D16: =C16/B16 -> 0.73182663438742113 | E16: 38124 | F16: =E16/B16 -> 0.19108912379892637 | G16: 1458 | H16: =G16/B16 -> 7.3079409951430762E-3 | I16: 10302 | J16: =I16/B16 -> 5.1636768266093258E-2 | K16: 277 | L16: =K16/B16 -> 1.3884085429729986E-3 | M16: 1968 | N16: =M16/B16 -> 9.864216651880366E-3 | O16: 1374 | P16: =O16/B16 -> 6.8869073575628164E-3 | Q16: 7486 | R16: =Q16/B16 -> 3.7522116796735984E-2
A17: 15 | B17: 196032 | C17: 134711 | D17: =C17/B17 -> 0.68718882631407119 | E17: 56126 | F17: =E17/B17 -> 0.28631039830231797 | G17: 1158 | H17: =G17/B17 -> 5.9071988246816847E-3 | I17: 1106 | J17: =I17/B17 -> 5.6419360104472743E-3 | K17: 84 | L17: =K17/B17 -> 4.2850146914789422E-4 | M17: 2261 | N17: =M17/B17 -> 1.1533831211230819E-2 | O17: 586 | P17: =O17/B17 -> 2.9893078681031667E-3 | Q17: 4579 | R17: =Q17/B17 -> 2.335843127652628E-2
A18: 16 | B18: 201363 | C18: 74519 | D18: =C18/B18 -> 0.3700729528264875 | E18: 110521 | F18: =E18/B18 -> 0.54886448851079894 | G18: 1355 | H18: =G18/B18 -> 6.7291409047342361E-3 | I18: 3659 | J18: =I18/B18 -> 1.8171163520607062E-2 | K18: 311 | L18: =K18/B18 -> 1.5444744069168616E-3 | M18: 9223 | N18: =M18/B18 -> 4.5802853553036059E-2 | O18: 1775 | P18: =O18/B18 -> 8.8149262774193868E-3 | Q18: 16234 | R18: =Q18/B18 -> 8.062057080993032E-2
A19: 17 | B19: 203458 | C19: 148455 | D19: =C19/B19 -> 0.72965919256062672 | E19: 38382 | F19: =E19/B19 -> 0.18864827138770657 | G19: 1515 | H19: =G19/B19 -> 7.4462542637792565E-3 | I19: 5244 | J19: =I19/B19 -> 2.5774361293239883E-2 | K19: 262 | L19: =K19/B19 -> 1.2877350607987889E-3 | M19: 8242 | N19: =M19/B19 -> 4.0509589202685568E-2 | O19: 1358 | P19: =O19/B19 -> 6.6745962311631881E-3 | Q19: 16104 | R19: =Q19/B19 -> 7.9151471065281281E-2
A20: 18 | B20: 199974 | C20: 81598 | D20: =C20/B20 -> 0.40804304559592747 | E20: 110922 | F20: =E20/B20 -> 0.55468210867412759 | G20: 1160 | H20: =G20/B20 -> 5.8007540980327442E-3 | I20: 2686 | J20: =I20/B20 -> 1.343174612699651E-2 | K20: 208 | L20: =K20/B20 -> 1.0401352175782852E-3 | M20: 2015 | N20: =M20/B20 -> 1.0076309920289638E-2 | O20: 1385 | P20: =O20/B20 -> 6.9259003670477165E-3 | Q20: 5269 | R20: =Q20/B20 -> 2.6348425295288389E-2
A21: 19 | B21: 201071 | C21: 186307 | D21: =C21/B21 -> 0.92657320051126224 | E21: 9003 | F21: =E21/B21 -> 4.4775228650576163E-2 | G21: 1013 | H21: =G21/B21 -> 5.0380213954274861E-3 | I21: 2711 | J21: =I21/B21 -> 1.3482799608098632E-2 | K21: 69 | L21: =K21/B21 -> 3.4316236553257306E-4 | M21: 1692 | N21: =M21/B21 -> 8.4149380069726606E-3 | O21: 276 | P21: =O21/B21 -> 1.3726494621302922E-3 | Q21: 3820 | R21: =Q21/B21 -> 1.8998264294701871E-2
A22: 20 | B22: 200060 | C22: 135284 | D22: =C22/B22 -> 0.67621713485954216 | E22: 58005 | F22: =E22/B22 -> 0.2899380185944217 | G22: 857 | H22: =G22/B22 -> 4.2837148855343395E-3 | I22: 1105 | J22: =I22/B22 -> 5.5233429971008694E-3 | K22: 62 | L22: =K22/B22 -> 3.0990702789163253E-4 | M22: 4240 | N22: =M22/B22 -> 2.1193641907427771E-2 | O22: 507 | P22: =O22/B22 -> 2.5342397280815757E-3 | Q22: 7256 | R22: =Q22/B22 -> 3.6269119264220731E-2
A23: 21 | B23: 200075 | C23: 151769 | D23: =C23/B23 -> 0.75856053979757587 | E23: 34308 | F23: =E23/B23 -> 0.17147569661376982 | G23: 1120 | H23: =G23/B23 -> 5.5979007872047981E-3 | I23: 8417 | J23: =I23/B23 -> 4.2069224040984628E-2 | K23: 150 | L23: =K23/B23 -> 7.4971885542921403E-4 | M23: 3401 | N23: =M23/B23 -> 1.6998625515431715E-2 | O23: 910 | P23: =O23/B23 -> 4.5482943896038982E-3 | Q23: 8146 | R23: =Q23/B23 -> 4.0714731975509184E-2
A24: 22 | B24: 196185 | C24: 138035 | D24: =C24/B24 -> 0.7035960955220838 | E24: 52344 | F24: =E24/B24 -> 0.26680938909702578 | G24: 1400 | H24: =G24/B24 -> 7.1361215179549919E-3 | I24: 1857 | J24: =I24/B24 -> 9.4655554706017282E-3 | K24: 99 | L24: =K24/B24 -> 5.0462573591253152E-4 | M24: 1660 | N24: =M24/B24 -> 8.4614012284323463E-3 | O24: 790 | P24: =O24/B24 -> 4.0268114279888882E-3 | Q24: 4184 | R24: =Q24/B24 -> 2.1326808879374059E-2
A25: 23 | B25: 200743 | C25: 173556 | D25: =C25/B25 -> 0.86456812939928163 | E25: 20416 | F25: =E25/B25 -> 0.10170217641461969 | G25: 1114 | H25: =G25/B25 -> 5.5493840382977236E-3 | I25: 3461 | J25: =I25/B25 -> 1.7240949871228387E-2 | K25: 88 | L25: =K25/B25 -> 4.3837145006301589E-4 | M25: 1622 | N25: =M25/B25 -> 8.0799828636614977E-3 | O25: 486 | P25: =O25/B25 -> 2.4210059628480196E-3 | Q25: 4020 | R25: =Q25/B25 -> 2.0025604877878682E-2
A26: 24 | B26: 204024 | C26: 181909 | D26: =C26/B26 -> 0.89160588950319575 | E26: 15056 | F26: =E26/B26 -> 7.3795239775712659E-2 | G26: 1179 | H26: =G26/B26 -> 5.778731913892483E-3 | I26: 1966 | J26: =I26/B26 -> 9.6361212406383557E-3 | K26: 97 | L26: =K26/B26 -> 4.7543426263576833E-4 | M26: 3318 | N26: =M26/B26 -> 1.6262792612633806E-2 | O26: 499 | P26: =O26/B26 -> 2.4457906912912207E-3 | Q26: 6760 | R26: =Q26/B26 -> 3.3133356859977259E-2
A27: 25 | B27: 198811 | C27: 165205 | D27: =C27/B27 -> 0.83096508744485964 | E27: 20702 | F27: =E27/B27 -> 0.10412904718551791 | G27: 1242 | H27: =G27/B27 -> 6.2471392427984364E-3 | I27: 7922 | J27: =I27/B27 -> 3.9846889759620946E-2 | K27: 129 | L27: =K27/B27 -> 6.4885745758534491E-4 | M27: 2942 | N27: =M27/B27 -> 1.4797973955163447E-2 | O27: 669 | P27: =O27/B27 -> 3.3650049544542305E-3 | Q27: 7104 | R27: =Q27/B27 -> 3.5732429292141786E-2
A28: 26 | B28: 201484 | C28: 180374 | D28: =C28/B28 -> 0.89522741259851901 | E28: 8075 | F28: =E28/B28 -> 4.0077624029699631E-2 | G28: 1371 | H28: =G28/B28 -> 6.8045105318536459E-3 | I28: 3298 | J28: =I28/B28 -> 1.6368545393182585E-2 | K28: 127 | L28: =K28/B28 -> 6.3032300331539973E-4 | M28: 7636 | N28: =M28/B28 -> 3.7898790970995216E-2 | O28: 603 | P28: =O28/B28 -> 2.9927934724345356E-3 | Q28: 14661 | R28: =Q28/B28 -> 7.2765083083520282E-2
A29: 27 | B29: 203166 | C29: 174454 | D29: =C29/B29 -> 0.85867714086018332 | E29: 15584 | F29: =E29/B29 -> 7.6705748009017263E-2 | G29: 1374 | H29: =G29/B29 -> 6.762942618351496E-3 | I29: 3478 | J29: =I29/B29 -> 1.7119006132915941E-2 | K29: 176 | L29: =K29/B29 -> 8.6628668182668362E-4 | M29: 7365 | N29: =M29/B29 -> 3.6251144384395029E-2 | O29: 735 | P29: =O29/B29 -> 3.6177313133102982E-3 | Q29: 14948 | R29: =Q29/B29 -> 7.3575302954234464E-2
A30: 28 | B30: 201162 | C30: 150374 | D30: =C30/B30 -> 0.74752686889173903 | E30: 31083 | F30: =E30/B30 -> 0.15451725474990308 | G30: 1836 | H30: =G30/B30 -> 9.1269722909893512E-3 | I30: 9707 | J30: =I30/B30 -> 4.8254640538471484E-2 | K30: 268 | L30: =K30/B30 -> 1.3322595718873345E-3 | M30: 6258 | N30: =M30/B30 -> 3.1109255227130372E-2 | O30: 1636 | P30: =O30/B30 -> 8.1327487298794004E-3 | Q30: 16500 | R30: =Q30/B30 -> 8.2023443791570977E-2
A31: 29 | B31: 203433 | C31: 106723 | D31: =C31/B31 -> 0.52461006817969558 | E31: 47198 | F31: =E31/B31 -> 0.23200758972241475 | G31: 2071 | H31: =G31/B31 -> 1.0180255907350331E-2 | I31: 16700 | J31: =I31/B31 -> 8.2090909537783932E-2 | K31: 358 | L31: =K31/B31 -> 1.7597931505704582E-3 | M31: 27698 | N31: =M31/B31 -> 0.13615293487290656 | O31: 2685 | P31: =O31/B31 -> 1.3198448629278436E-2 | Q31: 55210 | R31: =Q31/B31 -> 0.2713915638072486
A32: 30 | B32: 196074 | C32: 135389 | D32: =C32/B32 -> 0.69049950528881954 | E32: 27717 | F32: =E32/B32 -> 0.14135989473362098 | G32: 1497 | H32: =G32/B32 -> 7.6348725481195879E-3 | I32: 14719 | J32: =I32/B32 -> 7.506859655028203E-2 | K32: 264 | L32: =K32/B32 -> 1.3464304293277028E-3 | M32: 14757 | N32: =M32/B32 -> 7.5262400930261028E-2 | O32: 1731 | P32: =O32/B32 -> 8.8282995195691424E-3 | Q32: 31604 | R32: =Q32/B32 -> 0.16118404275936637
A33: 31 | B33: 200905 | C33: 148296 | D33: =C33/B33 -> 0.73813991687613545 | E33: 11990 | F33: =E33/B33 -> 5.9679948234240061E-2 | G33: 1269 | H33: =G33/B33 -> 6.3164182076105623E-3 | I33: 27819 | J33: =I33/B33 -> 0.13846843035265424 | K33: 244 | L33: =K33/B33 -> 1.2145043677359946E-3 | M33: 9884 | N33: =M33/B33 -> 4.9197381847141682E-2 | O33: 1403 | P33: =O33/B33 -> 6.9834001144819689E-3 | Q33: 24026 | R33: =Q33/B33 -> 0.11958886040665986
A34: 32 | B34: 198617 | C34: 147196 | D34: =C34/B34 -> 0.74110473927206633 | E34: 11165 | F34: =E34/B34 -> 5.6213717858994948E-2 | G34: 1005 | H34: =G34/B34 -> 5.0599898296721834E-3 | I34: 31804 | J34: =I34/B34 -> 0.16012728014218319 | K34: 170 | L34: =K34/B34 -> 8.5591867765599122E-4 | M34: 6144 | N34: =M34/B34 -> 3.0933907973637705E-2 | O34: 1133 | P34: =O34/B34 -> 5.7044462457896353E-3 | Q34: 17410 | R34: =Q34/B34 -> 8.7656142223475328E-2
A35: 33 | B35: 196074 | C35: 112226 | D35: =C35/B35 -> 0.57236553546110147 | E35: 20193 | F35: =E35/B35 -> 0.10298662749778145 | G35: 1241 | H35: =G35/B35 -> 6.3292430408927241E-3 | I35: 40801 | J35: =I35/B35 -> 0.20808980282954395 | K35: 195 | L35: =K35/B35 -> 9.9452247620796224E-4 | M35: 19390 | N35: =M35/B35 -> 9.8891234941909684E-2 | O35: 2028 | P35: =O35/B35 -> 1.0343033752562809E-2 | Q35: 38798 | R35: =Q35/B35 -> 0.19787427195854626
A36: 34 | B36: 196312 | C36: 132960 | D36: =C36/B36 -> 0.67728921308936796 | E36: 11602 | F36: =E36/B36 -> 5.9099800317861363E-2 | G36: 1078 | H36: =G36/B36 -> 5.4912588125025467E-3 | I36: 40711 | J36: =I36/B36 -> 0.20737907005175435 | K36: 256 | L36: =K36/B36 -> 1.3040466196666532E-3 | M36: 8481 | N36: =M36/B36 -> 4.3201638208565957E-2 | O36: 1224 | P36: =O36/B36 -> 6.2349729002811848E-3 | Q36: 22037 | R36: =Q36/B36 -> 0.11225498186560169
A37: 35 | B37: 196251 | C37: 106787 | D37: =C37/B37 -> 0.54413480695639771 | E37: 25065 | F37: =E37/B37 -> 0.12771909442499657 | G37: 1602 | H37: =G37/B37 -> 8.1630157298561538E-3 | I37: 34850 | J37: =I37/B37 -> 0.17757871297471095 | K37: 221 | L37: =K37/B37 -> 1.1261089115469475E-3 | M37: 25631 | N37: =M37/B37 -> 0.13060315616226159 | O37: 2095 | P37: =O37/B37 -> 1.0675104840230114E-2 | Q37: 51879 | R37: =Q37/B37 -> 0.26435024534906826
A38: 36 | B38: 201781 | C38: 107076 | D38: =C38/B38 -> 0.53065452148616565 | E38: 50916 | F38: =E38/B38 -> 0.25233297485888168 | G38: 1893 | H38: =G38/B38 -> 9.3814581154816352E-3 | I38: 17213 | J38: =I38/B38 -> 8.5305355806542735E-2 | K38: 387 | L38: =K38/B38 -> 1.9179209142585279E-3 | M38: 21462 | N38: =M38/B38 -> 0.10636283891942254 | O38: 2834 | P38: =O38/B38 -> 1.4044929899247204E-2 | Q38: 44368 | R38: =Q38/B38 -> 0.2198819512243472
A39: 37 | B39: 198267 | C39: 119378 | D39: =C39/B39 -> 0.60210725940272458 | E39: 15433 | F39: =E39/B39 -> 7.7839479086282637E-2 | G39: 1146 | H39: =G39/B39 -> 5.7800844315998127E-3 | I39: 48160 | J39: =I39/B39 -> 0.24290476983058198 | K39: 233 | L39: =K39/B39 -> 1.1751829603514454E-3 | M39: 12319 | N39: =M39/B39 -> 6.2133385787851735E-2 | O39: 1598 | P39: =O39/B39 -> 8.0598385006077668E-3 | Q39: 30619 | R39: =Q39/B39 -> 0.1544331633605189
A40: 38 | B40: 201414 | C40: 189958 | D40: =C40/B40 -> 0.94312212656518413 | E40: 8283 | F40: =E40/B40 -> 4.1124251541600883E-2 | G40: 888 | H40: =G40/B40 -> 4.4088295749054188E-3 | I40: 1191 | J40: =I40/B40 -> 5.9131937203967949E-3 | K40: 51 | L40: =K40/B40 -> 2.5320980666686526E-4 | M40: 804 | N40: =M40/B40 -> 3.9917781286305815E-3 | O40: 239 | P40: =O40/B40 -> 1.1866106626153097E-3 | Q40: 1947 | R40: =Q40/B40 -> 9.6666567368703261E-3
A41: 39 | B41: 201164 | C41: 122722 | D41: =C41/B41 -> 0.61005945397784889 | E41: 35833 | F41: =E41/B41 -> 0.17812829333280308 | G41: 1332 | H41: =G41/B41 -> 6.6214630848461953E-3 | I41: 28812 | J41: =I41/B41 -> 0.1432264222226641 | K41: 359 | L41: =K41/B41 -> 1.784613549143982E-3 | M41: 10105 | N41: =M41/B41 -> 5.023264600027838E-2 | O41: 2001 | P41: =O41/B41 -> 9.9471078324153434E-3 | Q41: 25242 | R41: =Q41/B41 -> 0.12547970809886461
A42: 40 | B42: 198458 | C42: 189689 | D42: =C42/B42 -> 0.95581432847252312 | E42: 5203 | F42: =E42/B42 -> 2.621713410394139E-2 | G42: 1049 | H42: =G42/B42 -> 5.2857531568392306E-3 | I42: 829 | J42: =I42/B42 -> 4.1772062602666556E-3 | K42: 74 | L42: =K42/B42 -> 3.7287486521077508E-4 | M42: 1371 | N42: =M42/B42 -> 6.9082627054590897E-3 | O42: 243 | P42: =O42/B42 -> 1.2244404357597074E-3 | Q42: 2857 | R42: =Q42/B42 -> 1.4395993106853843E-2

A1: SB 635 - Vogel Voting Age Population
A2: DISTRICT | B2: Voting Age Persons | C2: VAP White | D2: % VAP White | E2: VAP Black | F2: % VAP Black | G2: VAP AIAN | H2: % VAP AIAN | I2: VAP Asian | J2: % VAP Asian | K2: VAP HawPI | L2: % VAP HawPI | M2: VAP Other | N2: % VAP Other | O2: VAP Multi | P2: % VAP Multi | Q2: Voting Age Hispanic | R2: % VAP Hispanic
A3: 1 | B3: 155312 | C3: 95258 | D3: =C3/B3 -> 0.61333316163593288 | E3: 46171 | F3: =E3/B3 -> 0.29727902544555473 | G3: 1241 | H3: =G3/B3 -> 7.9903677758318744E-3 | I3: 6456 | J3: =I3/B3 -> 4.1567940661378387E-2 | K3: 306 | L3: =K3/B3 -> 1.9702276707530648E-3 | M3: 4341 | N3: =M3/B3 -> 2.7950190584114555E-2 | O3: 1539 | P3: =O3/B3 -> 9.9090862264345318E-3 | Q3: 10439 | R3: =Q3/B3 -> 6.7213093643762239E-2
A4: 2 | B4: 150013 | C4: 63459 | D4: =C4/B4 -> 0.42302333797737529 | E4: 76869 | F4: =E4/B4 -> 0.51241559064881048 | G4: 1104 | H4: =G4/B4 -> 7.3593621886103204E-3 | I4: 4455 | J4: =I4/B4 -> 2.969742622306067E-2 | K4: 220 | L4: =K4/B4 -> 1.4665395665708972E-3 | M4: 2194 | N4: =M4/B4 -> 1.462539913207522E-2 | O4: 1712 | P4: =O4/B4 -> 1.1412344263497163E-2 | Q4: 5883 | R4: =Q4/B4 -> 3.9216601227893583E-2
A5: 3 | B5: 157697 | C5: 133375 | D5: =C5/B5 -> 0.84576751618610368 | E5: 17955 | F5: =E5/B5 -> 0.11385758765226986 | G5: 1465 | H5: =G5/B5 -> 9.2899674692606699E-3 | I5: 3178 | J5: =I5/B5 -> 2.0152571069836457E-2 | K5: 108 | L5: =K5/B5 -> 6.8485767008884127E-4 | M5: 1064 | N5: =M5/B5 -> 6.7471163053196958E-3 | O5: 552 | P5: =O5/B5 -> 3.5003836471207443E-3 | Q5: 3468 | R5: =Q5/B5 -> 2.1991540739519456E-2
A6: 4 | B6: 154670 | C6: 119518 | D6: =C6/B6 -> 0.77272903601215492 | E6: 29816 | F6: =E6/B6 -> 0.19277170750630374 | G6: 1163 | H6: =G6/B6 -> 7.5192344992564813E-3 | I6: 1939 | J6: =I6/B6 -> 1.2536367750695028E-2 | K6: 100 | L6: =K6/B6 -> 6.4653779013383334E-4 | M6: 1613 | N6: =M6/B6 -> 1.0428654554858731E-2 | O6: 521 | P6: =O6/B6 -> 3.3684618865972714E-3 | Q6: 4023 | R6: =Q6/B6 -> 2.6010215297084114E-2
A7: 5 | B7: 149582 | C7: 59413 | D7: =C7/B7 -> 0.39719351258841307 | E7: 80221 | F7: =E7/B7 -> 0.53630115923038868 | G7: 1101 | H7: =G7/B7 -> 7.3605112914655506E-3 | I7: 4434 | J7: =I7/B7 -> 2.9642604056637829E-2 | K7: 181 | L7: =K7/B7 -> 1.2100386410129561E-3 | M7: 2940 | N7: =M7/B7 -> 1.9654771296011554E-2 | O7: 1292 | P7: =O7/B7 -> 8.6374028960703834E-3 | Q7: 6854 | R7: =Q7/B7 -> 4.5821021245871826E-2
A8: 6 | B8: 160365 | C8: 104839 | D8: =C8/B8 -> 0.65375237738908121 | E8: 42154 | F8: =E8/B8 -> 0.26286284413681288 | G8: 1523 | H8: =G8/B8 -> 9.4970847753562179E-3 | I8: 5515 | J8: =I8/B8 -> 3.4390297134661553E-2 | K8: 348 | L8: =K8/B8 -> 2.170049574408381E-3 | M8: 4270 | N8: =M8/B8 -> 2.6626757708976399E-2 | O8: 1716 | P8: =O8/B8 -> 1.0700589280703396E-2 | Q8: 11051 | R8: =Q8/B8 -> 6.8911545536744306E-2
A9: 7 | B9: 153597 | C9: 105761 | D9: =C9/B9 -> 0.68856162555258238 | E9: 31513 | F9: =E9/B9 -> 0.20516676758009597 | G9: 1204 | H9: =G9/B9 -> 7.8386947661738191E-3 | I9: 10827 | J9: =I9/B9 -> 7.0489658001132841E-2 | K9: 267 | L9: =K9/B9 -> 1.7383152014687788E-3 | M9: 2883 | N9: =M9/B9 -> 1.8769897849567375E-2 | O9: 1142 | P9: =O9/B9 -> 7.4350410489788209E-3 | Q9: 8017 | R9: =Q9/B9 -> 5.2195029850843441E-2
A10: 8 | B10: 149629 | C10: 110669 | D10: =C10/B10 -> 0.7396226667290432 | E10: 24261 | F10: =E10/B10 -> 0.16214102881125986 | G10: 1197 | H10: =G10/B10 -> 7.9997861377139462E-3 | I10: 8876 | J10: =I10/B10 -> 5.9320051594276509E-2 | K10: 320 | L10: =K10/B10 -> 2.13862286054174E-3 | M10: 3227 | N10: =M10/B10 -> 2.1566674909275607E-2 | O10: 1079 | P10: =O10/B10 -> 7.211168957889179E-3 | Q10: 8921 | R10: =Q10/B10 -> 5.962079543404019E-2
A11: 9 | B11: 155821 | C11: 68909 | D11: =C11/B11 -> 0.4422317916070363 | E11: 79106 | F11: =E11/B11 -> 0.50767226497070361 | G11: 1362 | H11: =G11/B11 -> 8.7407987370123411E-3 | I11: 3584 | J11: =I11/B11 -> 2.3000750861565514E-2 | K11: 84 | L11: =K11/B11 -> 5.3908009831794173E-4 | M11: 1663 | N11: =M11/B11 -> 1.0672502422651633E-2 | O11: 1113 | P11: =O11/B11 -> 7.1428113027127279E-3 | Q11: 3833 | R11: =Q11/B11 -> 2.4598738295865126E-2
A12: 10 | B12: 157128 | C12: 111093 | D12: =C12/B12 -> 0.70702230029020929 | E12: 34106 | F12: =E12/B12 -> 0.21705870373198921 | G12: 835 | H12: =G12/B12 -> 5.3141387913039047E-3 | I12: 5953 | J12: =I12/B12 -> 3.788630925105646E-2 | K12: 100 | L12: =K12/B12 -> 6.3642380734178501E-4 | M12: 4254 | N12: =M12/B12 -> 2.7073468764319535E-2 | O12: 787 | P12: =O12/B12 -> 5.0086553637798481E-3 | Q12: 8291 | R12: =Q12/B12 -> 5.2765897866707399E-2
A13: 11 | B13: 150313 | C13: 109659 | D13: =C13/B13 -> 0.72953769800349932 | E13: 30020 | F13: =E13/B13 -> 0.19971659137932182 | G13: 1072 | H13: =G13/B13 -> 7.1317850086153557E-3 | I13: 4581 | J13: =I13/B13 -> 3.0476405899689314E-2 | K13: 128 | L13: =K13/B13 -> 8.5155641893914699E-4 | M13: 4101 | N13: =M13/B13 -> 2.7283069328667513E-2 | O13: 752 | P13: =O13/B13 -> 5.0028939612674888E-3 | Q13: 7791 | R13: =Q13/B13 -> 5.1831844218397607E-2
A14: 12 | B14: 154608 | C14: 116600 | D14: =C14/B14 -> 0.75416537307254472 | E14: 19279 | F14: =E14/B14 -> 0.12469600538135155 | G14: 724 | H14: =G14/B14 -> 4.6828107213080826E-3 | I14: 13574 | J14: =I14/B14 -> 8.7796233053916997E-2 | K14: 78 | L14: =K14/B14 -> 5.0450170754424094E-4 | M14: 3608 | N14: =M14/B14 -> 2.3336437959225912E-2 | O14: 745 | P14: =O14/B14 -> 4.8186381041084546E-3 | Q14: 7829 | R14: =Q14/B14 -> 5.0637741902100797E-2
A15: 13 | B15: 134713 | C15: 98551 | D15: =C15/B15 -> 0.73156265542301036 | E15: 10873 | F15: =E15/B15 -> 8.0712329173873346E-2 | G15: 694 | H15: =G15/B15 -> 5.1516928581502898E-3 | I15: 18902 | J15: =I15/B15 -> 0.14031311009330949 | K15: 139 | L15: =K15/B15 -> 1.0318232093413406E-3 | M15: 4711 | N15: =M15/B15 -> 3.4970641289259391E-2 | O15: 843 | P15: =O15/B15 -> 6.257747953055756E-3 | Q15: 11999 | R15: =Q15/B15 -> 8.9070839488393838E-2
A16: 14 | B16: 148925 | C16: 110582 | D16: =C16/B16 -> 0.74253483296961553 | E16: 28054 | F16: =E16/B16 -> 0.1883766996810475 | G16: 1074 | H16: =G16/B16 -> 7.2116837334228641E-3 | I16: 7156 | J16: =I16/B16 -> 4.8051032398858488E-2 | K16: 178 | L16: =K16/B16 -> 1.1952324995803257E-3 | M16: 1229 | N16: =M16/B16 -> 8.2524760785630345E-3 | O16: 652 | P16: =O16/B16 -> 4.3780426389122039E-3 | Q16: 4516 | R16: =Q16/B16 -> 3.0323988584858151E-2
A17: 15 | B17: 154889 | C17: 107773 | D17: =C17/B17 -> 0.69580796570447223 | E17: 43588 | F17: =E17/B17 -> 0.28141443227085206 | G17: 871 | H17: =G17/B17 -> 5.6233819057518609E-3 | I17: 793 | J17: =I17/B17 -> 5.1197954664307984E-3 | K17: 54 | L17: =K17/B17 -> 3.4863676568381229E-4 | M17: 1451 | N17: =M17/B17 -> 9.3679990186520661E-3 | O17: 359 | P17: =O17/B17 -> 2.3177888681571966E-3 | Q17: 2977 | R17: =Q17/B17 -> 1.9220215767420539E-2
A18: 16 | B18: 153053 | C18: 60244 | D18: =C18/B18 -> 0.39361528359457182 | E18: 81258 | F18: =E18/B18 -> 0.53091412778579972 | G18: 1062 | H18: =G18/B18 -> 6.9387728433941186E-3 | I18: 2853 | J18: =I18/B18 -> 1.8640601621660469E-2 | K18: 204 | L18: =K18/B18 -> 1.3328716196350284E-3 | M18: 6328 | N18: =M18/B18 -> 4.1345154946325784E-2 | O18: 1104 | P18: =O18/B18 -> 7.2131875886130951E-3 | Q18: 10962 | R18: =Q18/B18 -> 7.1622248502152847E-2
A19: 17 | B19: 153888 | C19: 115956 | D19: =C19/B19 -> 0.75350904553961318 | E19: 26816 | F19: =E19/B19 -> 0.17425660220420044 | G19: 1132 | H19: =G19/B19 -> 7.3559991682262422E-3 | I19: 3710 | J19: =I19/B19 -> 2.410844250363901E-2 | K19: 182 | L19: =K19/B19 -> 1.1826783114992723E-3 | M19: 5350 | N19: =M19/B19 -> 3.4765543772093989E-2 | O19: 742 | P19: =O19/B19 -> 4.8216885007278023E-3 | Q19: 10361 | R19: =Q19/B19 -> 6.7328186733208562E-2
A20: 18 | B20: 153122 | C20: 65886 | D20: =C20/B20 -> 0.43028434842805086 | E20: 82033 | F20: =E20/B20 -> 0.53573621034208019 | G20: 870 | H20: =G20/B20 -> 5.6817439688614307E-3 | I20: 1975 | J20: =I20/B20 -> 1.2898211883334856E-2 | K20: 127 | L20: =K20/B20 -> 8.2940400464988698E-4 | M20: 1406 | N20: =M20/B20 -> 9.1822207128955998E-3 | O20: 825 | P20: =O20/B20 -> 5.3878606601272189E-3 | Q20: 3473 | R20: =Q20/B20 -> 2.2681260694087067E-2
A21: 19 | B21: 158353 | C21: 148025 | D21: =C21/B21 -> 0.93477862749679519 | E21: 6411 | F21: =E21/B21 -> 4.0485497590825557E-2 | G21: 791 | H21: =G21/B21 -> 4.9951690211110624E-3 | I21: 1819 | J21: =I21/B21 -> 1.1486994247030369E-2 | K21: 54 | L21: =K21/B21 -> 3.4101027451327099E-4 | M21: 1092 | N21: =M21/B21 -> 6.8959855512683689E-3 | O21: 161 | P21: =O21/B21 -> 1.0167158184562338E-3 | Q21: 2425 | R21: =Q21/B21 -> 1.5313887327679299E-2
A22: 20 | B22: 157857 | C22: 110326 | D22: =C22/B22 -> 0.69889837004377375 | E22: 43224 | F22: =E22/B22 -> 0.27381744236872613 | G22: 674 | H22: =G22/B22 -> 4.269687121888798E-3 | I22: 777 | J22: =I22/B22 -> 4.9221764001596384E-3 | K22: 49 | L22: =K22/B22 -> 3.1040752073078798E-4 | M22: 2496 | N22: =M22/B22 -> 1.5811779015184629E-2 | O22: 311 | P22: =O22/B22 -> 1.9701375295362259E-3 | Q22: 4286 | R22: =Q22/B22 -> 2.7151155792901172E-2
A23: 21 | B23: 162486 | C23: 127315 | D23: =C23/B23 -> 0.78354442844306582 | E23: 24220 | F23: =E23/B23 -> 0.14905899585195032 | G23: 902 | H23: =G23/B23 -> 5.5512474920916266E-3 | I23: 7001 | J23: =I23/B23 -> 4.3086789015669043E-2 | K23: 115 | L23: =K23/B23 -> 7.077532833597972E-4 | M23: 2325 | N23: =M23/B23 -> 1.4308925076621987E-2 | O23: 608 | P23: =O23/B23 -> 3.7418608372413622E-3 | Q23: 5713 | R23: =Q23/B23 -> 3.5159952242039313E-2
A24: 22 | B24: 154751 | C24: 111269 | D24: =C24/B24 -> 0.71901958630315799 | E24: 39363 | F24: =E24/B24 -> 0.25436346130235021 | G24: 1114 | H24: =G24/B24 -> 7.1986610748880457E-3 | I24: 1387 | J24: =I24/B24 -> 8.9627853778004671E-3 | K24: 78 | L24: =K24/B24 -> 5.0403551511783446E-4 | M24: 1050 | N24: =M24/B24 -> 6.7850934727400796E-3 | O24: 490 | P24: =O24/B24 -> 3.1663769539453704E-3 | Q24: 2799 | R24: =Q24/B24 -> 1.8087120600189983E-2
A25: 23 | B25: 158277 | C25: 138497 | D25: =C25/B25 -> 0.87502922092281255 | E25: 15018 | F25: =E25/B25 -> 9.4884285145662356E-2 | G25: 864 | H25: =G25/B25 -> 5.4587842832502509E-3 | I25: 2398 | J25: =I25/B25 -> 1.5150653600965396E-2 | K25: 63 | L25: =K25/B25 -> 3.9803635398699748E-4 | M25: 1136 | N25: =M25/B25 -> 7.1772904464957009E-3 | O25: 301 | P25: =O25/B25 -> 1.9017292468267656E-3 | Q25: 2757 | R25: =Q25/B25 -> 1.7418829014954795E-2
A26: 24 | B26: 158069 | C26: 142925 | D26: =C26/B26 -> 0.90419373817763127 | E26: 10712 | F26: =E26/B26 -> 6.7767873523587804E-2 | G26: 860 | H26: =G26/B26 -> 5.4406619893843829E-3 | I26: 1348 | J26: =I26/B26 -> 8.5279213508024972E-3 | K26: 67 | L26: =K26/B26 -> 4.2386552707994609E-4 | M26: 1878 | N26: =M26/B26 -> 1.1880887460539384E-2 | O26: 279 | P26: =O26/B26 -> 1.7650519709747009E-3 | Q26: 3970 | R26: =Q26/B26 -> 2.5115614067274417E-2
A27: 25 | B27: 160828 | C27: 135171 | D27: =C27/B27 -> 0.84046932126246676 | E27: 15543 | F27: =E27/B27 -> 9.6643619270276315E-2 | G27: 926 | H27: =G27/B27 -> 5.7577038824085354E-3 | I27: 6580 | J27: =I27/B27 -> 4.0913273808043375E-2 | K27: 104 | L27: =K27/B27 -> 6.4665356778670379E-4 | M27: 2053 | N27: =M27/B27 -> 1.2765190141020221E-2 | O27: 451 | P27: =O27/B27 -> 2.8042380679981099E-3 | Q27: 5032 | R27: =Q27/B27 -> 3.1288084164448976E-2
A28: 26 | B28: 159446 | C28: 144854 | D28: =C28/B28 -> 0.90848312281273913 | E28: 5612 | F28: =E28/B28 -> 3.5196869159464649E-2 | G28: 1017 | H28: =G28/B28 -> 6.378334984885165E-3 | I28: 2616 | J28: =I28/B28 -> 1.6406808574689864E-2 | K28: 112 | L28: =K28/B28 -> 7.0243217139344979E-4 | M28: 4889 | N28: =M28/B28 -> 3.0662418624487289E-2 | O28: 346 | P28: =O28/B28 -> 2.170013672340479E-3 | Q28: 9274 | R28: =Q28/B28 -> 5.8163892477704052E-2
A29: 27 | B29: 153073 | C29: 133915 | D29: =C29/B29 -> 0.87484402866606126 | E29: 10732 | F29: =E29/B29 -> 7.0110339511213607E-2 | G29: 983 | H29: =G29/B29 -> 6.4217726182932327E-3 | I29: 2374 | J29: =I29/B29 -> 1.5508940178868906E-2 | K29: 129 | L29: =K29/B29 -> 8.4273516557459511E-4 | M29: 4531 | N29: =M29/B29 -> 2.9600256086965041E-2 | O29: 409 | P29: =O29/B29 -> 2.6719277730233287E-3 | Q29: 9128 | R29: =Q29/B29 -> 5.9631679002828716E-2
A30: 28 | B30: 143369 | C30: 110124 | D30: =C30/B30 -> 0.7681158409419051 | E30: 20764 | F30: =E30/B30 -> 0.14482907741561984 | G30: 1275 | H30: =G30/B30 -> 8.8931358940914709E-3 | I30: 6454 | J30: =I30/B30 -> 4.5016705145463805E-2 | K30: 170 | L30: =K30/B30 -> 1.1857514525455293E-3 | M30: 3812 | N30: =M30/B30 -> 2.6588732571197399E-2 | O30: 770 | P30: =O30/B30 -> 5.3707565791768098E-3 | Q30: 10017 | R30: =Q30/B30 -> 6.9868660589109219E-2
A31: 29 | B31: 144704 | C31: 79551 | D31: =C31/B31 -> 0.54974983414418399 | E31: 32078 | F31: =E31/B31 -> 0.22168011941618754 | G31: 1389 | H31: =G31/B31 -> 9.5989053516143293E-3 | I31: 11917 | J31: =I31/B31 -> 8.235432330827068E-2 | K31: 257 | L31: =K31/B31 -> 1.7760393631136666E-3 | M31: 18027 | N31: =M31/B31 -> 0.12457844980097302 | O31: 1485 | P31: =O31/B31 -> 1.0262328615656789E-2 | Q31: 35485 | R31: =Q31/B31 -> 0.24522473463069439
A32: 30 | B32: 159983 | C32: 113481 | D32: =C32/B32 -> 0.70933161648425147 | E32: 21428 | F32: =E32/B32 -> 0.13393923104329836 | G32: 1187 | H32: =G32/B32 -> 7.419538325947132E-3 | I32: 11742 | J32: =I32/B32 -> 7.3395298250439112E-2 | K32: 211 | L32: =K32/B32 -> 1.3188901320765332E-3 | M32: 10736 | N32: =M32/B32 -> 6.710713013257659E-2 | O32: 1198 | P32: =O32/B32 -> 7.4882956314108375E-3 | Q32: 23138 | R32: =Q32/B32 -> 0.14462786671083802
A33: 31 | B33: 161054 | C33: 120879 | D33: =C33/B33 -> 0.75054950513492369 | E33: 9359 | F33: =E33/B33 -> 5.8110944155376459E-2 | G33: 1000 | H33: =G33/B33 -> 6.2090975697592114E-3 | I33: 21304 | J33: =I33/B33 -> 0.13227861462615023 | K33: 186 | L33: =K33/B33 -> 1.1548921479752133E-3 | M33: 7348 | N33: =M33/B33 -> 4.5624448942590684E-2 | O33: 978 | P33: =O33/B33 -> 6.0724974232245089E-3 | Q33: 17980 | R33: =Q33/B33 -> 0.11163957430427061
A34: 32 | B34: 149896 | C34: 113697 | D34: =C34/B34 -> 0.75850589742221275 | E34: 7902 | F34: =E34/B34 -> 5.2716550141431395E-2 | G34: 703 | H34: =G34/B34 -> 4.6899183433847464E-3 | I34: 22521 | J34: =I34/B34 -> 0.15024416929070822 | K34: 124 | L34: =K34/B34 -> 8.2724021988578745E-4 | M34: 4265 | N34: =M34/B34 -> 2.8453060788813576E-2 | O34: 684 | P34: =O34/B34 -> 4.5631637935635372E-3 | Q34: 12178 | R34: =Q34/B34 -> 8.1242995143299357E-2
A35: 33 | B35: 142626 | C35: 84383 | D35: =C35/B35 -> 0.59163827072202824 | E35: 14099 | F35: =E35/B35 -> 9.8852944063494735E-2 | G35: 816 | H35: =G35/B35 -> 5.721256993815994E-3 | I35: 28576 | J35: =I35/B35 -> 0.20035617629324246 | K35: 147 | L35: =K35/B35 -> 1.0306676202094991E-3 | M35: 13420 | N35: =M35/B35 -> 9.4092241246336569E-2 | O35: 1185 | P35: =O35/B35 -> 8.3084430608724915E-3 | Q35: 26626 | R35: =Q35/B35 -> 0.18668405480066749
A36: 34 | B36: 151463 | C36: 104813 | D36: =C36/B36 -> 0.69200398777259131 | E36: 8678 | F36: =E36/B36 -> 5.7294520774050429E-2 | G36: 765 | H36: =G36/B36 -> 5.0507384641793702E-3 | I36: 30103 | J36: =I36/B36 -> 0.19874820913358379 | K36: 199 | L36: =K36/B36 -> 1.3138522279368559E-3 | M36: 6125 | N36: =M36/B36 -> 4.0438919075945941E-2 | O36: 780 | P36: =O36/B36 -> 5.1497725517122995E-3 | Q36: 15918 | R36: =Q36/B36 -> 0.10509497368994408
A37: 35 | B37: 153812 | C37: 86599 | D37: =C37/B37 -> 0.56301849010480332 | E37: 18896 | F37: =E37/B37 -> 0.12285127298260214 | G37: 1178 | H37: =G37/B37 -> 7.6587002314513824E-3 | I37: 26990 | J37: =I37/B37 -> 0.17547395521805842 | K37: 166 | L37: =K37/B37 -> 1.0792395911892441E-3 | M37: 18555 | N37: =M37/B37 -> 0.12063428081033989 | O37: 1428 | P37: =O37/B37 -> 9.2840610615556648E-3 | Q37: 37848 | R37: =Q37/B37 -> 0.24606662679114763
A38: 36 | B38: 146120 | C38: 81426 | D38: =C38/B38 -> 0.55725431152477412 | E38: 35074 | F38: =E38/B38 -> 0.24003558718861209 | G38: 1253 | H38: =G38/B38 -> 8.575143717492472E-3 | I38: 12373 | J38: =I38/B38 -> 8.4676977826444025E-2 | K38: 277 | L38: =K38/B38 -> 1.8957021626060772E-3 | M38: 14146 | N38: =M38/B38 -> 9.6810840405146453E-2 | O38: 1571 | P38: =O38/B38 -> 1.075143717492472E-2 | Q38: 28956 | R38: =Q38/B38 -> 0.19816589104845334
A39: 37 | B39: 149996 | C39: 92692 | D39: =C39/B39 -> 0.61796314568388488 | E39: 10840 | F39: =E39/B39 -> 7.2268593829168781E-2 | G39: 822 | H39: =G39/B39 -> 5.480146137230326E-3 | I39: 35832 | J39: =I39/B39 -> 0.23888637030320808 | K39: 154 | L39: =K39/B39 -> 1.026694045174538E-3 | M39: 8701 | N39: =M39/B39 -> 5.8008213552361396E-2 | O39: 955 | P39: =O39/B39 -> 6.3668364489719723E-3 | Q39: 21603 | R39: =Q39/B39 -> 0.1440238406357503
A40: 38 | B40: 162238 | C40: 153258 | D40: =C40/B40 -> 0.94464921904855825 | E40: 6584 | F40: =E40/B40 -> 4.0582354318963496E-2 | G40: 717 | H40: =G40/B40 -> 4.4194331784168936E-3 | I40: 937 | J40: =I40/B40 -> 5.7754656738865122E-3 | K40: 47 | L40: =K40/B40 -> 2.8969785130487311E-4 | M40: 544 | N40: =M40/B40 -> 3.3530985342521483E-3 | O40: 151 | P40: =O40/B40 -> 9.3073139461778373E-4 | Q40: 1361 | R40: =Q40/B40 -> 8.3889101197006863E-3
A41: 39 | B41: 153134 | C41: 96636 | D41: =C41/B41 -> 0.63105515430929771 | E41: 25726 | F41: =E41/B41 -> 0.16799665652304518 | G41: 986 | H41: =G41/B41 -> 6.4388052294069246E-3 | I41: 21253 | J41: =I41/B41 -> 0.13878694476732797 | K41: 251 | L41: =K41/B41 -> 1.6390873352749879E-3 | M41: 7136 | N41: =M41/B41 -> 4.6599710057857825E-2 | O41: 1146 | P41: =O41/B41 -> 7.4836417777893868E-3 | Q41: 17747 | R41: =Q41/B41 -> 0.11589196390089726
A42: 40 | B42: 158487 | C42: 151963 | D42: =C42/B42 -> 0.95883574047082731 | E42: 3892 | F42: =E42/B42 -> 2.455721920409876E-2 | G42: 870 | H42: =G42/B42 -> 5.4894092259932994E-3 | I42: 611 | J42: =I42/B42 -> 3.8552057897493172E-3 | K42: 48 | L42: =K42/B42 -> 3.02863957296182E-4 | M42: 936 | N42: =M42/B42 -> 5.9058471672755498E-3 | O42: 167 | P42: =O42/B42 -> 1.0537141847596332E-3 | Q42: 1928 | R42: =Q42/B42 -> 1.2165035618063312E-2

A1: SB 635 - Vogel Election Data
A2: DISTRICT | B2: Rep. Gov '09 | C2: Dem. Gov '09 | D2: Rep. Lt. Gov '09 | E2: Dem. Lt. Gov '09 | F2: Rep. Att. Gen. '09 | G2: Dem. Att. Gen. '09 | H2: Rep. Pres. '08 | I2: Dem. Pres. '08 | J2: Other Pres. '08 | K2: Rep. U.S. Sen. '08 | L2: Dem. U.S. Sen. '08 | M2: Other U.S. Sen. '08
A3: 1 | B3: 0.54293130535759015 | C3: 0.4570686946424099 | D3: 0.51135135135135135 | E3: 0.48864864864864865 | F3: 0.52424200406729526 | G3: 0.47575799593270474 | H3: 0.41761963190184048 | I3: 0.5740981595092024 | J3: 8.282208588957056E-3 | K3: 0.30183349789403957 | L3: 0.6844308907525215 | M3: 1.3735611353438901E-2
A4: 2 | B4: 0.40251542250490174 | C4: 0.59748457749509831 | D4: 0.37813611341160425 | E4: 0.62186388658839575 | F4: 0.39310125186800265 | G4: 0.6068987481319974 | H4: 0.29838216217539221 | I4: 0.69504613652495284 | J4: 6.5717012996548939E-3 | K4: 0.21748862101735608 | L4: 0.77035712499374787 | M4: 1.2154253988896113E-2
A5: 3 | B5: 0.71102470265324791 | C5: 0.28897529734675204 | D5: 0.67571222225636929 | E5: 0.32428777774363071 | F5: 0.68821533240783583 | G5: 0.31178466759216411 | H5: 0.62438528917807257 | I5: 0.36688556573508857 | J5: 8.729145086838903E-3 | K5: 0.4491830887563027 | L5: 0.53869930888589945 | M5: 1.2117602357797883E-2
A6: 4 | B6: 0.69868121245598291 | C6: 0.30131878754401714 | D6: 0.67615925221910256 | E6: 0.32384074778089739 | F6: 0.69217178343391939 | G6: 0.30782821656608067 | H6: 0.58352898872601899 | I6: 0.40853903589483259 | J6: 7.9319753791484236E-3 | K6: 0.42534437036321276 | L6: 0.56385480078590522 | M6: 1.0800828850881997E-2
A7: 5 | B7: 0.35982364287682556 | C7: 0.64017635712317444 | D7: 0.33346693386773546 | E7: 0.66653306613226448 | F7: 0.35572296058661779 | G7: 0.64427703941338221 | H7: 0.26040718687433373 | I7: 0.73301437894901067 | J7: 6.578434176655659E-3 | K7: 0.19159815653513607 | L7: 0.79794934456058331 | M7: 1.045249890428061E-2
A8: 6 | B8: 0.54156828976972859 | C8: 0.45843171023027141 | D8: 0.50351021800301277 | E8: 0.49648978199698718 | F8: 0.52489940355583464 | G8: 0.47510059644416541 | H8: 0.42690166405216695 | I8: 0.56316323705822646 | J8: 9.9350988896065948E-3 | K8: 0.28721554869931559 | L8: 0.69953485458332676 | M8: 1.3249596717357598E-2
A9: 7 | B9: 0.62908201255185614 | C9: 0.3709179874481438 | D9: 0.57168045276447543 | E9: 0.42831954723552462 | F9: 0.61031039722161928 | G9: 0.38968960277838072 | H9: 0.5039657379382948 | I9: 0.48690648514792262 | J9: 9.127776913782585E-3 | K9: 0.35145238387057237 | L9: 0.63532295624463786 | M9: 1.3224659884789802E-2
A10: 8 | B10: 0.65035132736996093 | C10: 0.34964867263003907 | D10: 0.5880295470110557 | E10: 0.41197045298894436 | F10: 0.63060047881956316 | G10: 0.36939952118043679 | H10: 0.5226122769170426 | I10: 0.46862783552330523 | J10: 8.7598875596522196E-3 | K10: 0.36047184928832093 | L10: 0.62635838461642046 | M10: 1.3169766095258615E-2
A11: 9 | B11: 0.36467819502711551 | C11: 0.63532180497288449 | D11: 0.35324112303881089 | E11: 0.64675887696118906 | F11: 0.37310892979434285 | G11: 0.62689107020565715 | H11: 0.27143924979614026 | I11: 0.72219579595904682 | J11: 6.3649542448129016E-3 | K11: 0.19865288691888389 | L11: 0.78938049000659671 | M11: 1.1966623074519426E-2
A12: 10 | B12: 0.59295708874552466 | C12: 0.40704291125447534 | D12: 0.57134173873780003 | E12: 0.42865826126219997 | F12: 0.59248424058788707 | G12: 0.40751575941211299 | H12: 0.47464859170665785 | I12: 0.51734962065993462 | J12: 8.0017876334074634E-3 | K12: 0.34419953846485646 | L12: 0.64240731554769559 | M12: 1.3393145987447969E-2
A13: 11 | B13: 0.68561116984433668 | C13: 0.31438883015566332 | D13: 0.65814286238397479 | E13: 0.34185713761602526 | F13: 0.68334557473374957 | G13: 0.31665442526625048 | H13: 0.56912739732122997 | I13: 0.42330796956347616 | J13: 7.5646331152939084E-3 | K13: 0.43445785572066548 | L13: 0.55404569333048359 | M13: 1.1496450948850918E-2
A14: 12 | B14: 0.67382307731288327 | C14: 0.32617692268711679 | D14: 0.64395056705487463 | E14: 0.35604943294512537 | F14: 0.66291848555364941 | G14: 0.33708151444635059 | H14: 0.55047779106471462 | I14: 0.44144231494349462 | J14: 8.0798939917908277E-3 | K14: 0.39761935877330545 | L14: 0.59146846140442588 | M14: 1.0912179822268688E-2
A15: 13 | B15: 0.64650563763608082 | C15: 0.35349436236391912 | D15: 0.62135661189358371 | E15: 0.37864338810641629 | F15: 0.62174051174271117 | G15: 0.37825948825728878 | H15: 0.49487182828769888 | I15: 0.49853387721058734 | J15: 6.5942945017137345E-3 | K15: 0.40605924773569235 | L15: 0.58419796706701299 | M15: 9.7427851972946965E-3
A16: 14 | B16: 0.68937522737281487 | C16: 0.31062477262718519 | D16: 0.64292156862745098 | E16: 0.35707843137254902 | F16: 0.67170275975295124 | G16: 0.3282972402470487 | H16: 0.60594017045902338 | I16: 0.38649388081378983 | J16: 7.5659487271867503E-3 | K16: 0.43866452501147313 | L16: 0.55200780174391928 | M16: 9.3276732446076187E-3
A17: 15 | B17: 0.68831194867682433 | C17: 0.31168805132317562 | D17: 0.6832463412137959 | E17: 0.3167536587862041 | F17: 0.69757765510422676 | G17: 0.30242234489577324 | H17: 0.58640022332852559 | I17: 0.40487600614153446 | J17: 8.7237705299399813E-3 | K17: 0.40861718816504722 | L17: 0.57829772227019005 | M17: 1.308508956476268E-2
A18: 16 | B18: 0.40947555951453068 | C18: 0.59052444048546937 | D18: 0.39480019258545979 | E18: 0.60519980741454016 | F18: 0.41890278567367822 | G18: 0.58109721432632178 | H18: 0.27918502958661118 | I18: 0.71323640457459803 | J18: 7.5785658387907242E-3 | K18: 0.21773417148034885 | L18: 0.76740004530524408 | M18: 1.4865783214407067E-2
A19: 17 | B19: 0.61263923619004323 | C19: 0.38736076380995682 | D19: 0.59156421236819079 | E19: 0.40843578763180916 | F19: 0.59397265327768678 | G19: 0.40602734672231316 | H19: 0.48566044025076599 | I19: 0.50480122049717313 | J19: 9.5383392520608703E-3 | K19: 0.35498027163934215 | L19: 0.63399007722057998 | M19: 1.1029651140077871E-2
A20: 18 | B20: 0.43675566975756897 | C20: 0.56324433024243103 | D20: 0.4181485295800435 | E20: 0.58185147041995655 | F20: 0.43257778598467361 | G20: 0.56742221401532633 | H20: 0.33798347503293019 | I20: 0.65516704586277097 | J20: 6.8494791042988867E-3 | K20: 0.24240141614251817 | L20: 0.74580995066099209 | M20: 1.1788633196489774E-2
A21: 19 | B21: 0.69236671840393438 | C21: 0.30763328159606562 | D21: 0.67379425459017839 | E21: 0.32620574540982167 | F21: 0.68998183004921765 | G21: 0.31001816995078235 | H21: 0.62115782067631153 | I21: 0.36687041027219558 | J21: 1.1971769051492899E-2 | K21: 0.39750200017779358 | L21: 0.59229709307493994 | M21: 1.0200906747266423E-2
A22: 20 | B22: 0.59644200865574915 | C22: 0.40355799134425091 | D22: 0.59288431416424259 | E22: 0.40711568583575741 | F22: 0.59869028062200413 | G22: 0.40130971937799581 | H22: 0.50221320094886401 | I22: 0.48591377075640119 | J22: 1.1873028294734782E-2 | K22: 0.29221118661787771 | L22: 0.69609730598090092 | M22: 1.1691507401221424E-2
A23: 21 | B23: 0.51665520756774697 | C23: 0.48334479243225303 | D23: 0.50481927710843377 | E23: 0.49518072289156628 | F23: 0.5200376157407407 | G23: 0.47996238425925924 | H23: 0.43118835729317206 | I23: 0.55733880986790396 | J23: 1.1472832838923962E-2 | K23: 0.2714143875801065 | L23: 0.7157556767629879 | M23: 1.28299356569056E-2
A24: 22 | B24: 0.63830568766191087 | C24: 0.36169431233808919 | D24: 0.62148717745451665 | E24: 0.37851282254548335 | F24: 0.63982227159122462 | G24: 0.36017772840877532 | H24: 0.52911928381321072 | I24: 0.46088797483668037 | J24: 9.9927413501088806E-3 | K24: 0.37647902474005018 | L24: 0.61170114118272523 | M24: 1.1819834077224565E-2
A25: 23 | B25: 0.74590376215058962 | C25: 0.25409623784941038 | D25: 0.73305579264575238 | E25: 0.26694420735424756 | F25: 0.74690055624335205 | G25: 0.25309944375664789 | H25: 0.66894070678044182 | I25: 0.32020093447693421 | J25: 1.0858358742623994E-2 | K25: 0.47636920121086201 | L25: 0.51375624141282128 | M25: 9.8745573763167008E-3
A26: 24 | B26: 0.73270493182965835 | C26: 0.26729506817034171 | D26: 0.73256783386387747 | E26: 0.26743216613612247 | F26: 0.73760562043102629 | G26: 0.26239437956897371 | H26: 0.63239068497021356 | I26: 0.35680143163248484 | J26: 1.080788339730156E-2 | K26: 0.47391813713057235 | L26: 0.51393166419073155 | M26: 1.2150198678696088E-2
A27: 25 | B27: 0.46360651005016057 | C27: 0.53639348994983937 | D27: 0.4611265443380364 | E27: 0.53887345566196354 | F27: 0.48076499522795685 | G27: 0.51923500477204321 | H27: 0.42433881343817015 | I27: 0.56520133428639507 | J27: 1.0459852275434835E-2 | K27: 0.28726961097900999 | L27: 0.70200002414030349 | M27: 1.0730364880686551E-2
A28: 26 | B28: 0.70978763894295227 | C28: 0.29021236105704773 | D28: 0.69715687562973672 | E28: 0.30284312437026328 | F28: 0.69730843415746102 | G28: 0.30269156584253903 | H28: 0.57952966398898931 | I28: 0.40873178672101423 | J28: 1.1738549289996427E-2 | K28: 0.43891402714932126 | L28: 0.54996844663453148 | M28: 1.1117526216147268E-2
A29: 27 | B29: 0.69688595586718916 | C29: 0.3031140441328109 | D29: 0.67786157756573195 | E29: 0.3221384224342681 | F29: 0.67805650470872569 | G29: 0.32194349529127425 | H29: 0.57290186174898694 | I29: 0.41611558113584307 | J29: 1.0982557115170023E-2 | K29: 0.42546981776765375 | L29: 0.56435079726651483 | M29: 1.0179384965831435E-2
A30: 28 | B30: 0.68146073708972776 | C30: 0.31853926291027218 | D30: 0.65868615781493967 | E30: 0.34131384218506028 | F30: 0.65767231638418078 | G30: 0.34232768361581922 | H30: 0.55545026124372499 | I30: 0.43659717242085849 | J30: 7.9525663354164527E-3 | K30: 0.42187317604638191 | L30: 0.5672965926925122 | M30: 1.0830231261105851E-2
A31: 29 | B31: 0.55674245722131066 | C31: 0.44325754277868934 | D31: 0.53128482188080361 | E31: 0.46871517811919633 | F31: 0.53857591835355345 | G31: 0.46142408164644655 | H31: 0.3839319752697618 | I31: 0.60758150867713112 | J31: 8.486516053107027E-3 | K31: 0.3071193189619662 | L31: 0.68110668680488806 | M31: 1.1773994233145681E-2
A32: 30 | B32: 0.41489616135847251 | C32: 0.58510383864152749 | D32: 0.39285068782006227 | E32: 0.60714931217993773 | F32: 0.39035096550752069 | G32: 0.60964903449247931 | H32: 0.3373463081913407 | I32: 0.65403797581958278 | J32: 8.6157159890765025E-3 | K32: 0.26720222181846498 | L32: 0.71897630233342846 | M32: 1.3821475848106522E-2
A33: 31 | B33: 0.44406388373765282 | C33: 0.55593611626234718 | D33: 0.42381806387606363 | E33: 0.57618193612393631 | F33: 0.41816271963330787 | G33: 0.58183728036669213 | H33: 0.38262970498474058 | I33: 0.6084308240081383 | J33: 8.9394710071210581E-3 | K33: 0.30864977000090194 | L33: 0.67861974770967282 | M33: 1.2730482289425195E-2
A34: 32 | B34: 0.44927815882260075 | C34: 0.55072184117739931 | D34: 0.42726887940460656 | E34: 0.57273112059539344 | F34: 0.41823738274832623 | G34: 0.58176261725167377 | H34: 0.38591184096802073 | I34: 0.605937289926054 | J34: 8.1508691059252857E-3 | K34: 0.30754694124772863 | L34: 0.68102967898243494 | M34: 1.1423379769836463E-2
A35: 33 | B35: 0.5472445820433437 | C35: 0.45275541795665636 | D35: 0.5196161180405765 | E35: 0.48038388195942355 | F35: 0.52176492630527105 | G35: 0.47823507369472895 | H35: 0.40459578221221237 | I35: 0.58781282976076099 | J35: 7.5913880270266016E-3 | K35: 0.32643050029560744 | L35: 0.66059473019829662 | M35: 1.2974769506095905E-2
A36: 34 | B36: 0.52947803229440482 | C36: 0.47052196770559518 | D36: 0.50316493490982916 | E36: 0.49683506509017078 | F36: 0.48878977340607704 | G36: 0.51121022659392301 | H36: 0.43084377569069032 | I36: 0.5599013477491841 | J36: 9.2548765601255575E-3 | K36: 0.33718721300338422 | L36: 0.65104985720935504 | M36: 1.176292978726081E-2
A37: 35 | B37: 0.42412750755702117 | C37: 0.57587249244297889 | D37: 0.40310381533979495 | E37: 0.596896184660205 | F37: 0.39863737486095663 | G37: 0.60136262513904337 | H37: 0.33933506941670794 | I37: 0.65139871870656463 | J37: 9.2662118767274301E-3 | K37: 0.26845550376013122 | L37: 0.71838809751977517 | M37: 1.3156398720093557E-2
A38: 36 | B38: 0.48826578150477523 | C38: 0.51173421849522482 | D38: 0.45914716405654288 | E38: 0.54085283594345712 | F38: 0.4650158618258724 | G38: 0.5349841381741276 | H38: 0.36310727573058338 | I38: 0.62965250011578189 | J38: 7.2402241536347776E-3 | K38: 0.285111635392091 | L38: 0.703263909504242 | M38: 1.1624455103667015E-2
A39: 37 | B39: 0.53933857539315444 | C39: 0.4606614246068455 | D39: 0.51263495904690992 | E39: 0.48736504095309008 | F39: 0.5112482533768048 | G39: 0.48875174662319515 | H39: 0.42480291085506366 | I39: 0.56774856962058695 | J39: 7.4485195243494083E-3 | K39: 0.33597887126679027 | L39: 0.65156264589363599 | M39: 1.245848283957369E-2
A40: 38 | B40: 0.65985494685946267 | C40: 0.34014505314053733 | D40: 0.6569430428762526 | E40: 0.3430569571237474 | F40: 0.64564095278685418 | G40: 0.35435904721314582 | H40: 0.58074581963198768 | I40: 0.40456167354649131 | J40: 1.4692506821521024E-2 | K40: 0.34581456591501059 | L40: 0.64467341094530228 | M40: 9.5120231396871539E-3
A41: 39 | B41: 0.5279037211926203 | C41: 0.4720962788073797 | D41: 0.50180862250262881 | E41: 0.49819137749737119 | F41: 0.5021582127892531 | G41: 0.49784178721074684 | H41: 0.40713947013264923 | I41: 0.58603961238707791 | J41: 6.8209174802728364E-3 | K41: 0.32388768579584604 | L41: 0.66562899891721627 | M41: 1.0483315286937691E-2
A42: 40 | B42: 0.75034429819610327 | C42: 0.24965570180389679 | D42: 0.75580379717740087 | E42: 0.24419620282259918 | F42: 0.7472197868118684 | G42: 0.2527802131881316 | H42: 0.66023660816662399 | I42: 0.32423682400075543 | J42: 1.552656783262063E-2 | K42: 0.42041305575839405 | L42: 0.56984610297460769 | M42: 9.74084126699825E-3