A1: HB 5002 University of Richmond House Plan Population Totals
A2: DISTRICT | B2: Total Population | C2: Target | D2: Difference | E2: Deviation
A3: 1 | B3: 81019 | C3: 80010.240000000005 | D3: =B3-C3 -> 1008.7599999999948 | E3: 1.2607886190567541E-2
A4: 2 | B4: 82053 | C4: 80010.240000000005 | D4: =B4-C4 -> 2042.7599999999948 | E4: 2.5531232002303637E-2
A5: 3 | B5: 81137 | C5: 80010.240000000005 | D5: =B5-C5 -> 1126.7599999999948 | E5: 1.4082697414730849E-2
A6: 4 | B6: 81101 | C6: 80010.240000000005 | D6: =B6-C6 -> 1090.7599999999948 | E6: 1.3632755007358992E-2
A7: 5 | B7: 79111 | C7: 80010.240000000005 | D7: =B7-C7 -> -899.24000000000524 | E7: -1.1239061400140847E-2
A8: 6 | B8: 81623 | C8: 80010.240000000005 | D8: =B8-C8 -> 1612.7599999999948 | E8: 2.015691991425091E-2
A9: 7 | B9: 80602 | C9: 80010.240000000005 | D9: =B9-C9 -> 591.75999999999476 | E9: 7.3960533051768713E-3
A10: 8 | B10: 80345 | C10: 80010.240000000005 | D10: =B10-C10 -> 334.75999999999476 | E10: 4.183964452550008E-3
A11: 9 | B11: 79422 | C11: 80010.240000000005 | D11: =B11-C11 -> -588.24000000000524 | E11: -7.3520589364561989E-3
A12: 10 | B12: 81034 | C12: 80010.240000000005 | D12: =B12-C12 -> 1023.7599999999948 | E12: 1.2795362193639147E-2
A13: 11 | B13: 80956 | C13: 80010.240000000005 | D13: =B13-C13 -> 945.75999999999476 | E13: 1.1820486977666793E-2
A14: 12 | B14: 81393 | C14: 80010.240000000005 | D14: =B14-C14 -> 1382.7599999999948 | E14: 1.7282287867152937E-2
A15: 13 | B15: 76926 | C15: 80010.240000000005 | D15: =B15-C15 -> -3084.2400000000052 | E15: -3.8548065847571575E-2
A16: 14 | B16: 80546 | C16: 80010.240000000005 | D16: =B16-C16 -> 535.75999999999476 | E16: 6.6961428937095391E-3
A17: 15 | B17: 80771 | C17: 80010.240000000005 | D17: =B17-C17 -> 760.75999999999476 | E17: 9.5082829397836414E-3
A18: 16 | B18: 78882 | C18: 80010.240000000005 | D18: =B18-C18 -> -1128.2400000000052 | E18: -1.4101195047034044E-2
A19: 17 | B19: 81898 | C19: 80010.240000000005 | D19: =B19-C19 -> 1887.7599999999948 | E19: 2.35939799705637E-2
A20: 18 | B20: 79430 | C20: 80010.240000000005 | D20: =B20-C20 -> -580.24000000000524 | E20: -7.2520717348180082E-3
A21: 19 | B21: 81180 | C21: 80010.240000000005 | D21: =B21-C21 -> 1169.7599999999948 | E21: 1.4620128623536122E-2
A22: 20 | B22: 78943 | C22: 80010.240000000005 | D22: =B22-C22 -> -1067.2400000000052 | E22: -1.3338792634542844E-2
A23: 21 | B23: 83279 | C23: 80010.240000000005 | D23: =B23-C23 -> 3268.7599999999948 | E23: 4.0854270653356305E-2
A24: 22 | B24: 79274 | C24: 80010.240000000005 | D24: =B24-C24 -> -736.24000000000524 | E24: -9.2018221667627201E-3
A25: 23 | B25: 80010 | C25: 80010.240000000005 | D25: =B25-C25 -> -0.24000000000523869 | E25: -2.9996160492111845E-6
A26: 24 | B26: 78906 | C26: 80010.240000000005 | D26: =B26-C26 -> -1104.2400000000052 | E26: -1.3801233442119473E-2
A27: 25 | B27: 80030 | C27: 80010.240000000005 | D27: =B27-C27 -> 19.759999999994761 | E27: 2.4696838804626458E-4
A28: 26 | B28: 79121 | C28: 80010.240000000005 | D28: =B28-C28 -> -889.24000000000524 | E28: -1.1114077398093109E-2
A29: 27 | B29: 80160 | C29: 80010.240000000005 | D29: =B29-C29 -> 149.75999999999476 | E29: 1.8717604146668569E-3
A30: 28 | B30: 81471 | C30: 80010.240000000005 | D30: =B30-C30 -> 1460.7599999999948 | E30: 1.8257163083125295E-2
A31: 29 | B31: 80348 | C31: 80010.240000000005 | D31: =B31-C31 -> 337.75999999999476 | E31: 4.2214596531643294E-3
A32: 30 | B32: 80650 | C32: 80010.240000000005 | D32: =B32-C32 -> 639.75999999999476 | E32: 7.9959765150060137E-3
A33: 31 | B33: 77794 | C33: 80010.240000000005 | D33: =B33-C33 -> -2216.2400000000052 | E33: -2.7699454469827925E-2
A34: 32 | B34: 78459 | C34: 80010.240000000005 | D34: =B34-C34 -> -1551.2400000000052 | E34: -1.9388018333653355E-2
A35: 33 | B35: 79718 | C35: 80010.240000000005 | D35: =B35-C35 -> -292.24000000000524 | E35: -3.6525324758431574E-3
A36: 34 | B36: 80795 | C36: 80010.240000000005 | D36: =B36-C36 -> 784.75999999999476 | E36: 9.8082445446982126E-3
A37: 35 | B37: 80422 | C37: 80010.240000000005 | D37: =B37-C37 -> 411.75999999999476 | E37: 5.14634126831759E-3
A38: 36 | B38: 76153 | C38: 80010.240000000005 | D38: =B38-C38 -> -3857.2400000000052 | E38: -4.8209329205861712E-2
A39: 37 | B39: 80046 | C39: 80010.240000000005 | D39: =B39-C39 -> 35.759999999994761 | E39: 4.4694279132264519E-4
A40: 38 | B40: 82832 | C40: 80010.240000000005 | D40: =B40-C40 -> 2821.7599999999948 | E40: 3.5267485761822419E-2
A41: 39 | B41: 78182 | C41: 80010.240000000005 | D41: =B41-C41 -> -1828.2400000000052 | E41: -2.2850075190375695E-2
A42: 40 | B42: 77754 | C42: 80010.240000000005 | D42: =B42-C42 -> -2256.2400000000052 | E42: -2.8199390478018876E-2
A43: 41 | B43: 79261 | C43: 80010.240000000005 | D43: =B43-C43 -> -749.24000000000524 | E43: -9.3643013694247792E-3
A44: 42 | B44: 77186 | C44: 80010.240000000005 | D44: =B44-C44 -> -2824.2400000000052 | E44: -3.5298481794330386E-2
A45: 43 | B45: 79027 | C45: 80010.240000000005 | D45: =B45-C45 -> -983.24000000000524 | E45: -1.2288927017341845E-2
A46: 44 | B46: 82505 | C46: 80010.240000000005 | D46: =B46-C46 -> 2494.7599999999948 | E46: 3.1180508894861389E-2
A47: 45 | B47: 80313 | C47: 80010.240000000005 | D47: =B47-C47 -> 302.75999999999476 | E47: 3.7840156459972465E-3
A48: 46 | B48: 77836 | C48: 80010.240000000005 | D48: =B48-C48 -> -2174.2400000000052 | E48: -2.7174521661227427E-2
A49: 47 | B49: 79371 | C49: 80010.240000000005 | D49: =B49-C49 -> -639.24000000000524 | E49: -7.9894773468996618E-3
A50: 48 | B50: 76919 | C50: 80010.240000000005 | D50: =B50-C50 -> -3091.2400000000052 | E50: -3.8635554649004991E-2
A51: 49 | B51: 80140 | C51: 80010.240000000005 | D51: =B51-C51 -> 129.75999999999476 | E51: 1.6217924105713813E-3
A52: 50 | B52: 77884 | C52: 80010.240000000005 | D52: =B52-C52 -> -2126.2400000000052 | E52: -2.6574598451398285E-2
A53: 51 | B53: 78639 | C53: 80010.240000000005 | D53: =B53-C53 -> -1371.2400000000052 | E53: -1.7138306296794074E-2
A54: 52 | B54: 78056 | C54: 80010.240000000005 | D54: =B54-C54 -> -1954.2400000000052 | E54: -2.4424873616177192E-2
A55: 53 | B55: 80000 | C55: 80010.240000000005 | D55: =B55-C55 -> -10.240000000005239 | E55: -1.2798361809694905E-4
A56: 54 | B56: 78503 | C56: 80010.240000000005 | D56: =B56-C56 -> -1507.2400000000052 | E56: -1.883808872464331E-2
A57: 55 | B57: 78812 | C57: 80010.240000000005 | D57: =B57-C57 -> -1198.2400000000052 | E57: -1.4976083061368209E-2
A58: 56 | B58: 79627 | C58: 80010.240000000005 | D58: =B58-C58 -> -383.24000000000524 | E58: -4.789886894477572E-3
A59: 57 | B59: 79859 | C59: 80010.240000000005 | D59: =B59-C59 -> -151.24000000000524 | E59: -1.8902580469700532E-3
A60: 58 | B60: 81991 | C60: 80010.240000000005 | D60: =B60-C60 -> 1980.7599999999948 | E60: 2.4756331189607662E-2
A61: 59 | B61: 78769 | C61: 80010.240000000005 | D61: =B61-C61 -> -1241.2400000000052 | E61: -1.5513514270173482E-2
A62: 60 | B62: 80894 | C62: 80010.240000000005 | D62: =B62-C62 -> 883.75999999999476 | E62: 1.1045586164970818E-2
A63: 61 | B63: 80414 | C63: 80010.240000000005 | D63: =B63-C63 -> 403.75999999999476 | E63: 5.0463540666793993E-3
A64: 62 | B64: 82068 | C64: 80010.240000000005 | D64: =B64-C64 -> 2057.7599999999948 | E64: 2.5718708005375245E-2
A65: 63 | B65: 80025 | C65: 80010.240000000005 | D65: =B65-C65 -> 14.759999999994761 | E65: 1.8447638702239564E-4
A66: 64 | B66: 79646 | C66: 80010.240000000005 | D66: =B66-C66 -> -364.24000000000524 | E66: -4.5524172905868701E-3
A67: 65 | B67: 80580 | C67: 80010.240000000005 | D67: =B67-C67 -> 569.75999999999476 | E67: 7.121088500671848E-3
A68: 66 | B68: 81155 | C68: 80010.240000000005 | D68: =B68-C68 -> 1144.7599999999948 | E68: 1.4307668618416777E-2
A69: 67 | B69: 76019 | C69: 80010.240000000005 | D69: =B69-C69 -> -3991.2400000000052 | E69: -4.98841148333014E-2
A70: 68 | B70: 81708 | C70: 80010.240000000005 | D70: =B70-C70 -> 1697.7599999999948 | E70: 2.1219283931656681E-2
A71: 69 | B71: 82640 | C71: 80010.240000000005 | D71: =B71-C71 -> 2629.7599999999948 | E71: 3.2867792922505849E-2
A72: 70 | B72: 80243 | C72: 80010.240000000005 | D72: =B72-C72 -> 232.75999999999476 | E72: 2.9091276316630813E-3
A73: 71 | B73: 80522 | C73: 80010.240000000005 | D73: =B73-C73 -> 511.75999999999476 | E73: 6.3961812887949688E-3
A74: 72 | B74: 80105 | C74: 80010.240000000005 | D74: =B74-C74 -> 94.759999999994761 | E74: 1.1843484034042987E-3
A75: 73 | B75: 80270 | C75: 80010.240000000005 | D75: =B75-C75 -> 259.75999999999476 | E75: 3.2465844371919739E-3
A76: 74 | B76: 79774 | C76: 80010.240000000005 | D76: =B76-C76 -> -236.24000000000524 | E76: -2.9526220643758252E-3
A77: 75 | B77: 78675 | C77: 80010.240000000005 | D77: =B77-C77 -> -1335.2400000000052 | E77: -1.6688363889422218E-2
A78: 76 | B78: 78765 | C78: 80010.240000000005 | D78: =B78-C78 -> -1245.2400000000052 | E78: -1.5563507870992577E-2
A79: 77 | B79: 79695 | C79: 80010.240000000005 | D79: =B79-C79 -> -315.24000000000524 | E79: -3.9399956805529542E-3
A80: 78 | B80: 82800 | C80: 80010.240000000005 | D80: =B80-C80 -> 2789.7599999999948 | E80: 3.486753695526966E-2
A81: 79 | B81: 82401 | C81: 80010.240000000005 | D81: =B81-C81 -> 2390.7599999999948 | E81: 2.9880675273564916E-2
A82: 80 | B82: 81771 | C82: 80010.240000000005 | D82: =B82-C82 -> 1760.7599999999948 | E82: 2.2006683144557431E-2
A83: 81 | B83: 83677 | C83: 80010.240000000005 | D83: =B83-C83 -> 3666.7599999999948 | E83: 4.5828633934856269E-2
A84: 82 | B84: 79539 | C84: 80010.240000000005 | D84: =B84-C84 -> -471.24000000000524 | E84: -5.8897461124976652E-3
A85: 83 | B85: 80597 | C85: 80010.240000000005 | D85: =B85-C85 -> 586.75999999999476 | E85: 7.3335613041530029E-3
A86: 84 | B86: 78591 | C86: 80010.240000000005 | D86: =B86-C86 -> -1419.2400000000052 | E86: -1.7738229506623217E-2
A87: 85 | B87: 76503 | C87: 80010.240000000005 | D87: =B87-C87 -> -3507.2400000000052 | E87: -4.3834889134190889E-2
A88: 86 | B88: 81872 | C88: 80010.240000000005 | D88: =B88-C88 -> 1861.7599999999948 | E88: 2.3269021565239582E-2
A89: 87 | B89: 80537 | C89: 80010.240000000005 | D89: =B89-C89 -> 526.75999999999476 | E89: 6.5836572918665749E-3
A90: 88 | B90: 82223 | C90: 80010.240000000005 | D90: =B90-C90 -> 2212.7599999999948 | E90: 2.7655960037115183E-2
A91: 89 | B91: 83881 | C91: 80010.240000000005 | D91: =B91-C91 -> 3870.7599999999948 | E91: 4.8378307576630121E-2
A92: 90 | B92: 79508 | C92: 80010.240000000005 | D92: =B92-C92 -> -502.24000000000524 | E92: -6.2771965188456527E-3
A93: 91 | B93: 77182 | C93: 80010.240000000005 | D93: =B93-C93 -> -2828.2400000000052 | E93: -3.5348475395149487E-2
A94: 92 | B94: 80255 | C94: 80010.240000000005 | D94: =B94-C94 -> 244.75999999999476 | E94: 3.0591084341203669E-3
A95: 93 | B95: 79654 | C95: 80010.240000000005 | D95: =B95-C95 -> -356.24000000000524 | E95: -4.4524300889486794E-3
A96: 94 | B96: 78555 | C96: 80010.240000000005 | D96: =B96-C96 -> -1455.2400000000052 | E96: -1.8188171913995074E-2
A97: 95 | B97: 80613 | C97: 80010.240000000005 | D97: =B97-C97 -> 602.75999999999476 | E97: 7.5335357074293834E-3
A98: 96 | B98: 80595 | C98: 80010.240000000005 | D98: =B98-C98 -> 584.75999999999476 | E98: 7.308564503743455E-3
A99: 97 | B99: 79905 | C99: 80010.240000000005 | D99: =B99-C99 -> -105.24000000000524 | E99: -1.3153316375504589E-3
A100: 98 | B100: 79629 | C100: 80010.240000000005 | D100: =B100-C100 -> -381.24000000000524 | E100: -4.7648900940680241E-3
A101: 99 | B101: 81014 | C101: 80010.240000000005 | D101: =B101-C101 -> 1003.7599999999948 | E101: 1.2545394189543672E-2
A102: 100 | B102: 78050 | C102: 80010.240000000005 | D102: =B102-C102 -> -1960.2400000000052 | E102: -2.4499864017405837E-2

A1: HB 5002 University of Richmond House Plan Racial Demographics
A2: DISTRICT | B2: Total Population | C2: White | D2: % White | E2: Black | F2: % Black | G2: AIAN | H2: % AIAN | I2: Asian | J2: % Asian | K2: HawPI | L2: % HawPI | M2: Other | N2: % Other | O2: Multi | P2: % Multi | Q2: Total Hispanic | R2: % Hispanic
A3: 1 | B3: 81019 | C3: 76378 | D3: =C3/B3 -> 0.94271714042385124 | E3: 3301 | F3: =E3/B3 -> 4.0743529295597332E-2 | G3: 458 | H3: =G3/B3 -> 5.6529949764869969E-3 | I3: 312 | J3: =I3/B3 -> 3.8509485429343735E-3 | K3: 37 | L3: =K3/B3 -> 4.5668300028388402E-4 | M3: 436 | N3: =M3/B3 -> 5.381453733074958E-3 | O3: 97 | P3: =O3/B3 -> 1.1972500277712636E-3 | Q3: 991 | R3: =Q3/B3 -> 1.2231698737333218E-2
A4: 2 | B4: 82053 | C4: 79738 | D4: =C4/B4 -> 0.97178652821956535 | E4: 1412 | F4: =E4/B4 -> 1.720838969934067E-2 | G4: 322 | H4: =G4/B4 -> 3.9242928351187643E-3 | I4: 244 | J4: =I4/B4 -> 2.9736877384129771E-3 | K4: 12 | L4: =K4/B4 -> 1.4624693795473658E-4 | M4: 278 | N4: =M4/B4 -> 3.3880540626180641E-3 | O4: 47 | P4: =O4/B4 -> 5.7280050698938487E-4 | Q4: 644 | R4: =Q4/B4 -> 7.8485856702375286E-3
A5: 3 | B5: 81137 | C5: 77175 | D5: =C5/B5 -> 0.95116901043913382 | E5: 2733 | F5: =E5/B5 -> 3.3683769427018499E-2 | G5: 356 | H5: =G5/B5 -> 4.3876406571601119E-3 | I5: 505 | J5: =I5/B5 -> 6.2240408198479119E-3 | K5: 20 | L5: =K5/B5 -> 2.4649666613259057E-4 | M5: 260 | N5: =M5/B5 -> 3.2044566597236772E-3 | O5: 88 | P5: =O5/B5 -> 1.0845853309833983E-3 | Q5: 615 | R5: =Q5/B5 -> 7.5797724835771595E-3
A6: 4 | B6: 81101 | C6: 77574 | D6: =C6/B6 -> 0.95651101712679254 | E6: 2083 | F6: =E6/B6 -> 2.5684023624862825E-2 | G6: 377 | H6: =G6/B6 -> 4.6485246791038333E-3 | I6: 416 | J6: =I6/B6 -> 5.1294065424594025E-3 | K6: 30 | L6: =K6/B6 -> 3.6990912565812998E-4 | M6: 530 | N6: =M6/B6 -> 6.5350612199602965E-3 | O6: 91 | P6: =O6/B6 -> 1.1220576811629944E-3 | Q6: 1141 | R6: =Q6/B6 -> 1.4068877079197543E-2
A7: 5 | B7: 79111 | C7: 75172 | D7: =C7/B7 -> 0.95020919973202211 | E7: 1908 | F7: =E7/B7 -> 2.4118011401701406E-2 | G7: 384 | H7: =G7/B7 -> 4.8539394016002832E-3 | I7: 226 | J7: =I7/B7 -> 2.8567455853168331E-3 | K7: 24 | L7: =K7/B7 -> 3.033712126000177E-4 | M7: 1279 | N7: =M7/B7 -> 1.6167157538142608E-2 | O7: 118 | P7: =O7/B7 -> 1.4915751286167537E-3 | Q7: 2624 | R7: =Q7/B7 -> 3.3168585910935265E-2
A8: 6 | B8: 81623 | C8: 75955 | D8: =C8/B8 -> 0.93055878857674923 | E8: 3953 | F8: =E8/B8 -> 4.8429976844761892E-2 | G8: 420 | H8: =G8/B8 -> 5.1456084682013651E-3 | I8: 673 | J8: =I8/B8 -> 8.2452249978559964E-3 | K8: 25 | L8: =K8/B8 -> 3.0628621834531932E-4 | M8: 449 | N8: =M8/B8 -> 5.5009004814819355E-3 | O8: 148 | P8: =O8/B8 -> 1.8132144126042904E-3 | Q8: 1175 | R8: =Q8/B8 -> 1.4395452262230008E-2
A9: 7 | B9: 80602 | C9: 69388 | D9: =C9/B9 -> 0.86087193866157163 | E9: 3915 | F9: =E9/B9 -> 4.8571995732115826E-2 | G9: 438 | H9: =G9/B9 -> 5.4341083347807743E-3 | I9: 5774 | J9: =I9/B9 -> 7.1635939554849759E-2 | K9: 67 | L9: =K9/B9 -> 8.3124488226098603E-4 | M9: 734 | N9: =M9/B9 -> 9.106473784769609E-3 | O9: 286 | P9: =O9/B9 -> 3.5482990496513733E-3 | Q9: 2277 | R9: =Q9/B9 -> 2.8249919356839782E-2
A10: 8 | B10: 80345 | C10: 72481 | D10: =C10/B10 -> 0.90212209845043256 | E10: 4488 | F10: =E10/B10 -> 5.5859107598481547E-2 | G10: 371 | H10: =G10/B10 -> 4.6175866575393614E-3 | I10: 2093 | J10: =I10/B10 -> 2.6050158690646585E-2 | K10: 36 | L10: =K10/B10 -> 4.4806770800921031E-4 | M10: 709 | N10: =M10/B10 -> 8.8244445827369462E-3 | O10: 167 | P10: =O10/B10 -> 2.0785363121538364E-3 | Q10: 1658 | R10: =Q10/B10 -> 2.0636007218868629E-2
A11: 9 | B11: 79422 | C11: 71198 | D11: =C11/B11 -> 0.89645186472262095 | E11: 6177 | F11: =E11/B11 -> 7.7774420185842713E-2 | G11: 442 | H11: =G11/B11 -> 5.565208632368865E-3 | I11: 421 | J11: =I11/B11 -> 5.3007982674825619E-3 | K11: 31 | L11: =K11/B11 -> 3.9032006245120999E-4 | M11: 1069 | N11: =M11/B11 -> 1.3459746669688499E-2 | O11: 84 | P11: =O11/B11 -> 1.0576414595452142E-3 | Q11: 2013 | R11: =Q11/B11 -> 2.5345622119815669E-2
A12: 10 | B12: 81034 | C12: 58215 | D12: =C12/B12 -> 0.71840215218303427 | E12: 19616 | F12: =E12/B12 -> 0.24207122936051534 | G12: 368 | H12: =G12/B12 -> 4.5413036503196193E-3 | I12: 460 | J12: =I12/B12 -> 5.6766295628995237E-3 | K12: 13 | L12: =K12/B12 -> 1.6042648764716044E-4 | M12: 2181 | N12: =M12/B12 -> 2.6914628427573611E-2 | O12: 181 | P12: =O12/B12 -> 2.2336303280104646E-3 | Q12: 3345 | R12: =Q12/B12 -> 4.1278969321519365E-2
A13: 11 | B13: 80956 | C13: 49619 | D13: =C13/B13 -> 0.6129131874104452 | E13: 26722 | F13: =E13/B13 -> 0.33008053757596717 | G13: 438 | H13: =G13/B13 -> 5.4103463609862148E-3 | I13: 1717 | J13: =I13/B13 -> 2.1209051830624041E-2 | K13: 56 | L13: =K13/B13 -> 6.9173378131330598E-4 | M13: 1922 | N13: =M13/B13 -> 2.3741291565788823E-2 | O13: 482 | P13: =O13/B13 -> 5.9538514748752411E-3 | Q13: 4331 | R13: =Q13/B13 -> 5.3498196551213004E-2
A14: 12 | B14: 81393 | C14: 73020 | D14: =C14/B14 -> 0.89712874571523349 | E14: 6667 | F14: =E14/B14 -> 8.1911220866659293E-2 | G14: 381 | H14: =G14/B14 -> 4.680992222918433E-3 | I14: 518 | J14: =I14/B14 -> 6.3641836521568197E-3 | K14: 41 | L14: =K14/B14 -> 5.0372882188886019E-4 | M14: 591 | N14: =M14/B14 -> 7.261066676495522E-3 | O14: 175 | P14: =O14/B14 -> 2.1500620446475742E-3 | Q14: 1435 | R14: =Q14/B14 -> 1.7630508766110109E-2
A15: 13 | B15: 76926 | C15: 54381 | D15: =C15/B15 -> 0.70692613680680139 | E15: 9613 | F15: =E15/B15 -> 0.12496425135844838 | G15: 729 | H15: =G15/B15 -> 9.4766398876842683E-3 | I15: 4201 | J15: =I15/B15 -> 5.4610924784858177E-2 | K15: 116 | L15: =K15/B15 -> 1.5079426981774694E-3 | M15: 7279 | N15: =M15/B15 -> 9.4623404310636192E-2 | O15: 607 | P15: =O15/B15 -> 7.8907001533941711E-3 | Q15: 15856 | R15: =Q15/B15 -> 0.20612016743363754
A16: 14 | B16: 80546 | C16: 49813 | D16: =C16/B16 -> 0.61844163583542322 | E16: 28341 | F16: =E16/B16 -> 0.35186104834504506 | G16: 348 | H16: =G16/B16 -> 4.3205125021726718E-3 | I16: 619 | J16: =I16/B16 -> 7.6850495369105857E-3 | K16: 32 | L16: =K16/B16 -> 3.9728850594691233E-4 | M16: 1145 | N16: =M16/B16 -> 1.4215479353412957E-2 | O16: 248 | P16: =O16/B16 -> 3.0789859210885707E-3 | Q16: 2138 | R16: =Q16/B16 -> 2.6543838303578079E-2
A17: 15 | B17: 80771 | C17: 74355 | D17: =C17/B17 -> 0.92056554951653435 | E17: 3616 | F17: =E17/B17 -> 4.4768543165244951E-2 | G17: 579 | H17: =G17/B17 -> 7.1684144061606274E-3 | I17: 813 | J17: =I17/B17 -> 1.0065493803469067E-2 | K17: 48 | L17: =K17/B17 -> 5.9427269688378252E-4 | M17: 1112 | N17: =M17/B17 -> 1.376731747780763E-2 | O17: 248 | P17: =O17/B17 -> 3.0704089338995434E-3 | Q17: 2863 | R17: =Q17/B17 -> 3.5445890232880611E-2
A18: 16 | B18: 78882 | C18: 67284 | D18: =C18/B18 -> 0.85297025937476234 | E18: 9394 | F18: =E18/B18 -> 0.11908927258436652 | G18: 478 | H18: =G18/B18 -> 6.0596840850891207E-3 | I18: 947 | J18: =I18/B18 -> 1.2005273699956898E-2 | K18: 36 | L18: =K18/B18 -> 4.5637788088537311E-4 | M18: 541 | N18: =M18/B18 -> 6.8583453766385234E-3 | O18: 202 | P18: =O18/B18 -> 2.56078699830126E-3 | Q18: 1362 | R18: =Q18/B18 -> 1.7266296493496616E-2
A19: 17 | B19: 81898 | C19: 73013 | D19: =C19/B19 -> 0.89151139221959019 | E19: 5618 | F19: =E19/B19 -> 6.8597523749053702E-2 | G19: 465 | H19: =G19/B19 -> 5.6777943295318566E-3 | I19: 1545 | J19: =I19/B19 -> 1.8864929546509073E-2 | K19: 46 | L19: =K19/B19 -> 5.616742777601407E-4 | M19: 1010 | N19: =M19/B19 -> 1.2332413489950915E-2 | O19: 201 | P19: =O19/B19 -> 2.4542723876040929E-3 | Q19: 2333 | R19: =Q19/B19 -> 2.8486654130748003E-2
A20: 18 | B20: 79430 | C20: 69451 | D20: =C20/B20 -> 0.87436736749339039 | E20: 5650 | F20: =E20/B20 -> 7.1131814176004032E-2 | G20: 487 | H20: =G20/B20 -> 6.1311846909228255E-3 | I20: 1628 | J20: =I20/B20 -> 2.0496034243988416E-2 | K20: 83 | L20: =K20/B20 -> 1.0449452347979352E-3 | M20: 1847 | N20: =M20/B20 -> 2.3253178899660078E-2 | O20: 284 | P20: =O20/B20 -> 3.5754752612363089E-3 | Q20: 4771 | R20: =Q20/B20 -> 6.0065466448445175E-2
A21: 19 | B21: 81180 | C21: 75014 | D21: =C21/B21 -> 0.92404533136240452 | E21: 3984 | F21: =E21/B21 -> 4.9076127124907616E-2 | G21: 662 | H21: =G21/B21 -> 8.1547179108154722E-3 | I21: 953 | J21: =I21/B21 -> 1.1739344666173934E-2 | K21: 44 | L21: =K21/B21 -> 5.4200542005420054E-4 | M21: 388 | N21: =M21/B21 -> 4.7795023404779502E-3 | O21: 135 | P21: =O21/B21 -> 1.6629711751662971E-3 | Q21: 1318 | R21: =Q21/B21 -> 1.6235525991623551E-2
A22: 20 | B22: 78943 | C22: 65944 | D22: =C22/B22 -> 0.8353368886411715 | E22: 4181 | F22: =E22/B22 -> 5.2962263911936459E-2 | G22: 436 | H22: =G22/B22 -> 5.5229722711323363E-3 | I22: 2492 | J22: =I22/B22 -> 3.1567080045095827E-2 | K22: 79 | L22: =K22/B22 -> 1.0007220399528775E-3 | M22: 5479 | N22: =M22/B22 -> 6.9404507049390066E-2 | O22: 332 | P22: =O22/B22 -> 4.2055660413209527E-3 | Q22: 9641 | R22: =Q22/B22 -> 0.12212609097703406
A23: 21 | B23: 83279 | C23: 49856 | D23: =C23/B23 -> 0.5986623278377502 | E23: 19308 | F23: =E23/B23 -> 0.23184716435115696 | G23: 512 | H23: =G23/B23 -> 6.1480085015430059E-3 | I23: 10625 | J23: =I23/B23 -> 0.12758318423612194 | K23: 163 | L23: =K23/B23 -> 1.957276144045918E-3 | M23: 1767 | N23: =M23/B23 -> 2.1217834027786115E-2 | O23: 1048 | P23: =O23/B23 -> 1.2584204901595841E-2 | Q23: 5277 | R23: =Q23/B23 -> 6.3365314184848517E-2
A24: 22 | B24: 79274 | C24: 53823 | D24: =C24/B24 -> 0.67894896182859454 | E24: 23470 | F24: =E24/B24 -> 0.29606176047632266 | G24: 482 | H24: =G24/B24 -> 6.0801776118273327E-3 | I24: 398 | J24: =I24/B24 -> 5.0205615964881295E-3 | K24: 31 | L24: =K24/B24 -> 3.9104876756565835E-4 | M24: 839 | N24: =M24/B24 -> 1.0583545677018948E-2 | O24: 231 | P24: =O24/B24 -> 2.9139440421828088E-3 | Q24: 1696 | R24: =Q24/B24 -> 2.1394151928753439E-2
A25: 23 | B25: 80010 | C25: 52347 | D25: =C25/B25 -> 0.65425571803524563 | E25: 23502 | F25: =E25/B25 -> 0.29373828271466068 | G25: 451 | H25: =G25/B25 -> 5.6367954005749283E-3 | I25: 2082 | J25: =I25/B25 -> 2.6021747281589801E-2 | K25: 52 | L25: =K25/B25 -> 6.4991876015498061E-4 | M25: 1125 | N25: =M25/B25 -> 1.40607424071991E-2 | O25: 451 | P25: =O25/B25 -> 5.6367954005749283E-3 | Q25: 2371 | R25: =Q25/B25 -> 2.9633795775528059E-2
A26: 24 | B26: 78906 | C26: 63330 | D26: =C26/B26 -> 0.80260056269485214 | E26: 11928 | F26: =E26/B26 -> 0.1511672116188883 | G26: 707 | H26: =G26/B26 -> 8.9600283882087552E-3 | I26: 1193 | J26: =I26/B26 -> 1.5119255823384787E-2 | K26: 51 | L26: =K26/B26 -> 6.4633868146908981E-4 | M26: 1429 | N26: =M26/B26 -> 1.8110156388614299E-2 | O26: 268 | P26: =O26/B26 -> 3.3964464045826682E-3 | Q26: 2959 | R26: =Q26/B26 -> 3.7500316832686995E-2
A27: 25 | B27: 80030 | C27: 72725 | D27: =C27/B27 -> 0.9087217293514932 | E27: 4649 | F27: =E27/B27 -> 5.8090715981506932E-2 | G27: 482 | H27: =G27/B27 -> 6.0227414719480196E-3 | I27: 621 | J27: =I27/B27 -> 7.7595901536923655E-3 | K27: 35 | L27: =K27/B27 -> 4.3733599900037484E-4 | M27: 1341 | N27: =M27/B27 -> 1.6756216418842933E-2 | O27: 177 | P27: =O27/B27 -> 2.2116706235161816E-3 | Q27: 2843 | R27: =Q27/B27 -> 3.552417843308759E-2
A28: 26 | B28: 79121 | C28: 74126 | D28: =C28/B28 -> 0.93686884645037349 | E28: 1714 | F28: =E28/B28 -> 2.1663022459271243E-2 | G28: 529 | H28: =G28/B28 -> 6.6859620075580438E-3 | I28: 453 | J28: =I28/B28 -> 5.7254079195156789E-3 | K28: 22 | L28: =K28/B28 -> 2.780551307491058E-4 | M28: 2145 | N28: =M28/B28 -> 2.7110375248037815E-2 | O28: 132 | P28: =O28/B28 -> 1.6683307844946348E-3 | Q28: 4251 | R28: =Q28/B28 -> 5.3727834582474945E-2
A29: 27 | B29: 80160 | C29: 49989 | D29: =C29/B29 -> 0.62361526946107781 | E29: 22084 | F29: =E29/B29 -> 0.27549900199600796 | G29: 631 | H29: =G29/B29 -> 7.8717564870259479E-3 | I29: 2859 | J29: =I29/B29 -> 3.5666167664670657E-2 | K29: 81 | L29: =K29/B29 -> 1.0104790419161677E-3 | M29: 3825 | N29: =M29/B29 -> 4.7717065868263471E-2 | O29: 691 | P29: =O29/B29 -> 8.6202594810379247E-3 | Q29: 6572 | R29: =Q29/B29 -> 8.1986027944111778E-2
A30: 28 | B30: 81471 | C30: 58676 | D30: =C30/B30 -> 0.72020719028856894 | E30: 14882 | F30: =E30/B30 -> 0.18266622479164366 | G30: 685 | H30: =G30/B30 -> 8.4078997434669997E-3 | I30: 2789 | J30: =I30/B30 -> 3.4233039977415274E-2 | K30: 93 | L30: =K30/B30 -> 1.1415104761203373E-3 | M30: 3640 | N30: =M30/B30 -> 4.4678474549226105E-2 | O30: 706 | P30: =O30/B30 -> 8.6656601735586904E-3 | Q30: 7202 | R30: =Q30/B30 -> 8.8399553215254514E-2
A31: 29 | B31: 80348 | C31: 68105 | D31: =C31/B31 -> 0.84762532981530347 | E31: 5739 | F31: =E31/B31 -> 7.1426793448499032E-2 | G31: 530 | H31: =G31/B31 -> 6.5963060686015833E-3 | I31: 1612 | J31: =I31/B31 -> 2.0062727136954249E-2 | K31: 42 | L31: =K31/B31 -> 5.2272614128540844E-4 | M31: 4030 | N31: =M31/B31 -> 5.0156817842385626E-2 | O31: 290 | P31: =O31/B31 -> 3.6092995469706774E-3 | Q31: 7328 | R31: =Q31/B31 -> 9.1203265793796978E-2
A32: 30 | B32: 80650 | C32: 64381 | D32: =C32/B32 -> 0.79827650340979539 | E32: 10475 | F32: =E32/B32 -> 0.12988220706757594 | G32: 662 | H32: =G32/B32 -> 8.2083075015499073E-3 | I32: 1414 | J32: =I32/B32 -> 1.7532548047117173E-2 | K32: 67 | L32: =K32/B32 -> 8.3075015499070061E-4 | M32: 3300 | N32: =M32/B32 -> 4.091754494730316E-2 | O32: 351 | P32: =O32/B32 -> 4.3521388716677E-3 | Q32: 6195 | R32: =Q32/B32 -> 7.6813391196528205E-2
A33: 31 | B33: 77794 | C33: 38754 | D33: =C33/B33 -> 0.49816181196493303 | E33: 25271 | F33: =E33/B33 -> 0.32484510373550657 | G33: 688 | H33: =G33/B33 -> 8.8438697071753607E-3 | I33: 5817 | J33: =I33/B33 -> 7.4774404195696323E-2 | K33: 192 | L33: =K33/B33 -> 2.4680566624675424E-3 | M33: 5764 | N33: =M33/B33 -> 7.409311772116102E-2 | O33: 1308 | P33: =O33/B33 -> 1.6813636013060133E-2 | Q33: 13060 | R33: =Q33/B33 -> 0.16787927089492763
A34: 32 | B34: 78459 | C34: 53812 | D34: =C34/B34 -> 0.68586140531997608 | E34: 6938 | F34: =E34/B34 -> 8.8428351113320328E-2 | G34: 362 | H34: =G34/B34 -> 4.6138747626148693E-3 | I34: 13485 | J34: =I34/B34 -> 0.17187320766260084 | K34: 78 | L34: =K34/B34 -> 9.9414981072917059E-4 | M34: 3114 | N34: =M34/B34 -> 3.9689519366803046E-2 | O34: 670 | P34: =O34/B34 -> 8.5394919639556963E-3 | Q34: 8488 | R34: =Q34/B34 -> 0.10818389222396411
A35: 33 | B35: 79718 | C35: 62192 | D35: =C35/B35 -> 0.78015002885170226 | E35: 6351 | F35: =E35/B35 -> 7.9668330866303719E-2 | G35: 502 | H35: =G35/B35 -> 6.2971976216161969E-3 | I35: 5964 | J35: =I35/B35 -> 7.4813718357209166E-2 | K35: 57 | L35: =K35/B35 -> 7.1502044707594269E-4 | M35: 4088 | N35: =M35/B35 -> 5.1280764695551817E-2 | O35: 564 | P35: =O35/B35 -> 7.0749391605409067E-3 | Q35: 9440 | R35: =Q35/B35 -> 0.11841742141047192
A36: 34 | B36: 80795 | C36: 59027 | D36: =C36/B36 -> 0.73057738721455534 | E36: 3801 | F36: =E36/B36 -> 4.7044990407822264E-2 | G36: 324 | H36: =G36/B36 -> 4.0101491428925053E-3 | I36: 13803 | J36: =I36/B36 -> 0.17083977968933722 | K36: 93 | L36: =K36/B36 -> 1.1510613280524785E-3 | M36: 3173 | N36: =M36/B36 -> 3.9272232192586173E-2 | O36: 574 | P36: =O36/B36 -> 7.1044000247540073E-3 | Q36: 7470 | R36: =Q36/B36 -> 9.2456216350021658E-2
A37: 35 | B37: 80422 | C37: 59453 | D37: =C37/B37 -> 0.73926288826440523 | E37: 2920 | F37: =E37/B37 -> 3.6308472805948622E-2 | G37: 344 | H37: =G37/B37 -> 4.2774365223446319E-3 | I37: 14711 | J37: =I37/B37 -> 0.18292258337270895 | K37: 61 | L37: =K37/B37 -> 7.5849891820646087E-4 | M37: 2487 | N37: =M37/B37 -> 3.0924373927532268E-2 | O37: 446 | P37: =O37/B37 -> 5.5457461888537962E-3 | Q37: 6766 | R37: =Q37/B37 -> 8.4131207878441222E-2
A38: 36 | B38: 76153 | C38: 54596 | D38: =C38/B38 -> 0.71692513755203335 | E38: 6693 | F38: =E38/B38 -> 8.788885533071579E-2 | G38: 428 | H38: =G38/B38 -> 5.6202644675849931E-3 | I38: 10447 | J38: =I38/B38 -> 0.13718435255341221 | K38: 55 | L38: =K38/B38 -> 7.2223024700274446E-4 | M38: 3404 | N38: =M38/B38 -> 4.4699486559951679E-2 | O38: 530 | P38: =O38/B38 -> 6.9596732892991744E-3 | Q38: 8309 | R38: =Q38/B38 -> 0.10910929313356008
A39: 37 | B39: 80046 | C39: 52096 | D39: =C39/B39 -> 0.65082577517927187 | E39: 5880 | F39: =E39/B39 -> 7.3457761786972497E-2 | G39: 517 | H39: =G39/B39 -> 6.4587861979361868E-3 | I39: 17211 | J39: =I39/B39 -> 0.21501386702645978 | K39: 89 | L39: =K39/B39 -> 1.1118606801089374E-3 | M39: 3664 | N39: =M39/B39 -> 4.5773680133922995E-2 | O39: 589 | P39: =O39/B39 -> 7.3582689953276869E-3 | Q39: 9830 | R39: =Q39/B39 -> 0.12280438747720061
A40: 38 | B40: 82832 | C40: 45718 | D40: =C40/B40 -> 0.55193644968128264 | E40: 8604 | F40: =E40/B40 -> 0.10387289936256519 | G40: 702 | H40: =G40/B40 -> 8.4749855128452775E-3 | I40: 15508 | J40: =I40/B40 -> 0.18722232953447943 | K40: 85 | L40: =K40/B40 -> 1.0261734595325479E-3 | M40: 11463 | N40: =M40/B40 -> 0.13838854548966584 | O40: 752 | P40: =O40/B40 -> 9.0786169596291291E-3 | Q40: 23492 | R40: =Q40/B40 -> 0.28361019895692485
A41: 39 | B41: 78182 | C41: 42855 | D41: =C41/B41 -> 0.54814407408354859 | E41: 5640 | F41: =E41/B41 -> 7.2139367117750888E-2 | G41: 602 | H41: =G41/B41 -> 7.6999820930648997E-3 | I41: 19256 | J41: =I41/B41 -> 0.24629710163464735 | K41: 98 | L41: =K41/B41 -> 1.2534854570105652E-3 | M41: 9036 | N41: =M41/B41 -> 0.11557647540354557 | O41: 695 | P41: =O41/B41 -> 8.8895142104320687E-3 | Q41: 18721 | R41: =Q41/B41 -> 0.23945409429280398
A42: 40 | B42: 77754 | C42: 44128 | D42: =C42/B42 -> 0.567533503099519 | E42: 6274 | F42: =E42/B42 -> 8.0690382488360732E-2 | G42: 387 | H42: =G42/B42 -> 4.9772358978316224E-3 | I42: 21947 | J42: =I42/B42 -> 0.28226200581320576 | K42: 114 | L42: =K42/B42 -> 1.4661625125395477E-3 | M42: 4182 | N42: =M42/B42 -> 5.3785014275792888E-2 | O42: 722 | P42: =O42/B42 -> 9.285695912750469E-3 | Q42: 9951 | R42: =Q42/B42 -> 0.12798055405509684
A43: 41 | B43: 79261 | C43: 54513 | D43: =C43/B43 -> 0.6877657359861723 | E43: 5476 | F43: =E43/B43 -> 6.9088202268454857E-2 | G43: 449 | H43: =G43/B43 -> 5.6648288565624956E-3 | I43: 14695 | J43: =I43/B43 -> 0.18540013373538058 | K43: 112 | L43: =K43/B43 -> 1.413053077806235E-3 | M43: 3465 | N43: =M43/B43 -> 4.3716329594630399E-2 | O43: 551 | P43: =O43/B43 -> 6.9517164809931743E-3 | Q43: 10281 | R43: =Q43/B43 -> 0.12971070261540985
A44: 42 | B44: 77186 | C44: 45035 | D44: =C44/B44 -> 0.58346073122068765 | E44: 13623 | F44: =E44/B44 -> 0.1764957375689892 | G44: 478 | H44: =G44/B44 -> 6.1928328971575155E-3 | I44: 13295 | J44: =I44/B44 -> 0.17224626227554218 | K44: 170 | L44: =K44/B44 -> 2.2024719508719199E-3 | M44: 3704 | N44: =M44/B44 -> 4.7987977094291707E-2 | O44: 881 | P44: =O44/B44 -> 1.1413986992459773E-2 | Q44: 9612 | R44: =Q44/B44 -> 0.12453035524576996
A45: 43 | B45: 79027 | C45: 48944 | D45: =C45/B45 -> 0.61933263315069531 | E45: 12167 | F45: =E45/B45 -> 0.15396003897402152 | G45: 562 | H45: =G45/B45 -> 7.111493540182469E-3 | I45: 11312 | J45: =I45/B45 -> 0.14314095182659092 | K45: 93 | L45: =K45/B45 -> 1.1768129879661381E-3 | M45: 5262 | N45: =M45/B45 -> 6.6584838093309881E-2 | O45: 687 | P45: =O45/B45 -> 8.6932314272337302E-3 | Q45: 12476 | R45: =Q45/B45 -> 0.15787009503081226
A46: 44 | B46: 82505 | C46: 47061 | D46: =C46/B46 -> 0.57040179383067691 | E46: 17844 | F46: =E46/B46 -> 0.216277801345373 | G46: 625 | H46: =G46/B46 -> 7.5752984667595905E-3 | I46: 6058 | J46: =I46/B46 -> 7.3425852978607362E-2 | K46: 115 | L46: =K46/B46 -> 1.3938549178837646E-3 | M46: 9942 | N46: =M46/B46 -> 0.12050178777043816 | O46: 860 | P46: =O46/B46 -> 1.0423610690261197E-2 | Q46: 19335 | R46: =Q46/B46 -> 0.23434943336767469
A47: 45 | B47: 80313 | C47: 59662 | D47: =C47/B47 -> 0.74286852688854854 | E47: 10645 | F47: =E47/B47 -> 0.13254392190554456 | G47: 526 | H47: =G47/B47 -> 6.5493755680898482E-3 | I47: 4479 | J47: =I47/B47 -> 5.576930260356356E-2 | K47: 98 | L47: =K47/B47 -> 1.2202258662981087E-3 | M47: 4353 | N47: =M47/B47 -> 5.4200440775465993E-2 | O47: 550 | P47: =O47/B47 -> 6.8482063924893855E-3 | Q47: 9420 | R47: =Q47/B47 -> 0.1172910985768182
A48: 46 | B48: 77836 | C48: 38291 | D48: =C48/B48 -> 0.49194460146975694 | E48: 23088 | F48: =E48/B48 -> 0.29662367028110387 | G48: 474 | H48: =G48/B48 -> 6.089727118556966E-3 | I48: 7690 | J48: =I48/B48 -> 9.8797471606968501E-2 | K48: 113 | L48: =K48/B48 -> 1.4517703890230742E-3 | M48: 7225 | N48: =M48/B48 -> 9.2823372218510711E-2 | O48: 955 | P48: =O48/B48 -> 1.2269386916079964E-2 | Q48: 15022 | R48: =Q48/B48 -> 0.19299552906110284
A49: 47 | B49: 79371 | C49: 58861 | D49: =C49/B49 -> 0.74159327714152523 | E49: 4789 | F49: =E49/B49 -> 6.0336898867344495E-2 | G49: 730 | H49: =G49/B49 -> 9.1973138803845226E-3 | I49: 8871 | J49: =I49/B49 -> 0.11176626223683714 | K49: 98 | L49: =K49/B49 -> 1.234707890791347E-3 | M49: 5399 | N49: =M49/B49 -> 6.8022325534515121E-2 | O49: 623 | P49: =O49/B49 -> 7.8492144486021348E-3 | Q49: 11933 | R49: =Q49/B49 -> 0.15034458429401168
A50: 48 | B50: 76919 | C50: 63398 | D50: =C50/B50 -> 0.82421768353722746 | E50: 3200 | F50: =E50/B50 -> 4.1602204916860591E-2 | G50: 341 | H50: =G50/B50 -> 4.4332349614529566E-3 | I50: 8214 | J50: =I50/B50 -> 0.10678765974596653 | K50: 67 | L50: =K50/B50 -> 8.7104616544676869E-4 | M50: 1378 | N50: =M50/B50 -> 1.7914949492323091E-2 | O50: 321 | P50: =O50/B50 -> 4.1732211807225779E-3 | Q50: 5323 | R50: =Q50/B50 -> 6.9202667741390292E-2
A51: 49 | B51: 80140 | C51: 44766 | D51: =C51/B51 -> 0.55859745445470432 | E51: 13078 | F51: =E51/B51 -> 0.16318941851759422 | G51: 901 | H51: =G51/B51 -> 1.1242825056151734E-2 | I51: 9217 | J51: =I51/B51 -> 0.11501123034689294 | K51: 129 | L51: =K51/B51 -> 1.6096830546543548E-3 | M51: 11074 | N51: =M51/B51 -> 0.13818317943598701 | O51: 975 | P51: =O51/B51 -> 1.2166209134015473E-2 | Q51: 22948 | R51: =Q51/B51 -> 0.28634888944347392
A52: 50 | B52: 77884 | C52: 50205 | D52: =C52/B52 -> 0.64461250064198039 | E52: 8521 | F52: =E52/B52 -> 0.10940629654357763 | G52: 643 | H52: =G52/B52 -> 8.2558677006830672E-3 | I52: 7584 | J52: =I52/B52 -> 9.7375584202146787E-2 | K52: 115 | L52: =K52/B52 -> 1.4765548764829747E-3 | M52: 10147 | N52: =M52/B52 -> 0.13028349853628474 | O52: 669 | P52: =O52/B52 -> 8.5896974988444348E-3 | Q52: 18891 | R52: =Q52/B52 -> 0.24255302757947717
A53: 51 | B53: 78639 | C53: 44800 | D53: =C53/B53 -> 0.56969188316229857 | E53: 18564 | F53: =E53/B53 -> 0.2360660740853775 | G53: 837 | H53: =G53/B53 -> 1.064357379925991E-2 | I53: 6760 | J53: =I53/B53 -> 8.5962435941453988E-2 | K53: 181 | L53: =K53/B53 -> 2.3016569386691082E-3 | M53: 6415 | N53: =M53/B53 -> 8.1575299787637182E-2 | O53: 1082 | P53: =O53/B53 -> 1.3759076285303729E-2 | Q53: 14963 | R53: =Q53/B53 -> 0.1902745457088722
A54: 52 | B54: 78056 | C54: 35088 | D54: =C54/B54 -> 0.44952341908373478 | E54: 21416 | F54: =E54/B54 -> 0.27436712104130367 | G54: 971 | H54: =G54/B54 -> 1.2439786819719176E-2 | I54: 6756 | J54: =I54/B54 -> 8.6553243824946197E-2 | K54: 128 | L54: =K54/B54 -> 1.6398483140309522E-3 | M54: 12418 | N54: =M54/B54 -> 0.15909090909090909 | O54: 1279 | P54: =O54/B54 -> 1.6385671825356156E-2 | Q54: 23935 | R54: =Q54/B54 -> 0.30663882340883469
A55: 53 | B55: 80000 | C55: 51788 | D55: =C55/B55 -> 0.64734999999999998 | E55: 4058 | F55: =E55/B55 -> 5.0724999999999999E-2 | G55: 483 | H55: =G55/B55 -> 6.0375000000000003E-3 | I55: 18715 | J55: =I55/B55 -> 0.23393749999999999 | K55: 74 | L55: =K55/B55 -> 9.2500000000000004E-4 | M55: 4267 | N55: =M55/B55 -> 5.3337500000000003E-2 | O55: 615 | P55: =O55/B55 -> 7.6874999999999999E-3 | Q55: 10758 | R55: =Q55/B55 -> 0.13447500000000001
A56: 54 | B56: 78503 | C56: 57435 | D56: =C56/B56 -> 0.73162809064621737 | E56: 14289 | F56: =E56/B56 -> 0.18201852158516235 | G56: 581 | H56: =G56/B56 -> 7.4009910449282191E-3 | I56: 2461 | J56: =I56/B56 -> 3.1349120415780286E-2 | K56: 159 | L56: =K56/B56 -> 2.0254003031731273E-3 | M56: 2967 | N56: =M56/B56 -> 3.7794733959211749E-2 | O56: 611 | P56: =O56/B56 -> 7.7831420455269223E-3 | Q56: 6595 | R56: =Q56/B56 -> 8.4009528298281594E-2
A57: 55 | B57: 78812 | C57: 67375 | D57: =C57/B57 -> 0.85488250520225351 | E57: 8187 | F57: =E57/B57 -> 0.10388011977871391 | G57: 554 | H57: =G57/B57 -> 7.0293863878597169E-3 | I57: 1761 | J57: =I57/B57 -> 2.2344313048774298E-2 | K57: 33 | L57: =K57/B57 -> 4.18717961731716E-4 | M57: 678 | N57: =M57/B57 -> 8.6027508501243469E-3 | O57: 224 | P57: =O57/B57 -> 2.8422067705425572E-3 | Q57: 1700 | R57: =Q57/B57 -> 2.1570319240724764E-2
A58: 56 | B58: 79627 | C58: 59475 | D58: =C58/B58 -> 0.7469200145679229 | E58: 18264 | F58: =E58/B58 -> 0.22936943499064388 | G58: 457 | H58: =G58/B58 -> 5.7392592964697906E-3 | I58: 574 | J58: =I58/B58 -> 7.2086101448001309E-3 | K58: 29 | L58: =K58/B58 -> 3.6419807351777665E-4 | M58: 595 | N58: =M58/B58 -> 7.4723397842440375E-3 | O58: 233 | P58: =O58/B58 -> 2.9261431424014469E-3 | Q58: 1482 | R58: =Q58/B58 -> 1.861177741218431E-2
A59: 57 | B59: 79859 | C59: 56992 | D59: =C59/B59 -> 0.71365782191111837 | E59: 13546 | F59: =E59/B59 -> 0.16962396223343643 | G59: 464 | H59: =G59/B59 -> 5.8102405489675549E-3 | I59: 6300 | J59: =I59/B59 -> 7.8889041936412926E-2 | K59: 54 | L59: =K59/B59 -> 6.7619178802639656E-4 | M59: 2054 | N59: =M59/B59 -> 2.5720332085300342E-2 | O59: 449 | P59: =O59/B59 -> 5.6224094967380006E-3 | Q59: 4859 | R59: =Q59/B59 -> 6.0844738852227048E-2
A60: 58 | B60: 81991 | C60: 69447 | D60: =C60/B60 -> 0.84700759839494577 | E60: 8547 | F60: =E60/B60 -> 0.10424314863826517 | G60: 515 | H60: =G60/B60 -> 6.2811772023758702E-3 | I60: 1901 | J60: =I60/B60 -> 2.31854715761486E-2 | K60: 62 | L60: =K60/B60 -> 7.5618055640253197E-4 | M60: 1241 | N60: =M60/B60 -> 1.5135807588637777E-2 | O60: 278 | P60: =O60/B60 -> 3.3906160432242561E-3 | Q60: 2731 | R60: =Q60/B60 -> 3.3308533863472822E-2
A61: 59 | B61: 78769 | C61: 63474 | D61: =C61/B61 -> 0.80582462643933528 | E61: 13020 | F61: =E61/B61 -> 0.16529345300816312 | G61: 555 | H61: =G61/B61 -> 7.0459190798410542E-3 | I61: 570 | J61: =I61/B61 -> 7.2363493252421635E-3 | K61: 58 | L61: =K61/B61 -> 7.3633028221762372E-4 | M61: 813 | N61: =M61/B61 -> 1.0321319300740138E-2 | O61: 279 | P61: =O61/B61 -> 3.5420025644606382E-3 | Q61: 2092 | R61: =Q61/B61 -> 2.6558671558608082E-2
A62: 60 | B62: 80894 | C62: 51296 | D62: =C62/B62 -> 0.6341137785249833 | E62: 28033 | F62: =E62/B62 -> 0.34653991643385168 | G62: 382 | H62: =G62/B62 -> 4.7222290899201422E-3 | I62: 333 | J62: =I62/B62 -> 4.1164981333597049E-3 | K62: 18 | L62: =K62/B62 -> 2.2251341261403813E-4 | M62: 609 | N62: =M62/B62 -> 7.5283704601082895E-3 | O62: 223 | P62: =O62/B62 -> 2.7566939451628058E-3 | Q62: 1364 | R62: =Q62/B62 -> 1.6861571933641555E-2
A63: 61 | B63: 80414 | C63: 37305 | D63: =C63/B63 -> 0.46391175665928819 | E63: 41043 | F63: =E63/B63 -> 0.51039619966672467 | G63: 369 | H63: =G63/B63 -> 4.5887532021787253E-3 | I63: 412 | J63: =I63/B63 -> 5.1234859601561921E-3 | K63: 38 | L63: =K63/B63 -> 4.7255453030566817E-4 | M63: 912 | N63: =M63/B63 -> 1.1341308727336036E-2 | O63: 335 | P63: =O63/B63 -> 4.1659412540104961E-3 | Q63: 1898 | R63: =Q63/B63 -> 2.3602855224214687E-2
A64: 62 | B64: 82068 | C64: 47914 | D64: =C64/B64 -> 0.58383291904274504 | E64: 29059 | F64: =E64/B64 -> 0.35408441779987326 | G64: 1359 | H64: =G64/B64 -> 1.655943851440269E-2 | I64: 1239 | J64: =I64/B64 -> 1.5097236438075742E-2 | K64: 148 | L64: =K64/B64 -> 1.8033825608032364E-3 | M64: 1629 | N64: =M64/B64 -> 1.9849393186138323E-2 | O64: 720 | P64: =O64/B64 -> 8.7732124579616901E-3 | Q64: 4044 | R64: =Q64/B64 -> 4.9276209972218162E-2
A65: 63 | B65: 80025 | C65: 35077 | D65: =C65/B65 -> 0.43832552327397689 | E65: 41543 | F65: =E65/B65 -> 0.51912527335207748 | G65: 394 | H65: =G65/B65 -> 4.9234614183067795E-3 | I65: 1199 | J65: =I65/B65 -> 1.4982817869415807E-2 | K65: 61 | L65: =K65/B65 -> 7.6226179318962821E-4 | M65: 1267 | N65: =M65/B65 -> 1.5832552327397689E-2 | O65: 484 | P65: =O65/B65 -> 6.0481099656357392E-3 | Q65: 2769 | R65: =Q65/B65 -> 3.460168697282099E-2
A66: 64 | B66: 79646 | C66: 64647 | D66: =C66/B66 -> 0.81167918037315123 | E66: 9830 | F66: =E66/B66 -> 0.12342113853803079 | G66: 445 | H66: =G66/B66 -> 5.5872234638274362E-3 | I66: 2931 | J66: =I66/B66 -> 3.6800341511187003E-2 | K66: 91 | L66: =K66/B66 -> 1.1425558094568466E-3 | M66: 1254 | N66: =M66/B66 -> 1.5744670165482259E-2 | O66: 448 | P66: =O66/B66 -> 5.6248901388644751E-3 | Q66: 3565 | R66: =Q66/B66 -> 4.4760565502347888E-2
A67: 65 | B67: 80580 | C67: 64874 | D67: =C67/B67 -> 0.8050881111938446 | E67: 9636 | F67: =E67/B67 -> 0.11958302308265079 | G67: 480 | H67: =G67/B67 -> 5.956813104988831E-3 | I67: 4034 | J67: =I67/B67 -> 5.00620501365103E-2 | K67: 51 | L67: =K67/B67 -> 6.329113924050633E-4 | M67: 1092 | N67: =M67/B67 -> 1.355174981384959E-2 | O67: 413 | P67: =O67/B67 -> 5.125341275750807E-3 | Q67: 3170 | R67: =Q67/B67 -> 3.9339786547530405E-2
A68: 66 | B68: 81155 | C68: 59115 | D68: =C68/B68 -> 0.7284209229252665 | E68: 16654 | F68: =E68/B68 -> 0.20521224816708766 | G68: 612 | H68: =G68/B68 -> 7.5411250077013119E-3 | I68: 2434 | J68: =I68/B68 -> 2.999199063520424E-2 | K68: 77 | L68: =K68/B68 -> 9.4880167580555722E-4 | M68: 1721 | N68: =M68/B68 -> 2.1206333559238493E-2 | O68: 542 | P68: =O68/B68 -> 6.6785780296962603E-3 | Q68: 3943 | R68: =Q68/B68 -> 4.8586039061056005E-2
A69: 67 | B69: 76019 | C69: 47851 | D69: =C69/B69 -> 0.62946105578868439 | E69: 5146 | F69: =E69/B69 -> 6.7693602915060713E-2 | G69: 332 | H69: =G69/B69 -> 4.3673292203264972E-3 | I69: 19020 | J69: =I69/B69 -> 0.25020060774280112 | K69: 124 | L69: =K69/B69 -> 1.6311711545797761E-3 | M69: 3082 | N69: =M69/B69 -> 4.0542495954958631E-2 | O69: 464 | P69: =O69/B69 -> 6.1037372235888399E-3 | Q69: 7892 | R69: =Q69/B69 -> 0.10381615122535155
A70: 68 | B70: 81708 | C70: 66759 | D70: =C70/B70 -> 0.81704361873990305 | E70: 9120 | F70: =E70/B70 -> 0.11161697752974005 | G70: 337 | H70: =G70/B70 -> 4.1244431389827188E-3 | I70: 3497 | J70: =I70/B70 -> 4.2798746756743528E-2 | K70: 44 | L70: =K70/B70 -> 5.3850296176628971E-4 | M70: 1568 | N70: =M70/B70 -> 1.9190287364762325E-2 | O70: 383 | P70: =O70/B70 -> 4.6874235081020219E-3 | Q70: 3887 | R70: =Q70/B70 -> 4.7571841190581096E-2
A71: 69 | B71: 82640 | C71: 25039 | D71: =C71/B71 -> 0.3029888673765731 | E71: 46523 | F71: =E71/B71 -> 0.56295982575024206 | G71: 551 | H71: =G71/B71 -> 6.6674733785091964E-3 | I71: 1606 | J71: =I71/B71 -> 1.9433688286544046E-2 | K71: 119 | L71: =K71/B71 -> 1.4399806389157792E-3 | M71: 7935 | N71: =M71/B71 -> 9.6018877057115204E-2 | O71: 867 | P71: =O71/B71 -> 1.0491287512100678E-2 | Q71: 12232 | R71: =Q71/B71 -> 0.14801548886737656
A72: 70 | B72: 80243 | C72: 26523 | D72: =C72/B72 -> 0.33053350448014157 | E72: 47461 | F72: =E72/B72 -> 0.59146592226113182 | G72: 682 | H72: =G72/B72 -> 8.499183729421881E-3 | I72: 1096 | J72: =I72/B72 -> 1.3658512268982964E-2 | K72: 72 | L72: =K72/B72 -> 8.9727452861931877E-4 | M72: 3670 | N72: =M72/B72 -> 4.5736076667123614E-2 | O72: 739 | P72: =O72/B72 -> 9.2095260645788414E-3 | Q72: 6192 | R72: =Q72/B72 -> 7.7165609461261414E-2
A73: 71 | B73: 80522 | C73: 31187 | D73: =C73/B73 -> 0.38731030029060382 | E73: 43714 | F73: =E73/B73 -> 0.54288269044484738 | G73: 392 | H73: =G73/B73 -> 4.8682347681379004E-3 | I73: 3556 | J73: =I73/B73 -> 4.4161843968108093E-2 | K73: 58 | L73: =K73/B73 -> 7.2030004222448519E-4 | M73: 818 | N73: =M73/B73 -> 1.0158714388614291E-2 | O73: 797 | P73: =O73/B73 -> 9.8979160974640469E-3 | Q73: 2289 | R73: =Q73/B73 -> 2.8427013735376667E-2
A74: 72 | B74: 80105 | C74: 58133 | D74: =C74/B74 -> 0.72571000561762689 | E74: 7361 | F74: =E74/B74 -> 9.1891891891891897E-2 | G74: 298 | H74: =G74/B74 -> 3.7201173459833967E-3 | I74: 12713 | J74: =I74/B74 -> 0.1587042007365333 | K74: 36 | L74: =K74/B74 -> 4.4941014917920227E-4 | M74: 1037 | N74: =M74/B74 -> 1.2945509019412021E-2 | O74: 527 | P74: =O74/B74 -> 6.5788652393733221E-3 | Q74: 2944 | R74: =Q74/B74 -> 3.6751763310654766E-2
A75: 73 | B75: 80270 | C75: 59444 | D75: =C75/B75 -> 0.74055064158465178 | E75: 12338 | F75: =E75/B75 -> 0.15370624143515635 | G75: 451 | H75: =G75/B75 -> 5.6185374361529834E-3 | I75: 4369 | J75: =I75/B75 -> 5.4428802790581786E-2 | K75: 59 | L75: =K75/B75 -> 7.3501930982932599E-4 | M75: 3177 | N75: =M75/B75 -> 3.9578921141148624E-2 | O75: 432 | P75: =O75/B75 -> 5.381836302479133E-3 | Q75: 6168 | R75: =Q75/B75 -> 7.6840662763174292E-2
A76: 74 | B76: 79774 | C76: 33096 | D76: =C76/B76 -> 0.41487201343796226 | E76: 42236 | F76: =E76/B76 -> 0.52944568405746228 | G76: 401 | H76: =G76/B76 -> 5.0267004287111085E-3 | I76: 2046 | J76: =I76/B76 -> 2.5647454057713039E-2 | K76: 47 | L76: =K76/B76 -> 5.8916438940005515E-4 | M76: 1309 | N76: =M76/B76 -> 1.6408855015418559E-2 | O76: 639 | P76: =O76/B76 -> 8.0101286133326642E-3 | Q76: 2723 | R76: =Q76/B76 -> 3.4133928347581916E-2
A77: 75 | B77: 78675 | C77: 51194 | D77: =C77/B77 -> 0.65070225611693677 | E77: 25425 | F77: =E77/B77 -> 0.32316491897044802 | G77: 528 | H77: =G77/B77 -> 6.7111534795042897E-3 | I77: 643 | J77: =I77/B77 -> 8.1728630441690493E-3 | K77: 48 | L77: =K77/B77 -> 6.1010486177311726E-4 | M77: 547 | N77: =M77/B77 -> 6.9526533206228152E-3 | O77: 290 | P77: =O77/B77 -> 3.6860502065459168E-3 | Q77: 1386 | R77: =Q77/B77 -> 1.761677788369876E-2
A78: 76 | B78: 78765 | C78: 34165 | D78: =C78/B78 -> 0.43375864914619439 | E78: 41690 | F78: =E78/B78 -> 0.52929600710975688 | G78: 466 | H78: =G78/B78 -> 5.9163333968133055E-3 | I78: 1099 | J78: =I78/B78 -> 1.3952897860724942E-2 | K78: 46 | L78: =K78/B78 -> 5.8401574303307302E-4 | M78: 722 | N78: =M78/B78 -> 9.1665079667364955E-3 | O78: 577 | P78: =O78/B78 -> 7.3255887767409381E-3 | Q78: 1973 | R78: =Q78/B78 -> 2.5049196978353328E-2
A79: 77 | B79: 79695 | C79: 33087 | D79: =C79/B79 -> 0.41517033690946736 | E79: 43092 | F79: =E79/B79 -> 0.54071146245059287 | G79: 697 | H79: =G79/B79 -> 8.7458435284522244E-3 | I79: 948 | J79: =I79/B79 -> 1.1895351025785808E-2 | K79: 128 | L79: =K79/B79 -> 1.6061233452537801E-3 | M79: 1106 | N79: =M79/B79 -> 1.3877909530083443E-2 | O79: 637 | P79: =O79/B79 -> 7.9929732103645144E-3 | Q79: 2826 | R79: =Q79/B79 -> 3.5460191981931115E-2
A80: 78 | B80: 82800 | C80: 65144 | D80: =C80/B80 -> 0.7867632850241546 | E80: 12368 | F80: =E80/B80 -> 0.14937198067632851 | G80: 576 | H80: =G80/B80 -> 6.956521739130435E-3 | I80: 3425 | J80: =I80/B80 -> 4.1364734299516911E-2 | K80: 145 | L80: =K80/B80 -> 1.7512077294685991E-3 | M80: 674 | N80: =M80/B80 -> 8.1400966183574879E-3 | O80: 468 | P80: =O80/B80 -> 5.6521739130434784E-3 | Q80: 3119 | R80: =Q80/B80 -> 3.7669082125603867E-2
A81: 79 | B81: 82401 | C81: 47936 | D81: =C81/B81 -> 0.58174051285785366 | E81: 29479 | F81: =E81/B81 -> 0.35775051273649594 | G81: 551 | H81: =G81/B81 -> 6.6868120532517809E-3 | I81: 2705 | J81: =I81/B81 -> 3.2827271513695223E-2 | K81: 119 | L81: =K81/B81 -> 1.4441572311015643E-3 | M81: 825 | N81: =M81/B81 -> 1.0012014417300761E-2 | O81: 786 | P81: =O81/B81 -> 9.5387191903010884E-3 | Q81: 2832 | R81: =Q81/B81 -> 3.4368514945206978E-2
A82: 80 | B82: 81771 | C82: 39126 | D82: =C82/B82 -> 0.47848259162783874 | E82: 36061 | F82: =E82/B82 -> 0.4409998654779812 | G82: 672 | H82: =G82/B82 -> 8.2180724217632162E-3 | I82: 3213 | J82: =I82/B82 -> 3.9292658766555383E-2 | K82: 84 | L82: =K82/B82 -> 1.027259052720402E-3 | M82: 1661 | N82: =M82/B82 -> 2.0312824840102238E-2 | O82: 954 | P82: =O82/B82 -> 1.1666727813038853E-2 | Q82: 4541 | R82: =Q82/B82 -> 5.5533135219087454E-2
A83: 81 | B83: 83677 | C83: 64065 | D83: =C83/B83 -> 0.76562257251096477 | E83: 11962 | F83: =E83/B83 -> 0.14295445582418106 | G83: 596 | H83: =G83/B83 -> 7.1226262891834072E-3 | I83: 4874 | J83: =I83/B83 -> 5.8247786129999882E-2 | K83: 179 | L83: =K83/B83 -> 2.139178029805084E-3 | M83: 1324 | N83: =M83/B83 -> 1.5822746991407437E-2 | O83: 677 | P83: =O83/B83 -> 8.0906342244583332E-3 | Q83: 4702 | R83: =Q83/B83 -> 5.6192263106946951E-2
A84: 82 | B84: 79539 | C84: 66088 | D84: =C84/B84 -> 0.83088799205421238 | E84: 8122 | F84: =E84/B84 -> 0.10211342863249476 | G84: 587 | H84: =G84/B84 -> 7.3800274079382439E-3 | I84: 2443 | J84: =I84/B84 -> 3.0714492261657803E-2 | K84: 120 | L84: =K84/B84 -> 1.5086938483008336E-3 | M84: 1619 | N84: =M84/B84 -> 2.0354794503325412E-2 | O84: 560 | P84: =O84/B84 -> 7.0405712920705568E-3 | Q84: 4272 | R84: =Q84/B84 -> 5.3709500999509677E-2
A85: 83 | B85: 80597 | C85: 59507 | D85: =C85/B85 -> 0.73832772931994983 | E85: 13340 | F85: =E85/B85 -> 0.16551484546571213 | G85: 700 | H85: =G85/B85 -> 8.6851867935531096E-3 | I85: 4625 | J85: =I85/B85 -> 5.7384269885975905E-2 | K85: 139 | L85: =K85/B85 -> 1.7246299490055461E-3 | M85: 1600 | N85: =M85/B85 -> 1.9851855528121395E-2 | O85: 686 | P85: =O85/B85 -> 8.5114830576820469E-3 | Q85: 4800 | R85: =Q85/B85 -> 5.9555566584364179E-2
A86: 84 | B86: 78591 | C86: 43666 | D86: =C86/B86 -> 0.55561069333638713 | E86: 22883 | F86: =E86/B86 -> 0.29116565510045678 | G86: 686 | H86: =G86/B86 -> 8.7287348424119806E-3 | I86: 7367 | J86: =I86/B86 -> 9.3738468781412634E-2 | K86: 210 | L86: =K86/B86 -> 2.6720616864526472E-3 | M86: 2567 | N86: =M86/B86 -> 3.266277309106641E-2 | O86: 1212 | P86: =O86/B86 -> 1.5421613161812422E-2 | Q86: 7083 | R86: =Q86/B86 -> 9.0124823453067146E-2
A87: 85 | B87: 76503 | C87: 50153 | D87: =C87/B87 -> 0.6555690626511379 | E87: 10529 | F87: =E87/B87 -> 0.13762858972850739 | G87: 520 | H87: =G87/B87 -> 6.7971190672261221E-3 | I87: 9482 | J87: =I87/B87 -> 0.12394285191430401 | K87: 112 | L87: =K87/B87 -> 1.4639948760179339E-3 | M87: 4851 | N87: =M87/B87 -> 6.3409278067526761E-2 | O87: 856 | P87: =O87/B87 -> 1.1189103695279925E-2 | Q87: 11483 | R87: =Q87/B87 -> 0.15009868894030298
A88: 86 | B88: 81872 | C88: 39910 | D88: =C88/B88 -> 0.48746824311119796 | E88: 8478 | F88: =E88/B88 -> 0.10355188587062732 | G88: 575 | H88: =G88/B88 -> 7.0231581004494819E-3 | I88: 20416 | J88: =I88/B88 -> 0.24936486222395934 | K88: 74 | L88: =K88/B88 -> 9.0384991205784643E-4 | M88: 11481 | N88: =M88/B88 -> 0.14023109243697479 | O88: 938 | P88: =O88/B88 -> 1.1456908344733242E-2 | Q88: 21202 | R88: =Q88/B88 -> 0.25896521399257377
A89: 87 | B89: 80537 | C89: 48816 | D89: =C89/B89 -> 0.60613134335771135 | E89: 23002 | F89: =E89/B89 -> 0.28560785725815463 | G89: 968 | H89: =G89/B89 -> 1.2019320312402994E-2 | I89: 3230 | J89: =I89/B89 -> 4.0105789885394288E-2 | K89: 252 | L89: =K89/B89 -> 3.128996610253672E-3 | M89: 2660 | N89: =M89/B89 -> 3.3028297552677652E-2 | O89: 1609 | P89: =O89/B89 -> 1.9978395023405392E-2 | Q89: 7715 | R89: =Q89/B89 -> 9.5794479555980486E-2
A90: 88 | B90: 82223 | C90: 57699 | D90: =C90/B90 -> 0.70173795653284365 | E90: 16163 | F90: =E90/B90 -> 0.19657516753219903 | G90: 681 | H90: =G90/B90 -> 8.2823540858397281E-3 | I90: 3215 | J90: =I90/B90 -> 3.9100981477202243E-2 | K90: 171 | L90: =K90/B90 -> 2.0797100567967602E-3 | M90: 3365 | N90: =M90/B90 -> 4.0925288544567819E-2 | O90: 929 | P90: =O90/B90 -> 1.129854177055082E-2 | Q90: 8683 | R90: =Q90/B90 -> 0.10560305510623548
A91: 89 | B91: 83881 | C91: 31353 | D91: =C91/B91 -> 0.37377952098806644 | E91: 44313 | F91: =E91/B91 -> 0.52828411678449227 | G91: 665 | H91: =G91/B91 -> 7.9278978552950012E-3 | I91: 3909 | J91: =I91/B91 -> 4.6601733408042342E-2 | K91: 162 | L91: =K91/B91 -> 1.9313074474553236E-3 | M91: 2228 | N91: =M91/B91 -> 2.6561438227965809E-2 | O91: 1251 | P91: =O91/B91 -> 1.4913985288682777E-2 | Q91: 5714 | R91: =Q91/B91 -> 6.8120313300985919E-2
A92: 90 | B92: 79508 | C92: 32944 | D92: =C92/B92 -> 0.41434824168637119 | E92: 42208 | F92: =E92/B92 -> 0.53086481863460278 | G92: 390 | H92: =G92/B92 -> 4.9051667756703724E-3 | I92: 2285 | J92: =I92/B92 -> 2.8739246365145646E-2 | K92: 97 | L92: =K92/B92 -> 1.2200030185641696E-3 | M92: 850 | N92: =M92/B92 -> 1.0690748100820043E-2 | O92: 734 | P92: =O92/B92 -> 9.231775418825779E-3 | Q92: 2651 | R92: =Q92/B92 -> 3.3342556723851689E-2
A93: 91 | B93: 77182 | C93: 48646 | D93: =C93/B93 -> 0.63027648933689207 | E93: 21031 | F93: =E93/B93 -> 0.27248581275426914 | G93: 594 | H93: =G93/B93 -> 7.696094944417092E-3 | I93: 3929 | J93: =I93/B93 -> 5.090565157679252E-2 | K93: 145 | L93: =K93/B93 -> 1.8786763753206707E-3 | M93: 1919 | N93: =M93/B93 -> 2.4863310098209426E-2 | O93: 918 | P93: =O93/B93 -> 1.1893964914099142E-2 | Q93: 4570 | R93: =Q93/B93 -> 5.9210696794589415E-2
A94: 92 | B94: 80255 | C94: 33549 | D94: =C94/B94 -> 0.41803002928166472 | E94: 41825 | F94: =E94/B94 -> 0.5211513301351941 | G94: 679 | H94: =G94/B94 -> 8.4605320540776276E-3 | I94: 1731 | J94: =I94/B94 -> 2.156874961061616E-2 | K94: 93 | L94: =K94/B94 -> 1.1588063049031213E-3 | M94: 1154 | N94: =M94/B94 -> 1.437916640707744E-2 | O94: 1224 | P94: =O94/B94 -> 1.5251386206466887E-2 | Q94: 3497 | R94: =Q94/B94 -> 4.3573609120927045E-2
A95: 93 | B95: 79654 | C95: 50690 | D95: =C95/B95 -> 0.63637733196073021 | E95: 6257 | F95: =E95/B95 -> 7.8552238431215005E-2 | G95: 457 | H95: =G95/B95 -> 5.7373138825419943E-3 | I95: 19783 | J95: =I95/B95 -> 0.24836166419765485 | K95: 76 | L95: =K95/B95 -> 9.5412659753433605E-4 | M95: 1731 | N95: =M95/B95 -> 2.1731488688578101E-2 | O95: 660 | P95: =O95/B95 -> 8.2858362417455502E-3 | Q95: 5610 | R95: =Q95/B95 -> 7.0429608054837167E-2
A96: 94 | B96: 78555 | C96: 45351 | D96: =C96/B96 -> 0.57731525682642737 | E96: 25750 | F96: =E96/B96 -> 0.32779581185156897 | G96: 664 | H96: =G96/B96 -> 8.4526764687161866E-3 | I96: 3134 | J96: =I96/B96 -> 3.9895614537585132E-2 | K96: 183 | L96: =K96/B96 -> 2.3295780026732862E-3 | M96: 2242 | N96: =M96/B96 -> 2.8540513016357967E-2 | O96: 1231 | P96: =O96/B96 -> 1.5670549296671121E-2 | Q96: 6362 | R96: =Q96/B96 -> 8.0987842912609007E-2
A97: 95 | B97: 80613 | C97: 28940 | D97: =C97/B97 -> 0.35899916886854477 | E97: 47210 | F97: =E97/B97 -> 0.58563755225583958 | G97: 564 | H97: =G97/B97 -> 6.9963901603959655E-3 | I97: 1523 | J97: =I97/B97 -> 1.8892734422487689E-2 | K97: 102 | L97: =K97/B97 -> 1.2653046034758661E-3 | M97: 1062 | N97: =M97/B97 -> 1.3174053812660489E-2 | O97: 1212 | P97: =O97/B97 -> 1.5034795876595586E-2 | Q97: 3086 | R97: =Q97/B97 -> 3.8281666728691405E-2
A98: 96 | B98: 80595 | C98: 51814 | D98: =C98/B98 -> 0.64289347974440103 | E98: 20807 | F98: =E98/B98 -> 0.25816738011042867 | G98: 625 | H98: =G98/B98 -> 7.7548235002171352E-3 | I98: 3791 | J98: =I98/B98 -> 4.7037657422917052E-2 | K98: 203 | L98: =K98/B98 -> 2.5187666728705253E-3 | M98: 2388 | N98: =M98/B98 -> 2.9629629629629631E-2 | O98: 967 | P98: =O98/B98 -> 1.1998262919535952E-2 | Q98: 5829 | R98: =Q98/B98 -> 7.2324585892425089E-2
A99: 97 | B99: 79905 | C99: 61424 | D99: =C99/B99 -> 0.76871284650522498 | E99: 14976 | F99: =E99/B99 -> 0.18742256429510043 | G99: 1001 | H99: =G99/B99 -> 1.2527376259307927E-2 | I99: 1093 | J99: =I99/B99 -> 1.3678743507915651E-2 | K99: 70 | L99: =K99/B99 -> 8.7604029785370125E-4 | M99: 861 | N99: =M99/B99 -> 1.0775295663600526E-2 | O99: 480 | P99: =O99/B99 -> 6.0071334709968088E-3 | Q99: 2314 | R99: =Q99/B99 -> 2.8959389274763783E-2
A100: 98 | B100: 79629 | C100: 63127 | D100: =C100/B100 -> 0.79276394278466389 | E100: 13933 | F100: =E100/B100 -> 0.17497394165442237 | G100: 862 | H100: =G100/B100 -> 1.0825201873689233E-2 | I100: 686 | J100: =I100/B100 -> 8.614951839154077E-3 | K100: 46 | L100: =K100/B100 -> 5.7767898629896143E-4 | M100: 653 | N100: =M100/B100 -> 8.2005299576787347E-3 | O100: 322 | P100: =O100/B100 -> 4.0437529040927298E-3 | Q100: 1832 | R100: =Q100/B100 -> 2.3006693541297769E-2
A101: 99 | B101: 81014 | C101: 58088 | D101: =C101/B101 -> 0.7170118744908287 | E101: 19675 | F101: =E101/B101 -> 0.24285925889352458 | G101: 688 | H101: =G101/B101 -> 8.4923593452983434E-3 | I101: 853 | J101: =I101/B101 -> 1.0529044362702742E-2 | K101: 45 | L101: =K101/B101 -> 5.5545955020119982E-4 | M101: 1322 | N101: =M101/B101 -> 1.6318167230355247E-2 | O101: 343 | P101: =O101/B101 -> 4.2338361270891451E-3 | Q101: 3044 | R101: =Q101/B101 -> 3.7573752684721157E-2
A102: 100 | B102: 78050 | C102: 50343 | D102: =C102/B102 -> 0.64500960922485584 | E102: 21361 | F102: =E102/B102 -> 0.27368353619474695 | G102: 774 | H102: =G102/B102 -> 9.9167200512491997E-3 | I102: 1961 | J102: =I102/B102 -> 2.51249199231262E-2 | K102: 164 | L102: =K102/B102 -> 2.1012171684817423E-3 | M102: 2939 | N102: =M102/B102 -> 3.7655349135169762E-2 | O102: 508 | P102: =O102/B102 -> 6.5086483023702752E-3 | Q102: 6511 | R102: =Q102/B102 -> 8.3420884048686736E-2

A1: HB 5002 University of Richmond House Plan Voting Age
A2: DISTRICT | B2: Voting Age Population | C2: VAP White | D2: % VAP White | E2: VAP Black | F2: % VAP Black | G2: VAP AIAN | H2: % VAP AIAN | I2: VAP Asian | J2: % VAP Asian | K2: VAP HawPI | L2: % VAP HawPI | M2: VAP Other | N2: % VAP Other | O2: VAP Multi | P2: % VAP Multi | Q2: Voting Age Hispanic | R2: % VAP Hispanic
A3: 1 | B3: 64605 | C3: 60647 | D3: =C3/B3 -> 0.93873539199752343 | E3: 2915 | F3: =E3/B3 -> 4.512034672238991E-2 | G3: 385 | H3: =G3/B3 -> 5.9592910765420637E-3 | I3: 232 | J3: =I3/B3 -> 3.5910533240461266E-3 | K3: 23 | L3: =K3/B3 -> 3.5600959678043492E-4 | M3: 327 | N3: =M3/B3 -> 5.061527745530532E-3 | O3: 76 | P3: =O3/B3 -> 1.1763795371875242E-3 | Q3: 722 | R3: =Q3/B3 -> 1.117560560328148E-2
A4: 2 | B4: 65603 | C4: 63757 | D4: =C4/B4 -> 0.97186104294010944 | E4: 1155 | F4: =E4/B4 -> 1.760590216910812E-2 | G4: 272 | H4: =G4/B4 -> 4.1461518528116094E-3 | I4: 190 | J4: =I4/B4 -> 2.8962090148316388E-3 | K4: 11 | L4: =K4/B4 -> 1.6767525875341068E-4 | M4: 182 | N4: =M4/B4 -> 2.7742633721018857E-3 | O4: 36 | P4: =O4/B4 -> 5.4875539228388945E-4 | Q4: 417 | R4: =Q4/B4 -> 6.3564166272883863E-3
A5: 3 | B5: 64632 | C5: 61716 | D5: =C5/B5 -> 0.95488303007797992 | E5: 2041 | F5: =E5/B5 -> 3.1578784503032552E-2 | G5: 284 | H5: =G5/B5 -> 4.3941081817056565E-3 | I5: 372 | J5: =I5/B5 -> 5.755662829558114E-3 | K5: 16 | L5: =K5/B5 -> 2.4755539051862855E-4 | M5: 154 | N5: =M5/B5 -> 2.3827206337417996E-3 | O5: 49 | P5: =O5/B5 -> 7.5813838346329996E-4 | Q5: 418 | R5: =Q5/B5 -> 6.4673845772991708E-3
A6: 4 | B6: 64886 | C6: 62431 | D6: =C6/B6 -> 0.962164411429276 | E6: 1419 | F6: =E6/B6 -> 2.1869124310328884E-2 | G6: 301 | H6: =G6/B6 -> 4.6389051567364298E-3 | I6: 300 | J6: =I6/B6 -> 4.623493511697439E-3 | K6: 19 | L6: =K6/B6 -> 2.9282125574083776E-4 | M6: 356 | N6: =M6/B6 -> 5.4865456338809605E-3 | O6: 60 | P6: =O6/B6 -> 9.2469870233948773E-4 | Q6: 754 | R6: =Q6/B6 -> 1.1620380359399562E-2
A7: 5 | B7: 62881 | C7: 60249 | D7: =C7/B7 -> 0.95814315930090166 | E7: 1315 | F7: =E7/B7 -> 2.0912517294572289E-2 | G7: 305 | H7: =G7/B7 -> 4.8504317679426215E-3 | I7: 163 | J7: =I7/B7 -> 2.5921979612283518E-3 | K7: 19 | L7: =K7/B7 -> 3.0215804456036003E-4 | M7: 768 | N7: =M7/B7 -> 1.2213546222229291E-2 | O7: 62 | P7: =O7/B7 -> 9.8598940856538535E-4 | Q7: 1530 | R7: =Q7/B7 -> 2.4331674114597412E-2
A8: 6 | B8: 66033 | C8: 61823 | D8: =C8/B8 -> 0.936243999212515 | E8: 2908 | F8: =E8/B8 -> 4.403858676722245E-2 | G8: 331 | H8: =G8/B8 -> 5.0126451925552378E-3 | I8: 541 | J8: =I8/B8 -> 8.1928732603395275E-3 | K8: 23 | L8: =K8/B8 -> 3.4831069313827936E-4 | M8: 310 | N8: =M8/B8 -> 4.6946223857768088E-3 | O8: 97 | P8: =O8/B8 -> 1.4689624884527434E-3 | Q8: 820 | R8: =Q8/B8 -> 1.2418033407538654E-2
A9: 7 | B9: 68585 | C9: 59273 | D9: =C9/B9 -> 0.86422687176496316 | E9: 3021 | F9: =E9/B9 -> 4.4047532259240359E-2 | G9: 359 | H9: =G9/B9 -> 5.2343806954873512E-3 | I9: 5083 | J9: =I9/B9 -> 7.4112415251148214E-2 | K9: 60 | L9: =K9/B9 -> 8.7482685718451552E-4 | M9: 564 | N9: =M9/B9 -> 8.2233724575344457E-3 | O9: 225 | P9: =O9/B9 -> 3.2806007144419334E-3 | Q9: 1840 | R9: =Q9/B9 -> 2.6828023620325145E-2
A10: 8 | B10: 63108 | C10: 57715 | D10: =C10/B10 -> 0.91454332255815429 | E10: 3116 | F10: =E10/B10 -> 4.9375673448691135E-2 | G10: 286 | H10: =G10/B10 -> 4.5319135450339098E-3 | I10: 1427 | J10: =I10/B10 -> 2.2612030170501361E-2 | K10: 28 | L10: =K10/B10 -> 4.4368384356975344E-4 | M10: 452 | N10: =M10/B10 -> 7.1623249033403056E-3 | O10: 84 | P10: =O10/B10 -> 1.3310515307092604E-3 | Q10: 1076 | R10: =Q10/B10 -> 1.705013627432338E-2
A11: 9 | B11: 62918 | C11: 56818 | D11: =C11/B11 -> 0.90304841221907883 | E11: 4704 | F11: =E11/B11 -> 7.4763978511713652E-2 | G11: 345 | H11: =G11/B11 -> 5.4833275056422647E-3 | I11: 276 | J11: =I11/B11 -> 4.3866620045138116E-3 | K11: 26 | L11: =K11/B11 -> 4.1323627578753299E-4 | M11: 689 | N11: =M11/B11 -> 1.0950761308369625E-2 | O11: 60 | P11: =O11/B11 -> 9.5362217489430683E-4 | Q11: 1257 | R11: =Q11/B11 -> 1.997838456403573E-2
A12: 10 | B12: 64430 | C12: 47575 | D12: =C12/B12 -> 0.73839826167934197 | E12: 14852 | F12: =E12/B12 -> 0.23051373583734286 | G12: 289 | H12: =G12/B12 -> 4.4854881266490768E-3 | I12: 317 | J12: =I12/B12 -> 4.9200682911687103E-3 | K12: 12 | L12: =K12/B12 -> 1.8624864193698588E-4 | M12: 1269 | N12: =M12/B12 -> 1.9695793884836256E-2 | O12: 116 | P12: =O12/B12 -> 1.8004035387241969E-3 | Q12: 1946 | R12: =Q12/B12 -> 3.0203321434114545E-2
A13: 11 | B13: 63684 | C13: 41561 | D13: =C13/B13 -> 0.65261290119967341 | E13: 18920 | F13: =E13/B13 -> 0.2970918912128635 | G13: 354 | H13: =G13/B13 -> 5.5586960618051627E-3 | I13: 1230 | J13: =I13/B13 -> 1.9314113435085736E-2 | K13: 37 | L13: =K13/B13 -> 5.8099365617737581E-4 | M13: 1278 | N13: =M13/B13 -> 2.0067834934991521E-2 | O13: 304 | P13: =O13/B13 -> 4.7735694994033035E-3 | Q13: 2892 | R13: =Q13/B13 -> 4.5411720369323533E-2
A14: 12 | B14: 65248 | C14: 59099 | D14: =C14/B14 -> 0.90575956351152531 | E14: 4997 | F14: =E14/B14 -> 7.6584722903384014E-2 | G14: 307 | H14: =G14/B14 -> 4.7051250613045614E-3 | I14: 368 | J14: =I14/B14 -> 5.6400196174595388E-3 | K14: 33 | L14: =K14/B14 -> 5.0576262873957818E-4 | M14: 342 | N14: =M14/B14 -> 5.2415399705738105E-3 | O14: 102 | P14: =O14/B14 -> 1.5632663070132419E-3 | Q14: 943 | R14: =Q14/B14 -> 1.4452550269740069E-2
A15: 13 | B15: 55452 | C15: 40480 | D15: =C15/B15 -> 0.73000072134458627 | E15: 6578 | F15: =E15/B15 -> 0.11862511721849528 | G15: 484 | H15: =G15/B15 -> 8.7282694943374445E-3 | I15: 2964 | J15: =I15/B15 -> 5.3451633845487991E-2 | K15: 78 | L15: =K15/B15 -> 1.4066219433023154E-3 | M15: 4550 | N15: =M15/B15 -> 8.2052946692635076E-2 | O15: 318 | P15: =O15/B15 -> 5.734689461155594E-3 | Q15: 9891 | R15: =Q15/B15 -> 0.17837048257952823
A16: 14 | B16: 62771 | C16: 40435 | D16: =C16/B16 -> 0.64416689235474978 | E16: 20798 | F16: =E16/B16 -> 0.33133134727820174 | G16: 260 | H16: =G16/B16 -> 4.1420401140654121E-3 | I16: 444 | J16: =I16/B16 -> 7.0733300409424734E-3 | K16: 20 | L16: =K16/B16 -> 3.1861847031272405E-4 | M16: 671 | N16: =M16/B16 -> 1.0689649678991891E-2 | O16: 143 | P16: =O16/B16 -> 2.2781220627359766E-3 | Q16: 1301 | R16: =Q16/B16 -> 2.0726131493842698E-2
A17: 15 | B17: 62127 | C17: 57853 | D17: =C17/B17 -> 0.93120543403029277 | E17: 2468 | F17: =E17/B17 -> 3.9725079273101871E-2 | G17: 430 | H17: =G17/B17 -> 6.9213063563346045E-3 | I17: 561 | J17: =I17/B17 -> 9.0298903858225896E-3 | K17: 31 | L17: =K17/B17 -> 4.9897790010784357E-4 | M17: 663 | N17: =M17/B17 -> 1.0671688637790333E-2 | O17: 121 | P17: =O17/B17 -> 1.9476234165499702E-3 | Q17: 1721 | R17: =Q17/B17 -> 2.7701321486632222E-2
A18: 16 | B18: 61490 | C18: 53042 | D18: =C18/B18 -> 0.86261180679785332 | E18: 6977 | F18: =E18/B18 -> 0.11346560416327858 | G18: 354 | H18: =G18/B18 -> 5.7570336640104082E-3 | I18: 625 | J18: =I18/B18 -> 1.0164254350300862E-2 | K18: 26 | L18: =K18/B18 -> 4.2283298097251583E-4 | M18: 346 | N18: =M18/B18 -> 5.6269312083265573E-3 | O18: 120 | P18: =O18/B18 -> 1.9515368352577655E-3 | Q18: 884 | R18: =Q18/B18 -> 1.437632135306554E-2
A19: 17 | B19: 63739 | C19: 57935 | D19: =C19/B19 -> 0.90894115062991265 | E19: 3557 | F19: =E19/B19 -> 5.5805707651516337E-2 | G19: 368 | H19: =G19/B19 -> 5.7735452391785248E-3 | I19: 1074 | J19: =I19/B19 -> 1.6849966268689499E-2 | K19: 26 | L19: =K19/B19 -> 4.0791352233326533E-4 | M19: 662 | N19: =M19/B19 -> 1.0386105837870065E-2 | O19: 117 | P19: =O19/B19 -> 1.835610850499694E-3 | Q19: 1472 | R19: =Q19/B19 -> 2.3094180956714099E-2
A20: 18 | B20: 59487 | C20: 52619 | D20: =C20/B20 -> 0.88454620337216538 | E20: 4132 | F20: =E20/B20 -> 6.946055440684519E-2 | G20: 356 | H20: =G20/B20 -> 5.9845008153041838E-3 | I20: 996 | J20: =I20/B20 -> 1.6743153966412828E-2 | K20: 63 | L20: =K20/B20 -> 1.0590549195622573E-3 | M20: 1164 | N20: =M20/B20 -> 1.9567300418578848E-2 | O20: 157 | P20: =O20/B20 -> 2.6392321011313395E-3 | Q20: 2970 | R20: =Q20/B20 -> 4.9926874779363556E-2
A21: 19 | B21: 64821 | C21: 60171 | D21: =C21/B21 -> 0.92826398852223813 | E21: 3087 | F21: =E21/B21 -> 4.7623455361688341E-2 | G21: 497 | H21: =G21/B21 -> 7.6672683235371256E-3 | I21: 660 | J21: =I21/B21 -> 1.0181885500069422E-2 | K21: 34 | L21: =K21/B21 -> 5.2452137424600052E-4 | M21: 280 | N21: =M21/B21 -> 4.3195877879082393E-3 | O21: 92 | P21: =O21/B21 -> 1.4192931303127073E-3 | Q21: 902 | R21: =Q21/B21 -> 1.3915243516761544E-2
A22: 20 | B22: 64477 | C22: 55306 | D22: =C22/B22 -> 0.85776323340105776 | E22: 2981 | F22: =E22/B22 -> 4.6233540642399616E-2 | G22: 314 | H22: =G22/B22 -> 4.8699536268746995E-3 | I22: 2028 | J22: =I22/B22 -> 3.1453076290770356E-2 | K22: 77 | L22: =K22/B22 -> 1.1942242970361524E-3 | M22: 3560 | N22: =M22/B22 -> 5.5213486979853281E-2 | O22: 211 | P22: =O22/B22 -> 3.2724847620081579E-3 | Q22: 6223 | R22: =Q22/B22 -> 9.6515036369558133E-2
A23: 21 | B23: 62487 | C23: 38684 | D23: =C23/B23 -> 0.61907276713556425 | E23: 13541 | F23: =E23/B23 -> 0.21670107382335527 | G23: 393 | H23: =G23/B23 -> 6.2893081761006293E-3 | I23: 8064 | J23: =I23/B23 -> 0.12905084257525565 | K23: 112 | L23: =K23/B23 -> 1.7923728135452175E-3 | M23: 1185 | N23: =M23/B23 -> 1.8963944500456093E-2 | O23: 508 | P23: =O23/B23 -> 8.1296909757229505E-3 | Q23: 3350 | R23: =Q23/B23 -> 5.3611151119432841E-2
A24: 22 | B24: 62889 | C24: 43650 | D24: =C24/B24 -> 0.69408004579497207 | E24: 17825 | F24: =E24/B24 -> 0.28343589498958482 | G24: 376 | H24: =G24/B24 -> 5.9787880233427146E-3 | I24: 291 | J24: =I24/B24 -> 4.6272003052998138E-3 | K24: 27 | L24: =K24/B24 -> 4.2932786337833325E-4 | M24: 572 | N24: =M24/B24 -> 9.0953902908298741E-3 | O24: 148 | P24: =O24/B24 -> 2.3533527325923453E-3 | Q24: 1184 | R24: =Q24/B24 -> 1.8826821860738762E-2
A25: 23 | B25: 64290 | C25: 44366 | D25: =C25/B25 -> 0.69009177165966717 | E25: 16832 | F25: =E25/B25 -> 0.26181365686731994 | G25: 370 | H25: =G25/B25 -> 5.7551718774303939E-3 | I25: 1580 | J25: =I25/B25 -> 2.4576139368486544E-2 | K25: 39 | L25: =K25/B25 -> 6.0662622491833881E-4 | M25: 828 | N25: =M25/B25 -> 1.2879141390573962E-2 | O25: 275 | P25: =O25/B25 -> 4.2774926116036713E-3 | Q25: 1757 | R25: =Q25/B25 -> 2.7329289158500546E-2
A26: 24 | B26: 61922 | C26: 50251 | D26: =C26/B26 -> 0.81152094570588806 | E26: 9123 | F26: =E26/B26 -> 0.14733051258034302 | G26: 540 | H26: =G26/B26 -> 8.7206485578631178E-3 | I26: 857 | J26: =I26/B26 -> 1.3839992248312394E-2 | K26: 36 | L26: =K26/B26 -> 5.8137657052420783E-4 | M26: 940 | N26: =M26/B26 -> 1.5180388230354317E-2 | O26: 175 | P26: =O26/B26 -> 2.8261361067148994E-3 | Q26: 1911 | R26: =Q26/B26 -> 3.0861406285326701E-2
A27: 25 | B27: 61764 | C27: 56922 | D27: =C27/B27 -> 0.92160481834078101 | E27: 3151 | F27: =E27/B27 -> 5.1016773525030763E-2 | G27: 352 | H27: =G27/B27 -> 5.6991127517647825E-3 | I27: 439 | J27: =I27/B27 -> 7.107700278479373E-3 | K27: 21 | L27: =K27/B27 -> 3.4000388575869438E-4 | M27: 762 | N27: =M27/B27 -> 1.2337283854672625E-2 | O27: 117 | P27: =O27/B27 -> 1.8943073635127258E-3 | Q27: 1629 | R27: =Q27/B27 -> 2.6374587138138721E-2
A28: 26 | B28: 61111 | C28: 57950 | D28: =C28/B28 -> 0.94827445140809352 | E28: 1060 | F28: =E28/B28 -> 1.7345486082701967E-2 | G28: 390 | H28: =G28/B28 -> 6.3818297851450639E-3 | I28: 319 | J28: =I28/B28 -> 5.2200094909263467E-3 | K28: 18 | L28: =K28/B28 -> 2.9454599008361834E-4 | M28: 1299 | N28: =M28/B28 -> 2.125640228436779E-2 | O28: 75 | P28: =O28/B28 -> 1.2272749586817431E-3 | Q28: 2530 | R28: =Q28/B28 -> 4.1400075272864136E-2
A29: 27 | B29: 59880 | C29: 39344 | D29: =C29/B29 -> 0.65704742818971273 | E29: 15216 | F29: =E29/B29 -> 0.25410821643286574 | G29: 454 | H29: =G29/B29 -> 7.5818303273213093E-3 | I29: 2027 | J29: =I29/B29 -> 3.3851035404141618E-2 | K29: 54 | L29: =K29/B29 -> 9.0180360721442887E-4 | M29: 2433 | N29: =M29/B29 -> 4.0631262525050102E-2 | O29: 352 | P29: =O29/B29 -> 5.878423513694055E-3 | Q29: 4164 | R29: =Q29/B29 -> 6.953907815631262E-2
A30: 28 | B30: 61236 | C30: 46102 | D30: =C30/B30 -> 0.75285779606767256 | E30: 9853 | F30: =E30/B30 -> 0.1609020837415899 | G30: 481 | H30: =G30/B30 -> 7.8548566202887183E-3 | I30: 1950 | J30: =I30/B30 -> 3.1844013325494809E-2 | K30: 64 | L30: =K30/B30 -> 1.0451368476059833E-3 | M30: 2415 | N30: =M30/B30 -> 3.9437585733882029E-2 | O30: 371 | P30: =O30/B30 -> 6.0585276634659352E-3 | Q30: 4631 | R30: =Q30/B30 -> 7.5625449082239199E-2
A31: 29 | B31: 60614 | C31: 52710 | D31: =C31/B31 -> 0.86960108225822419 | E31: 3719 | F31: =E31/B31 -> 6.1355462434421089E-2 | G31: 366 | H31: =G31/B31 -> 6.0382089946217042E-3 | I31: 1150 | J31: =I31/B31 -> 1.8972514600587322E-2 | K31: 35 | L31: =K31/B31 -> 5.7742435740917939E-4 | M31: 2479 | N31: =M31/B31 -> 4.0898142343353018E-2 | O31: 155 | P31: =O31/B31 -> 2.5571650113835089E-3 | Q31: 4512 | R31: =Q31/B31 -> 7.4438248589434777E-2
A32: 30 | B32: 59191 | C32: 48399 | D32: =C32/B32 -> 0.8176749843726242 | E32: 7121 | F32: =E32/B32 -> 0.1203054518423409 | G32: 464 | H32: =G32/B32 -> 7.8390295821999974E-3 | I32: 924 | J32: =I32/B32 -> 1.5610481323174131E-2 | K32: 45 | L32: =K32/B32 -> 7.6025071379094797E-4 | M32: 2047 | N32: =M32/B32 -> 3.4582960247334898E-2 | O32: 191 | P32: =O32/B32 -> 3.2268419185349125E-3 | Q32: 3797 | R32: =Q32/B32 -> 6.4148265783649544E-2
A33: 31 | B33: 55235 | C33: 29180 | D33: =C33/B33 -> 0.52828822304698109 | E33: 16986 | F33: =E33/B33 -> 0.3075224042726532 | G33: 447 | H33: =G33/B33 -> 8.0926948492803484E-3 | I33: 4099 | J33: =I33/B33 -> 7.4210192812528289E-2 | K33: 137 | L33: =K33/B33 -> 2.480311396759301E-3 | M33: 3716 | N33: =M33/B33 -> 6.7276183579252288E-2 | O33: 670 | P33: =O33/B33 -> 1.2129990042545488E-2 | Q33: 8256 | R33: =Q33/B33 -> 0.14947044446456051
A34: 32 | B34: 55327 | C34: 38801 | D34: =C34/B34 -> 0.7013031612051982 | E34: 4732 | F34: =E34/B34 -> 8.5527861622715848E-2 | G34: 226 | H34: =G34/B34 -> 4.0848048873063786E-3 | I34: 8998 | J34: =I34/B34 -> 0.16263307246010086 | K34: 54 | L34: =K34/B34 -> 9.7601532705550637E-4 | M34: 2133 | N34: =M34/B34 -> 3.8552605418692501E-2 | O34: 383 | P34: =O34/B34 -> 6.9224790789307209E-3 | Q34: 5733 | R34: =Q34/B34 -> 0.10362029388905959
A35: 33 | B35: 55412 | C35: 44062 | D35: =C35/B35 -> 0.79517072114343468 | E35: 4133 | F35: =E35/B35 -> 7.4586732115787188E-2 | G35: 316 | H35: =G35/B35 -> 5.7027358694867539E-3 | I35: 3860 | J35: =I35/B35 -> 6.9660001443730593E-2 | K35: 42 | L35: =K35/B35 -> 7.5795856493178374E-4 | M35: 2721 | N35: =M35/B35 -> 4.9104887028080559E-2 | O35: 278 | P35: =O35/B35 -> 5.016963834548473E-3 | Q35: 6036 | R35: =Q35/B35 -> 0.10892947376019635
A36: 34 | B36: 57684 | C36: 42862 | D36: =C36/B36 -> 0.74304833229318357 | E36: 2639 | F36: =E36/B36 -> 4.5749254559323209E-2 | G36: 225 | H36: =G36/B36 -> 3.9005616808820472E-3 | I36: 9508 | J36: =I36/B36 -> 0.16482906871922889 | K36: 69 | L36: =K36/B36 -> 1.1961722488038277E-3 | M36: 2053 | N36: =M36/B36 -> 3.5590458359337079E-2 | O36: 328 | P36: =O36/B36 -> 5.6861521392413839E-3 | Q36: 4912 | R36: =Q36/B36 -> 8.5153595451078284E-2
A37: 35 | B37: 60022 | C37: 45050 | D37: =C37/B37 -> 0.75055812868614846 | E37: 2176 | F37: =E37/B37 -> 3.6253373762953581E-2 | G37: 224 | H37: =G37/B37 -> 3.7319649461863983E-3 | I37: 10478 | J37: =I37/B37 -> 0.17456932458098698 | K37: 47 | L37: =K37/B37 -> 7.8304621638732464E-4 | M37: 1775 | N37: =M37/B37 -> 2.9572490086968113E-2 | O37: 272 | P37: =O37/B37 -> 4.5316717203691976E-3 | Q37: 4790 | R37: =Q37/B37 -> 7.9804071840325216E-2
A38: 36 | B38: 58512 | C38: 43334 | D38: =C38/B38 -> 0.7406002187585452 | E38: 4643 | F38: =E38/B38 -> 7.9351244189226136E-2 | G38: 299 | H38: =G38/B38 -> 5.1100628930817607E-3 | I38: 7548 | J38: =I38/B38 -> 0.12899917965545529 | K38: 43 | L38: =K38/B38 -> 7.3489198796827999E-4 | M38: 2338 | N38: =M38/B38 -> 3.9957615531856713E-2 | O38: 307 | P38: =O38/B38 -> 5.2467869838665575E-3 | Q38: 5709 | R38: =Q38/B38 -> 9.7569729286300241E-2
A39: 37 | B39: 64041 | C39: 42725 | D39: =C39/B39 -> 0.66715073156259275 | E39: 4575 | F39: =E39/B39 -> 7.1438609640698925E-2 | G39: 385 | H39: =G39/B39 -> 6.0117737074686529E-3 | I39: 13171 | J39: =I39/B39 -> 0.20566512078199903 | K39: 69 | L39: =K39/B39 -> 1.0774347683515247E-3 | M39: 2724 | N39: =M39/B39 -> 4.2535250854921068E-2 | O39: 392 | P39: =O39/B39 -> 6.121078683968083E-3 | Q39: 7284 | R39: =Q39/B39 -> 0.11373963554597835
A40: 38 | B40: 64607 | C40: 37019 | D40: =C40/B40 -> 0.57298744718064609 | E40: 6278 | F40: =E40/B40 -> 9.7172133050598228E-2 | G40: 506 | H40: =G40/B40 -> 7.8319686721253119E-3 | I40: 11985 | J40: =I40/B40 -> 0.18550621449688115 | K40: 54 | L40: =K40/B40 -> 8.3582274366554707E-4 | M40: 8250 | N40: =M40/B40 -> 0.12769514139334748 | O40: 515 | P40: =O40/B40 -> 7.9712724627362362E-3 | Q40: 17147 | R40: =Q40/B40 -> 0.26540467751172475
A41: 39 | B41: 60143 | C41: 34022 | D41: =C41/B41 -> 0.56568511713748904 | E41: 3913 | F41: =E41/B41 -> 6.5061603179089836E-2 | G41: 442 | H41: =G41/B41 -> 7.3491511896646329E-3 | I41: 14795 | J41: =I41/B41 -> 0.24599704038707745 | K41: 70 | L41: =K41/B41 -> 1.1638927223450776E-3 | M41: 6467 | N41: =M41/B41 -> 0.10752706050579453 | O41: 434 | P41: =O41/B41 -> 7.2161348785394807E-3 | Q41: 13291 | R41: =Q41/B41 -> 0.22098997389554895
A42: 40 | B42: 57223 | C42: 33544 | D42: =C42/B42 -> 0.58619785750484943 | E42: 4336 | F42: =E42/B42 -> 7.5773727347395278E-2 | G42: 279 | H42: =G42/B42 -> 4.875661884207399E-3 | I42: 15702 | J42: =I42/B42 -> 0.27440015378431748 | K42: 68 | L42: =K42/B42 -> 1.188333362459151E-3 | M42: 2894 | N42: =M42/B42 -> 5.0574069867011517E-2 | O42: 400 | P42: =O42/B42 -> 6.9901962497597118E-3 | Q42: 6874 | R42: =Q42/B42 -> 0.12012652255212065
A43: 41 | B43: 59739 | C43: 42044 | D43: =C43/B43 -> 0.70379484089121014 | E43: 3716 | F43: =E43/B43 -> 6.2203920387016859E-2 | G43: 315 | H43: =G43/B43 -> 5.2729372771556267E-3 | I43: 10859 | J43: =I43/B43 -> 0.18177405045280304 | K43: 73 | L43: =K43/B43 -> 1.2219822896265421E-3 | M43: 2422 | N43: =M43/B43 -> 4.054302884212993E-2 | O43: 310 | P43: =O43/B43 -> 5.189239860057919E-3 | Q43: 7219 | R43: =Q43/B43 -> 0.12084233080567133
A44: 42 | B44: 55185 | C44: 33281 | D44: =C44/B44 -> 0.60308054725015858 | E44: 9071 | F44: =E44/B44 -> 0.16437437709522515 | G44: 320 | H44: =G44/B44 -> 5.7986771767690494E-3 | I44: 9478 | J44: =I44/B44 -> 0.17174956962942828 | K44: 116 | L44: =K44/B44 -> 2.1020204765787804E-3 | M44: 2476 | N44: =M44/B44 -> 4.4867264655250524E-2 | O44: 443 | P44: =O44/B44 -> 8.0275437165896538E-3 | Q44: 6367 | R44: =Q44/B44 -> 0.11537555495152668
A45: 43 | B45: 61623 | C45: 39610 | D45: =C45/B45 -> 0.64277948168703247 | E45: 8903 | F45: =E45/B45 -> 0.14447527708810023 | G45: 412 | H45: =G45/B45 -> 6.6858153611476234E-3 | I45: 8470 | J45: =I45/B45 -> 0.13744867987602033 | K45: 70 | L45: =K45/B45 -> 1.135939503107606E-3 | M45: 3731 | N45: =M45/B45 -> 6.0545575515635393E-2 | O45: 427 | P45: =O45/B45 -> 6.9292309689563958E-3 | Q45: 8850 | R45: =Q45/B45 -> 0.14361520860717589
A46: 44 | B46: 61095 | C46: 36257 | D46: =C46/B46 -> 0.59345281937965466 | E46: 12692 | F46: =E46/B46 -> 0.2077420410835584 | G46: 418 | H46: =G46/B46 -> 6.8418037482609051E-3 | I46: 4437 | J46: =I46/B46 -> 7.2624601031180944E-2 | K46: 80 | L46: =K46/B46 -> 1.3094361240690727E-3 | M46: 6677 | N46: =M46/B46 -> 0.10928881250511499 | O46: 534 | P46: =O46/B46 -> 8.7404861281610603E-3 | Q46: 12847 | R46: =Q46/B46 -> 0.21027907357394221
A47: 45 | B47: 67622 | C47: 51425 | D47: =C47/B47 -> 0.76047735943923578 | E47: 8362 | F47: =E47/B47 -> 0.12365798113040134 | G47: 436 | H47: =G47/B47 -> 6.4476058087604626E-3 | I47: 3687 | J47: =I47/B47 -> 5.4523675726834461E-2 | K47: 85 | L47: =K47/B47 -> 1.2569873709739434E-3 | M47: 3221 | N47: =M47/B47 -> 4.7632427316553781E-2 | O47: 406 | P47: =O47/B47 -> 6.0039632072402468E-3 | Q47: 7144 | R47: =Q47/B47 -> 0.10564609150868061
A48: 46 | B48: 63777 | C48: 33023 | D48: =C48/B48 -> 0.51778854445960143 | E48: 18009 | F48: =E48/B48 -> 0.28237452373112565 | G48: 393 | H48: =G48/B48 -> 6.1620960534361918E-3 | I48: 6335 | J48: =I48/B48 -> 9.9330479639995611E-2 | K48: 94 | L48: =K48/B48 -> 1.473885570033084E-3 | M48: 5252 | N48: =M48/B48 -> 8.2349436317167637E-2 | O48: 671 | P48: =O48/B48 -> 1.0521034228640419E-2 | Q48: 11195 | R48: =Q48/B48 -> 0.17553349953745082
A49: 47 | B49: 67394 | C49: 50975 | D49: =C49/B49 -> 0.75637297088761613 | E49: 3830 | F49: =E49/B49 -> 5.6829984865121523E-2 | G49: 575 | H49: =G49/B49 -> 8.5319167878446147E-3 | I49: 7273 | J49: =I49/B49 -> 0.1079176187791198 | K49: 76 | L49: =K49/B49 -> 1.1276968276107665E-3 | M49: 4202 | N49: =M49/B49 -> 6.2349764073953172E-2 | O49: 463 | P49: =O49/B49 -> 6.870047778734012E-3 | Q49: 9317 | R49: =Q49/B49 -> 0.1382467281953883
A50: 48 | B50: 61270 | C50: 50860 | D50: =C50/B50 -> 0.83009629508731841 | E50: 2602 | F50: =E50/B50 -> 4.246776562755019E-2 | G50: 258 | H50: =G50/B50 -> 4.2108699200261142E-3 | I50: 6225 | J50: =I50/B50 -> 0.10159947772156031 | K50: 54 | L50: =K50/B50 -> 8.8134486698220992E-4 | M50: 1046 | N50: =M50/B50 -> 1.7071976497470213E-2 | O50: 225 | P50: =O50/B50 -> 3.6722702790925412E-3 | Q50: 4019 | R50: =Q50/B50 -> 6.5594907785212986E-2
A51: 49 | B51: 67005 | C51: 39035 | D51: =C51/B51 -> 0.58256846503992243 | E51: 10502 | F51: =E51/B51 -> 0.15673457204686217 | G51: 733 | H51: =G51/B51 -> 1.0939482128199387E-2 | I51: 7614 | J51: =I51/B51 -> 0.11363331094694426 | K51: 105 | L51: =K51/B51 -> 1.5670472352809493E-3 | M51: 8281 | N51: =M51/B51 -> 0.12358779195582419 | O51: 735 | P51: =O51/B51 -> 1.0969330646966645E-2 | Q51: 17253 | R51: =Q51/B51 -> 0.25748824714573537
A52: 50 | B52: 57124 | C52: 37950 | D52: =C52/B52 -> 0.66434423359708705 | E52: 5874 | F52: =E52/B52 -> 0.10282893354807086 | G52: 459 | H52: =G52/B52 -> 8.035151600028009E-3 | I52: 5624 | J52: =I52/B52 -> 9.8452489321476086E-2 | K52: 76 | L52: =K52/B52 -> 1.3304390448848119E-3 | M52: 6721 | N52: =M52/B52 -> 0.11765632658777396 | O52: 420 | P52: =O52/B52 -> 7.3524263006792242E-3 | Q52: 12417 | R52: =Q52/B52 -> 0.21736923184650936
A53: 51 | B53: 56436 | C53: 33630 | D53: =C53/B53 -> 0.59589623644482248 | E53: 12606 | F53: =E53/B53 -> 0.22336806293854986 | G53: 556 | H53: =G53/B53 -> 9.8518676022397045E-3 | I53: 4710 | J53: =I53/B53 -> 8.3457367637678082E-2 | K53: 131 | L53: =K53/B53 -> 2.3212134098802182E-3 | M53: 4226 | N53: =M53/B53 -> 7.4881281451555745E-2 | O53: 577 | P53: =O53/B53 -> 1.0223970515273939E-2 | Q53: 9651 | R53: =Q53/B53 -> 0.17100786731873271
A54: 52 | B54: 56603 | C54: 27313 | D54: =C54/B54 -> 0.48253626132890481 | E54: 14807 | F54: =E54/B54 -> 0.26159390845008212 | G54: 637 | H54: =G54/B54 -> 1.1253820468879742E-2 | I54: 4899 | J54: =I54/B54 -> 8.6550182852498977E-2 | K54: 98 | L54: =K54/B54 -> 1.7313569952122679E-3 | M54: 8153 | N54: =M54/B54 -> 0.14403830185679203 | O54: 696 | P54: =O54/B54 -> 1.2296168047629985E-2 | Q54: 15601 | R54: =Q54/B54 -> 0.27562143349292439
A55: 53 | B55: 63033 | C55: 41779 | D55: =C55/B55 -> 0.66281154315993207 | E55: 3004 | F55: =E55/B55 -> 4.7657576190249552E-2 | G55: 360 | H55: =G55/B55 -> 5.7112940840512109E-3 | I55: 14274 | J55: =I55/B55 -> 0.22645281043263052 | K55: 64 | L55: =K55/B55 -> 1.015341170497993E-3 | M55: 3134 | N55: =M55/B55 -> 4.9719987942823597E-2 | O55: 418 | P55: =O55/B55 -> 6.6314470198150172E-3 | Q55: 8009 | R55: =Q55/B55 -> 0.12706042866435041
A56: 54 | B56: 55586 | C56: 41746 | D56: =C56/B56 -> 0.75101644298924186 | E56: 9506 | F56: =E56/B56 -> 0.1710142841722736 | G56: 410 | H56: =G56/B56 -> 7.3759579750296836E-3 | I56: 1649 | J56: =I56/B56 -> 2.9665743172741336E-2 | K56: 104 | L56: =K56/B56 -> 1.8709747058611882E-3 | M56: 1872 | N56: =M56/B56 -> 3.3677544705501383E-2 | O56: 299 | P56: =O56/B56 -> 5.3790522793509153E-3 | Q56: 4051 | R56: =Q56/B56 -> 7.2878062821573775E-2
A57: 55 | B57: 59208 | C57: 50967 | D57: =C57/B57 -> 0.86081272800972841 | E57: 6120 | F57: =E57/B57 -> 0.10336441021483583 | G57: 379 | H57: =G57/B57 -> 6.4011620051344417E-3 | I57: 1165 | J57: =I57/B57 -> 1.967639508174571E-2 | K57: 23 | L57: =K57/B57 -> 3.8846101878124576E-4 | M57: 432 | N57: =M57/B57 -> 7.296311309282529E-3 | O57: 122 | P57: =O57/B57 -> 2.0605323604918255E-3 | Q57: 1122 | R57: =Q57/B57 -> 1.8950141872719903E-2
A58: 56 | B58: 62523 | C58: 46578 | D58: =C58/B58 -> 0.74497384962333857 | E58: 14651 | F58: =E58/B58 -> 0.23432976664587432 | G58: 366 | H58: =G58/B58 -> 5.8538457847512118E-3 | I58: 414 | J58: =I58/B58 -> 6.6215632647185834E-3 | K58: 19 | L58: =K58/B58 -> 3.0388816915375143E-4 | M58: 361 | N58: =M58/B58 -> 5.7738752139212769E-3 | O58: 134 | P58: =O58/B58 -> 2.1432112982422468E-3 | Q58: 964 | R58: =Q58/B58 -> 1.5418326056011388E-2
A59: 57 | B59: 67117 | C59: 49471 | D59: =C59/B59 -> 0.73708598417688509 | E59: 9929 | F59: =E59/B59 -> 0.14793569438443316 | G59: 361 | H59: =G59/B59 -> 5.3786671037144088E-3 | I59: 5528 | J59: =I59/B59 -> 8.2363633654662746E-2 | K59: 41 | L59: =K59/B59 -> 6.1087354917532073E-4 | M59: 1472 | N59: =M59/B59 -> 2.1931850350879807E-2 | O59: 315 | P59: =O59/B59 -> 4.693296780249415E-3 | Q59: 3641 | R59: =Q59/B59 -> 5.4248551037740067E-2
A60: 58 | B60: 62657 | C60: 53829 | D60: =C60/B60 -> 0.85910592591410373 | E60: 6302 | F60: =E60/B60 -> 0.10057934468614839 | G60: 375 | H60: =G60/B60 -> 5.9849657659958189E-3 | I60: 1242 | J60: =I60/B60 -> 1.9822206616978151E-2 | K60: 46 | L60: =K60/B60 -> 7.3415580062882041E-4 | M60: 723 | N60: =M60/B60 -> 1.1539013996839938E-2 | O60: 140 | P60: =O60/B60 -> 2.2343872193051058E-3 | Q60: 1702 | R60: =Q60/B60 -> 2.7163764623266355E-2
A61: 59 | B61: 60603 | C61: 49361 | D61: =C61/B61 -> 0.81449763213042259 | E61: 9762 | F61: =E61/B61 -> 0.16108113459729717 | G61: 419 | H61: =G61/B61 -> 6.9138491493820438E-3 | I61: 385 | J61: =I61/B61 -> 6.3528208174512815E-3 | K61: 46 | L61: =K61/B61 -> 7.5903833143573754E-4 | M61: 468 | N61: =M61/B61 -> 7.7223899806940248E-3 | O61: 162 | P61: =O61/B61 -> 2.6731349933171627E-3 | Q61: 1267 | R61: =Q61/B61 -> 2.0906555781066944E-2
A62: 60 | B62: 64601 | C62: 41876 | D62: =C62/B62 -> 0.64822525967090294 | E62: 21637 | F62: =E62/B62 -> 0.3349328957756072 | G62: 309 | H62: =G62/B62 -> 4.7832076902834322E-3 | I62: 237 | J62: =I62/B62 -> 3.6686738595377781E-3 | K62: 17 | L62: =K62/B62 -> 2.6315382114827944E-4 | M62: 377 | N62: =M62/B62 -> 5.8358229748765502E-3 | O62: 148 | P62: =O62/B62 -> 2.2909862076438445E-3 | Q62: 916 | R62: =Q62/B62 -> 1.4179347068930821E-2
A63: 61 | B63: 64064 | C63: 30745 | D63: =C63/B63 -> 0.4799107142857143 | E63: 31912 | F63: =E63/B63 -> 0.49812687312687315 | G63: 278 | H63: =G63/B63 -> 4.3394105894105891E-3 | I63: 311 | J63: =I63/B63 -> 4.8545204795204799E-3 | K63: 26 | L63: =K63/B63 -> 4.0584415584415587E-4 | M63: 596 | N63: =M63/B63 -> 9.3031968031968039E-3 | O63: 196 | P63: =O63/B63 -> 3.0594405594405595E-3 | Q63: 1251 | R63: =Q63/B63 -> 1.9527347652347652E-2
A64: 62 | B64: 63173 | C64: 38612 | D64: =C64/B64 -> 0.61121048549221979 | E64: 20933 | F64: =E64/B64 -> 0.33135991641998958 | G64: 1063 | H64: =G64/B64 -> 1.6826808921532932E-2 | I64: 939 | J64: =I64/B64 -> 1.4863945039811312E-2 | K64: 96 | L64: =K64/B64 -> 1.5196365535909329E-3 | M64: 1139 | N64: =M64/B64 -> 1.802985452645909E-2 | O64: 391 | P64: =O64/B64 -> 6.1893530463964039E-3 | Q64: 2706 | R64: =Q64/B64 -> 4.2834755354344417E-2
A65: 63 | B65: 62864 | C65: 28379 | D65: =C65/B65 -> 0.45143484347162127 | E65: 32046 | F65: =E65/B65 -> 0.50976711631458382 | G65: 314 | H65: =G65/B65 -> 4.9949096462204128E-3 | I65: 920 | J65: =I65/B65 -> 1.4634767116314585E-2 | K65: 45 | L65: =K65/B65 -> 7.1583100025451765E-4 | M65: 823 | N65: =M65/B65 -> 1.3091753626877069E-2 | O65: 337 | P65: =O65/B65 -> 5.360778824128277E-3 | Q65: 1802 | R65: =Q65/B65 -> 2.8665054721303131E-2
A66: 64 | B66: 64376 | C66: 53237 | D66: =C66/B66 -> 0.82696967814092204 | E66: 7341 | F66: =E66/B66 -> 0.11403318006710575 | G66: 324 | H66: =G66/B66 -> 5.0329315272772462E-3 | I66: 2282 | J66: =I66/B66 -> 3.54479930408848E-2 | K66: 69 | L66: =K66/B66 -> 1.0718280104386729E-3 | M66: 852 | N66: =M66/B66 -> 1.323474586802535E-2 | O66: 271 | P66: =O66/B66 -> 4.2096433453460919E-3 | Q66: 2487 | R66: =Q66/B66 -> 3.8632409593637382E-2
A67: 65 | B67: 58171 | C67: 47622 | D67: =C67/B67 -> 0.81865534372797444 | E67: 6541 | F67: =E67/B67 -> 0.11244434512042083 | G67: 333 | H67: =G67/B67 -> 5.7245018995719515E-3 | I67: 2719 | J67: =I67/B67 -> 4.6741503498306719E-2 | K67: 30 | L67: =K67/B67 -> 5.1572089185332893E-4 | M67: 699 | N67: =M67/B67 -> 1.2016296780182565E-2 | O67: 227 | P67: =O67/B67 -> 3.9022880816901892E-3 | Q67: 1956 | R67: =Q67/B67 -> 3.3625002148837048E-2
A68: 66 | B68: 60237 | C68: 45134 | D68: =C68/B68 -> 0.74927370220960543 | E68: 11536 | F68: =E68/B68 -> 0.19151020137125022 | G68: 429 | H68: =G68/B68 -> 7.1218686189551276E-3 | I68: 1762 | J68: =I68/B68 -> 2.925112472400684E-2 | K68: 50 | L68: =K68/B68 -> 8.3005461759383772E-4 | M68: 1058 | N68: =M68/B68 -> 1.7563955708285606E-2 | O68: 268 | P68: =O68/B68 -> 4.4490927503029699E-3 | Q68: 2401 | R68: =Q68/B68 -> 3.9859222736856083E-2
A69: 67 | B69: 55373 | C69: 35670 | D69: =C69/B69 -> 0.64417676484929476 | E69: 3641 | F69: =E69/B69 -> 6.5754067867011004E-2 | G69: 238 | H69: =G69/B69 -> 4.2981236342621854E-3 | I69: 13296 | J69: =I69/B69 -> 0.24011702454264713 | K69: 90 | L69: =K69/B69 -> 1.6253408700991458E-3 | M69: 2147 | N69: =M69/B69 -> 3.8773409423365178E-2 | O69: 291 | P69: =O69/B69 -> 5.2552688133205711E-3 | Q69: 5469 | R69: =Q69/B69 -> 9.876654687302476E-2
A70: 68 | B70: 62859 | C70: 52266 | D70: =C70/B70 -> 0.83147997900062043 | E70: 6568 | F70: =E70/B70 -> 0.1044878219507151 | G70: 244 | H70: =G70/B70 -> 3.8817034951240076E-3 | I70: 2488 | J70: =I70/B70 -> 3.9580648753559551E-2 | K70: 34 | L70: =K70/B70 -> 5.4089310997629616E-4 | M70: 1028 | N70: =M70/B70 -> 1.6354062266342131E-2 | O70: 231 | P70: =O70/B70 -> 3.6748914236624827E-3 | Q70: 2554 | R70: =Q70/B70 -> 4.0630617731748836E-2
A71: 69 | B71: 63117 | C71: 21188 | D71: =C71/B71 -> 0.3356940285501529 | E71: 33912 | F71: =E71/B71 -> 0.5372878939113076 | G71: 441 | H71: =G71/B71 -> 6.9870240981035224E-3 | I71: 1289 | J71: =I71/B71 -> 2.0422390164298049E-2 | K71: 84 | L71: =K71/B71 -> 1.3308617329720995E-3 | M71: 5643 | N71: =M71/B71 -> 8.9405389990018541E-2 | O71: 560 | P71: =O71/B71 -> 8.8724115531473302E-3 | Q71: 8547 | R71: =Q71/B71 -> 0.13541518132991112
A72: 70 | B72: 59887 | C72: 22313 | D72: =C72/B72 -> 0.37258503514953162 | E72: 33201 | F72: =E72/B72 -> 0.55439410890510465 | G72: 523 | H72: =G72/B72 -> 8.7331140314258517E-3 | I72: 918 | J72: =I72/B72 -> 1.5328869370648054E-2 | K72: 51 | L72: =K72/B72 -> 8.5160385392489188E-4 | M72: 2420 | N72: =M72/B72 -> 4.0409437774475261E-2 | O72: 461 | P72: =O72/B72 -> 7.6978309148897093E-3 | Q72: 4090 | R72: =Q72/B72 -> 6.8295289461819758E-2
A73: 71 | B73: 68519 | C73: 29418 | D73: =C73/B73 -> 0.42934076679461169 | E73: 33917 | F73: =E73/B73 -> 0.49500138647674369 | G73: 353 | H73: =G73/B73 -> 5.1518556896627214E-3 | I73: 3431 | J73: =I73/B73 -> 5.0073702184795461E-2 | K73: 51 | L73: =K73/B73 -> 7.4431909397393423E-4 | M73: 721 | N73: =M73/B73 -> 1.0522628759906012E-2 | O73: 628 | P73: =O73/B73 -> 9.1653410003064845E-3 | Q73: 1958 | R73: =Q73/B73 -> 2.8576015411783593E-2
A74: 72 | B74: 58192 | C74: 42796 | D74: =C74/B74 -> 0.73542755017871875 | E74: 5362 | F74: =E74/B74 -> 9.2143249931262022E-2 | G74: 199 | H74: =G74/B74 -> 3.4197140500412428E-3 | I74: 8772 | J74: =I74/B74 -> 0.15074237008523508 | K74: 20 | L74: =K74/B74 -> 3.4368985427550179E-4 | M74: 691 | N74: =M74/B74 -> 1.1874484465218587E-2 | O74: 352 | P74: =O74/B74 -> 6.0489414352488313E-3 | Q74: 1910 | R74: =Q74/B74 -> 3.2822381083310419E-2
A75: 73 | B75: 64576 | C75: 49149 | D75: =C75/B75 -> 0.761103196233895 | E75: 9206 | F75: =E75/B75 -> 0.14256070366699702 | G75: 344 | H75: =G75/B75 -> 5.3270564915758175E-3 | I75: 3339 | J75: =I75/B75 -> 5.1706516352824576E-2 | K75: 43 | L75: =K75/B75 -> 6.6588206144697719E-4 | M75: 2227 | N75: =M75/B75 -> 3.4486496531219026E-2 | O75: 268 | P75: =O75/B75 -> 4.1501486620416257E-3 | Q75: 4315 | R75: =Q75/B75 -> 6.6820490584737366E-2
A76: 74 | B76: 60905 | C76: 27468 | D76: =C76/B76 -> 0.4509974550529513 | E76: 30414 | F76: =E76/B76 -> 0.49936786799113375 | G76: 292 | H76: =G76/B76 -> 4.7943518594532469E-3 | I76: 1478 | J76: =I76/B76 -> 2.4267301535177737E-2 | K76: 29 | L76: =K76/B76 -> 4.7615138330186357E-4 | M76: 843 | N76: =M76/B76 -> 1.3841228142188654E-2 | O76: 381 | P76: =O76/B76 -> 6.2556440357934492E-3 | Q76: 1755 | R76: =Q76/B76 -> 2.8815368196371399E-2
A77: 75 | B77: 61698 | C77: 40391 | D77: =C77/B77 -> 0.65465655288664137 | E77: 19885 | F77: =E77/B77 -> 0.32229569840189309 | G77: 398 | H77: =G77/B77 -> 6.450776362280787E-3 | I77: 455 | J77: =I77/B77 -> 7.3746312684365781E-3 | K77: 31 | L77: =K77/B77 -> 5.0244740510227231E-4 | M77: 359 | N77: =M77/B77 -> 5.8186651107005093E-3 | O77: 179 | P77: =O77/B77 -> 2.9012285649453792E-3 | Q77: 876 | R77: =Q77/B77 -> 1.4198191189341632E-2
A78: 76 | B78: 58594 | C78: 26520 | D78: =C78/B78 -> 0.45260606888077276 | E78: 30179 | F78: =E78/B78 -> 0.515052735774994 | G78: 334 | H78: =G78/B78 -> 5.7002423456326582E-3 | I78: 738 | J78: =I78/B78 -> 1.2595146260709287E-2 | K78: 30 | L78: =K78/B78 -> 5.1199781547598734E-4 | M78: 471 | N78: =M78/B78 -> 8.0383657029730014E-3 | O78: 322 | P78: =O78/B78 -> 5.4954432194422639E-3 | Q78: 1200 | R78: =Q78/B78 -> 2.0479912619039493E-2
A79: 77 | B79: 59612 | C79: 26941 | D79: =C79/B79 -> 0.45193920687109979 | E79: 30073 | F79: =E79/B79 -> 0.50447896396698655 | G79: 525 | H79: =G79/B79 -> 8.806951620479099E-3 | I79: 743 | J79: =I79/B79 -> 1.2463933436220894E-2 | K79: 85 | L79: =K79/B79 -> 1.4258874052204254E-3 | M79: 869 | N79: =M79/B79 -> 1.4577601825135879E-2 | O79: 376 | P79: =O79/B79 -> 6.307454874857411E-3 | Q79: 1973 | R79: =Q79/B79 -> 3.3097362947057639E-2
A80: 78 | B80: 60623 | C80: 48236 | D80: =C80/B80 -> 0.79567160978506513 | E80: 9000 | F80: =E80/B80 -> 0.14845850584761558 | G80: 432 | H80: =G80/B80 -> 7.1260082806855482E-3 | I80: 2231 | J80: =I80/B80 -> 3.6801214060670044E-2 | K80: 89 | L80: =K80/B80 -> 1.468089668937532E-3 | M80: 402 | N80: =M80/B80 -> 6.6311465945268298E-3 | O80: 233 | P80: =O80/B80 -> 3.8434257624993815E-3 | Q80: 1834 | R80: =Q80/B80 -> 3.0252544413836333E-2
A81: 79 | B81: 61277 | C81: 37420 | D81: =C81/B81 -> 0.61066958238817171 | E81: 20508 | F81: =E81/B81 -> 0.33467695872839726 | G81: 395 | H81: =G81/B81 -> 6.4461380289505031E-3 | I81: 1916 | J81: =I81/B81 -> 3.1267849274605478E-2 | K81: 62 | L81: =K81/B81 -> 1.0117988804934966E-3 | M81: 553 | N81: =M81/B81 -> 9.0245932405307056E-3 | O81: 423 | P81: =O81/B81 -> 6.9030794588507919E-3 | Q81: 1796 | R81: =Q81/B81 -> 2.93095288607471E-2
A82: 80 | B82: 61247 | C82: 31051 | D82: =C82/B82 -> 0.50697993371103889 | E82: 25709 | F82: =E82/B82 -> 0.41975933515110947 | G82: 504 | H82: =G82/B82 -> 8.2289744803827128E-3 | I82: 2281 | J82: =I82/B82 -> 3.7242640455859059E-2 | K82: 52 | L82: =K82/B82 -> 8.4902117654742277E-4 | M82: 1161 | N82: =M82/B82 -> 1.8956030499453033E-2 | O82: 489 | P82: =O82/B82 -> 7.9840645256094179E-3 | Q82: 2899 | R82: =Q82/B82 -> 4.7332930592518814E-2
A83: 81 | B83: 61694 | C83: 47586 | D83: =C83/B83 -> 0.77132298116510523 | E83: 9094 | F83: =E83/B83 -> 0.1474049340292411 | G83: 434 | H83: =G83/B83 -> 7.0347197458423836E-3 | I83: 3312 | J83: =I83/B83 -> 5.3684312899147407E-2 | K83: 114 | L83: =K83/B83 -> 1.8478296106590592E-3 | M83: 826 | N83: =M83/B83 -> 1.3388660161441955E-2 | O83: 328 | P83: =O83/B83 -> 5.316562388562907E-3 | Q83: 2905 | R83: =Q83/B83 -> 4.7087237008461118E-2
A84: 82 | B84: 63166 | C84: 53768 | D84: =C84/B84 -> 0.85121742709685588 | E84: 5671 | F84: =E84/B84 -> 8.9779311655004274E-2 | G84: 447 | H84: =G84/B84 -> 7.0765918373808696E-3 | I84: 1756 | J84: =I84/B84 -> 2.7799765696735586E-2 | K84: 91 | L84: =K84/B84 -> 1.4406484501155684E-3 | M84: 1113 | N84: =M84/B84 -> 1.7620238736028877E-2 | O84: 320 | P84: =O84/B84 -> 5.0660165278789224E-3 | Q84: 2874 | R84: =Q84/B84 -> 4.549916094101257E-2
A85: 83 | B85: 63245 | C85: 48221 | D85: =C85/B85 -> 0.76244762431812796 | E85: 9455 | F85: =E85/B85 -> 0.14949798403035813 | G85: 534 | H85: =G85/B85 -> 8.4433552059451338E-3 | I85: 3431 | J85: =I85/B85 -> 5.4249347774527633E-2 | K85: 101 | L85: =K85/B85 -> 1.5969641868922445E-3 | M85: 1117 | N85: =M85/B85 -> 1.766147521543205E-2 | O85: 386 | P85: =O85/B85 -> 6.1032492687168949E-3 | Q85: 3215 | R85: =Q85/B85 -> 5.0834058028302632E-2
A86: 84 | B86: 58218 | C86: 34265 | D86: =C86/B86 -> 0.58856367446494207 | E86: 15359 | F86: =E86/B86 -> 0.26381875021471024 | G86: 527 | H86: =G86/B86 -> 9.0521831735889246E-3 | I86: 5532 | J86: =I86/B86 -> 9.5022158095434406E-2 | K86: 168 | L86: =K86/B86 -> 2.8857054519220858E-3 | M86: 1760 | N86: =M86/B86 -> 3.0231199972517091E-2 | O86: 607 | P86: =O86/B86 -> 1.0426328626885155E-2 | Q86: 4522 | R86: =Q86/B86 -> 7.7673571747569475E-2
A87: 85 | B87: 51484 | C87: 34533 | D87: =C87/B87 -> 0.67075207831559325 | E87: 6762 | F87: =E87/B87 -> 0.13134177608577421 | G87: 343 | H87: =G87/B87 -> 6.6622640043508662E-3 | I87: 6270 | J87: =I87/B87 -> 0.12178540905912516 | K87: 68 | L87: =K87/B87 -> 1.3207986947401135E-3 | M87: 3095 | N87: =M87/B87 -> 6.011576412089193E-2 | O87: 413 | P87: =O87/B87 -> 8.0219097195245118E-3 | Q87: 7142 | R87: =Q87/B87 -> 0.13872270996814545
A88: 86 | B88: 61234 | C88: 31211 | D88: =C88/B88 -> 0.50970049319005784 | E88: 6184 | F88: =E88/B88 -> 0.10098964627494529 | G88: 397 | H88: =G88/B88 -> 6.4833262566548E-3 | I88: 14699 | J88: =I88/B88 -> 0.24004637946239019 | K88: 56 | L88: =K88/B88 -> 9.1452461051050066E-4 | M88: 8073 | N88: =M88/B88 -> 0.13183852108305844 | O88: 614 | P88: =O88/B88 -> 1.002710912238299E-2 | Q88: 14906 | R88: =Q88/B88 -> 0.24342685436195577
A89: 87 | B89: 66736 | C89: 42002 | D89: =C89/B89 -> 0.62937544953248625 | E89: 17758 | F89: =E89/B89 -> 0.26609326300647329 | G89: 791 | H89: =G89/B89 -> 1.1852673219851355E-2 | I89: 2650 | J89: =I89/B89 -> 3.9708702948933111E-2 | K89: 203 | L89: =K89/B89 -> 3.0418364900503475E-3 | M89: 2135 | N89: =M89/B89 -> 3.1991728602253654E-2 | O89: 1197 | P89: =O89/B89 -> 1.793634619995205E-2 | Q89: 6066 | R89: =Q89/B89 -> 9.0895468712538965E-2
A90: 88 | B90: 57629 | C90: 41542 | D90: =C90/B90 -> 0.7208523486439119 | E90: 10896 | F90: =E90/B90 -> 0.18907147443127592 | G90: 473 | H90: =G90/B90 -> 8.207673220080168E-3 | I90: 2143 | J90: =I90/B90 -> 3.7186138923111629E-2 | K90: 110 | L90: =K90/B90 -> 1.908761213972132E-3 | M90: 2018 | N90: =M90/B90 -> 3.501709208905239E-2 | O90: 447 | P90: =O90/B90 -> 7.7565114785958459E-3 | Q90: 5251 | R90: =Q90/B90 -> 9.1117319405160602E-2
A91: 89 | B91: 63777 | C91: 26010 | D91: =C91/B91 -> 0.40782727315489908 | E91: 31818 | F91: =E91/B91 -> 0.4988945858224752 | G91: 520 | H91: =G91/B91 -> 8.1534095363532313E-3 | I91: 3038 | J91: =I91/B91 -> 4.7634727252771375E-2 | K91: 108 | L91: =K91/B91 -> 1.6934004421656711E-3 | M91: 1604 | N91: =M91/B91 -> 2.5150132492904965E-2 | O91: 679 | P91: =O91/B91 -> 1.0646471298430469E-2 | Q91: 3817 | R91: =Q91/B91 -> 5.9849161923577462E-2
A92: 90 | B92: 62256 | C92: 28023 | D92: =C92/B92 -> 0.45012528912875865 | E92: 30779 | F92: =E92/B92 -> 0.49439411462349009 | G92: 313 | H92: =G92/B92 -> 5.0276278591621692E-3 | I92: 1935 | J92: =I92/B92 -> 3.1081341557440245E-2 | K92: 79 | L92: =K92/B92 -> 1.2689539964019533E-3 | M92: 630 | N92: =M92/B92 -> 1.0119506553585197E-2 | O92: 497 | P92: =O92/B92 -> 7.9831662811616546E-3 | Q92: 1924 | R92: =Q92/B92 -> 3.0904651760472888E-2
A93: 91 | B93: 58530 | C93: 37992 | D93: =C93/B93 -> 0.64910302409021015 | E93: 15267 | F93: =E93/B93 -> 0.26084059456688879 | G93: 448 | H93: =G93/B93 -> 7.6541944302067318E-3 | I93: 2830 | J93: =I93/B93 -> 4.8351272851529133E-2 | K93: 104 | L93: =K93/B93 -> 1.7768665641551341E-3 | M93: 1374 | N93: =M93/B93 -> 2.3475140953357253E-2 | O93: 515 | P93: =O93/B93 -> 8.7989065436528281E-3 | Q93: 3089 | R93: =Q93/B93 -> 5.2776354006492394E-2
A94: 92 | B94: 61429 | C94: 27168 | D94: =C94/B94 -> 0.44226668186035911 | E94: 30841 | F94: =E94/B94 -> 0.50205928795845611 | G94: 520 | H94: =G94/B94 -> 8.4650572205310203E-3 | I94: 1294 | J94: =I94/B94 -> 2.1064969314167577E-2 | K94: 73 | L94: =K94/B94 -> 1.1883638021130086E-3 | M94: 815 | N94: =M94/B94 -> 1.326734929756304E-2 | O94: 718 | P94: =O94/B94 -> 1.1688290546810139E-2 | Q94: 2246 | R94: =Q94/B94 -> 3.6562535610216676E-2
A95: 93 | B95: 53944 | C95: 35261 | D95: =C95/B95 -> 0.65365935043749068 | E95: 4074 | F95: =E95/B95 -> 7.5522764348212965E-2 | G95: 278 | H95: =G95/B95 -> 5.1534925107518913E-3 | I95: 12800 | J95: =I95/B95 -> 0.23728310840872016 | K95: 51 | L95: =K95/B95 -> 9.4542488506599439E-4 | M95: 1129 | N95: =M95/B95 -> 2.0929111671362896E-2 | O95: 351 | P95: =O95/B95 -> 6.5067477383953728E-3 | Q95: 3456 | R95: =Q95/B95 -> 6.4066439270354436E-2
A96: 94 | B96: 59821 | C96: 36893 | D96: =C96/B96 -> 0.61672322428578596 | E96: 17623 | F96: =E96/B96 -> 0.29459554337105698 | G96: 499 | H96: =G96/B96 -> 8.3415522976881037E-3 | I96: 2448 | J96: =I96/B96 -> 4.0922084217916786E-2 | K96: 132 | L96: =K96/B96 -> 2.2065829725347284E-3 | M96: 1566 | N96: =M96/B96 -> 2.6178097992343826E-2 | O96: 660 | P96: =O96/B96 -> 1.1032914862673644E-2 | Q96: 4218 | R96: =Q96/B96 -> 7.0510355895087015E-2
A97: 95 | B97: 61009 | C97: 23743 | D97: =C97/B97 -> 0.38917208936386433 | E97: 34208 | F97: =E97/B97 -> 0.56070415840285859 | G97: 442 | H97: =G97/B97 -> 7.2448327295972729E-3 | I97: 1127 | J97: =I97/B97 -> 1.8472684358045534E-2 | K97: 68 | L97: =K97/B97 -> 1.1145896507072726E-3 | M97: 731 | N97: =M97/B97 -> 1.1981838745103182E-2 | O97: 690 | P97: =O97/B97 -> 1.1309806749823797E-2 | Q97: 1983 | R97: =Q97/B97 -> 3.2503401137537087E-2
A98: 96 | B98: 60460 | C98: 40462 | D98: =C98/B98 -> 0.6692358584187893 | E98: 14579 | F98: =E98/B98 -> 0.24113463446907046 | G98: 455 | H98: =G98/B98 -> 7.5256367846510087E-3 | I98: 2731 | J98: =I98/B98 -> 4.5170360568971224E-2 | K98: 132 | L98: =K98/B98 -> 2.1832616606020511E-3 | M98: 1593 | N98: =M98/B98 -> 2.6347998676811115E-2 | O98: 508 | P98: =O98/B98 -> 8.4022494211048633E-3 | Q98: 3702 | R98: =Q98/B98 -> 6.1230565663248429E-2
A99: 97 | B99: 60067 | C99: 46564 | D99: =C99/B99 -> 0.77520102552150094 | E99: 11222 | F99: =E99/B99 -> 0.18682471240448167 | G99: 721 | H99: =G99/B99 -> 1.2003263022957697E-2 | I99: 742 | J99: =I99/B99 -> 1.2352872625568116E-2 | K99: 39 | L99: =K99/B99 -> 6.4927497627649121E-4 | M99: 530 | N99: =M99/B99 -> 8.823480446834368E-3 | O99: 249 | P99: =O99/B99 -> 4.1453710023806748E-3 | Q99: 1424 | R99: =Q99/B99 -> 2.3706860672249322E-2
A100: 98 | B100: 63186 | C100: 50726 | D100: =C100/B100 -> 0.80280441870034502 | E100: 10634 | F100: =E100/B100 -> 0.16829677460196879 | G100: 655 | H100: =G100/B100 -> 1.0366220365270788E-2 | I100: 477 | J100: =I100/B100 -> 7.5491406324185734E-3 | K100: 36 | L100: =K100/B100 -> 5.6974646282404329E-4 | M100: 440 | N100: =M100/B100 -> 6.9635678789605289E-3 | O100: 218 | P100: =O100/B100 -> 3.4501313582122623E-3 | Q100: 1182 | R100: =Q100/B100 -> 1.870667552938942E-2
A101: 99 | B101: 63778 | C101: 46921 | D101: =C101/B101 -> 0.7356925585625137 | E101: 14692 | F101: =E101/B101 -> 0.23036156668443664 | G101: 531 | H101: =G101/B101 -> 8.325754962526263E-3 | I101: 580 | J101: =I101/B101 -> 9.0940449684844306E-3 | K101: 33 | L101: =K101/B101 -> 5.1741979993101073E-4 | M101: 820 | N101: =M101/B101 -> 1.2857098058891781E-2 | O101: 201 | P101: =O101/B101 -> 3.1515569632161559E-3 | Q101: 1957 | R101: =Q101/B101 -> 3.0684562074696605E-2
A102: 100 | B102: 61552 | C102: 41405 | D102: =C102/B102 -> 0.67268325968286979 | E102: 15770 | F102: =E102/B102 -> 0.25620613465037689 | G102: 588 | H102: =G102/B102 -> 9.5528983623602813E-3 | I102: 1470 | J102: =I102/B102 -> 2.3882245905900702E-2 | K102: 115 | L102: =K102/B102 -> 1.8683389654276059E-3 | M102: 1898 | N102: =M102/B102 -> 3.083571614244866E-2 | O102: 306 | P102: =O102/B102 -> 4.9714062906160645E-3 | Q102: 4171 | R102: =Q102/B102 -> 6.7763841954769949E-2

A1: HB 5002 University of Richmond House Plan Election Data
A2: DISTRICT | B2: Rep. Gov '09 | C2: Dem. Gov '09 | D2: Rep. Lt. Gov '09 | E2: Dem. Lt. Gov '09 | F2: Rep. Att. Gen. '09 | G2: Dem. Att. Gen. '09
A3: 1 | B3: 0.73305526590198122 | C3: 0.26694473409801878 | D3: 0.74355273890945595 | E3: 0.256447261090544 | F3: 0.73167811456298448 | G3: 0.26832188543701557
A4: 2 | B4: 0.64901149946184788 | C4: 0.35098850053815217 | D4: 0.65347230354842489 | E4: 0.34652769645157511 | F4: 0.6331427223958026 | G4: 0.3668572776041974
A5: 3 | B5: 0.73438232689001204 | C5: 0.26561767310998802 | D5: 0.72099491842738705 | E5: 0.279005081572613 | F5: 0.70792910953335864 | G5: 0.29207089046664136
A6: 4 | B6: 0.74261943102522809 | C6: 0.25738056897477185 | D6: 0.7576056029765813 | E6: 0.2423943970234187 | F6: 0.74712076340901612 | G6: 0.25287923659098388
A7: 5 | B7: 0.72324048950661723 | C7: 0.27675951049338282 | D7: 0.71298533460695623 | E7: 0.28701466539304377 | F7: 0.71206291727961979 | G7: 0.28793708272038021
A8: 6 | B8: 0.63788993678101358 | C8: 0.36211006321898642 | D8: 0.61945928953159379 | E8: 0.38054071046840615 | F8: 0.63271426316620194 | G8: 0.36728573683379806
A9: 7 | B9: 0.51995411459276697 | C9: 0.48004588540723298 | D9: 0.50634455832113223 | E9: 0.49365544167886777 | F9: 0.52144345055752972 | G9: 0.47855654944247028
A10: 8 | B10: 0.67063010596133621 | C10: 0.32936989403866374 | D10: 0.65698146944083224 | E10: 0.34301853055916776 | F10: 0.6756305260155645 | G10: 0.3243694739844355
A11: 9 | B11: 0.68622461228213372 | C11: 0.31377538771786623 | D11: 0.66644018442125696 | E11: 0.33355981557874304 | F11: 0.68262186187359575 | G11: 0.3173781381264042
A12: 10 | B12: 0.61612540795035042 | C12: 0.38387459204964958 | D12: 0.60712721699146044 | E12: 0.39287278300853951 | F12: 0.61233845134209652 | G12: 0.38766154865790348
A13: 11 | B13: 0.46965743156959638 | C13: 0.53034256843040362 | D13: 0.46129837702871412 | E13: 0.53870162297128588 | F13: 0.47997734352874538 | G13: 0.52002265647125456
A14: 12 | B14: 0.56550819672131147 | C14: 0.43449180327868853 | D14: 0.60141330113153535 | E14: 0.3985866988684646 | F14: 0.61617838395621161 | G14: 0.38382161604378839
A15: 13 | B15: 0.65351357934478138 | C15: 0.34648642065521862 | D15: 0.62933889365877593 | E15: 0.37066110634122407 | F15: 0.63708885616102107 | G15: 0.36291114383897888
A16: 14 | B16: 0.63767609151763416 | C16: 0.3623239084823659 | D16: 0.63966984782047975 | E16: 0.36033015217952025 | F16: 0.6455709271112946 | G16: 0.35442907288870534
A17: 15 | B17: 0.68610917074144295 | C17: 0.31389082925855705 | D17: 0.66199392712550609 | E17: 0.33800607287449391 | F17: 0.66465883782142132 | G17: 0.33534116217857868
A18: 16 | B18: 0.76283097569822267 | C18: 0.2371690243017773 | D18: 0.74841931641161918 | E18: 0.25158068358838082 | F18: 0.76288139481532458 | G18: 0.2371186051846754
A19: 17 | B19: 0.69508943720005822 | C19: 0.30491056279994183 | D19: 0.67591868647380771 | E19: 0.32408131352619235 | F19: 0.69534417900239387 | G19: 0.30465582099760613
A20: 18 | B20: 0.65382658959537576 | C20: 0.34617341040462429 | D20: 0.63713139231056359 | E20: 0.36286860768943635 | F20: 0.63616425571628554 | G20: 0.3638357442837144
A21: 19 | B21: 0.67406790252030824 | C21: 0.32593209747969171 | D21: 0.67303152925307708 | E21: 0.32696847074692292 | F21: 0.68631587830710161 | G21: 0.31368412169289844
A22: 20 | B22: 0.68348592743302816 | C22: 0.31651407256697184 | D22: 0.69096010401697117 | E22: 0.30903989598302883 | F22: 0.69858788044968467 | G22: 0.30141211955031533
A23: 21 | B23: 0.62010087212356835 | C23: 0.37989912787643165 | D23: 0.56471726510427867 | E23: 0.43528273489572133 | F23: 0.60153400557820214 | G23: 0.39846599442179792
A24: 22 | B24: 0.65706066167352806 | C24: 0.34293933832647189 | D24: 0.65584152396392748 | E24: 0.34415847603607252 | F24: 0.66868882544861341 | G24: 0.33131117455138664
A25: 23 | B25: 0.63022287533676213 | C25: 0.36977712466323781 | D25: 0.61960413765665412 | E25: 0.38039586234334594 | F25: 0.62925441660844394 | G25: 0.37074558339155606
A26: 24 | B26: 0.58269834155087408 | C26: 0.41730165844912598 | D26: 0.56335624336915913 | E26: 0.43664375663084093 | F26: 0.57332045799420606 | G26: 0.42667954200579389
A27: 25 | B27: 0.76427410217252079 | C27: 0.23572589782747919 | D27: 0.76617683686176841 | E27: 0.23382316313823162 | F27: 0.76658685024443785 | G27: 0.23341314975556221
A28: 26 | B28: 0.77081250892474651 | C28: 0.22918749107525346 | D28: 0.76067058483476246 | E28: 0.23932941516523751 | F28: 0.75536377223856133 | G28: 0.2446362277614387
A29: 27 | B29: 0.60121681415929207 | C29: 0.39878318584070799 | D29: 0.57704735938604468 | E29: 0.42295264061395538 | F29: 0.60109179134654267 | G29: 0.39890820865345733
A30: 28 | B30: 0.63272580923359978 | C30: 0.36727419076640028 | D30: 0.61827393431167021 | E30: 0.38172606568832984 | F30: 0.60539973176278505 | G30: 0.394600268237215
A31: 29 | B31: 0.71036325393667221 | C31: 0.28963674606332784 | D31: 0.68790248390064401 | E31: 0.31209751609935604 | F31: 0.68781973903546589 | G31: 0.31218026096453411
A32: 30 | B32: 0.71023421023421018 | C32: 0.28976578976578976 | D32: 0.69108244531688168 | E32: 0.30891755468311832 | F32: 0.6978372926938593 | G32: 0.30216270730614075
A33: 31 | B33: 0.51085983893272591 | C33: 0.48914016106727404 | D33: 0.48042267365661862 | E33: 0.51957732634338138 | F33: 0.48990645002461841 | G33: 0.51009354997538159
A34: 32 | B34: 0.61297215762679902 | C34: 0.38702784237320093 | D34: 0.58475006343567626 | E34: 0.4152499365643238 | F34: 0.586472819216182 | G34: 0.41352718078381795
A35: 33 | B35: 0.62356436775041424 | C35: 0.37643563224958576 | D35: 0.60398090088017031 | E35: 0.39601909911982974 | F35: 0.60326399264452357 | G35: 0.39673600735547637
A36: 34 | B36: 0.5685110211426001 | C36: 0.4314889788573999 | D36: 0.54746907146417723 | E36: 0.45253092853582272 | F36: 0.53994740183186718 | G36: 0.46005259816813276
A37: 35 | B37: 0.52057561221913662 | C37: 0.47942438778086344 | D37: 0.49408572518760335 | E37: 0.5059142748123967 | F37: 0.45980271792049449 | G37: 0.54019728207950557
A38: 36 | B38: 0.43959601816951771 | C38: 0.56040398183048223 | D38: 0.41497424934408705 | E38: 0.58502575065591289 | F38: 0.41191369149091617 | G38: 0.58808630850908383
A39: 37 | B39: 0.52442260997233048 | C39: 0.47557739002766952 | D39: 0.50071091395097533 | E39: 0.49928908604902461 | F39: 0.48925864721636558 | G39: 0.51074135278363442
A40: 38 | B40: 0.43066825775656326 | C40: 0.56933174224343674 | D40: 0.40451472718493481 | E40: 0.59548527281506514 | F40: 0.39970982952484585 | G40: 0.60029017047515421
A41: 39 | B41: 0.50853727945361415 | C41: 0.4914627205463859 | D41: 0.48158575122091352 | E41: 0.51841424877908648 | F41: 0.47969674343805641 | G41: 0.52030325656194365
A42: 40 | B42: 0.57316392069254396 | C42: 0.42683607930745604 | D42: 0.54971910112359545 | E42: 0.45028089887640449 | F42: 0.55301060914775524 | G42: 0.44698939085224476
A43: 41 | B43: 0.53512190700625395 | C43: 0.46487809299374605 | D43: 0.50704610753865098 | E43: 0.49295389246134902 | F43: 0.50591189226204059 | G43: 0.49408810773795936
A44: 42 | B44: 0.53238460135011856 | C44: 0.46761539864988139 | D44: 0.50385368240763395 | E44: 0.49614631759236605 | F44: 0.50671243793293697 | G44: 0.49328756206706309
A45: 43 | B45: 0.46176062204943069 | C45: 0.53823937795056931 | D45: 0.4388609715242881 | E45: 0.56113902847571184 | F45: 0.43419138220481251 | G45: 0.56580861779518743
A46: 44 | B46: 0.46639770676292602 | C46: 0.53360229323707398 | D46: 0.44259229577389542 | E46: 0.55740770422610464 | F46: 0.43834956652038959 | G46: 0.56165043347961041
A47: 45 | B47: 0.38015650250914351 | C47: 0.61984349749085654 | D47: 0.35717653109330133 | E47: 0.64282346890669861 | F47: 0.35526711651695536 | G47: 0.64473288348304469
A48: 46 | B48: 0.35183349851337958 | C48: 0.64816650148662036 | D48: 0.3356968407783818 | E48: 0.6643031592216182 | F48: 0.33137920394939835 | G48: 0.66862079605060165
A49: 47 | B49: 0.3276346258067695 | C49: 0.6723653741932305 | D49: 0.30937251787132647 | E49: 0.69062748212867353 | F49: 0.3082856431948246 | G49: 0.69171435680517546
A50: 48 | B50: 0.38979642094894107 | C50: 0.61020357905105893 | D50: 0.37083901914568085 | E50: 0.62916098085431915 | F50: 0.36238418266048972 | G50: 0.63761581733951023
A51: 49 | B51: 0.33254645141638745 | C51: 0.6674535485836125 | D51: 0.3112633767033644 | E51: 0.68873662329663565 | F51: 0.31525763653193462 | G51: 0.68474236346806538
A52: 50 | B52: 0.6320966135458167 | C52: 0.36790338645418325 | D52: 0.61208894456623864 | E52: 0.38791105543376136 | F52: 0.60510312833051216 | G52: 0.39489687166948778
A53: 51 | B53: 0.55296541953763922 | C53: 0.44703458046236072 | D53: 0.52048145991069694 | E53: 0.47951854008930306 | F53: 0.5306969205834684 | G53: 0.4693030794165316
A54: 52 | B54: 0.48217750995812481 | C54: 0.51782249004187519 | D54: 0.44644696189495364 | E54: 0.5535530381050463 | F54: 0.46396210873146621 | G54: 0.53603789126853374
A55: 53 | B55: 0.42761506276150629 | C55: 0.57238493723849371 | D55: 0.40528386734120292 | E55: 0.59471613265879708 | F55: 0.39985351287396476 | G55: 0.60014648712603524
A56: 54 | B56: 0.66677221201950476 | C56: 0.33322778798049524 | D56: 0.65160135523876495 | E56: 0.34839864476123505 | F56: 0.63734152900499419 | G56: 0.36265847099500576
A57: 55 | B57: 0.74570618003373712 | C57: 0.25429381996626282 | D57: 0.71776990059335743 | E57: 0.28223009940664251 | F57: 0.74015444015444021 | G57: 0.25984555984555985
A58: 56 | B58: 0.72061068702290076 | C58: 0.27938931297709924 | D58: 0.6959735292853767 | E58: 0.30402647071462335 | F58: 0.72340609093262009 | G58: 0.27659390906737985
A59: 57 | B59: 0.35869393764130608 | C59: 0.64130606235869392 | D59: 0.3375826500925681 | E59: 0.66241734990743195 | F59: 0.35173183170420741 | G59: 0.64826816829579259
A60: 58 | B60: 0.63019246023462616 | C60: 0.36980753976537384 | D60: 0.60235771327164411 | E60: 0.39764228672835594 | F60: 0.62035349468062562 | G60: 0.37964650531937438
A61: 59 | B61: 0.65841683366733472 | C61: 0.34158316633266533 | D61: 0.628883803712179 | E61: 0.371116196287821 | F61: 0.65449165943988163 | G61: 0.34550834056011837
A62: 60 | B62: 0.64479054779806655 | C62: 0.3552094522019334 | D62: 0.65250815773463855 | E62: 0.34749184226536145 | F62: 0.66191638017078847 | G62: 0.33808361982921148
A63: 61 | B63: 0.53487492571181583 | C63: 0.46512507428818411 | D63: 0.52531258682967485 | E63: 0.47468741317032509 | F63: 0.54458616620778788 | G63: 0.45541383379221217
A64: 62 | B64: 0.62120163908253956 | C64: 0.3787983609174605 | D64: 0.59326508620689655 | E64: 0.40673491379310345 | F64: 0.62009936278215794 | G64: 0.37990063721784212
A65: 63 | B65: 0.50855759810983692 | C65: 0.49144240189016308 | D65: 0.4889111714049782 | E65: 0.5110888285950218 | F65: 0.50942058945130231 | G65: 0.49057941054869764
A66: 64 | B66: 0.63292570567049167 | C66: 0.36707429432950833 | D66: 0.60029498525073743 | E66: 0.39970501474926251 | F66: 0.61169040352661919 | G66: 0.38830959647338081
A67: 65 | B67: 0.71367887922231754 | C67: 0.28632112077768246 | D67: 0.68415663144097649 | E67: 0.31584336855902351 | F67: 0.71039888378200922 | G67: 0.28960111621799078
A68: 66 | B68: 0.71796559592768128 | C68: 0.28203440407231878 | D68: 0.69234840132304298 | E68: 0.30765159867695702 | F68: 0.71601941747572817 | G68: 0.28398058252427183
A69: 67 | B69: 0.58408777504646558 | C69: 0.41591222495353436 | D69: 0.55808202653799754 | E69: 0.4419179734620024 | F69: 0.55874547647768391 | G69: 0.44125452352231603
A70: 68 | B70: 0.67264010580261202 | C70: 0.32735989419738798 | D70: 0.6465242769965508 | E70: 0.3534757230034492 | F70: 0.66672207446808507 | G70: 0.33327792553191488
A71: 69 | B71: 0.2929325231851615 | C71: 0.7070674768148385 | D71: 0.28250514933058701 | E71: 0.71749485066941299 | F71: 0.30194406768714072 | G71: 0.69805593231285923
A72: 70 | B72: 0.32422462084984288 | C72: 0.67577537915015717 | D72: 0.31605177545511176 | E72: 0.68394822454488824 | F72: 0.33829358180933178 | G72: 0.66170641819066822
A73: 71 | B73: 0.17995976377441755 | C73: 0.82004023622558242 | D73: 0.18250525762355416 | E73: 0.81749474237644582 | F73: 0.1999337528983107 | G73: 0.80006624710168928
A74: 72 | B74: 0.69535538028688715 | C74: 0.30464461971311285 | D74: 0.66304146612365789 | E74: 0.33695853387634211 | F74: 0.6824042296632965 | G74: 0.31759577033670344
A75: 73 | B75: 0.61860588391200633 | C75: 0.38139411608799362 | D75: 0.58891649658354783 | E75: 0.41108350341645222 | F75: 0.60861631581289777 | G75: 0.39138368418710223
A76: 74 | B76: 0.37887363147151604 | C76: 0.62112636852848391 | D76: 0.36559390910364797 | E76: 0.63440609089635203 | F76: 0.383295033531867 | G76: 0.616704966468133
A77: 75 | B77: 0.62415939183826907 | C77: 0.37584060816173093 | D77: 0.60360551431601273 | E77: 0.39639448568398727 | F77: 0.6153944781605265 | G77: 0.38460552183947344
A78: 76 | B78: 0.45114879649890594 | C78: 0.54885120350109406 | D78: 0.42317365954041386 | E78: 0.57682634045958614 | F78: 0.44921388983146704 | G78: 0.55078611016853296
A79: 77 | B79: 0.40855329101236215 | C79: 0.59144670898763785 | D79: 0.38019869818430968 | E79: 0.61980130181569026 | F79: 0.39881362946613325 | G79: 0.6011863705338667
A80: 78 | B80: 0.71959318255700555 | C80: 0.28040681744299445 | D80: 0.67541495247552841 | E80: 0.32458504752447154 | F80: 0.70558712121212119 | G80: 0.29441287878787881
A81: 79 | B81: 0.57851889541606916 | C81: 0.42148110458393079 | D81: 0.54203550185003047 | E81: 0.45796449814996953 | F81: 0.55914585391091676 | G81: 0.4408541460890833
A82: 80 | B82: 0.45733629041671531 | C82: 0.54266370958328469 | D82: 0.42998551424432641 | E82: 0.57001448575567359 | F82: 0.45520318340769322 | G82: 0.54479681659230672
A83: 81 | B83: 0.70403130695829308 | C83: 0.29596869304170687 | D83: 0.64465202665792631 | E83: 0.35534797334207363 | F83: 0.68445488311120817 | G83: 0.31554511688879178
A84: 82 | B84: 0.66931312948008348 | C84: 0.33068687051991652 | D84: 0.60016613595458945 | E84: 0.39983386404541049 | F84: 0.64457886959734023 | G84: 0.35542113040265977
A85: 83 | B85: 0.65615204736554056 | C85: 0.34384795263445944 | D85: 0.59575766824355258 | E85: 0.40424233175644742 | F85: 0.63834853090172239 | G85: 0.36165146909827761
A86: 84 | B86: 0.56265694613203732 | C86: 0.43734305386796274 | D86: 0.50732966849908379 | E86: 0.49267033150091621 | F86: 0.54677392602421626 | G86: 0.45322607397578374
A87: 85 | B87: 0.6484825777444736 | C87: 0.3515174222555264 | D87: 0.62179873455860202 | E87: 0.37820126544139804 | F87: 0.62572526561675834 | G87: 0.37427473438324166
A88: 86 | B88: 0.50153919014918302 | C88: 0.49846080985081698 | D88: 0.47012428298279157 | E88: 0.52987571701720837 | F88: 0.47229762094842725 | G88: 0.52770237905157269
A89: 87 | B89: 0.53139472267097465 | C89: 0.46860527732902529 | D89: 0.47720230190349711 | E89: 0.52279769809650289 | F89: 0.50921531839752787 | G89: 0.49078468160247213
A90: 88 | B90: 0.6764086687306502 | C90: 0.32359133126934986 | D90: 0.64909534840042571 | E90: 0.35090465159957429 | F90: 0.64757324005247052 | G90: 0.35242675994752953
A91: 89 | B91: 0.36275481313703284 | C91: 0.63724518686296716 | D91: 0.32579086115992972 | E91: 0.67420913884007028 | F91: 0.35222939278380755 | G91: 0.6477706072161924
A92: 90 | B92: 0.33920735529706764 | C92: 0.66079264470293242 | D92: 0.3087759649248904 | E92: 0.69122403507510966 | F92: 0.33131356849166849 | G92: 0.66868643150833151
A93: 91 | B93: 0.62966241737488193 | C93: 0.37033758262511801 | D93: 0.59369797859690843 | E93: 0.40630202140309157 | F93: 0.60852713178294571 | G93: 0.39147286821705424
A94: 92 | B94: 0.42194230874093464 | C94: 0.57805769125906536 | D94: 0.38974358974358975 | E94: 0.61025641025641031 | F94: 0.40689112472598504 | G94: 0.5931088752740149
A95: 93 | B95: 0.65379612514547825 | C95: 0.34620387485452181 | D95: 0.62691089381627874 | E95: 0.37308910618372126 | F95: 0.62506027416132814 | G95: 0.37493972583867191
A96: 94 | B96: 0.5794034425842961 | C96: 0.42059655741570384 | D96: 0.5456713570236108 | E96: 0.4543286429763892 | F96: 0.55890099365497425 | G96: 0.44109900634502575
A97: 95 | B97: 0.36945344808315639 | C97: 0.63054655191684361 | D97: 0.34922901199314677 | E97: 0.65077098800685318 | F97: 0.36422586939056584 | G97: 0.63577413060943422
A98: 96 | B98: 0.62158705170462936 | C98: 0.3784129482953707 | D98: 0.58713415540038627 | E98: 0.41286584459961373 | F98: 0.60074534161490678 | G98: 0.39925465838509316
A99: 97 | B99: 0.69536892791389326 | C99: 0.30463107208610679 | D99: 0.67644397885814966 | E99: 0.32355602114185039 | F99: 0.68798930685506965 | G99: 0.3120106931449303
A100: 98 | B100: 0.69027003857693958 | C100: 0.30972996142306042 | D100: 0.66113014441216011 | E100: 0.33886985558783989 | F100: 0.67240174672489084 | G100: 0.32759825327510916
A101: 99 | B101: 0.65840157372249419 | C101: 0.34159842627750581 | D101: 0.63767441860465113 | E101: 0.36232558139534882 | F101: 0.64669824463638892 | G101: 0.35330175536361103
A102: 100 | B102: 0.59063591093812606 | C102: 0.40936408906187394 | D102: 0.55658442243450745 | E102: 0.4434155775654926 | F102: 0.57324991146263726 | G102: 0.42675008853736279