A1: SB____ J. Watkins Population Totals
A2: DISTRICT | B2: Total Population | C2: Target | D2: Difference | E2: Deviation
A3: 1 | B3: 200951 | C3: 200025.60000000001 | D3: =B3-C3 -> 925.39999999999418 | E3: =(B3-C3)/C3 -> 4.6264078197990367E-3
A4: 2 | B4: 200458 | C4: 200025.60000000001 | D4: =B4-C4 -> 432.39999999999418 | E4: =(B4-C4)/C4 -> 2.1617232994176456E-3
A5: 3 | B5: 200796 | C5: 200025.60000000001 | D5: =B5-C5 -> 770.39999999999418 | E5: =(B5-C5)/C5 -> 3.8515070071030617E-3
A6: 4 | B6: 200590 | C6: 200025.60000000001 | D6: =B6-C6 -> 564.39999999999418 | E6: =(B6-C6)/C6 -> 2.8216388302297014E-3
A7: 5 | B7: 199721 | C7: 200025.60000000001 | D7: =B7-C7 -> -304.60000000000582 | E7: =(B7-C7)/C7 -> -1.5228050809496674E-3
A8: 6 | B8: 199320 | C8: 200025.60000000001 | D8: =B8-C8 -> -705.60000000000582 | E8: =(B8-C8)/C8 -> -3.5275484737953833E-3
A9: 7 | B9: 199613 | C9: 200025.60000000001 | D9: =B9-C9 -> -412.60000000000582 | E9: =(B9-C9)/C9 -> -2.0627359697958951E-3
A10: 8 | B10: 199296 | C10: 200025.60000000001 | D10: =B10-C10 -> -729.60000000000582 | E10: =(B10-C10)/C10 -> -3.6475331157612115E-3
A11: 9 | B11: 200151 | C11: 200025.60000000001 | D11: =B11-C11 -> 125.39999999999418 | E11: =(B11-C11)/C11 -> 6.2691975427142416E-4
A12: 10 | B12: 199756 | C12: 200025.60000000001 | D12: =B12-C12 -> -269.60000000000582 | E12: =(B12-C12)/C12 -> -1.3478274780828344E-3
A13: 11 | B13: 199415 | C13: 200025.60000000001 | D13: =B13-C13 -> -610.60000000000582 | E13: =(B13-C13)/C13 -> -3.052609266013979E-3
A14: 12 | B14: 200448 | C14: 200025.60000000001 | D14: =B14-C14 -> 422.39999999999418 | E14: =(B14-C14)/C14 -> 2.1117296985985502E-3
A15: 13 | B15: 199268 | C15: 200025.60000000001 | D15: =B15-C15 -> -757.60000000000582 | E15: =(B15-C15)/C15 -> -3.7875151980546781E-3
A16: 14 | B16: 199933 | C16: 200025.60000000001 | D16: =B16-C16 -> -92.600000000005821 | E16: =(B16-C16)/C16 -> -4.6294074358485022E-4
A17: 15 | B17: 199205 | C17: 200025.60000000001 | D17: =B17-C17 -> -820.60000000000582 | E17: =(B17-C17)/C17 -> -4.1024748832149778E-3
A18: 16 | B18: 200423 | C18: 200025.60000000001 | D18: =B18-C18 -> 397.39999999999418 | E18: =(B18-C18)/C18 -> 1.9867456965508125E-3
A19: 17 | B19: 200935 | C19: 200025.60000000001 | D19: =B19-C19 -> 909.39999999999418 | E19: =(B19-C19)/C19 -> 4.546418058488484E-3
A20: 18 | B20: 200337 | C20: 200025.60000000001 | D20: =B20-C20 -> 311.39999999999418 | E20: =(B20-C20)/C20 -> 1.5568007295065939E-3
A21: 19 | B21: 200846 | C21: 200025.60000000001 | D21: =B21-C21 -> 820.39999999999418 | E21: =(B21-C21)/C21 -> 4.1014750111985371E-3
A22: 20 | B22: 200576 | C22: 200025.60000000001 | D22: =B22-C22 -> 550.39999999999418 | E22: =(B22-C22)/C22 -> 2.7516477890829681E-3
A23: 21 | B23: 200674 | C23: 200025.60000000001 | D23: =B23-C23 -> 648.39999999999418 | E23: =(B23-C23)/C23 -> 3.2415850771101008E-3
A24: 22 | B24: 199707 | C24: 200025.60000000001 | D24: =B24-C24 -> -318.60000000000582 | E24: =(B24-C24)/C24 -> -1.5927961220964008E-3
A25: 23 | B25: 200986 | C25: 200025.60000000001 | D25: =B25-C25 -> 960.39999999999418 | E25: =(B25-C25)/C25 -> 4.8013854226658693E-3
A26: 24 | B26: 199318 | C26: 200025.60000000001 | D26: =B26-C26 -> -707.60000000000582 | E26: =(B26-C26)/C26 -> -3.5375471939592023E-3
A27: 25 | B27: 199502 | C27: 200025.60000000001 | D27: =B27-C27 -> -523.60000000000582 | E27: =(B27-C27)/C27 -> -2.6176649388878516E-3
A28: 26 | B28: 199456 | C28: 200025.60000000001 | D28: =B28-C28 -> -569.60000000000582 | E28: =(B28-C28)/C28 -> -2.847635502655689E-3
A29: 27 | B29: 200966 | C29: 200025.60000000001 | D29: =B29-C29 -> 940.39999999999418 | E29: =(B29-C29)/C29 -> 4.7013982210276795E-3
A30: 28 | B30: 199947 | C30: 200025.60000000001 | D30: =B30-C30 -> -78.600000000005821 | E30: =(B30-C30)/C30 -> -3.9294970243811703E-4
A31: 29 | B31: 200860 | C31: 200025.60000000001 | D31: =B31-C31 -> 834.39999999999418 | E31: =(B31-C31)/C31 -> 4.1714660523452709E-3
A32: 30 | B32: 200570 | C32: 200025.60000000001 | D32: =B32-C32 -> 544.39999999999418 | E32: =(B32-C32)/C32 -> 2.7216516285915112E-3
A33: 31 | B33: 200819 | C33: 200025.60000000001 | D33: =B33-C33 -> 793.39999999999418 | E33: =(B33-C33)/C33 -> 3.9664922889869805E-3
A34: 32 | B34: 199677 | C34: 200025.60000000001 | D34: =B34-C34 -> -348.60000000000582 | E34: =(B34-C34)/C34 -> -1.7427769245536861E-3
A35: 33 | B35: 199217 | C35: 200025.60000000001 | D35: =B35-C35 -> -808.60000000000582 | E35: =(B35-C35)/C35 -> -4.042482562232063E-3
A36: 34 | B36: 199089 | C36: 200025.60000000001 | D36: =B36-C36 -> -936.60000000000582 | E36: =(B36-C36)/C36 -> -4.6824006527164813E-3
A37: 35 | B37: 199365 | C37: 200025.60000000001 | D37: =B37-C37 -> -660.60000000000582 | E37: =(B37-C37)/C37 -> -3.3025772701094549E-3
A38: 36 | B38: 199151 | C38: 200025.60000000001 | D38: =B38-C38 -> -874.60000000000582 | E38: =(B38-C38)/C38 -> -4.3724403276380911E-3
A39: 37 | B39: 200814 | C39: 200025.60000000001 | D39: =B39-C39 -> 788.39999999999418 | E39: =(B39-C39)/C39 -> 3.9414954885774326E-3
A40: 38 | B40: 200322 | C40: 200025.60000000001 | D40: =B40-C40 -> 296.39999999999418 | E40: =(B40-C40)/C40 -> 1.4818103282779513E-3
A41: 39 | B41: 199453 | C41: 200025.60000000001 | D41: =B41-C41 -> -572.60000000000582 | E41: =(B41-C41)/C41 -> -2.8626335829014175E-3
A42: 40 | B42: 199093 | C42: 200025.60000000001 | D42: =B42-C42 -> -932.60000000000582 | E42: =(B42-C42)/C42 -> -4.6624032123888434E-3

A1: SB____ J. Watkins Racial Demographics
A2: DISTRICT | B2: Total Population | C2: White | D2: % White | E2: Black | F2: % Black | G2: AIAN | H2: % AIAN | I2: Asian | J2: % Asian | K2: HawPI | L2: % HawPI | M2: Other | N2: % Other | O2: Multi | P2: % Multi | Q2: Total Hispanic | R2: % Hispanic
A3: 1 | B3: 200951 | C3: 138208 | D3: =C3/B3 -> 0.68776965528910028 | E3: 41924 | F3: =E3/B3 -> 0.20862797398370747 | G3: 1657 | H3: =G3/B3 -> 8.2457912625465909E-3 | I3: 12163 | J3: =I3/B3 -> 6.0527193196351352E-2 | K3: 354 | L3: =K3/B3 -> 1.7616234803509313E-3 | M3: 4977 | N3: =M3/B3 -> 2.4767231812730467E-2 | O3: 1668 | P3: =O3/B3 -> 8.3005309752128623E-3 | Q3: 13091 | R3: =Q3/B3 -> 6.5145234410378644E-2
A4: 2 | B4: 200458 | C4: 150751 | D4: =C4/B4 -> 0.7520328447854413 | E4: 31129 | F4: =E4/B4 -> 0.15528938730307595 | G4: 1568 | H4: =G4/B4 -> 7.8220874198086376E-3 | I4: 10134 | J4: =I4/B4 -> 5.0554230811441801E-2 | K4: 433 | L4: =K4/B4 -> 2.1600534775364417E-3 | M4: 4512 | N4: =M4/B4 -> 2.2508455636592203E-2 | O4: 1931 | P4: =O4/B4 -> 9.6329405661036219E-3 | Q4: 12969 | R4: =Q4/B4 -> 6.4696844226720812E-2
A5: 3 | B5: 200796 | C5: 132920 | D5: =C5/B5 -> 0.66196537779637044 | E5: 45738 | F5: =E5/B5 -> 0.22778342198051754 | G5: 1541 | H5: =G5/B5 -> 7.6744556664475388E-3 | I5: 14877 | J5: =I5/B5 -> 7.4090121317157712E-2 | K5: 333 | L5: =K5/B5 -> 1.6583995697125441E-3 | M5: 3503 | N5: =M5/B5 -> 1.7445566644753878E-2 | O5: 1884 | P5: =O5/B5 -> 9.3826570250403387E-3 | Q5: 11378 | R5: =Q5/B5 -> 5.6664475387955937E-2
A6: 4 | B6: 200590 | C6: 73424 | D6: =C6/B6 -> 0.3660401814646792 | E6: 119957 | F6: =E6/B6 -> 0.59802083852634724 | G6: 1209 | H6: =G6/B6 -> 6.0272197018794559E-3 | I6: 2176 | J6: =I6/B6 -> 1.0847998404706117E-2 | K6: 186 | L6: =K6/B6 -> 9.2726456951991627E-4 | M6: 2122 | N6: =M6/B6 -> 1.0578792561942271E-2 | O6: 1516 | P6: =O6/B6 -> 7.5577047709257687E-3 | Q6: 5524 | R6: =Q6/B6 -> 2.7538760656064608E-2
A7: 5 | B7: 199721 | C7: 68235 | D7: =C7/B7 -> 0.34165160398756267 | E7: 117233 | F7: =E7/B7 -> 0.58698384246023205 | G7: 1270 | H7: =G7/B7 -> 6.3588706245212073E-3 | I7: 6311 | J7: =I7/B7 -> 3.1599080717601057E-2 | K7: 299 | L7: =K7/B7 -> 1.4970884383715282E-3 | M7: 3857 | N7: =M7/B7 -> 1.9311940156518343E-2 | O7: 2516 | P7: =O7/B7 -> 1.2597573615193194E-2 | Q7: 10264 | R7: =Q7/B7 -> 5.1391691409516278E-2
A8: 6 | B8: 199320 | C8: 136081 | D8: =C8/B8 -> 0.68272626931567326 | E8: 45326 | F8: =E8/B8 -> 0.22740317078065422 | G8: 1967 | H8: =G8/B8 -> 9.8685530804736108E-3 | I8: 8141 | J8: =I8/B8 -> 4.0843869155127437E-2 | K8: 464 | L8: =K8/B8 -> 2.3279149106963676E-3 | M8: 4616 | N8: =M8/B8 -> 2.3158739715031105E-2 | O8: 2725 | P8: =O8/B8 -> 1.367148304234397E-2 | Q8: 13140 | R8: =Q8/B8 -> 6.5924142083082476E-2
A9: 7 | B9: 199613 | C9: 67966 | D9: =C9/B9 -> 0.34048884591684908 | E9: 115591 | F9: =E9/B9 -> 0.57907551111400557 | G9: 1449 | H9: =G9/B9 -> 7.2590462545024624E-3 | I9: 5665 | J9: =I9/B9 -> 2.8379915135787748E-2 | K9: 308 | L9: =K9/B9 -> 1.5429856772855475E-3 | M9: 5264 | N9: =M9/B9 -> 2.6371027939062087E-2 | O9: 3370 | P9: =O9/B9 -> 1.6882667962507453E-2 | Q9: 13150 | R9: =Q9/B9 -> 6.5877472910081003E-2
A10: 8 | B10: 199296 | C10: 139133 | D10: =C10/B10 -> 0.69812239081567118 | E10: 50957 | F10: =E10/B10 -> 0.25568501123956328 | G10: 1421 | H10: =G10/B10 -> 7.130097944765575E-3 | I10: 4186 | J10: =I10/B10 -> 2.1003933847141939E-2 | K10: 214 | L10: =K10/B10 -> 1.0737797045600513E-3 | M10: 2117 | N10: =M10/B10 -> 1.0622390815671163E-2 | O10: 1268 | P10: =O10/B10 -> 6.3623956326268466E-3 | Q10: 5948 | R10: =Q10/B10 -> 2.9845054592164418E-2
A11: 9 | B11: 200151 | C11: 152402 | D11: =C11/B11 -> 0.76143511648705231 | E11: 32768 | F11: =E11/B11 -> 0.16371639412243755 | G11: 1592 | H11: =G11/B11 -> 7.9539947339758478E-3 | I11: 7844 | J11: =I11/B11 -> 3.9190411239514167E-2 | K11: 357 | L11: =K11/B11 -> 1.7836533417269962E-3 | M11: 3489 | N11: =M11/B11 -> 1.7431838961584005E-2 | O11: 1699 | P11: =O11/B11 -> 8.4885911137091499E-3 | Q11: 10120 | R11: =Q11/B11 -> 5.0561825821504765E-2
A12: 10 | B12: 199756 | C12: 68412 | D12: =C12/B12 -> 0.34247782294399165 | E12: 119611 | F12: =E12/B12 -> 0.59878551833236549 | G12: 1710 | H12: =G12/B12 -> 8.5604437413644638E-3 | I12: 5319 | J12: =I12/B12 -> 2.6627485532349466E-2 | K12: 125 | L12: =K12/B12 -> 6.2576343138629126E-4 | M12: 2677 | N12: =M12/B12 -> 1.3401349646568814E-2 | O12: 1902 | P12: =O12/B12 -> 9.5216163719738078E-3 | Q12: 6113 | R12: =Q12/B12 -> 3.0602334848515187E-2
A13: 11 | B13: 199415 | C13: 65843 | D13: =C13/B13 -> 0.33018077877792545 | E13: 115117 | F13: =E13/B13 -> 0.57727352506080287 | G13: 1323 | H13: =G13/B13 -> 6.6344056364867239E-3 | I13: 3454 | J13: =I13/B13 -> 1.732066293909686E-2 | K13: 295 | L13: =K13/B13 -> 1.4793270315673344E-3 | M13: 11621 | N13: =M13/B13 -> 5.8275455707945741E-2 | O13: 1762 | P13: =O13/B13 -> 8.8358448461750613E-3 | Q13: 19316 | R13: =Q13/B13 -> 9.6863325226286892E-2
A14: 12 | B14: 200448 | C14: 138137 | D14: =C14/B14 -> 0.68914132343550449 | E14: 45725 | F14: =E14/B14 -> 0.22811402458492977 | G14: 1498 | H14: =G14/B14 -> 7.4732598978288637E-3 | I14: 6473 | J14: =I14/B14 -> 3.229266443167305E-2 | K14: 203 | L14: =K14/B14 -> 1.0127314814814814E-3 | M14: 6909 | N14: =M14/B14 -> 3.4467792145593867E-2 | O14: 1503 | P14: =O14/B14 -> 7.4982040229885057E-3 | Q14: 13353 | R14: =Q14/B14 -> 6.6615780651340994E-2
A15: 13 | B15: 199268 | C15: 128863 | D15: =C15/B15 -> 0.64668185559146474 | E15: 65023 | F15: =E15/B15 -> 0.32630929200875203 | G15: 1182 | H15: =G15/B15 -> 5.9317100588152641E-3 | I15: 1150 | J15: =I15/B15 -> 5.7711223076459843E-3 | K15: 80 | L15: =K15/B15 -> 4.0146937792319892E-4 | M15: 2292 | N15: =M15/B15 -> 1.1502097677499649E-2 | O15: 678 | P15: =O15/B15 -> 3.4024529778991109E-3 | Q15: 4756 | R15: =Q15/B15 -> 2.3867354517534176E-2
A16: 14 | B16: 199933 | C16: 164318 | D16: =C16/B16 -> 0.82186532488383612 | E16: 25329 | F16: =E16/B16 -> 0.12668744029249798 | G16: 1075 | H16: =G16/B16 -> 5.3768012284115176E-3 | I16: 6167 | J16: =I16/B16 -> 3.0845333186617516E-2 | K16: 122 | L16: =K16/B16 -> 6.1020441848019086E-4 | M16: 2137 | N16: =M16/B16 -> 1.0688580674525966E-2 | O16: 785 | P16: =O16/B16 -> 3.9263153156307365E-3 | Q16: 5968 | R16: =Q16/B16 -> 2.9849999749916221E-2
A17: 15 | B17: 199205 | C17: 145928 | D17: =C17/B17 -> 0.73255189377776664 | E17: 26157 | F17: =E17/B17 -> 0.13130694510679952 | G17: 942 | H17: =G17/B17 -> 4.7287969679475914E-3 | I17: 19504 | J17: =I17/B17 -> 9.7909189026379864E-2 | K17: 115 | L17: =K17/B17 -> 5.7729474661780578E-4 | M17: 5349 | N17: =M17/B17 -> 2.6851735649205594E-2 | O17: 1210 | P17: =O17/B17 -> 6.0741447252829995E-3 | Q17: 11694 | R17: =Q17/B17 -> 5.8703345799553226E-2
A18: 16 | B18: 200423 | C18: 160174 | D18: =C18/B18 -> 0.79917973486076943 | E18: 32856 | F18: =E18/B18 -> 0.16393328111045138 | G18: 2190 | H18: =G18/B18 -> 1.0926889628435858E-2 | I18: 2568 | J18: =I18/B18 -> 1.28129007149878E-2 | K18: 111 | L18: =K18/B18 -> 5.5382865240017362E-4 | M18: 1711 | N18: =M18/B18 -> 8.5369443626729467E-3 | O18: 813 | P18: =O18/B18 -> 4.0564206702823529E-3 | Q18: 4540 | R18: =Q18/B18 -> 2.2652090827898992E-2
A19: 17 | B19: 200935 | C19: 144098 | D19: =C19/B19 -> 0.71713738273571059 | E19: 42054 | F19: =E19/B19 -> 0.20929156194789358 | G19: 1739 | H19: =G19/B19 -> 8.6545400253813416E-3 | I19: 5319 | J19: =I19/B19 -> 2.647124692064598E-2 | K19: 261 | L19: =K19/B19 -> 1.2989275138726455E-3 | M19: 5878 | N19: =M19/B19 -> 2.925324109786747E-2 | O19: 1586 | P19: =O19/B19 -> 7.8930997586284125E-3 | Q19: 14545 | R19: =Q19/B19 -> 7.2386592679224621E-2
A20: 18 | B20: 200337 | C20: 141795 | D20: =C20/B20 -> 0.70778238667844684 | E20: 39189 | F20: =E20/B20 -> 0.19561538807110018 | G20: 1602 | H20: =G20/B20 -> 7.9965258539361171E-3 | I20: 6796 | J20: =I20/B20 -> 3.3922840014575441E-2 | K20: 334 | L20: =K20/B20 -> 1.6671907835297524E-3 | M20: 8835 | N20: =M20/B20 -> 4.4100690336782523E-2 | O20: 1786 | P20: =O20/B20 -> 8.9149782616291546E-3 | Q20: 18537 | R20: =Q20/B20 -> 9.2529088485901259E-2
A21: 19 | B21: 200846 | C21: 130231 | D21: =C21/B21 -> 0.6484122163249455 | E21: 27227 | F21: =E21/B21 -> 0.13556157453969708 | G21: 1739 | H21: =G21/B21 -> 8.6583750734393512E-3 | I21: 17411 | J21: =I21/B21 -> 8.6688308455234356E-2 | K21: 301 | L21: =K21/B21 -> 1.4986606653854197E-3 | M21: 21932 | N21: =M21/B21 -> 0.10919809207054161 | O21: 2005 | P21: =O21/B21 -> 9.9827728707566985E-3 | Q21: 44696 | R21: =Q21/B21 -> 0.22253866146201567
A22: 20 | B22: 200576 | C22: 100640 | D22: =C22/B22 -> 0.50175494575622204 | E22: 55090 | F22: =E22/B22 -> 0.27465898213146139 | G22: 2178 | H22: =G22/B22 -> 1.0858726866624122E-2 | I22: 16910 | J22: =I22/B22 -> 8.4307195277600513E-2 | K22: 419 | L22: =K22/B22 -> 2.0889837268666242E-3 | M22: 22259 | N22: =M22/B22 -> 0.11097539087428207 | O22: 3080 | P22: =O22/B22 -> 1.5355775366943204E-2 | Q22: 46840 | R22: =Q22/B22 -> 0.23352744097000638
A23: 21 | B23: 200674 | C23: 135268 | D23: =C23/B23 -> 0.67406838952729298 | E23: 14638 | F23: =E23/B23 -> 7.2944178119736483E-2 | G23: 1162 | H23: =G23/B23 -> 5.7904860619711574E-3 | I23: 38312 | J23: =I23/B23 -> 0.19091661102085972 | K23: 301 | L23: =K23/B23 -> 1.4999451847274685E-3 | M23: 9515 | N23: =M23/B23 -> 4.7415210739806854E-2 | O23: 1478 | P23: =O23/B23 -> 7.3651793456053103E-3 | Q23: 24793 | R23: =Q23/B23 -> 0.12354864107956187
A24: 22 | B24: 199707 | C24: 115445 | D24: =C24/B24 -> 0.57807187529731052 | E24: 39377 | F24: =E24/B24 -> 0.19717385970446705 | G24: 1474 | H24: =G24/B24 -> 7.3808128908851465E-3 | I24: 23238 | J24: =I24/B24 -> 0.11636046808574561 | K24: 307 | L24: =K24/B24 -> 1.5372520742888331E-3 | M24: 17735 | N24: =M24/B24 -> 8.8805099470724611E-2 | O24: 2131 | P24: =O24/B24 -> 1.0670632476578188E-2 | Q24: 37633 | R24: =Q24/B24 -> 0.18844106616192721
A25: 23 | B25: 200986 | C25: 116036 | D25: =C25/B25 -> 0.57733374463893006 | E25: 39503 | F25: =E25/B25 -> 0.19654602808155791 | G25: 1455 | H25: =G25/B25 -> 7.2393102007104974E-3 | I25: 23142 | J25: =I25/B25 -> 0.11514234822325933 | K25: 288 | L25: =K25/B25 -> 1.4329356273571293E-3 | M25: 18654 | N25: =M25/B25 -> 9.2812434696944071E-2 | O25: 1908 | P25: =O25/B25 -> 9.4931985312409813E-3 | Q25: 38619 | R25: =Q25/B25 -> 0.19214771178092008
A26: 24 | B26: 199318 | C26: 142764 | D26: =C26/B26 -> 0.71626245497145269 | E26: 17631 | F26: =E26/B26 -> 8.8456637132622237E-2 | G26: 1563 | H26: =G26/B26 -> 7.8417403345407838E-3 | I26: 22226 | J26: =I26/B26 -> 0.11151024995233746 | K26: 254 | L26: =K26/B26 -> 1.2743455182171203E-3 | M26: 13225 | N26: =M26/B26 -> 6.6351257789060702E-2 | O26: 1655 | P26: =O26/B26 -> 8.3033143017690325E-3 | Q26: 30435 | R26: =Q26/B26 -> 0.15269569231077976
A27: 25 | B27: 199502 | C27: 122562 | D27: =C27/B27 -> 0.61433970586761033 | E27: 14001 | F27: =E27/B27 -> 7.0179747571452913E-2 | G27: 1454 | H27: =G27/B27 -> 7.2881474872432354E-3 | I27: 40243 | J27: =I27/B27 -> 0.20171727601728304 | K27: 172 | L27: =K27/B27 -> 8.6214674539603618E-4 | M27: 19454 | N27: =M27/B27 -> 9.7512806889153994E-2 | O27: 1616 | P27: =O27/B27 -> 8.1001694218604328E-3 | Q27: 42451 | R27: =Q27/B27 -> 0.21278483423725075
A28: 26 | B28: 199456 | C28: 130794 | D28: =C28/B28 -> 0.65575364992780361 | E28: 14176 | F28: =E28/B28 -> 7.1073319428846468E-2 | G28: 1072 | H28: =G28/B28 -> 5.3746189635809401E-3 | I28: 42893 | J28: =I28/B28 -> 0.21504993582544521 | K28: 213 | L28: =K28/B28 -> 1.0679047007861383E-3 | M28: 8956 | N28: =M28/B28 -> 4.4902133803946732E-2 | O28: 1352 | P28: =O28/B28 -> 6.7784373495908875E-3 | Q28: 22389 | R28: =Q28/B28 -> 0.11225032087277395
A29: 27 | B29: 200966 | C29: 133521 | D29: =C29/B29 -> 0.66439596747708562 | E29: 12925 | F29: =E29/B29 -> 6.4314361633311112E-2 | G29: 1002 | H29: =G29/B29 -> 4.9859180159828034E-3 | I29: 42882 | J29: =I29/B29 -> 0.21337937760616224 | K29: 167 | L29: =K29/B29 -> 8.3098633599713379E-4 | M29: 8997 | N29: =M29/B29 -> 4.4768766856085107E-2 | O29: 1472 | P29: =O29/B29 -> 7.324622075375934E-3 | Q29: 22133 | R29: =Q29/B29 -> 0.11013305733308122
A30: 28 | B30: 199947 | C30: 133270 | D30: =C30/B30 -> 0.66652662955683251 | E30: 17899 | F30: =E30/B30 -> 8.9518722461452288E-2 | G30: 1100 | H30: =G30/B30 -> 5.5014578863398804E-3 | I30: 30491 | J30: =I30/B30 -> 0.15249541128399025 | K30: 215 | L30: =K30/B30 -> 1.0752849505118857E-3 | M30: 15156 | N30: =M30/B30 -> 7.5800087023061111E-2 | O30: 1816 | P30: =O30/B30 -> 9.0824068378120206E-3 | Q30: 31659 | R30: =Q30/B30 -> 0.15833695929421296
A31: 29 | B31: 200860 | C31: 142535 | D31: =C31/B31 -> 0.70962361844070498 | E31: 13832 | F31: =E31/B31 -> 6.8863885293239072E-2 | G31: 1084 | H31: =G31/B31 -> 5.3967937867171164E-3 | I31: 35643 | J31: =I31/B31 -> 0.17745195658667728 | K31: 220 | L31: =K31/B31 -> 1.0952902519167579E-3 | M31: 6080 | N31: =M31/B31 -> 3.0269839689335856E-2 | O31: 1466 | P31: =O31/B31 -> 7.2986159514089417E-3 | Q31: 17093 | R31: =Q31/B31 -> 8.5099073981877923E-2
A32: 30 | B32: 200570 | C32: 173638 | D32: =C32/B32 -> 0.86572269033255222 | E32: 14279 | F32: =E32/B32 -> 7.1192102507852614E-2 | G32: 1436 | H32: =G32/B32 -> 7.1595951538116365E-3 | I32: 3476 | J32: =I32/B32 -> 1.7330607767861595E-2 | K32: 153 | L32: =K32/B32 -> 7.6282594605374681E-4 | M32: 6888 | N32: =M32/B32 -> 3.4342124943909855E-2 | O32: 700 | P32: =O32/B32 -> 3.4900533479583187E-3 | Q32: 14144 | R32: =Q32/B32 -> 7.0519020790746373E-2
A33: 31 | B33: 200819 | C33: 174091 | D33: =C33/B33 -> 0.86690502392701885 | E33: 12007 | F33: =E33/B33 -> 5.9790159297676018E-2 | G33: 1321 | H33: =G33/B33 -> 6.5780628327000929E-3 | I33: 3429 | J33: =I33/B33 -> 1.7075077557402438E-2 | K33: 145 | L33: =K33/B33 -> 7.2204323296102462E-4 | M33: 9149 | N33: =M33/B33 -> 4.5558438195589065E-2 | O33: 677 | P33: =O33/B33 -> 3.3711949566525082E-3 | Q33: 16775 | R33: =Q33/B33 -> 8.3532932640835778E-2
A34: 32 | B34: 199677 | C34: 179902 | D34: =C34/B34 -> 0.90096505856958986 | E34: 13143 | F34: =E34/B34 -> 6.5821301401763843E-2 | G34: 1077 | H34: =G34/B34 -> 5.3937108430114639E-3 | I34: 1952 | J34: =I34/B34 -> 9.7757878974543896E-3 | K34: 90 | L34: =K34/B34 -> 4.5072792559984373E-4 | M34: 3088 | N34: =M34/B34 -> 1.5464975936136861E-2 | O34: 425 | P34: =O34/B34 -> 2.1284374264437067E-3 | Q34: 6285 | R34: =Q34/B34 -> 3.1475833471055752E-2
A35: 33 | B35: 199217 | C35: 154577 | D35: =C35/B35 -> 0.7759227375173805 | E35: 29271 | F35: =E35/B35 -> 0.146930231857723 | G35: 1223 | H35: =G35/B35 -> 6.1390343193602958E-3 | I35: 8893 | J35: =I35/B35 -> 4.4639764678717178E-2 | K35: 140 | L35: =K35/B35 -> 7.0275127122685309E-4 | M35: 4224 | N35: =M35/B35 -> 2.1203009783301627E-2 | O35: 889 | P35: =O35/B35 -> 4.4624705722905176E-3 | Q35: 9493 | R35: =Q35/B35 -> 4.7651555841117979E-2
A36: 34 | B36: 199089 | C36: 176496 | D36: =C36/B36 -> 0.88651808989949221 | E36: 12293 | F36: =E36/B36 -> 6.1746254187825547E-2 | G36: 1311 | H36: =G36/B36 -> 6.5849946506336366E-3 | I36: 6875 | J36: =I36/B36 -> 3.4532294601911706E-2 | K36: 130 | L36: =K36/B36 -> 6.5297429792705777E-4 | M36: 1473 | N36: =M36/B36 -> 7.3987010834350468E-3 | O36: 511 | P36: =O36/B36 -> 2.5666912787748195E-3 | Q36: 4119 | R36: =Q36/B36 -> 2.0689239485858085E-2
A37: 35 | B37: 199365 | C37: 155970 | D37: =C37/B37 -> 0.78233391016477316 | E37: 33772 | F37: =E37/B37 -> 0.16939783813608206 | G37: 1095 | H37: =G37/B37 -> 5.4924384922127754E-3 | I37: 4518 | J37: =I37/B37 -> 2.2661951696636821E-2 | K37: 111 | L37: =K37/B37 -> 5.5676773756677448E-4 | M37: 3132 | N37: =M37/B37 -> 1.5709878865397639E-2 | O37: 767 | P37: =O37/B37 -> 3.847214907330775E-3 | Q37: 7340 | R37: =Q37/B37 -> 3.6816893637298426E-2
A38: 36 | B38: 199151 | C38: 155720 | D38: =C38/B38 -> 0.78191924720438255 | E38: 35794 | F38: =E38/B38 -> 0.17973296644254863 | G38: 1292 | H38: =G38/B38 -> 6.4875396056258815E-3 | I38: 3589 | J38: =I38/B38 -> 1.8021501272903476E-2 | K38: 106 | L38: =K38/B38 -> 5.3225944132843928E-4 | M38: 1917 | N38: =M38/B38 -> 9.6258617832699813E-3 | O38: 733 | P38: =O38/B38 -> 3.6806242499409997E-3 | Q38: 4490 | R38: =Q38/B38 -> 2.254570652419521E-2
A39: 37 | B39: 200814 | C39: 147807 | D39: =C39/B39 -> 0.73603931996773131 | E39: 47986 | F39: =E39/B39 -> 0.23895744320615098 | G39: 999 | H39: =G39/B39 -> 4.9747527562819327E-3 | I39: 1153 | J39: =I39/B39 -> 5.7416315595526209E-3 | K39: 68 | L39: =K39/B39 -> 3.3862180923640781E-4 | M39: 2367 | N39: =M39/B39 -> 1.1787026800920255E-2 | O39: 434 | P39: =O39/B39 -> 2.1612039001264851E-3 | Q39: 4404 | R39: =Q39/B39 -> 2.1930741880546178E-2
A40: 38 | B40: 200322 | C40: 170597 | D40: =C40/B40 -> 0.85161390161839434 | E40: 23292 | F40: =E40/B40 -> 0.11627280079072692 | G40: 983 | H40: =G40/B40 -> 4.9070995696927945E-3 | I40: 1188 | J40: =I40/B40 -> 5.9304519723245575E-3 | K40: 61 | L40: =K40/B40 -> 3.0450973931969532E-4 | M40: 3819 | N40: =M40/B40 -> 1.9064306466588792E-2 | O40: 382 | P40: =O40/B40 -> 1.9069298429528459E-3 | Q40: 7103 | R40: =Q40/B40 -> 3.5457912760455665E-2
A41: 39 | B41: 199453 | C41: 189127 | D41: =C41/B41 -> 0.94822840468681846 | E41: 7153 | F41: =E41/B41 -> 3.5863085538949027E-2 | G41: 886 | H41: =G41/B41 -> 4.4421492782760847E-3 | I41: 1221 | J41: =I41/B41 -> 6.1217429670147854E-3 | K41: 54 | L41: =K41/B41 -> 2.7074047519967112E-4 | M41: 766 | N41: =M41/B41 -> 3.8405037778323717E-3 | O41: 246 | P41: =O41/B41 -> 1.2333732759096127E-3 | Q41: 1874 | R41: =Q41/B41 -> 9.3956972319293262E-3
A42: 40 | B42: 199093 | C42: 189173 | D42: =C42/B42 -> 0.95017403926808075 | E42: 6481 | F42: =E42/B42 -> 3.2552626159633939E-2 | G42: 1022 | H42: =G42/B42 -> 5.1332794221795848E-3 | I42: 881 | J42: =I42/B42 -> 4.4250676819375867E-3 | K42: 70 | L42: =K42/B42 -> 3.5159448097120443E-4 | M42: 1231 | N42: =M42/B42 -> 6.1830400867936086E-3 | O42: 235 | P42: =O42/B42 -> 1.1803529004033291E-3 | Q42: 2651 | R42: =Q42/B42 -> 1.3315385272209469E-2

A1: SB____ J. Watkins Voting Age Population
A2: DISTRICT | B2: Voting Age Persons | C2: VAP White | D2: % VAP White | E2: VAP Black | F2: % VAP Black | G2: VAP AIAN | H2: % VAP AIAN | I2: VAP Asian | J2: % VAP Asian | K2: VAP HawPI | L2: % VAP HawPI | M2: VAP Other | N2: % VAP Other | O2: VAP Multi | P2: % VAP Multi | Q2: Voting Age Hispanic | R2: % VAP Hispanic
A3: 1 | B3: 157067 | C3: 111572 | D3: =C3/B3 -> 0.71034654001158737 | E3: 30538 | F3: =E3/B3 -> 0.19442658228654014 | G3: 1258 | H3: =G3/B3 -> 8.0093208630711739E-3 | I3: 9202 | J3: =I3/B3 -> 5.8586463101733655E-2 | K3: 259 | L3: =K3/B3 -> 1.6489778247499474E-3 | M3: 3327 | N3: =M3/B3 -> 2.1182043331826547E-2 | O3: 911 | P3: =O3/B3 -> 5.8000725804911281E-3 | Q3: 8503 | R3: =Q3/B3 -> 5.4136132987833215E-2
A4: 2 | B4: 152454 | C4: 117847 | D4: =C4/B4 -> 0.77300038044262531 | E4: 21827 | F4: =E4/B4 -> 0.14317105487556903 | G4: 1189 | H4: =G4/B4 -> 7.7990738189880225E-3 | I4: 7267 | J4: =I4/B4 -> 4.7666837209912501E-2 | K4: 315 | L4: =K4/B4 -> 2.0661970168050691E-3 | M4: 3009 | N4: =M4/B4 -> 1.973710102719509E-2 | O4: 1000 | P4: =O4/B4 -> 6.5593556089049813E-3 | Q4: 8351 | R4: =Q4/B4 -> 5.4777178689965497E-2
A5: 3 | B5: 148345 | C5: 100647 | D5: =C5/B5 -> 0.67846573864976911 | E5: 32410 | F5: =E5/B5 -> 0.21847719842259597 | G5: 1142 | H5: =G5/B5 -> 7.698270922511713E-3 | I5: 10607 | J5: =I5/B5 -> 7.1502241396744076E-2 | K5: 217 | L5: =K5/B5 -> 1.4628062961340119E-3 | M5: 2390 | N5: =M5/B5 -> 1.6111092385992114E-2 | O5: 932 | P5: =O5/B5 -> 6.2826519262529912E-3 | Q5: 7143 | R5: =Q5/B5 -> 4.8151269001314501E-2
A6: 4 | B6: 153250 | C6: 59784 | D6: =C6/B6 -> 0.39010766721044043 | E6: 88397 | F6: =E6/B6 -> 0.576815660685155 | G6: 896 | H6: =G6/B6 -> 5.8466557911908646E-3 | I6: 1630 | J6: =I6/B6 -> 1.0636215334420881E-2 | K6: 117 | L6: =K6/B6 -> 7.6345840130505706E-4 | M6: 1533 | N6: =M6/B6 -> 1.000326264274062E-2 | O6: 893 | P6: =O6/B6 -> 5.8270799347471449E-3 | Q6: 3624 | R6: =Q6/B6 -> 2.364763458401305E-2
A7: 5 | B7: 151064 | C7: 56869 | D7: =C7/B7 -> 0.37645633638722659 | E7: 83742 | F7: =E7/B7 -> 0.55434782608695654 | G7: 998 | H7: =G7/B7 -> 6.6064714293279673E-3 | I7: 5035 | J7: =I7/B7 -> 3.3330244134936189E-2 | K7: 207 | L7: =K7/B7 -> 1.3702801461632156E-3 | M7: 2764 | N7: =M7/B7 -> 1.8296880792246995E-2 | O7: 1449 | P7: =O7/B7 -> 9.5919610231425083E-3 | Q7: 6953 | R7: =Q7/B7 -> 4.6026849547211778E-2
A8: 6 | B8: 158654 | C8: 111374 | D8: =C8/B8 -> 0.70199301624919641 | E8: 33893 | F8: =E8/B8 -> 0.21362839890579499 | G8: 1566 | H8: =G8/B8 -> 9.8705358831167201E-3 | I8: 6205 | J8: =I8/B8 -> 3.9110265105197474E-2 | K8: 349 | L8: =K8/B8 -> 2.1997554426613887E-3 | M8: 3428 | N8: =M8/B8 -> 2.1606766926771465E-2 | O8: 1839 | P8: =O8/B8 -> 1.1591261487261587E-2 | Q8: 9578 | R8: =Q8/B8 -> 6.0370365701463563E-2
A9: 7 | B9: 150764 | C9: 56129 | D9: =C9/B9 -> 0.372297100103473 | E9: 83229 | F9: =E9/B9 -> 0.55204823432649708 | G9: 1110 | H9: =G9/B9 -> 7.3625003316441593E-3 | I9: 4350 | J9: =I9/B9 -> 2.885304184022711E-2 | K9: 230 | L9: =K9/B9 -> 1.5255631317821232E-3 | M9: 3807 | N9: =M9/B9 -> 2.5251386272584966E-2 | O9: 1909 | P9: =O9/B9 -> 1.2662173993791621E-2 | Q9: 8762 | R9: =Q9/B9 -> 5.811732243771723E-2
A10: 8 | B10: 153557 | C10: 110382 | D10: =C10/B10 -> 0.71883404859433309 | E10: 36921 | F10: =E10/B10 -> 0.24043840398028093 | G10: 1068 | H10: =G10/B10 -> 6.9550720579328847E-3 | I10: 3002 | J10: =I10/B10 -> 1.9549743743365655E-2 | K10: 132 | L10: =K10/B10 -> 8.5961564760968245E-4 | M10: 1373 | N10: =M10/B10 -> 8.9413051830916201E-3 | O10: 679 | P10: =O10/B10 -> 4.4218107933861692E-3 | Q10: 3803 | R10: =Q10/B10 -> 2.4766047786815321E-2
A11: 9 | B11: 155306 | C11: 121208 | D11: =C11/B11 -> 0.78044634463575135 | E11: 23685 | F11: =E11/B11 -> 0.15250537648255702 | G11: 1148 | H11: =G11/B11 -> 7.3918586532394116E-3 | I11: 5800 | J11: =I11/B11 -> 3.7345627342150335E-2 | K11: 243 | L11: =K11/B11 -> 1.5646530076107812E-3 | M11: 2306 | N11: =M11/B11 -> 1.4848106319137702E-2 | O11: 916 | P11: =O11/B11 -> 5.898033559553398E-3 | Q11: 6569 | R11: =Q11/B11 -> 4.2297142415618195E-2
A12: 10 | B12: 156819 | C12: 59529 | D12: =C12/B12 -> 0.37960323685267727 | E12: 87979 | F12: =E12/B12 -> 0.56102258017204543 | G12: 1377 | H12: =G12/B12 -> 8.7808237522239013E-3 | I12: 4661 | J12: =I12/B12 -> 2.972216376842092E-2 | K12: 92 | L12: =K12/B12 -> 5.8666360581307111E-4 | M12: 1935 | N12: =M12/B12 -> 1.2339066057046658E-2 | O12: 1246 | P12: =O12/B12 -> 7.9454657917726809E-3 | Q12: 4348 | R12: =Q12/B12 -> 2.7726232152991664E-2
A13: 11 | B13: 151760 | C13: 53459 | D13: =C13/B13 -> 0.352260147601476 | E13: 85171 | F13: =E13/B13 -> 0.56122166578808641 | G13: 1045 | H13: =G13/B13 -> 6.8858724301528729E-3 | I13: 2696 | J13: =I13/B13 -> 1.7764891934633632E-2 | K13: 196 | L13: =K13/B13 -> 1.2915129151291514E-3 | M13: 8051 | N13: =M13/B13 -> 5.3050869794412231E-2 | O13: 1142 | P13: =O13/B13 -> 7.525039536109647E-3 | Q13: 13199 | R13: =Q13/B13 -> 8.697285187137585E-2
A14: 12 | B14: 148916 | C14: 106517 | D14: =C14/B14 -> 0.71528244110773864 | E14: 31421 | F14: =E14/B14 -> 0.21099814660614039 | G14: 1061 | H14: =G14/B14 -> 7.1248220473286951E-3 | I14: 4612 | J14: =I14/B14 -> 3.0970480002148863E-2 | K14: 143 | L14: =K14/B14 -> 9.6027290553063471E-4 | M14: 4382 | N14: =M14/B14 -> 2.942598511912756E-2 | O14: 780 | P14: =O14/B14 -> 5.2378522119852803E-3 | Q14: 8411 | R14: =Q14/B14 -> 5.6481506352574609E-2
A15: 13 | B15: 157870 | C15: 104035 | D15: =C15/B15 -> 0.6589915753468043 | E15: 50123 | F15: =E15/B15 -> 0.31749540761385953 | G15: 912 | H15: =G15/B15 -> 5.7769050484575918E-3 | I15: 835 | J15: =I15/B15 -> 5.2891619687084309E-3 | K15: 63 | L15: =K15/B15 -> 3.9906251979476782E-4 | M15: 1479 | N15: =M15/B15 -> 9.3684677266105028E-3 | O15: 423 | P15: =O15/B15 -> 2.67941977576487E-3 | Q15: 3167 | R15: =Q15/B15 -> 2.006080952682587E-2
A16: 14 | B16: 156880 | C16: 129893 | D16: =C16/B16 -> 0.82797679755226927 | E16: 19658 | F16: =E16/B16 -> 0.1253059663437022 | G16: 819 | H16: =G16/B16 -> 5.2205507394186643E-3 | I16: 4482 | J16: =I16/B16 -> 2.8569607343192249E-2 | K16: 85 | L16: =K16/B16 -> 5.418154003059664E-4 | M16: 1436 | N16: =M16/B16 -> 9.153493115757267E-3 | O16: 507 | P16: =O16/B16 -> 3.2317695053544109E-3 | Q16: 4013 | R16: =Q16/B16 -> 2.5580061193268739E-2
A17: 15 | B17: 151612 | C17: 113719 | D17: =C17/B17 -> 0.75006595783974883 | E17: 18945 | F17: =E17/B17 -> 0.12495712740416326 | G17: 676 | H17: =G17/B17 -> 4.4587499670210801E-3 | I17: 13797 | J17: =I17/B17 -> 9.100203150146427E-2 | K17: 80 | L17: =K17/B17 -> 5.2766271799066034E-4 | M17: 3639 | N17: =M17/B17 -> 2.4002057884600164E-2 | O17: 756 | P17: =O17/B17 -> 4.9864126850117409E-3 | Q17: 7878 | R17: =Q17/B17 -> 5.1961586154130282E-2
A18: 16 | B18: 153210 | C18: 123545 | D18: =C18/B18 -> 0.80637686835062983 | E18: 24750 | F18: =E18/B18 -> 0.16154298022322303 | G18: 1579 | H18: =G18/B18 -> 1.0306115788786633E-2 | I18: 1705 | J18: =I18/B18 -> 1.1128516415377586E-2 | K18: 75 | L18: =K18/B18 -> 4.895241824946152E-4 | M18: 1074 | N18: =M18/B18 -> 7.0099862933228905E-3 | O18: 482 | P18: =O18/B18 -> 3.1460087461653938E-3 | Q18: 2871 | R18: =Q18/B18 -> 1.8738985705893871E-2
A19: 17 | B19: 148284 | C19: 109512 | D19: =C19/B19 -> 0.73852876911871812 | E19: 29406 | F19: =E19/B19 -> 0.19830865096706321 | G19: 1252 | H19: =G19/B19 -> 8.443257532842384E-3 | I19: 3566 | J19: =I19/B19 -> 2.4048447573575032E-2 | K19: 171 | L19: =K19/B19 -> 1.1531925224569071E-3 | M19: 3584 | N19: =M19/B19 -> 2.4169836260149444E-2 | O19: 793 | P19: =O19/B19 -> 5.3478460251948964E-3 | Q19: 8921 | R19: =Q19/B19 -> 6.0161581829462386E-2
A20: 18 | B20: 146912 | C20: 107633 | D20: =C20/B20 -> 0.73263586364626443 | E20: 26628 | F20: =E20/B20 -> 0.18125136135918102 | G20: 1131 | H20: =G20/B20 -> 7.6984861685907213E-3 | I20: 4712 | J20: =I20/B20 -> 3.2073622304508824E-2 | K20: 229 | L20: =K20/B20 -> 1.5587562622522326E-3 | M20: 5665 | N20: =M20/B20 -> 3.856049880200392E-2 | O20: 914 | P20: =O20/B20 -> 6.2214114571988678E-3 | Q20: 11662 | R20: =Q20/B20 -> 7.9380853844478322E-2
A21: 19 | B21: 142381 | C21: 95439 | D21: =C21/B21 -> 0.67030713367654393 | E21: 18265 | F21: =E21/B21 -> 0.12828256579178401 | G21: 1189 | H21: =G21/B21 -> 8.3508333274804926E-3 | I21: 12088 | J21: =I21/B21 -> 8.4898968261214625E-2 | K21: 192 | L21: =K21/B21 -> 1.3484945322760761E-3 | M21: 14132 | N21: =M21/B21 -> 9.9254816302737026E-2 | O21: 1076 | P21: =O21/B21 -> 7.5571881079638439E-3 | Q21: 28470 | R21: =Q21/B21 -> 0.19995645486406191
A22: 20 | B22: 143776 | C22: 76121 | D22: =C22/B22 -> 0.52944163142666367 | E22: 37667 | F22: =E22/B22 -> 0.26198391943022481 | G22: 1440 | H22: =G22/B22 -> 1.0015579790785666E-2 | I22: 11990 | J22: =I22/B22 -> 8.3393612285777879E-2 | K22: 307 | L22: =K22/B22 -> 2.1352659692855554E-3 | M22: 14605 | N22: =M22/B22 -> 0.10158162697529491 | O22: 1646 | P22: =O22/B22 -> 1.1448364121967505E-2 | Q22: 30282 | R22: =Q22/B22 -> 0.21061929668373025
A23: 21 | B23: 150623 | C23: 103823 | D23: =C23/B23 -> 0.68929048020554629 | E23: 10054 | F23: =E23/B23 -> 6.6749434017381148E-2 | G23: 814 | H23: =G23/B23 -> 5.4042211348864387E-3 | I23: 28136 | J23: =I23/B23 -> 0.18679750104565704 | K23: 202 | L23: =K23/B23 -> 1.3410966452666591E-3 | M23: 6729 | N23: =M23/B23 -> 4.4674452108907671E-2 | O23: 865 | P23: =O23/B23 -> 5.7428148423547534E-3 | Q23: 17394 | R23: =Q23/B23 -> 0.1154803715236053
A24: 22 | B24: 149913 | C24: 90334 | D24: =C24/B24 -> 0.6025761608399538 | E24: 27854 | F24: =E24/B24 -> 0.18580109797015604 | G24: 1024 | H24: =G24/B24 -> 6.830628431156738E-3 | I24: 17137 | J24: =I24/B24 -> 0.11431296818821583 | K24: 217 | L24: =K24/B24 -> 1.4475062202744257E-3 | M24: 12106 | N24: =M24/B24 -> 8.0753503698811971E-2 | O24: 1241 | P24: =O24/B24 -> 8.2781346514311637E-3 | Q24: 25521 | R24: =Q24/B24 -> 0.17023873846831161
A25: 23 | B25: 163750 | C25: 98536 | D25: =C25/B25 -> 0.60174656488549616 | E25: 30529 | F25: =E25/B25 -> 0.18643664122137404 | G25: 1171 | H25: =G25/B25 -> 7.1511450381679387E-3 | I25: 18460 | J25: =I25/B25 -> 0.11273282442748092 | K25: 229 | L25: =K25/B25 -> 1.3984732824427481E-3 | M25: 13504 | N25: =M25/B25 -> 8.2467175572519077E-2 | O25: 1321 | P25: =O25/B25 -> 8.0671755725190836E-3 | Q25: 28386 | R25: =Q25/B25 -> 0.17334961832061069
A26: 24 | B26: 167891 | C26: 122650 | D26: =C26/B26 -> 0.73053350090237124 | E26: 14288 | F26: =E26/B26 -> 8.5102834577195918E-2 | G26: 1240 | H26: =G26/B26 -> 7.3857443222090525E-3 | I26: 18204 | J26: =I26/B26 -> 0.1084274916463658 | K26: 204 | L26: =K26/B26 -> 1.2150740659118118E-3 | M26: 10079 | N26: =M26/B26 -> 6.0032997599633098E-2 | O26: 1226 | P26: =O26/B26 -> 7.3023568863131438E-3 | Q26: 23384 | R26: =Q26/B26 -> 0.13928084292785201
A27: 25 | B27: 155142 | C27: 97455 | D27: =C27/B27 -> 0.62816645395830917 | E27: 10324 | F27: =E27/B27 -> 6.6545487359967001E-2 | G27: 1062 | H27: =G27/B27 -> 6.8453416869706466E-3 | I27: 30842 | J27: =I27/B27 -> 0.1987985200654884 | K27: 138 | L27: =K27/B27 -> 8.8950767683799363E-4 | M27: 14203 | N27: =M27/B27 -> 9.1548387928478428E-2 | O27: 1118 | P27: =O27/B27 -> 7.2063013239483829E-3 | Q27: 31205 | R27: =Q27/B27 -> 0.2011383119980405
A28: 26 | B28: 153018 | C28: 103236 | D28: =C28/B28 -> 0.67466572560090965 | E28: 10440 | F28: =E28/B28 -> 6.8227267380308196E-2 | G28: 764 | H28: =G28/B28 -> 4.9928766550340481E-3 | I28: 31212 | J28: =I28/B28 -> 0.20397600282319728 | K28: 160 | L28: =K28/B28 -> 1.045628618855298E-3 | M28: 6380 | N28: =M28/B28 -> 4.1694441176855009E-2 | O28: 826 | P28: =O28/B28 -> 5.3980577448404761E-3 | Q28: 15931 | R28: =Q28/B28 -> 0.10411193454364846
A29: 27 | B29: 150713 | C29: 102745 | D29: =C29/B29 -> 0.68172619482061936 | E29: 9266 | F29: =E29/B29 -> 6.1481093203638704E-2 | G29: 691 | H29: =G29/B29 -> 4.5848732358854246E-3 | I29: 30549 | J29: =I29/B29 -> 0.2026965158944484 | K29: 124 | L29: =K29/B29 -> 8.2275583393602407E-4 | M29: 6376 | N29: =M29/B29 -> 4.2305574170774914E-2 | O29: 962 | P29: =O29/B29 -> 6.382992840697219E-3 | Q29: 15641 | R29: =Q29/B29 -> 0.10378003224672058
A30: 28 | B30: 141494 | C30: 96476 | D30: =C30/B30 -> 0.6818380991420131 | E30: 12236 | F30: =E30/B30 -> 8.6477165109474605E-2 | G30: 728 | H30: =G30/B30 -> 5.1450944916392218E-3 | I30: 20648 | J30: =I30/B30 -> 0.14592844926286627 | K30: 158 | L30: =K30/B30 -> 1.1166551231854354E-3 | M30: 10253 | N30: =M30/B30 -> 7.2462436569748545E-2 | O30: 995 | P30: =O30/B30 -> 7.0321003010728371E-3 | Q30: 21211 | R30: =Q30/B30 -> 0.14990741656890044
A31: 29 | B31: 139575 | C31: 100969 | D31: =C31/B31 -> 0.72340318825004479 | E31: 9148 | F31: =E31/B31 -> 6.5541823392441342E-2 | G31: 718 | H31: =G31/B31 -> 5.1441877126992656E-3 | I31: 23759 | J31: =I31/B31 -> 0.17022389396381873 | K31: 147 | L31: =K31/B31 -> 1.0531972058033315E-3 | M31: 4045 | N31: =M31/B31 -> 2.8980834676697115E-2 | O31: 789 | P31: =O31/B31 -> 5.6528747984954325E-3 | Q31: 11029 | R31: =Q31/B31 -> 7.9018448862618662E-2
A32: 30 | B32: 151452 | C32: 133589 | D32: =C32/B32 -> 0.88205504054089745 | E32: 9742 | F32: =E32/B32 -> 6.4324010247471142E-2 | G32: 1017 | H32: =G32/B32 -> 6.714998811504635E-3 | I32: 2371 | J32: =I32/B32 -> 1.5655125056123393E-2 | K32: 111 | L32: =K32/B32 -> 7.3290547500198084E-4 | M32: 4243 | N32: =M32/B32 -> 2.8015476850751394E-2 | O32: 379 | P32: =O32/B32 -> 2.5024430182500066E-3 | Q32: 8671 | R32: =Q32/B32 -> 5.725246282650609E-2
A33: 31 | B33: 157754 | C33: 139537 | D33: =C33/B33 -> 0.88452273793374492 | E33: 8259 | F33: =E33/B33 -> 5.2353664566350142E-2 | G33: 968 | H33: =G33/B33 -> 6.1361360092295602E-3 | I33: 2671 | J33: =I33/B33 -> 1.693142487670677E-2 | K33: 121 | L33: =K33/B33 -> 7.6701700115369502E-4 | M33: 5813 | N33: =M33/B33 -> 3.6848510972780406E-2 | O33: 385 | P33: =O33/B33 -> 2.4405086400344843E-3 | Q33: 10588 | R33: =Q33/B33 -> 6.7117157092688617E-2
A34: 32 | B34: 155555 | C34: 141992 | D34: =C34/B34 -> 0.91280897431776542 | E34: 9339 | F34: =E34/B34 -> 6.0036642988010674E-2 | G34: 801 | H34: =G34/B34 -> 5.1493041046575165E-3 | I34: 1329 | J34: =I34/B34 -> 8.5436019414355056E-3 | K34: 65 | L34: =K34/B34 -> 4.1785863520941145E-4 | M34: 1777 | N34: =M34/B34 -> 1.1423612227186526E-2 | O34: 252 | P34: =O34/B34 -> 1.620005785734949E-3 | Q34: 3741 | R34: =Q34/B34 -> 2.4049371604898589E-2
A35: 33 | B35: 159071 | C35: 125722 | D35: =C35/B35 -> 0.79035147827070928 | E35: 21600 | F35: =E35/B35 -> 0.13578842152246481 | G35: 925 | H35: =G35/B35 -> 5.8150134216796269E-3 | I35: 7290 | J35: =I35/B35 -> 4.5828592263831874E-2 | K35: 102 | L35: =K35/B35 -> 6.412231016338616E-4 | M35: 2871 | N35: =M35/B35 -> 1.804854436069428E-2 | O35: 561 | P35: =O35/B35 -> 3.526727058986239E-3 | Q35: 6549 | R35: =Q35/B35 -> 4.1170295025491764E-2
A36: 34 | B36: 164367 | C36: 146444 | D36: =C36/B36 -> 0.89095743062780242 | E36: 9439 | F36: =E36/B36 -> 5.7426369040014115E-2 | G36: 1021 | H36: =G36/B36 -> 6.2117091630315086E-3 | I36: 5895 | J36: =I36/B36 -> 3.586486338498604E-2 | K36: 109 | L36: =K36/B36 -> 6.6315014571051369E-4 | M36: 1074 | N36: =M36/B36 -> 6.5341583164503824E-3 | O36: 385 | P36: =O36/B36 -> 2.3423193220050253E-3 | Q36: 3088 | R36: =Q36/B36 -> 1.8787226146367578E-2
A37: 35 | B37: 155399 | C37: 125329 | D37: =C37/B37 -> 0.80649811131345761 | E37: 23471 | F37: =E37/B37 -> 0.15103700796015418 | G37: 862 | H37: =G37/B37 -> 5.5470112420285848E-3 | I37: 3142 | J37: =I37/B37 -> 2.0218920327672637E-2 | K37: 69 | L37: =K37/B37 -> 4.4401830127606997E-4 | M37: 2065 | N37: =M37/B37 -> 1.3288373799059196E-2 | O37: 461 | P37: =O37/B37 -> 2.966557056351714E-3 | Q37: 4796 | R37: =Q37/B37 -> 3.0862489462609156E-2
A38: 36 | B38: 157070 | C38: 125719 | D38: =C38/B38 -> 0.80040109505316104 | E38: 25941 | F38: =E38/B38 -> 0.16515566308015533 | G38: 1015 | H38: =G38/B38 -> 6.4620869675940662E-3 | I38: 2542 | J38: =I38/B38 -> 1.6183867065639523E-2 | K38: 79 | L38: =K38/B38 -> 5.0296046348761699E-4 | M38: 1323 | N38: =M38/B38 -> 8.4229961163812313E-3 | O38: 451 | P38: =O38/B38 -> 2.8713312535812059E-3 | Q38: 3135 | R38: =Q38/B38 -> 1.9959253835869356E-2
A39: 37 | B39: 157937 | C39: 118838 | D39: =C39/B39 -> 0.75243926375706771 | E39: 35755 | F39: =E39/B39 -> 0.2263877368824278 | G39: 767 | H39: =G39/B39 -> 4.8563667791587783E-3 | I39: 806 | J39: =I39/B39 -> 5.103300683183801E-3 | K39: 51 | L39: =K39/B39 -> 3.2291356680195268E-4 | M39: 1450 | N39: =M39/B39 -> 9.1808759188790473E-3 | O39: 270 | P39: =O39/B39 -> 1.709542412480926E-3 | Q39: 2735 | R39: =Q39/B39 -> 1.7317031474575306E-2
A40: 38 | B40: 158321 | C40: 136849 | D40: =C40/B40 -> 0.86437680408789741 | E40: 17310 | F40: =E40/B40 -> 0.10933483239747097 | G40: 777 | H40: =G40/B40 -> 4.907750709002596E-3 | I40: 835 | J40: =I40/B40 -> 5.2740950347711299E-3 | K40: 50 | L40: =K40/B40 -> 3.1581407393839098E-4 | M40: 2270 | N40: =M40/B40 -> 1.4337958956802951E-2 | O40: 230 | P40: =O40/B40 -> 1.4527447401165986E-3 | Q40: 4229 | R40: =Q40/B40 -> 2.6711554373709111E-2
A41: 39 | B41: 160629 | C41: 152846 | D41: =C41/B41 -> 0.95154673191017813 | E41: 5403 | F41: =E41/B41 -> 3.363651644472667E-2 | G41: 719 | H41: =G41/B41 -> 4.4761531230350683E-3 | I41: 959 | J41: =I41/B41 -> 5.9702793393471912E-3 | K41: 49 | L41: =K41/B41 -> 3.0505076916372513E-4 | M41: 502 | N41: =M41/B41 -> 3.1252140024528572E-3 | O41: 151 | P41: =O41/B41 -> 9.4005441109637738E-4 | Q41: 1296 | R41: =Q41/B41 -> 8.0682815680854642E-3
A42: 40 | B42: 158792 | C42: 151041 | D42: =C42/B42 -> 0.95118771726535345 | E42: 5195 | F42: =E42/B42 -> 3.2715753942264093E-2 | G42: 846 | H42: =G42/B42 -> 5.3277243186054717E-3 | I42: 645 | J42: =I42/B42 -> 4.0619174769509795E-3 | K42: 45 | L42: =K42/B42 -> 2.8338959141518467E-4 | M42: 852 | N42: =M42/B42 -> 5.3655095974608292E-3 | O42: 168 | P42: =O42/B42 -> 1.0579878079500227E-3 | Q42: 1819 | R42: =Q42/B42 -> 1.1455237039649353E-2

A1: SB____ J. Watkins Election Data
A2: DISTRICT | B2: Rep. Gov '09 | C2: Dem. Gov '09 | D2: Rep. Lt. Gov '09 | E2: Dem. Lt. Gov '09 | F2: Rep. Att. Gen. '09 | G2: Dem. Att. Gen. '09
A3: 1 | B3: 0.62914531666325069 | C3: 0.37085468333674931 | D3: 0.58001215958405838 | E3: 0.41998784041594162 | F3: 0.61229071377617394 | G3: 0.38770928622382611
A4: 2 | B4: 0.66554859210874751 | C4: 0.33445140789125255 | D4: 0.60194458823794195 | E4: 0.398055411762058 | F4: 0.644745122718691 | G4: 0.355254877281309
A5: 3 | B5: 0.64951897381079637 | C5: 0.35048102618920363 | D5: 0.60405663813513022 | E5: 0.39594336186486978 | F5: 0.63528367583805556 | G5: 0.36471632416194444
A6: 4 | B6: 0.39711055865659739 | C6: 0.60288944134340261 | D6: 0.38030270218243944 | E6: 0.61969729781756056 | F6: 0.39532626368026402 | G6: 0.60467373631973598
A7: 5 | B7: 0.3175906308851224 | C7: 0.6824093691148776 | D7: 0.28961665242339152 | E7: 0.71038334757660848 | F7: 0.31309297912713474 | G7: 0.68690702087286526
A8: 6 | B8: 0.62684023668639055 | C8: 0.37315976331360945 | D8: 0.57991350312349832 | E8: 0.42008649687650168 | F8: 0.60046706471494604 | G8: 0.3995329352850539
A9: 7 | B9: 0.36122620233911995 | C9: 0.63877379766088005 | D9: 0.33983674561755656 | E9: 0.6601632543824435 | F9: 0.35570560068865337 | G9: 0.64429439931134669
A10: 8 | B10: 0.65653350310361291 | C10: 0.34346649689638709 | D10: 0.62201189832341808 | E10: 0.37798810167658192 | F10: 0.6406227475854116 | G10: 0.35937725241458846
A11: 9 | B11: 0.6448567649350414 | C11: 0.3551432350649586 | D11: 0.60990474800189776 | E11: 0.39009525199810224 | F11: 0.62119739616759884 | G11: 0.37880260383240122
A12: 10 | B12: 0.29797869075283906 | C12: 0.702021309247161 | D12: 0.2905160205346079 | E12: 0.7094839794653921 | F12: 0.31026502592403038 | G12: 0.68973497407596962
A13: 11 | B13: 0.35632852489530015 | C13: 0.64367147510469991 | D13: 0.34460118889184632 | E13: 0.65539881110815368 | F13: 0.36683700754649712 | G13: 0.63316299245350294
A14: 12 | B14: 0.67278545287321079 | C14: 0.32721454712678916 | D14: 0.64558988005707896 | E14: 0.35441011994292104 | F14: 0.67005516762470585 | G14: 0.32994483237529415
A15: 13 | B15: 0.63161492098340966 | C15: 0.3683850790165904 | D15: 0.62757507539395996 | E15: 0.37242492460603999 | F15: 0.64647803043255259 | G15: 0.35352196956744741
A16: 14 | B16: 0.66553410631846788 | C16: 0.33446589368153218 | D16: 0.63965329780554658 | E16: 0.36034670219445336 | F16: 0.66289874214802413 | G16: 0.33710125785197587
A17: 15 | B17: 0.67148221550015641 | C17: 0.32851778449984353 | D17: 0.6410386165738915 | E17: 0.3589613834261085 | F17: 0.65996398034655801 | G17: 0.34003601965344199
A18: 16 | B18: 0.71764936721279304 | C18: 0.2823506327872069 | D18: 0.69473666853543514 | E18: 0.30526333146456486 | F18: 0.71289569922721785 | G18: 0.28710430077278221
A19: 17 | B19: 0.66584876674916793 | C19: 0.33415123325083212 | D19: 0.64248940036341606 | E19: 0.35751059963658388 | F19: 0.64523305542356046 | G19: 0.35476694457643959
A20: 18 | B20: 0.64758520858007629 | C20: 0.35241479141992366 | D20: 0.63192355806339995 | E20: 0.36807644193660005 | F20: 0.62281449893390195 | G20: 0.37718550106609811
A21: 19 | B21: 0.63779615556548952 | C21: 0.36220384443451048 | D21: 0.61303748699344751 | E21: 0.38696251300655249 | F21: 0.61818744548549565 | G21: 0.38181255451450435
A22: 20 | B22: 0.52138717689265013 | C22: 0.47861282310734982 | D22: 0.48839935826237196 | E22: 0.51160064173762809 | F22: 0.50038612423933526 | G22: 0.49961387576066474
A23: 21 | B23: 0.55614475098530991 | C23: 0.44385524901469009 | D23: 0.52875033786827641 | E23: 0.47124966213172359 | F23: 0.52658250676284946 | G23: 0.4734174932371506
A24: 22 | B24: 0.46652262746295298 | C24: 0.53347737253704708 | D24: 0.44325512157085134 | E24: 0.55674487842914866 | F24: 0.43991380739267361 | G24: 0.56008619260732639
A25: 23 | B25: 0.39000551927145616 | C25: 0.60999448072854379 | D25: 0.36495672954223801 | E25: 0.63504327045776199 | F25: 0.36497232944240338 | G25: 0.63502767055759657
A26: 24 | B26: 0.33906066377598576 | C26: 0.66093933622401424 | D26: 0.32020348540257831 | E26: 0.67979651459742174 | F26: 0.31867659696362072 | G26: 0.68132340303637928
A27: 25 | B27: 0.4379588839941263 | C27: 0.5620411160058737 | D27: 0.41554290513741776 | E27: 0.58445709486258224 | F27: 0.39962419968451329 | G27: 0.60037580031548665
A28: 26 | B28: 0.52228226979837866 | C28: 0.47771773020162128 | D28: 0.49803297899054155 | E28: 0.50196702100945845 | F28: 0.48582013018271625 | G28: 0.5141798698172837
A29: 27 | B29: 0.5010029687876113 | C29: 0.4989970312123887 | D29: 0.47712774547803616 | E29: 0.52287225452196384 | F29: 0.46962186659113442 | G29: 0.53037813340886564
A30: 28 | B30: 0.59500796874196704 | C30: 0.40499203125803301 | D30: 0.56941597696079704 | E30: 0.43058402303920296 | F30: 0.57164677557149146 | G30: 0.42835322442850854
A31: 29 | B31: 0.6374171428571429 | C31: 0.36258285714285715 | D31: 0.61610284478991795 | E31: 0.38389715521008211 | F31: 0.61504842085892397 | G31: 0.38495157914107608
A32: 30 | B32: 0.69328831461160534 | C32: 0.30671168538839472 | D32: 0.67425435143881751 | E32: 0.32574564856118254 | F32: 0.67585000546627305 | G32: 0.32414999453372689
A33: 31 | B33: 0.70948301838061212 | C33: 0.29051698161938788 | D33: 0.69575363678000479 | E33: 0.30424636321999521 | F33: 0.69601553635332114 | G33: 0.30398446364667886
A34: 32 | B34: 0.71893051348147585 | C34: 0.28106948651852409 | D34: 0.72116649194701232 | E34: 0.27883350805298773 | F34: 0.72621663450331508 | G34: 0.27378336549668497
A35: 33 | B35: 0.4991106170094497 | C35: 0.5008893829905503 | D35: 0.47490130778873318 | E35: 0.52509869221126682 | F35: 0.49100604604003156 | G35: 0.50899395395996849
A36: 34 | B36: 0.55828051804904932 | C36: 0.44171948195095068 | D36: 0.56163697216265507 | E36: 0.43836302783734493 | F36: 0.58050455951472302 | G36: 0.41949544048527698
A37: 35 | B37: 0.61061026352288483 | C37: 0.38938973647711511 | D37: 0.59872487277973829 | E37: 0.40127512722026165 | F37: 0.61686995830248237 | G37: 0.38313004169751763
A38: 36 | B38: 0.71095715587967179 | C38: 0.28904284412032816 | D38: 0.69868720721387967 | E38: 0.30131279278612033 | F38: 0.70928056620903046 | G38: 0.29071943379096954
A39: 37 | B39: 0.67750581372433094 | C39: 0.32249418627566906 | D39: 0.66895996781331724 | E39: 0.33104003218668276 | F39: 0.68131668650033284 | G39: 0.31868331349966722
A40: 38 | B40: 0.65499302911126367 | C40: 0.34500697088873628 | D40: 0.64096278607806256 | E40: 0.35903721392193738 | F40: 0.64720914879570668 | G40: 0.35279085120429327
A41: 39 | B41: 0.67276233541694375 | C41: 0.32723766458305625 | D41: 0.66375099397932524 | E41: 0.33624900602067476 | F41: 0.65454628822963001 | G41: 0.34545371177037004
A42: 40 | B42: 0.74028413760713863 | C42: 0.25971586239286132 | D42: 0.75221345106413606 | E42: 0.24778654893586391 | F42: 0.74200144334856866 | G42: 0.25799855665143134