A1: SB 455 Introduced - Vogel Population Totals
A2: DISTRICT | B2: Total Pop. | C2: Target | D2: Difference | E2: Deviation
A3: 1 | B3: 727366 | C3: 727365.818181818 | D3: =B3-C3 -> 0.18181818199809641 | E3: =(B3-C3)/C3 -> 2.4996800434282676E-7
A4: 2 | B4: 727366 | C4: 727365.818181818 | D4: =B4-C4 -> 0.18181818199809641 | E4: =(B4-C4)/C4 -> 2.4996800434282676E-7
A5: 3 | B5: 727366 | C5: 727365.818181818 | D5: =B5-C5 -> 0.18181818199809641 | E5: =(B5-C5)/C5 -> 2.4996800434282676E-7
A6: 4 | B6: 727366 | C6: 727365.818181818 | D6: =B6-C6 -> 0.18181818199809641 | E6: =(B6-C6)/C6 -> 2.4996800434282676E-7
A7: 5 | B7: 727365 | C7: 727365.818181818 | D7: =B7-C7 -> -0.81818181800190359 | E7: =(B7-C7)/C7 -> -1.1248560181822903E-6
A8: 6 | B8: 727366 | C8: 727365.818181818 | D8: =B8-C8 -> 0.18181818199809641 | E8: =(B8-C8)/C8 -> 2.4996800434282676E-7
A9: 7 | B9: 727366 | C9: 727365.818181818 | D9: =B9-C9 -> 0.18181818199809641 | E9: =(B9-C9)/C9 -> 2.4996800434282676E-7
A10: 8 | B10: 727366 | C10: 727365.818181818 | D10: =B10-C10 -> 0.18181818199809641 | E10: =(B10-C10)/C10 -> 2.4996800434282676E-7
A11: 9 | B11: 727366 | C11: 727365.818181818 | D11: =B11-C11 -> 0.18181818199809641 | E11: =(B11-C11)/C11 -> 2.4996800434282676E-7
A12: 10 | B12: 727365 | C12: 727365.818181818 | D12: =B12-C12 -> -0.81818181800190359 | E12: =(B12-C12)/C12 -> -1.1248560181822903E-6
A13: 11 | B13: 727366 | C13: 727365.818181818 | D13: =B13-C13 -> 0.18181818199809641 | E13: =(B13-C13)/C13 -> 2.4996800434282676E-7

A1: SB 455 Introduced - Vogel Racial Demographics
A2: DISTRICT | B2: Total Population | C2: White | D2: % White | E2: Black | F2: % Black | G2: AIAN | H2: % AIAN | I2: Asian | J2: % Asian | K2: HawPI | L2: % HawPI | M2: Other | N2: % Other | O2: Multi | P2: % Multi | Q2: Total Hispanic | R2: % Hispanic
A3: 1 | B3: 727366 | C3: 527650 | D3: =C3/B3 -> 0.72542571415215995 | E3: 130061 | F3: =E3/B3 -> 0.1788109424966248 | G3: 6435 | H3: =G3/B3 -> 8.8469903734845999E-3 | I3: 29672 | J3: =I3/B3 -> 4.0793768199228447E-2 | K3: 1035 | L3: =K3/B3 -> 1.4229425076233973E-3 | M3: 26577 | N3: =M3/B3 -> 3.6538688913146891E-2 | O3: 5936 | P3: =O3/B3 -> 8.1609533577318705E-3 | Q3: 61279 | R3: =Q3/B3 -> 8.4247820217057165E-2
A4: 2 | B4: 727366 | C4: 483618 | D4: =C4/B4 -> 0.66488947792445618 | E4: 167145 | F4: =E4/B4 -> 0.22979490380358719 | G4: 5990 | H4: =G4/B4 -> 8.2351938363904829E-3 | I4: 42532 | J4: =I4/B4 -> 5.8474000709409016E-2 | K4: 1490 | L4: =K4/B4 -> 2.0484872815061468E-3 | M4: 18345 | N4: =M4/B4 -> 2.5221140388745143E-2 | O4: 8246 | P4: =O4/B4 -> 1.133679605590583E-2 | Q4: 50022 | R4: =Q4/B4 -> 6.877143006409428E-2
A5: 3 | B5: 727366 | C5: 246709 | D5: =C5/B5 -> 0.33918137498865769 | E5: 432598 | F5: =E5/B5 -> 0.59474597382885641 | G5: 5547 | H5: =G5/B5 -> 7.6261469466540914E-3 | I5: 16132 | J5: =I5/B5 -> 2.2178655587420913E-2 | K5: 966 | L5: =K5/B5 -> 1.3280796737818374E-3 | M5: 16776 | N5: =M5/B5 -> 2.3064042036608806E-2 | O5: 8638 | P5: =O5/B5 -> 1.1875726938020199E-2 | Q5: 37041 | R5: =Q5/B5 -> 5.0924843888771262E-2
A6: 4 | B6: 727366 | C6: 447441 | D6: =C6/B6 -> 0.61515248169422276 | E6: 235678 | F6: =E6/B6 -> 0.32401569498711791 | G6: 5098 | H6: =G6/B6 -> 7.008851114844521E-3 | I6: 18153 | J6: =I6/B6 -> 2.4957174242403412E-2 | K6: 782 | L6: =K6/B6 -> 1.0751121168710114E-3 | M6: 15248 | N6: =M6/B6 -> 2.0963311455305857E-2 | O6: 4966 | P6: =O6/B6 -> 6.827374389234581E-3 | Q6: 34360 | R6: =Q6/B6 -> 4.7238941605739063E-2
A7: 5 | B7: 727365 | C7: 542589 | D7: =C7/B7 -> 0.74596523066135989 | E7: 154368 | F7: =E7/B7 -> 0.21222907343630776 | G7: 4149 | H7: =G7/B7 -> 5.7041512858056137E-3 | I7: 13088 | J7: =I7/B7 -> 1.7993717047149641E-2 | K7: 371 | L7: =K7/B7 -> 5.100602861012009E-4 | M7: 10554 | N7: =M7/B7 -> 1.450990905528861E-2 | O7: 2246 | P7: =O7/B7 -> 3.0878582279873241E-3 | Q7: 22973 | R7: =Q7/B7 -> 3.1583867796773288E-2
A8: 6 | B8: 727366 | C8: 607889 | D8: =C8/B8 -> 0.83574019132046318 | E8: 84851 | F8: =E8/B8 -> 0.11665516397522017 | G8: 4609 | H8: =G8/B8 -> 6.3365623358804237E-3 | I8: 12343 | J8: =I8/B8 -> 1.6969448668208303E-2 | K8: 407 | L8: =K8/B8 -> 5.5955323729731663E-4 | M8: 14868 | N8: =M8/B8 -> 2.0440878457337847E-2 | O8: 2399 | P8: =O8/B8 -> 3.2982020055927828E-3 | Q8: 31018 | R8: =Q8/B8 -> 4.2644280870978296E-2
A9: 7 | B9: 727366 | C9: 556598 | D9: =C9/B9 -> 0.76522411000789148 | E9: 111369 | F9: =E9/B9 -> 0.15311273829131414 | G9: 4698 | H9: =G9/B9 -> 6.4589216432992466E-3 | I9: 33412 | J9: =I9/B9 -> 4.5935608758176767E-2 | K9: 559 | L9: =K9/B9 -> 7.685264364845209E-4 | M9: 16836 | N9: =M9/B9 -> 2.3146531457340597E-2 | O9: 3894 | P9: =O9/B9 -> 5.3535634054932453E-3 | Q9: 36815 | R9: =Q9/B9 -> 5.0614133737348188E-2
A10: 8 | B10: 727366 | C10: 454669 | D10: =C10/B10 -> 0.62508970724504587 | E10: 105900 | F10: =E10/B10 -> 0.14559382759161138 | G10: 5554 | H10: =G10/B10 -> 7.6357707124061341E-3 | I10: 89760 | J10: =I10/B10 -> 0.12340417341475955 | K10: 962 | L10: =K10/B10 -> 1.3225803790663847E-3 | M10: 63612 | N10: =M10/B10 -> 8.7455283859844982E-2 | O10: 6909 | P10: =O10/B10 -> 9.4986567972657511E-3 | Q10: 135594 | R10: =Q10/B10 -> 0.18641784191177482
A11: 9 | B11: 727366 | C11: 666198 | D11: =C11/B11 -> 0.9159047852112967 | E11: 40053 | F11: =E11/B11 -> 5.5065812809507182E-2 | G11: 3526 | H11: =G11/B11 -> 4.8476282916715928E-3 | I11: 9626 | J11: =I11/B11 -> 1.3234052732737027E-2 | K11: 272 | L11: =K11/B11 -> 3.7395204065078654E-4 | M11: 6506 | N11: =M11/B11 -> 8.9446028546838873E-3 | O11: 1185 | P11: =O11/B11 -> 1.6291660594528752E-3 | Q11: 13904 | R11: =Q11/B11 -> 1.9115548430913735E-2
A12: 10 | B12: 727365 | C12: 527743 | D12: =C12/B12 -> 0.7255545702638978 | E12: 54611 | F12: =E12/B12 -> 7.5080599148982977E-2 | G12: 4011 | H12: =G12/B12 -> 5.5144253572827944E-3 | I12: 96867 | J12: =I12/B12 -> 0.13317522839289764 | K12: 778 | L12: =K12/B12 -> 1.0696142926866154E-3 | M12: 38400 | N12: =M12/B12 -> 5.2793301849827806E-2 | O12: 4955 | P12: =O12/B12 -> 6.8122606944243953E-3 | Q12: 85367 | R12: =Q12/B12 -> 0.11736473434932942
A13: 11 | B13: 727366 | C13: 425748 | D13: =C13/B13 -> 0.58532843162864368 | E13: 96820 | F13: =E13/B13 -> 0.13311042858753364 | G13: 5246 | H13: =G13/B13 -> 7.2123250193162729E-3 | I13: 137228 | J13: =I13/B13 -> 0.18866430380303725 | K13: 957 | L13: =K13/B13 -> 1.3157062606720688E-3 | M13: 54161 | N13: =M13/B13 -> 7.4461825270909013E-2 | O13: 7206 | P13: =O13/B13 -> 9.9069794298881162E-3 | Q13: 123452 | R13: =Q13/B13 -> 0.169724732803018

A1: SB 455 Introduced - Vogel Voting Age Population
A2: DISTRICT | B2: Voting Age Persons | C2: VAP White | D2: % VAP White | E2: VAP Black | F2: % VAP Black | G2: VAP AIAN | H2: % VAP AIAN | I2: VAP Asian | J2: % VAP Asian | K2: VAP HawPI | L2: % VAP HawPI | M2: VAP Other | N2: % VAP Other | O2: VAP Multi | P2: % VAP Multi | Q2: Voting Age Hispanic | R2: % VAP Hispanic
A3: 1 | B3: 543139 | C3: 405154 | D3: =C3/B3 -> 0.74594901121075818 | E3: 91813 | F3: =E3/B3 -> 0.1690414424300225 | G3: 4600 | H3: =G3/B3 -> 8.4692868676342521E-3 | I3: 20586 | J3: =I3/B3 -> 3.790189988198233E-2 | K3: 681 | L3: =K3/B3 -> 1.2538226862736795E-3 | M3: 17157 | N3: =M3/B3 -> 3.158859886695671E-2 | O3: 3148 | P3: =O3/B3 -> 5.7959380563723101E-3 | Q3: 38845 | R3: =Q3/B3 -> 7.1519445298533157E-2
A4: 2 | B4: 565474 | C4: 389934 | D4: =C4/B4 -> 0.68957016591390585 | E4: 120203 | F4: =E4/B4 -> 0.21257033921984034 | G4: 4645 | H4: =G4/B4 -> 8.214347609262318E-3 | I4: 32070 | J4: =I4/B4 -> 5.671348284801777E-2 | K4: 1103 | L4: =K4/B4 -> 1.950575976967995E-3 | M4: 12774 | N4: =M4/B4 -> 2.2589898032447115E-2 | O4: 4745 | P4: =O4/B4 -> 8.3911903995586012E-3 | Q4: 33693 | R4: =Q4/B4 -> 5.9583641334526434E-2
A5: 3 | B5: 560148 | C5: 208797 | D5: =C5/B5 -> 0.37275327234945049 | E5: 315613 | F5: =E5/B5 -> 0.56344573219934735 | G5: 4353 | H5: =G5/B5 -> 7.7711604790162599E-3 | I5: 13294 | J5: =I5/B5 -> 2.3733013417882417E-2 | K5: 686 | L5: =K5/B5 -> 1.224676335539893E-3 | M5: 12117 | N5: =M5/B5 -> 2.1631783028770966E-2 | O5: 5288 | P5: =O5/B5 -> 9.4403621899926456E-3 | Q5: 25474 | R5: =Q5/B5 -> 4.5477266722366232E-2
A6: 4 | B6: 547486 | C6: 346507 | D6: =C6/B6 -> 0.63290568160647032 | E6: 171434 | F6: =E6/B6 -> 0.31312946815078374 | G6: 3750 | H6: =G6/B6 -> 6.8494902152749114E-3 | I6: 12721 | J6: =I6/B6 -> 2.3235297340936573E-2 | K6: 493 | L6: =K6/B6 -> 9.0047964696814164E-4 | M6: 9926 | N6: =M6/B6 -> 1.8130143967151673E-2 | O6: 2655 | P6: =O6/B6 -> 4.8494390724146373E-3 | Q6: 21796 | R6: =Q6/B6 -> 3.9811063661901853E-2
A7: 5 | B7: 574341 | C7: 436040 | D7: =C7/B7 -> 0.75920054462418662 | E7: 116491 | F7: =E7/B7 -> 0.2028254991372721 | G7: 3156 | H7: =G7/B7 -> 5.4949933924271473E-3 | I7: 10186 | J7: =I7/B7 -> 1.7735108585317783E-2 | K7: 283 | L7: =K7/B7 -> 4.9273863436529862E-4 | M7: 6784 | N7: =M7/B7 -> 1.1811798217435287E-2 | O7: 1401 | P7: =O7/B7 -> 2.4393174089957013E-3 | Q7: 15077 | R7: =Q7/B7 -> 2.6250955442846672E-2
A8: 6 | B8: 572702 | C8: 488611 | D8: =C8/B8 -> 0.85316796518957505 | E8: 60264 | F8: =E8/B8 -> 0.1052275005151021 | G8: 3520 | H8: =G8/B8 -> 6.1463029638450717E-3 | I8: 9010 | J8: =I8/B8 -> 1.5732440256887525E-2 | K8: 305 | L8: =K8/B8 -> 5.32563182946803E-4 | M8: 9534 | N8: =M8/B8 -> 1.6647401266278099E-2 | O8: 1458 | P8: =O8/B8 -> 2.5458266253653734E-3 | Q8: 19899 | R8: =Q8/B8 -> 3.474581894248667E-2
A9: 7 | B9: 549562 | C9: 428788 | D9: =C9/B9 -> 0.78023589695066253 | E9: 80425 | F9: =E9/B9 -> 0.14634381562043955 | G9: 3398 | H9: =G9/B9 -> 6.1831058188157118E-3 | I9: 23375 | J9: =I9/B9 -> 4.2533872429316437E-2 | K9: 373 | L9: =K9/B9 -> 6.7872232796299594E-4 | M9: 10975 | N9: =M9/B9 -> 1.9970449194085471E-2 | O9: 2228 | P9: =O9/B9 -> 4.0541376587173057E-3 | Q9: 23883 | R9: =Q9/B9 -> 4.3458244929598482E-2
A10: 8 | B10: 580212 | C10: 375269 | D10: =C10/B10 -> 0.64677910832592223 | E10: 79591 | F10: =E10/B10 -> 0.13717572197748409 | G10: 4213 | H10: =G10/B10 -> 7.2611390319400494E-3 | I10: 69715 | J10: =I10/B10 -> 0.12015435737282235 | K10: 738 | L10: =K10/B10 -> 1.2719488738598995E-3 | M10: 46039 | N10: =M10/B10 -> 7.9348582931755979E-2 | O10: 4647 | P10: =O10/B10 -> 8.0091414862153831E-3 | Q10: 98819 | R10: =Q10/B10 -> 0.17031533301620788
A11: 9 | B11: 584877 | C11: 538799 | D11: =C11/B11 -> 0.92121762353452097 | E11: 30113 | F11: =E11/B11 -> 5.1486038944940561E-2 | G11: 2853 | H11: =G11/B11 -> 4.8779486969055029E-3 | I11: 7897 | J11: =I11/B11 -> 1.3501984177869877E-2 | K11: 219 | L11: =K11/B11 -> 3.7443770228612171E-4 | M11: 4201 | N11: =M11/B11 -> 7.182706791342453E-3 | O11: 795 | P11: =O11/B11 -> 1.3592601521345514E-3 | Q11: 9226 | R11: =Q11/B11 -> 1.5774256809551409E-2
A12: 10 | B12: 520811 | C12: 387308 | D12: =C12/B12 -> 0.74366324828008623 | E12: 36962 | F12: =E12/B12 -> 7.0970083197167494E-2 | G12: 2706 | H12: =G12/B12 -> 5.1957427934509835E-3 | I12: 65528 | J12: =I12/B12 -> 0.12581915512537178 | K12: 541 | L12: =K12/B12 -> 1.0387645422235705E-3 | M12: 25026 | N12: =M12/B12 -> 4.8051980468922506E-2 | O12: 2740 | P12: =O12/B12 -> 5.2610255927774182E-3 | Q12: 55325 | R12: =Q12/B12 -> 0.10622855508044185
A13: 11 | B13: 548595 | C13: 334137 | D13: =C13/B13 -> 0.60907773494107675 | E13: 67339 | F13: =E13/B13 -> 0.12274811108376854 | G13: 3592 | H13: =G13/B13 -> 6.5476353229613829E-3 | I13: 101292 | J13: =I13/B13 -> 0.18463894129549122 | K13: 710 | L13: =K13/B13 -> 1.2942152225229905E-3 | M13: 37301 | N13: =M13/B13 -> 6.7993692979338133E-2 | O13: 4224 | P13: =O13/B13 -> 7.699669154841003E-3 | Q13: 84820 | R13: =Q13/B13 -> 0.15461314813295782

A1: SB 455 Introduced - Vogel Election Data
A2: DISTRICT | B2: Rep. Gov '09 | C2: Dem. Gov '09 | D2: Rep. Lt. Gov '09 | E2: Dem. Lt. Gov '09 | F2: Rep. Att. Gen. '09 | G2: Dem. Att. Gen. '09
A3: 1 | B3: 0.65542054365469471 | C3: 0.34457945634530535 | D3: 0.6286301069561907 | E3: 0.37136989304380935 | F3: 0.63510910868069015 | G3: 0.36489089131930991
A4: 2 | B4: 0.6169543363541784 | C4: 0.3830456636458216 | D4: 0.56501121599253545 | E4: 0.43498878400746455 | F4: 0.59655370843989775 | G4: 0.40344629156010231
A5: 3 | B5: 0.30653452604927994 | C5: 0.69346547395072 | D5: 0.29083867102241118 | E5: 0.70916132897758888 | F5: 0.30905699630546291 | G5: 0.69094300369453709
A6: 4 | B6: 0.62592076223590709 | C6: 0.37407923776409296 | D6: 0.59854623245329019 | E6: 0.40145376754670975 | F6: 0.62089509281911071 | G6: 0.37910490718088935
A7: 5 | B7: 0.61956337341221879 | C7: 0.38043662658778127 | D7: 0.60579421117878507 | E7: 0.39420578882121488 | F7: 0.62034026669551812 | G7: 0.37965973330448188
A8: 6 | B8: 0.67241945645559942 | C8: 0.32758054354440058 | D8: 0.66769814497919733 | E8: 0.33230185502080267 | F8: 0.67567094451920662 | G8: 0.32432905548079344
A9: 7 | B9: 0.67914219500561301 | C9: 0.32085780499438699 | D9: 0.65277185294345774 | E9: 0.34722814705654231 | F9: 0.67079662350529889 | G9: 0.32920337649470116
A10: 8 | B10: 0.39936804590240227 | C10: 0.60063195409759773 | D10: 0.37794023961058643 | E10: 0.62205976038941357 | F10: 0.37500618505690253 | G10: 0.62499381494309747
A11: 9 | B11: 0.6612431237223384 | C11: 0.33875687627766154 | D11: 0.65739717543625298 | E11: 0.34260282456374697 | F11: 0.6582866077863696 | G11: 0.3417133922136304
A12: 10 | B12: 0.6254022897941125 | C12: 0.3745977102058875 | D12: 0.60290030359117208 | E12: 0.39709969640882797 | F12: 0.60042748091603049 | G12: 0.39957251908396946
A13: 11 | B13: 0.49776649546411633 | C13: 0.50223350453588367 | D13: 0.46960358824967136 | E13: 0.53039641175032859 | F13: 0.46537370477884532 | G13: 0.53462629522115468