A1: Ind. Bipartisan Advisory Comm. on Redistricting - Opt 1 Population Totals
A2: DISTRICT | B2: Total Population | C2: Target | D2: Difference | E2: Deviation
A3: 1 | B3: 200699 | C3: 200025.60000000001 | D3: =B3-C3 -> 673.39999999999418 | E3: =(B3-C3)/C3 -> 3.3665690791578385E-3
A4: 2 | B4: 200274 | C4: 200025.60000000001 | D4: =B4-C4 -> 248.39999999999418 | E4: =(B4-C4)/C4 -> 1.2418410443462945E-3
A5: 3 | B5: 198898 | C5: 200025.60000000001 | D5: =B5-C5 -> -1127.6000000000058 | E5: =(B5-C5)/C5 -> -5.6372784283611988E-3
A6: 4 | B6: 197941 | C6: 200025.60000000001 | D6: =B6-C6 -> -2084.6000000000058 | E6: =(B6-C6)/C6 -> -1.0421666026748605E-2
A7: 5 | B7: 199320 | C7: 200025.60000000001 | D7: =B7-C7 -> -705.60000000000582 | E7: =(B7-C7)/C7 -> -3.5275484737953833E-3
A8: 6 | B8: 197092 | C8: 200025.60000000001 | D8: =B8-C8 -> -2933.6000000000058 | E8: =(B8-C8)/C8 -> -1.4666122736289783E-2
A9: 7 | B9: 198077 | C9: 200025.60000000001 | D9: =B9-C9 -> -1948.6000000000058 | E9: =(B9-C9)/C9 -> -9.7417530556089104E-3
A10: 8 | B10: 203869 | C10: 200025.60000000001 | D10: =B10-C10 -> 3843.3999999999942 | E10: =(B10-C10)/C10 -> 1.9214540538811001E-2
A11: 9 | B11: 202682 | C11: 200025.60000000001 | D11: =B11-C11 -> 2656.3999999999942 | E11: =(B11-C11)/C11 -> 1.3280300121584408E-2
A12: 10 | B12: 200177 | C12: 200025.60000000001 | D12: =B12-C12 -> 151.39999999999418 | E12: =(B12-C12)/C12 -> 7.5690311640107158E-4
A13: 11 | B13: 196346 | C13: 200025.60000000001 | D13: =B13-C13 -> -3679.6000000000058 | E13: =(B13-C13)/C13 -> -1.8395645357394283E-2
A14: 12 | B14: 198644 | C14: 200025.60000000001 | D14: =B14-C14 -> -1381.6000000000058 | E14: =(B14-C14)/C14 -> -6.9071158891662156E-3
A15: 13 | B15: 197891 | C15: 200025.60000000001 | D15: =B15-C15 -> -2134.6000000000058 | E15: =(B15-C15)/C15 -> -1.067163403084408E-2
A16: 14 | B16: 199238 | C16: 200025.60000000001 | D16: =B16-C16 -> -787.60000000000582 | E16: =(B16-C16)/C16 -> -3.9374960005119633E-3
A17: 15 | B17: 201984 | C17: 200025.60000000001 | D17: =B17-C17 -> 1958.3999999999942 | E17: =(B17-C17)/C17 -> 9.7907467844115664E-3
A18: 16 | B18: 200731 | C18: 200025.60000000001 | D18: =B18-C18 -> 705.39999999999418 | E18: =(B18-C18)/C18 -> 3.5265486017789431E-3
A19: 17 | B19: 202958 | C19: 200025.60000000001 | D19: =B19-C19 -> 2932.3999999999942 | E19: =(B19-C19)/C19 -> 1.4660123504191434E-2
A20: 18 | B20: 197473 | C20: 200025.60000000001 | D20: =B20-C20 -> -2552.6000000000058 | E20: =(B20-C20)/C20 -> -1.2761366545082259E-2
A21: 19 | B21: 200811 | C21: 200025.60000000001 | D21: =B21-C21 -> 785.39999999999418 | E21: =(B21-C21)/C21 -> 3.9264974083317045E-3
A22: 20 | B22: 196546 | C22: 200025.60000000001 | D22: =B22-C22 -> -3479.6000000000058 | E22: =(B22-C22)/C22 -> -1.7395773341012378E-2
A23: 21 | B23: 200497 | C23: 200025.60000000001 | D23: =B23-C23 -> 471.39999999999418 | E23: =(B23-C23)/C23 -> 2.3566983426121166E-3
A24: 22 | B24: 200786 | C24: 200025.60000000001 | D24: =B24-C24 -> 760.39999999999418 | E24: =(B24-C24)/C24 -> 3.8015134062839664E-3
A25: 23 | B25: 201856 | C25: 200025.60000000001 | D25: =B25-C25 -> 1830.3999999999942 | E25: =(B25-C25)/C25 -> 9.1508286939271481E-3
A26: 24 | B26: 201475 | C26: 200025.60000000001 | D26: =B26-C26 -> 1449.3999999999942 | E26: =(B26-C26)/C26 -> 7.246072502719623E-3
A27: 25 | B27: 202450 | C27: 200025.60000000001 | D27: =B27-C27 -> 2424.3999999999942 | E27: =(B27-C27)/C27 -> 1.21204485825814E-2
A28: 26 | B28: 198622 | C28: 200025.60000000001 | D28: =B28-C28 -> -1403.6000000000058 | E28: =(B28-C28)/C28 -> -7.0171018109682253E-3
A29: 27 | B29: 199368 | C29: 200025.60000000001 | D29: =B29-C29 -> -657.60000000000582 | E29: =(B29-C29)/C29 -> -3.2875791898637264E-3
A30: 28 | B30: 199215 | C30: 200025.60000000001 | D30: =B30-C30 -> -810.60000000000582 | E30: =(B30-C30)/C30 -> -4.052481282395882E-3
A31: 29 | B31: 202040 | C31: 200025.60000000001 | D31: =B31-C31 -> 2014.3999999999942 | E31: =(B31-C31)/C31 -> 1.00707109489985E-2
A32: 30 | B32: 202260 | C32: 200025.60000000001 | D32: =B32-C32 -> 2234.3999999999942 | E32: =(B32-C32)/C32 -> 1.1170570167018593E-2
A33: 31 | B33: 200796 | C33: 200025.60000000001 | D33: =B33-C33 -> 770.39999999999418 | E33: =(B33-C33)/C33 -> 3.8515070071030617E-3
A34: 32 | B34: 202734 | C34: 200025.60000000001 | D34: =B34-C34 -> 2708.3999999999942 | E34: =(B34-C34)/C34 -> 1.3540266845843703E-2
A35: 33 | B35: 197631 | C35: 200025.60000000001 | D35: =B35-C35 -> -2394.6000000000058 | E35: =(B35-C35)/C35 -> -1.1971467652140555E-2
A36: 34 | B36: 199088 | C36: 200025.60000000001 | D36: =B36-C36 -> -937.60000000000582 | E36: =(B36-C36)/C36 -> -4.6874000127983904E-3
A37: 35 | B37: 201159 | C37: 200025.60000000001 | D37: =B37-C37 -> 1133.3999999999942 | E37: =(B37-C37)/C37 -> 5.666274716836216E-3
A38: 36 | B38: 200335 | C38: 200025.60000000001 | D38: =B38-C38 -> 309.39999999999418 | E38: =(B38-C38)/C38 -> 1.5468020093427749E-3
A39: 37 | B39: 201234 | C39: 200025.60000000001 | D39: =B39-C39 -> 1208.3999999999942 | E39: =(B39-C39)/C39 -> 6.0412267229794292E-3
A40: 38 | B40: 198113 | C40: 200025.60000000001 | D40: =B40-C40 -> -1912.6000000000058 | E40: =(B40-C40)/C40 -> -9.5617760926601687E-3
A41: 39 | B41: 198294 | C41: 200025.60000000001 | D41: =B41-C41 -> -1731.6000000000058 | E41: =(B41-C41)/C41 -> -8.6568919178345461E-3
A42: 40 | B42: 201420 | C42: 200025.60000000001 | D42: =B42-C42 -> 1394.3999999999942 | E42: =(B42-C42)/C42 -> 6.9711076982145988E-3

A1: Ind. Bipartisan Advisory Comm. on Redistricting - Opt 1 Racial Demographics
A2: DISTRICT | B2: Total Population | C2: White | D2: % White | E2: Black | F2: % Black | G2: AIAN | H2: % AIAN | I2: Asian | J2: % Asian | K2: HawPI | L2: % HawPI | M2: Other | N2: % Other | O2: Multi | P2: % Multi | Q2: Total Hispanic | R2: % Hispanic
A3: 1 | B3: 200699 | C3: 149711 | D3: =C3/B3 -> 0.7459479120473943 | E3: 35208 | F3: =E3/B3 -> 0.17542688304376206 | G3: 1693 | H3: =G3/B3 -> 8.4355178650616092E-3 | I3: 7589 | J3: =I3/B3 -> 3.7812844109836125E-2 | K3: 316 | L3: =K3/B3 -> 1.5744971325218362E-3 | M3: 4411 | N3: =M3/B3 -> 2.1978186239094366E-2 | O3: 1771 | P3: =O3/B3 -> 8.8241595623296584E-3 | Q3: 11171 | R3: =Q3/B3 -> 5.5660466668991875E-2
A4: 2 | B4: 200274 | C4: 68795 | D4: =C4/B4 -> 0.34350439897340646 | E4: 115666 | F4: =E4/B4 -> 0.5775387718825209 | G4: 1494 | H4: =G4/B4 -> 7.459780101261272E-3 | I4: 6054 | J4: =I4/B4 -> 3.0228586836034632E-2 | K4: 369 | L4: =K4/B4 -> 1.8424758081428442E-3 | M4: 4442 | N4: =M4/B4 -> 2.2179613928917385E-2 | O4: 3454 | P4: =O4/B4 -> 1.7246372469716487E-2 | Q4: 12326 | R4: =Q4/B4 -> 6.1545682415091327E-2
A5: 3 | B5: 198898 | C5: 137879 | D5: =C5/B5 -> 0.69321461251495742 | E5: 44099 | F5: =E5/B5 -> 0.22171665878993252 | G5: 1847 | H5: =G5/B5 -> 9.2861667789520264E-3 | I5: 7911 | J5: =I5/B5 -> 3.9774155597341349E-2 | K5: 424 | L5: =K5/B5 -> 2.1317459200193064E-3 | M5: 4114 | N5: =M5/B5 -> 2.0683968667357139E-2 | O5: 2624 | P5: =O5/B5 -> 1.3192691731440236E-2 | Q5: 12206 | R5: =Q5/B5 -> 6.1368138442819936E-2
A6: 4 | B6: 197941 | C6: 159229 | D6: =C6/B6 -> 0.80442657155414998 | E6: 31429 | F6: =E6/B6 -> 0.15877963635628797 | G6: 2042 | H6: =G6/B6 -> 1.031620533391263E-2 | I6: 2566 | J6: =I6/B6 -> 1.2963458808432816E-2 | K6: 123 | L6: =K6/B6 -> 6.2139728504958548E-4 | M6: 1747 | N6: =M6/B6 -> 8.8258622518831362E-3 | O6: 805 | P6: =O6/B6 -> 4.0668684102838724E-3 | Q6: 4702 | R6: =Q6/B6 -> 2.3754553124415861E-2
A7: 5 | B7: 199320 | C7: 64966 | D7: =C7/B7 -> 0.32593818984547462 | E7: 119307 | F7: =E7/B7 -> 0.59857013847080076 | G7: 1376 | H7: =G7/B7 -> 6.9034718041340558E-3 | I7: 6513 | J7: =I7/B7 -> 3.2676098735701382E-2 | K7: 295 | L7: =K7/B7 -> 1.4800321091711821E-3 | M7: 4281 | N7: =M7/B7 -> 2.1478025285972306E-2 | O7: 2582 | P7: =O7/B7 -> 1.2954043748745736E-2 | Q7: 11050 | R7: =Q7/B7 -> 5.5438490868954443E-2
A8: 6 | B8: 197092 | C8: 173535 | D8: =C8/B8 -> 0.88047713758041934 | E8: 10960 | F8: =E8/B8 -> 5.5608548292168124E-2 | G8: 1226 | H8: =G8/B8 -> 6.2204452742881493E-3 | I8: 4006 | J8: =I8/B8 -> 2.0325533253505976E-2 | K8: 129 | L8: =K8/B8 -> 6.5451667241694239E-4 | M8: 6548 | N8: =M8/B8 -> 3.3223063340977819E-2 | O8: 688 | P8: =O8/B8 -> 3.4907555862236923E-3 | Q8: 13701 | R8: =Q8/B8 -> 6.951575913786455E-2
A9: 7 | B9: 198077 | C9: 128684 | D9: =C9/B9 -> 0.64966654381881794 | E9: 45542 | F9: =E9/B9 -> 0.22992068740944177 | G9: 1786 | H9: =G9/B9 -> 9.0166955274968829E-3 | I9: 13710 | J9: =I9/B9 -> 6.921550710077394E-2 | K9: 453 | L9: =K9/B9 -> 2.2869894031109115E-3 | M9: 5530 | N9: =M9/B9 -> 2.7918435759830773E-2 | O9: 2372 | P9: =O9/B9 -> 1.1975140980527774E-2 | Q9: 15039 | R9: =Q9/B9 -> 7.592501905824503E-2
A10: 8 | B10: 203869 | C10: 157463 | D10: =C10/B10 -> 0.77237343588284635 | E10: 31484 | F10: =E10/B10 -> 0.15443250322511023 | G10: 1559 | H10: =G10/B10 -> 7.6470674796070021E-3 | I10: 6985 | J10: =I10/B10 -> 3.4262197783871018E-2 | K10: 362 | L10: =K10/B10 -> 1.7756500497868729E-3 | M10: 4690 | N10: =M10/B10 -> 2.3004968877073022E-2 | O10: 1326 | P10: =O10/B10 -> 6.5041767017055066E-3 | Q10: 12470 | R10: =Q10/B10 -> 6.1166729615586481E-2
A11: 9 | B11: 202682 | C11: 67971 | D11: =C11/B11 -> 0.33535785121520412 | E11: 123135 | F11: =E11/B11 -> 0.607528048864724 | G11: 1716 | H11: =G11/B11 -> 8.466464708262204E-3 | I11: 5527 | J11: =I11/B11 -> 2.7269318439723311E-2 | K11: 121 | L11: =K11/B11 -> 5.9699430635182205E-4 | M11: 2295 | N11: =M11/B11 -> 1.1323156471714311E-2 | O11: 1917 | P11: =O11/B11 -> 9.4581659940201901E-3 | Q11: 5543 | R11: =Q11/B11 -> 2.7348259835604544E-2
A12: 10 | B12: 200177 | C12: 161722 | D12: =C12/B12 -> 0.80789501291357146 | E12: 27471 | F12: =E12/B12 -> 0.13723354830974588 | G12: 1100 | H12: =G12/B12 -> 5.495136803928523E-3 | I12: 6399 | J12: =I12/B12 -> 3.1966709462126021E-2 | K12: 118 | L12: =K12/B12 -> 5.8947831169415068E-4 | M12: 2547 | N12: =M12/B12 -> 1.2723739490550862E-2 | O12: 820 | P12: =O12/B12 -> 4.0963747083830812E-3 | Q12: 6597 | R12: =Q12/B12 -> 3.2955834086833155E-2
A13: 11 | B13: 196346 | C13: 130757 | D13: =C13/B13 -> 0.66595194197997409 | E13: 48431 | F13: =E13/B13 -> 0.24666150570930909 | G13: 1487 | H13: =G13/B13 -> 7.5733653855948177E-3 | I13: 6053 | J13: =I13/B13 -> 3.0828231794892691E-2 | K13: 184 | L13: =K13/B13 -> 9.3712120440446966E-4 | M13: 7871 | N13: =M13/B13 -> 4.0087396738410767E-2 | O13: 1563 | P13: =O13/B13 -> 7.9604371874140555E-3 | Q13: 14828 | R13: =Q13/B13 -> 7.5519745754942802E-2
A14: 12 | B14: 198644 | C14: 144936 | D14: =C14/B14 -> 0.7296268701798192 | E14: 26594 | F14: =E14/B14 -> 0.13387769074323916 | G14: 953 | H14: =G14/B14 -> 4.7975272346509334E-3 | I14: 19490 | J14: =I14/B14 -> 9.8115221199734204E-2 | K14: 115 | L14: =K14/B14 -> 5.789251122611305E-4 | M14: 5341 | N14: =M14/B14 -> 2.6887295865971286E-2 | O14: 1215 | P14: =O14/B14 -> 6.1164696643241177E-3 | Q14: 11689 | R14: =Q14/B14 -> 5.8843962062785686E-2
A15: 13 | B15: 197891 | C15: 132297 | D15: =C15/B15 -> 0.6685346983945708 | E15: 55888 | F15: =E15/B15 -> 0.28241809885239855 | G15: 1422 | H15: =G15/B15 -> 7.1857739866896427E-3 | I15: 4963 | J15: =I15/B15 -> 2.5079462936667154E-2 | K15: 226 | L15: =K15/B15 -> 1.142042841766427E-3 | M15: 1727 | N15: =M15/B15 -> 8.727026494383271E-3 | O15: 1368 | P15: =O15/B15 -> 6.9128964935242128E-3 | Q15: 5658 | R15: =Q15/B15 -> 2.8591497339444442E-2
A16: 14 | B16: 199238 | C16: 135661 | D16: =C16/B16 -> 0.6808992260512553 | E16: 40993 | F16: =E16/B16 -> 0.20574890332165552 | G16: 1427 | H16: =G16/B16 -> 7.1622883184934601E-3 | I16: 16125 | J16: =I16/B16 -> 8.0933356086690292E-2 | K16: 329 | L16: =K16/B16 -> 1.6512914203113864E-3 | M16: 2920 | N16: =M16/B16 -> 1.4655838745620816E-2 | O16: 1783 | P16: =O16/B16 -> 8.9490960559732574E-3 | Q16: 10132 | R16: =Q16/B16 -> 5.0853752798160991E-2
A17: 15 | B17: 201984 | C17: 127295 | D17: =C17/B17 -> 0.63022318599493032 | E17: 69624 | F17: =E17/B17 -> 0.3447005703422053 | G17: 1006 | H17: =G17/B17 -> 4.9805925221799744E-3 | I17: 1176 | J17: =I17/B17 -> 5.8222433460076049E-3 | K17: 67 | L17: =K17/B17 -> 3.317094423320659E-4 | M17: 2217 | N17: =M17/B17 -> 1.0976116920152091E-2 | O17: 599 | P17: =O17/B17 -> 2.965581432192649E-3 | Q17: 4483 | R17: =Q17/B17 -> 2.2194827313054499E-2
A18: 16 | B18: 200731 | C18: 73217 | D18: =C18/B18 -> 0.36475183205384321 | E18: 109670 | F18: =E18/B18 -> 0.54635307949444778 | G18: 1339 | H18: =G18/B18 -> 6.6706188879644898E-3 | I18: 3393 | J18: =I18/B18 -> 1.6903218735521669E-2 | K18: 310 | L18: =K18/B18 -> 1.5443553810821449E-3 | M18: 11078 | N18: =M18/B18 -> 5.5188286811703222E-2 | O18: 1724 | P18: =O18/B18 -> 8.5886086354374763E-3 | Q18: 18395 | R18: =Q18/B18 -> 9.1640055596793724E-2
A19: 17 | B19: 202958 | C19: 156011 | D19: =C19/B19 -> 0.76868613210615 | E19: 34788 | F19: =E19/B19 -> 0.1714049212152268 | G19: 1420 | H19: =G19/B19 -> 6.9965214477872269E-3 | I19: 4285 | J19: =I19/B19 -> 2.1112742537864979E-2 | K19: 268 | L19: =K19/B19 -> 1.3204702450753357E-3 | M19: 5028 | N19: =M19/B19 -> 2.4773598478502943E-2 | O19: 1158 | P19: =O19/B19 -> 5.7056139693926824E-3 | Q19: 11255 | R19: =Q19/B19 -> 5.5454823165383971E-2
A20: 18 | B20: 197473 | C20: 74972 | D20: =C20/B20 -> 0.37965696576240804 | E20: 116111 | F20: =E20/B20 -> 0.5879841801157627 | G20: 1139 | H20: =G20/B20 -> 5.767877127506039E-3 | I20: 1467 | J20: =I20/B20 -> 7.4288636927579976E-3 | K20: 150 | L20: =K20/B20 -> 7.5959751459693222E-4 | M20: 2379 | N20: =M20/B20 -> 1.2047216581507345E-2 | O20: 1255 | P20: =O20/B20 -> 6.3552992054609998E-3 | Q20: 5199 | R20: =Q20/B20 -> 2.6327649855929672E-2
A21: 19 | B21: 200811 | C21: 121161 | D21: =C21/B21 -> 0.60335838176195522 | E21: 35894 | F21: =E21/B21 -> 0.17874518826159921 | G21: 2015 | H21: =G21/B21 -> 1.0034310869424483E-2 | I21: 14890 | J21: =I21/B21 -> 7.4149324489196311E-2 | K21: 374 | L21: =K21/B21 -> 1.8624477742753135E-3 | M21: 24143 | N21: =M21/B21 -> 0.12022747757841951 | O21: 2334 | P21: =O21/B21 -> 1.1622869265129898E-2 | Q21: 49156 | R21: =Q21/B21 -> 0.24478738714512652
A22: 20 | B22: 196546 | C22: 164354 | D22: =C22/B22 -> 0.83621137036622473 | E22: 25801 | F22: =E22/B22 -> 0.13127206862515645 | G22: 931 | H22: =G22/B22 -> 4.7368046157133699E-3 | I22: 989 | J22: =I22/B22 -> 5.0319009290446005E-3 | K22: 63 | L22: =K22/B22 -> 3.2053565068737089E-4 | M22: 4079 | N22: =M22/B22 -> 2.0753411415139457E-2 | O22: 329 | P22: =O22/B22 -> 1.673908398034048E-3 | Q22: 7154 | R22: =Q22/B22 -> 3.6398603889165895E-2
A23: 21 | B23: 200497 | C23: 181508 | D23: =C23/B23 -> 0.90529035347162301 | E23: 9281 | F23: =E23/B23 -> 4.6289969425976449E-2 | G23: 1089 | H23: =G23/B23 -> 5.4315027157513579E-3 | I23: 6709 | J23: =I23/B23 -> 3.3461847309436049E-2 | K23: 112 | L23: =K23/B23 -> 5.5861184955385867E-4 | M23: 1312 | N23: =M23/B23 -> 6.5437388090594873E-3 | O23: 486 | P23: =O23/B23 -> 2.4239764185997794E-3 | Q23: 3907 | R23: =Q23/B23 -> 1.9486575858990409E-2
A24: 22 | B24: 200786 | C24: 154690 | D24: =C24/B24 -> 0.77042224059446374 | E24: 35629 | F24: =E24/B24 -> 0.17744763081091311 | G24: 1046 | H24: =G24/B24 -> 5.209526560616776E-3 | I24: 5032 | J24: =I24/B24 -> 2.5061508272489118E-2 | K24: 123 | L24: =K24/B24 -> 6.1259251143007984E-4 | M24: 3460 | N24: =M24/B24 -> 1.7232277150797365E-2 | O24: 806 | P24: =O24/B24 -> 4.0142240992897911E-3 | Q24: 7768 | R24: =Q24/B24 -> 3.8687956331616744E-2
A25: 23 | B25: 201856 | C25: 158811 | D25: =C25/B25 -> 0.78675392358909324 | E25: 35653 | F25: =E25/B25 -> 0.17662591154090043 | G25: 1170 | H25: =G25/B25 -> 5.7962111604311986E-3 | I25: 3530 | J25: =I25/B25 -> 1.748771401395054E-2 | K25: 99 | L25: =K25/B25 -> 4.9044863665187064E-4 | M25: 1898 | N25: =M25/B25 -> 9.4027425491439443E-3 | O25: 695 | P25: =O25/B25 -> 3.4430485098287888E-3 | Q25: 4385 | R25: =Q25/B25 -> 2.1723406785034878E-2
A26: 24 | B26: 201475 | C26: 177661 | D26: =C26/B26 -> 0.88180171237126193 | E26: 17793 | F26: =E26/B26 -> 8.8313686561608137E-2 | G26: 1556 | H26: =G26/B26 -> 7.7230425611118005E-3 | I26: 1750 | J26: =I26/B26 -> 8.6859411837696982E-3 | K26: 109 | L26: =K26/B26 -> 5.4101005087479838E-4 | M26: 2088 | N26: =M26/B26 -> 1.0363568680977788E-2 | O26: 518 | P26: =O26/B26 -> 2.5710385903958306E-3 | Q26: 4979 | R26: =Q26/B26 -> 2.4712743516565331E-2
A27: 25 | B27: 202450 | C27: 150864 | D27: =C27/B27 -> 0.74519140528525563 | E27: 36908 | F27: =E27/B27 -> 0.18230674240553224 | G27: 1148 | H27: =G27/B27 -> 5.6705359347987159E-3 | I27: 8729 | J27: =I27/B27 -> 4.3116818967646332E-2 | K27: 130 | L27: =K27/B27 -> 6.4213386021239808E-4 | M27: 3836 | N27: =M27/B27 -> 1.8947888367498146E-2 | O27: 835 | P27: =O27/B27 -> 4.1244751790565568E-3 | Q27: 8832 | R27: =Q27/B27 -> 4.3625586564583846E-2
A28: 26 | B28: 198622 | C28: 176681 | D28: =C28/B28 -> 0.88953388849170789 | E28: 8742 | F28: =E28/B28 -> 4.4013251301467111E-2 | G28: 1189 | H28: =G28/B28 -> 5.986245229632166E-3 | I28: 3347 | J28: =I28/B28 -> 1.6851104107299293E-2 | K28: 121 | L28: =K28/B28 -> 6.0919736987846262E-4 | M28: 7986 | N28: =M28/B28 -> 4.0207026411978534E-2 | O28: 556 | P28: =O28/B28 -> 2.7992870880365721E-3 | Q28: 14400 | R28: =Q28/B28 -> 7.2499521704544309E-2
A29: 27 | B29: 199368 | C29: 164791 | D29: =C29/B29 -> 0.82656695156695159 | E29: 22241 | F29: =E29/B29 -> 0.11155752176878937 | G29: 1556 | H29: =G29/B29 -> 7.8046627342401994E-3 | I29: 4286 | J29: =I29/B29 -> 2.1497933469764457E-2 | K29: 179 | L29: =K29/B29 -> 8.9783716544279929E-4 | M29: 5446 | N29: =M29/B29 -> 2.7316319569840698E-2 | O29: 869 | P29: =O29/B29 -> 4.3587737249709078E-3 | Q29: 12275 | R29: =Q29/B29 -> 6.1569559808996428E-2
A30: 28 | B30: 199215 | C30: 143084 | D30: =C30/B30 -> 0.71823908842205653 | E30: 42451 | F30: =E30/B30 -> 0.21309138368094771 | G30: 1699 | H30: =G30/B30 -> 8.5284742614762949E-3 | I30: 4860 | J30: =I30/B30 -> 2.4395753331827422E-2 | K30: 178 | L30: =K30/B30 -> 8.9350701503400853E-4 | M30: 5518 | N30: =M30/B30 -> 2.7698717466054262E-2 | O30: 1425 | P30: =O30/B30 -> 7.1530758226037196E-3 | Q30: 12462 | R30: =Q30/B30 -> 6.2555530457043901E-2
A31: 29 | B31: 202040 | C31: 106795 | D31: =C31/B31 -> 0.52858344882201547 | E31: 54815 | F31: =E31/B31 -> 0.27130766184913879 | G31: 2108 | H31: =G31/B31 -> 1.0433577509404079E-2 | I31: 14679 | J31: =I31/B31 -> 7.265392991486834E-2 | K31: 446 | L31: =K31/B31 -> 2.2074836666006732E-3 | M31: 20152 | N31: =M31/B31 -> 9.9742625222728171E-2 | O31: 3045 | P31: =O31/B31 -> 1.5071273015244507E-2 | Q31: 42522 | R31: =Q31/B31 -> 0.21046327459908928
A32: 30 | B32: 202260 | C32: 129427 | D32: =C32/B32 -> 0.63990408385246711 | E32: 39840 | F32: =E32/B32 -> 0.19697419163452981 | G32: 1361 | H32: =G32/B32 -> 6.7289627212498765E-3 | I32: 14596 | J32: =I32/B32 -> 7.2164540690200729E-2 | K32: 261 | L32: =K32/B32 -> 1.2904182735093445E-3 | M32: 14978 | N32: =M32/B32 -> 7.4053198852961535E-2 | O32: 1797 | P32: =O32/B32 -> 8.8846039750815776E-3 | Q32: 31234 | R32: =Q32/B32 -> 0.15442499752793434
A33: 31 | B33: 200796 | C33: 143051 | D33: =C33/B33 -> 0.71241957011095836 | E33: 18292 | F33: =E33/B33 -> 9.1097432219765337E-2 | G33: 1592 | H33: =G33/B33 -> 7.9284447897368469E-3 | I33: 22503 | J33: =I33/B33 -> 0.11206896551724138 | K33: 267 | L33: =K33/B33 -> 1.3297077631028507E-3 | M33: 13420 | N33: =M33/B33 -> 6.6834000677304328E-2 | O33: 1671 | P33: =O33/B33 -> 8.321878921890874E-3 | Q33: 30852 | R33: =Q33/B33 -> 0.15364847905336759
A34: 32 | B34: 202734 | C34: 135945 | D34: =C34/B34 -> 0.67055846577288469 | E34: 13886 | F34: =E34/B34 -> 6.8493691240739091E-2 | G34: 1122 | H34: =G34/B34 -> 5.534345497055255E-3 | I34: 39816 | J34: =I34/B34 -> 0.1963952765692977 | K34: 163 | L34: =K34/B34 -> 8.0400919431373129E-4 | M34: 10241 | N34: =M34/B34 -> 5.0514467232925901E-2 | O34: 1561 | P34: =O34/B34 -> 7.6997444927836478E-3 | Q34: 24374 | R34: =Q34/B34 -> 0.12022650369449624
A35: 33 | B35: 197631 | C35: 133664 | D35: =C35/B35 -> 0.67633114238150893 | E35: 17312 | F35: =E35/B35 -> 8.7597593494947654E-2 | G35: 1096 | H35: =G35/B35 -> 5.5456886824435435E-3 | I35: 28693 | J35: =I35/B35 -> 0.14518471292459179 | K35: 202 | L35: =K35/B35 -> 1.0221068557058357E-3 | M35: 14891 | N35: =M35/B35 -> 7.534749103126534E-2 | O35: 1773 | P35: =O35/B35 -> 8.971264629536865E-3 | Q35: 31084 | R35: =Q35/B35 -> 0.15728301734039701
A36: 34 | B36: 199088 | C36: 140119 | D36: =C36/B36 -> 0.70380434782608692 | E36: 10426 | F36: =E36/B36 -> 5.2368801735915779E-2 | G36: 941 | H36: =G36/B36 -> 4.7265530820541669E-3 | I36: 39366 | J36: =I36/B36 -> 0.19773165635296955 | K36: 162 | L36: =K36/B36 -> 8.1371051997106809E-4 | M36: 6916 | N36: =M36/B36 -> 3.4738407136542637E-2 | O36: 1158 | P36: =O36/B36 -> 5.816523346459857E-3 | Q36: 19280 | R36: =Q36/B36 -> 9.6841597685445632E-2
A37: 35 | B37: 201159 | C37: 110767 | D37: =C37/B37 -> 0.55064401791617579 | E37: 17500 | F37: =E37/B37 -> 8.6995858997111736E-2 | G37: 1723 | H37: =G37/B37 -> 8.5653637172584864E-3 | I37: 42299 | J37: =I37/B37 -> 0.21027644798393311 | K37: 223 | L37: =K37/B37 -> 1.1085758032203382E-3 | M37: 26752 | N37: =M37/B37 -> 0.13298932685089904 | O37: 1895 | P37: =O37/B37 -> 9.4204087314015278E-3 | Q37: 55352 | R37: =Q37/B37 -> 0.27516541641189307
A38: 36 | B38: 200335 | C38: 111189 | D38: =C38/B38 -> 0.55501534928993934 | E38: 38635 | F38: =E38/B38 -> 0.19285197294531659 | G38: 1436 | H38: =G38/B38 -> 7.1679936107020741E-3 | I38: 29760 | J38: =I38/B38 -> 0.14855117677889534 | K38: 338 | L38: =K38/B38 -> 1.6871739835775078E-3 | M38: 16743 | N38: =M38/B38 -> 8.3575011855142642E-2 | O38: 2234 | P38: =O38/B38 -> 1.1151321536426485E-2 | Q38: 36698 | R38: =Q38/B38 -> 0.18318316819327626
A39: 37 | B39: 201234 | C39: 131328 | D39: =C39/B39 -> 0.65261337547332954 | E39: 14330 | F39: =E39/B39 -> 7.1210630410368028E-2 | G39: 1037 | H39: =G39/B39 -> 5.1532047268354258E-3 | I39: 45349 | J39: =I39/B39 -> 0.22535456235029866 | K39: 276 | L39: =K39/B39 -> 1.3715376129282328E-3 | M39: 7498 | N39: =M39/B39 -> 3.7260105151216992E-2 | O39: 1416 | P39: =O39/B39 -> 7.0365842750231078E-3 | Q39: 20920 | R39: =Q39/B39 -> 0.10395857558861822
A40: 38 | B40: 198113 | C40: 190174 | D40: =C40/B40 -> 0.95992691039962041 | E40: 4522 | F40: =E40/B40 -> 2.2825357245612351E-2 | G40: 1041 | H40: =G40/B40 -> 5.2545769333663108E-3 | I40: 732 | J40: =I40/B40 -> 3.6948610136639192E-3 | K40: 76 | L40: =K40/B40 -> 3.8361944950608998E-4 | M40: 1352 | N40: =M40/B40 -> 6.8243881017399158E-3 | O40: 216 | P40: =O40/B40 -> 1.0902868564909925E-3 | Q40: 2803 | R40: =Q40/B40 -> 1.4148491012704871E-2
A41: 39 | B41: 198294 | C41: 125208 | D41: =C41/B41 -> 0.63142606432872406 | E41: 19070 | F41: =E41/B41 -> 9.6170332939978009E-2 | G41: 1092 | H41: =G41/B41 -> 5.5069744924203454E-3 | I41: 41610 | J41: =I41/B41 -> 0.20983993464250053 | K41: 280 | L41: =K41/B41 -> 1.4120447416462424E-3 | M41: 9303 | N41: =M41/B41 -> 4.6915186541196405E-2 | O41: 1731 | P41: =O41/B41 -> 8.7294623135344487E-3 | Q41: 23177 | R41: =Q41/B41 -> 0.11688200348976772
A42: 40 | B42: 201420 | C42: 190479 | D42: =C42/B42 -> 0.94568066726243671 | E42: 8033 | F42: =E42/B42 -> 3.9881838943501141E-2 | G42: 883 | H42: =G42/B42 -> 4.3838744911130966E-3 | I42: 1076 | J42: =I42/B42 -> 5.3420712938139214E-3 | K42: 38 | L42: =K42/B42 -> 1.8866051037632806E-4 | M42: 705 | N42: =M42/B42 -> 3.500148942508192E-3 | O42: 206 | P42: =O42/B42 -> 1.0227385562506207E-3 | Q42: 1767 | R42: =Q42/B42 -> 8.7727137324992554E-3

A1: Ind. Bipartisan Advisory Comm. on Redistricting - Opt 1 Voting Age Population
A2: DISTRICT | B2: Voting Age Persons | C2: VAP White | D2: % VAP White | E2: VAP Black | F2: % VAP Black | G2: VAP AIAN | H2: % VAP AIAN | I2: VAP Asian | J2: % VAP Asian | K2: VAP HawPI | L2: % VAP HawPI | M2: VAP Other | N2: % VAP Other | O2: VAP Multi | P2: % VAP Multi | Q2: Voting Age Hispanic | R2: % VAP Hispanic
A3: 1 | B3: 157520 | C3: 120801 | D3: =C3/B3 -> 0.76689309294057895 | E3: 25590 | F3: =E3/B3 -> 0.16245556119857796 | G3: 1239 | H3: =G3/B3 -> 7.8656678517013707E-3 | I3: 5687 | J3: =I3/B3 -> 3.6103351955307263E-2 | K3: 221 | L3: =K3/B3 -> 1.4029964448958863E-3 | M3: 3003 | N3: =M3/B3 -> 1.9064245810055867E-2 | O3: 979 | P3: =O3/B3 -> 6.2150837988826819E-3 | Q3: 7469 | R3: =Q3/B3 -> 4.7416201117318438E-2
A4: 2 | B4: 150967 | C4: 56189 | D4: =C4/B4 -> 0.37219392317526345 | E4: 83610 | F4: =E4/B4 -> 0.55382964488928044 | G4: 1146 | H4: =G4/B4 -> 7.5910629475315801E-3 | I4: 4632 | J4: =I4/B4 -> 3.0682202070651202E-2 | K4: 262 | L4: =K4/B4 -> 1.7354786145316527E-3 | M4: 3174 | N4: =M4/B4 -> 2.1024462299707884E-2 | O4: 1954 | P4: =O4/B4 -> 1.2943226003033775E-2 | Q4: 8101 | R4: =Q4/B4 -> 5.3660733802751596E-2
A5: 3 | B5: 158209 | C5: 112294 | D5: =C5/B5 -> 0.70978262930680303 | E5: 33124 | F5: =E5/B5 -> 0.20936861999001322 | G5: 1473 | H5: =G5/B5 -> 9.3104690630747937E-3 | I5: 6063 | J5: =I5/B5 -> 3.8322725003002357E-2 | K5: 333 | L5: =K5/B5 -> 2.1048107250535683E-3 | M5: 3112 | N5: =M5/B5 -> 1.9670183112212327E-2 | O5: 1810 | P5: =O5/B5 -> 1.1440562799840718E-2 | Q5: 9003 | R5: =Q5/B5 -> 5.6905738611583413E-2
A6: 4 | B6: 150579 | C6: 122151 | D6: =C6/B6 -> 0.81120873428565732 | E6: 23594 | F6: =E6/B6 -> 0.15668851566287464 | G6: 1463 | H6: =G6/B6 -> 9.7158302286507407E-3 | I6: 1709 | J6: =I6/B6 -> 1.1349524170036991E-2 | K6: 82 | L6: =K6/B6 -> 5.4456464712874966E-4 | M6: 1111 | N6: =M6/B6 -> 7.3781868653663525E-3 | O6: 469 | P6: =O6/B6 -> 3.114644140285166E-3 | Q6: 2985 | R6: =Q6/B6 -> 1.98234813619429E-2
A7: 5 | B7: 148396 | C7: 53142 | D7: =C7/B7 -> 0.35810938300223727 | E7: 84556 | F7: =E7/B7 -> 0.56979972505997467 | G7: 1043 | H7: =G7/B7 -> 7.028491333998221E-3 | I7: 4972 | J7: =I7/B7 -> 3.350494622496563E-2 | K7: 195 | L7: =K7/B7 -> 1.3140515916871074E-3 | M7: 3064 | N7: =M7/B7 -> 2.0647456804765627E-2 | O7: 1424 | P7: =O7/B7 -> 9.595945982371493E-3 | Q7: 7328 | R7: =Q7/B7 -> 4.9381384942990374E-2
A8: 6 | B8: 146923 | C8: 131745 | D8: =C8/B8 -> 0.89669418675088308 | E8: 7196 | F8: =E8/B8 -> 4.8978036114155035E-2 | G8: 866 | H8: =G8/B8 -> 5.8942439236879182E-3 | I8: 2637 | J8: =I8/B8 -> 1.794817693621829E-2 | K8: 93 | L8: =K8/B8 -> 6.3298462459927991E-4 | M8: 4021 | N8: =M8/B8 -> 2.7368077156061339E-2 | O8: 365 | P8: =O8/B8 -> 2.4842944943950234E-3 | Q8: 8370 | R8: =Q8/B8 -> 5.6968616213935189E-2
A9: 7 | B9: 151833 | C9: 103532 | D9: =C9/B9 -> 0.68188075056147213 | E9: 31242 | F9: =E9/B9 -> 0.20576554503961589 | G9: 1355 | H9: =G9/B9 -> 8.9242786482516979E-3 | I9: 10300 | J9: =I9/B9 -> 6.7837690093721398E-2 | K9: 338 | L9: =K9/B9 -> 2.2261300244347409E-3 | M9: 3810 | N9: =M9/B9 -> 2.5093359151172671E-2 | O9: 1256 | P9: =O9/B9 -> 8.272246481331463E-3 | Q9: 9884 | R9: =Q9/B9 -> 6.5097837755955554E-2
A10: 8 | B10: 157561 | C10: 124538 | D10: =C10/B10 -> 0.79041133275366371 | E10: 22961 | F10: =E10/B10 -> 0.14572768641986278 | G10: 1181 | H10: =G10/B10 -> 7.4955096756176972E-3 | I10: 4871 | J10: =I10/B10 -> 3.091501069427079E-2 | K10: 251 | L10: =K10/B10 -> 1.5930338091278934E-3 | M10: 3030 | N10: =M10/B10 -> 1.9230647177918392E-2 | O10: 729 | P10: =O10/B10 -> 4.6267794695387821E-3 | Q10: 7936 | R10: =Q10/B10 -> 5.0367794060712991E-2
A11: 9 | B11: 159588 | C11: 59658 | D11: =C11/B11 -> 0.37382509963155125 | E11: 90627 | F11: =E11/B11 -> 0.56788104368749526 | G11: 1379 | H11: =G11/B11 -> 8.6410005764844481E-3 | I11: 4894 | J11: =I11/B11 -> 3.0666466150337118E-2 | K11: 92 | L11: =K11/B11 -> 5.7648444745218939E-4 | M11: 1648 | N11: =M11/B11 -> 1.0326590971752262E-2 | O11: 1290 | P11: =O11/B11 -> 8.0833145349274386E-3 | Q11: 3953 | R11: =Q11/B11 -> 2.4770032834548962E-2
A12: 10 | B12: 155121 | C12: 126698 | D12: =C12/B12 -> 0.81676884496618773 | E12: 20773 | F12: =E12/B12 -> 0.1339148148864435 | G12: 831 | H12: =G12/B12 -> 5.3571083218906532E-3 | I12: 4518 | J12: =I12/B12 -> 2.9125650298799002E-2 | K12: 75 | L12: =K12/B12 -> 4.8349353085655716E-4 | M12: 1709 | N12: =M12/B12 -> 1.1017205923118082E-2 | O12: 517 | P12: =O12/B12 -> 3.3328820727045339E-3 | Q12: 4416 | R12: =Q12/B12 -> 2.8468099096834086E-2
A13: 11 | B13: 145740 | C13: 101201 | D13: =C13/B13 -> 0.69439412652669141 | E13: 33141 | F13: =E13/B13 -> 0.22739810621655002 | G13: 1057 | H13: =G13/B13 -> 7.2526416906820365E-3 | I13: 4380 | J13: =I13/B13 -> 3.0053519967064634E-2 | K13: 132 | L13: =K13/B13 -> 9.0572251955537255E-4 | M13: 5025 | N13: =M13/B13 -> 3.4479209551255663E-2 | O13: 804 | P13: =O13/B13 -> 5.5166735282009055E-3 | Q13: 9383 | R13: =Q13/B13 -> 6.4381775765061072E-2
A14: 12 | B14: 151172 | C14: 112930 | D14: =C14/B14 -> 0.74702987325695236 | E14: 19298 | F14: =E14/B14 -> 0.12765591511655597 | G14: 685 | H14: =G14/B14 -> 4.5312624030905196E-3 | I14: 13787 | J14: =I14/B14 -> 9.1200751461910937E-2 | K14: 79 | L14: =K14/B14 -> 5.2258354721773875E-4 | M14: 3633 | N14: =M14/B14 -> 2.4032228190405631E-2 | O14: 760 | P14: =O14/B14 -> 5.0273860238668538E-3 | Q14: 7874 | R14: =Q14/B14 -> 5.2086365199904741E-2
A15: 13 | B15: 151811 | C15: 104958 | D15: =C15/B15 -> 0.6913728254210828 | E15: 40167 | F15: =E15/B15 -> 0.26458557021559703 | G15: 1061 | H15: =G15/B15 -> 6.9889533696504205E-3 | I15: 3620 | J15: =I15/B15 -> 2.3845439395037249E-2 | K15: 131 | L15: =K15/B15 -> 8.6291507203035348E-4 | M15: 1119 | N15: =M15/B15 -> 7.3710073710073713E-3 | O15: 755 | P15: =O15/B15 -> 4.9732891555947858E-3 | Q15: 3592 | R15: =Q15/B15 -> 2.3660999532313206E-2
A16: 14 | B16: 147974 | C16: 102331 | D16: =C16/B16 -> 0.69154716369091862 | E16: 29872 | F16: =E16/B16 -> 0.20187330206657927 | G16: 1071 | H16: =G16/B16 -> 7.2377579845107924E-3 | I16: 11682 | J16: =I16/B16 -> 7.8946301377268976E-2 | K16: 220 | L16: =K16/B16 -> 1.4867476718883046E-3 | M16: 1932 | N16: =M16/B16 -> 1.3056347736764567E-2 | O16: 866 | P16: =O16/B16 -> 5.8523794720694178E-3 | Q16: 6289 | R16: =Q16/B16 -> 4.2500709584116128E-2
A17: 15 | B17: 159228 | C17: 103383 | D17: =C17/B17 -> 0.649276509156681 | E17: 52450 | F17: =E17/B17 -> 0.32940186399376992 | G17: 774 | H17: =G17/B17 -> 4.860954103549627E-3 | I17: 847 | J17: =I17/B17 -> 5.319416183083377E-3 | K17: 46 | L17: =K17/B17 -> 2.8889391313085638E-4 | M17: 1368 | N17: =M17/B17 -> 8.5914537644132937E-3 | O17: 360 | P17: =O17/B17 -> 2.2609088853719197E-3 | Q17: 2876 | R17: =Q17/B17 -> 1.8062149873137891E-2
A18: 16 | B18: 153759 | C18: 59632 | D18: =C18/B18 -> 0.38782770439453951 | E18: 81374 | F18: =E18/B18 -> 0.52923080925344212 | G18: 1067 | H18: =G18/B18 -> 6.9394311877678701E-3 | I18: 2631 | J18: =I18/B18 -> 1.7111193491112717E-2 | K18: 205 | L18: =K18/B18 -> 1.3332552891212872E-3 | M18: 7748 | N18: =M18/B18 -> 5.0390546244447477E-2 | O18: 1102 | P18: =O18/B18 -> 7.1670601395690658E-3 | Q18: 12640 | R18: =Q18/B18 -> 8.2206570021917419E-2
A19: 17 | B19: 151259 | C19: 118534 | D19: =C19/B19 -> 0.78364923740074965 | E19: 24896 | F19: =E19/B19 -> 0.16459185899682002 | G19: 1040 | H19: =G19/B19 -> 6.8756239298157461E-3 | I19: 2891 | J19: =I19/B19 -> 1.9112912289516656E-2 | K19: 183 | L19: =K19/B19 -> 1.2098453645733476E-3 | M19: 3130 | N19: =M19/B19 -> 2.0692983558003159E-2 | O19: 585 | P19: =O19/B19 -> 3.8675384605213574E-3 | Q19: 6960 | R19: =Q19/B19 -> 4.6013790914920763E-2
A20: 18 | B20: 152380 | C20: 61042 | D20: =C20/B20 -> 0.40059062869142931 | E20: 86839 | F20: =E20/B20 -> 0.56988449927812046 | G20: 837 | H20: =G20/B20 -> 5.4928468302926896E-3 | I20: 1116 | J20: =I20/B20 -> 7.3237957737235862E-3 | K20: 102 | L20: =K20/B20 -> 6.6937918361989761E-4 | M20: 1698 | N20: =M20/B20 -> 1.114319464496653E-2 | O20: 746 | P20: =O20/B20 -> 4.8956555978474864E-3 | Q20: 3467 | R20: =Q20/B20 -> 2.2752329702060637E-2
A21: 19 | B21: 145239 | C21: 91516 | D21: =C21/B21 -> 0.63010623868244753 | E21: 24443 | F21: =E21/B21 -> 0.1682950171785815 | G21: 1378 | H21: =G21/B21 -> 9.4878097480704214E-3 | I21: 10681 | J21: =I21/B21 -> 7.3540853352061092E-2 | K21: 260 | L21: =K21/B21 -> 1.7901527826547966E-3 | M21: 15683 | N21: =M21/B21 -> 0.10798063880913529 | O21: 1278 | P21: =O21/B21 -> 8.7992894470493455E-3 | Q21: 31592 | R21: =Q21/B21 -> 0.21751733349857821
A22: 20 | B22: 155775 | C22: 132260 | D22: =C22/B22 -> 0.84904509709516929 | E22: 19420 | F22: =E22/B22 -> 0.124666987642433 | G22: 733 | H22: =G22/B22 -> 4.705504734392553E-3 | I22: 668 | J22: =I22/B22 -> 4.2882362381640188E-3 | K22: 52 | L22: =K22/B22 -> 3.3381479698282781E-4 | M22: 2436 | N22: =M22/B22 -> 1.5637939335580164E-2 | O22: 206 | P22: =O22/B22 -> 1.3224201572781256E-3 | Q22: 4205 | R22: =Q22/B22 -> 2.6994061948322903E-2
A23: 21 | B23: 163977 | C23: 148902 | D23: =C23/B23 -> 0.90806637516237032 | E23: 7020 | F23: =E23/B23 -> 4.2810882013940982E-2 | G23: 861 | H23: =G23/B23 -> 5.2507363837611372E-3 | I23: 5771 | J23: =I23/B23 -> 3.5193960128554615E-2 | K23: 97 | L23: =K23/B23 -> 5.9154637540630693E-4 | M23: 968 | N23: =M23/B23 -> 5.9032669215804655E-3 | O23: 358 | P23: =O23/B23 -> 2.1832330143861638E-3 | Q23: 2962 | R23: =Q23/B23 -> 1.8063508906736921E-2
A24: 22 | B24: 157222 | C24: 125319 | D24: =C24/B24 -> 0.7970831054178168 | E24: 24705 | F24: =E24/B24 -> 0.15713449771660454 | G24: 838 | H24: =G24/B24 -> 5.3300428693185435E-3 | I24: 3524 | J24: =I24/B24 -> 2.2414165956418312E-2 | K24: 79 | L24: =K24/B24 -> 5.0247420844411086E-4 | M24: 2275 | N24: =M24/B24 -> 1.4469985116586738E-2 | O24: 482 | P24: =O24/B24 -> 3.0657287148109042E-3 | Q24: 5086 | R24: =Q24/B24 -> 3.2349162330971494E-2
A25: 23 | B25: 159191 | C25: 128018 | D25: =C25/B25 -> 0.8041786281887795 | E25: 25940 | F25: =E25/B25 -> 0.16294891042835336 | G25: 921 | H25: =G25/B25 -> 5.7855029492873342E-3 | I25: 2497 | J25: =I25/B25 -> 1.5685560113322991E-2 | K25: 74 | L25: =K25/B25 -> 4.6485039983416149E-4 | M25: 1309 | N25: =M25/B25 -> 8.2228266673367214E-3 | O25: 432 | P25: =O25/B25 -> 2.7137212530859156E-3 | Q25: 3057 | R25: =Q25/B25 -> 1.9203346922878804E-2
A26: 24 | B26: 159955 | C26: 142639 | D26: =C26/B26 -> 0.89174455315557499 | E26: 13208 | F26: =E26/B26 -> 8.2573223719171016E-2 | G26: 1172 | H26: =G26/B26 -> 7.3270607358319525E-3 | I26: 1268 | J26: =I26/B26 -> 7.9272295333062421E-3 | K26: 79 | L26: =K26/B26 -> 4.9388890625488423E-4 | M26: 1254 | N26: =M26/B26 -> 7.8397049170079083E-3 | O26: 335 | P26: =O26/B26 -> 2.09433903285299E-3 | Q26: 3157 | R26: =Q26/B26 -> 1.9736800975274298E-2
A27: 25 | B27: 163584 | C27: 124390 | D27: =C27/B27 -> 0.76040444053208134 | E27: 27810 | F27: =E27/B27 -> 0.17000440140845072 | G27: 884 | H27: =G27/B27 -> 5.4039514866979655E-3 | I27: 7201 | J27: =I27/B27 -> 4.4020197574334896E-2 | K27: 101 | L27: =K27/B27 -> 6.1741979655712052E-4 | M27: 2652 | N27: =M27/B27 -> 1.6211854460093898E-2 | O27: 546 | P27: =O27/B27 -> 3.3377347417840376E-3 | Q27: 6235 | R27: =Q27/B27 -> 3.811497456964006E-2
A28: 26 | B28: 156769 | C28: 141723 | D28: =C28/B28 -> 0.90402439257761424 | E28: 6090 | F28: =E28/B28 -> 3.8846965918006751E-2 | G28: 874 | H28: =G28/B28 -> 5.5750818082656644E-3 | I28: 2619 | J28: =I28/B28 -> 1.6706108988384184E-2 | K28: 111 | L28: =K28/B28 -> 7.0804814727401467E-4 | M28: 5020 | N28: =M28/B28 -> 3.2021636930770751E-2 | O28: 332 | P28: =O28/B28 -> 2.1177656296844402E-3 | Q28: 9011 | R28: =Q28/B28 -> 5.7479476171947257E-2
A29: 27 | B29: 148827 | C29: 125214 | D29: =C29/B29 -> 0.84133927311576528 | E29: 15713 | F29: =E29/B29 -> 0.10557896080684284 | G29: 1125 | H29: =G29/B29 -> 7.5591122578564374E-3 | I29: 2817 | J29: =I29/B29 -> 1.8928017093672519E-2 | K29: 121 | L29: =K29/B29 -> 8.13024518400559E-4 | M29: 3387 | N29: =M29/B29 -> 2.2757967304319782E-2 | O29: 450 | P29: =O29/B29 -> 3.0236449031425749E-3 | Q29: 7613 | R29: =Q29/B29 -> 5.1153352550276497E-2
A30: 28 | B30: 151216 | C30: 112052 | D30: =C30/B30 -> 0.74100624272563753 | E30: 30191 | F30: =E30/B30 -> 0.19965479843402814 | G30: 1239 | H30: =G30/B30 -> 8.1935773992170141E-3 | I30: 3345 | J30: =I30/B30 -> 2.2120675060840124E-2 | K30: 123 | L30: =K30/B30 -> 8.1340598878425565E-4 | M30: 3520 | N30: =M30/B30 -> 2.3277960004232358E-2 | O30: 746 | P30: =O30/B30 -> 4.9333403872606077E-3 | Q30: 7838 | R30: =Q30/B30 -> 5.1833139350333297E-2
A31: 29 | B31: 143783 | C31: 79897 | D31: =C31/B31 -> 0.55567765313006401 | E31: 37148 | F31: =E31/B31 -> 0.25836155873782018 | G31: 1391 | H31: =G31/B31 -> 9.6743008561512838E-3 | I31: 10376 | J31: =I31/B31 -> 7.2164303151276574E-2 | K31: 313 | L31: =K31/B31 -> 2.1768915657622945E-3 | M31: 13064 | N31: =M31/B31 -> 9.0859141901337426E-2 | O31: 1594 | P31: =O31/B31 -> 1.1086150657588171E-2 | Q31: 27209 | R31: =Q31/B31 -> 0.18923655786845456
A32: 30 | B32: 165253 | C32: 108997 | D32: =C32/B32 -> 0.6595765281114413 | E32: 31004 | F32: =E32/B32 -> 0.18761535342777438 | G32: 1098 | H32: =G32/B32 -> 6.6443574398044212E-3 | I32: 11769 | J32: =I32/B32 -> 7.1218071684023887E-2 | K32: 211 | L32: =K32/B32 -> 1.2768300726764415E-3 | M32: 10898 | N32: =M32/B32 -> 6.5947365554634416E-2 | O32: 1276 | P32: =O32/B32 -> 7.7214937096452109E-3 | Q32: 23062 | R32: =Q32/B32 -> 0.13955571154532748
A33: 31 | B33: 169061 | C33: 122906 | D33: =C33/B33 -> 0.72699203246165589 | E33: 14784 | F33: =E33/B33 -> 8.7447725968733181E-2 | G33: 1267 | H33: =G33/B33 -> 7.4943363637976828E-3 | I33: 18445 | J33: =I33/B33 -> 0.10910263159451322 | K33: 214 | L33: =K33/B33 -> 1.2658152974370197E-3 | M33: 10205 | N33: =M33/B33 -> 6.0362827618433583E-2 | O33: 1240 | P33: =O33/B33 -> 7.3346306954294605E-3 | Q33: 23683 | R33: =Q33/B33 -> 0.14008553125794831
A34: 32 | B34: 151735 | C34: 104434 | D34: =C34/B34 -> 0.68826572643094874 | E34: 9837 | F34: =E34/B34 -> 6.4830131479223646E-2 | G34: 770 | H34: =G34/B34 -> 5.074636702145187E-3 | I34: 28357 | J34: =I34/B34 -> 0.18688502982172867 | K34: 124 | L34: =K34/B34 -> 8.1721422216364059E-4 | M34: 7219 | N34: =M34/B34 -> 4.7576366691930008E-2 | O34: 994 | P34: =O34/B34 -> 6.5508946518601507E-3 | Q34: 17061 | R34: =Q34/B34 -> 0.11243945035753122
A35: 33 | B35: 139499 | C35: 96369 | D35: =C35/B35 -> 0.69082215643122891 | E35: 11826 | F35: =E35/B35 -> 8.4774801253055573E-2 | G35: 719 | H35: =G35/B35 -> 5.1541588111742734E-3 | I35: 19396 | J35: =I35/B35 -> 0.13904042322884036 | K35: 148 | L35: =K35/B35 -> 1.0609395049426878E-3 | M35: 10074 | N35: =M35/B35 -> 7.221557143778809E-2 | O35: 967 | P35: =O35/B35 -> 6.9319493329701286E-3 | Q35: 20810 | R35: =Q35/B35 -> 0.14917669660714414
A36: 34 | B36: 152565 | C36: 109373 | D36: =C36/B36 -> 0.71689443843607648 | E36: 7941 | F36: =E36/B36 -> 5.204994592468784E-2 | G36: 656 | H36: =G36/B36 -> 4.2998066397928756E-3 | I36: 28737 | J36: =I36/B36 -> 0.18835906007275588 | K36: 127 | L36: =K36/B36 -> 8.3243207813063285E-4 | M36: 4988 | N36: =M36/B36 -> 3.2694261462327533E-2 | O36: 743 | P36: =O36/B36 -> 4.8700553862288205E-3 | Q36: 13909 | R36: =Q36/B36 -> 9.1167699013535219E-2
A37: 35 | B37: 156478 | C37: 88821 | D37: =C37/B37 -> 0.56762611996574597 | E37: 12676 | F37: =E37/B37 -> 8.1008192845000576E-2 | G37: 1270 | H37: =G37/B37 -> 8.1161569038459072E-3 | I37: 32884 | J37: =I37/B37 -> 0.21015094773706208 | K37: 161 | L37: =K37/B37 -> 1.0288986311174735E-3 | M37: 19369 | N37: =M37/B37 -> 0.12378097879574125 | O37: 1297 | P37: =O37/B37 -> 8.2887051214867273E-3 | Q37: 40348 | R37: =Q37/B37 -> 0.25785094390265723
A38: 36 | B38: 148950 | C38: 86492 | D38: =C38/B38 -> 0.58067807989258136 | E38: 26911 | F38: =E38/B38 -> 0.18067136623027863 | G38: 992 | H38: =G38/B38 -> 6.6599530043638805E-3 | I38: 21689 | J38: =I38/B38 -> 0.14561262168512923 | K38: 239 | L38: =K38/B38 -> 1.6045652903658946E-3 | M38: 11381 | N38: =M38/B38 -> 7.6408190668009399E-2 | O38: 1246 | P38: =O38/B38 -> 8.3652232292715685E-3 | Q38: 24760 | R38: =Q38/B38 -> 0.16623027861698556
A39: 37 | B39: 152287 | C39: 101801 | D39: =C39/B39 -> 0.66848122295402757 | E39: 10106 | F39: =E39/B39 -> 6.6361541037646021E-2 | G39: 738 | H39: =G39/B39 -> 4.8461129315043308E-3 | I39: 33262 | J39: =I39/B39 -> 0.21841654244945399 | K39: 185 | L39: =K39/B39 -> 1.2148115072199202E-3 | M39: 5357 | N39: =M39/B39 -> 3.5177001319876285E-2 | O39: 838 | P39: =O39/B39 -> 5.5027678002718553E-3 | Q39: 14892 | R39: =Q39/B39 -> 9.7789043056859745E-2
A40: 38 | B40: 158427 | C40: 152506 | D40: =C40/B40 -> 0.96262632000858439 | E40: 3412 | F40: =E40/B40 -> 2.1536733006368863E-2 | G40: 843 | H40: =G40/B40 -> 5.3210626976462347E-3 | I40: 538 | J40: =I40/B40 -> 3.3958858022938008E-3 | K40: 50 | L40: =K40/B40 -> 3.1560276972990715E-4 | M40: 916 | N40: =M40/B40 -> 5.7818427414518987E-3 | O40: 162 | P40: =O40/B40 -> 1.0225529739248992E-3 | Q40: 1871 | R40: =Q40/B40 -> 1.1809855643293125E-2
A41: 39 | B41: 136726 | C41: 88584 | D41: =C41/B41 -> 0.64789432880359255 | E41: 12454 | F41: =E41/B41 -> 9.108728405716543E-2 | G41: 718 | H41: =G41/B41 -> 5.2513786697482552E-3 | I41: 27783 | J41: =I41/B41 -> 0.20320202448693006 | K41: 189 | L41: =K41/B41 -> 1.3823266971900005E-3 | M41: 6077 | N41: =M41/B41 -> 4.4446557348273186E-2 | O41: 921 | P41: =O41/B41 -> 6.7360999371004785E-3 | Q41: 14789 | R41: =Q41/B41 -> 0.10816523558065035
A42: 40 | B42: 160808 | C42: 152372 | D42: =C42/B42 -> 0.94753992338689619 | E42: 6299 | F42: =E42/B42 -> 3.9170936769314962E-2 | G42: 731 | H42: =G42/B42 -> 4.5457937416048949E-3 | I42: 810 | J42: =I42/B42 -> 5.0370628326948906E-3 | K42: 34 | L42: =K42/B42 -> 2.1143226705139047E-4 | M42: 447 | N42: =M42/B42 -> 2.7797124521168103E-3 | O42: 115 | P42: =O42/B42 -> 7.1513855032087951E-4 | Q42: 1181 | R42: =Q42/B42 -> 7.3441619819909461E-3

A1: Ind. Bipartisan Advisory Comm. on Redistricting - Opt 1 Election Data
A2: DISTRICT | B2: Rep. Gov '09 | C2: Dem. Gov '09 | D2: Rep. Lt. Gov '09 | E2: Dem. Lt. Gov '09 | F2: Rep. Att. Gen. '09 | G2: Dem. Att. Gen. '09
A3: 1 | B3: 0.64095025498629787 | C3: 0.35904974501370213 | D3: 0.60835299065591453 | E3: 0.39164700934408542 | F3: 0.62078713561935528 | G3: 0.37921286438064467
A4: 2 | B4: 0.35109857094338637 | C4: 0.64890142905661363 | D4: 0.32991890738369611 | E4: 0.67008109261630389 | F4: 0.34505512191196586 | G4: 0.65494487808803414
A5: 3 | B5: 0.62653179862806652 | C5: 0.37346820137193348 | D5: 0.58091335170399683 | E5: 0.41908664829600323 | F5: 0.60118681734360968 | G5: 0.39881318265639037
A6: 4 | B6: 0.71679004037685057 | C6: 0.28320995962314938 | D6: 0.69239112014912729 | E6: 0.30760887985087271 | F6: 0.70908688772819295 | G6: 0.290913112271807
A7: 5 | B7: 0.33895114026297407 | C7: 0.66104885973702587 | D7: 0.3131859442704874 | E7: 0.6868140557295126 | F7: 0.33527493747823611 | G7: 0.66472506252176389
A8: 6 | B8: 0.69071185868349405 | C8: 0.30928814131650589 | D8: 0.67146027140052911 | E8: 0.32853972859947084 | F8: 0.66987309374000215 | G8: 0.33012690625999785
A9: 7 | B9: 0.61820099442519205 | C9: 0.38179900557480789 | D9: 0.56115810855982107 | E9: 0.43884189144017899 | F9: 0.59778739532382397 | G9: 0.40221260467617609
A10: 8 | B10: 0.66077629446716568 | C10: 0.33922370553283432 | D10: 0.6042010856738258 | E10: 0.3957989143261742 | F10: 0.64155557308511479 | G10: 0.35844442691488521
A11: 9 | B11: 0.28132024660034277 | C11: 0.71867975339965728 | D11: 0.27576275762757629 | E11: 0.72423724237242371 | F11: 0.29557385952208542 | G11: 0.70442614047791452
A12: 10 | B12: 0.67115579743566089 | C12: 0.32884420256433911 | D12: 0.64654132780852835 | E12: 0.35345867219147159 | F12: 0.66940623691596757 | G12: 0.33059376308403243
A13: 11 | B13: 0.66014072189537287 | C13: 0.33985927810462713 | D13: 0.63320131220995357 | E13: 0.36679868779004643 | F13: 0.65777519860724787 | G13: 0.34222480139275208
A14: 12 | B14: 0.66654423339280089 | C14: 0.33345576660719906 | D14: 0.6360731715880763 | E14: 0.36392682841192375 | F14: 0.65534467291692322 | G14: 0.34465532708307683
A15: 13 | B15: 0.60918674698795183 | C15: 0.39081325301204817 | D15: 0.57282156160981668 | E15: 0.42717843839018332 | F15: 0.5922248585508304 | G15: 0.40777514144916954
A16: 14 | B16: 0.66538094733495812 | C16: 0.33461905266504188 | D16: 0.61790114101370519 | E16: 0.38209885898629486 | F16: 0.65022605836415948 | G16: 0.34977394163584052
A17: 15 | B17: 0.64561076604554868 | C17: 0.35438923395445132 | D17: 0.64947595363630539 | E17: 0.35052404636369461 | F17: 0.65855382967327258 | G17: 0.34144617032672736
A18: 16 | B18: 0.39642091373907307 | C18: 0.60357908626092693 | D18: 0.38074086490110626 | E18: 0.61925913509889374 | F18: 0.40369134105635185 | G18: 0.59630865894364815
A19: 17 | B19: 0.67327412276140364 | C19: 0.32672587723859642 | D19: 0.65144503807159981 | E19: 0.34855496192840013 | F19: 0.6585463595714165 | G19: 0.3414536404285835
A20: 18 | B20: 0.42834966752392206 | C20: 0.57165033247607799 | D20: 0.41691440530834545 | E20: 0.58308559469165455 | F20: 0.43200364823348697 | G20: 0.56799635176651309
A21: 19 | B21: 0.59167984902728055 | C21: 0.40832015097271945 | D21: 0.56439626753087113 | E21: 0.43560373246912892 | F21: 0.5735137855824618 | G21: 0.42648621441753815
A22: 20 | B22: 0.66178899665410185 | C22: 0.3382110033458981 | D22: 0.64657805308211813 | E22: 0.35342194691788187 | F22: 0.65652362375379281 | G22: 0.34347637624620719
A23: 21 | B23: 0.58212160255230383 | C23: 0.41787839744769617 | D23: 0.57764347952066564 | E23: 0.42235652047933442 | F23: 0.59576410064928331 | G23: 0.40423589935071669
A24: 22 | B24: 0.59988010519801982 | C24: 0.40011989480198018 | D24: 0.58720839204634412 | E24: 0.41279160795365588 | F24: 0.60576094618939458 | G24: 0.39423905381060548
A25: 23 | B25: 0.71858340363662476 | C25: 0.28141659636337529 | D25: 0.70621356049185391 | E25: 0.29378643950814609 | F25: 0.71744431503857908 | G25: 0.28255568496142086
A26: 24 | B26: 0.66298735313926516 | C26: 0.33701264686073484 | D26: 0.67269176272354769 | E26: 0.32730823727645236 | F26: 0.67754476682945519 | G26: 0.32245523317054486
A27: 25 | B27: 0.49771646587854984 | C27: 0.50228353412145021 | D27: 0.4772463850728686 | E27: 0.52275361492713146 | F27: 0.49418072197206747 | G27: 0.50581927802793258
A28: 26 | B28: 0.73303647158608987 | C28: 0.26696352841391008 | D28: 0.72293396854009739 | E28: 0.27706603145990255 | F28: 0.72785680519145646 | G28: 0.27214319480854354
A29: 27 | B29: 0.68013061835728694 | C29: 0.31986938164271306 | D29: 0.6595185535582887 | E29: 0.34048144644171136 | F29: 0.66576275461941103 | G29: 0.33423724538058902
A30: 28 | B30: 0.65328346489234201 | C30: 0.34671653510765799 | D30: 0.63222126695883751 | E30: 0.36777873304116254 | F30: 0.63430033771736627 | G30: 0.36569966228263379
A31: 29 | B31: 0.55154001432571464 | C31: 0.44845998567428536 | D31: 0.52109441637687814 | E31: 0.47890558362312186 | F31: 0.5293519278096801 | G31: 0.47064807219031995
A32: 30 | B32: 0.3973230220107079 | C32: 0.6026769779892921 | D32: 0.37438059462915602 | E32: 0.62561940537084404 | F32: 0.37197980526505592 | G32: 0.62802019473494408
A33: 31 | B33: 0.34075433231396535 | C33: 0.65924566768603465 | D33: 0.3217310855263158 | E33: 0.6782689144736842 | F33: 0.32028740838343078 | G33: 0.67971259161656916
A34: 32 | B34: 0.48330241187384043 | C34: 0.51669758812615951 | D34: 0.45959425358157652 | E34: 0.54040574641842354 | F34: 0.45286926048345344 | G34: 0.54713073951654656
A35: 33 | B35: 0.59725406352232036 | C35: 0.40274593647767959 | D35: 0.57162169188374146 | E35: 0.42837830811625849 | F35: 0.57391507353894844 | G35: 0.42608492646105162
A36: 34 | B36: 0.50654997491498965 | C36: 0.49345002508501029 | D36: 0.48154522495557012 | E36: 0.51845477504442994 | F36: 0.46171989068174163 | G36: 0.53828010931825843
A37: 35 | B37: 0.45445110992988585 | C37: 0.5455488900701142 | D37: 0.43283774382230927 | E37: 0.56716225617769078 | F37: 0.42586904213382482 | G37: 0.57413095786617518
A38: 36 | B38: 0.48324838764221356 | C38: 0.51675161235778644 | D38: 0.45778210116731516 | E38: 0.54221789883268479 | F38: 0.45750487329434697 | G38: 0.54249512670565303
A39: 37 | B39: 0.57470255709067164 | C39: 0.42529744290932836 | D39: 0.54800451420950036 | E39: 0.45199548579049964 | F39: 0.54495235748316084 | G39: 0.45504764251683916
A40: 38 | B40: 0.7298920362969995 | C40: 0.27010796370300044 | D40: 0.7386873492210223 | E40: 0.26131265077897775 | F40: 0.72595042820245592 | G40: 0.27404957179754408
A41: 39 | B41: 0.62796625758810076 | C41: 0.37203374241189918 | D41: 0.60224719101123592 | E41: 0.39775280898876403 | F41: 0.60348929421094366 | G41: 0.39651070578905628
A42: 40 | B42: 0.69147136444634927 | C42: 0.30852863555365079 | D42: 0.68349864743011723 | E42: 0.31650135256988277 | F42: 0.67658027223568895 | G42: 0.32341972776431099