A1: SB 5004 - M. Locke Substitute Population Totals
A2: DISTRICT | B2: Total Pop. | C2: Target | D2: Difference | E2: Deviation
A3: 1 | B3: 727366 | C3: 727365.818181818 | D3: =B3-C3 -> 0.18181818199809641 | E3: =(B3-C3)/C3 -> 2.4996800434282676E-7
A4: 2 | B4: 727365 | C4: 727365.818181818 | D4: =B4-C4 -> -0.81818181800190359 | E4: =(B4-C4)/C4 -> -1.1248560181822903E-6
A5: 3 | B5: 727366 | C5: 727365.818181818 | D5: =B5-C5 -> 0.18181818199809641 | E5: =(B5-C5)/C5 -> 2.4996800434282676E-7
A6: 4 | B6: 727366 | C6: 727365.818181818 | D6: =B6-C6 -> 0.18181818199809641 | E6: =(B6-C6)/C6 -> 2.4996800434282676E-7
A7: 5 | B7: 727366 | C7: 727365.818181818 | D7: =B7-C7 -> 0.18181818199809641 | E7: =(B7-C7)/C7 -> 2.4996800434282676E-7
A8: 6 | B8: 727365 | C8: 727365.818181818 | D8: =B8-C8 -> -0.81818181800190359 | E8: =(B8-C8)/C8 -> -1.1248560181822903E-6
A9: 7 | B9: 727367 | C9: 727365.818181818 | D9: =B9-C9 -> 1.1818181819980964 | E9: =(B9-C9)/C9 -> 1.6247920268679438E-6
A10: 8 | B10: 727366 | C10: 727365.818181818 | D10: =B10-C10 -> 0.18181818199809641 | E10: =(B10-C10)/C10 -> 2.4996800434282676E-7
A11: 9 | B11: 727366 | C11: 727365.818181818 | D11: =B11-C11 -> 0.18181818199809641 | E11: =(B11-C11)/C11 -> 2.4996800434282676E-7
A12: 10 | B12: 727365 | C12: 727365.818181818 | D12: =B12-C12 -> -0.81818181800190359 | E12: =(B12-C12)/C12 -> -1.1248560181822903E-6
A13: 11 | B13: 727366 | C13: 727365.818181818 | D13: =B13-C13 -> 0.18181818199809641 | E13: =(B13-C13)/C13 -> 2.4996800434282676E-7

A1: SB 5004 - M. Locke Substitute Racial Demographics
A2: DISTRICT | B2: Total Pop. | C2: White | D2: % White | E2: Black | F2: % Black | G2: AIAN | H2: % AIAN | I2: Asian | J2: % Asian | K2: HawPI | L2: % HawPI | M2: Other | N2: % Other | O2: Multi | P2: % Multi | Q2: Total Hispanic | R2: % Hispanic
A3: 1 | B3: 727366 | C3: 530333 | D3: =C3/B3 -> 0.72911436608254987 | E3: 129021 | F3: =E3/B3 -> 0.17738112587060709 | G3: 6562 | H3: =G3/B3 -> 9.021592980700226E-3 | I3: 26069 | J3: =I3/B3 -> 3.5840278484284394E-2 | K3: 984 | L3: =K3/B3 -> 1.3528265000013748E-3 | M3: 28809 | N3: =M3/B3 -> 3.9607295364369521E-2 | O3: 5588 | P3: =O3/B3 -> 7.6825147174874823E-3 | Q3: 64605 | R3: =Q3/B3 -> 8.8820483772956121E-2
A4: 2 | B4: 727365 | C4: 523525 | D4: =C4/B4 -> 0.71975555601383079 | E4: 133529 | F4: =E4/B4 -> 0.18357908340379314 | G4: 5493 | H4: =G4/B4 -> 7.5519168505495862E-3 | I4: 42401 | J4: =I4/B4 -> 5.8293978951420536E-2 | K4: 1307 | L4: =K4/B4 -> 1.7968970186907536E-3 | M4: 14746 | N4: =M4/B4 -> 2.0273177840561478E-2 | O4: 6364 | P4: =O4/B4 -> 8.7493899211537537E-3 | Q4: 42403 | R4: =Q4/B4 -> 5.8296728602558551E-2
A5: 3 | B5: 727366 | C5: 343576 | D5: =C5/B5 -> 0.47235642028909791 | E5: 327424 | F5: =E5/B5 -> 0.45015026822809973 | G5: 5895 | H5: =G5/B5 -> 8.1045855868984804E-3 | I5: 23586 | J5: =I5/B5 -> 3.24265912896671E-2 | K5: 1365 | L5: =K5/B5 -> 1.8766343216482487E-3 | M5: 15539 | N5: =M5/B5 -> 2.1363385145855045E-2 | O5: 9981 | P5: =O5/B5 -> 1.3722115138733457E-2 | Q5: 42243 | R5: =Q5/B5 -> 5.8076676666217561E-2
A6: 4 | B6: 727366 | C6: 295947 | D6: =C6/B6 -> 0.40687494328852325 | E6: 385276 | F6: =E6/B6 -> 0.52968656769769273 | G6: 4989 | H6: =G6/B6 -> 6.8589953338484338E-3 | I6: 14109 | J6: =I6/B6 -> 1.9397387285080687E-2 | K6: 680 | L6: =K6/B6 -> 9.348801016269663E-4 | M6: 20356 | N6: =M6/B6 -> 2.7985910806939011E-2 | O6: 6009 | P6: =O6/B6 -> 8.2613154862888841E-3 | Q6: 38642 | R6: =Q6/B6 -> 5.3125936598631227E-2
A7: 5 | B7: 727366 | C7: 522994 | D7: =C7/B7 -> 0.71902453510337294 | E7: 171600 | F7: =E7/B7 -> 0.23591974329292267 | G7: 4198 | H7: =G7/B7 -> 5.7715098038676541E-3 | I7: 13092 | J7: =I7/B7 -> 1.7999191603676828E-2 | K7: 378 | L7: =K7/B7 -> 5.1968335061028425E-4 | M7: 12559 | N7: =M7/B7 -> 1.7266410582842749E-2 | O7: 2545 | P7: =O7/B7 -> 3.498926262706808E-3 | Q7: 24993 | R7: =Q7/B7 -> 3.4360968205827604E-2
A8: 6 | B8: 727365 | C8: 647104 | D8: =C8/B8 -> 0.88965512500601485 | E8: 50128 | F8: =E8/B8 -> 6.8917256123129378E-2 | G8: 4597 | H8: =G8/B8 -> 6.3200731407202712E-3 | I8: 10300 | J8: =I8/B8 -> 1.4160703360761103E-2 | K8: 377 | L8: =K8/B8 -> 5.1830923951523653E-4 | M8: 13087 | N8: =M8/B8 -> 1.7992342221580637E-2 | O8: 1772 | P8: =O8/B8 -> 2.4361909082785123E-3 | Q8: 27221 | R8: =Q8/B8 -> 3.7424126813910483E-2
A9: 7 | B9: 727367 | C9: 563859 | D9: =C9/B9 -> 0.77520563896904859 | E9: 107025 | F9: =E9/B9 -> 0.14714030193836125 | G9: 4672 | H9: =G9/B9 -> 6.4231673969261738E-3 | I9: 34069 | J9: =I9/B9 -> 4.6838803520093709E-2 | K9: 479 | L9: =K9/B9 -> 6.5853963679957984E-4 | M9: 13563 | N9: =M9/B9 -> 1.8646707920485808E-2 | O9: 3700 | P9: =O9/B9 -> 5.0868406182848552E-3 | Q9: 31102 | R9: =Q9/B9 -> 4.2759707272944744E-2
A10: 8 | B10: 727366 | C10: 454669 | D10: =C10/B10 -> 0.62508970724504587 | E10: 105900 | F10: =E10/B10 -> 0.14559382759161138 | G10: 5554 | H10: =G10/B10 -> 7.6357707124061341E-3 | I10: 89760 | J10: =I10/B10 -> 0.12340417341475955 | K10: 962 | L10: =K10/B10 -> 1.3225803790663847E-3 | M10: 63612 | N10: =M10/B10 -> 8.7455283859844982E-2 | O10: 6909 | P10: =O10/B10 -> 9.4986567972657511E-3 | Q10: 135594 | R10: =Q10/B10 -> 0.18641784191177482
A11: 9 | B11: 727366 | C11: 651354 | D11: =C11/B11 -> 0.89549690252225156 | E11: 52120 | F11: =E11/B11 -> 7.1655810142349244E-2 | G11: 3646 | H11: =G11/B11 -> 5.0126071331351753E-3 | I11: 11332 | J11: =I11/B11 -> 1.5579501928877621E-2 | K11: 312 | L11: =K11/B11 -> 4.2894498780531395E-4 | M11: 7051 | N11: =M11/B11 -> 9.6938817596643224E-3 | O11: 1551 | P11: =O11/B11 -> 2.1323515259168012E-3 | Q11: 16203 | R11: =Q11/B11 -> 2.2276268068620198E-2
A12: 10 | B12: 727365 | C12: 527743 | D12: =C12/B12 -> 0.7255545702638978 | E12: 54611 | F12: =E12/B12 -> 7.5080599148982977E-2 | G12: 4011 | H12: =G12/B12 -> 5.5144253572827944E-3 | I12: 96867 | J12: =I12/B12 -> 0.13317522839289764 | K12: 778 | L12: =K12/B12 -> 1.0696142926866154E-3 | M12: 38400 | N12: =M12/B12 -> 5.2793301849827806E-2 | O12: 4955 | P12: =O12/B12 -> 6.8122606944243953E-3 | Q12: 85367 | R12: =Q12/B12 -> 0.11736473434932942
A13: 11 | B13: 727366 | C13: 425748 | D13: =C13/B13 -> 0.58532843162864368 | E13: 96820 | F13: =E13/B13 -> 0.13311042858753364 | G13: 5246 | H13: =G13/B13 -> 7.2123250193162729E-3 | I13: 137228 | J13: =I13/B13 -> 0.18866430380303725 | K13: 957 | L13: =K13/B13 -> 1.3157062606720688E-3 | M13: 54161 | N13: =M13/B13 -> 7.4461825270909013E-2 | O13: 7206 | P13: =O13/B13 -> 9.9069794298881162E-3 | Q13: 123452 | R13: =Q13/B13 -> 0.169724732803018

A1: SB 5004 - M. Locke Substitute Voting Age Population
A2: DISTRICT | B2: Voting Age Population | C2: VAP White | D2: % VAP White | E2: VAP Black | F2: % VAP Black | G2: VAP AIAN | H2: % VAP AIAN | I2: VAP Asian | J2: % VAP Asian | K2: VAP HawPI | L2: % VAP HawPI | M2: VAP Other | N2: % VAP Other | O2: VAP Multi | P2: % VAP Multi | Q2: VAP Hispanic | R2: % VAP Hispanic
A3: 1 | B3: 536389 | C3: 401554 | D3: =C3/B3 -> 0.74862459893845701 | E3: 90359 | F3: =E3/B3 -> 0.16845796614024522 | G3: 4709 | H3: =G3/B3 -> 8.7790763792695223E-3 | I3: 17761 | J3: =I3/B3 -> 3.3112163001105539E-2 | K3: 651 | L3: =K3/B3 -> 1.2136714213005859E-3 | M3: 18445 | N3: =M3/B3 -> 3.4387356936849939E-2 | O3: 2910 | P3: =O3/B3 -> 5.4251671827722043E-3 | Q3: 40656 | R3: =Q3/B3 -> 7.5795737794772083E-2
A4: 2 | B4: 556485 | C4: 411862 | D4: =C4/B4 -> 0.74011339029803136 | E4: 95595 | F4: =E4/B4 -> 0.17178360602711665 | G4: 4106 | H4: =G4/B4 -> 7.3784558433740354E-3 | I4: 30925 | J4: =I4/B4 -> 5.5572027997160753E-2 | K4: 912 | L4: =K4/B4 -> 1.6388581902477156E-3 | M4: 9753 | N4: =M4/B4 -> 1.7526078870050407E-2 | O4: 3332 | P4: =O4/B4 -> 5.9875827740190658E-3 | Q4: 27167 | R4: =Q4/B4 -> 4.8818925936907551E-2
A5: 3 | B5: 561119 | C5: 283386 | D5: =C5/B5 -> 0.50503725591184756 | E5: 236462 | F5: =E5/B5 -> 0.42141150094721441 | G5: 4589 | H5: =G5/B5 -> 8.1783008595324707E-3 | I5: 18382 | J5: =I5/B5 -> 3.275953942033686E-2 | K5: 986 | L5: =K5/B5 -> 1.7572030175417336E-3 | M5: 11321 | N5: =M5/B5 -> 2.0175755944817408E-2 | O5: 5993 | P5: =O5/B5 -> 1.0680443898709542E-2 | Q5: 29190 | R5: =Q5/B5 -> 5.2021050793147262E-2
A6: 4 | B6: 559377 | C6: 241831 | D6: =C6/B6 -> 0.43232202968659778 | E6: 284293 | F6: =E6/B6 -> 0.50823147894890208 | G6: 3881 | H6: =G6/B6 -> 6.9380757521313894E-3 | I6: 11094 | J6: =I6/B6 -> 1.98327782515191E-2 | K6: 451 | L6: =K6/B6 -> 8.062541005439981E-4 | M6: 14140 | N6: =M6/B6 -> 2.5278121910625572E-2 | O6: 3687 | P6: =O6/B6 -> 6.5912613496800906E-3 | Q6: 26193 | R6: =Q6/B6 -> 4.6825307440241555E-2
A7: 5 | B7: 573901 | C7: 422296 | D7: =C7/B7 -> 0.73583422924859865 | E7: 128260 | F7: =E7/B7 -> 0.22348802319563826 | G7: 3214 | H7: =G7/B7 -> 5.600269035948709E-3 | I7: 10299 | J7: =I7/B7 -> 1.7945603858505212E-2 | K7: 285 | L7: =K7/B7 -> 4.9660133019458061E-4 | M7: 7971 | N7: =M7/B7 -> 1.3889155098178955E-2 | O7: 1576 | P7: =O7/B7 -> 2.7461182329356457E-3 | Q7: 16348 | R7: =Q7/B7 -> 2.8485749284284222E-2
A8: 6 | B8: 574347 | C8: 517225 | D8: =C8/B8 -> 0.90054444438640757 | E8: 36508 | F8: =E8/B8 -> 6.3564360917703067E-2 | G8: 3488 | H8: =G8/B8 -> 6.072983753723794E-3 | I8: 7472 | J8: =I8/B8 -> 1.3009556940316568E-2 | K8: 293 | L8: =K8/B8 -> 5.1014456417461916E-4 | M8: 8282 | N8: =M8/B8 -> 1.4419854199638895E-2 | O8: 1079 | P8: =O8/B8 -> 1.878655238035543E-3 | Q8: 17211 | R8: =Q8/B8 -> 2.9966205099008093E-2
A9: 7 | B9: 552613 | C9: 436735 | D9: =C9/B9 -> 0.79030895038661775 | E9: 77159 | F9: =E9/B9 -> 0.13962574170350681 | G9: 3343 | H9: =G9/B9 -> 6.0494414716990011E-3 | I9: 24081 | J9: =I9/B9 -> 4.3576607861197617E-2 | K9: 327 | L9: =K9/B9 -> 5.9173417925383585E-4 | M9: 8840 | N9: =M9/B9 -> 1.5996728270959968E-2 | O9: 2128 | P9: =O9/B9 -> 3.8507961267650235E-3 | Q9: 20145 | R9: =Q9/B9 -> 3.6454082694399155E-2
A10: 8 | B10: 580212 | C10: 375269 | D10: =C10/B10 -> 0.64677910832592223 | E10: 79591 | F10: =E10/B10 -> 0.13717572197748409 | G10: 4213 | H10: =G10/B10 -> 7.2611390319400494E-3 | I10: 69715 | J10: =I10/B10 -> 0.12015435737282235 | K10: 738 | L10: =K10/B10 -> 1.2719488738598995E-3 | M10: 46039 | N10: =M10/B10 -> 7.9348582931755979E-2 | O10: 4647 | P10: =O10/B10 -> 8.0091414862153831E-3 | Q10: 98819 | R10: =Q10/B10 -> 0.17031533301620788
A11: 9 | B11: 583498 | C11: 527741 | D11: =C11/B11 -> 0.90444354565054208 | E11: 37720 | F11: =E11/B11 -> 6.4644608893260985E-2 | G11: 2945 | H11: =G11/B11 -> 5.0471466911626087E-3 | I11: 9125 | J11: =I11/B11 -> 1.5638442633907915E-2 | K11: 238 | L11: =K11/B11 -> 4.0788485993096808E-4 | M11: 4716 | N11: =M11/B11 -> 8.0822899135901058E-3 | O11: 1013 | P11: =O11/B11 -> 1.7360813576053388E-3 | Q11: 10983 | R11: =Q11/B11 -> 1.8822686624461439E-2
A12: 10 | B12: 520811 | C12: 387308 | D12: =C12/B12 -> 0.74366324828008623 | E12: 36962 | F12: =E12/B12 -> 7.0970083197167494E-2 | G12: 2706 | H12: =G12/B12 -> 5.1957427934509835E-3 | I12: 65528 | J12: =I12/B12 -> 0.12581915512537178 | K12: 541 | L12: =K12/B12 -> 1.0387645422235705E-3 | M12: 25026 | N12: =M12/B12 -> 4.8051980468922506E-2 | O12: 2740 | P12: =O12/B12 -> 5.2610255927774182E-3 | Q12: 55325 | R12: =Q12/B12 -> 0.10622855508044185
A13: 11 | B13: 548595 | C13: 334137 | D13: =C13/B13 -> 0.60907773494107675 | E13: 67339 | F13: =E13/B13 -> 0.12274811108376854 | G13: 3592 | H13: =G13/B13 -> 6.5476353229613829E-3 | I13: 101292 | J13: =I13/B13 -> 0.18463894129549122 | K13: 710 | L13: =K13/B13 -> 1.2942152225229905E-3 | M13: 37301 | N13: =M13/B13 -> 6.7993692979338133E-2 | O13: 4224 | P13: =O13/B13 -> 7.699669154841003E-3 | Q13: 84820 | R13: =Q13/B13 -> 0.15461314813295782

A1: SB 5004 - M. Locke Substitute Election Data
A2: District | B2: Rep. Gov '09 | C2: Dem. Gov '09 | D2: Rep. Lt. Gov '09 | E2: Dem. Lt. Gov '09 | F2: Rep. Att. Gen. '09 | G2: Dem. Att. Gen. '09 | H2: Rep. Pres. '08 | I2: Dem. Pres. '08 | J2: Other Pres. '08 | K2: Rep. U.S. Sen. '08 | L2: Dem. U.S. Sen. '08 | M2: Other U.S. Sen. '08
A3: 1 | B3: 0.65935613682092553 | C3: 0.34064386317907447 | D3: 0.63744956106576312 | E3: 0.36255043893423688 | F3: 0.63991930757509397 | G3: 0.36008069242490609 | H3: 0.53069004824861987 | I3: 0.46092068422810817 | J3: 8.3892675232719524E-3 | K3: 0.3949727188257568 | L3: 0.59411830458505366 | M3: 1.090897658918953E-2
A4: 2 | B4: 0.65688596001340338 | C4: 0.34311403998659668 | D4: 0.60810626548189894 | E4: 0.39189373451810106 | F4: 0.63767621452252188 | G4: 0.36232378547747807 | H4: 0.54554762826781833 | I4: 0.44550299625222339 | J4: 8.9493754799582562E-3 | K4: 0.38753243966390161 | L4: 0.59995440005901168 | M4: 1.25131602770867E-2
A5: 3 | B5: 0.45375468339877972 | C5: 0.54624531660122033 | D5: 0.42156384535448432 | E5: 0.57843615464551568 | F5: 0.4401513430632063 | G5: 0.55984865693679364 | H5: 0.34182484123045948 | I5: 0.65089978330947473 | J5: 7.2753754600657569E-3 | K5: 0.24229794854621958 | L5: 0.74549379031201313 | M5: 1.2208261141767249E-2
A6: 4 | B6: 0.4168407561678949 | C6: 0.58315924383210505 | D6: 0.40154250726116647 | E6: 0.59845749273883353 | F6: 0.42112519778610868 | G6: 0.57887480221389132 | H6: 0.31065753553294384 | I6: 0.68239014803436915 | J6: 6.9523164326869549E-3 | K6: 0.23130599167379051 | L6: 0.7562151192288179 | M6: 1.2478889097391631E-2
A7: 5 | B7: 0.60313295989440441 | C7: 0.39686704010559559 | D7: 0.58973618278882955 | E7: 0.41026381721117045 | F7: 0.60353326938948493 | G7: 0.39646673061051507 | H7: 0.50527759458492871 | I7: 0.484544538829775 | J7: 1.0177866585296231E-2 | K7: 0.3419504156839922 | L7: 0.64647066187989999 | M7: 1.1578922436107831E-2
A8: 6 | B8: 0.6934956507433836 | C8: 0.3065043492566164 | D8: 0.68862715655451801 | E8: 0.31137284344548199 | F8: 0.69834997624926265 | G8: 0.3016500237507373 | H8: 0.61428552740877373 | I8: 0.37471302709809079 | J8: 1.1001445493135543E-2 | K8: 0.43639349821629836 | L8: 0.55297078585938508 | M8: 1.0635715924316525E-2
A9: 7 | B9: 0.69639066786566917 | C9: 0.30360933213433089 | D9: 0.66851277439248225 | E9: 0.33148722560751781 | F9: 0.6905589422484576 | G9: 0.3094410577515424 | H9: 0.58654136298221993 | I9: 0.40553769555730934 | J9: 7.92094146047073E-3 | K9: 0.43286763799087402 | L9: 0.55538720835315325 | M9: 1.1745153655972704E-2
A10: 8 | B10: 0.39936804590240227 | C10: 0.60063195409759773 | D10: 0.37794023961058643 | E10: 0.62205976038941357 | F10: 0.37500618505690253 | G10: 0.62499381494309747 | H10: 0.32799846992445253 | I10: 0.66302381180070769 | J10: 8.9777182748398202E-3 | K10: 0.26132543341618425 | L10: 0.72503712780106477 | M10: 1.3637438782750986E-2
A11: 9 | B11: 0.65354671808075759 | C11: 0.34645328191924246 | D11: 0.64772155281162802 | E11: 0.35227844718837192 | F11: 0.64877488323300947 | G11: 0.35122511676699053 | H11: 0.56744613682807965 | I11: 0.41861893354690649 | J11: 1.3934929625013918E-2 | K11: 0.35395437150858466 | L11: 0.63519200035189072 | M11: 1.0853628139524655E-2
A12: 10 | B12: 0.6254022897941125 | C12: 0.3745977102058875 | D12: 0.60290030359117208 | E12: 0.39709969640882797 | F12: 0.60042748091603049 | G12: 0.39957251908396946 | H12: 0.49609920573339167 | I12: 0.49582763144900754 | J12: 8.073162817600836E-3 | K12: 0.39145498190677508 | L12: 0.5983196589158396 | M12: 1.0225359177385261E-2
A13: 11 | B13: 0.49776649546411633 | C13: 0.50223350453588367 | D13: 0.46960358824967136 | E13: 0.53039641175032859 | F13: 0.46537370477884532 | G13: 0.53462629522115468 | H13: 0.38459978823582419 | I13: 0.607305113128628 | J13: 8.0950986355478455E-3 | K13: 0.30391251998799773 | L13: 0.6840054238215153 | M13: 1.2082056190487042E-2