A1: SB____J. Howell (3/30/11) Population Totals
A2: DISTRICT | B2: Total Population | C2: Target | D2: Difference | E2: Deviation
A3: 1 | B3: 200724 | C3: 200025.60000000001 | D3: =B3-C3 -> 698.39999999999418 | E3: =(B3-C3)/C3 -> 3.4915530812055767E-3
A4: 2 | B4: 200193 | C4: 200025.60000000001 | D4: =B4-C4 -> 167.39999999999418 | E4: =(B4-C4)/C4 -> 8.3689287771162376E-4
A5: 3 | B5: 201842 | C5: 200025.60000000001 | D5: =B5-C5 -> 1816.3999999999942 | E5: =(B5-C5)/C5 -> 9.0808376527804144E-3
A6: 4 | B6: 203831 | C6: 200025.60000000001 | D6: =B6-C6 -> 3805.3999999999942 | E6: =(B6-C6)/C6 -> 1.902456485569844E-2
A7: 5 | B7: 201056 | C7: 200025.60000000001 | D7: =B7-C7 -> 1030.3999999999942 | E7: =(B7-C7)/C7 -> 5.1513406283995354E-3
A8: 6 | B8: 196062 | C8: 200025.60000000001 | D8: =B8-C8 -> -3963.6000000000058 | E8: =(B8-C8)/C8 -> -1.9815463620656584E-2
A9: 7 | B9: 198556 | C9: 200025.60000000001 | D9: =B9-C9 -> -1469.6000000000058 | E9: =(B9-C9)/C9 -> -7.3470595763742534E-3
A10: 8 | B10: 199526 | C10: 200025.60000000001 | D10: =B10-C10 -> -499.60000000000582 | E10: =(B10-C10)/C10 -> -2.4976802969220229E-3
A11: 9 | B11: 202033 | C11: 200025.60000000001 | D11: =B11-C11 -> 2007.3999999999942 | E11: =(B11-C11)/C11 -> 1.0035715428425133E-2
A12: 10 | B12: 197605 | C12: 200025.60000000001 | D12: =B12-C12 -> -2420.6000000000058 | E12: =(B12-C12)/C12 -> -1.2101451014270202E-2
A13: 11 | B13: 200218 | C13: 200025.60000000001 | D13: =B13-C13 -> 192.39999999999418 | E13: =(B13-C13)/C13 -> 9.6187687975936168E-4
A14: 12 | B14: 203531 | C14: 200025.60000000001 | D14: =B14-C14 -> 3505.3999999999942 | E14: =(B14-C14)/C14 -> 1.7524756831125587E-2
A15: 13 | B15: 202372 | C15: 200025.60000000001 | D15: =B15-C15 -> 2346.3999999999942 | E15: =(B15-C15)/C15 -> 1.1730498496192458E-2
A16: 14 | B16: 197025 | C16: 200025.60000000001 | D16: =B16-C16 -> -3000.6000000000058 | E16: =(B16-C16)/C16 -> -1.5001079861777721E-2
A17: 15 | B17: 203055 | C17: 200025.60000000001 | D17: =B17-C17 -> 3029.3999999999942 | E17: =(B17-C17)/C17 -> 1.5145061432136658E-2
A18: 16 | B18: 197225 | C18: 200025.60000000001 | D18: =B18-C18 -> -2800.6000000000058 | E18: =(B18-C18)/C18 -> -1.4001207845395817E-2
A19: 17 | B19: 204024 | C19: 200025.60000000001 | D19: =B19-C19 -> 3998.3999999999942 | E19: =(B19-C19)/C19 -> 1.9989441351506976E-2
A20: 18 | B20: 197503 | C20: 200025.60000000001 | D20: =B20-C20 -> -2522.6000000000058 | E20: =(B20-C20)/C20 -> -1.2611385742624973E-2
A21: 19 | B21: 199202 | C21: 200025.60000000001 | D21: =B21-C21 -> -823.60000000000582 | E21: =(B21-C21)/C21 -> -4.1174729634607058E-3
A22: 20 | B22: 200108 | C22: 200025.60000000001 | D22: =B22-C22 -> 82.399999999994179 | E22: =(B22-C22)/C22 -> 4.1194727074931497E-4
A23: 21 | B23: 200387 | C23: 200025.60000000001 | D23: =B23-C23 -> 361.39999999999418 | E23: =(B23-C23)/C23 -> 1.8067687336020698E-3
A24: 22 | B24: 202229 | C24: 200025.60000000001 | D24: =B24-C24 -> 2203.3999999999942 | E24: =(B24-C24)/C24 -> 1.1015590004479396E-2
A25: 23 | B25: 198303 | C25: 200025.60000000001 | D25: =B25-C25 -> -1722.6000000000058 | E25: =(B25-C25)/C25 -> -8.6118976770973611E-3
A26: 24 | B26: 204024 | C26: 200025.60000000001 | D26: =B26-C26 -> 3998.3999999999942 | E26: =(B26-C26)/C26 -> 1.9989441351506976E-2
A27: 25 | B27: 198245 | C27: 200025.60000000001 | D27: =B27-C27 -> -1780.6000000000058 | E27: =(B27-C27)/C27 -> -8.9018605618481125E-3
A28: 26 | B28: 201484 | C28: 200025.60000000001 | D28: =B28-C28 -> 1458.3999999999942 | E28: =(B28-C28)/C28 -> 7.291066743456808E-3
A29: 27 | B29: 200123 | C29: 200025.60000000001 | D29: =B29-C29 -> 97.399999999994179 | E29: =(B29-C29)/C29 -> 4.8693767197795771E-4
A30: 28 | B30: 203825 | C30: 200025.60000000001 | D30: =B30-C30 -> 3799.3999999999942 | E30: =(B30-C30)/C30 -> 1.8994568695206982E-2
A31: 29 | B31: 204003 | C31: 200025.60000000001 | D31: =B31-C31 -> 3977.3999999999942 | E31: =(B31-C31)/C31 -> 1.9884454789786878E-2
A32: 30 | B32: 196030 | C32: 200025.60000000001 | D32: =B32-C32 -> -3995.6000000000058 | E32: =(B32-C32)/C32 -> -1.9975443143277687E-2
A33: 31 | B33: 200905 | C33: 200025.60000000001 | D33: =B33-C33 -> 879.39999999999418 | E33: =(B33-C33)/C33 -> 4.3964372560311984E-3
A34: 32 | B34: 198388 | C34: 200025.60000000001 | D34: =B34-C34 -> -1637.6000000000058 | E34: =(B34-C34)/C34 -> -8.1869520701350514E-3
A35: 33 | B35: 196727 | C35: 200025.60000000001 | D35: =B35-C35 -> -3298.6000000000058 | E35: =(B35-C35)/C35 -> -1.6490889166186757E-2
A36: 34 | B36: 196206 | C36: 200025.60000000001 | D36: =B36-C36 -> -3819.6000000000058 | E36: =(B36-C36)/C36 -> -1.9095555768861613E-2
A37: 35 | B37: 197400 | C37: 200025.60000000001 | D37: =B37-C37 -> -2625.6000000000058 | E37: =(B37-C37)/C37 -> -1.3126319831061653E-2
A38: 36 | B38: 199271 | C38: 200025.60000000001 | D38: =B38-C38 -> -754.60000000000582 | E38: =(B38-C38)/C38 -> -3.7725171178089496E-3
A39: 37 | B39: 198382 | C39: 200025.60000000001 | D39: =B39-C39 -> -1643.6000000000058 | E39: =(B39-C39)/C39 -> -8.2169482306265092E-3
A40: 38 | B40: 200106 | C40: 200025.60000000001 | D40: =B40-C40 -> 80.399999999994179 | E40: =(B40-C40)/C40 -> 4.0194855058549593E-4
A41: 39 | B41: 199529 | C41: 200025.60000000001 | D41: =B41-C41 -> -496.60000000000582 | E41: =(B41-C41)/C41 -> -2.4826822166762945E-3
A42: 40 | B42: 199766 | C42: 200025.60000000001 | D42: =B42-C42 -> -259.60000000000582 | E42: =(B42-C42)/C42 -> -1.2978338772637393E-3

A1: SB____J. Howell (3/30/11) Racial Demographics
A2: DISTRICT | B2: Total Population | C2: White | D2: % White | E2: Black | F2: % Black | G2: AIAN | H2: % AIAN | I2: Asian | J2: % Asian | K2: HawPI | L2: % HawPI | M2: Other | N2: % Other | O2: Multi | P2: % Multi | Q2: Total Hispanic | R2: % Hispanic
A3: 1 | B3: 200724 | C3: 116232 | D3: =C3/B3 -> 0.57906378908351763 | E3: 65194 | F3: =E3/B3 -> 0.32479424483370201 | G3: 1635 | H3: =G3/B3 -> 8.1455132420637285E-3 | I3: 8298 | J3: =I3/B3 -> 4.1340347940455553E-2 | K3: 458 | L3: =K3/B3 -> 2.2817401008349775E-3 | M3: 6115 | N3: =M3/B3 -> 3.0464717721846914E-2 | O3: 2792 | P3: =O3/B3 -> 1.3909647077579164E-2 | Q3: 15455 | R3: =Q3/B3 -> 7.6996273489966321E-2
A4: 2 | B4: 200193 | C4: 79753 | D4: =C4/B4 -> 0.39838056275693956 | E4: 106265 | F4: =E4/B4 -> 0.53081276568111768 | G4: 1480 | H4: =G4/B4 -> 7.3928658844215336E-3 | I4: 6174 | J4: =I4/B4 -> 3.0840239169201721E-2 | K4: 289 | L4: =K4/B4 -> 1.4436069193228534E-3 | M4: 3199 | N4: =M4/B4 -> 1.5979579705584113E-2 | O4: 3033 | P4: =O4/B4 -> 1.5150379883412507E-2 | Q4: 9267 | R4: =Q4/B4 -> 4.6290329831712398E-2
A5: 3 | B5: 201842 | C5: 166769 | D5: =C5/B5 -> 0.82623537222183685 | E5: 26547 | F5: =E5/B5 -> 0.13152366702668425 | G5: 1370 | H5: =G5/B5 -> 6.7874872424966062E-3 | I5: 4359 | J5: =I5/B5 -> 2.1596099919739202E-2 | K5: 157 | L5: =K5/B5 -> 7.7783612924961108E-4 | M5: 1797 | N5: =M5/B5 -> 8.9030033392455479E-3 | O5: 843 | P5: =O5/B5 -> 4.1765341207479116E-3 | Q5: 5505 | R5: =Q5/B5 -> 2.7273808226236363E-2
A6: 4 | B6: 203831 | C6: 160800 | D6: =C6/B6 -> 0.78888883437749902 | E6: 32870 | F6: =E6/B6 -> 0.16126104468898253 | G6: 2252 | H6: =G6/B6 -> 1.1048368501356516E-2 | I6: 3779 | J6: =I6/B6 -> 1.8539868812889108E-2 | K6: 188 | L6: =K6/B6 -> 9.2233271680951376E-4 | M6: 2825 | N6: =M6/B6 -> 1.3859520877589768E-2 | O6: 1117 | P6: =O6/B6 -> 5.4800300248735471E-3 | Q6: 7274 | R6: =Q6/B6 -> 3.5686426500385122E-2
A7: 5 | B7: 201056 | C7: 73907 | D7: =C7/B7 -> 0.36759410313544483 | E7: 113011 | F7: =E7/B7 -> 0.56208717969123034 | G7: 1446 | H7: =G7/B7 -> 7.192026102180487E-3 | I7: 5975 | J7: =I7/B7 -> 2.9718088492758237E-2 | K7: 251 | L7: =K7/B7 -> 1.2484084036288397E-3 | M7: 4093 | N7: =M7/B7 -> 2.0357512334871878E-2 | O7: 2373 | P7: =O7/B7 -> 1.1802681839885405E-2 | Q7: 10389 | R7: =Q7/B7 -> 5.167217093745026E-2
A8: 6 | B8: 196062 | C8: 123693 | D8: =C8/B8 -> 0.63088716834470726 | E8: 55043 | F8: =E8/B8 -> 0.28074282624883967 | G8: 1901 | H8: =G8/B8 -> 9.6959125174689645E-3 | I8: 6752 | J8: =I8/B8 -> 3.4438085911599393E-2 | K8: 442 | L8: =K8/B8 -> 2.2543889177913108E-3 | M8: 5834 | N8: =M8/B8 -> 2.9755893543878979E-2 | O8: 2397 | P8: =O8/B8 -> 1.2225724515714418E-2 | Q8: 15175 | R8: =Q8/B8 -> 7.7398986035029732E-2
A9: 7 | B9: 198556 | C9: 114199 | D9: =C9/B9 -> 0.57514756542234935 | E9: 57390 | F9: =E9/B9 -> 0.28903684602832452 | G9: 1739 | H9: =G9/B9 -> 8.7582344527488473E-3 | I9: 15964 | J9: =I9/B9 -> 8.0400491548983669E-2 | K9: 480 | L9: =K9/B9 -> 2.4174540180100326E-3 | M9: 5964 | N9: =M9/B9 -> 3.0036866173774653E-2 | O9: 2820 | P9: =O9/B9 -> 1.420254235580894E-2 | Q9: 16506 | R9: =Q9/B9 -> 8.3130200044319993E-2
A10: 8 | B10: 199526 | C10: 110491 | D10: =C10/B10 -> 0.55376742880627083 | E10: 63688 | F10: =E10/B10 -> 0.31919649569479669 | G10: 1363 | H10: =G10/B10 -> 6.8311899201106627E-3 | I10: 10561 | J10: =I10/B10 -> 5.2930445155017394E-2 | K10: 189 | L10: =K10/B10 -> 9.472449705802753E-4 | M10: 11463 | N10: =M10/B10 -> 5.7451159247416374E-2 | O10: 1771 | P10: =O10/B10 -> 8.8760362058077635E-3 | Q10: 19807 | R10: =Q10/B10 -> 9.9270270541182606E-2
A11: 9 | B11: 202033 | C11: 79271 | D11: =C11/B11 -> 0.39236659357629694 | E11: 112724 | F11: =E11/B11 -> 0.55794845396544124 | G11: 1735 | H11: =G11/B11 -> 8.5877059688268757E-3 | I11: 4133 | J11: =I11/B11 -> 2.045705404562621E-2 | K11: 117 | L11: =K11/B11 -> 5.7911331317161063E-4 | M11: 2311 | N11: =M11/B11 -> 1.143872535674865E-2 | O11: 1742 | P11: =O11/B11 -> 8.6223537738884248E-3 | Q11: 5445 | R11: =Q11/B11 -> 2.6951042651448032E-2
A12: 10 | B12: 197605 | C12: 154552 | D12: =C12/B12 -> 0.78212595835125631 | E12: 32032 | F12: =E12/B12 -> 0.1621011614078591 | G12: 1152 | H12: =G12/B12 -> 5.8298119986842437E-3 | I12: 6410 | J12: =I12/B12 -> 3.2438450444067714E-2 | K12: 114 | L12: =K12/B12 -> 5.7690847903646165E-4 | M12: 2433 | N12: =M12/B12 -> 1.2312441486804484E-2 | O12: 912 | P12: =O12/B12 -> 4.6152678322916932E-3 | Q12: 6509 | R12: =Q12/B12 -> 3.2939449912704637E-2
A13: 11 | B13: 200218 | C13: 139679 | D13: =C13/B13 -> 0.69763457830964248 | E13: 51608 | F13: =E13/B13 -> 0.25775904264351857 | G13: 1285 | H13: =G13/B13 -> 6.4180043752309979E-3 | I13: 3300 | J13: =I13/B13 -> 1.6482034582305287E-2 | K13: 149 | L13: =K13/B13 -> 7.4418883417075386E-4 | M13: 3308 | N13: =M13/B13 -> 1.6521991029777541E-2 | O13: 889 | P13: =O13/B13 -> 4.4401602253543639E-3 | Q13: 7104 | R13: =Q13/B13 -> 3.5481325355362657E-2
A14: 12 | B14: 203531 | C14: 161088 | D14: =C14/B14 -> 0.79146665618505285 | E14: 23258 | F14: =E14/B14 -> 0.11427251868265768 | G14: 945 | H14: =G14/B14 -> 4.6430273520986975E-3 | I14: 14599 | J14: =I14/B14 -> 7.1728631019353312E-2 | K14: 99 | L14: =K14/B14 -> 4.8641238926748259E-4 | M14: 2632 | N14: =M14/B14 -> 1.2931690995474891E-2 | O14: 910 | P14: =O14/B14 -> 4.4710633760950422E-3 | Q14: 7065 | R14: =Q14/B14 -> 3.471215687045217E-2
A15: 13 | B15: 202372 | C15: 140322 | D15: =C15/B15 -> 0.69338643685885404 | E15: 43143 | F15: =E15/B15 -> 0.21318660684284388 | G15: 1489 | H15: =G15/B15 -> 7.3577372363765742E-3 | I15: 12951 | J15: =I15/B15 -> 6.3996007352795842E-2 | K15: 282 | L15: =K15/B15 -> 1.3934734054118158E-3 | M15: 2518 | N15: =M15/B15 -> 1.2442432747613306E-2 | O15: 1667 | P15: =O15/B15 -> 8.2373055561046002E-3 | Q15: 8324 | R15: =Q15/B15 -> 4.1132172434921829E-2
A16: 14 | B16: 197025 | C16: 165546 | D16: =C16/B16 -> 0.84022839741149602 | E16: 18192 | F16: =E16/B16 -> 9.2333460220784161E-2 | G16: 1396 | H16: =G16/B16 -> 7.0853952544093386E-3 | I16: 7924 | J16: =I16/B16 -> 4.0218246415429516E-2 | K16: 348 | L16: =K16/B16 -> 1.7662733155690902E-3 | M16: 2529 | N16: =M16/B16 -> 1.2835934526075371E-2 | O16: 1090 | P16: =O16/B16 -> 5.5322928562365186E-3 | Q16: 8743 | R16: =Q16/B16 -> 4.437507930465677E-2
A17: 15 | B17: 203055 | C17: 152669 | D17: =C17/B17 -> 0.75186033340720493 | E17: 44752 | F17: =E17/B17 -> 0.22039348944867154 | G17: 1425 | H17: =G17/B17 -> 7.0178030582847013E-3 | I17: 1516 | J17: =I17/B17 -> 7.4659574991997246E-3 | K17: 71 | L17: =K17/B17 -> 3.4965895939523777E-4 | M17: 1998 | N17: =M17/B17 -> 9.8396986038265487E-3 | O17: 624 | P17: =O17/B17 -> 3.0730590234173006E-3 | Q17: 4210 | R17: =Q17/B17 -> 2.07332988599148E-2
A18: 16 | B18: 197225 | C18: 74286 | D18: =C18/B18 -> 0.37665610343516287 | E18: 106680 | F18: =E18/B18 -> 0.54090505767524399 | G18: 1345 | H18: =G18/B18 -> 6.8196222588414249E-3 | I18: 3651 | J18: =I18/B18 -> 1.8511851945747244E-2 | K18: 311 | L18: =K18/B18 -> 1.5768791988845228E-3 | M18: 9208 | N18: =M18/B18 -> 4.6687793129674228E-2 | O18: 1744 | P18: =O18/B18 -> 8.8426923564456847E-3 | Q18: 16186 | R18: =Q18/B18 -> 8.206870325770059E-2
A19: 17 | B19: 204024 | C19: 148539 | D19: =C19/B19 -> 0.72804670038818964 | E19: 38721 | F19: =E19/B19 -> 0.18978649570638748 | G19: 1535 | H19: =G19/B19 -> 7.5236246716072616E-3 | I19: 5232 | J19: =I19/B19 -> 2.5644041877426187E-2 | K19: 264 | L19: =K19/B19 -> 1.2939654158334313E-3 | M19: 8370 | N19: =M19/B19 -> 4.1024585342900835E-2 | O19: 1363 | P19: =O19/B19 -> 6.6805865976551776E-3 | Q19: 16277 | R19: =Q19/B19 -> 7.9779829823942286E-2
A20: 18 | B20: 197503 | C20: 81425 | D20: =C20/B20 -> 0.41227221864984331 | E20: 108701 | F20: =E20/B20 -> 0.55037644997797497 | G20: 1162 | H20: =G20/B20 -> 5.8834549348617485E-3 | I20: 2656 | J20: =I20/B20 -> 1.3447896993969711E-2 | K20: 204 | L20: =K20/B20 -> 1.0328957028500833E-3 | M20: 1990 | N20: =M20/B20 -> 1.0075796317017969E-2 | O20: 1365 | P20: =O20/B20 -> 6.911287423482175E-3 | Q20: 5190 | R20: =Q20/B20 -> 2.6278081851921237E-2
A21: 19 | B21: 199202 | C21: 185093 | D21: =C21/B21 -> 0.92917239786749128 | E21: 8319 | F21: =E21/B21 -> 4.1761628899308241E-2 | G21: 969 | H21: =G21/B21 -> 4.864408991877592E-3 | I21: 2830 | J21: =I21/B21 -> 1.4206684671840645E-2 | K21: 65 | L21: =K21/B21 -> 3.2630194475959074E-4 | M21: 1649 | N21: =M21/B21 -> 8.2780293370548486E-3 | O21: 277 | P21: =O21/B21 -> 1.3905482876677944E-3 | Q21: 3790 | R21: =Q21/B21 -> 1.902591339444383E-2
A22: 20 | B22: 200108 | C22: 135049 | D22: =C22/B22 -> 0.67488056449517264 | E22: 58271 | F22: =E22/B22 -> 0.29119775321326485 | G22: 865 | H22: =G22/B22 -> 4.3226657604893354E-3 | I22: 1103 | J22: =I22/B22 -> 5.5120235073060544E-3 | K22: 62 | L22: =K22/B22 -> 3.0983269034721251E-4 | M22: 4254 | N22: =M22/B22 -> 2.125852039898455E-2 | O22: 504 | P22: =O22/B22 -> 2.518639934435405E-3 | Q22: 7282 | R22: =Q22/B22 -> 3.6390349211425831E-2
A23: 21 | B23: 200387 | C23: 152018 | D23: =C23/B23 -> 0.75862206630170614 | E23: 34376 | F23: =E23/B23 -> 0.17154805451451441 | G23: 1123 | H23: =G23/B23 -> 5.6041559582208425E-3 | I23: 8409 | J23: =I23/B23 -> 4.1963800046909229E-2 | K23: 149 | L23: =K23/B23 -> 7.4356120906046794E-4 | M23: 3400 | N23: =M23/B23 -> 1.6967168528896584E-2 | O23: 912 | P23: =O23/B23 -> 4.5511934406922607E-3 | Q23: 8142 | R23: =Q23/B23 -> 4.0631378283022351E-2
A24: 22 | B24: 202229 | C24: 141593 | D24: =C24/B24 -> 0.70016169787715909 | E24: 19797 | F24: =E24/B24 -> 9.7893971685564379E-2 | G24: 1157 | H24: =G24/B24 -> 5.7212368156891449E-3 | I24: 30405 | J24: =I24/B24 -> 0.15034935642266936 | K24: 214 | L24: =K24/B24 -> 1.0582062908880527E-3 | M24: 7514 | N24: =M24/B24 -> 3.7155897522116017E-2 | O24: 1549 | P24: =O24/B24 -> 7.659633385913989E-3 | Q24: 19887 | R24: =Q24/B24 -> 9.8339011714442537E-2
A25: 23 | B25: 198303 | C25: 161173 | D25: =C25/B25 -> 0.8127612794561857 | E25: 30239 | F25: =E25/B25 -> 0.15248886804536493 | G25: 1107 | H25: =G25/B25 -> 5.5823663787234684E-3 | I25: 3461 | J25: =I25/B25 -> 1.7453089464102914E-2 | K25: 93 | L25: =K25/B25 -> 4.6897928926945128E-4 | M25: 1630 | N25: =M25/B25 -> 8.2197445323570501E-3 | O25: 600 | P25: =O25/B25 -> 3.0256728339964601E-3 | Q25: 4180 | R25: =Q25/B25 -> 2.1078854076842006E-2
A26: 24 | B26: 204024 | C26: 181909 | D26: =C26/B26 -> 0.89160588950319575 | E26: 15056 | F26: =E26/B26 -> 7.3795239775712659E-2 | G26: 1179 | H26: =G26/B26 -> 5.778731913892483E-3 | I26: 1966 | J26: =I26/B26 -> 9.6361212406383557E-3 | K26: 97 | L26: =K26/B26 -> 4.7543426263576833E-4 | M26: 3318 | N26: =M26/B26 -> 1.6262792612633806E-2 | O26: 499 | P26: =O26/B26 -> 2.4457906912912207E-3 | Q26: 6760 | R26: =Q26/B26 -> 3.3133356859977259E-2
A27: 25 | B27: 198245 | C27: 165121 | D27: =C27/B27 -> 0.83291381875961568 | E27: 20363 | F27: =E27/B27 -> 0.10271633584705793 | G27: 1222 | H27: =G27/B27 -> 6.1640898887739921E-3 | I27: 7934 | J27: =I27/B27 -> 4.0021185906328027E-2 | K27: 127 | L27: =K27/B27 -> 6.4062145325228886E-4 | M27: 2814 | N27: =M27/B27 -> 1.4194557239779061E-2 | O27: 664 | P27: =O27/B27 -> 3.3493909051930692E-3 | Q27: 6931 | R27: =Q27/B27 -> 3.496178970465838E-2
A28: 26 | B28: 201484 | C28: 180374 | D28: =C28/B28 -> 0.89522741259851901 | E28: 8075 | F28: =E28/B28 -> 4.0077624029699631E-2 | G28: 1371 | H28: =G28/B28 -> 6.8045105318536459E-3 | I28: 3298 | J28: =I28/B28 -> 1.6368545393182585E-2 | K28: 127 | L28: =K28/B28 -> 6.3032300331539973E-4 | M28: 7636 | N28: =M28/B28 -> 3.7898790970995216E-2 | O28: 603 | P28: =O28/B28 -> 2.9927934724345356E-3 | Q28: 14661 | R28: =Q28/B28 -> 7.2765083083520282E-2
A29: 27 | B29: 200123 | C29: 173489 | D29: =C29/B29 -> 0.86691184921273412 | E29: 12685 | F29: =E29/B29 -> 6.3386017599176503E-2 | G29: 1244 | H29: =G29/B29 -> 6.2161770511135655E-3 | I29: 4920 | J29: =I29/B29 -> 2.458488029861635E-2 | K29: 135 | L29: =K29/B29 -> 6.745851301449609E-4 | M29: 6886 | N29: =M29/B29 -> 3.4408838564282965E-2 | O29: 764 | P29: =O29/B29 -> 3.8176521439314821E-3 | Q29: 14373 | R29: =Q29/B29 -> 7.1820830189433499E-2
A30: 28 | B30: 203825 | C30: 152442 | D30: =C30/B30 -> 0.74790629216239424 | E30: 35345 | F30: =E30/B30 -> 0.17340856126579174 | G30: 1925 | H30: =G30/B30 -> 9.4443763032012757E-3 | I30: 6505 | J30: =I30/B30 -> 3.1914632650558078E-2 | K30: 269 | L30: =K30/B30 -> 1.3197595976941004E-3 | M30: 5830 | N30: =M30/B30 -> 2.8602968232552435E-2 | O30: 1509 | P30: =O30/B30 -> 7.4034097878081691E-3 | Q30: 15044 | R30: =Q30/B30 -> 7.3808414080706486E-2
A31: 29 | B31: 204003 | C31: 104516 | D31: =C31/B31 -> 0.51232579913040499 | E31: 48210 | F31: =E31/B31 -> 0.23632005411685122 | G31: 2051 | H31: =G31/B31 -> 1.0053773719013935E-2 | I31: 17169 | J31: =I31/B31 -> 8.4160527051072784E-2 | K31: 378 | L31: =K31/B31 -> 1.8529139277363568E-3 | M31: 28883 | N31: =M31/B31 -> 0.14158125125610899 | O31: 2796 | P31: =O31/B31 -> 1.3705680798811782E-2 | Q31: 57008 | R31: =Q31/B31 -> 0.27944687087934983
A32: 30 | B32: 196030 | C32: 135368 | D32: =C32/B32 -> 0.69054736519920423 | E32: 27710 | F32: =E32/B32 -> 0.14135591491098301 | G32: 1497 | H32: =G32/B32 -> 7.6365862368004897E-3 | I32: 14703 | J32: =I32/B32 -> 7.5003825945008415E-2 | K32: 264 | L32: =K32/B32 -> 1.3467326429628119E-3 | M32: 14757 | N32: =M32/B32 -> 7.5279293985614448E-2 | O32: 1731 | P32: =O32/B32 -> 8.8302810794266186E-3 | Q32: 31600 | R32: =Q32/B32 -> 0.16119981635463959
A33: 31 | B33: 200905 | C33: 148296 | D33: =C33/B33 -> 0.73813991687613545 | E33: 11990 | F33: =E33/B33 -> 5.9679948234240061E-2 | G33: 1269 | H33: =G33/B33 -> 6.3164182076105623E-3 | I33: 27819 | J33: =I33/B33 -> 0.13846843035265424 | K33: 244 | L33: =K33/B33 -> 1.2145043677359946E-3 | M33: 9884 | N33: =M33/B33 -> 4.9197381847141682E-2 | O33: 1403 | P33: =O33/B33 -> 6.9834001144819689E-3 | Q33: 24026 | R33: =Q33/B33 -> 0.11958886040665986
A34: 32 | B34: 198388 | C34: 146916 | D34: =C34/B34 -> 0.74054882351755147 | E34: 11182 | F34: =E34/B34 -> 5.636429622759441E-2 | G34: 1019 | H34: =G34/B34 -> 5.1363993789946974E-3 | I34: 31602 | J34: =I34/B34 -> 0.1592939089057806 | K34: 170 | L34: =K34/B34 -> 8.5690666774200053E-4 | M34: 6342 | N34: =M34/B34 -> 3.1967659334233928E-2 | O34: 1157 | P34: =O34/B34 -> 5.8320059681029098E-3 | Q34: 17734 | R34: =Q34/B34 -> 8.9390487327862575E-2
A35: 33 | B35: 196727 | C35: 112695 | D35: =C35/B35 -> 0.57284968509660594 | E35: 20220 | F35: =E35/B35 -> 0.10278202788636029 | G35: 1241 | H35: =G35/B35 -> 6.3082342535595009E-3 | I35: 40948 | J35: =I35/B35 -> 0.20814631443574089 | K35: 195 | L35: =K35/B35 -> 9.9122133718299987E-4 | M35: 19399 | N35: =M35/B35 -> 9.8608731897502633E-2 | O35: 2029 | P35: =O35/B35 -> 1.0313785093047726E-2 | Q35: 38839 | R35: =Q35/B35 -> 0.1974258744351309
A36: 34 | B36: 196206 | C36: 132743 | D36: =C36/B36 -> 0.67654913713138232 | E36: 11699 | F36: =E36/B36 -> 5.9626107254620142E-2 | G36: 1051 | H36: =G36/B36 -> 5.3566149862899195E-3 | I36: 41186 | J36: =I36/B36 -> 0.20991203123248015 | K36: 229 | L36: =K36/B36 -> 1.1671406582877181E-3 | M36: 8095 | N36: =M36/B36 -> 4.1257657767856233E-2 | O36: 1203 | P36: =O36/B36 -> 6.131310969083514E-3 | Q36: 21439 | R36: =Q36/B36 -> 0.10926781036257811
A37: 35 | B37: 197400 | C37: 107361 | D37: =C37/B37 -> 0.54387537993920976 | E37: 25022 | F37: =E37/B37 -> 0.12675785207700102 | G37: 1629 | H37: =G37/B37 -> 8.2522796352583593E-3 | I37: 35273 | J37: =I37/B37 -> 0.17868794326241136 | K37: 214 | L37: =K37/B37 -> 1.0840932117527863E-3 | M37: 25791 | N37: =M37/B37 -> 0.13065349544072949 | O37: 2110 | P37: =O37/B37 -> 1.0688956433637285E-2 | Q37: 52321 | R37: =Q37/B37 -> 0.26505065856129684
A38: 36 | B38: 199271 | C38: 106281 | D38: =C38/B38 -> 0.53334905731390925 | E38: 50424 | F38: =E38/B38 -> 0.25304233932684633 | G38: 1888 | H38: =G38/B38 -> 9.4745346789046076E-3 | I38: 16944 | J38: =I38/B38 -> 8.5029934109830327E-2 | K38: 383 | L38: =K38/B38 -> 1.922005710815924E-3 | M38: 20595 | N38: =M38/B38 -> 0.10335171700849596 | O38: 2756 | P38: =O38/B38 -> 1.3830411851197615E-2 | Q38: 42920 | R38: =Q38/B38 -> 0.21538507861153905
A39: 37 | B39: 198382 | C39: 119703 | D39: =C39/B39 -> 0.6033964775029993 | E39: 15501 | F39: =E39/B39 -> 7.813712937665715E-2 | G39: 1137 | H39: =G39/B39 -> 5.731366757064653E-3 | I39: 47782 | J39: =I39/B39 -> 0.24085854563418052 | K39: 268 | L39: =K39/B39 -> 1.3509290157373149E-3 | M39: 12404 | N39: =M39/B39 -> 6.2525833997036026E-2 | O39: 1587 | P39: =O39/B39 -> 7.9997177163250704E-3 | Q39: 30611 | R39: =Q39/B39 -> 0.15430331380871248
A40: 38 | B40: 200106 | C40: 188717 | D40: =C40/B40 -> 0.94308516486262284 | E40: 8245 | F40: =E40/B40 -> 4.1203162323968298E-2 | G40: 874 | H40: =G40/B40 -> 4.3676851268827522E-3 | I40: 1182 | J40: =I40/B40 -> 5.9068693592396028E-3 | K40: 51 | L40: =K40/B40 -> 2.5486492159155648E-4 | M40: 800 | N40: =M40/B40 -> 3.9978811230048077E-3 | O40: 237 | P40: =O40/B40 -> 1.1843722826901742E-3 | Q40: 1932 | R40: =Q40/B40 -> 9.6548829120566108E-3
A41: 39 | B41: 199529 | C41: 121844 | D41: =C41/B41 -> 0.61065809982508812 | E41: 35665 | F41: =E41/B41 -> 0.17874594670448907 | G41: 1327 | H41: =G41/B41 -> 6.6506623097394362E-3 | I41: 28302 | J41: =I41/B41 -> 0.14184404272060702 | K41: 358 | L41: =K41/B41 -> 1.7942254008189286E-3 | M41: 10040 | N41: =M41/B41 -> 5.0318500067659339E-2 | O41: 1993 | P41: =O41/B41 -> 9.9885229715981141E-3 | Q41: 25042 | R41: =Q41/B41 -> 0.12550556560700449
A42: 40 | B42: 199766 | C42: 190930 | D42: =C42/B42 -> 0.95576824885115585 | E42: 5241 | F42: =E42/B42 -> 2.6235695764043932E-2 | G42: 1063 | H42: =G42/B42 -> 5.3212258342260448E-3 | I42: 838 | J42: =I42/B42 -> 4.194908042409619E-3 | K42: 74 | L42: =K42/B42 -> 3.7043340708629098E-4 | M42: 1375 | N42: =M42/B42 -> 6.8830531722114873E-3 | O42: 245 | P42: =O42/B42 -> 1.2264349288667741E-3 | Q42: 2872 | R42: =Q42/B42 -> 1.4376820880430104E-2

A1: SB____J. Howell (3/30/11) Voting Age Population
A2: DISTRICT | B2: Voting Age Persons | C2: VAP White | D2: % VAP White | E2: VAP Black | F2: % VAP Black | G2: VAP AIAN | H2: % VAP AIAN | I2: VAP Asian | J2: % VAP Asian | K2: VAP HawPI | L2: % VAP HawPI | M2: VAP Other | N2: % VAP Other | O2: VAP Multi | P2: % VAP Multi | Q2: Voting Age Hispanic | R2: % VAP Hispanic
A3: 1 | B3: 154756 | C3: 94909 | D3: =C3/B3 -> 0.61328155289617203 | E3: 45977 | F3: =E3/B3 -> 0.29709348910543049 | G3: 1241 | H3: =G3/B3 -> 8.0190751893303002E-3 | I3: 6460 | J3: =I3/B3 -> 4.1743131122541292E-2 | K3: 307 | L3: =K3/B3 -> 1.9837679960712346E-3 | M3: 4320 | N3: =M3/B3 -> 2.7914911215074053E-2 | O3: 1542 | P3: =O3/B3 -> 9.9640724753805986E-3 | Q3: 10403 | R3: =Q3/B3 -> 6.7221949391299857E-2
A4: 2 | B4: 150369 | C4: 63636 | D4: =C4/B4 -> 0.42319893063064862 | E4: 77022 | F4: =E4/B4 -> 0.51221993895018259 | G4: 1105 | H4: =G4/B4 -> 7.3485891373886907E-3 | I4: 4466 | J4: =I4/B4 -> 2.9700270667491306E-2 | K4: 220 | L4: =K4/B4 -> 1.4630675205660742E-3 | M4: 2208 | N4: =M4/B4 -> 1.4683877660954053E-2 | O4: 1712 | P4: =O4/B4 -> 1.1385325432768722E-2 | Q4: 5918 | R4: =Q4/B4 -> 3.9356516303227396E-2
A5: 3 | B5: 158928 | C5: 133398 | D5: =C5/B5 -> 0.83936122017517367 | E5: 19716 | F5: =E5/B5 -> 0.12405617638175778 | G5: 1021 | H5: =G5/B5 -> 6.4242927615020635E-3 | I5: 3033 | J5: =I5/B5 -> 1.9084113560857745E-2 | K5: 107 | L5: =K5/B5 -> 6.7326084767945231E-4 | M5: 1151 | N5: =M5/B5 -> 7.2422732306453236E-3 | O5: 502 | P5: =O5/B5 -> 3.1586630423839726E-3 | Q5: 3510 | R5: =Q5/B5 -> 2.2085472666868014E-2
A6: 4 | B6: 151506 | C6: 121320 | D6: =C6/B6 -> 0.80076036592610189 | E6: 23655 | F6: =E6/B6 -> 0.1561324303987961 | G6: 1589 | H6: =G6/B6 -> 1.0488033477222025E-2 | I6: 2495 | J6: =I6/B6 -> 1.6467994666877879E-2 | K6: 109 | L6: =K6/B6 -> 7.1944345438464488E-4 | M6: 1752 | N6: =M6/B6 -> 1.1563898459466952E-2 | O6: 586 | P6: =O6/B6 -> 3.8678336171504759E-3 | Q6: 4460 | R6: =Q6/B6 -> 2.9437778041793726E-2
A7: 5 | B7: 149846 | C7: 59587 | D7: =C7/B7 -> 0.39765492572374306 | E7: 80300 | F7: =E7/B7 -> 0.53588350706725574 | G7: 1102 | H7: =G7/B7 -> 7.3542169961160128E-3 | I7: 4434 | J7: =I7/B7 -> 2.9590379456241742E-2 | K7: 181 | L7: =K7/B7 -> 1.2079067842985466E-3 | M7: 2948 | N7: =M7/B7 -> 1.9673531492332128E-2 | O7: 1294 | P7: =O7/B7 -> 8.6355324800128138E-3 | Q7: 6868 | R7: =Q7/B7 -> 4.5833722621891809E-2
A8: 6 | B8: 160101 | C8: 104665 | D8: =C8/B8 -> 0.6537435743686798 | E8: 42075 | F8: =E8/B8 -> 0.26280285569734108 | G8: 1522 | H8: =G8/B8 -> 9.5064990224920515E-3 | I8: 5515 | J8: =I8/B8 -> 3.4447005327886769E-2 | K8: 348 | L8: =K8/B8 -> 2.1736278973897728E-3 | M8: 4262 | N8: =M8/B8 -> 2.6620695685848308E-2 | O8: 1714 | P8: =O8/B8 -> 1.0705742000362272E-2 | Q8: 11037 | R8: =Q8/B8 -> 6.8937733056008393E-2
A9: 7 | B9: 150316 | C9: 91408 | D9: =C9/B9 -> 0.60810559088852811 | E9: 39625 | F9: =E9/B9 -> 0.26361132547433408 | G9: 1320 | H9: =G9/B9 -> 8.7815003060219797E-3 | I9: 12037 | J9: =I9/B9 -> 8.0077969078474684E-2 | K9: 340 | L9: =K9/B9 -> 2.2619015939753587E-3 | M9: 4111 | N9: =M9/B9 -> 2.7349051331860878E-2 | O9: 1475 | P9: =O9/B9 -> 9.8126613268048647E-3 | Q9: 10776 | R9: =Q9/B9 -> 7.1688975225524892E-2
A10: 8 | B10: 159185 | C10: 93856 | D10: =C10/B10 -> 0.58960329176744042 | E10: 46584 | F10: =E10/B10 -> 0.29264063825109149 | G10: 1049 | H10: =G10/B10 -> 6.58981687973113E-3 | I10: 8528 | J10: =I10/B10 -> 5.357288689260923E-2 | K10: 130 | L10: =K10/B10 -> 8.1665986116782364E-4 | M10: 7914 | N10: =M10/B10 -> 4.9715739548324277E-2 | O10: 1124 | P10: =O10/B10 -> 7.0609667996356443E-3 | Q10: 13683 | R10: =Q10/B10 -> 8.5956591387379461E-2
A11: 9 | B11: 158193 | C11: 68166 | D11: =C11/B11 -> 0.43090402230187175 | E11: 82335 | F11: =E11/B11 -> 0.52047182871555631 | G11: 1385 | H11: =G11/B11 -> 8.7551282294412516E-3 | I11: 3442 | J11: =I11/B11 -> 2.1758232033022951E-2 | K11: 87 | L11: =K11/B11 -> 5.4996112343782589E-4 | M11: 1641 | N11: =M11/B11 -> 1.0373404638637614E-2 | O11: 1137 | P11: =O11/B11 -> 7.1874229580322774E-3 | Q11: 3820 | R11: =Q11/B11 -> 2.4147718293476957E-2
A12: 10 | B12: 148445 | C12: 117548 | D12: =C12/B12 -> 0.79186230590454376 | E12: 23596 | F12: =E12/B12 -> 0.15895449493078245 | G12: 855 | H12: =G12/B12 -> 5.7597089831250628E-3 | I12: 4330 | J12: =I12/B12 -> 2.916905251103102E-2 | K12: 72 | L12: =K12/B12 -> 4.8502812489474215E-4 | M12: 1540 | N12: =M12/B12 -> 1.0374212671359764E-2 | O12: 504 | P12: =O12/B12 -> 3.3951968742631953E-3 | Q12: 4077 | R12: =Q12/B12 -> 2.7464717572164773E-2
A13: 11 | B13: 154989 | C13: 110062 | D13: =C13/B13 -> 0.7101278155223919 | E13: 38876 | F13: =E13/B13 -> 0.25083070411448555 | G13: 936 | H13: =G13/B13 -> 6.0391382614250044E-3 | I13: 2379 | J13: =I13/B13 -> 1.5349476414455219E-2 | K13: 112 | L13: =K13/B13 -> 7.2263192871752189E-4 | M13: 2118 | N13: =M13/B13 -> 1.3665485937711708E-2 | O13: 506 | P13: =O13/B13 -> 3.2647478208130899E-3 | Q13: 4530 | R13: =Q13/B13 -> 2.9227880688306913E-2
A14: 12 | B14: 153740 | C14: 123264 | D14: =C14/B14 -> 0.80176922076232604 | E14: 17454 | F14: =E14/B14 -> 0.1135293352413165 | G14: 680 | H14: =G14/B14 -> 4.4230519058150123E-3 | I14: 10026 | J14: =I14/B14 -> 6.5213997658384287E-2 | K14: 77 | L14: =K14/B14 -> 5.0084558345258223E-4 | M14: 1696 | N14: =M14/B14 -> 1.1031611812150384E-2 | O14: 543 | P14: =O14/B14 -> 3.531937036555223E-3 | Q14: 4583 | R14: =Q14/B14 -> 2.9810068947573827E-2
A15: 13 | B15: 153237 | C15: 109000 | D15: =C15/B15 -> 0.71131645751352479 | E15: 31019 | F15: =E15/B15 -> 0.20242500179460574 | G15: 1125 | H15: =G15/B15 -> 7.3415689422267469E-3 | I15: 9445 | J15: =I15/B15 -> 6.1636549919405891E-2 | K15: 194 | L15: =K15/B15 -> 1.2660127775928789E-3 | M15: 1619 | N15: =M15/B15 -> 1.0565333437746759E-2 | O15: 835 | P15: =O15/B15 -> 5.4490756148971855E-3 | Q15: 5191 | R15: =Q15/B15 -> 3.3875630559199149E-2
A16: 14 | B16: 149482 | C16: 127338 | D16: =C16/B16 -> 0.8518617626202486 | E16: 13308 | F16: =E16/B16 -> 8.9027441431075313E-2 | G16: 1035 | H16: =G16/B16 -> 6.9239105711724489E-3 | I16: 5390 | J16: =I16/B16 -> 3.6057853119439133E-2 | K16: 231 | L16: =K16/B16 -> 1.5453365622616769E-3 | M16: 1614 | N16: =M16/B16 -> 1.079728662982834E-2 | O16: 566 | P16: =O16/B16 -> 3.7864090659744986E-3 | Q16: 5503 | R16: =Q16/B16 -> 3.681379697890047E-2
A17: 15 | B17: 159708 | C17: 121816 | D17: =C17/B17 -> 0.76274200415758764 | E17: 34031 | F17: =E17/B17 -> 0.21308262579207052 | G17: 1089 | H17: =G17/B17 -> 6.8186941167630924E-3 | I17: 1066 | J17: =I17/B17 -> 6.6746812933603829E-3 | K17: 51 | L17: =K17/B17 -> 3.1933278232774813E-4 | M17: 1259 | N17: =M17/B17 -> 7.8831367245222536E-3 | O17: 396 | P17: =O17/B17 -> 2.4795251333683973E-3 | Q17: 2783 | R17: =Q17/B17 -> 1.7425551631727904E-2
A18: 16 | B18: 150528 | C18: 60060 | D18: =C18/B18 -> 0.3989955357142857 | E18: 78959 | F18: =E18/B18 -> 0.52454692814625847 | G18: 1052 | H18: =G18/B18 -> 6.9887329931972789E-3 | I18: 2847 | J18: =I18/B18 -> 1.8913424744897961E-2 | K18: 204 | L18: =K18/B18 -> 1.3552295918367347E-3 | M18: 6321 | N18: =M18/B18 -> 4.19921875E-2 | O18: 1085 | P18: =O18/B18 -> 7.2079613095238099E-3 | Q18: 10943 | R18: =Q18/B18 -> 7.2697438350340135E-2
A19: 17 | B19: 154318 | C19: 116071 | D19: =C19/B19 -> 0.75215464171386359 | E19: 27031 | F19: =E19/B19 -> 0.17516427118029004 | G19: 1145 | H19: =G19/B19 -> 7.4197436462369913E-3 | I19: 3700 | J19: =I19/B19 -> 2.397646418434661E-2 | K19: 183 | L19: =K19/B19 -> 1.1858629583068729E-3 | M19: 5444 | N19: =M19/B19 -> 3.527780297826566E-2 | O19: 744 | P19: =O19/B19 -> 4.8212133386902369E-3 | Q19: 10485 | R19: =Q19/B19 -> 6.7944115398074101E-2
A20: 18 | B20: 151276 | C20: 65823 | D20: =C20/B20 -> 0.43511859118432533 | E20: 80303 | F20: =E20/B20 -> 0.53083767418493355 | G20: 872 | H20: =G20/B20 -> 5.7642983685449109E-3 | I20: 1950 | J20: =I20/B20 -> 1.2890346122319469E-2 | K20: 125 | L20: =K20/B20 -> 8.2630423861022233E-4 | M20: 1392 | N20: =M20/B20 -> 9.2017240011634371E-3 | O20: 811 | P20: =O20/B20 -> 5.3610619001031225E-3 | Q20: 3430 | R20: =Q20/B20 -> 2.2673788307464502E-2
A21: 19 | B21: 156510 | C21: 146693 | D21: =C21/B21 -> 0.93727557344578616 | E21: 5871 | F21: =E21/B21 -> 3.7511980065171556E-2 | G21: 761 | H21: =G21/B21 -> 4.8623091176282669E-3 | I21: 1907 | J21: =I21/B21 -> 1.2184524950482398E-2 | K21: 50 | L21: =K21/B21 -> 3.1946840457478757E-4 | M21: 1067 | N21: =M21/B21 -> 6.8174557536259664E-3 | O21: 161 | P21: =O21/B21 -> 1.0286882627308159E-3 | Q21: 2392 | R21: =Q21/B21 -> 1.5283368474857837E-2
A22: 20 | B22: 157840 | C22: 110129 | D22: =C22/B22 -> 0.69772554485554994 | E22: 43396 | F22: =E22/B22 -> 0.27493664470349721 | G22: 679 | H22: =G22/B22 -> 4.3018246325392806E-3 | I22: 779 | J22: =I22/B22 -> 4.9353775975671567E-3 | K22: 49 | L22: =K22/B22 -> 3.1044095286365938E-4 | M22: 2500 | N22: =M22/B22 -> 1.5838824125696909E-2 | O22: 308 | P22: =O22/B22 -> 1.951343132285859E-3 | Q22: 4309 | R22: =Q22/B22 -> 2.7299797263051193E-2
A23: 21 | B23: 162733 | C23: 127529 | D23: =C23/B23 -> 0.78367018367509966 | E23: 24269 | F23: =E23/B23 -> 0.14913385729999448 | G23: 903 | H23: =G23/B23 -> 5.5489667123447611E-3 | I23: 6985 | J23: =I23/B23 -> 4.2923070305346797E-2 | K23: 114 | L23: =K23/B23 -> 7.0053400355183032E-4 | M23: 2323 | N23: =M23/B23 -> 1.4274916581148262E-2 | O23: 610 | P23: =O23/B23 -> 3.7484714225141796E-3 | Q23: 5706 | R23: =Q23/B23 -> 3.5063570388304773E-2
A24: 22 | B24: 139200 | C24: 99620 | D24: =C24/B24 -> 0.71566091954022992 | E24: 13322 | F24: =E24/B24 -> 9.5704022988505749E-2 | G24: 757 | H24: =G24/B24 -> 5.4382183908045978E-3 | I24: 19645 | J24: =I24/B24 -> 0.1411278735632184 | K24: 143 | L24: =K24/B24 -> 1.0272988505747127E-3 | M24: 4878 | N24: =M24/B24 -> 3.504310344827586E-2 | O24: 835 | P24: =O24/B24 -> 5.9985632183908047E-3 | Q24: 12495 | R24: =Q24/B24 -> 8.9762931034482754E-2
A25: 23 | B25: 156627 | C25: 129916 | D25: =C25/B25 -> 0.82946107631506705 | E25: 21828 | F25: =E25/B25 -> 0.13936294508609626 | G25: 875 | H25: =G25/B25 -> 5.5865208425111886E-3 | I25: 2443 | J25: =I25/B25 -> 1.559756619229124E-2 | K25: 63 | L25: =K25/B25 -> 4.0222950066080561E-4 | M25: 1134 | N25: =M25/B25 -> 7.2401310118945014E-3 | O25: 368 | P25: =O25/B25 -> 2.3495310514789914E-3 | Q25: 2864 | R25: =Q25/B25 -> 1.8285480791945193E-2
A26: 24 | B26: 158069 | C26: 142925 | D26: =C26/B26 -> 0.90419373817763127 | E26: 10712 | F26: =E26/B26 -> 6.7767873523587804E-2 | G26: 860 | H26: =G26/B26 -> 5.4406619893843829E-3 | I26: 1348 | J26: =I26/B26 -> 8.5279213508024972E-3 | K26: 67 | L26: =K26/B26 -> 4.2386552707994609E-4 | M26: 1878 | N26: =M26/B26 -> 1.1880887460539384E-2 | O26: 279 | P26: =O26/B26 -> 1.7650519709747009E-3 | Q26: 3970 | R26: =Q26/B26 -> 2.5115614067274417E-2
A27: 25 | B27: 160398 | C27: 135056 | D27: =C27/B27 -> 0.84200551129066448 | E27: 15328 | F27: =E27/B27 -> 9.5562288806593593E-2 | G27: 913 | H27: =G27/B27 -> 5.6920909238269805E-3 | I27: 6590 | J27: =I27/B27 -> 4.1085300315465277E-2 | K27: 103 | L27: =K27/B27 -> 6.4215264529482907E-4 | M27: 1959 | N27: =M27/B27 -> 1.2213369244005536E-2 | O27: 449 | P27: =O27/B27 -> 2.7992867741493035E-3 | Q27: 4908 | R27: =Q27/B27 -> 3.0598885272883701E-2
A28: 26 | B28: 159446 | C28: 144854 | D28: =C28/B28 -> 0.90848312281273913 | E28: 5612 | F28: =E28/B28 -> 3.5196869159464649E-2 | G28: 1017 | H28: =G28/B28 -> 6.378334984885165E-3 | I28: 2616 | J28: =I28/B28 -> 1.6406808574689864E-2 | K28: 112 | L28: =K28/B28 -> 7.0243217139344979E-4 | M28: 4889 | N28: =M28/B28 -> 3.0662418624487289E-2 | O28: 346 | P28: =O28/B28 -> 2.170013672340479E-3 | Q28: 9274 | R28: =Q28/B28 -> 5.8163892477704052E-2
A29: 27 | B29: 147501 | C29: 130365 | D29: =C29/B29 -> 0.88382451644395632 | E29: 8325 | F29: =E29/B29 -> 5.6440295320031732E-2 | G29: 871 | H29: =G29/B29 -> 5.9050447115612777E-3 | I29: 3205 | J29: =I29/B29 -> 2.1728666246330533E-2 | K29: 101 | L29: =K29/B29 -> 6.8474112039918378E-4 | M29: 4235 | N29: =M29/B29 -> 2.8711669751391517E-2 | O29: 399 | P29: =O29/B29 -> 2.7050664063294487E-3 | Q29: 8828 | R29: =Q29/B29 -> 5.9850441691920733E-2
A30: 28 | B30: 147638 | C30: 112756 | D30: =C30/B30 -> 0.76373291429035883 | E30: 24795 | F30: =E30/B30 -> 0.16794456711686692 | G30: 1366 | H30: =G30/B30 -> 9.2523605033934357E-3 | I30: 4273 | J30: =I30/B30 -> 2.8942413199853696E-2 | K30: 173 | L30: =K30/B30 -> 1.1717850417914087E-3 | M30: 3521 | N30: =M30/B30 -> 2.3848873596228615E-2 | O30: 754 | P30: =O30/B30 -> 5.1070862515070646E-3 | Q30: 9117 | R30: =Q30/B30 -> 6.175239437001314E-2
A31: 29 | B31: 145025 | C31: 78020 | D31: =C31/B31 -> 0.53797621099810378 | E31: 32726 | F31: =E31/B31 -> 0.22565764523358042 | G31: 1371 | H31: =G31/B31 -> 9.4535424926736767E-3 | I31: 12294 | J31: =I31/B31 -> 8.4771591104981905E-2 | K31: 273 | L31: =K31/B31 -> 1.8824340630925703E-3 | M31: 18796 | N31: =M31/B31 -> 0.12960524047578004 | O31: 1545 | P31: =O31/B31 -> 1.0653335631787622E-2 | Q31: 36610 | R31: =Q31/B31 -> 0.25243923461472162
A32: 30 | B32: 159954 | C32: 113468 | D32: =C32/B32 -> 0.70937894644710353 | E32: 21421 | F32: =E32/B32 -> 0.1339197519286795 | G32: 1187 | H32: =G32/B32 -> 7.4208835040074023E-3 | I32: 11733 | J32: =I32/B32 -> 7.3352338797404257E-2 | K32: 211 | L32: =K32/B32 -> 1.319129249659277E-3 | M32: 10736 | N32: =M32/B32 -> 6.7119296797829381E-2 | O32: 1198 | P32: =O32/B32 -> 7.4896532753166538E-3 | Q32: 23136 | R32: =Q32/B32 -> 0.14464158445553096
A33: 31 | B33: 161054 | C33: 120879 | D33: =C33/B33 -> 0.75054950513492369 | E33: 9359 | F33: =E33/B33 -> 5.8110944155376459E-2 | G33: 1000 | H33: =G33/B33 -> 6.2090975697592114E-3 | I33: 21304 | J33: =I33/B33 -> 0.13227861462615023 | K33: 186 | L33: =K33/B33 -> 1.1548921479752133E-3 | M33: 7348 | N33: =M33/B33 -> 4.5624448942590684E-2 | O33: 978 | P33: =O33/B33 -> 6.0724974232245089E-3 | Q33: 17980 | R33: =Q33/B33 -> 0.11163957430427061
A34: 32 | B34: 149867 | C34: 113578 | D34: =C34/B34 -> 0.75785863465606174 | E34: 7917 | F34: =E34/B34 -> 5.2826839797954189E-2 | G34: 710 | H34: =G34/B34 -> 4.7375339467661329E-3 | I34: 22419 | J34: =I34/B34 -> 0.14959263880640836 | K34: 124 | L34: =K34/B34 -> 8.2740029492816961E-4 | M34: 4419 | N34: =M34/B34 -> 2.9486144381351467E-2 | O34: 700 | P34: =O34/B34 -> 4.6708081165299899E-3 | Q34: 12429 | R34: =Q34/B34 -> 8.2933534400501774E-2
A35: 33 | B35: 143098 | C35: 84732 | D35: =C35/B35 -> 0.59212567611007838 | E35: 14121 | F35: =E35/B35 -> 9.8680624467148384E-2 | G35: 817 | H35: =G35/B35 -> 5.7093739954436817E-3 | I35: 28670 | J35: =I35/B35 -> 0.20035220618037988 | K35: 147 | L35: =K35/B35 -> 1.0272680261079819E-3 | M35: 13426 | N35: =M35/B35 -> 9.3823813051195679E-2 | O35: 1185 | P35: =O35/B35 -> 8.2810381696459771E-3 | Q35: 26652 | R35: =Q35/B35 -> 0.18624998252945535
A36: 34 | B36: 151241 | C36: 104659 | D36: =C36/B36 -> 0.69200150752772061 | E36: 8684 | F36: =E36/B36 -> 5.7418292658736721E-2 | G36: 754 | H36: =G36/B36 -> 4.9854206200699545E-3 | I36: 30367 | J36: =I36/B36 -> 0.20078550128602693 | K36: 177 | L36: =K36/B36 -> 1.1703175726158913E-3 | M36: 5831 | N36: =M36/B36 -> 3.8554360259453455E-2 | O36: 769 | P36: =O36/B36 -> 5.0846000753763864E-3 | Q36: 15461 | R36: =Q36/B36 -> 0.10222757056618245
A37: 35 | B37: 154888 | C37: 87104 | D37: =C37/B37 -> 0.56236764629926139 | E37: 18866 | F37: =E37/B37 -> 0.12180414234801921 | G37: 1192 | H37: =G37/B37 -> 7.6958834770931251E-3 | I37: 27470 | J37: =I37/B37 -> 0.17735395898972162 | K37: 160 | L37: =K37/B37 -> 1.0330044935695471E-3 | M37: 18658 | N37: =M37/B37 -> 0.1204612365063788 | O37: 1438 | P37: =O37/B37 -> 9.2841278859563045E-3 | Q37: 38229 | R37: =Q37/B37 -> 0.24681705490418884
A38: 36 | B38: 144805 | C38: 81166 | D38: =C38/B38 -> 0.56051931908428576 | E38: 34798 | F38: =E38/B38 -> 0.2403093815821277 | G38: 1245 | H38: =G38/B38 -> 8.5977694140395699E-3 | I38: 12219 | J38: =I38/B38 -> 8.438244535754981E-2 | K38: 273 | L38: =K38/B38 -> 1.8852940160906046E-3 | M38: 13577 | N38: =M38/B38 -> 9.3760574565795382E-2 | O38: 1527 | P38: =O38/B38 -> 1.0545215980111183E-2 | Q38: 28058 | R38: =Q38/B38 -> 0.19376402748523877
A39: 37 | B39: 149822 | C39: 92733 | D39: =C39/B39 -> 0.61895449266462865 | E39: 10946 | F39: =E39/B39 -> 7.3060031237067988E-2 | G39: 819 | H39: =G39/B39 -> 5.4664868977853717E-3 | I39: 35421 | J39: =I39/B39 -> 0.23642055238883475 | K39: 183 | L39: =K39/B39 -> 1.2214494533513102E-3 | M39: 8774 | N39: =M39/B39 -> 5.8562827889095059E-2 | O39: 946 | P39: =O39/B39 -> 6.314159469236828E-3 | Q39: 21536 | R39: =Q39/B39 -> 0.14374390943920118
A40: 38 | B40: 161241 | C40: 152296 | D40: =C40/B40 -> 0.9445240354500406 | E40: 6569 | F40: =E40/B40 -> 4.0740258371009856E-2 | G40: 708 | H40: =G40/B40 -> 4.3909427502930396E-3 | I40: 929 | J40: =I40/B40 -> 5.7615618856246241E-3 | K40: 47 | L40: =K40/B40 -> 2.9148913737821023E-4 | M40: 542 | N40: =M40/B40 -> 3.361427924659361E-3 | O40: 150 | P40: =O40/B40 -> 9.302844809942881E-4 | Q40: 1350 | R40: =Q40/B40 -> 8.3725603289485917E-3
A41: 39 | B41: 151983 | C41: 96014 | D41: =C41/B41 -> 0.63174170795417905 | E41: 25610 | F41: =E41/B41 -> 0.16850568813617312 | G41: 979 | H41: =G41/B41 -> 6.4415099057131388E-3 | I41: 20895 | J41: =I41/B41 -> 0.13748248159333609 | K41: 250 | L41: =K41/B41 -> 1.6449208135120375E-3 | M41: 7095 | N41: =M41/B41 -> 4.6682852687471625E-2 | O41: 1140 | P41: =O41/B41 -> 7.5008389096148913E-3 | Q41: 17614 | R41: =Q41/B41 -> 0.11589454083680412
A42: 40 | B42: 159484 | C42: 152925 | D42: =C42/B42 -> 0.95887361741616717 | E42: 3907 | F42: =E42/B42 -> 2.449775526071581E-2 | G42: 879 | H42: =G42/B42 -> 5.51152466705124E-3 | I42: 619 | J42: =I42/B42 -> 3.8812670863534902E-3 | K42: 48 | L42: =K42/B42 -> 3.0097063028266158E-4 | M42: 938 | N42: =M42/B42 -> 5.8814677334403454E-3 | O42: 168 | P42: =O42/B42 -> 1.0533972059893156E-3 | Q42: 1939 | R42: =Q42/B42 -> 1.2157959419126684E-2

A1: SB____J. Howell (3/30/11) Election Data
A2: DISTRICT | B2: Rep. Gov '09 | C2: Dem. Gov '09 | D2: Rep. Lt. Gov '09 | E2: Dem. Lt. Gov '09 | F2: Rep. Att. Gen. '09 | G2: Dem. Att. Gen. '09
A3: 1 | B3: 0.54241117746063217 | C3: 0.45758882253936783 | D3: 0.5109941302524923 | E3: 0.4890058697475077 | F3: 0.52390648037632526 | G3: 0.4760935196236748
A4: 2 | B4: 0.40310502718687397 | C4: 0.59689497281312598 | D4: 0.37869879986395216 | E4: 0.62130120013604784 | F4: 0.39367654604539792 | G4: 0.60632345395460208
A5: 3 | B5: 0.70019580502566237 | C5: 0.29980419497433769 | D5: 0.66374649954325593 | E5: 0.33625350045674407 | F5: 0.67775455270004059 | G5: 0.32224544729995941
A6: 4 | B6: 0.71313142028678023 | C6: 0.28686857971321983 | D6: 0.69057168832557891 | E6: 0.30942831167442109 | F6: 0.70364812234251617 | G6: 0.29635187765748383
A7: 5 | B7: 0.36064358474506464 | C7: 0.63935641525493536 | D7: 0.33411301594546022 | E7: 0.66588698405453972 | F7: 0.35649667532319285 | G7: 0.64350332467680715
A8: 6 | B8: 0.54139949818790079 | C8: 0.45860050181209927 | D8: 0.50348014605203106 | E8: 0.49651985394796894 | F8: 0.52474793767186068 | G8: 0.47525206232813932
A9: 7 | B9: 0.57296619315695829 | C9: 0.42703380684304176 | D9: 0.51771182383915748 | E9: 0.48228817616084252 | F9: 0.55625839176488134 | G9: 0.4437416082351186
A10: 8 | B10: 0.47997390187948563 | C10: 0.52002609812051437 | D10: 0.46024264457220154 | E10: 0.53975735542779846 | F10: 0.47930135447357824 | G10: 0.52069864552642176
A11: 9 | B11: 0.34415504258733487 | C11: 0.65584495741266513 | D11: 0.33494591283765546 | E11: 0.66505408716234449 | F11: 0.35381563837561331 | G11: 0.64618436162438664
A12: 10 | B12: 0.71163291394738615 | C12: 0.28836708605261385 | D12: 0.68519678374947102 | E12: 0.31480321625052898 | F12: 0.71174165974118486 | G12: 0.28825834025881514
A13: 11 | B13: 0.69029893050149271 | C13: 0.30970106949850723 | D13: 0.6706457175704158 | E13: 0.3293542824295842 | F13: 0.69257230710098971 | G13: 0.30742769289901029
A14: 12 | B14: 0.69724728198010644 | C14: 0.30275271801989362 | D14: 0.66703381942289797 | E14: 0.33296618057710209 | F14: 0.68826238486432656 | G14: 0.31173761513567338
A15: 13 | B15: 0.65918097754293259 | C15: 0.34081902245706736 | D15: 0.61196535541226293 | E15: 0.38803464458773701 | F15: 0.64150871800709586 | G15: 0.35849128199290414
A16: 14 | B16: 0.71116623444958094 | C16: 0.28883376555041906 | D16: 0.64865743574051404 | E16: 0.3513425642594859 | F16: 0.69004191467779286 | G16: 0.30995808532220714
A17: 15 | B17: 0.72393125921328261 | C17: 0.27606874078671734 | D17: 0.72017590989592661 | E17: 0.27982409010407339 | F17: 0.72885606799498392 | G17: 0.27114393200501602
A18: 16 | B18: 0.41217910784230843 | C18: 0.58782089215769151 | D18: 0.39680082559339525 | E18: 0.60319917440660475 | F18: 0.42107383322782987 | G18: 0.57892616677217013
A19: 17 | B19: 0.61195181160242307 | C19: 0.38804818839757699 | D19: 0.59097070649052263 | E19: 0.40902929350947731 | F19: 0.5937766116596469 | G19: 0.40622338834035304
A20: 18 | B20: 0.44111744943744224 | C20: 0.55888255056255776 | D20: 0.42271256931608131 | E20: 0.57728743068391863 | F20: 0.43735290690900619 | G20: 0.56264709309099381
A21: 19 | B21: 0.69270906783246367 | C21: 0.30729093216753633 | D21: 0.67331723942061916 | E21: 0.32668276057938084 | F21: 0.6898561574247366 | G21: 0.31014384257526334
A22: 20 | B22: 0.59472939126647062 | C22: 0.40527060873352933 | D22: 0.59140122391338457 | E22: 0.40859877608661543 | F22: 0.59737156511350065 | G22: 0.40262843488649941
A23: 21 | B23: 0.51702318553147286 | C23: 0.48297681446852719 | D23: 0.5052075833933285 | E23: 0.49479241660667145 | F23: 0.52065123427144366 | G23: 0.47934876572855634
A24: 22 | B24: 0.64547595822131287 | C24: 0.35452404177868718 | D24: 0.62079950180833987 | E24: 0.37920049819166007 | F24: 0.62087622695714628 | G24: 0.37912377304285372
A25: 23 | B25: 0.7004502907389023 | C25: 0.2995497092610977 | D25: 0.68831517844345702 | E25: 0.31168482155654292 | F25: 0.70110237351430926 | G25: 0.29889762648569068
A26: 24 | B26: 0.73270493182965835 | C26: 0.26729506817034171 | D26: 0.73256783386387747 | E26: 0.26743216613612247 | F26: 0.73760562043102629 | G26: 0.26239437956897371
A27: 25 | B27: 0.46391976145296826 | C27: 0.53608023854703168 | D27: 0.46138215102974828 | E27: 0.53861784897025167 | F27: 0.48075509153738694 | G27: 0.51924490846261306
A28: 26 | B28: 0.70978763894295227 | C28: 0.29021236105704773 | D28: 0.69715687562973672 | E28: 0.30284312437026328 | F28: 0.69730843415746102 | G28: 0.30269156584253903
A29: 27 | B29: 0.69066626714894164 | C29: 0.30933373285105836 | D29: 0.67165921027037545 | E29: 0.3283407897296246 | F29: 0.67205323193916355 | G29: 0.3279467680608365
A30: 28 | B30: 0.68887603872183667 | C30: 0.31112396127816327 | D30: 0.6677770327269581 | E30: 0.3322229672730419 | F30: 0.6681082016130776 | G30: 0.3318917983869224
A31: 29 | B31: 0.55013224332772304 | C31: 0.44986775667227696 | D31: 0.52411141134899186 | E31: 0.47588858865100808 | F31: 0.53220550509602715 | G31: 0.46779449490397285
A32: 30 | B32: 0.41488258980185783 | C32: 0.58511741019814212 | D32: 0.39285355614919559 | E32: 0.60714644385080441 | F32: 0.39035343872721778 | G32: 0.60964656127278216
A33: 31 | B33: 0.44406388373765282 | C33: 0.55593611626234718 | D33: 0.42381806387606363 | E33: 0.57618193612393631 | F33: 0.41816271963330787 | G33: 0.58183728036669213
A34: 32 | B34: 0.44889161482519935 | C34: 0.55110838517480065 | D34: 0.42687503303440866 | E34: 0.57312496696559134 | F34: 0.41756670902160103 | G34: 0.58243329097839902
A35: 33 | B35: 0.54720059096925111 | C35: 0.45279940903074889 | D35: 0.51957981103928397 | E35: 0.48042018896071609 | F35: 0.52165274889019964 | G35: 0.47834725110980036
A36: 34 | B36: 0.52809659260438013 | C36: 0.47190340739561992 | D36: 0.50181279169921678 | E36: 0.49818720830078322 | F36: 0.48744614768059313 | G36: 0.51255385231940687
A37: 35 | B37: 0.42020246118584409 | C37: 0.57979753881415597 | D37: 0.39877061719467083 | E37: 0.60122938280532923 | F37: 0.39357706964157507 | G37: 0.60642293035842487
A38: 36 | B38: 0.48525943396226418 | C38: 0.51474056603773588 | D38: 0.45643202802600719 | E38: 0.54356797197399287 | F38: 0.46205091601237214 | G38: 0.53794908398762786
A39: 37 | B39: 0.5453055382413371 | C39: 0.4546944617586629 | D39: 0.51876800148657443 | E39: 0.48123199851342563 | F39: 0.51852454444031237 | G39: 0.48147545555968763
A40: 38 | B40: 0.65979900647849277 | C40: 0.34020099352150723 | D40: 0.65676388823446263 | E40: 0.34323611176553737 | F40: 0.64549019607843139 | G40: 0.35450980392156861
A41: 39 | B41: 0.52794704769909639 | C41: 0.47205295230090355 | D41: 0.50192478531240747 | E41: 0.49807521468759253 | F41: 0.50211783641831509 | G41: 0.49788216358168497
A42: 40 | B42: 0.75006748245456178 | C42: 0.24993251754543819 | D42: 0.75560440566966636 | E42: 0.24439559433033364 | F42: 0.74699432196960991 | G42: 0.25300567803039009