A1: HB 5001 Conference, Senate Population Totals
A2: DISTRICT | B2: Total Population | C2: Target | D2: Difference | E2: Deviation
A3: 1 | B3: 200745 | C3: 200025.60000000001 | D3: =B3-C3 -> 719.39999999999418 | E3: =(B3-C3)/C3 -> 3.5965396429256764E-3
A4: 2 | B4: 200193 | C4: 200025.60000000001 | D4: =B4-C4 -> 167.39999999999418 | E4: =(B4-C4)/C4 -> 8.3689287771162376E-4
A5: 3 | B5: 203776 | C5: 200025.60000000001 | D5: =B5-C5 -> 3750.3999999999942 | E5: =(B5-C5)/C5 -> 1.8749600051193419E-2
A6: 4 | B6: 201941 | C6: 200025.60000000001 | D6: =B6-C6 -> 1915.3999999999942 | E6: =(B6-C6)/C6 -> 9.5757743008894562E-3
A7: 5 | B7: 200751 | C7: 200025.60000000001 | D7: =B7-C7 -> 725.39999999999418 | E7: =(B7-C7)/C7 -> 3.6265358034171333E-3
A8: 6 | B8: 196367 | C8: 200025.60000000001 | D8: =B8-C8 -> -3658.6000000000058 | E8: =(B8-C8)/C8 -> -1.8290658795674181E-2
A9: 7 | B9: 196952 | C9: 200025.60000000001 | D9: =B9-C9 -> -3073.6000000000058 | E9: =(B9-C9)/C9 -> -1.5366033147757115E-2
A10: 8 | B10: 200030 | C10: 200025.60000000001 | D10: =B10-C10 -> 4.3999999999941792 | E10: =(B10-C10)/C10 -> 2.1997184360372769E-5
A11: 9 | B11: 202033 | C11: 200025.60000000001 | D11: =B11-C11 -> 2007.3999999999942 | E11: =(B11-C11)/C11 -> 1.0035715428425133E-2
A12: 10 | B12: 197605 | C12: 200025.60000000001 | D12: =B12-C12 -> -2420.6000000000058 | E12: =(B12-C12)/C12 -> -1.2101451014270202E-2
A13: 11 | B13: 199714 | C13: 200025.60000000001 | D13: =B13-C13 -> -311.60000000000582 | E13: =(B13-C13)/C13 -> -1.5578006015230341E-3
A14: 12 | B14: 203531 | C14: 200025.60000000001 | D14: =B14-C14 -> 3505.3999999999942 | E14: =(B14-C14)/C14 -> 1.7524756831125587E-2
A15: 13 | B15: 202857 | C15: 200025.60000000001 | D15: =B15-C15 -> 2831.3999999999942 | E15: =(B15-C15)/C15 -> 1.4155188135918572E-2
A16: 14 | B16: 198144 | C16: 200025.60000000001 | D16: =B16-C16 -> -1881.6000000000058 | E16: =(B16-C16)/C16 -> -9.4067959301209741E-3
A17: 15 | B17: 198538 | C17: 200025.60000000001 | D17: =B17-C17 -> -1487.6000000000058 | E17: =(B17-C17)/C17 -> -7.4370480578486243E-3
A18: 16 | B18: 197225 | C18: 200025.60000000001 | D18: =B18-C18 -> -2800.6000000000058 | E18: =(B18-C18)/C18 -> -1.4001207845395817E-2
A19: 17 | B19: 204024 | C19: 200025.60000000001 | D19: =B19-C19 -> 3998.3999999999942 | E19: =(B19-C19)/C19 -> 1.9989441351506976E-2
A20: 18 | B20: 197503 | C20: 200025.60000000001 | D20: =B20-C20 -> -2522.6000000000058 | E20: =(B20-C20)/C20 -> -1.2611385742624973E-2
A21: 19 | B21: 197558 | C21: 200025.60000000001 | D21: =B21-C21 -> -2467.6000000000058 | E21: =(B21-C21)/C21 -> -1.2336420938119949E-2
A22: 20 | B22: 201089 | C22: 200025.60000000001 | D22: =B22-C22 -> 1063.3999999999942 | E22: =(B22-C22)/C22 -> 5.3163195111025499E-3
A23: 21 | B23: 200511 | C23: 200025.60000000001 | D23: =B23-C23 -> 485.39999999999418 | E23: =(B23-C23)/C23 -> 2.4266893837588499E-3
A24: 22 | B24: 203213 | C24: 200025.60000000001 | D24: =B24-C24 -> 3187.3999999999942 | E24: =(B24-C24)/C24 -> 1.5934960325078362E-2
A25: 23 | B25: 203359 | C25: 200025.60000000001 | D25: =B25-C25 -> 3333.3999999999942 | E25: =(B25-C25)/C25 -> 1.666486689703715E-2
A26: 24 | B26: 204024 | C26: 200025.60000000001 | D26: =B26-C26 -> 3998.3999999999942 | E26: =(B26-C26)/C26 -> 1.9989441351506976E-2
A27: 25 | B27: 198245 | C27: 200025.60000000001 | D27: =B27-C27 -> -1780.6000000000058 | E27: =(B27-C27)/C27 -> -8.9018605618481125E-3
A28: 26 | B28: 201484 | C28: 200025.60000000001 | D28: =B28-C28 -> 1458.3999999999942 | E28: =(B28-C28)/C28 -> 7.291066743456808E-3
A29: 27 | B29: 203835 | C29: 200025.60000000001 | D29: =B29-C29 -> 3809.3999999999942 | E29: =(B29-C29)/C29 -> 1.904456229602608E-2
A30: 28 | B30: 198907 | C30: 200025.60000000001 | D30: =B30-C30 -> -1118.6000000000058 | E30: =(B30-C30)/C30 -> -5.592284187624013E-3
A31: 29 | B31: 204003 | C31: 200025.60000000001 | D31: =B31-C31 -> 3977.3999999999942 | E31: =(B31-C31)/C31 -> 1.9884454789786878E-2
A32: 30 | B32: 196030 | C32: 200025.60000000001 | D32: =B32-C32 -> -3995.6000000000058 | E32: =(B32-C32)/C32 -> -1.9975443143277687E-2
A33: 31 | B33: 200905 | C33: 200025.60000000001 | D33: =B33-C33 -> 879.39999999999418 | E33: =(B33-C33)/C33 -> 4.3964372560311984E-3
A34: 32 | B34: 198617 | C34: 200025.60000000001 | D34: =B34-C34 -> -1408.6000000000058 | E34: =(B34-C34)/C34 -> -7.0420986113777723E-3
A35: 33 | B35: 196178 | C35: 200025.60000000001 | D35: =B35-C35 -> -3847.6000000000058 | E35: =(B35-C35)/C35 -> -1.9235537851155081E-2
A36: 34 | B36: 196312 | C36: 200025.60000000001 | D36: =B36-C36 -> -3713.6000000000058 | E36: =(B36-C36)/C36 -> -1.8565623600179205E-2
A37: 35 | B37: 196251 | C37: 200025.60000000001 | D37: =B37-C37 -> -3774.6000000000058 | E37: =(B37-C37)/C37 -> -1.8870584565175687E-2
A38: 36 | B38: 199271 | C38: 200025.60000000001 | D38: =B38-C38 -> -754.60000000000582 | E38: =(B38-C38)/C38 -> -3.7725171178089496E-3
A39: 37 | B39: 197280 | C39: 200025.60000000001 | D39: =B39-C39 -> -2745.6000000000058 | E39: =(B39-C39)/C39 -> -1.3726243040890795E-2
A40: 38 | B40: 201414 | C40: 200025.60000000001 | D40: =B40-C40 -> 1388.3999999999942 | E40: =(B40-C40)/C40 -> 6.9411115377231419E-3
A41: 39 | B41: 202151 | C41: 200025.60000000001 | D41: =B41-C41 -> 2125.3999999999942 | E41: =(B41-C41)/C41 -> 1.0625639918090455E-2
A42: 40 | B42: 198458 | C42: 200025.60000000001 | D42: =B42-C42 -> -1567.6000000000058 | E42: =(B42-C42)/C42 -> -7.8369968644013861E-3

A1: HB 5001 Conference, Senate Racial Demographics
A2: DISTRICT | B2: Total Population | C2: White | D2: % White | E2: Black | F2: % Black | G2: AIAN | H2: % AIAN | I2: Asian | J2: % Asian | K2: HawPI | L2: % HawPI | M2: Other | N2: % Other | O2: Multi | P2: % Multi | Q2: Total Hispanic | R2: % Hispanic
A3: 1 | B3: 200745 | C3: 116200 | D3: =C3/B3 -> 0.57884380681959702 | E3: 65258 | F3: =E3/B3 -> 0.32507908042541533 | G3: 1646 | H3: =G3/B3 -> 8.1994570225908496E-3 | I3: 8258 | J3: =I3/B3 -> 4.1136765548332462E-2 | K3: 455 | L3: =K3/B3 -> 2.2665570748960123E-3 | M3: 6137 | N3: =M3/B3 -> 3.0571122568432588E-2 | O3: 2791 | P3: =O3/B3 -> 1.3903210540735759E-2 | Q3: 15484 | R3: =Q3/B3 -> 7.7132680764153527E-2
A4: 2 | B4: 200193 | C4: 79753 | D4: =C4/B4 -> 0.39838056275693956 | E4: 106265 | F4: =E4/B4 -> 0.53081276568111768 | G4: 1480 | H4: =G4/B4 -> 7.3928658844215336E-3 | I4: 6174 | J4: =I4/B4 -> 3.0840239169201721E-2 | K4: 289 | L4: =K4/B4 -> 1.4436069193228534E-3 | M4: 3199 | N4: =M4/B4 -> 1.5979579705584113E-2 | O4: 3033 | P4: =O4/B4 -> 1.5150379883412507E-2 | Q4: 9267 | R4: =Q4/B4 -> 4.6290329831712398E-2
A5: 3 | B5: 203776 | C5: 170260 | D5: =C5/B5 -> 0.8355252826633166 | E5: 24101 | F5: =E5/B5 -> 0.11827202418341709 | G5: 1976 | H5: =G5/B5 -> 9.6969221105527633E-3 | I5: 4637 | J5: =I5/B5 -> 2.2755378454773871E-2 | K5: 161 | L5: =K5/B5 -> 7.9008322864321603E-4 | M5: 1667 | N5: =M5/B5 -> 8.1805511934673371E-3 | O5: 974 | P5: =O5/B5 -> 4.7797581658291458E-3 | Q5: 5526 | R5: =Q5/B5 -> 2.7118011934673367E-2
A6: 4 | B6: 201941 | C6: 153625 | D6: =C6/B6 -> 0.76074199890066896 | E6: 40116 | F6: =E6/B6 -> 0.19865208154857111 | G6: 1624 | H6: =G6/B6 -> 8.0419528476139077E-3 | I6: 2933 | J6: =I6/B6 -> 1.45240441515096E-2 | K6: 168 | L6: =K6/B6 -> 8.3192615664971455E-4 | M6: 2567 | N6: =M6/B6 -> 1.2711633595951293E-2 | O6: 908 | P6: =O6/B6 -> 4.4963627990353616E-3 | Q6: 6349 | R6: =Q6/B6 -> 3.1439876003387129E-2
A7: 5 | B7: 200751 | C7: 73698 | D7: =C7/B7 -> 0.36711149633127604 | E7: 112929 | F7: =E7/B7 -> 0.56253268974998882 | G7: 1445 | H7: =G7/B7 -> 7.197971616579743E-3 | I7: 5973 | J7: =I7/B7 -> 2.9753276446941732E-2 | K7: 251 | L7: =K7/B7 -> 1.2503051043332286E-3 | M7: 4083 | N7: =M7/B7 -> 2.0338628450169614E-2 | O7: 2372 | P7: =O7/B7 -> 1.1815632300710831E-2 | Q7: 10373 | R7: =Q7/B7 -> 5.167097548704614E-2
A8: 6 | B8: 196367 | C8: 123902 | D8: =C8/B8 -> 0.63097159909760803 | E8: 55125 | F8: =E8/B8 -> 0.28072435796238676 | G8: 1902 | H8: =G8/B8 -> 9.6859451944573179E-3 | I8: 6754 | J8: =I8/B8 -> 3.4394781200507214E-2 | K8: 442 | L8: =K8/B8 -> 2.2508873690589557E-3 | M8: 5844 | N8: =M8/B8 -> 2.9760601323032893E-2 | O8: 2398 | P8: =O8/B8 -> 1.2211827852948815E-2 | Q8: 15191 | R8: =Q8/B8 -> 7.7360248921661989E-2
A9: 7 | B9: 196952 | C9: 113206 | D9: =C9/B9 -> 0.57478979649863926 | E9: 57025 | F9: =E9/B9 -> 0.2895375522970064 | G9: 1724 | H9: =G9/B9 -> 8.7534018441041469E-3 | I9: 15789 | J9: =I9/B9 -> 8.0166741134895816E-2 | K9: 475 | L9: =K9/B9 -> 2.4117551484625697E-3 | M9: 5938 | N9: =M9/B9 -> 3.0149478045412081E-2 | O9: 2795 | P9: =O9/B9 -> 1.4191275031479751E-2 | Q9: 16397 | R9: =Q9/B9 -> 8.3253787724927905E-2
A10: 8 | B10: 200030 | C10: 110897 | D10: =C10/B10 -> 0.55440183972404145 | E10: 63750 | F10: =E10/B10 -> 0.31870219467079935 | G10: 1366 | H10: =G10/B10 -> 6.8289756536519522E-3 | I10: 10562 | J10: =I10/B10 -> 5.2802079688046795E-2 | K10: 189 | L10: =K10/B10 -> 9.4485827125931115E-4 | M10: 11495 | N10: =M10/B10 -> 5.7466380042993551E-2 | O10: 1771 | P10: =O10/B10 -> 8.8536719492076192E-3 | Q10: 19851 | R10: =Q10/B10 -> 9.924011398290257E-2
A11: 9 | B11: 202033 | C11: 79271 | D11: =C11/B11 -> 0.39236659357629694 | E11: 112724 | F11: =E11/B11 -> 0.55794845396544124 | G11: 1735 | H11: =G11/B11 -> 8.5877059688268757E-3 | I11: 4133 | J11: =I11/B11 -> 2.045705404562621E-2 | K11: 117 | L11: =K11/B11 -> 5.7911331317161063E-4 | M11: 2311 | N11: =M11/B11 -> 1.143872535674865E-2 | O11: 1742 | P11: =O11/B11 -> 8.6223537738884248E-3 | Q11: 5445 | R11: =Q11/B11 -> 2.6951042651448032E-2
A12: 10 | B12: 197605 | C12: 154552 | D12: =C12/B12 -> 0.78212595835125631 | E12: 32032 | F12: =E12/B12 -> 0.1621011614078591 | G12: 1152 | H12: =G12/B12 -> 5.8298119986842437E-3 | I12: 6410 | J12: =I12/B12 -> 3.2438450444067714E-2 | K12: 114 | L12: =K12/B12 -> 5.7690847903646165E-4 | M12: 2433 | N12: =M12/B12 -> 1.2312441486804484E-2 | O12: 912 | P12: =O12/B12 -> 4.6152678322916932E-3 | Q12: 6509 | R12: =Q12/B12 -> 3.2939449912704637E-2
A13: 11 | B13: 199714 | C13: 139273 | D13: =C13/B13 -> 0.69736222798601999 | E13: 51546 | F13: =E13/B13 -> 0.25809908168681212 | G13: 1282 | H13: =G13/B13 -> 6.4191794265800097E-3 | I13: 3299 | J13: =I13/B13 -> 1.6518621628929368E-2 | K13: 149 | L13: =K13/B13 -> 7.4606687563215401E-4 | M13: 3276 | N13: =M13/B13 -> 1.6403456943429102E-2 | O13: 889 | P13: =O13/B13 -> 4.4513654525972137E-3 | Q13: 7060 | R13: =Q13/B13 -> 3.535055128834233E-2
A14: 12 | B14: 203531 | C14: 161088 | D14: =C14/B14 -> 0.79146665618505285 | E14: 23258 | F14: =E14/B14 -> 0.11427251868265768 | G14: 945 | H14: =G14/B14 -> 4.6430273520986975E-3 | I14: 14599 | J14: =I14/B14 -> 7.1728631019353312E-2 | K14: 99 | L14: =K14/B14 -> 4.8641238926748259E-4 | M14: 2632 | N14: =M14/B14 -> 1.2931690995474891E-2 | O14: 910 | P14: =O14/B14 -> 4.4710633760950422E-3 | Q14: 7065 | R14: =Q14/B14 -> 3.471215687045217E-2
A15: 13 | B15: 202857 | C15: 140521 | D15: =C15/B15 -> 0.69270964275326952 | E15: 42441 | F15: =E15/B15 -> 0.20921634451855248 | G15: 1495 | H15: =G15/B15 -> 7.3697234998052813E-3 | I15: 13731 | J15: =I15/B15 -> 6.768807583667312E-2 | K15: 310 | L15: =K15/B15 -> 1.528170090260627E-3 | M15: 2674 | N15: =M15/B15 -> 1.3181699423731989E-2 | O15: 1685 | P15: =O15/B15 -> 8.3063438777069565E-3 | Q15: 8682 | R15: =Q15/B15 -> 4.2798621689170202E-2
A16: 14 | B16: 198144 | C16: 166340 | D16: =C16/B16 -> 0.83949047157622736 | E16: 19259 | F16: =E16/B16 -> 9.7196988049095601E-2 | G16: 1405 | H16: =G16/B16 -> 7.0908026485788115E-3 | I16: 7319 | J16: =I16/B16 -> 3.6937782622739015E-2 | K16: 325 | L16: =K16/B16 -> 1.6402212532299742E-3 | M16: 2399 | N16: =M16/B16 -> 1.2107356266149871E-2 | O16: 1097 | P16: =O16/B16 -> 5.5363775839793279E-3 | Q16: 8494 | R16: =Q16/B16 -> 4.2867813307493542E-2
A17: 15 | B17: 198538 | C17: 138602 | D17: =C17/B17 -> 0.69811320754716977 | E17: 54489 | F17: =E17/B17 -> 0.27445123855382847 | G17: 1361 | H17: =G17/B17 -> 6.8551108603894465E-3 | I17: 1328 | J17: =I17/B17 -> 6.6888958285063818E-3 | K17: 72 | L17: =K17/B17 -> 3.6265097865396045E-4 | M17: 1956 | N17: =M17/B17 -> 9.8520182534325915E-3 | O17: 730 | P17: =O17/B17 -> 3.6768779780193212E-3 | Q17: 4276 | R17: =Q17/B17 -> 2.1537438676726875E-2
A18: 16 | B18: 197225 | C18: 74286 | D18: =C18/B18 -> 0.37665610343516287 | E18: 106680 | F18: =E18/B18 -> 0.54090505767524399 | G18: 1345 | H18: =G18/B18 -> 6.8196222588414249E-3 | I18: 3651 | J18: =I18/B18 -> 1.8511851945747244E-2 | K18: 311 | L18: =K18/B18 -> 1.5768791988845228E-3 | M18: 9208 | N18: =M18/B18 -> 4.6687793129674228E-2 | O18: 1744 | P18: =O18/B18 -> 8.8426923564456847E-3 | Q18: 16186 | R18: =Q18/B18 -> 8.206870325770059E-2
A19: 17 | B19: 204024 | C19: 148539 | D19: =C19/B19 -> 0.72804670038818964 | E19: 38721 | F19: =E19/B19 -> 0.18978649570638748 | G19: 1535 | H19: =G19/B19 -> 7.5236246716072616E-3 | I19: 5232 | J19: =I19/B19 -> 2.5644041877426187E-2 | K19: 264 | L19: =K19/B19 -> 1.2939654158334313E-3 | M19: 8370 | N19: =M19/B19 -> 4.1024585342900835E-2 | O19: 1363 | P19: =O19/B19 -> 6.6805865976551776E-3 | Q19: 16277 | R19: =Q19/B19 -> 7.9779829823942286E-2
A20: 18 | B20: 197503 | C20: 81425 | D20: =C20/B20 -> 0.41227221864984331 | E20: 108701 | F20: =E20/B20 -> 0.55037644997797497 | G20: 1162 | H20: =G20/B20 -> 5.8834549348617485E-3 | I20: 2656 | J20: =I20/B20 -> 1.3447896993969711E-2 | K20: 204 | L20: =K20/B20 -> 1.0328957028500833E-3 | M20: 1990 | N20: =M20/B20 -> 1.0075796317017969E-2 | O20: 1365 | P20: =O20/B20 -> 6.911287423482175E-3 | Q20: 5190 | R20: =Q20/B20 -> 2.6278081851921237E-2
A21: 19 | B21: 197558 | C21: 181126 | D21: =C21/B21 -> 0.91682442624444471 | E21: 11032 | F21: =E21/B21 -> 5.5841828728778381E-2 | G21: 1013 | H21: =G21/B21 -> 5.1276080948379713E-3 | I21: 2403 | J21: =I21/B21 -> 1.2163516536915742E-2 | K21: 70 | L21: =K21/B21 -> 3.5432632442118265E-4 | M21: 1614 | N21: =M21/B21 -> 8.1697526802255536E-3 | O21: 300 | P21: =O21/B21 -> 1.518541390376497E-3 | Q21: 3580 | R21: =Q21/B21 -> 1.8121260591826199E-2
A22: 20 | B22: 201089 | C22: 135888 | D22: =C22/B22 -> 0.67576048416372847 | E22: 58396 | F22: =E22/B22 -> 0.29039877865024938 | G22: 868 | H22: =G22/B22 -> 4.3164966756013504E-3 | I22: 1105 | J22: =I22/B22 -> 5.4950792932482633E-3 | K22: 62 | L22: =K22/B22 -> 3.083211911143822E-4 | M22: 4262 | N22: =M22/B22 -> 2.1194595427895112E-2 | O22: 508 | P22: =O22/B22 -> 2.5262445981630026E-3 | Q22: 7306 | R22: =Q22/B22 -> 3.6332171327123811E-2
A23: 21 | B23: 200511 | C23: 152120 | D23: =C23/B23 -> 0.75866161956201905 | E23: 34350 | F23: =E23/B23 -> 0.17131229708095816 | G23: 1122 | H23: =G23/B23 -> 5.5957029788889388E-3 | I23: 8449 | J23: =I23/B23 -> 4.2137339098603066E-2 | K23: 150 | L23: =K23/B23 -> 7.4808863354130194E-4 | M23: 3408 | N23: =M23/B23 -> 1.6996573754058379E-2 | O23: 912 | P23: =O23/B23 -> 4.5483788919311163E-3 | Q23: 8157 | R23: =Q23/B23 -> 4.0681059891975999E-2
A24: 22 | B24: 203213 | C24: 146481 | D24: =C24/B24 -> 0.72082494722286472 | E24: 17408 | F24: =E24/B24 -> 8.5663810878241056E-2 | G24: 1096 | H24: =G24/B24 -> 5.3933557400363168E-3 | I24: 29306 | J24: =I24/B24 -> 0.1442132147057521 | K24: 178 | L24: =K24/B24 -> 8.7592821325407336E-4 | M24: 7225 | N24: =M24/B24 -> 3.5553827757082469E-2 | O24: 1519 | P24: =O24/B24 -> 7.474915482769311E-3 | Q24: 19285 | R24: =Q24/B24 -> 9.4900424677555079E-2
A25: 23 | B25: 203359 | C25: 178266 | D25: =C25/B25 -> 0.8766073790685438 | E25: 17690 | F25: =E25/B25 -> 8.6989019418860239E-2 | G25: 1125 | H25: =G25/B25 -> 5.532088572426104E-3 | I25: 4034 | J25: =I25/B25 -> 1.9836840267703913E-2 | K25: 86 | L25: =K25/B25 -> 4.2289743753657326E-4 | M25: 1691 | N25: =M25/B25 -> 8.3153438008644817E-3 | O25: 467 | P25: =O25/B25 -> 2.2964314340648802E-3 | Q25: 4285 | R25: =Q25/B25 -> 2.1071110695862982E-2
A26: 24 | B26: 204024 | C26: 181909 | D26: =C26/B26 -> 0.89160588950319575 | E26: 15056 | F26: =E26/B26 -> 7.3795239775712659E-2 | G26: 1179 | H26: =G26/B26 -> 5.778731913892483E-3 | I26: 1966 | J26: =I26/B26 -> 9.6361212406383557E-3 | K26: 97 | L26: =K26/B26 -> 4.7543426263576833E-4 | M26: 3318 | N26: =M26/B26 -> 1.6262792612633806E-2 | O26: 499 | P26: =O26/B26 -> 2.4457906912912207E-3 | Q26: 6760 | R26: =Q26/B26 -> 3.3133356859977259E-2
A27: 25 | B27: 198245 | C27: 165121 | D27: =C27/B27 -> 0.83291381875961568 | E27: 20363 | F27: =E27/B27 -> 0.10271633584705793 | G27: 1222 | H27: =G27/B27 -> 6.1640898887739921E-3 | I27: 7934 | J27: =I27/B27 -> 4.0021185906328027E-2 | K27: 127 | L27: =K27/B27 -> 6.4062145325228886E-4 | M27: 2814 | N27: =M27/B27 -> 1.4194557239779061E-2 | O27: 664 | P27: =O27/B27 -> 3.3493909051930692E-3 | Q27: 6931 | R27: =Q27/B27 -> 3.496178970465838E-2
A28: 26 | B28: 201484 | C28: 180374 | D28: =C28/B28 -> 0.89522741259851901 | E28: 8075 | F28: =E28/B28 -> 4.0077624029699631E-2 | G28: 1371 | H28: =G28/B28 -> 6.8045105318536459E-3 | I28: 3298 | J28: =I28/B28 -> 1.6368545393182585E-2 | K28: 127 | L28: =K28/B28 -> 6.3032300331539973E-4 | M28: 7636 | N28: =M28/B28 -> 3.7898790970995216E-2 | O28: 603 | P28: =O28/B28 -> 2.9927934724345356E-3 | Q28: 14661 | R28: =Q28/B28 -> 7.2765083083520282E-2
A29: 27 | B29: 203835 | C29: 172952 | D29: =C29/B29 -> 0.84849020040719214 | E29: 15220 | F29: =E29/B29 -> 7.4668236563887463E-2 | G29: 1357 | H29: =G29/B29 -> 6.6573454019182177E-3 | I29: 6145 | J29: =I29/B29 -> 3.0146932568008437E-2 | K29: 174 | L29: =K29/B29 -> 8.5363161380528371E-4 | M29: 7181 | N29: =M29/B29 -> 3.5229474820320357E-2 | O29: 806 | P29: =O29/B29 -> 3.9541786248681529E-3 | Q29: 15173 | R29: =Q29/B29 -> 7.4437657909583732E-2
A30: 28 | B30: 198907 | C30: 151728 | D30: =C30/B30 -> 0.76280874981775404 | E30: 30323 | F30: =E30/B30 -> 0.15244812902512228 | G30: 1883 | H30: =G30/B30 -> 9.4667357106587493E-3 | I30: 6922 | J30: =I30/B30 -> 3.4800183000095519E-2 | K30: 285 | L30: =K30/B30 -> 1.4328304182356579E-3 | M30: 6190 | N30: =M30/B30 -> 3.1120071189048148E-2 | O30: 1576 | P30: =O30/B30 -> 7.9233008390856025E-3 | Q30: 15710 | R30: =Q30/B30 -> 7.898163463327082E-2
A31: 29 | B31: 204003 | C31: 104516 | D31: =C31/B31 -> 0.51232579913040499 | E31: 48210 | F31: =E31/B31 -> 0.23632005411685122 | G31: 2051 | H31: =G31/B31 -> 1.0053773719013935E-2 | I31: 17169 | J31: =I31/B31 -> 8.4160527051072784E-2 | K31: 378 | L31: =K31/B31 -> 1.8529139277363568E-3 | M31: 28883 | N31: =M31/B31 -> 0.14158125125610899 | O31: 2796 | P31: =O31/B31 -> 1.3705680798811782E-2 | Q31: 57008 | R31: =Q31/B31 -> 0.27944687087934983
A32: 30 | B32: 196030 | C32: 135368 | D32: =C32/B32 -> 0.69054736519920423 | E32: 27710 | F32: =E32/B32 -> 0.14135591491098301 | G32: 1497 | H32: =G32/B32 -> 7.6365862368004897E-3 | I32: 14703 | J32: =I32/B32 -> 7.5003825945008415E-2 | K32: 264 | L32: =K32/B32 -> 1.3467326429628119E-3 | M32: 14757 | N32: =M32/B32 -> 7.5279293985614448E-2 | O32: 1731 | P32: =O32/B32 -> 8.8302810794266186E-3 | Q32: 31600 | R32: =Q32/B32 -> 0.16119981635463959
A33: 31 | B33: 200905 | C33: 148296 | D33: =C33/B33 -> 0.73813991687613545 | E33: 11990 | F33: =E33/B33 -> 5.9679948234240061E-2 | G33: 1269 | H33: =G33/B33 -> 6.3164182076105623E-3 | I33: 27819 | J33: =I33/B33 -> 0.13846843035265424 | K33: 244 | L33: =K33/B33 -> 1.2145043677359946E-3 | M33: 9884 | N33: =M33/B33 -> 4.9197381847141682E-2 | O33: 1403 | P33: =O33/B33 -> 6.9834001144819689E-3 | Q33: 24026 | R33: =Q33/B33 -> 0.11958886040665986
A34: 32 | B34: 198617 | C34: 147196 | D34: =C34/B34 -> 0.74110473927206633 | E34: 11165 | F34: =E34/B34 -> 5.6213717858994948E-2 | G34: 1005 | H34: =G34/B34 -> 5.0599898296721834E-3 | I34: 31804 | J34: =I34/B34 -> 0.16012728014218319 | K34: 170 | L34: =K34/B34 -> 8.5591867765599122E-4 | M34: 6144 | N34: =M34/B34 -> 3.0933907973637705E-2 | O34: 1133 | P34: =O34/B34 -> 5.7044462457896353E-3 | Q34: 17410 | R34: =Q34/B34 -> 8.7656142223475328E-2
A35: 33 | B35: 196178 | C35: 112298 | D35: =C35/B35 -> 0.57242912049261385 | E35: 20203 | F35: =E35/B35 -> 0.10298300522994423 | G35: 1242 | H35: =G35/B35 -> 6.3309851257531422E-3 | I35: 40821 | J35: =I35/B35 -> 0.20808143624667394 | K35: 195 | L35: =K35/B35 -> 9.9399524921244984E-4 | M35: 19391 | N35: =M35/B35 -> 9.8843907063992903E-2 | O35: 2028 | P35: =O35/B35 -> 1.0337550591809479E-2 | Q35: 38810 | R35: =Q35/B35 -> 0.19783054165094965
A36: 34 | B36: 196312 | C36: 132960 | D36: =C36/B36 -> 0.67728921308936796 | E36: 11602 | F36: =E36/B36 -> 5.9099800317861363E-2 | G36: 1078 | H36: =G36/B36 -> 5.4912588125025467E-3 | I36: 40711 | J36: =I36/B36 -> 0.20737907005175435 | K36: 256 | L36: =K36/B36 -> 1.3040466196666532E-3 | M36: 8481 | N36: =M36/B36 -> 4.3201638208565957E-2 | O36: 1224 | P36: =O36/B36 -> 6.2349729002811848E-3 | Q36: 22037 | R36: =Q36/B36 -> 0.11225498186560169
A37: 35 | B37: 196251 | C37: 106787 | D37: =C37/B37 -> 0.54413480695639771 | E37: 25065 | F37: =E37/B37 -> 0.12771909442499657 | G37: 1602 | H37: =G37/B37 -> 8.1630157298561538E-3 | I37: 34850 | J37: =I37/B37 -> 0.17757871297471095 | K37: 221 | L37: =K37/B37 -> 1.1261089115469475E-3 | M37: 25631 | N37: =M37/B37 -> 0.13060315616226159 | O37: 2095 | P37: =O37/B37 -> 1.0675104840230114E-2 | Q37: 51879 | R37: =Q37/B37 -> 0.26435024534906826
A38: 36 | B38: 199271 | C38: 106281 | D38: =C38/B38 -> 0.53334905731390925 | E38: 50424 | F38: =E38/B38 -> 0.25304233932684633 | G38: 1888 | H38: =G38/B38 -> 9.4745346789046076E-3 | I38: 16944 | J38: =I38/B38 -> 8.5029934109830327E-2 | K38: 383 | L38: =K38/B38 -> 1.922005710815924E-3 | M38: 20595 | N38: =M38/B38 -> 0.10335171700849596 | O38: 2756 | P38: =O38/B38 -> 1.3830411851197615E-2 | Q38: 42920 | R38: =Q38/B38 -> 0.21538507861153905
A39: 37 | B39: 197280 | C39: 118885 | D39: =C39/B39 -> 0.60262064071370636 | E39: 15328 | F39: =E39/B39 -> 7.7696674776966748E-2 | G39: 1144 | H39: =G39/B39 -> 5.7988645579886457E-3 | I39: 47837 | J39: =I39/B39 -> 0.24248276561232765 | K39: 229 | L39: =K39/B39 -> 1.1607866991078669E-3 | M39: 12264 | N39: =M39/B39 -> 6.2165450121654503E-2 | O39: 1593 | P39: =O39/B39 -> 8.074817518248175E-3 | Q39: 30524 | R39: =Q39/B39 -> 0.1547242497972425
A40: 38 | B40: 201414 | C40: 189958 | D40: =C40/B40 -> 0.94312212656518413 | E40: 8283 | F40: =E40/B40 -> 4.1124251541600883E-2 | G40: 888 | H40: =G40/B40 -> 4.4088295749054188E-3 | I40: 1191 | J40: =I40/B40 -> 5.9131937203967949E-3 | K40: 51 | L40: =K40/B40 -> 2.5320980666686526E-4 | M40: 804 | N40: =M40/B40 -> 3.9917781286305815E-3 | O40: 239 | P40: =O40/B40 -> 1.1866106626153097E-3 | Q40: 1947 | R40: =Q40/B40 -> 9.6666567368703261E-3
A41: 39 | B41: 202151 | C41: 123215 | D41: =C41/B41 -> 0.60951961652428133 | E41: 35938 | F41: =E41/B41 -> 0.17777799763543095 | G41: 1334 | H41: =G41/B41 -> 6.5990274596712355E-3 | I41: 29135 | J41: =I41/B41 -> 0.1441249363099861 | K41: 363 | L41: =K41/B41 -> 1.7956873822043919E-3 | M41: 10160 | N41: =M41/B41 -> 5.0259459512938351E-2 | O41: 2006 | P41: =O41/B41 -> 9.9232751754876301E-3 | Q41: 25337 | R41: =Q41/B41 -> 0.12533700055898808
A42: 40 | B42: 198458 | C42: 189689 | D42: =C42/B42 -> 0.95581432847252312 | E42: 5203 | F42: =E42/B42 -> 2.621713410394139E-2 | G42: 1049 | H42: =G42/B42 -> 5.2857531568392306E-3 | I42: 829 | J42: =I42/B42 -> 4.1772062602666556E-3 | K42: 74 | L42: =K42/B42 -> 3.7287486521077508E-4 | M42: 1371 | N42: =M42/B42 -> 6.9082627054590897E-3 | O42: 243 | P42: =O42/B42 -> 1.2244404357597074E-3 | Q42: 2857 | R42: =Q42/B42 -> 1.4395993106853843E-2

A1: HB 5001 Conference, Senate Voting Age Population
A2: DISTRICT | B2: Voting Age Population | C2: VAP White | D2: % VAP White | E2: VAP Black | F2: % VAP Black | G2: VAP AIAN | H2: % VAP AIAN | I2: VAP Asian | J2: % VAP Asian | K2: VAP HawPI | L2: % VAP HawPI | M2: VAP Other | N2: % VAP Other | O2: VAP Multi | P2: % VAP Multi | Q2: Voting Age Hispanic | R2: % VAP Hispanic
A3: 1 | B3: 154645 | C3: 94765 | D3: =C3/B3 -> 0.61279058488796923 | E3: 46022 | F3: =E3/B3 -> 0.29759772381906946 | G3: 1248 | H3: =G3/B3 -> 8.0700960263830057E-3 | I3: 6433 | J3: =I3/B3 -> 4.1598499789841252E-2 | K3: 304 | L3: =K3/B3 -> 1.9657926218112449E-3 | M3: 4336 | N3: =M3/B3 -> 2.8038410553202497E-2 | O3: 1537 | P3: =O3/B3 -> 9.9388923017233021E-3 | Q3: 10422 | R3: =Q3/B3 -> 6.7393061528015774E-2
A4: 2 | B4: 150369 | C4: 63636 | D4: =C4/B4 -> 0.42319893063064862 | E4: 77022 | F4: =E4/B4 -> 0.51221993895018259 | G4: 1105 | H4: =G4/B4 -> 7.3485891373886907E-3 | I4: 4466 | J4: =I4/B4 -> 2.9700270667491306E-2 | K4: 220 | L4: =K4/B4 -> 1.4630675205660742E-3 | M4: 2208 | N4: =M4/B4 -> 1.4683877660954053E-2 | O4: 1712 | P4: =O4/B4 -> 1.1385325432768722E-2 | Q4: 5918 | R4: =Q4/B4 -> 3.9356516303227396E-2
A5: 3 | B5: 158008 | C5: 133691 | D5: =C5/B5 -> 0.84610272897574801 | E5: 17951 | F5: =E5/B5 -> 0.11360817173813983 | G5: 1457 | H5: =G5/B5 -> 9.221052098627917E-3 | I5: 3190 | J5: =I5/B5 -> 2.0188851197407726E-2 | K5: 110 | L5: =K5/B5 -> 6.9616728266923191E-4 | M5: 1055 | N5: =M5/B5 -> 6.6768771201458155E-3 | O5: 554 | P5: =O5/B5 -> 3.5061515872614043E-3 | Q5: 3450 | R5: =Q5/B5 -> 2.183433750189864E-2
A6: 4 | B6: 154170 | C6: 119019 | D6: =C6/B6 -> 0.77199844327690215 | E6: 29832 | F6: =E6/B6 -> 0.19350068106635532 | G6: 1156 | H6: =G6/B6 -> 7.4982162547836805E-3 | I6: 1933 | J6: =I6/B6 -> 1.2538107284166829E-2 | K6: 99 | L6: =K6/B6 -> 6.4214827787507293E-4 | M6: 1610 | N6: =M6/B6 -> 1.0443017448271389E-2 | O6: 521 | P6: =O6/B6 -> 3.379386391645586E-3 | Q6: 4025 | R6: =Q6/B6 -> 2.6107543620678471E-2
A7: 5 | B7: 149582 | C7: 59413 | D7: =C7/B7 -> 0.39719351258841307 | E7: 80221 | F7: =E7/B7 -> 0.53630115923038868 | G7: 1101 | H7: =G7/B7 -> 7.3605112914655506E-3 | I7: 4434 | J7: =I7/B7 -> 2.9642604056637829E-2 | K7: 181 | L7: =K7/B7 -> 1.2100386410129561E-3 | M7: 2940 | N7: =M7/B7 -> 1.9654771296011554E-2 | O7: 1292 | P7: =O7/B7 -> 8.6374028960703834E-3 | Q7: 6854 | R7: =Q7/B7 -> 4.5821021245871826E-2
A8: 6 | B8: 160365 | C8: 104839 | D8: =C8/B8 -> 0.65375237738908121 | E8: 42154 | F8: =E8/B8 -> 0.26286284413681288 | G8: 1523 | H8: =G8/B8 -> 9.4970847753562179E-3 | I8: 5515 | J8: =I8/B8 -> 3.4390297134661553E-2 | K8: 348 | L8: =K8/B8 -> 2.170049574408381E-3 | M8: 4270 | N8: =M8/B8 -> 2.6626757708976399E-2 | O8: 1716 | P8: =O8/B8 -> 1.0700589280703396E-2 | Q8: 11051 | R8: =Q8/B8 -> 6.8911545536744306E-2
A9: 7 | B9: 149107 | C9: 90648 | D9: =C9/B9 -> 0.60793926509151142 | E9: 39357 | F9: =E9/B9 -> 0.26395139061211076 | G9: 1307 | H9: =G9/B9 -> 8.7655173801364124E-3 | I9: 11904 | J9: =I9/B9 -> 7.9835286069735154E-2 | K9: 337 | L9: =K9/B9 -> 2.2601219258653184E-3 | M9: 4091 | N9: =M9/B9 -> 2.7436672993219634E-2 | O9: 1463 | P9: =O9/B9 -> 9.8117459274212476E-3 | Q9: 10704 | R9: =Q9/B9 -> 7.1787374167544118E-2
A10: 8 | B10: 159556 | C10: 94167 | D10: =C10/B10 -> 0.59018150367269173 | E10: 46623 | F10: =E10/B10 -> 0.29220461781443507 | G10: 1052 | H10: =G10/B10 -> 6.5932963975030706E-3 | I10: 8529 | J10: =I10/B10 -> 5.3454586477474995E-2 | K10: 130 | L10: =K10/B10 -> 8.1476096166863046E-4 | M10: 7931 | N10: =M10/B10 -> 4.9706686053799291E-2 | O10: 1124 | P10: =O10/B10 -> 7.0445486224272359E-3 | Q10: 13705 | R10: =Q10/B10 -> 8.589460753591216E-2
A11: 9 | B11: 158193 | C11: 68166 | D11: =C11/B11 -> 0.43090402230187175 | E11: 82335 | F11: =E11/B11 -> 0.52047182871555631 | G11: 1385 | H11: =G11/B11 -> 8.7551282294412516E-3 | I11: 3442 | J11: =I11/B11 -> 2.1758232033022951E-2 | K11: 87 | L11: =K11/B11 -> 5.4996112343782589E-4 | M11: 1641 | N11: =M11/B11 -> 1.0373404638637614E-2 | O11: 1137 | P11: =O11/B11 -> 7.1874229580322774E-3 | Q11: 3820 | R11: =Q11/B11 -> 2.4147718293476957E-2
A12: 10 | B12: 148445 | C12: 117548 | D12: =C12/B12 -> 0.79186230590454376 | E12: 23596 | F12: =E12/B12 -> 0.15895449493078245 | G12: 855 | H12: =G12/B12 -> 5.7597089831250628E-3 | I12: 4330 | J12: =I12/B12 -> 2.916905251103102E-2 | K12: 72 | L12: =K12/B12 -> 4.8502812489474215E-4 | M12: 1540 | N12: =M12/B12 -> 1.0374212671359764E-2 | O12: 504 | P12: =O12/B12 -> 3.3951968742631953E-3 | Q12: 4077 | R12: =Q12/B12 -> 2.7464717572164773E-2
A13: 11 | B13: 154618 | C13: 109751 | D13: =C13/B13 -> 0.70982033139737932 | E13: 38837 | F13: =E13/B13 -> 0.25118032829295422 | G13: 933 | H13: =G13/B13 -> 6.0342262867195285E-3 | I13: 2378 | J13: =I13/B13 -> 1.5379839346001112E-2 | K13: 112 | L13: =K13/B13 -> 7.2436585649794975E-4 | M13: 2101 | N13: =M13/B13 -> 1.3588327361626719E-2 | O13: 506 | P13: =O13/B13 -> 3.2725814588210945E-3 | Q13: 4508 | R13: =Q13/B13 -> 2.9155725724042479E-2
A14: 12 | B14: 153740 | C14: 123264 | D14: =C14/B14 -> 0.80176922076232604 | E14: 17454 | F14: =E14/B14 -> 0.1135293352413165 | G14: 680 | H14: =G14/B14 -> 4.4230519058150123E-3 | I14: 10026 | J14: =I14/B14 -> 6.5213997658384287E-2 | K14: 77 | L14: =K14/B14 -> 5.0084558345258223E-4 | M14: 1696 | N14: =M14/B14 -> 1.1031611812150384E-2 | O14: 543 | P14: =O14/B14 -> 3.531937036555223E-3 | Q14: 4583 | R14: =Q14/B14 -> 2.9810068947573827E-2
A15: 13 | B15: 153465 | C15: 108940 | D15: =C15/B15 -> 0.7098686997035154 | E15: 30605 | F15: =E15/B15 -> 0.19942657935034047 | G15: 1123 | H15: =G15/B15 -> 7.3176294269051579E-3 | I15: 10035 | J15: =I15/B15 -> 6.5389502492424978E-2 | K15: 210 | L15: =K15/B15 -> 1.3683901866875182E-3 | M15: 1711 | N15: =M15/B15 -> 1.1149121949630209E-2 | O15: 841 | P15: =O15/B15 -> 5.4800768904962041E-3 | Q15: 5413 | R15: =Q15/B15 -> 3.527188609780732E-2
A16: 14 | B16: 150463 | C16: 128158 | D16: =C16/B16 -> 0.85175757495198157 | E16: 13990 | F16: =E16/B16 -> 9.2979669420389072E-2 | G16: 1050 | H16: =G16/B16 -> 6.978459820686813E-3 | I16: 4933 | J16: =I16/B16 -> 3.278546885280767E-2 | K16: 218 | L16: =K16/B16 -> 1.448861181818786E-3 | M16: 1542 | N16: =M16/B16 -> 1.0248366708094349E-2 | O16: 572 | P16: =O16/B16 -> 3.8015990642217687E-3 | Q16: 5353 | R16: =Q16/B16 -> 3.5576852781082392E-2
A17: 15 | B17: 155455 | C17: 111145 | D17: =C17/B17 -> 0.7149657457141938 | E17: 40586 | F17: =E17/B17 -> 0.26107876877552988 | G17: 1058 | H17: =G17/B17 -> 6.8058280531343475E-3 | I17: 947 | J17: =I17/B17 -> 6.0917950532308387E-3 | K17: 47 | L17: =K17/B17 -> 3.0233829725644079E-4 | M17: 1209 | N17: =M17/B17 -> 7.777170242192274E-3 | O17: 463 | P17: =O17/B17 -> 2.9783538644623845E-3 | Q17: 2804 | R17: =Q17/B17 -> 1.803737415972468E-2
A18: 16 | B18: 150528 | C18: 60060 | D18: =C18/B18 -> 0.3989955357142857 | E18: 78959 | F18: =E18/B18 -> 0.52454692814625847 | G18: 1052 | H18: =G18/B18 -> 6.9887329931972789E-3 | I18: 2847 | J18: =I18/B18 -> 1.8913424744897961E-2 | K18: 204 | L18: =K18/B18 -> 1.3552295918367347E-3 | M18: 6321 | N18: =M18/B18 -> 4.19921875E-2 | O18: 1085 | P18: =O18/B18 -> 7.2079613095238099E-3 | Q18: 10943 | R18: =Q18/B18 -> 7.2697438350340135E-2
A19: 17 | B19: 154318 | C19: 116071 | D19: =C19/B19 -> 0.75215464171386359 | E19: 27031 | F19: =E19/B19 -> 0.17516427118029004 | G19: 1145 | H19: =G19/B19 -> 7.4197436462369913E-3 | I19: 3700 | J19: =I19/B19 -> 2.397646418434661E-2 | K19: 183 | L19: =K19/B19 -> 1.1858629583068729E-3 | M19: 5444 | N19: =M19/B19 -> 3.527780297826566E-2 | O19: 744 | P19: =O19/B19 -> 4.8212133386902369E-3 | Q19: 10485 | R19: =Q19/B19 -> 6.7944115398074101E-2
A20: 18 | B20: 151276 | C20: 65823 | D20: =C20/B20 -> 0.43511859118432533 | E20: 80303 | F20: =E20/B20 -> 0.53083767418493355 | G20: 872 | H20: =G20/B20 -> 5.7642983685449109E-3 | I20: 1950 | J20: =I20/B20 -> 1.2890346122319469E-2 | K20: 125 | L20: =K20/B20 -> 8.2630423861022233E-4 | M20: 1392 | N20: =M20/B20 -> 9.2017240011634371E-3 | O20: 811 | P20: =O20/B20 -> 5.3610619001031225E-3 | Q20: 3430 | R20: =Q20/B20 -> 2.2673788307464502E-2
A21: 19 | B21: 155557 | C21: 143814 | D21: =C21/B21 -> 0.92450998669298068 | E21: 8053 | F21: =E21/B21 -> 5.1768805003953533E-2 | G21: 791 | H21: =G21/B21 -> 5.0849527825813047E-3 | I21: 1618 | J21: =I21/B21 -> 1.0401331987631544E-2 | K21: 59 | L21: =K21/B21 -> 3.7928219237964221E-4 | M21: 1047 | N21: =M21/B21 -> 6.7306517868048364E-3 | O21: 175 | P21: =O21/B21 -> 1.1249895536684302E-3 | Q21: 2276 | R21: =Q21/B21 -> 1.4631292709424841E-2
A22: 20 | B22: 158633 | C22: 110813 | D22: =C22/B22 -> 0.69854948213801671 | E22: 43490 | F22: =E22/B22 -> 0.27415481015929849 | G22: 681 | H22: =G22/B22 -> 4.2929277010458101E-3 | I22: 781 | J22: =I22/B22 -> 4.9233135602302167E-3 | K22: 49 | L22: =K22/B22 -> 3.0888907100035931E-4 | M22: 2508 | N22: =M22/B22 -> 1.5810077348344921E-2 | O22: 311 | P22: =O22/B22 -> 1.9605000220635051E-3 | Q22: 4330 | R22: =Q22/B22 -> 2.7295707702684812E-2
A23: 21 | B23: 162817 | C23: 127589 | D23: =C23/B23 -> 0.78363438707260302 | E23: 24254 | F23: =E23/B23 -> 0.14896478868914179 | G23: 902 | H23: =G23/B23 -> 5.5399620432755791E-3 | I23: 7022 | J23: =I23/B23 -> 4.3128174576364878E-2 | K23: 115 | L23: =K23/B23 -> 7.0631445119367139E-4 | M23: 2327 | N23: =M23/B23 -> 1.4292119373284116E-2 | O23: 608 | P23: =O23/B23 -> 3.7342537941369757E-3 | Q23: 5718 | R23: =Q23/B23 -> 3.5119182886307942E-2
A24: 22 | B24: 138398 | C24: 101794 | D24: =C24/B24 -> 0.73551640919666472 | E24: 11490 | F24: =E24/B24 -> 8.3021430945533894E-2 | G24: 702 | H24: =G24/B24 -> 5.0723276347924102E-3 | I24: 18790 | J24: =I24/B24 -> 0.13576785791702192 | K24: 121 | L24: =K24/B24 -> 8.7429009089726726E-4 | M24: 4680 | N24: =M24/B24 -> 3.3815517565282734E-2 | O24: 821 | P24: =O24/B24 -> 5.9321666498070779E-3 | Q24: 12176 | R24: =Q24/B24 -> 8.7978149973265515E-2
A25: 23 | B25: 160956 | C25: 142722 | D25: =C25/B25 -> 0.8867143815701185 | E25: 13012 | F25: =E25/B25 -> 8.0841969233827873E-2 | G25: 875 | H25: =G25/B25 -> 5.4362682969258678E-3 | I25: 2812 | J25: =I25/B25 -> 1.7470613086806332E-2 | K25: 57 | L25: =K25/B25 -> 3.5413404905688511E-4 | M25: 1192 | N25: =M25/B25 -> 7.4057506399264391E-3 | O25: 286 | P25: =O25/B25 -> 1.7768831233380552E-3 | Q25: 2926 | R25: =Q25/B25 -> 1.8178881184920101E-2
A26: 24 | B26: 158069 | C26: 142925 | D26: =C26/B26 -> 0.90419373817763127 | E26: 10712 | F26: =E26/B26 -> 6.7767873523587804E-2 | G26: 860 | H26: =G26/B26 -> 5.4406619893843829E-3 | I26: 1348 | J26: =I26/B26 -> 8.5279213508024972E-3 | K26: 67 | L26: =K26/B26 -> 4.2386552707994609E-4 | M26: 1878 | N26: =M26/B26 -> 1.1880887460539384E-2 | O26: 279 | P26: =O26/B26 -> 1.7650519709747009E-3 | Q26: 3970 | R26: =Q26/B26 -> 2.5115614067274417E-2
A27: 25 | B27: 160398 | C27: 135056 | D27: =C27/B27 -> 0.84200551129066448 | E27: 15328 | F27: =E27/B27 -> 9.5562288806593593E-2 | G27: 913 | H27: =G27/B27 -> 5.6920909238269805E-3 | I27: 6590 | J27: =I27/B27 -> 4.1085300315465277E-2 | K27: 103 | L27: =K27/B27 -> 6.4215264529482907E-4 | M27: 1959 | N27: =M27/B27 -> 1.2213369244005536E-2 | O27: 449 | P27: =O27/B27 -> 2.7992867741493035E-3 | Q27: 4908 | R27: =Q27/B27 -> 3.0598885272883701E-2
A28: 26 | B28: 159446 | C28: 144854 | D28: =C28/B28 -> 0.90848312281273913 | E28: 5612 | F28: =E28/B28 -> 3.5196869159464649E-2 | G28: 1017 | H28: =G28/B28 -> 6.378334984885165E-3 | I28: 2616 | J28: =I28/B28 -> 1.6406808574689864E-2 | K28: 112 | L28: =K28/B28 -> 7.0243217139344979E-4 | M28: 4889 | N28: =M28/B28 -> 3.0662418624487289E-2 | O28: 346 | P28: =O28/B28 -> 2.170013672340479E-3 | Q28: 9274 | R28: =Q28/B28 -> 5.8163892477704052E-2
A29: 27 | B29: 151523 | C29: 131214 | D29: =C29/B29 -> 0.86596754288127875 | E29: 10230 | F29: =E29/B29 -> 6.7514502748757615E-2 | G29: 962 | H29: =G29/B29 -> 6.3488711284755452E-3 | I29: 4122 | J29: =I29/B29 -> 2.72037908436343E-2 | K29: 126 | L29: =K29/B29 -> 8.3155692535126675E-4 | M29: 4444 | N29: =M29/B29 -> 2.9328880763976425E-2 | O29: 425 | P29: =O29/B29 -> 2.8048547085260983E-3 | Q29: 9271 | R29: =Q29/B29 -> 6.1185430594695195E-2
A30: 28 | B30: 142673 | C30: 111826 | D30: =C30/B30 -> 0.78379230828537982 | E30: 20259 | F30: =E30/B30 -> 0.14199603288639057 | G30: 1320 | H30: =G30/B30 -> 9.2519257322688942E-3 | I30: 4596 | J30: =I30/B30 -> 3.2213523231445336E-2 | K30: 180 | L30: =K30/B30 -> 1.2616262362184856E-3 | M30: 3732 | N30: =M30/B30 -> 2.6157717297596601E-2 | O30: 760 | P30: =O30/B30 -> 5.3268663307002723E-3 | Q30: 9462 | R30: =Q30/B30 -> 6.6319485817218388E-2
A31: 29 | B31: 145025 | C31: 78020 | D31: =C31/B31 -> 0.53797621099810378 | E31: 32726 | F31: =E31/B31 -> 0.22565764523358042 | G31: 1371 | H31: =G31/B31 -> 9.4535424926736767E-3 | I31: 12294 | J31: =I31/B31 -> 8.4771591104981905E-2 | K31: 273 | L31: =K31/B31 -> 1.8824340630925703E-3 | M31: 18796 | N31: =M31/B31 -> 0.12960524047578004 | O31: 1545 | P31: =O31/B31 -> 1.0653335631787622E-2 | Q31: 36610 | R31: =Q31/B31 -> 0.25243923461472162
A32: 30 | B32: 159954 | C32: 113468 | D32: =C32/B32 -> 0.70937894644710353 | E32: 21421 | F32: =E32/B32 -> 0.1339197519286795 | G32: 1187 | H32: =G32/B32 -> 7.4208835040074023E-3 | I32: 11733 | J32: =I32/B32 -> 7.3352338797404257E-2 | K32: 211 | L32: =K32/B32 -> 1.319129249659277E-3 | M32: 10736 | N32: =M32/B32 -> 6.7119296797829381E-2 | O32: 1198 | P32: =O32/B32 -> 7.4896532753166538E-3 | Q32: 23136 | R32: =Q32/B32 -> 0.14464158445553096
A33: 31 | B33: 161054 | C33: 120879 | D33: =C33/B33 -> 0.75054950513492369 | E33: 9359 | F33: =E33/B33 -> 5.8110944155376459E-2 | G33: 1000 | H33: =G33/B33 -> 6.2090975697592114E-3 | I33: 21304 | J33: =I33/B33 -> 0.13227861462615023 | K33: 186 | L33: =K33/B33 -> 1.1548921479752133E-3 | M33: 7348 | N33: =M33/B33 -> 4.5624448942590684E-2 | O33: 978 | P33: =O33/B33 -> 6.0724974232245089E-3 | Q33: 17980 | R33: =Q33/B33 -> 0.11163957430427061
A34: 32 | B34: 149896 | C34: 113697 | D34: =C34/B34 -> 0.75850589742221275 | E34: 7902 | F34: =E34/B34 -> 5.2716550141431395E-2 | G34: 703 | H34: =G34/B34 -> 4.6899183433847464E-3 | I34: 22521 | J34: =I34/B34 -> 0.15024416929070822 | K34: 124 | L34: =K34/B34 -> 8.2724021988578745E-4 | M34: 4265 | N34: =M34/B34 -> 2.8453060788813576E-2 | O34: 684 | P34: =O34/B34 -> 4.5631637935635372E-3 | Q34: 12178 | R34: =Q34/B34 -> 8.1242995143299357E-2
A35: 33 | B35: 142710 | C35: 84442 | D35: =C35/B35 -> 0.59170345455819495 | E35: 14108 | F35: =E35/B35 -> 9.8857823558265015E-2 | G35: 817 | H35: =G35/B35 -> 5.7248966435428494E-3 | I35: 28590 | J35: =I35/B35 -> 0.20033634643682993 | K35: 147 | L35: =K35/B35 -> 1.0300609627916753E-3 | M35: 13421 | N35: =M35/B35 -> 9.4043865181136568E-2 | O35: 1185 | P35: =O35/B35 -> 8.3035526592390163E-3 | Q35: 26634 | R35: =Q35/B35 -> 0.1866302291360101
A36: 34 | B36: 151463 | C36: 104813 | D36: =C36/B36 -> 0.69200398777259131 | E36: 8678 | F36: =E36/B36 -> 5.7294520774050429E-2 | G36: 765 | H36: =G36/B36 -> 5.0507384641793702E-3 | I36: 30103 | J36: =I36/B36 -> 0.19874820913358379 | K36: 199 | L36: =K36/B36 -> 1.3138522279368559E-3 | M36: 6125 | N36: =M36/B36 -> 4.0438919075945941E-2 | O36: 780 | P36: =O36/B36 -> 5.1497725517122995E-3 | Q36: 15918 | R36: =Q36/B36 -> 0.10509497368994408
A37: 35 | B37: 153812 | C37: 86599 | D37: =C37/B37 -> 0.56301849010480332 | E37: 18896 | F37: =E37/B37 -> 0.12285127298260214 | G37: 1178 | H37: =G37/B37 -> 7.6587002314513824E-3 | I37: 26990 | J37: =I37/B37 -> 0.17547395521805842 | K37: 166 | L37: =K37/B37 -> 1.0792395911892441E-3 | M37: 18555 | N37: =M37/B37 -> 0.12063428081033989 | O37: 1428 | P37: =O37/B37 -> 9.2840610615556648E-3 | Q37: 37848 | R37: =Q37/B37 -> 0.24606662679114763
A38: 36 | B38: 144805 | C38: 81166 | D38: =C38/B38 -> 0.56051931908428576 | E38: 34798 | F38: =E38/B38 -> 0.2403093815821277 | G38: 1245 | H38: =G38/B38 -> 8.5977694140395699E-3 | I38: 12219 | J38: =I38/B38 -> 8.438244535754981E-2 | K38: 273 | L38: =K38/B38 -> 1.8852940160906046E-3 | M38: 13577 | N38: =M38/B38 -> 9.3760574565795382E-2 | O38: 1527 | P38: =O38/B38 -> 1.0545215980111183E-2 | Q38: 28058 | R38: =Q38/B38 -> 0.19376402748523877
A39: 37 | B39: 149270 | C39: 92317 | D39: =C39/B39 -> 0.61845648824278154 | E39: 10759 | F39: =E39/B39 -> 7.2077443558652102E-2 | G39: 820 | H39: =G39/B39 -> 5.4934012192670995E-3 | I39: 35609 | J39: =I39/B39 -> 0.2385542975815636 | K39: 153 | L39: =K39/B39 -> 1.0249882762778857E-3 | M39: 8660 | N39: =M39/B39 -> 5.8015676291284249E-2 | O39: 952 | P39: =O39/B39 -> 6.3777048301735112E-3 | Q39: 21534 | R39: =Q39/B39 -> 0.14426207543377773
A40: 38 | B40: 162238 | C40: 153258 | D40: =C40/B40 -> 0.94464921904855825 | E40: 6584 | F40: =E40/B40 -> 4.0582354318963496E-2 | G40: 717 | H40: =G40/B40 -> 4.4194331784168936E-3 | I40: 937 | J40: =I40/B40 -> 5.7754656738865122E-3 | K40: 47 | L40: =K40/B40 -> 2.8969785130487311E-4 | M40: 544 | N40: =M40/B40 -> 3.3530985342521483E-3 | O40: 151 | P40: =O40/B40 -> 9.3073139461778373E-4 | Q40: 1361 | R40: =Q40/B40 -> 8.3889101197006863E-3
A41: 39 | B41: 153860 | C41: 97011 | D41: =C41/B41 -> 0.63051475367216947 | E41: 25807 | F41: =E41/B41 -> 0.16773040426361627 | G41: 988 | H41: =G41/B41 -> 6.4214220720135188E-3 | I41: 21476 | J41: =I41/B41 -> 0.13958143767060965 | K41: 252 | L41: =K41/B41 -> 1.637852593266606E-3 | M41: 7177 | N41: =M41/B41 -> 4.6646301832835045E-2 | O41: 1149 | P41: =O41/B41 -> 7.4678278954894064E-3 | Q41: 17816 | R41: =Q41/B41 -> 0.11579357857792799
A42: 40 | B42: 158487 | C42: 151963 | D42: =C42/B42 -> 0.95883574047082731 | E42: 3892 | F42: =E42/B42 -> 2.455721920409876E-2 | G42: 870 | H42: =G42/B42 -> 5.4894092259932994E-3 | I42: 611 | J42: =I42/B42 -> 3.8552057897493172E-3 | K42: 48 | L42: =K42/B42 -> 3.02863957296182E-4 | M42: 936 | N42: =M42/B42 -> 5.9058471672755498E-3 | O42: 167 | P42: =O42/B42 -> 1.0537141847596332E-3 | Q42: 1928 | R42: =Q42/B42 -> 1.2165035618063312E-2

A1: HB 5001 Conference, Senate Election Data
A2: DISTRICT | B2: Rep. Gov '09 | C2: Dem. Gov '09 | D2: Rep. Lt. Gov '09 | E2: Dem. Lt. Gov '09 | F2: Rep. Att. Gen. '09 | G2: Dem. Att. Gen. '09
A3: 1 | B3: 0.54380437016233985 | C3: 0.4561956298376601 | D3: 0.51228232037827237 | E3: 0.48771767962172757 | F3: 0.52519002595476461 | G3: 0.47480997404523545
A4: 2 | B4: 0.40310502718687397 | C4: 0.59689497281312598 | D4: 0.37869879986395216 | E4: 0.62130120013604784 | F4: 0.39367654604539792 | G4: 0.60632345395460208
A5: 3 | B5: 0.71026954506647155 | C5: 0.2897304549335285 | D5: 0.67492702412044858 | E5: 0.32507297587955142 | F5: 0.687409395145122 | G5: 0.312590604854878
A6: 4 | B6: 0.69872559699814973 | C6: 0.30127440300185021 | D6: 0.67607529230823005 | E6: 0.32392470769176995 | F6: 0.6922335541303053 | G6: 0.30776644586969476
A7: 5 | B7: 0.35982364287682556 | C7: 0.64017635712317444 | D7: 0.33346693386773546 | E7: 0.66653306613226448 | F7: 0.35572296058661779 | G7: 0.64427703941338221
A8: 6 | B8: 0.54156828976972859 | C8: 0.45843171023027141 | D8: 0.50351021800301277 | E8: 0.49648978199698718 | F8: 0.52489940355583464 | G8: 0.47510059644416541
A9: 7 | B9: 0.57262940569237575 | C9: 0.42737059430762425 | D9: 0.51747088186356072 | E9: 0.48252911813643928 | F9: 0.55593435105291744 | G9: 0.44406564894708261
A10: 8 | B10: 0.48015039489161487 | C10: 0.51984960510838518 | D10: 0.46039447315684001 | E10: 0.53960552684315999 | F10: 0.47947958536069391 | G10: 0.52052041463930609
A11: 9 | B11: 0.34415504258733487 | C11: 0.65584495741266513 | D11: 0.33494591283765546 | E11: 0.66505408716234449 | F11: 0.35381563837561331 | G11: 0.64618436162438664
A12: 10 | B12: 0.71163291394738615 | C12: 0.28836708605261385 | D12: 0.68519678374947102 | E12: 0.31480321625052898 | F12: 0.71174165974118486 | G12: 0.28825834025881514
A13: 11 | B13: 0.69051810627141419 | C13: 0.30948189372858576 | D13: 0.67088316025874806 | E13: 0.32911683974125189 | F13: 0.69279196026337064 | G13: 0.3072080397366293
A14: 12 | B14: 0.69724728198010644 | C14: 0.30275271801989362 | D14: 0.66703381942289797 | E14: 0.33296618057710209 | F14: 0.68826238486432656 | G14: 0.31173761513567338
A15: 13 | B15: 0.66097929772816366 | C15: 0.33902070227183634 | D15: 0.61247416366837637 | E15: 0.38752583633162369 | F15: 0.6421883920076118 | G15: 0.3578116079923882
A16: 14 | B16: 0.70844336990887113 | C16: 0.29155663009112887 | D16: 0.6472748613293452 | E16: 0.3527251386706548 | F16: 0.68848886783514918 | G16: 0.31151113216485077
A17: 15 | B17: 0.67171757556372946 | C17: 0.32828242443627059 | D17: 0.66799588900308327 | E17: 0.33200411099691673 | F17: 0.6759928355259095 | G17: 0.32400716447409056
A18: 16 | B18: 0.41217910784230843 | C18: 0.58782089215769151 | D18: 0.39680082559339525 | E18: 0.60319917440660475 | F18: 0.42107383322782987 | G18: 0.57892616677217013
A19: 17 | B19: 0.61195181160242307 | C19: 0.38804818839757699 | D19: 0.59097070649052263 | E19: 0.40902929350947731 | F19: 0.5937766116596469 | G19: 0.40622338834035304
A20: 18 | B20: 0.44111744943744224 | C20: 0.55888255056255776 | D20: 0.42271256931608131 | E20: 0.57728743068391863 | F20: 0.43735290690900619 | G20: 0.56264709309099381
A21: 19 | B21: 0.70066992576498277 | C21: 0.29933007423501717 | D21: 0.68311991536244576 | E21: 0.31688008463755429 | F21: 0.69840862893035693 | G21: 0.30159137106964307
A22: 20 | B22: 0.59578013417009301 | C22: 0.40421986582990693 | D22: 0.59242350006681221 | E22: 0.40757649993318784 | F22: 0.59832045683574064 | G22: 0.4016795431642593
A23: 21 | B23: 0.51701564494020891 | C23: 0.48298435505979109 | D23: 0.50512814353998026 | E23: 0.49487185646001969 | F23: 0.52035861936352279 | G23: 0.47964138063647727
A24: 22 | B24: 0.63507019692829547 | C24: 0.36492980307170453 | D24: 0.61119939283257829 | E24: 0.38880060716742165 | F24: 0.61106897369044799 | G24: 0.38893102630955201
A25: 23 | B25: 0.7371542503759525 | C25: 0.26284574962404744 | D25: 0.72254128393462735 | E25: 0.27745871606537265 | F25: 0.73733064873903698 | G25: 0.26266935126096302
A26: 24 | B26: 0.73270493182965835 | C26: 0.26729506817034171 | D26: 0.73256783386387747 | E26: 0.26743216613612247 | F26: 0.73760562043102629 | G26: 0.26239437956897371
A27: 25 | B27: 0.46391976145296826 | C27: 0.53608023854703168 | D27: 0.46138215102974828 | E27: 0.53861784897025167 | F27: 0.48075509153738694 | G27: 0.51924490846261306
A28: 26 | B28: 0.70978763894295227 | C28: 0.29021236105704773 | D28: 0.69715687562973672 | E28: 0.30284312437026328 | F28: 0.69730843415746102 | G28: 0.30269156584253903
A29: 27 | B29: 0.70206286632042214 | C29: 0.29793713367957786 | D29: 0.68247084087751064 | E29: 0.31752915912248936 | F29: 0.68292734277954392 | G29: 0.31707265722045602
A30: 28 | B30: 0.6905204872646733 | C30: 0.3094795127353267 | D30: 0.66745699778558165 | E30: 0.33254300221441835 | F30: 0.6663388027004068 | G30: 0.33366119729959315
A31: 29 | B31: 0.55013224332772304 | C31: 0.44986775667227696 | D31: 0.52411141134899186 | E31: 0.47588858865100808 | F31: 0.53220550509602715 | G31: 0.46779449490397285
A32: 30 | B32: 0.41488258980185783 | C32: 0.58511741019814212 | D32: 0.39285355614919559 | E32: 0.60714644385080441 | F32: 0.39035343872721778 | G32: 0.60964656127278216
A33: 31 | B33: 0.44406388373765282 | C33: 0.55593611626234718 | D33: 0.42381806387606363 | E33: 0.57618193612393631 | F33: 0.41816271963330787 | G33: 0.58183728036669213
A34: 32 | B34: 0.44927815882260075 | C34: 0.55072184117739931 | D34: 0.42726887940460656 | E34: 0.57273112059539344 | F34: 0.41823738274832623 | G34: 0.58176261725167377
A35: 33 | B35: 0.54726907009128889 | C35: 0.45273092990871111 | D35: 0.51965379327584049 | E35: 0.48034620672415945 | F35: 0.52178526841448192 | G35: 0.47821473158551808
A36: 34 | B36: 0.52947803229440482 | C36: 0.47052196770559518 | D36: 0.50316493490982916 | E36: 0.49683506509017078 | F36: 0.48878977340607704 | G36: 0.51121022659392301
A37: 35 | B37: 0.42412750755702117 | C37: 0.57587249244297889 | D37: 0.40310381533979495 | E37: 0.596896184660205 | F37: 0.39863737486095663 | G37: 0.60136262513904337
A38: 36 | B38: 0.48525943396226418 | C38: 0.51474056603773588 | D38: 0.45643202802600719 | E38: 0.54356797197399287 | F38: 0.46205091601237214 | G38: 0.53794908398762786
A39: 37 | B39: 0.53924367992200017 | C39: 0.46075632007799988 | D39: 0.51253124051105969 | E39: 0.48746875948894025 | F39: 0.51113916356920774 | G39: 0.48886083643079226
A40: 38 | B40: 0.65985494685946267 | C40: 0.34014505314053733 | D40: 0.6569430428762526 | E40: 0.3430569571237474 | F40: 0.64564095278685418 | G40: 0.35435904721314582
A41: 39 | B41: 0.52802765284024655 | C41: 0.47197234715975345 | D41: 0.50193867499423639 | E41: 0.49806132500576361 | F41: 0.50228722511331203 | G41: 0.49771277488668791
A42: 40 | B42: 0.75034429819610327 | C42: 0.24965570180389679 | D42: 0.75580379717740087 | E42: 0.24419620282259918 | F42: 0.7472197868118684 | G42: 0.2527802131881316